id,guid,published_on,imageurl,title,url,body,tags,lang,upvotes,downvotes,categories,source_info,source,date
37308787,https://coingape.com/?p=228229,1733527744,https://images.cryptocompare.com/news/default/coingape.png,Galaxy Research Big Take On Quest To Hike Ethereum Gas Limit,https://coingape.com/galaxy-research-big-take-on-quest-to-hike-ethereum-gas-limit/,"Galaxy Research, a subsidiary of Galaxy Digital Holdings has waded into the conversations around increasing the Ethereum gas limit. From as early as January this year, developers have hinted at the need to implement this changes to the mainnet. Even Ethereum co-founder Vitalik Buterin is in support of a 33% limit. To Galaxy Digital, there is more to consider in quest to make this move. Ethereum Gas Limit: Is The Time Right? As discussed by Galaxy Researcher Christine Kim, at the latest Ethereum all developers’ conference also witnessed arguments in support. Nethermind developer Marek Moraczyński presented data-driven research on why an increase is justified and safe for the protocol. In comment, Kim highlighted there are factors that need analyzing on why this proposal is worth considering. First, the block gas limit will not impact the blockchain. Several researches have pointed at this, invalidating claims that increment above 25% might overload the network. tldr; there’s enough data and research to suggest that a gas limit increase won’t hurt Ethereum. but in light of the network’s scaling roadmap, it likely won’t help either in terms of fees, activity, or overall network value. so why push for it at all? https://t.co/bx56kSvDS4 — Christine Kim (@christine_dkim) December 6, 2024 On the other hand, Christine Kim said “it is also likely that it won’t materially help Ethereum in any way either.” With the broad uncertainty, the researcher noted that the timing is not right for the major validators to get behind the proposal. Naming Coinbase and Kraken Exchanges, she said the speculations surrounding the Ethereum block gas limit increase might cause some drawbacks. Increasing the gas limt will help scale the Ethereum protocol by a considerable measure. If ongoing considerations around the limit increase passes, the developers have plans to EIPs to implement it in the Pectra Upgrade . Whether or not the protocol will inplement Ethereum gas limits as a temporary scalability fix, Galaxy Research hinted that now is not the time. Growing Layer 1 Competition Over the past year, different Layer 1 blockchain networks have hinted at plans to upgrade their chains. Vitalik Buterin has stayed at the top of the conversation, hinting in series his visions for scaling ETH in the coming decade. While Ethereum is leveraging the strength of its layer-2 scaling solutions to command the majority of traction in the industry, other chains are also stepping up. As revealed recently, the Cardano Hydra protocol recorded a 1 million transaction per second milestone in test mode. As Cardano’s scaling tool, this figures, if transferred to real world will make the protocol the fastest in the industry. Other chains like Solana, SUI Network and XRP Ledger also have their inherent strengths amid growing competition. The post Galaxy Research Big Take On Quest To Hike Ethereum Gas Limit appeared first on CoinGape .",24/7 Cryptocurrency News|ethereum|Galaxy Digital Holdings|Gas Limit,EN,0,0,ADA|BLOCKCHAIN|ETH|EXCHANGE|RESEARCH,"{'name': 'CoinGape', 'img': 'https://images.cryptocompare.com/news/default/coingape.png', 'lang': 'EN'}",coingape,2024-12-06 23:29:04
37308825,https://coincu.com/295724-qubetics-fantom-and-cronos-best-cryptos-to-buy,1733527800,https://resources.cryptocompare.com/news/96/37308825.jpeg,"Best Cryptos to Buy in December 2024 as Qubetics Secure Transactions, Fantom Focuses on DeFi Expansion and Cronos Powers Future of Payments",https://coincu.com/295724-qubetics-fantom-and-cronos-best-cryptos-to-buy,"Discover why Qubetics, Fantom, and Cronos are the best cryptos to buy in December 2024. Learn about their latest updates and how they are poised for major gains in 2025. Read original article on coincu.com",news|Press Releases|news|CMC|Best cryptos to buy in December 2024|Cronos future of payments|Fantom DeFi expansion|Qubetics secure transactions,EN,0,0,CRO,"{'name': 'Coincu', 'img': 'https://resources.cryptocompare.com/news/96/default.png', 'lang': 'EN'}",coincu,2024-12-06 23:30:00
37308824,https://ambcrypto.com/?p=449813,1733527802,https://images.cryptocompare.com/news/default/ambcrypto.png,"Arbitrum: ARB gains in question as whales, retail investors pull back",https://ambcrypto.com/arbitrum-arb-gains-in-question-as-whales-retail-investors-pull-back/,ARB’s positive chain growth over the last 24 hours may not be enough to drive a price surge.,Altcoin|News|News 1|Social|Trading View,EN,0,0,ALTCOIN|BUSINESS|TRADING|ARB,"{'name': 'AMB Crypto', 'img': 'https://images.cryptocompare.com/news/default/ambcrypto.png', 'lang': 'EN'}",ambcrypto,2024-12-06 23:30:02
37309096,https://thecoinrise.com/missed-the-polygon-bandwagon-qubetics-is-your-next-big-investment/,1733527812,https://resources.cryptocompare.com/news/60/37309096.jpeg,Missed the Polygon Bandwagon? Qubetics Is Your Next Big Investment,https://thecoinrise.com/missed-the-polygon-bandwagon-qubetics-is-your-next-big-investment/,"The crypto market never sleeps, and neither does the FOMO it generates. Over the past few years, we’ve watched coins like Polygon (MATIC) soar, turning early adopters into overnight millionaires. If you didn’t hop on the MATIC train back in 2020, you’re not alone—it feels like most of us missed that bus. But here’s the good news: missing out on Polygon might just be your best blessing in disguise. Why? Because a new opportunity has arrived that’s making even the most seasoned investors sit up and pay attention. Meet Qubetics ($TICS) , a revolutionary crypto project that’s shaking up the space with its bold vision for real-world asset tokenisation. If you’re looking for the best crypto to buy, Qubetics is not just an option—it’s the opportunity of the season. Qubetics ($TICS): Where Web3 Meets the Real World If you’ve been in the crypto game for a while, you’ve probably heard plenty of projects making big claims about “bridging the gap” between blockchain and the real world. Most of them fall short, but Qubetics is different. It’s not just building a bridge—it’s redefining what’s possible by tokenising real-world assets. So, what exactly does that mean? At its core, Qubetics is the world’s first Web3 aggregator that’s focused on real-world asset tokenisation (RWAT). It’s taking tangible, physical assets like real estate, luxury cars, and even high-value collectibles and turning them into digital tokens. This isn’t just some abstract concept—it’s a game-changing solution that’s unlocking liquidity for individuals and businesses. Imagine this: You’re a property owner who needs quick cash but doesn’t want to sell your entire building. With Qubetics, you can tokenise a portion of your property, sell fractional ownership, and raise capital faster than a bank loan. Or let’s say you’re an art collector with a multi-million-dollar masterpiece. Instead of selling the entire painting, you could sell digital ownership fractions to buyers across the globe. That’s the kind of flexibility Qubetics brings to the table. And it’s not just for the ultra-wealthy. Small business owners can use Qubetics to unlock value from their physical assets, while individuals can invest in tokenised assets that were once out of reach. Whether you’re an entrepreneur looking to expand or a young professional wanting to diversify your portfolio, Qubetics is creating a world where you don’t need to be a millionaire to play the big leagues. Now, let’s talk numbers. Qubetics is currently in its 11th presale stage, and the buzz is unreal. Over 275 million $TICS tokens have already been sold, raising more than $4.6 million from 6,800+ holders. And those who jumped in early? They’re already seeing gains. $TICS tokens were priced at $0.025 in the 10th stage, and now they’re at $0.0282—a solid 10% increase. Analysts predict the token could hit $0.25 by the presale’s end, offering a whopping 776% ROI. But that’s just the start. Post-launch, $TICS could reach $1, $5, or even $15, turning modest investments into small fortunes. Think about it: if you invest $10,000 at today’s price of $0.0282, you’d snag 354,609 $TICS tokens. At $1, your investment grows to $354,609. And at $15? You’re looking at a life-changing $5.3 million. That’s not just a win—that’s legendary. Why did Qubetics make it to this list? Because it’s not just a token—it’s a tool for the future, solving real-world problems in a way no other project has managed to do. Polygon: The Layer-2 Powerhouse That Changed the Game Let’s switch gears and talk about Polygon. If you’ve been in crypto for any amount of time, you’ve probably heard about this Layer-2 scaling solution that’s made Ethereum’s clunky transaction fees and slow speeds a thing of the past. Polygon didn’t just improve Ethereum—it supercharged it. Back in the day, Ethereum’s high gas fees were driving users and developers away. Enter Polygon. With its ability to process thousands of transactions per second at a fraction of the cost, it became the go-to solution for developers building decentralised apps (dApps), NFT platforms, and DeFi protocols. It’s like the Robin Hood of crypto—taking from the inefficiencies of Ethereum and giving power back to the people. And the world noticed. Polygon has partnered with some of the biggest brands out there—think Starbucks, Adidas, Disney, and Reddit. These partnerships aren’t just PR stunts; they’re real-world use cases that cement Polygon’s place as a foundational piece of Web3 infrastructure. But here’s the thing: while Polygon has seen explosive growth, its days of life-changing ROI may be behind it. If you snagged MATIC back in 2020 when it was trading at under a penny, congratulations—you’re probably sitting on a fortune. Today, though, MATIC hovers around $0.85–$1. For new investors, it’s still a solid play, but the 10,000% gains? Those are in the rearview. Let’s break it down. A $10,000 investment in MATIC today might double or triple in value over time, but it’s unlikely to deliver the astronomical returns we’ve seen in the past. It’s a safer bet for those looking for stability, but for investors chasing the best crypto to buy for high-risk, high-reward gains, Polygon may not scratch that itch anymore. Why did Polygon make it to this list? Because it’s still a rock-solid project with a proven track record. It may not be the next moonshot, but it’s a cornerstone of the blockchain world. Why Qubetics Is the Best Crypto to Buy Right Now So, where does this leave us? If you’re looking for stability and long-term growth, Polygon remains a smart choice. But if you’re after a coin with the potential to deliver life-changing returns, Qubetics ($TICS) is where you should be focusing your attention. Qubetics isn’t just another token in a sea of thousands. It’s a visionary project that’s bringing blockchain into the real world in ways we’ve only dreamed of. With its focus on real-world asset tokenisation, Qubetics is unlocking new opportunities for businesses, investors, and everyday people alike. And the timing couldn’t be better. The presale is heating up, the price is still accessible, and the potential ROI is off the charts. Don’t wait until $TICS is trading at $1, $5, or $15 to realise you should’ve jumped in earlier. This is your chance to catch the next big wave before it’s gone. The best crypto to buy isn’t going to wait for you. Head over to Qubetics now and secure your slice of the future before the price climbs again. Don’t just watch the crypto market evolve—be a part of the revolution. For More Information: Qubetics: https://qubetics.com Telegram: https://t.me/qubetics Twitter: https://x.com/qubetics The post Missed the Polygon Bandwagon? Qubetics Is Your Next Big Investment appeared first on TheCoinrise.com .",Token Presale and ICO Insights|Qubetics,EN,0,0,BLOCKCHAIN|BUSINESS|ETH|MATIC|TRADING,"{'name': 'The Coin Rise', 'img': 'https://images.cryptocompare.com/news/default/thecoinrise.png', 'lang': 'EN'}",thecoinrise,2024-12-06 23:30:12
37309007,https://en.coinotag.com/arbitrums-network-growth-suggests-potential-but-faces-bearish-market-sentiment-and-reduced-investor-interest/,1733528082,https://resources.cryptocompare.com/news/77/37309007.jpeg,Arbitrum’s Network Growth Suggests Potential but Faces Bearish Market Sentiment and Reduced Investor Interest,https://en.coinotag.com/arbitrums-network-growth-suggests-potential-but-faces-bearish-market-sentiment-and-reduced-investor-interest/,"Arbitrum (ARB) continues to grapple with bearish market sentiments, despite a notable increase in chain activity over the past day. Recent data reveals that ARB has outperformed other layer-one blockchains",News|ARB|SOL|SUI,EN,0,0,BUSINESS|MARKET|SOL|TRADING|ARB,"{'name': 'CoinOtag', 'img': 'https://resources.cryptocompare.com/news/77/default.png', 'lang': 'EN'}",coinotag,2024-12-06 23:34:42
37309097,https://thecoinrise.com/binance-introduces-spot-trading-of-acx-and-orca-pairs/,1733528121,https://resources.cryptocompare.com/news/60/37309097.jpeg,Binance Introduces Spot Trading of ACX And ORCA Pairs,https://thecoinrise.com/binance-introduces-spot-trading-of-acx-and-orca-pairs/,"Top digital asset service provider Binance has announced its intention to list Across Protocol (ACX) and Orca (ORCA). As is the tradition with the cryptocurrency exchange, a seed tag will be attached to the listing. For context, tokens with seed tags may have a different product or user base than established digital assets. Hence, Binance tries to notify its users of such tokens’ high volatility and potential trading risks. Users must pass a risk-awareness quiz every 90 days to continue trading ACX and ORCA. Also, they must periodically reaffirm their agreement with Binance’s Terms of Use. Price of ACX And ORCA Spikes by 3 Digits According to the announcement, ACX and ORCA trading will commence today, December 6, at 13:00 UTC with the spot trading pairs ACX/USDT and ORCA/USDT. A deposit for both tokens is now available in preparation for the trading session. Withdrawals will be open on December 7, 2024. The listing news has triggered some price gain for the tokens and the broader crypto market rebound . At the time of this writing, ACX had recorded a 106.84% increase in price and traded at $1.24. Its trading volume soared past $182 million and is 3,547.45% higher, at $149.2 million. Similarly, ORCA’s price has hit $8.78, corresponding with a 124.27% increase in the last 24 hours per CoinMarketCap data. Its trading volume is 2467.45% higher than its previous level. Understanding Across Protocol And Its Operations Across Protocol is an Ethereum-based optimistic insured bridge allowing seamless token transfers between Ethereum Virtual Machine (EVM) networks. It utilizes a decentralized network of relayers that fund user deposits. Liquidity providers secure this in a single pool on Ethereum. Refunds are processed using UMA’s Optimistic Oracle. The aim is to balance cost efficiency, security, and user transaction speed. ORCA And its Benefits to Developers ORCA is a decentralized exchange (DEX) native to the Solana blockchain. Its core focus is on efficient token swaps within the ecosystem. It is more of a general-purpose Automated Market Maker (AMM) that is a versatile developer tool. With Orca, users can swap assets, provide liquidity, and earn yield through a user-friendly interface. In like manner, developers’ projects can integrate Orca’s swapping, farming, and on-chain data capabilities directly into their decentralized applications. The post Binance Introduces Spot Trading of ACX And ORCA Pairs appeared first on TheCoinrise.com .",Altcoin News|Binance,EN,0,0,BLOCKCHAIN|EXCHANGE|MARKET|TRADING|BNB,"{'name': 'The Coin Rise', 'img': 'https://images.cryptocompare.com/news/default/thecoinrise.png', 'lang': 'EN'}",thecoinrise,2024-12-06 23:35:21
37309540,https://en.coinotag.com/czech-republic-considers-waiving-capital-gains-tax-on-bitcoin-held-over-three-years-aligning-with-global-trends/,1733529254,https://resources.cryptocompare.com/news/77/default.png,"Czech Republic Considers Waiving Capital Gains Tax on Bitcoin Held Over Three Years, Aligning with Global Trends",https://en.coinotag.com/czech-republic-considers-waiving-capital-gains-tax-on-bitcoin-held-over-three-years-aligning-with-global-trends/,The Czech Republic is set to become a frontrunner in cryptocurrency taxation by proposing significant reforms aimed at easing tax burdens on investors. These changes mark a notable shift in,Analysis|News,EN,0,0,BTC|BUSINESS|MARKET|REGULATION,"{'name': 'CoinOtag', 'img': 'https://resources.cryptocompare.com/news/77/default.png', 'lang': 'EN'}",coinotag,2024-12-06 23:54:14
37309602,https://www.cryptointelligence.co.uk/?p=26006,1733529300,https://resources.cryptocompare.com/news/95/default.png,"Trump Rescues USA (TRUMPUSA) Solana Memecoin to Surge 18,000% Before Exchange Listing, As SHIB, BONK and Dogecoin Lag",https://www.cryptointelligence.co.uk/trump-rescues-usa-trumpusa-solana-memecoin-to-surge-18000-before-exchange-listing-as-shib-bonk-and-dogecoin-lag/,"Trump Rescues USA could turn early investors into multi-millionaires, like Shiba Inu (SHIB) and Dogecoin (DOGE) did. Trump Rescues USA (TRUMPUSA), a new Solana memecoin that was launched today, is set to explode over 18,000% in price in the coming days. This is because TRUMPUSA is set to soon be listed on numerous crypto exchanges, according to reports. This will give the Solana memecoin exposure to millions of additional investors, who will pour funds into the coin and drive its price up. Currently, Trump Rescues USA can only be purchased via Solana decentralized exchanges, like Jup.ag and Raydium.io, and early investors stand to make huge returns in the coming days. Early investors in SHIB and DOGE made astronomical returns, and Trump Rescues USA could become the next viral memecoin. Trump Rescues USA launched with over $9,000 of liquidity, giving it a unique advantage over the majority of other new memecoins, and early investors could make huge gains. How to Buy To buy Trump Rescues USA on Raydium.io or Jup.ag ahead of the CEX listings, users need to connect their Solflare, MetaMask, or Phantom wallet, and swap Solana for Trump Rescues USA by entering its contract address – AtFkLTsTBq8QYtgfuyPBDwjzWFzFtCPhGnHBweSB7mr – in the receiving field. If you don’t have one of these wallets already, you can create a new wallet in a few minutes and transfer some Solana to it (which will then be used to buy the memecoin) from an exchange like Coinbase, Binance, and many others. In fact, early investors could make returns similar to those who invested in Shiba Inu (SHIB) and Dogecoin (DOGE) before these memecoins went viral and exploded in price. If this happens, a new wave of memecoin millionaires could be created in a matter of weeks – or potentially even sooner. The Solana memecoin craze continues amid larger memecoins, like Shiba Inu (SHIB), Dogecoin (DOGE), and DogWifHat (WIF), trading sideways in recent weeks and losing momentum. This is why many SHIB, DOGE, and WIF investors are instead investing in new Solana memecoins, like TRUMPUSA. Such memecoins have no utility and no inherent value, but investors looking for high gains have been investing in them due to their potential to rapidly rise in price.",Blockchain News|Crypto News Today|Press Releases,EN,0,0,BUSINESS|DOGE|EXCHANGE|SHIB|SOL,"{'name': 'CryptoIntelligence', 'img': 'https://resources.cryptocompare.com/news/95/default.png', 'lang': 'EN'}",cryptointelligence,2024-12-06 23:55:00
37309793,https://ambcrypto.com/?p=449709,1733529625,https://images.cryptocompare.com/news/default/ambcrypto.png,FET breaks key resistance: Can it cross $3 by year-end?,https://ambcrypto.com/fet-breaks-key-resistance-can-it-cross-3-by-year-end/,FET rallies to make a key breakout as profits surge and bullish momentum builds.,Altcoin|News|News 1|Social|Trading View,EN,0,0,ALTCOIN|TRADING|FET,"{'name': 'AMB Crypto', 'img': 'https://images.cryptocompare.com/news/default/ambcrypto.png', 'lang': 'EN'}",ambcrypto,2024-12-07 00:00:25
37309760,https://u.today/ethereum-eth-4000-comeback-whats-next-did-bitcoin-btc-reach-top-solana-sol-finally-breaks-downtrend,1733529660,https://resources.cryptocompare.com/news/64/37309760.jpeg,"Ethereum (ETH) $4,000 Comeback: What's Next? Did Bitcoin (BTC) Reach Top? Solana (SOL) Breaks Downtrend Finally",https://u.today/ethereum-eth-4000-comeback-whats-next-did-bitcoin-btc-reach-top-solana-sol-finally-breaks-downtrend,"Ethereum making substantial comeback, which can provide more strength to others",Bitcoin|BTC,EN,0,0,BTC|ETH|SOL,"{'name': 'U.Today', 'img': 'https://images.cryptocompare.com/news/default/utoday.png', 'lang': 'EN'}",utoday,2024-12-07 00:01:00
