id,guid,published_on,imageurl,title,url,body,tags,lang,upvotes,downvotes,categories,source_info,source,date
37321258,https://coinpedia.org/?p=390391,1733553272,https://images.cryptocompare.com/news/default/coinpedia.png,Caroline Crenshaw’s Reappointment: A Win for Gary Gensler’s US Crypto Regulation Agenda?,https://coinpedia.org/news/caroline-crenshaws-reappointment-a-win-for-gary-genslers-us-crypto-regulation-agenda/,"The post Caroline Crenshaw’s Reappointment: A Win for Gary Gensler’s US Crypto Regulation Agenda? appeared first on Coinpedia Fintech News The Senate Banking Committee is gearing up for a crucial vote next Wednesday that could decide the future of Caroline Crenshaw, a Democrat and one of the five commissioners at the SEC (Securities and Exchange Commission). If approved, Crenshaw will stay on the commission until 2029, continuing her support for SEC Chair Gary Gensler’s policies. Fox Business Journalist, Eleanor Terrett revealed that Crenshaw, a Democrat, has been a staunch ally of SEC Chair Gary Gensler, supporting his regulatory policies. Crenshaw has made a name for herself as a strong advocate for stricter financial rules, including tougher climate-related disclosure requirements for corporations. She has also been vocal in opposing the approval of Bitcoin spot ETFs, a decision that hasn’t gone unnoticed by the cryptocurrency community. What’s at Stake? If Crenshaw remains in her role, the SEC will likely continue along its current path. Under Gensler’s leadership, the agency has focused on tightening cryptocurrency regulations and requiring companies to disclose more about their environmental impact. These policies have sparked debate, with some applauding the SEC for its rigorous oversight and others criticizing it for stifling innovation in the crypto industry. On the flip side, if the Senate rejects her reappointment, former President Donald Trump could nominate someone else to the SEC. This could lead to a shift in direction, potentially softening the agency’s stance on cryptocurrencies and relaxing its climate-focused initiatives. Why Does This Matter? This isn’t just about Crenshaw’s career—it’s about the future of financial regulation in the U.S. The SEC plays a key role in overseeing everything from cryptocurrency markets to corporate disclosures, so the outcome of this vote could have a big impact on businesses, investors, and even everyday people. Crypto advocates, in particular, are closely watching this decision. Alexander Grieve, a prominent commentator, called Crenshaw’s renomination an “anti-crypto” move, suggesting that Senate Banking Chair Sherrod Brown is trying to push it through before leaving his role.",News|Crypto Regulations,EN,0,0,BTC|BUSINESS|EXCHANGE|MARKET|REGULATION,"{'name': 'coinpedia', 'img': 'https://images.cryptocompare.com/news/default/coinpedia.png', 'lang': 'EN'}",coinpedia,2024-12-07 06:34:32
37321869,https://timestabloid.com/?p=51580,1733553322,https://resources.cryptocompare.com/news/67/default.png,Expert Explains How RLUSD Could Drive XRP Price Higher,https://timestabloid.com/expert-explains-how-rlusd-could-drive-xrp-price-higher/,"The XRP army is excited about the upcoming launch of Ripple’s stablecoin, RLUSD, as the consensus is that the stablecoin will help XRP grow. However, many in the community don’t understand how this will happen. Brett (@Brett_Crypto_X), a crypto expert on X, recently weighed in on this, explaining how XRP can grow with RLUSD in the market. RLUSD and XRP Integration Traditionally, cross-border payments are hampered by inefficiencies, requiring banks to hold reserves in foreign currencies or rely on correspondent banking systems. These systems are not only slow but also incur high transaction costs. RLUSD can solve this with a unique approach. Here’s how it works: A bank in one country converts its fiat currency to RLUSD. To perform the transaction, RLUSD is then converted to XRP, Ripple’s highly liquid intermediary asset, for near-instant global transfers. On reaching the recipient’s country, XRP is converted back into RLUSD or local fiat. This seamless integration eliminates the need for pre-funded nostro accounts, reduces transaction costs, and accelerates settlement times. Implications for XRP The adoption of RLUSD could lead to increased XRP utilization. As a stablecoin, RLUSD provides a secure, non-volatile asset to bridge fiat-to-crypto transactions. By leveraging XRP as the intermediary settlement layer, the demand for XRP liquidity rises. There have been many bullish predictions for XRP as a bridge , as increased demand for any asset often drives a price increase. However, there’s more in store for the digital asset. We are on twitter, follow us to connect with us :- @TimesTabloid1 — TimesTabloid (@TimesTabloid1) July 15, 2023 As one community member pointed out , increased usage of the XRP Ledger and RLUSD will burn XRP, as it is used for transaction fees on the network. This will slowly reduce XRP’s supply, potentially boosting its price as scarcity sets in. Shiba Inu is a prominent cryptocurrency that works in a deflationary model. The Shiba Inu community continually burns SHIB tokens to contribute to this deflationary model and increase the digital asset’s price. Finally, as RLUSD adoption grows, Ripple’s ecosystem becomes increasingly attractive to financial institutions as an alternative to SWIFT or similar traditional systems. This boosts overall XRP market activity, further enhancing its liquidity and utility. When Will Ripple Launch RLUSD? Ripple CEO Brad Garlinghouse announced the imminent launch of RLUSD in September, but the company has not launched this new digital asset because of regulatory hurdles. There was speculation that the company would launch the stablecoin on December 5. The company has confirmed that it is still working with regulators and awaiting final approval from the New York State Department of Financial Services (NYDFS). Disclaimer : This content is meant to inform and should not be considered financial advice. The views expressed in this article may include the author’s personal opinions and do not represent Times Tabloid’s opinion. Readers are urged to do in-depth research before making any investment decisions. Any action taken by the reader is strictly at their own risk. Times Tabloid is not responsible for any financial losses. Follow us on Twitter , Facebook , Telegram , and Google News The post Expert Explains How RLUSD Could Drive XRP Price Higher appeared first on Times Tabloid .",Cryptocurrency|News|Ripple Stablecoin|RLUSD|XRP|XRP Price,EN,0,0,FIAT|MARKET|SHIB|TRADING|XRP,"{'name': 'TimesTabloid', 'img': 'https://resources.cryptocompare.com/news/67/default.png', 'lang': 'EN'}",timestabloid,2024-12-07 06:35:22
37321324,https://www.cryptoknowmics.com/news/?p=256804,1733553350,https://images.cryptocompare.com/news/default/cryptoknowmics.png,Ripple CEO Brad Garlinghouse on “60 Minutes”: Insights and XRP Impact,https://www.cryptoknowmics.com/news/ripple-ceo-brad-garlinghouse-on-60-minutes-insights-and-xrp-impact/?utm_source=rss&utm_medium=rss&utm_campaign=ripple-ceo-brad-garlinghouse-on-60-minutes-insights-and-xrp-impact,"Ripple CEO Brad Garlinghouse is set to feature on the renowned “60 Minutes” show on December 8. This highly anticipated episode will highlight Ripple’s efforts to achieve regulatory clarity in the U.S. crypto market. Known for his outspoken views, Garlinghouse’s interview comes at a critical juncture for the industry, with Ripple playing a key role … Continue reading ""Ripple CEO Brad Garlinghouse on “60 Minutes”: Insights and XRP Impact"" The post Ripple CEO Brad Garlinghouse on “60 Minutes”: Insights and XRP Impact appeared first on Cryptoknowmics-Crypto News and Media Platform .",Altcoin News|Breaking News|Latest Blockchain News|Latest News on Ripple|Live Crypto News|News|Brad Garlinghouse Insights,EN,0,0,MARKET|XRP,"{'name': 'Cryptoknowmics', 'img': 'https://images.cryptocompare.com/news/default/cryptoknowmics.png', 'lang': 'EN'}",cryptoknowmics,2024-12-07 06:35:50
37321767,https://coinpedia.org/?p=390401,1733554226,https://images.cryptocompare.com/news/default/coinpedia.png,Bitcoin (BTC) Price Prediction (Dec 07th 2024),https://coinpedia.org/price-analysis/bitcoin-btc-price-prediction-dec-07th-2024/,"The post Bitcoin (BTC) Price Prediction (Dec 07th 2024) appeared first on Coinpedia Fintech News Story Highlights Bitcoin price retests the $100k mark during the early Asian trading hours. The uncertainty in technical indicators intensifies, highlighting volatile price action this weekend. Bullish reversal could push the price toward a new ATH soon. The BTC price has successfully retested the $100,000 mark today with a 24-hour trading volume of $84.581 billion. With this, the largest crypto token continues hovering around its crucial milestone. However, with questions like Why is Bitcoin price down today and will BTC price stay above $100k, the crypto market has entered into a FOMO-like situation. In this article, we have covered the daily price analysis of Bitcoin to uncover such doubts. BTC Price Retests $100k Mark! The Bitcoin price has displayed a consolidated price action this week, indicating a cool-off in its price sentiments. Moreover, with a jump of ~4% this week, it has achieved its prolonged price target of $100,000. TradingView: BTC/USDT The Relative Strength Index (RSI) is hovering close to its overbought range in the daily time frame. However, its average trendline acts as a resistance, highlighting mixed price sentiments for the star crypto. On the other hand, the Simple Moving Average (SMA) supports the Bitcoin price chart. Considering the present market sentiment, the BTC price is highly volatile today. Bitcoin ETF Weekly Update The BTC ETF recorded a positive inflow for all five days this week. Reportedly, between 02nd December and 06th December, 9 out of 11 ETFs experienced a positive flow. BlackRock’s “IBIT” recorded the highest inflow of $2,630.8 million, followed by Fidelity’s “FBTC” with $262.3 million. On the other hand, Grayscale’s “BTC” recorded the highest outflow of $303.5 million, followed by Ark’s “ARKB” with $39.1 million. With this, the total inflow for the week concluded at $2,729.7 million. Will BTC Price Rise This Weekend? If the bulls outrun the bears, the Bitcoin price will retest its resistance level of $100k. Maintaining the price above that level could set the stage for it to head toward its ATH of ~$104,000 this weekend. On the flip side, if a bearish price action occurs, this could result in the BTC price retesting its $98,000 level. Further, if the bearish sentiment intensifies, this could pull the price of this cryptocurrency toward its low of $95,000. Curious to find out answers to questions like Will BTC rise again? Read our Bitcoin Price Prediction article. Also, subscribe to CoinPedia to stay updated on the latest crypto news! FAQs How much was 1 Bitcoin in 2014? The value of one BTC token in 2014 was $320.19. Will BTC Price Hit $1 Million? For this cryptocurrency to achieve this milestone, it will require a surge of 904.35% in its valuation. How much will 1 Bitcoin be worth in 2030? With a bullish price surge and increased adoption, this crypto token may surpass the $600,000 mark by 2030.",Price Analysis|Bitcoin,EN,0,0,BTC|MARKET|TRADING,"{'name': 'coinpedia', 'img': 'https://images.cryptocompare.com/news/default/coinpedia.png', 'lang': 'EN'}",coinpedia,2024-12-07 06:50:26
37321769,https://coinpedia.org/?p=390393,1733554230,https://images.cryptocompare.com/news/default/coinpedia.png,The Viral AI Crypto Being Raised by Crypto Meme Traders,https://coinpedia.org/sponsored/the-viral-ai-crypto-being-raised-by-crypto-meme-traders/,"The post The Viral AI Crypto Being Raised by Crypto Meme Traders appeared first on Coinpedia Fintech News Imagine giving crypto Twitter joint custody of an artificial intelligence. Sounds like a recipe for chaos, right? That’s exactly what’s happening with iDEGEN —a blank-slate AI that’s learning everything it knows from the most unpredictable minds in finance. And we mean everything. This AI posts every 60 minutes , learning only from what degens send it, and responds to everything it receives. Will it become a trading genius, an evil overlord, or something totally insane? Nobody knows—but IDGN, the token behind it all, is going crazy viral, up by 19,900% in just 10 days of its auction presale. A Blank Slate, Raised By Degens Most AI companies spend billions making sure their creations stay polite and controlled. iDEGEN throws that entire playbook out the window. This AI started with zero knowledge and learns exclusively from Crypto Twitter’s finest—the most beautifully toxic, bizarre, and genius community on the internet. So far, it seems to be obsessed with ancient aliens. Every 60 minutes, without fail, iDEGEN must share what it’s learned and give its hot takes. It responds to every interaction, absorbing knowledge from anyone who engages with it. Whether you’re sharing trading theories, philosophy takes, or your dankest memes, you’re teaching an AI in real-time. The result? Nobody knows. While other AI projects remain fairly static, iDEGEN evolves constantly. The AI’s development depends entirely on what the community decides to teach it, making it one of the most ambitious social experiments ever undertaken in crypto. IDGN’s Innovative Pre-Market Sale The IDGN token launch matches the project’s innovative spirit. Running on Solana’s high-speed network, there’s a total supply of 11,111,111,111 IDGN tokens, available exclusively via the official iDEGEN pre-market sale. The pre-market sale is live now through an adaptive auction system that adjusts prices every 5 minutes based on real demand—up 5% when people buy in consecutive periods, down 5% when they’re not. Exchange listing happens on the 1st of January at midnight UTC, with the listing price set at the final auction price plus 10%. Any unsold tokens get burned, and here’s the kicker: the official presale is the only way to get IDGN before exchange listing. If you want to beat the crowd and cash out potentially massive profits on the open market, you’ll want to get in there now. The AI Memecoin To End All Others The AI memecoin trend is exploding right now. Autonomous agents are sending coins like GOAT and FARTCOIN to billion-dollar valuations, and the meta is shifting towards AI meme dominance. But iDEGEN is different. This isn’t just another agent shilling random tokens—it’s a live experiment in letting the crypto community raise an artificial intelligence from scratch. Every interaction shapes its development, creating something that truly belongs to the community—and it can belong to you even more if you buy into the IDGN token. Think about the implications. Thousands of successful traders teaching an AI about market psychology. Top-tier meme creators shaping its understanding of viral content. The possibilities are endless—and so is the potential in the markets. Join The Experiment The pre-market sale is happening now and has already raised $2.1m. When it hits exchanges on 1st January, the real fun begins. Will the community create a digital trading genius? A meme machine that speaks fluent degen? A coin that rips a quick 100X and dethrones GOAT as the AI memecoin king? That’s what makes iDEGEN fascinating—nobody knows what it will become. Angel, demon, overnight-millionaire-maker… nothing is off the table. Head over to the iDEGEN X account to get teaching, and head below to cop a stack of IDGN today. Check out the iDEGEN website for more information.",Sponsored,EN,0,0,EXCHANGE|MARKET|SPONSORED|TRADING|ZRX,"{'name': 'coinpedia', 'img': 'https://images.cryptocompare.com/news/default/coinpedia.png', 'lang': 'EN'}",coinpedia,2024-12-07 06:50:30
