id,guid,published_on,imageurl,title,url,body,tags,lang,upvotes,downvotes,categories,source_info,source,date
37316468,https://thecoinrise.com/lost-out-on-ponke-btfd-coins-presale-brings-high-roi-to-the-table/,1733541339,https://resources.cryptocompare.com/news/60/37316468.jpeg,Lost Out on Ponke? BTFD Coin’s Presale Brings High ROI to the Table,https://thecoinrise.com/lost-out-on-ponke-btfd-coins-presale-brings-high-roi-to-the-table/,"Over the years, meme coins have taken the crypto world by storm, offering a mix of laughter, community hype, and jaw-dropping returns. From Dogecoin’s rocket ride to Shiba Inu’s mind-blowing ascent, the meme coin movement has proven one thing: when the internet’s attention converges, magic happens. These coins aren’t just funny—they’re life-changing for the early birds. And now? It looks like another player is about to steal the spotlight. Enter BTFD Coin (BTFD), a fresh contender in the meme coin arena. This isn’t your regular pump-and-dump coin ; BTFD blends fun with utility through its Play-to-Earn (P2E) game, staking features, and a solid community dubbed the Bulls Squad. Analysts are already buzzing, and if history’s taught us anything, it’s this: early adopters often laugh all the way to the bank. But what about Ponke? This crypto has carved out its niche with its loyal fanbase and innovative features. With BTFD making waves and ponke holding steady, let’s dive into these two contenders to see who comes out on top in the race to become the best crypto to watch in 2024. BTFD Coin (BTFD): A Meme Coin With Game-Changing Potential BTFD Coin isn’t just here to make you chuckle; it’s here to make you rich—or so the buzz says. This coin’s presale launched at a ridiculously low price of $0.000004 per coin on November 26, 2024. When the presale ends, the listing price will jump to $0.000064. That’s a whopping 15,000% ROI for those who get in early. And, spoiler alert: the excitement isn’t unwarranted. First up, let’s talk about the P2E game. Gamers can earn BTFD tokens while having a blast—yes, you can literally get paid to play. This feature alone taps into two booming markets: crypto and gaming. Then there’s the staking. With a generous Annual Percentage Yield (APY) that’s raising eyebrows (and heart rates), holders can earn passive income by simply locking up their coins. Add the Bulls Squad, a community-driven initiative that rewards engagement and loyalty, and you’ve got a recipe for a viral hit. Here’s a juicy example: Let’s say you invest $10,000 during the presale. When BTFD hits $0.0006, your stash could balloon to $1.1 million. Sound too good to be true? Maybe—but meme coins have pulled off crazier stunts. Analysts are projecting BTFD could outperform the usual suspects thanks to its multi-pronged approach. The FOMO is real—but don’t wait too long. Presales like these have a way of ending before you can blink, leaving latecomers gnashing their teeth. If you’ve ever felt the sting of missing out on a crypto moonshot, consider this your second chance. Ponke: The Old Guard of Meme Coins Now, let’s shift gears to ponke. While it’s not the shiny new kid on the block, ponke has earned its stripes. Known for its quirky branding and steadfast community, ponke has carved out its place in the crypto ecosystem. Unlike many meme coins, ponke isn’t just about the memes; it has actual utility. One of ponke’s standout features is its decentralized exchange (DEX), allowing users to swap tokens with ease. This has given ponke a utility edge, even as newer coins enter the fray. Its loyal community keeps the project alive, and let’s be honest—in crypto, community is king. But here’s the kicker: ponke’s growth has been more steady than explosive. While this makes it a safer bet, it doesn’t exactly scream “meme coin mania.” Analysts predict ponke will continue to hold its value, but the potential for a 15,000% ROI? That’s less likely. Sure, there’s room for growth, especially if it announces a groundbreaking update or partnership. But compared to BTFD, ponke feels like the safer, albeit less thrilling, option. If you’re a fan of slow and steady, ponke’s got your back. But if you’re looking for adrenaline-pumping gains, you might want to give BTFD a closer look. After all, the crypto market loves a good underdog story. Conclusion: Make the Most of This Wealth-Generation Opportunity So, here’s the deal: BTFD Coin is shaping up to be a serious contender for the best crypto to invest in this year. With its P2E game, high-yield staking, and an engaged community, it’s ticking all the right boxes. And let’s not forget that jaw-dropping 15,000% ROI promise. If you’ve ever wondered what it feels like to get in on the ground floor of a crypto sensation, this might just be your shot. ponke, on the other hand, remains a solid pick for those who value stability over moonshots. Its features and loyal fanbase make it a reliable choice, but the ROI potential doesn’t hold a candle to what BTFD is offering right now . Don’t let this wealth-generation opportunity slip through your fingers. The BTFD presale is live, but it won’t last forever. Secure your spot, invest wisely, and who knows? This time next year, you could be laughing all the way to the bank. Find Out More: Website: https://www.btfd.io/ X/Twitter: https://x.com/BTFD_COIN Telegram: https://t.me/btfd_coin The post Lost Out on Ponke? BTFD Coin’s Presale Brings High ROI to the Table appeared first on TheCoinrise.com .",Token Presale and ICO Insights|BTFD,EN,0,0,DOGE|FIAT|MARKET|SHIB|TRADING,"{'name': 'The Coin Rise', 'img': 'https://images.cryptocompare.com/news/default/thecoinrise.png', 'lang': 'EN'}",thecoinrise,2024-12-07 03:15:39
37315483,https://en.coinotag.com/ripples-rlusd-launch-delayed-as-xrp-surges-while-bitcoin-faces-volatility-after-100000-milestone/,1733541375,https://resources.cryptocompare.com/news/77/default.png,"Ripple’s RLUSD Launch Delayed as XRP Surges While Bitcoin Faces Volatility After $100,000 Milestone",https://en.coinotag.com/ripples-rlusd-launch-delayed-as-xrp-surges-while-bitcoin-faces-volatility-after-100000-milestone/,"Ripple’s RLUSD stablecoin launch encounters regulatory challenges with NYDFS, yet XRP sees a brief price surge amid speculation. Bitcoin briefly crossed $100,000 but dropped back to $97,000, impacted by significant",Bitcoin|News|Ripple,EN,0,0,BTC|TRADING|XRP,"{'name': 'CoinOtag', 'img': 'https://resources.cryptocompare.com/news/77/default.png', 'lang': 'EN'}",coinotag,2024-12-07 03:16:15
37315739,https://coinpedia.org/?p=390343,1733541939,https://images.cryptocompare.com/news/default/coinpedia.png,Is Chainlink Ready To Break Its All Time High at $52?,https://coinpedia.org/price-analysis/is-chainlink-ready-to-break-its-all-time-high-at-52/,"The post Is Chainlink Ready To Break Its All Time High at $52? appeared first on Coinpedia Fintech News Chainlink seems to be getting ready to break its current all time high soon. The investors have been waiting for over 3 years for LINK to break past $52. Even though the trading volume is low, market intelligence platform Santiment thinks it is time for the token to take a jump and create new history. Let’s analyse the market and explore what is going on and what we should be expecting from it. Technical Metrics Let’s start with the current price. At the time of writing, Chainlink is trading at $25.50 which is almost 50% gap from its current ATH at $52. The daily chart shows that there is no moving average nearby to support the price.The nearest MA is 20 that lies around $19.32. However, we might be able to see a golden cross over soon as MA 100 is ready to cross over MA 200. This gives us an idea that the strength is building up. Source : Coinglass RSI is at 74.24, so the asset is still below the overbought zone and has space for growth. This momentum is supported by the Average directional Index which is at 52.83. The histogram of MACD is displaying a remarkable buildup. Sometimes the bulls are getting tired but keeping the momentum. Market Sentiment According to the market intelligence platform Santiment, the market has low sentiment towards Chainlink as of now. This can be verified looking at the volume. The daily trading volume is down by 10.98% in the last 24 hours. Despite this the price surged by 8.47%. Chainlink has enjoyed a late-week rally, and now needs to climb just +10.8% to match its 3-year high from January, 2022. It is encouraging that there is very little retail FOMO toward LINK. Markets move the opposite direction of the crowd's expectations, so the crowd's… pic.twitter.com/UuKdmMMXWA — Santiment (@santimentfeed) December 6, 2024 Chain link has been working with multiple financial institutions like SWIFT and Euroclear including major banks and capital market institutions. On December 3, the official Chainlink account of X shared a list of companies and financial institutions they are working with. They are helping companies to develop blockchain applications and tokenized assets. Source : Chainlink X profile What to Expect? Chainlink is not a random crypto which goes into the pump and dump phase. They are the pioneers in the blockchain sector. With the rising adoption of blockchain and RWA worldwide, there is no power in the world that can stop LINK from growing. The strength is building in and it is also reflecting on the charts. The time to create a new ATH is not very far away. It is just waiting for the right moment.",Price Analysis,EN,0,0,BLOCKCHAIN|BUSINESS|LINK|MARKET|TRADING,"{'name': 'coinpedia', 'img': 'https://images.cryptocompare.com/news/default/coinpedia.png', 'lang': 'EN'}",coinpedia,2024-12-07 03:25:39
37316036,https://www.cryptopolitan.com/?p=623803,1733542200,https://resources.cryptocompare.com/news/43/37316036.jpeg,Last Chance to Invest This Undervalued Coin Could Deliver Life-Changing 50x Gains by December 2024,https://www.cryptopolitan.com/last-chance-to-invest-this-undervalued-coin-could-deliver-life-changing-50x-gains-by-december-2024/,"The crypto space is no stranger to big opportunities, and Lightchain Protocol AI is shaping up to be the next life-changing investment you don’t want to miss! This hybrid blockchain-AI innovation is currently in its presale phase and has the potential to skyrocket by a staggering 50x before the year ends. If you’ve been waiting for the perfect moment to diversify your portfolio, this could be it. 🚀 With groundbreaking technology like Proof of Intelligence (PoI) and its unique Artificial Intelligence Virtual Machine (AIVM) , Lightchain Protocol is set to redefine how blockchain and AI intersect. Learn the details of this revolutionary project and reserve your spot in the Lightchain AI Presale —before prices increase! Why Lightchain Protocol AI is Turning Heads Lightchain Protocol AI merges blockchain and AI into an outperforming powerhouse. But what exactly makes it so special? Here’s what the buzz is all about: 1. Proof of Intelligence (PoI) – A Smarter Consensus Unlike traditional models like Proof of Work (PoW) or Proof of Stake (PoS), the PoI consensus mechanism rewards contributors for completing valuable AI computations. This approach not only secures the blockchain but also accelerates advancements in AI. PoI is a win-win for blockchain security and AI innovation. 🙌 2. Artificial Intelligence Virtual Machine (AIVM) – The Future of AI Computing Lightchain’s AIVM is a scalable, adaptive computational layer designed to carry out advanced AI tasks on the blockchain. Think of it as a “living ecosystem” for developers to build smarter decentralized apps (dApps). Whether it’s training complex AI models or executing real-time decision-making algorithms, the AIVM enables it all—efficiently and seamlessly. 💡 3. Real-World Applications This isn’t just a flashy idea—it’s practical. Lightchain will power real-world use cases including decentralized finance, personalized AI-driven health solutions, and even a secure launchpad for memecoin projects. It’s not just another trend; it’s the infrastructure for the future of innovation. 🌎 50x Potential Gains by December 2024 If you’ve been in the crypto space long enough, you know how rare it is for an undervalued coin with this much utility and real-world potential to come around. Currently priced at $0.003 per token , Lightchain’s value is forecasted to multiply 50 times within the next year, placing its potential December 2024 price at $0.15 or more . 📈 Why such high growth? The combination of: Unparalleled technology Adoption of AI-driven blockchain systems Demand for transparent, auditable AI solutions …all position Lightchain Protocol AI for explosive growth. How Lightchain Will Redefine Major Industries Lightchain AI doesn’t just cater to blockchain enthusiasts. Its potential impact spans across sectors: Customer Data Insights 🎯 Lightchain’s transparent AI framework will allow businesses to unlock deep insights into customer behaviors, enabling hyper-personalized services while maintaining data privacy. Supply Chain Optimization 📦 AI-driven decentralized systems can rebuild broken supply chains, maximizing efficiency and minimizing waste. Decentralized Governance 🤝 Through tokenized voting systems and AI optimization, Lightchain empowers communities to create scalable, democratic solutions for complex governance challenges. Crypto Launchpads for Creators 🐕🔥 With a secure memecoin launchpad, Lightchain is tapping into one of the most creative and lucrative sectors in the crypto space. What Sets Lightchain Apart from Other Coins Not all blockchain projects are created equal, and Lightchain is in a league of its own. Here are some standout advantages: Environmentally Friendly – PoI is far less energy-intensive compared to PoW. Developer Empowerment – AIVM supports and accelerates AI dApp creation for developers globally. Layered Security – Innovative consensus models like PoI add impenetrable layers of security to Lightchain’s ecosystem. Community First – Decentralized governance ensures that contributors and token holders drive decisions, aligning the ecosystem to collective values. How to Get Started with Lightchain Here’s the best part—you can participate in Lightchain’s success today by joining its presale. Tokens are currently available at just $0.003 , but the clock is ticking because this price won’t last long! ⏳ Steps to Join the Presale Visit the official Lightchain AI website ( https://lightchain.ai ). Connect your crypto wallet (ETH or USDT supported). Select the amount you wish to invest. Receive your Lightchain Protocol AI (LCAI) tokens instantly and secure your spot for massive future gains. 🚀 Lightchain Protocol AI isn’t just a cryptocurrency—it’s a movement backed by next-gen technology. Whether you’re a day trader, an NFT collector, or a long-term investor, this project has something to offer everyone. Don’t Miss the Community Perks When you join the Lightchain AI ecosystem, you become part of a thriving community of innovators, tech enthusiasts, and investors. Engage in governance, discuss trends, and access exclusive opportunities in both the crypto and AI worlds. Want to be in the know? Stay connected via: Whitepaper for in-depth details 📜 Telegram to chat with the Lightchain community 💬 Twitter for exciting updates 🐦",Press Release,EN,0,0,BLOCKCHAIN|BUSINESS|TECHNOLOGY|TRADING|ZRX,"{'name': 'Cryptopolitan', 'img': 'https://images.cryptocompare.com/news/default/cryptopolitan.png', 'lang': 'EN'}",cryptopolitan,2024-12-07 03:30:00
37315880,https://www.newsbtc.com/?p=658554,1733542216,https://resources.cryptocompare.com/news/21/37315880.jpeg,Is Pepe Coin’s Next ATH Around The Corner? Whales Bet Big After Major Listings,https://www.newsbtc.com/news/is-pepe-coins-next-ath-around-the-corner-whales-bet-big-after-major-listings/,"Pepe is in the meme coin spotlight again. Binance.US and Coinbase, two of the major cryptocurrency exchanges, have added Pepe Coin to their trading platforms. Whales have been consuming enormous amounts of the token, generating ripples. Could this momentum take the meme coin to a new all-time high? Let’s investigate. Related Reading: Market Expert: Not Long On XRP? You’re ‘Disrespecting’ Yourself Exchange Listings Generate Excitement Binance.US announced on December 5 that it would allow trading of Pepe Coin against Tether (USDT). It was not long before Coinbase followed suit, adding the token to its growing memecoin list. These listings are important because they make PEPE accessible to millions of investors. Accessibility often leads to an increase in trading volume, and this seems to be the case here. The effects are already apparent. The price of Pepe Coin has risen by 165% in the past month; currently, its market capitalization is at $9.15 billion. These milestones are undeniable indications that the coin is not just another transient meme but is garnering significant attention within the crypto community. Whales Place Significant Bets On Pepe The excitement is not only in the listings. By statistics, whales have bought 337 million tokens, valued at some $7 million. Such behavior usually reflects confidence in the possibility for a token to climb. Whales continue to accumulate $PEPE! A whale has withdrawn 337.09B $PEPE($6.92M) from #Binance in the past 20 days.https://t.co/65vbIQd2dd pic.twitter.com/79NauAQt8V — Lookonchain (@lookonchain) December 4, 2024 Currently trading at $0.0000217, PEPE is getting closer to its all-time high of $0.00002457. Technical indicators support this optimism: the MACD (Moving Average Convergence Divergence) shows continuous bullishness while the Relative Strength Index (RSI) is now at 62.45, indicating strong buying momentum. These signals taken with the presence of whales suggest short-term hope for the cryptocurrency. Investor interest now turns towards the strong level of resistance at $0.000028105. Should the coin breach past that point, it will probably try for the next line of resistance, at $0.000036003. Related Reading: No Sweat! Dogecoin Will Hit $5 ‘Very Easy’ In 2025 – Analyst Is A New PEPE ATH On The Way? With all the excitement going on right now, a lot of people are interested in how the Pepe Coin could hit new heights. Its appeal has definitely grown since it was listed on several exchanges recently, and the backing of whales makes things even better. The narrative that the crypto asset could reach a new ATH is strengthened by the active participation of the community. However, it is not completely issue-free. Like other meme coins, Pepe is vulnerable to market volatility and speculative trading. Although the trends now seem promising, the investors need to be very careful as they navigate through this fast-changing market. The next few days will be critical as Pepe Coin approaches its ATH. It is certain that this diminutive frog-themed crypto will not be hopping out of the spotlight anytime soon, regardless of whether it bursts through resistance or consolidates further. Featured image from DALL-E, chart from TradingView",Cryptocurrency Market News|altcoins|Binance US|coinbase|crypto|memecoins|PEPE|Pepe Coin,EN,0,0,BUSINESS|EXCHANGE|MARKET|TRADING|PEPE,"{'name': 'NewsBTC', 'img': 'https://images.cryptocompare.com/news/default/newsbtc.png', 'lang': 'EN'}",newsbtc,2024-12-07 03:30:16
37315944,https://news.bitcoin.com/?p=689962&preview=true&preview_id=689962,1733542228,https://resources.cryptocompare.com/news/14/37315944.jpeg,Ripple Applauds White House Crypto Czar: Is Regulatory Clarity Finally Here?,https://news.bitcoin.com/ripple-applauds-white-house-crypto-czar-is-regulatory-clarity-finally-here/,"“Dream team!” Ripple executives hailed David Sacks’ appointment as White House Cryptocurrency Czar, predicting his leadership will drive innovation and deliver long-awaited regulatory clarity. ‘Crypto Czar’ Appointed: Ripple’s Executives Predict Major Policy Breakthroughs Ripple’s leadership has voiced strong support for David Sacks’ appointment to spearhead the Trump administration’s efforts in cryptocurrency and artificial intelligence (AI).",Regulation|Crypto Czar|Ripple,EN,0,0,REGULATION,"{'name': 'Bitcoin.com', 'img': 'https://images.cryptocompare.com/news/default/bitcoincom.png', 'lang': 'EN'}",bitcoin.com,2024-12-07 03:30:28
37316618,https://www.cryptoglobe.com/latest/2024/12/crypto-analyst-who-called-2018-bear-market-bottom-predicts-violent-upside-move-for-dogecoin-doge/,1733543340,https://resources.cryptocompare.com/news/2/37316618.jpeg,Crypto Analyst Who Called 2018 Bear Market Bottom Predicts ‘Violent Upside Move’ for Dogecoin ($DOGE),https://www.cryptoglobe.com/latest/2024/12/crypto-analyst-who-called-2018-bear-market-bottom-predicts-violent-upside-move-for-dogecoin-doge/,"A prominent cryptocurrency analyst who has gained a large following on social media after accurately calling Bitcoin’s 2018 bear market bottom above $3,000 has recently revealed he believes the price of the meme-inspired Dogecoin ($DOGE) could soon see a “violent upside move.” In a post shared on the microblogging platform X (formerly known as Twitter) with",DOGE|Altcoins|Dogecoin ($DOGE),EN,0,0,ALTCOIN|BTC|DOGE|MARKET|TRADING,"{'name': 'CryptoGlobe', 'img': 'https://images.cryptocompare.com/news/default/cryptoglobe.png', 'lang': 'EN'}",cryptoglobe,2024-12-07 03:49:00
37316504,https://www.cryptointelligence.co.uk/?p=26018,1733543386,https://resources.cryptocompare.com/news/95/default.png,"New Solana Memecoin Gay Musk (GAYMUSK) Will Skyrocket 12,000% Before Exchange Listing",https://www.cryptointelligence.co.uk/new-solana-memecoin-gay-musk-gaymusk-will-skyrocket-12000-before-exchange-listing/,"Gay Musk could turn early investors into multi-millionaires, like other memecoins, such as Shiba Inu (SHIB) and Dogecoin (DOGE), did. Gay Musk (GAYMUSK), a Solana memecoin launched today, is set to explode over 12,000% in price in the coming days. This is because GAYMUSK is set to soon be listed on numerous crypto exchanges, according to reports. This will give the Solana memecoin exposure to millions of additional investors, who will pour funds into the coin and cause its price to rally, which will benefit investors who buy before these new exchange listings. Currently, Gay Musk can only be purchased via Solana decentralized exchanges, like Jup.ag and Raydium.io, and early investors stand to make huge returns in the coming days. Early investors in SHIB and DOGE made astronomical returns, and Gay Musk could become the next viral memecoin. Gay Musk launched with over $8,000 of liquidity, giving it a unique advantage over the majority of other new memecoins, and early investors could make huge gains. To buy Gay Musk on Raydium.io or Jup.ag ahead of the CEX listings, users need to connect their Solflare, MetaMask or Phantom wallet, and swap Solana for Gay Musk by entering its contract address – AzwJdwbJA3YzCtot1SZ786obi9zqEQ46qxXxsevU9k4L – in the receiving field. If you don’t have one of these wallets already, you can create a new wallet in a few minutes and transfer some Solana to it (which will then be used to buy the memecoin), from an exchange like Coinbase, Binance and many others. Early investors could make returns similar to those who invested in Shiba Inu (SHIB) and Dogecoin (DOGE) before these memecoins went viral and exploded in price. If this happens, a new wave of memecoin millionaires could be created in a matter of weeks – or potentially even sooner. The Solana memecoin craze continues amid larger memecoins, like Shiba Inu (SHIB), Dogecoin (DOGE) and DogWifHat (WIF) trading sideways in recent weeks and losing momentum. This is why many SHIB, DOGE and WIF investors are instead investing in new Solana memecoins, like GAYMUSK. Such memecoins have no utility and no inherent value, but investors looking for high gains have been investing in them due to their potential to rapidly rise in price.",Blockchain News|Crypto News Today|Press Releases,EN,0,0,BUSINESS|DOGE|EXCHANGE|SHIB|SOL,"{'name': 'CryptoIntelligence', 'img': 'https://resources.cryptocompare.com/news/95/default.png', 'lang': 'EN'}",cryptointelligence,2024-12-07 03:49:46
37316801,https://ambcrypto.com/?p=449806,1733544001,https://images.cryptocompare.com/news/default/ambcrypto.png,WIF’s $93.8M exchange exodus: Is a 30% price surge coming?,https://ambcrypto.com/wifs-93-8m-exchange-exodus-is-a-30-price-surge-coming/,$94 million WIF outflow from exchanges indicate potential upward momentum.,Memecoins|News|News 1|Social|Trading View|ambcrypto,EN,0,0,EXCHANGE|TRADING|WIF,"{'name': 'AMB Crypto', 'img': 'https://images.cryptocompare.com/news/default/ambcrypto.png', 'lang': 'EN'}",ambcrypto,2024-12-07 04:00:01
