id,guid,published_on,imageurl,title,url,body,tags,lang,upvotes,downvotes,categories,source_info,source,date
44300281,https://bitcoinworld.co.in/?p=158220,1746662451,https://resources.cryptocompare.com/news/82/default.png,Bitcoin Treasury Powerhouse: Asset Entities and Strive Merge for Public BTC Play,https://bitcoinworld.co.in/asset-entities-bitcoin-treasury/,"Big news is hitting the wires for those following the intersection of traditional finance and the burgeoning world of cryptocurrency. Asset Entities (NASDAQ: ASST), a company already listed on the NASDAQ exchange, is set to merge with Strive Asset Management. The strategic goal? To create a new kind of entity on the public markets: a dedicated Bitcoin treasury company. This move signals a potentially significant shift, offering investors a novel way to gain exposure to the leading digital asset. What is a Public Bitcoin Treasury Company? Before diving into the specifics of the Asset Entities and Strive Asset Management deal, let’s clarify what a public Bitcoin company focused on treasury operations actually entails. Unlike companies that mine Bitcoin or provide crypto services, a Bitcoin treasury company primarily holds Bitcoin on its balance sheet as a significant asset. The core objective is often to provide shareholders with direct exposure to the price movements of Bitcoin through the company’s stock. Key characteristics typically include: Primary Asset Holding: A substantial portion of the company’s assets consists of Bitcoin. Strategic Focus: Management is focused on strategies related to acquiring, holding, and potentially managing their Bitcoin reserves. Shareholder Value: The value proposition to shareholders is often tied directly to the performance of their Bitcoin holdings. Public Listing: Being listed on a major exchange like NASDAQ allows broader investor access compared to private funds or direct crypto ownership. The most prominent example of this model is MicroStrategy, an operating software company that has famously adopted a corporate Bitcoin treasury strategy, accumulating significant amounts of BTC over time. Asset Entities ASST and Strive Asset Management: The Merger Explained According to a GlobeNewswire press release, Asset Entities (NASDAQ: ASST) is merging with Strive Asset Management. The new combined entity will operate under the Strive brand and will remain listed on the NASDAQ stock exchange. This is a crucial point – the existing public listing of Asset Entities provides a direct path for the new, Bitcoin-focused venture to immediately trade on a major U.S. exchange. Strive Asset Management, co-founded by Vivek Ramaswamy, has positioned itself as an asset manager focusing on a different approach to investing, often emphasizing a focus on profit over political or social agendas (often referred to as ‘anti-ESG’). Their move into the Bitcoin treasury space via this merger with Asset Entities ASST indicates a strategic decision to embrace digital assets as a core component of their future offerings. The press release highlights that the new entity will focus on maximizing Bitcoin (BTC) exposure and long-term value for shareholders. This suggests a dedicated strategy towards accumulating and holding Bitcoin, making the company’s stock a proxy for direct BTC investment, albeit with the added layers of corporate structure, management decisions, and market dynamics. Why This Strategic Move? Benefits for the New Entity and Investors The decision by Asset Entities and Strive Asset Management to merge and focus on becoming a NASDAQ listed Bitcoin company offers several potential benefits: Immediate Public Access: Leveraging Asset Entities’ existing NASDAQ listing bypasses the traditional IPO process for Strive’s new venture, allowing them to hit the ground running on a major exchange. Clear Market Positioning: Positioning the new entity explicitly as a ‘Bitcoin treasury company’ provides a clear and understandable value proposition for investors interested in Bitcoin exposure through traditional equity markets. Strive’s Brand and Expertise: Operating under the Strive brand brings their established identity and asset management expertise to the venture, potentially attracting their existing investor base and new capital. Potential for Capital Raising: Being publicly listed can facilitate easier access to capital markets for potential future fundraising, which could be used to acquire more Bitcoin. Shareholder Access to BTC: Provides traditional investors, who may be hesitant or unable to directly hold Bitcoin, with a regulated and familiar avenue for exposure via stock ownership. This merger creates a unique vehicle that combines the accessibility of a public stock with the investment focus on a volatile, high-growth asset class like Bitcoin. What Are the Potential Challenges and Risks? While the prospects are exciting, establishing a dedicated Bitcoin treasury company on a major exchange like NASDAQ also comes with significant challenges and risks: Bitcoin Price Volatility: The most obvious risk. The value of the company’s primary asset, and therefore its stock price, will be highly sensitive to the volatile price swings of Bitcoin. Regulatory Landscape: The regulatory environment for cryptocurrencies is still evolving globally and within the U.S. Changes in regulations could impact the company’s operations, reporting requirements, or even the ability to hold Bitcoin. Security Risks: Holding large amounts of Bitcoin requires sophisticated security measures to protect against hacks, theft, or loss of private keys. Management and Operational Challenges: Successfully managing a corporate treasury of a volatile digital asset requires specialized knowledge and infrastructure. Market Perception and Premium/Discount: The stock price might trade at a premium or discount to the underlying value of its Bitcoin holdings (often referred to as Net Asset Value or NAV), influenced by market sentiment, management performance, and liquidity. Investors considering the new Strive entity will need to weigh these risks carefully against the potential benefits of Bitcoin exposure. Comparing to Other Public Bitcoin Companies How does this new venture compare to existing public Bitcoin company examples? As mentioned, MicroStrategy is the benchmark. However, MicroStrategy is primarily a software company whose core business generates revenue, and its Bitcoin treasury is a corporate strategy layered on top. While its stock price is heavily influenced by its BTC holdings, it still has an underlying operational business. The new Strive entity, emerging from the merger of Asset Entities and Strive Asset Management, appears to be positioning itself with a much more explicit and central focus on the Bitcoin treasury function from its inception. This might make it a more direct, albeit potentially more volatile, proxy for Bitcoin compared to companies with diversified operations. Actionable Insights for Investors For investors watching this development, here are some points to consider: Evaluate Your Risk Tolerance: Investing in a company whose value is closely tied to Bitcoin’s price means accepting significant volatility. Research the New Entity: Once the merger is complete and the new entity is fully operational under the Strive brand, thoroughly research their specific strategy for managing their Bitcoin treasury, their security protocols, and their management team. Understand the Premium/Discount: Pay attention to whether the stock is trading at a premium or discount to the value of its underlying Bitcoin holdings. This can indicate market sentiment and potential mispricing. Diversification: Consider how this investment fits into your overall portfolio diversification strategy. Stay Informed: Keep up with news regarding both the company’s performance and broader Bitcoin and crypto market developments. The creation of a dedicated NASDAQ listed Bitcoin company is a notable event, expanding the options for investors seeking regulated exposure to the digital asset space. A Compelling New Avenue for Bitcoin Exposure The merger between Asset Entities (ASST) and Strive Asset Management to form a public Bitcoin treasury company under the Strive brand is a significant development in the evolving landscape of crypto adoption within traditional finance. By creating a dedicated entity focused on maximizing Bitcoin exposure while remaining listed on NASDAQ, they are offering investors a clear and accessible pathway to participate in the potential growth of BTC. While the inherent volatility of Bitcoin and the operational challenges of managing a large digital asset treasury present risks, the strategic vision to create a focused public Bitcoin company could resonate with a growing segment of investors looking for regulated exposure. This move by Strive Asset Management and Asset Entities ASST marks another step towards bridging the gap between traditional equity markets and the innovative world of cryptocurrencies, potentially setting a precedent for future similar ventures. To learn more about the latest Bitcoin trends, explore our article on key developments shaping Bitcoin institutional adoption .",Crypto News|Asset Entities|BITCOIN|Nasdaq|Strive Asset Management|Treasury,EN,0,0,BTC|BUSINESS|MARKET|REGULATION|TRADING,"{'name': 'Bitcoin World', 'img': 'https://resources.cryptocompare.com/news/82/default.png', 'lang': 'EN'}",bitcoinworld,2025-05-08 00:00:51
44300962,https://coinedition.com/?p=641051,1746662460,https://resources.cryptocompare.com/news/7/default.png,Algorand (ALGO) Price Tests Critical $0.175 Support: Can Bulls Step In?,https://coinedition.com/algorand-algo-price-analysis-descending-channel-support/,"ALGO’s price respects a descending channel, creating clear scalp trading opportunities. Liquidation volumes have dropped since March, signaling reduced leveraged activity. MACD shows bearish momentum, but RSI hints at weakening downside without reversal. Algorand (ALGO) has remained trapped in a persistent downtrend, but there may be an opportunity for traders watching key levels. Sjuul from AltCryptoGems notes that ALGO’s consistent pattern adherence makes current levels worth watching closely. ALGO Price Respects Descending Channel Structure ALGO’s price has shown a clear downward trajectory, constrained within a well-defined descending channel. This channel has acted as a reliable guide, with price action consistently respecting both upper and lower boundaries. Such behavior indicates a technically structured market, where each support and resistance level is significant. The price is approaching the $0.175 level, a critical zone. This area holds importance due to its alignment with the channel’s midline and a horizontal support level. Source: X Analyst Sjuul specifically suggests that traders looking for a quick “scalp” trade might f… The post Algorand (ALGO) Price Tests Critical $0.175 Support: Can Bulls Step In? appeared first on Coin Edition .",Market|Market News|News|Price Analysis|Top Crypto News|Algorand (ALGO)|Altcoin News,EN,0,0,ALGO|MARKET|TRADING,"{'name': 'Coin Edition', 'img': 'https://resources.cryptocompare.com/news/7/default.png', 'lang': 'EN'}",coinquora,2025-05-08 00:01:00
44300407,https://u.today/now-or-never-for-bitcoin-btc-price-shiba-inu-shib-finally-bouncing-solana-sol-is-something-wrong,1746662460,https://resources.cryptocompare.com/news/64/44300407.jpeg,"Now or Never For Bitcoin (BTC) Price, Shiba Inu (SHIB) Is Finally Bouncing, Solana (SOL): Is Something Wrong?",https://u.today/now-or-never-for-bitcoin-btc-price-shiba-inu-shib-finally-bouncing-solana-sol-is-something-wrong,Market is in state where direction of assets can change at any given moment,Bitcoin|BTC,EN,0,0,BTC|MARKET|SHIB|SOL|TRADING,"{'name': 'U.Today', 'img': 'https://images.cryptocompare.com/news/default/utoday.png', 'lang': 'EN'}",utoday,2025-05-08 00:01:00
44300320,https://en.coin-turk.com/?p=191669,1746662514,https://resources.cryptocompare.com/news/79/44300320.jpeg,Movement Labs Ends Controversial Ties After Shocking Discovery,https://en.coin-turk.com/movement-labs-ends-controversial-ties-after-shocking-discovery/,Movement Labs swiftly ended its relationship with Rushi Manche amid a scandal. The MOVE token faced significant price declines following secret deal revelations. Continue Reading: Movement Labs Ends Controversial Ties After Shocking Discovery The post Movement Labs Ends Controversial Ties After Shocking Discovery appeared first on COINTURK NEWS .,Cryptocurrency News,EN,0,0,TRADING,"{'name': 'CoinTurk News', 'img': 'https://resources.cryptocompare.com/news/79/default.png', 'lang': 'EN'}",cointurken,2025-05-08 00:01:54
44300463,https://cointelegraph.com/news/changpeng-zhao-cz-binance-asked-trump-pardon,1746662696,https://images.cryptocompare.com/news/default/cointelegraph.png,Binance founder CZ asked Trump to pardon money laundering conviction,https://cointelegraph.com/news/changpeng-zhao-cz-binance-asked-trump-pardon?utm_source=rss_feed&utm_medium=rss&utm_campaign=rss_partner_inbound,"Binance founder and convicted felon Changpeng Zhao says that he applied for a pardon from US President Donald Trump shortly after denying reports that he was seeking one. Zhao, also known as CZ, said on a Farokh Radio podcast episode aired May 6 that he “wouldn’t mind” a pardon and that his lawyers have already filed the paperwork on his behalf “I got lawyers applying,” Zhao said, adding that he submitted the request after Bloomberg and The Wall Street Journal reported in March that he was seeking a pardon from Trump amid discussions of a business deal between the Trump family and Binance.US. Zhao denied the reports at the time, but said on the podcast that he thought “if they’re writing this article, I may as well just officially apply.” He added that Trump’s pardon of three BitMEX founders, including Arthur Hayes, also motivated him to submit an application. Zhao said the application was submitted about two weeks ago. Changpeng Zhao (right) speaking with Farokh Sarmad (left). Source: Farokh Radio Zhao said at the time of the Bloomberg and Wall Street Journal reports that “no felon would mind a pardon,” and claimed he is the only person in US history to serve prison time for a Bank Secrecy Act charge. Zhao pleaded guilty to a money laundering charge in November 2023 as part of a deal Binance reached with US authorities, which saw it pay a $4.3 billion fine , to which Zhao contributed $50 million. He was also forced to step down as CEO . Zhao was later sentenced to four months in prison and was prohibited from working at Binance as part of his plea deal. Related: VanEck files for BNB ETF, first in US According to the US Department of Justice, a pardon would not erase Zhao’s money laundering conviction; however, it could potentially allow him to assume a management or operational role at Binance.US. Zhao has no plans to return as Binance CEO While Zhao remains a Binance shareholder, he said in November at Binance Blockchain Week that he has “no plans to return to the CEO position.” “I feel the team is doing well and doesn't need me back,” Zhao said. Since leaving prison, Zhao has commenced advisory roles in Pakistan and Kyrgyzstan , assisting on matters related to crypto regulation and implementing blockchain solutions. Magazine: Bitcoiner Adam Back on Blockstream conspiracy theories and Satoshi question",,EN,0,0,BLOCKCHAIN|BUSINESS|EXCHANGE|REGULATION|BNB,"{'name': 'CoinTelegraph', 'img': 'https://images.cryptocompare.com/news/default/cointelegraph.png', 'lang': 'EN'}",cointelegraph,2025-05-08 00:04:56
44300433,https://bitcoinworld.co.in/?p=158222,1746662751,https://resources.cryptocompare.com/news/82/default.png,US Stock Market Opening Higher: Optimism Spreads,https://bitcoinworld.co.in/us-stock-market-opening-optimism/,"Hello, crypto enthusiasts! While our primary focus is the exciting world of digital assets, it’s crucial to keep an eye on traditional financial markets. Why? Because movements in the US stock market often offer valuable insights into broader economic trends and overall investor sentiment , which can indirectly influence the crypto landscape. Today, we’re seeing a notable positive signal from Wall Street. What’s Happening with the Stock Market Opening? The stock market opening today brought good news for traditional investors, with major indices kicking off the trading session on a higher note. This follows a period where markets have been closely watching economic data and corporate earnings reports. Here’s a quick look at how the key indices performed right out of the gate: S&P 500: Started the day up +0.13% NASDAQ: Opened with a gain of +0.07% Dow Jones Industrial Average: Saw the strongest initial momentum, rising +0.31% These early gains, though modest, suggest a positive start to the trading day, indicating that market participants are feeling a degree of optimism. Why Should Crypto Investors Care About the S&P 500 and NASDAQ? You might wonder, ‘I’m here for Bitcoin and Ethereum, why talk about the S&P 500 and NASDAQ ?’ That’s a fair question! The connection lies in the concept of risk appetite and market liquidity. Historically, there has been a correlation between the performance of tech stocks (heavily represented in the NASDAQ) and risk-on assets like cryptocurrencies. When investors feel confident about the economy and are willing to take on more risk, both tech stocks and crypto often benefit. Conversely, during periods of uncertainty or fear, investors tend to move towards safer assets, sometimes leading to sell-offs in both markets. The NASDAQ , in particular, is home to many growth-oriented technology companies. Its performance is often seen as a barometer for investor confidence in future innovation and economic expansion – themes that also resonate strongly within the crypto space. Similarly, the S&P 500 , representing the 500 largest US publicly traded companies, provides a broader snapshot of the overall health and direction of the US economy. When these major indices show strength, it can signal a more favorable macroeconomic environment for risk assets globally, including digital currencies. Understanding Investor Sentiment: A Key Driver At its core, the positive stock market opening reflects improving investor sentiment . Sentiment is essentially the overall attitude of investors towards a particular market or financial instrument. It’s driven by a mix of factors, including economic data releases, corporate earnings, geopolitical events, and even news headlines. Positive sentiment in traditional markets can spill over into the crypto market for several reasons: Increased Risk Appetite: When investors feel optimistic, they are more likely to allocate capital to higher-risk, potentially higher-reward assets like cryptocurrencies. Liquidity: A strong stock market can indicate healthy overall market liquidity, meaning there’s more capital flowing through the financial system, some of which can find its way into crypto. Confidence Boost: General economic confidence, reflected in stock market gains, can indirectly boost confidence in newer, less-established asset classes like digital assets. Conversely, negative sentiment stemming from stock market downturns often correlates with crypto price drops, as investors become risk-averse and potentially liquidate crypto holdings to cover losses or increase cash positions elsewhere. What Might Be Driving This Positive Start? While the initial report is brief, several factors could be contributing to this morning’s positive momentum: Positive Economic Data: Recent reports on inflation, employment, or consumer spending might have exceeded expectations, boosting confidence in the economic outlook. Strong Corporate Earnings: If companies are reporting better-than-expected profits, it signals underlying business strength. Federal Reserve Outlook: Any indications that the Federal Reserve might be nearing the end of its rate-hiking cycle or considering future cuts can be positive for markets. Geopolitical Stability: A reduction in major geopolitical tensions can decrease uncertainty and encourage investment. It’s important to remember that market movements are complex and influenced by a multitude of factors. The initial stock market opening is just one data point in a continuous trading day. Actionable Insights for Crypto Investors So, how should you, as a crypto investor, use this information? Stay Informed: Recognize the interconnectedness. While crypto has its unique drivers, global macroeconomic conditions and traditional market sentiment matter. Watch for Correlation: Observe how Bitcoin, Ethereum, and other major cryptocurrencies react throughout the day. Do they track the stock market’s movements, or are they following their own narrative? Assess Risk Appetite: A positive US stock market can indicate higher overall risk appetite. This might be a favorable environment for altcoins or higher-beta crypto assets, but always conduct your own research. Diversify Your Information Sources: Don’t rely solely on stock market news, but integrate it into your broader understanding of the financial landscape. This morning’s positive start in the US stock market , including gains in the S&P 500 and NASDAQ , is a signal of potentially improving investor sentiment in traditional finance. While not a direct predictor of crypto prices, it’s a data point worth considering as part of the larger global economic picture that influences all asset classes. Concluding Thoughts The higher stock market opening today provides a glimmer of optimism in the broader financial world. For those navigating the volatile waters of cryptocurrency, understanding these traditional market movements is like having an extra compass. It helps gauge the prevailing winds of investor sentiment and global risk appetite, factors that can subtly, yet significantly, impact the path of digital assets. Keep watching how this sentiment evolves throughout the day and week, and how the crypto market responds. To learn more about the latest crypto market trends, explore our articles on key developments shaping Bitcoin and Ethereum price action.",Crypto News|CRYPTOCURRENCY|Finance|Nasdaq|SP500|Stock Market,EN,0,0,BTC|BUSINESS|ETH|MARKET|TRADING,"{'name': 'Bitcoin World', 'img': 'https://resources.cryptocompare.com/news/82/default.png', 'lang': 'EN'}",bitcoinworld,2025-05-08 00:05:51
44300510,https://en.coinotag.com/changpeng-zhao-confirms-pardon-application-to-trump-after-previous-denials-amid-binance-conviction-discussions/,1746662831,https://resources.cryptocompare.com/news/77/44300510.jpeg,Changpeng Zhao Confirms Pardon Application to Trump After Previous Denials Amid Binance Conviction Discussions,https://en.coinotag.com/changpeng-zhao-confirms-pardon-application-to-trump-after-previous-denials-amid-binance-conviction-discussions/,"Changpeng Zhao, the founder of Binance, recently confirmed his application for a pardon from former President Donald Trump, casting a spotlight on his controversial past. This development comes on the",News,EN,0,0,EXCHANGE|REGULATION|BNB,"{'name': 'CoinOtag', 'img': 'https://resources.cryptocompare.com/news/77/default.png', 'lang': 'EN'}",coinotag,2025-05-08 00:07:11
