id,guid,published_on,imageurl,title,url,body,tags,lang,upvotes,downvotes,categories,source_info,source,date
44297639,https://www.cryptopolitan.com/?p=722905,1746657372,https://resources.cryptocompare.com/news/43/44297639.jpeg,Robinhood is planning a blockchain to trade US assets in Europe,https://www.cryptopolitan.com/robinhood-to-trade-us-assets-in-europe/,"Robinhood Markets Inc. is developing a blockchain platform that would allow European investors to trade tokenized U.S. stocks. The global interest in tokenized assets is on the rise, and among other companies, Robinhood is buying into the wave with its plan to launch a blockchain-based platform that allows its customers to trade tokenized assets. Robinhood to launch a blockchain platform Robinhood Markets Inc. is currently working to claim its stake in global finance by developing a blockchain-based platform that will allow European retail investors to trade U.S. securities. According to individuals familiar with the matter, Robinhood, based in Menlo Park, California, is currently in talks to build the platform in partnership with a digital asset company. Two blockchains under consideration for the collaboration are Arbitrum and Solana. Arbitrum operates as a layer-2 solution on the Ethereum network, and Solana is known for its fast transaction speeds and low costs. Discussions are still ongoing, and no official agreement has been reached. A spokesperson for Robinhood declined to comment on the ongoing discussions, and Offchain Labs, the developer behind Arbitrum and the Solana Foundation, both followed suit and refrained from responding to media inquiries. Robinhood’s proposed platform would tokenize U.S. stocks and potentially other securities, while giving investors in the European Union access to trade them 24/7 with increased efficiency and lower settlement costs. At present, Robinhood’s customers within the European Union only have access to cryptocurrency trading. However, the company recently secured a brokerage license in Lithuania, which allows it to offer traditional stock trading services across the EU. This development is expected to pave the way for the blockchain venture . Tokenized securities Tokenized securities are digital representations of traditional financial assets like stocks, bonds, or real estate that are recorded on blockchain networks. The technology offers greater efficiency, faster settlement times, and significantly lower infrastructure costs. A 2023 report by the Global Financial Markets Association (GFMA) showed that distributed ledger technology (DLT) could cut global clearing and settlement costs by up to $20B annually. These saved expenses come from reducing the reliance on centralized agents and complex reconciliation processes, which often delay trading. Several major financial institutions are buying into the tokenization wave. BlackRock’s USD Institutional Digital Liquidity Fund, known as BUIDL , has attracted over $2B in assets since its launch. Franklin Templeton and Apollo have each launched their own tokenized investment products in recent years. Even Coinbase has expressed interest in offering tokenized securities. The CEO of Robinhood, Vlad Tenev, publicly shared his enthusiasm for the potential of tokenized assets. Speaking on a podcast in March, he said, “Tokenized securities can really push forward U.S. company dominance in the global market. Right now, it’s very difficult to invest in a U.S. company if you’re overseas.” This challenge is precisely what Robinhood’s blockchain platform seeks to solve as European investors face regulatory and operational hurdles when they try to invest directly in U.S.-listed securities. Robinhood ’s acquisition of Bitstamp, a well-established European cryptocurrency exchange, is also critical to its expansion into the EU. Bitstamp’s MiFID-compliant multilateral trading facility (MTF) license would allow Robinhood to offer crypto-linked derivatives and potentially even tokenized securities. Once the deal closes, Robinhood could use Bitstamp’s infrastructure and licensing to bring its tokenized platform to the European market faster and more securely. Cryptopolitan Academy: Tired of market swings? Learn how DeFi can help you build steady passive income. Register Now",News|Robinhood,EN,0,0,BLOCKCHAIN|BUSINESS|MARKET|TRADING|ARB,"{'name': 'Cryptopolitan', 'img': 'https://images.cryptocompare.com/news/default/cryptopolitan.png', 'lang': 'EN'}",cryptopolitan,2025-05-07 22:36:12
44298164,https://coinpedia.org/?p=452197,1746658718,https://images.cryptocompare.com/news/default/coinpedia.png,Robinhood Plans to Build Blockchain Tokenization Platform to Enable EU Investors to Access U.S. Stocks,https://coinpedia.org/news/robinhood-plans-to-build-blockchain-tokenization-platform-to-enable-eu-investors-to-access-u-s-stocks/,"The post Robinhood Plans to Build Blockchain Tokenization Platform to Enable EU Investors to Access U.S. Stocks appeared first on Coinpedia Fintech News Robinhood’s Q1 earnings report showed that the company is heavily reliant on crypto trading, despite a drop in QoQ trading volume. The trading platform is likely to tap into Solana (SOL) and Arbitrum (ARB) chains for its planned development. Robinhood Markets, Inc. (NASDAQ: HOOD), an established electronic trading platform, is ostensibly planning to develop a blockchain tokenization platform to enable European retail investors to participate in the United States securities market. Reportedly, Robinhood plans to collaborate with Arbitrum (ARB) and Solana (SOL) networks to enable the tokenization of U.S. securities. Currently, Robinhood provides cryptocurrency trading services to several EU countries and stock trading services to retail investors in the United Kingdom. Once finalized, the new tokenization platform by Robinhood will help democratize the mainstream adoption of U.S. securities via the blockchain technology. Robinhood Taps Blockchain to Remain Profitable In the recently released first-quarter earnings report, Robinhood noted that crypto trading remained a significant contributor to its overall revenue. During the first three months of 2025, Robinhood reported a revenue of about $252 million from crypto trading services. However, Robinhood highlighted that its crypto trading services dropped by 35 percent from the fourth quarter of 2024. As a result, the trading platform is compelled to diversify its products to ensure a sustainable revenue source for its shareholders. The company has laid significant emphasis on blockchain technology to ensure transparency and seamless adoption of its services globally. Last month, Robinhood secured a brokerage license in Lithuania, which will play a crucial role in its entry into the EU market, particularly in the tokenization and trading of U.S. stock securities. Furthermore, Robinhood acquired Bitstamp cryptocurrency exchange to enhance its legalities in more jurisdictions in the near future.",News,EN,0,0,BLOCKCHAIN|BUSINESS|SOL|TRADING|ARB,"{'name': 'coinpedia', 'img': 'https://images.cryptocompare.com/news/default/coinpedia.png', 'lang': 'EN'}",coinpedia,2025-05-07 22:58:38
44298367,https://www.cryptopolitan.com/?p=722510,1746658800,https://resources.cryptocompare.com/news/43/44298367.jpeg,"Avalanche (AVAX) Announces $250 Million Fundraising While Ruvi AI (RUVI) Is Expected to Explode and Grow by 14,000% in May 2025",https://www.cryptopolitan.com/avalanche-avax-announces-250-million-fundraising-while-ruvi-ai-ruvi-is-expected-to-explode-and-grow-by-14000-in-may-2025/,"Avalanche just announced their $250 million fundraise and we are excited to see them advance blockchain scalability and adoption. But another project with a unique vision is getting attention from the blockchain and AI communities. Enter Ruvi AI, a pioneering platform that combines AI with blockchain to solve real world problems and open up new innovation pathways. What is Ruvi AI’s Vision Ruvi AI is at the forefront of technological convergence by combining the robust, transparent network of blockchain with advanced AI capabilities. It’s designed to deliver solutions across industries like healthcare, supply chain management and finance. By leveraging blockchain’s immutable data and AI’s predictive power, Ruvi AI allows users to unlock new insights. One of Ruvi AI’s key features is its accessibility. The platform prioritizes user friendly interfaces so its tools are available to organizations that may not have deep knowledge of blockchain. Whether it’s predicting financial risks or optimizing logistics networks, Ruvi AI makes its solutions intuitive and effective. By doing so, the project has positioned itself as the go to platform for businesses looking to leverage next gen tech. Presale Success Ruvi AI’s presale launch is a huge success. Within days of launching Phase 1, the project has sold over 10 million tokens and raised over $100,000. This is a testament to the community’s confidence and enthusiasm for the project’s roadmap and potential. Right now, Ruvi AI tokens are priced at $0.01 in Phase 1. Investors can still get in before Phase 2 starts but time is running out as Phase 2 will have a 50% price increase to $0.015 per token. And to add to the confidence, the beta platform will be released shortly after the presale so the development team is committed to delivering on their timelines. VIP Tiers for Investors To reward early believers, Ruvi AI has VIP tiers with extra bonuses and returns . Two tiers stand out for their benefits: VIP Tier 3 VIP Tier 3 requires a $1,000 investment and gets 100,000 tokens in Phase 1. It also gets a 60% bonus so 160,000 tokens. At $0.07 listing price, these tokens would be worth $11,200. If Ruvi AI reaches $1, Tier 3 investors could see returns of $160,000. VIP Tier 5 For larger investments, VIP Tier 5 is the way to go. With a $5,000 investment, you get 500,000 tokens plus 100% bonus so 1,000,000 tokens. At $0.07 listing price, this is $70,000. If Ruvi AI reaches $1, Tier 5 investors could see returns of $1,000,000. Both tiers show Ruvi AI’s investor first approach, delivering massive long term gains and building trust with its growing community. Leaderboard Rewards for Top Supporters Ruvi AI goes beyond traditional rewards by offering leaderboard rewards to top supporters during the presale. The updated reward structure means everyone gets a chance to benefit: Top 10 get 500,000 tokens each. At $0.07, tokens are worth $35,000, which could be $500,000 if the $1 valuation is reached. Top 50 get 250,000 tokens each. Tokens are worth $17,500 at $0.07 and $250,000 at $1. Top 100 get 100,000 tokens each, worth $7,000 at $0.07 and $100,000 at $1. Top 200 get 75,000 tokens, worth $5,250 at $0.07 and $75,000 at $1. Top 500 get 40,000 tokens, worth $2,800 at $0.07 and $40,000 at $1. Top 1000 get 20,000 tokens, worth $1,400 at $0.07 and $20,000 at $1.This structure rewards participation at all levels, creates a strong and active community and maximizes value for Ruvi AI supporters. Building the Future of Blockchain and AI While Avalanche is funding the future of blockchain, Ruvi AI is building its own by combining blockchain with AI to solve real world problems. From the successful presale to the VIP tiers and leaderboard rewards, Ruvi AI is setting new standards for transparency, innovation and investment. The Ruvi AI project is a once in a lifetime opportunity to be part of a movement that will change the way technology integrates. Whether you’re a tech enthusiast, business leader or early stage investor, Ruvi AI promises not only groundbreaking solutions but also massive growth. Join the Ruvi AI revolution today and be part of the future of blockchain and AI. Learn More Buy RUVI: https://presale.ruvi.io Website: https://ruvi.io Whitepaper: https://docs.ruvi.io Telegram: https://t.me/ruviofficial Twitter/X: https://x.com/RuviAI Try RUVI AI: https://web.ruvi.io/register",Press Release,EN,0,0,AVAX|BLOCKCHAIN|BUSINESS|MINING|TRADING,"{'name': 'Cryptopolitan', 'img': 'https://images.cryptocompare.com/news/default/cryptopolitan.png', 'lang': 'EN'}",cryptopolitan,2025-05-07 23:00:00
44298977,https://coinedition.com/?p=641028,1746658800,https://resources.cryptocompare.com/news/7/default.png,"Hong Kong Defends Currency Peg, Bitcoin Pumps Back to $97K, US-China Trade Talks",https://coinedition.com/hong-kong-defends-currency-peg-bitcoin-pumps-back-to-97k-us-china-trade-talks/,"Hong Kong Monetary Authority intervenes with $9.4 billion to defend the HKD peg to the U.S. dollar. Bitcoin rises 3%, reaching $97K, as risk conditions ease and sentiment improves. New Hampshire creates the first state-level Bitcoin reserve, allowing up to 5% of public funds in crypto. Tuesday, the Hong Kong Monetary Authority (HKMA) intervened in the foreign exchange market, selling HKD 73.3 billion (approximately $9.4 billion) to defend the Hong Kong dollar’s peg to the U.S. dollar. This move came after sharp volatility in regional markets, triggering reactions across currencies and money markets. Bitcoin surged by 3% as traders responded to easing risk conditions. Additionally, a new state-level crypto policy in New Hampshire further boosted sentiment. HKMA Intervenes as HKD Hits Band Limit On Tuesday, the Hong Kong dollar spiked to the strong end of its trading band, nearing the 7.75 floor of its peg to the U.S. dollar. In response, the HKMA conducted two foreign exchange operations, selling HKD 73.3 billion to maintain the peg. Related: India-Pakistan Clashes Spark Fears of Crypto Market Volatility – Is a Bitcoin Crash Looming? According t… The post Hong Kong Defends Currency Peg, Bitcoin Pumps Back to $97K, US-China Trade Talks appeared first on Coin Edition .",CoinMarketCap Feed|Market|Market News|News|Top Crypto News|Bitcoin News|Hong Kong,EN,0,0,ASIA|BTC|EXCHANGE|FIAT|MARKET,"{'name': 'Coin Edition', 'img': 'https://resources.cryptocompare.com/news/7/default.png', 'lang': 'EN'}",coinquora,2025-05-07 23:00:00
44299219,https://thecoinrise.com/beyond-hype-unpacking-pepes-breakout-signals-cardanos-resilience-and-the-compelling-100x-narrative-of-unsds-presale/,1746658801,https://images.cryptocompare.com/news/default/thecoinrise.png,"Beyond Hype: Unpacking Pepe’s Breakout Signals, Cardano’s Resilience, and the Compelling 100x Narrative of $UNSD’s Presale",https://thecoinrise.com/beyond-hype-unpacking-pepes-breakout-signals-cardanos-resilience-and-the-compelling-100x-narrative-of-unsds-presale/,"Opportunities in crypto tend to reward those who spot solid fundamentals before mainstream momentum kicks in. Right now, Pepe (PEPE) is drawing attention with signs of a potential trend reversal, while Cardano (ADA) continues to earn credibility through consistent upgrades and a research-driven roadmap. Both projects offer compelling cases, but Unstaked ($UNSD) is taking a different route, one focused on real-world utility and automation. Its AI-powered agents and on-chain Proof of Intelligence system bring measurable, verifiable engagement to the forefront of blockchain functionality. With its crypto presale still underway, Unstaked positions itself as a standout among emerging coins. For those seeking early access to utility-driven growth, it’s a strategic opportunity worth watching. Pepe (PEPE) Sets the Stage for a Breakout Move Pepe (PEPE) is turning heads as technical signals continue to align in its favor. The token has established a firm base and recently confirmed a double-bottom formation, a bullish pattern that often precedes trend reversals. Coupled with consistent buying pressure and well-defended support zones, this setup is attracting renewed interest from traders who see momentum building beneath the surface. With resistance levels clearly in sight, a breakout could trigger sharp upward movement. The Relative Strength Index (RSI) is rebounding from oversold territory, adding further strength to the case for bullish continuation. If PEPE sustains its current consolidation and breaks through overhead resistance, the next leg up could arrive faster than expected. Cardano (ADA) Reclaims Attention with Strategic Strength Cardano (ADA) is regaining momentum as community interest picks up, largely fueled by recent insights from founder Charles Hoskinson. His pointed commentary on competitors has cast a spotlight on Cardano’s disciplined approach to blockchain development, renewing confidence in ADA’s long-term vision. Unlike hype-driven projects, Cardano continues to win support through its academic rigor and commitment to security and scalability. Its steady development and methodical rollouts are starting to resonate with a broader audience. As attention shifts toward sustainable, research-backed platforms, ADA’s rise is becoming a key storyline in the search for next-generation blockchain solutions. Unstaked Could Follow the Footsteps of Crypto’s Biggest 100x Winners Some of the biggest gains in crypto history have come from early-stage bets on platforms that combined utility with perfect timing. Projects like Solana and Polygon delivered 100x to 500x returns once their ecosystems took off, while AI-driven networks such as Fetch.ai proved that real-world functionality can be just as powerful as hype. In this context, Unstaked is starting to mirror that same trajectory. Currently priced at just $0.006695 in Stage 2 of its crypto presale , the project has already raised over $1 million, signaling strong early demand. What makes Unstaked stand out isn’t just its presale numbers but the functionality it’s building. The platform allows users to deploy AI agents that autonomously manage, moderate, and grow digital communities on Telegram and X. These agents are not theoretical; they’ll go live right after launch, delivering immediate utility and solving a major pain point in the Web3 ecosystem. Unstaked’s infrastructure is powered by its Proof of Intelligence protocol, which tracks every agent action on-chain and distributes rewards based on verified engagement. That adds a layer of transparency and merit-based earning that most projects simply don’t offer. The UNSD token plays a central role in governance, utility, and access across this ecosystem. With real AI use cases, strong early traction, and on-chain performance baked in from day one, Unstaked offers more than a speculative bet. It presents an early opportunity to back a platform designed for long-term utility. As demand for AI-integrated tools rises, history suggests platforms like Unstaked could be the next 100x story, if you get in before the crowd. Quick Recap While Pepe (PEPE) flashes promising technical signals and Cardano (ADA) continues its methodical climb, Unstaked offers a fundamentally different value proposition, one grounded in active utility and verifiable performance. Its AI-driven agents and on-chain Proof of Intelligence system go beyond market speculation, delivering a platform built for real engagement and scalable results. With its presale gaining traction and utility ready to activate post-launch, Unstaked ($UNSD) is quickly emerging as a serious contender among emerging crypto coins. For those prioritizing long-term functionality over short-term hype, Unstaked presents a compelling entry point ahead of broader adoption. Join Unstaked Now: Presale: https://presale.unstaked.com/ Website: https://unstaked.com/ Telegram: https://t.me/UnstakedTokenOfficial X: https://t.me/UnstakedTokenOfficial The post Beyond Hype: Unpacking Pepe’s Breakout Signals, Cardano’s Resilience, and the Compelling 100x Narrative of $UNSD’s Presale appeared first on TheCoinrise.com .",Token Presale and ICO Insights|Unstaked,EN,0,0,ADA|BLOCKCHAIN|TRADING|ZRX|PEPE,"{'name': 'The Coin Rise', 'img': 'https://images.cryptocompare.com/news/default/thecoinrise.png', 'lang': 'EN'}",thecoinrise,2025-05-07 23:00:01
44299221,https://thecoinrise.com/kaspa-upgrade-targets-speed-xrp-faces-decline-while-top-bullish-crypto-web3-ai-at-0-0003-preps-for-1747-roi/,1746658802,https://images.cryptocompare.com/news/default/thecoinrise.png,"Kaspa Upgrade Targets Speed, XRP Faces Decline, While Top Bullish Crypto Web3 ai at $0.0003 Preps for 1,747% ROI",https://thecoinrise.com/kaspa-upgrade-targets-speed-xrp-faces-decline-while-top-bullish-crypto-web3-ai-at-0-0003-preps-for-1747-roi/,"Not all gains are the same. Kaspa is preparing for a major speed upgrade, XRP is seeing less network activity, and another project is making progress with practical tools instead of short-term hype. Web3 ai takes a different path. It does not focus on protocol changes or short-term rallies. Instead, it uses AI to help users with trading choices. Its $WAI token powers tools that run around the clock to monitor markets, spot scams, shift assets, and improve DeFi activity. For anyone looking at the next top bullish crypto, attention is moving from promises to actual tools. Web3 ai is part of that shift. Kaspa Upgrade Could Unlock New Network Speed The new Kaspa (KAS) upgrade, named Crescendo, is set to change how the network performs. Scheduled for May 5, this update will increase block speed from one per second to ten. This shift is more than just faster times. It boosts the network’s ability to handle more transactions while keeping its core values of security and decentralization. From a market view, this upgrade may trigger price growth. Analysts are focused on the $0.0990 level as a key point. A close above that could start a stronger upward move. If it breaks $0.15, the trend could strengthen further. With better performance and growing interest, Kaspa’s update is one of the top stories in the space right now. XRP Activity Drop Adds Pressure to Price Trend New XRP data shows a big drop in network use, with active addresses falling 44% in just a few days. This change matches a slide in price, raising concerns about a short-term pullback. Even though XRP is trading above $0.50, the lower user activity adds to bearish signals. Current charts are showing stress as XRP stays near support zones. If sellers increase and buyers don’t return, the price could test the $0.47 to $0.48 area. Still, if XRP holds above current levels, it may stay in a sideways trend, delaying any bigger price changes. $WAI Powers a Nonstop AI Trading System Web3 ai runs at all hours, and so does the system behind it. While traders rest, $WAI holders stay connected through an AI-driven engine that tracks market changes, spots scams, adjusts portfolios, and finds high-yield DeFi options. This is not just a group of features. It is a full-time crypto system, always on and ready to act. At the center of this setup is the $WAI token, available at $0.0003 in presale batch 1. With a planned listing price of $0.005242, early users may see gains up to 1,747%. But its value goes beyond that. $WAI powers everything from AI trade bots and price scanners to fraud alerts and lending tools. It is the main link to a smart, automated dashboard made to help you every second. Unlike tokens that just sit unused, $WAI drives a system made to take action. Whether it’s adjusting your assets during market swings or pointing out new presale risks, Web3 ai works like a full-time quant analyst that doesn’t stop. For those searching for the top bullish crypto with a clear use case and 24/7 function, $WAI stands out as a working product, not just an idea. The ai crypto presale is still active, but not for long. When it closes, access to one of the most advanced AI systems for retail traders may close with it. Functionality Could Define the Next Bullish Trend Kaspa is focused on faster blocks, and XRP is dealing with lower user numbers. Web3 ai is moving in a different direction, focusing on performance instead of price changes. Its system, powered by $WAI, monitors the market, controls risk, and manages assets in real time. These tools are often used by professionals, but now available to regular traders. What makes this different is not the promise of future gains, but what is already in motion. As more users look for long-term tools that can work in any market, platforms like Web3 ai may be what separates the next top bullish crypto from the rest. Join Web3 ai Now: Website: http://web3ai.com/ Telegram: https://t.me/Web3Ai_Token X: https://x.com/Web3Ai_Token Instagram: https://www.instagram.com/web3ai_token The post Kaspa Upgrade Targets Speed, XRP Faces Decline, While Top Bullish Crypto Web3 ai at $0.0003 Preps for 1,747% ROI appeared first on TheCoinrise.com .",Token Presale and ICO Insights|Web3,EN,0,0,BLOCKCHAIN|MARKET|TRADING|XRP,"{'name': 'The Coin Rise', 'img': 'https://images.cryptocompare.com/news/default/thecoinrise.png', 'lang': 'EN'}",thecoinrise,2025-05-07 23:00:02
