id,guid,published_on,imageurl,title,url,body,tags,lang,upvotes,downvotes,categories,source_info,source,date
44299270,https://cryptonews.com/?p=358436,1746660600,https://resources.cryptocompare.com/news/52/44299270.jpeg,South Korean Crypto Exchanges Fret Over Commission Fee Cap Fears,https://cryptonews.com/news/south-korean-crypto-exchanges-fret-over-commission-fee-cap-fears/,"South Korean crypto exchanges are “worried” they may be hit with a commission fee cap following recent comments from Lee Jae-myung, the frontrunner in the nation’s presidential race . Per the South Korean newspaper Noksek Gyungjae Shinmun , crypto exchanges think Lee’s promise to “lower crypto transaction fees” could result in lower profits for their platforms. South Korean Crypto Exchanges: Commission Fee Fears Lee made the pledge this week, along with a promise to green-light Bitcoin spot ETFs . He appears to have been responding to a slew of crypto-related manifesto promises from his main rival, the People Power Party’s Kim Moon-soon. Kim, earlier this month, promised to let the country’s sovereign wealth and state pension funds buy BTC and other tokens. South Korea goes to the ballot booth on June 3. Lee Jae-myung, the frontrunner in the South Korean presidential elections, on the campaign trail earlier this week. (Source: MBN News/Screenshot) However, Lee leads Kim by around 20 percentage points in most opinion polls. And exchanges fear that if he wins power in early June, they could be hit in the pocket. The media outlet wrote that the entire crypto industry was now “expressing concerns” about Lee’s “fee reduction plan.” One exchange official, speaking on condition of anonymity, told the newspaper: “Domestic crypto exchange fees commission fees are already very low compared to overseas platforms. Additional reductions could have a significant impact on exchanges’ profitability.” A senior executive at a non-fiat trading South Korean crypto exchange spoke to Cryptonews.com on May 7. Also speaking on condition of anonymity, the executive said: “Exchanges are already over-regulated as things stand in this country. A commission fee cap will hurt everyone in the sector more, particularly smaller operators.” Lee, meanwhile, is reportedly “reviewing a plan” that involves cutting crypto transaction fees in order “to establish parity with domestic stock market transactions.” BOK expected to lower key rates this month amid deepening economic downturn https://t.co/1NpTm1uPRT — The Korea Times (@koreatimescokr) May 6, 2025 South Korean Fees ‘Are Already Lower Than Those of International Rivals’ The media outlet said that, per its calculations, South Korean crypto exchanges charge an average of 0.05% in commission fees. Lee’s plan would see fees capped at 0.015%, a reduction of around 70%. The media outlet wrote that Binance commission fees stand at 0.1%, although it offers a 25% discount (0.075%) for transactions involving its own coins. The United States-based Coinbase trading platform, meanwhile, charges a fee of 0.5% for transactions worth less than $10,000. Advocates of Lee’s policy say that the move is part of a wider effort to protect crypto investors. They also say it will increase transparency and boost transaction volumes. South Korea’s high court delayed its first hearing on leading presidential candidate Lee Jae-myung’s election violation case until June 18, two weeks after the election date, ensuring he will be able to run for the country’s top office https://t.co/jl13YC7th5 — Bloomberg (@business) May 7, 2025 S Korean Exchanges Face Other Limiting Factors, Claim Industry Insiders South Korean industry insiders also complained that domestic exchanges experience limitations when it comes to diversifying their profit structures. While many overseas exchanges can offer profit-generating services such as crypto derivatives and margin trading, domestic platforms are restricted by tight regulations. As such, any sort of transaction fee cap would hurt South Korean crypto exchanges’ main revenue flow. This could prove to be “a huge burden,” crypto exchange officials claimed. Insiders called on politicians to hold “consultation sessions with the industry” and “consider the market’s unique characteristics.” The post South Korean Crypto Exchanges Fret Over Commission Fee Cap Fears appeared first on Cryptonews .",Blockchain News|Crypto Exchange|South Korea,EN,0,0,ASIA|BTC|BUSINESS|EXCHANGE|TRADING,"{'name': 'cryptonews', 'img': 'https://images.cryptocompare.com/news/default/cryptonews.png', 'lang': 'EN'}",cryptonews,2025-05-07 23:30:00
44299311,https://news.bitcoin.com/?p=724718&preview=true&preview_id=724718,1746660627,https://resources.cryptocompare.com/news/14/44299311.jpeg,Congressional Roundtable Highlights Urgent Need for Crypto Policy Overhaul,https://news.bitcoin.com/congressional-roundtable-highlights-urgent-need-for-crypto-policy-overhaul/,Congress faces mounting pressure to pass landmark crypto legislation as U.S. leadership in digital finance hangs in the balance. Steil Urges Swift Bipartisan Action on Digital Asset Regulation at Congressional Roundtable U.S. Representative Bryan Steil (R-WI) called for immediate bipartisan action on digital asset legislation at a joint roundtable held May 6 by the U.S.,Regulation|Congress|United States US,EN,0,0,REGULATION,"{'name': 'Bitcoin.com', 'img': 'https://images.cryptocompare.com/news/default/bitcoincom.png', 'lang': 'EN'}",bitcoin.com,2025-05-07 23:30:27
44299246,https://www.newsbtc.com/?p=746106,1746660635,https://resources.cryptocompare.com/news/21/44299246.jpeg,"Analyst Says These Factors Will Drive XRP Price To $1,000, But What Does Market Cap Say?",https://www.newsbtc.com/analysis/xrp/factors-to-drive-xrp-to-1000/,"As the XRP price takes center stage, bold predictions about its future outlook persist across online forums and social media. Among the most ambitious claims is the idea that the XRP price could skyrocket to $1,000 or even beyond. In response to these projections, a crypto analyst has outlined several key factors that would need to align for XRP to reach such a target. Factors Needed To Take The XRP Price To $1,000 While it’s tempting to imagine XRP hitting a four-digit price target, X (formerly Twitter) crypto analyst Jasmin argues that the numbers don’t support such a prediction. For the XRP price to reach $1,000, it would need to climb as high as 46,848%, accompanied by key factors like a significant rise in global adoption, especially by financial institutions. Related Reading: XRP Price To $1,000: Analyst Reveals Target For When Banks Start Using XRP Although Ripple, a blockchain company, has made progress in partnering with global banks and fintech firms for cross-border payments, that level of adoption is still nowhere near enough to support a $1,000 XRP price tag. To even approach this level, XRP would need to become a fundamental part of the global financial structure across different sectors, particularly in banking, remittance, and investment. But beyond simple adoption, XRP would have to be deeply integrated into major economies in such a way that it becomes an indispensable currency for daily transactions. For this to happen, Jasmin reveals that the cryptocurrency would need widespread regulatory clarity to ensure that it can be used in multiple jurisdictions without any legal barriers. The ongoing legal battle between Ripple and the US SEC has already created years’ worth of uncertainty around XRP’s legal status. Until this issue is resolved favorably, the cryptocurrency’s potential for mainstream adoption remains limited. Jasmin has also highlighted that XRP would have to incorporate mechanisms that would drastically reduce its circulating supply. While the cryptocurrency’s price could grow with more aggressive token burns, a jump to $1,000 still seems unlikely. Such a high valuation would also need massive speculative trading activities, which are usually seen during bull markets. How Market Cap Influences A $1,000 Projection Based on Jasmin’s analysis, the most significant factor that makes a $1,000 XRP price projection unrealistic is its market capitalization. Currently, XRP has a market cap of about $125.15 billion, and for its price to hit a four-digit level, its total market valuation would need to reach $50 trillion. Related Reading: XRP Price Cross That Led To 20x Rally In 2017 Returns To put this in perspective, the global crypto market capitalization today is $3.09 trillion, according to CoinGecko data. This would mean that XRP alone would need a market cap over 15x higher than the entire crypto market. Furthermore, Bitcoin, the largest cryptocurrency, has never even come close to reaching a $10 trillion market cap. BTC’s market valuation currently sits at $1.92 trillion, meaning XRP would have to surpass it by over 25x to get a $50 trillion market cap. Due to these extreme market cap requirements, Jasmin argues that a $1,000 or even $10,000 target is highly unrealistic. However, she acknowledges that a price surge to $5 or even $10 is a far more attainable goal. Featured image from Getty Images, chart from Tradingview.com",XRP|bitcoin|Bitcoin Market Valuation|CoinGecko|Jasmin|Ripple|US SEC|xrp|xrp news|XRP Price|XRPUSD|xrpusdt,EN,0,0,BTC|MARKET|REGULATION|TRADING|XRP,"{'name': 'NewsBTC', 'img': 'https://images.cryptocompare.com/news/default/newsbtc.png', 'lang': 'EN'}",newsbtc,2025-05-07 23:30:35
33767162,[object Object],1746660644,https://resources.cryptocompare.com/news/13/33767162.jpeg,"Dogecoin’s Price Coils In A Key Bullish Chart Pattern, A Rebound On The Horizon?",https://bitcoinist.com/dogecoins-coils-bullish-pattern/,"During the recent bullish market action in late April, Dogecoin witnessed a notable upward movement, rising to the $0.18 mark with robust momentum and volume. However, the dog-themed meme coin seems to have lost its steam as it pulls back to key support levels, but technical developments are pointing to a potential rebound in the short term. Chart Pattern To Spark A Rally For Dogecoin? In the past few days, Dogecoin’s price has faced bearish pressure, causing it to revisit the $0.16 support level. After enduring a phase of price correction and diminishing upside momentum, DOGE is currently displaying a possible reversal signal. Trader Tardigrade, a crypto analyst and investor, has pointed out a positive trend in the Dogecoin chart that suggests a shift in price dynamics. Following his examination of the 1-day time frame chart, Trader Tardigrade unveiled a critical pattern, particularly the Diamond Bottom Reversal Formation. The emergence of this bullish pattern indicates that the ongoing DOGE correction is nearing its end. Looking at the chart, the meme coin previously tested the upper line of the pattern and failed, leading to a slight pullback. However, when a breakout finally occurs, the crypto expert has predicted a sharp rally to the $0.35 price level. A Diamond Bottom Reversal Formation is often called a bullish diamond pattern, which hints at a potential shift to an upward trend after a prolonged period of downward trend. It is distinguished by a symmetrical diamond-shaped pattern created by trendlines that converge, usually following a persistently negative activity. Since the diamond bottom formation implies a change in price toward the upside trajectory, it shows DOGE may be building momentum for another move. Thus, this key chart pattern could pave the way for a bounce to higher levels in the near term. In another technical analysis , Trader Tradigrade reported that crucial momentum indicators are flashing upward signals despite the current correction. One of these indicators is the Dogecoin Price Momentum Oscillator (PMO), which measures the rate of change in a price over a specific period. It helps to determine trend reversals or overbought/oversold conditions. Trader Tardigrade highlighted an impending bullish crossover in the PMO indicator, “turning into green time.” A change in the PMO indicator to green time suggests a phase of positive price movements for DOGE. DOGE To Trigger A Meme Coin Frenzy Despite ongoing corrections, optimism in Dogecoin remains strong in the community. Kamran Ashgar, a crypto trader, highlighted that DOGE is waking up, building strength for a price recovery as indicated by the Relative Strength Index (RSI). When DOGE makes a bullish move, the analyst believes that other meme coins could follow suit, sparking a memecoin mania . His prediction is based on a 28-day trend, which suggests that the meme coin is about to break out of the trend. According to Ashgar, “this is not just a breakout, it is a signal” of upside movements.",Dogecoin|Diamond Bottom Reversal Formation|Doge|DOGE news|doge price|dogecoin|Dogecoin news|dogecoin price|Dogecoin Price Momentum Oscillator|dogeusd|dogeusdt|Kamran Ashgar|meme coin|Memecoin Mania|PMO|Trader Tardigrade,EN,0,0,AAVE|ADA|ALTCOIN|ASIA|ATOM|AVAX|AXS|BCH|BLOCKCHAIN|BTC|BUSINESS|COMMODITY|DOGE|DOT|ETC|ETH|EXCHANGE|FIAT|FIL|LINK|LTC|LUNA|LUNC|MANA|MARKET|MATIC|MINING|REGULATION|SHIB|SOL|SPONSORED|TECHNOLOGY|TRADING|TRX|UNI|USDT|WALLET|XLM|XMR|XRP|XTZ|ZEC|ZRX|OTHER|RESEARCH|APT|ARB|BITTENSOR|BNB|CRO|WIF|FDUSD|HBAR|ICP|IMX|INJ|LDO|MNT|NEAR|NOT|PEPE|SUI|TON|USDC|AR|FLOKI|ONDO|BGB|BONK|RUNE|FET|PYTH|SEI|FLR|JUP|BSV|AGX|ENS|ZK|WLD|XAUT|CAKE|OM|APE|HNT|XDC|FTT|BTG|PEOPLE|MOG|PYUSD|AXL|MEME|RAY|SSV|ARKM|ETHFI|MX|AIRDROP|TOKEN SALE|FORKS|TOKEN LISTING AND DELISTING|ADMINISTRATIVE EVENTS,"{'name': 'Bitcoinist', 'img': 'https://images.cryptocompare.com/news/default/bitcoinist.png', 'lang': 'EN'}",bitcoinist,2025-05-07 23:30:44
44299420,https://en.coinotag.com/breakingnews/donald-trump-promises-historic-tax-cuts-for-middle-class-and-working-class-americans/,1746660813,https://resources.cryptocompare.com/news/77/44299420.jpeg,Donald Trump Promises Historic Tax Cuts for Middle Class and Working-Class Americans,https://en.coinotag.com/breakingnews/donald-trump-promises-historic-tax-cuts-for-middle-class-and-working-class-americans/,"On May 8th, 2023, former President Donald Trump announced via his social media platform, Truth Social, ambitious proposals aimed at reshaping the economic landscape. He emphasized significant reforms in tax",,EN,0,0,REGULATION,"{'name': 'CoinOtag', 'img': 'https://resources.cryptocompare.com/news/77/default.png', 'lang': 'EN'}",coinotag,2025-05-07 23:33:33
44300489,https://coinedition.com/?p=641040,1746661608,https://resources.cryptocompare.com/news/7/default.png,"Doodles’ $DOOD Token Launches May 9 on Solana, Gets Binance Futures Listing",https://coinedition.com/doodles-dood-token-solana-launch-binance-listing-airdrop/,"$DOOD launches May 9 on Solana with 68% supply to Doodles holders, partners, and growth fund users Binance to list $DOOD perpetual contracts with 50x leverage, boosting visibility after TGE event Doodles’ token debut reinforces Solana’s lead as hub for NFT, meme, and utility token launches A few hours ago, Doodles announced the upcoming launch of their token $DOOD on Solana on May 9. This is just another highlight of Solana’s increasing pull for major NFT and meme coin projects seeking high liquidity and strong network effects. Adding immediate visibility, Binance Futures also announced it will list $DOOD perpetual contracts shortly after the launch. $DOOD Launch Details: Supply, Allocation, and Airdrop Based on details shared in a Doodles X post back in February, $DOOD will launch with a supply of 10 billion on Solana, with 68% of that to be allocated to the community. This is then divided into 30% to existing Doodles NFT holders, 25% to the ecosystem fund for growth and development, and 13% to partner communities, including Bonk, Solana Mobile, and Helius. Eligible participants can claim their airdropped tokens within 77 days following the Tok… The post Doodles’ $DOOD Token Launches May 9 on Solana, Gets Binance Futures Listing appeared first on Coin Edition .",CoinMarketCap Feed|Market|Market News|News|Top Crypto News|Altcoin News|Meme Coin News|Solana (SOL),EN,0,0,EXCHANGE|MARKET|SOL|ZRX|BNB,"{'name': 'Coin Edition', 'img': 'https://resources.cryptocompare.com/news/7/default.png', 'lang': 'EN'}",coinquora,2025-05-07 23:46:48
44299923,https://bitcoinworld.co.in/?p=158218,1746661810,https://resources.cryptocompare.com/news/82/default.png,UBS Forecast: USD/ZAR Could Plummet on Rising Risk Appetite,https://bitcoinworld.co.in/usd-zar-ubs-forecast/,"For those tracking global markets, including the dynamic world of cryptocurrency, shifts in major currency pairs like the USD/ZAR can offer valuable insights into broader economic sentiment. Recent analysis from UBS suggests a notable potential movement for this pair, indicating that conditions are aligning for the US Dollar to weaken against the South African Rand. This outlook is significantly tied to increasing trade deal optimism and a corresponding rise in global investor risk appetite . What is Driving the UBS Forecast on USD/ZAR? UBS analysts point to specific factors underpinning their view that the USD/ZAR exchange rate may decline. A lower USD/ZAR rate means it takes fewer US Dollars to buy one South African Rand, effectively indicating a strengthening ZAR relative to the USD. The primary drivers identified are: Trade Deal Progress: Positive developments or the anticipation of favorable outcomes in major international trade negotiations tend to reduce global economic uncertainty. This encourages investors to move away from traditional safe-haven assets, like the US Dollar, towards currencies associated with emerging markets, such as the South African Rand. Increased Risk Appetite: When investor confidence is high and global economic prospects appear brighter, there is a greater willingness to take on more risk. Emerging market currencies and assets often benefit disproportionately from this shift, as they typically offer higher yields but also carry greater perceived risk. A surge in risk appetite directly supports the ZAR. These two factors are often intertwined. Successful trade talks signal improved global economic health, which in turn boosts confidence and encourages risk-taking in the Forex market and beyond. How Does Trade Deal Optimism Impact Emerging Markets? Emerging markets, like South Africa, are often highly sensitive to global trade flows and investor sentiment. Here’s why trade deal optimism is particularly impactful: Export Potential: Better trade relations can open up or expand export markets for South African goods, boosting economic activity and potentially improving the country’s trade balance. Foreign Investment: Reduced trade tensions create a more stable and predictable global environment, making emerging markets more attractive destinations for foreign direct investment and portfolio flows. This inflow of capital increases demand for the local currency (ZAR). Commodity Prices: Many emerging economies are significant commodity exporters. Improved global trade often correlates with stronger demand for commodities, pushing prices up. As a major exporter of minerals and other commodities, South Africa’s economy benefits from higher prices, which supports the Rand. This positive feedback loop reinforces the case for a stronger ZAR when trade prospects improve, influencing the USD/ZAR pair. Understanding the Role of Risk Appetite in Forex Risk appetite is a key metric for understanding capital flows in the Forex market . It describes the level of risk that investors are willing to take on. When risk appetite is high, investors seek higher returns, often found in assets perceived as riskier, such as: Emerging market currencies (like ZAR) Stocks in developing economies Certain commodities Conversely, when risk appetite is low (during periods of uncertainty or fear), investors flock to safe havens like: The US Dollar (often considered a primary safe haven) Japanese Yen Swiss Franc Government bonds from stable economies Gold The current environment, characterized by increasing trade deal optimism , is fostering higher risk appetite . This dynamic directly impacts the USD/ZAR pair, as capital flows move out of the safe-haven USD and into the higher-yielding, risk-sensitive ZAR. What Does a Weakening USD/ZAR Mean for the Market? A weakening USD/ZAR rate has several implications for different market participants: For South Africa: Makes imports cheaper (potentially reducing inflation). Makes exports more expensive for international buyers (could impact competitiveness unless commodity prices are rising). Attracts foreign investment seeking exposure to a strengthening currency and potentially higher local returns. Can improve the country’s external debt profile if denominated in USD. For USD Holders/Investors: Investments in ZAR-denominated assets become more valuable when converted back to USD. Travel to South Africa becomes less expensive. For the Forex Market: Increased trading activity around the USD/ZAR pair. Potential for volatility as sentiment shifts. May signal broader trends for other emerging market currencies against the USD. Are There Challenges or Risks to This Outlook? While the UBS forecast highlights the potential for USD/ZAR to weaken, it’s crucial to remember that Forex markets are influenced by numerous factors. Potential challenges or risks include: Reversal in Trade Optimism: Any breakdown or negative turn in trade negotiations could quickly reverse sentiment and strengthen the USD. Domestic Issues in South Africa: Local political instability, economic challenges (like power shortages or high unemployment), or changes in monetary policy by the South African Reserve Bank could negatively impact the ZAR regardless of global sentiment. Unexpected Global Events: Geopolitical shocks, new economic data from major economies (US inflation, Federal Reserve policy), or other unforeseen events can rapidly shift risk appetite and currency valuations. Commodity Price Volatility: While often linked to trade, commodity prices have their own dynamics and significant declines could hurt the ZAR. Therefore, while the current environment supports the UBS forecast , continuous monitoring of global and local developments is essential. Actionable Insights for Traders and Investors Given the UBS forecast and the factors at play, what should market participants consider? Monitor Trade Headlines: Keep a close eye on news related to major international trade negotiations. Positive headlines reinforce the trend; negative ones pose a risk. Track Risk Appetite Indicators: Observe broader market movements. Are stock markets rising globally? Are traditional safe havens like gold or the Yen weakening? These can be signs of increasing risk appetite . Analyze South African Fundamentals: Pay attention to South Africa’s economic data releases (inflation, growth, unemployment) and political developments. These domestic factors play a significant role in the ZAR’s strength. Consider Volatility: Emerging market currencies can be volatile. Risk management is crucial if trading the USD/ZAR pair. Look for Confirmation: While UBS has a view, look for analysis from other major banks and research institutions to see if there is a consensus forming in the Forex market . This environment driven by trade deal optimism and rising risk appetite presents potential opportunities but also requires careful analysis and awareness of potential pitfalls. In conclusion, UBS’s outlook for a potentially weaker USD/ZAR pair is strongly linked to the positive momentum generated by trade deal optimism and the resulting increase in global investor risk appetite . These factors create a favorable environment for emerging market currencies like the South African Rand. However, market participants must remain vigilant, as the complex interplay of global events, domestic conditions, and shifts in sentiment can quickly alter the trajectory of currency pairs in the volatile Forex market . To learn more about the latest Forex market trends, explore our article on key developments shaping currency valuations and institutional adoption.",Forex News|Forex|risk-appetite|Trade Deals|UBS|USDZAR,EN,0,0,BUSINESS|COMMODITY|FIAT|MARKET|TRADING,"{'name': 'Bitcoin World', 'img': 'https://resources.cryptocompare.com/news/82/default.png', 'lang': 'EN'}",bitcoinworld,2025-05-07 23:50:10
