id,guid,published_on,imageurl,title,url,body,tags,lang,upvotes,downvotes,categories,source_info,source,date
35930933,https://thecoinrise.com/xyz-draws-major-whale-attention-as-predicted-gains-reach-10000-could-it-outshine-wif-in-2025/,1731081624,https://resources.cryptocompare.com/news/60/35930933.jpeg,"XYZ Draws Major Whale Attention as Predicted Gains Reach 10,000% — Could It Outshine WIF in 2025?",https://thecoinrise.com/xyz-draws-major-whale-attention-as-predicted-gains-reach-10000-could-it-outshine-wif-in-2025/,"XYZ Draws Major Whale Attention as Predicted Gains Reach 10,000% — Could It Outshine WIF in 2025? The post XYZ Draws Major Whale Attention as Predicted Gains Reach 10,000% — Could It Outshine WIF in 2025? appeared first on TheCoinrise.com .",Token Presale and ICO Insights|XYZ,EN,0,0,WIF,"{'name': 'The Coin Rise', 'img': 'https://images.cryptocompare.com/news/default/thecoinrise.png', 'lang': 'EN'}",thecoinrise,2024-11-08 16:00:24
35930540,https://news.bitcoin.com/?p=683310&preview=true&preview_id=683310,1731081637,https://resources.cryptocompare.com/news/14/35930540.jpeg,"Bitcoin Price Keeps Rising: BTC Tops $75,000 and Pepe Unchained ICO Reaches $25.5 Million",https://news.bitcoin.com/bitcoin-price-keeps-rising-btc-tops-75000-and-pepe-unchained-ico-reaches-25-5-million/,"Bitcoin (BTC) smashed through $76,000 yesterday and has remained above this key threshold following Trump’s election win this week. Meanwhile, new meme coin project Pepe Unchained (PEPU) has just hit $25.5 million in its ICO – with investors rushing to secure discounted tokens. Bitcoin Posts New All-Time High as Trading Volumes Explode to $59B Bitcoin’s",Branded Spotlight,EN,0,0,BTC|TOKEN SALE|TRADING|BUSINESS,"{'name': 'Bitcoin.com', 'img': 'https://images.cryptocompare.com/news/default/bitcoincom.png', 'lang': 'EN'}",bitcoin.com,2024-11-08 16:00:37
35930499,https://en.coin-turk.com/?p=172679,1731081644,https://resources.cryptocompare.com/news/79/35930499.jpeg,"Solana Price Poised to Reach $500, as This AI Altcoin Is Set to Make 350% if SOL Reaches $200",https://en.coin-turk.com/solana-price-poised-to-reach-500-as-this-ai-altcoin-is-set-to-make-350-if-sol-reaches-200/,"Solana could be heading for a massive price increase, with some experts suggesting it might reach $500. At the same time, a specific AI-powered altcoin is expected to soar, potentially rising by 350% if Solana hits $200. Continue Reading: Solana Price Poised to Reach $500, as This AI Altcoin Is Set to Make 350% if SOL Reaches $200 The post Solana Price Poised to Reach $500, as This AI Altcoin Is Set to Make 350% if SOL Reaches $200 appeared first on COINTURK NEWS .",Sponsored Article,EN,0,0,SOL|ALTCOIN|TRADING,"{'name': 'CoinTurk News', 'img': 'https://resources.cryptocompare.com/news/79/default.png', 'lang': 'EN'}",cointurken,2024-11-08 16:00:44
35930936,https://thecoinrise.com/chatgpt-reveals-5-altcoins-set-to-deliver-huge-profits-by-the-end-of-november/,1731081726,https://resources.cryptocompare.com/news/60/35930936.jpeg,ChatGPT Reveals 5 Altcoins Set to Deliver Huge Profits by the End of November!,https://thecoinrise.com/chatgpt-reveals-5-altcoins-set-to-deliver-huge-profits-by-the-end-of-november/,ChatGPT Reveals 5 Altcoins Set to Deliver Huge Profits by the End of November! The post ChatGPT Reveals 5 Altcoins Set to Deliver Huge Profits by the End of November! appeared first on TheCoinrise.com .,Token Presale and ICO Insights|XYZ,EN,0,0,ALTCOIN,"{'name': 'The Coin Rise', 'img': 'https://images.cryptocompare.com/news/default/thecoinrise.png', 'lang': 'EN'}",thecoinrise,2024-11-08 16:02:06
35930564,https://coinpedia.org/?p=377647,1731081776,https://images.cryptocompare.com/news/default/coinpedia.png,BlackRock’s IBIT Surpasses Its Gold ETF In Assets Under Management,https://coinpedia.org/crypto-live-news/blackrocks-ibit-surpasses-its-gold-etf-in-assets-under-management/,"The post BlackRock’s IBIT Surpasses Its Gold ETF In Assets Under Management appeared first on Coinpedia Fintech News Amidst the market optimism around Bitcoin and the broader market, BlackRock’s iShares Bitcoin Trust (IBIT) has surpassed its Gold ETF counterpart, the iShares Gold Trust (IAU), in assets under management (AUM). Notably, IBIT has amassed around $33.1 billion in AUM, while IAU currently holds about $32.9 billion worth of assets. The surge in IBIT’s assets …",Crypto Live News|Bitcoin ETF,EN,0,0,FIAT|BTC|MARKET,"{'name': 'coinpedia', 'img': 'https://images.cryptocompare.com/news/default/coinpedia.png', 'lang': 'EN'}",coinpedia,2024-11-08 16:02:56
35930938,https://thecoinrise.com/top-traders-are-quietly-accumulating-xyz-and-mew-is-this-the-next-100x-gem/,1731081831,https://resources.cryptocompare.com/news/60/35930938.jpeg,Top Traders Are Quietly Accumulating XYZ and MEW — Is This the Next 100x Gem?,https://thecoinrise.com/top-traders-are-quietly-accumulating-xyz-and-mew-is-this-the-next-100x-gem/,Top Traders Are Quietly Accumulating XYZ and MEW — Is This the Next 100x Gem? The post Top Traders Are Quietly Accumulating XYZ and MEW — Is This the Next 100x Gem? appeared first on TheCoinrise.com .,Token Presale and ICO Insights|XYZ,EN,0,0,ZRX,"{'name': 'The Coin Rise', 'img': 'https://images.cryptocompare.com/news/default/thecoinrise.png', 'lang': 'EN'}",thecoinrise,2024-11-08 16:03:51
35930788,https://cointelegraph.com/news/9-3-b-stablecoin-exchange-inflows-traders-higher-bitcoin-prices,1731081924,https://images.cryptocompare.com/news/default/cointelegraph.png,$9.3B stablecoin exchange inflows have traders bracing higher Bitcoin prices,https://cointelegraph.com/news/9-3-b-stablecoin-exchange-inflows-traders-higher-bitcoin-prices?utm_source=rss_feed&utm_medium=rss&utm_campaign=rss_partner_inbound,"Stablecoin inflows to exchanges spike and Bitcoin price hits a new all-time just below $77,000 as investors prepare for a new crypto era under Trump’s presidency.",2024 US presidential election|Bitcoin|crypto rally|crypto bull run|markets|market analysis|Donald Trump|BTC price,EN,0,0,BTC|MARKET|EXCHANGE|BUSINESS|TRADING,"{'name': 'CoinTelegraph', 'img': 'https://images.cryptocompare.com/news/default/cointelegraph.png', 'lang': 'EN'}",cointelegraph,2024-11-08 16:05:24
35930775,https://en.coin-turk.com/?p=172711,1731082025,https://resources.cryptocompare.com/news/79/35930775.jpeg,Bitcoin and Major Altcoins Experience Significant Price Movements,https://en.coin-turk.com/bitcoin-and-major-altcoins-experience-significant-price-movements/,"Bitcoin price reaches record highs, maintaining market optimism. Cardano and Solana show significant price movements with bullish targets. Continue Reading: Bitcoin and Major Altcoins Experience Significant Price Movements The post Bitcoin and Major Altcoins Experience Significant Price Movements appeared first on COINTURK NEWS .",Technical Analysis,EN,0,0,TRADING|BTC|ALTCOIN|ADA|MARKET,"{'name': 'CoinTurk News', 'img': 'https://resources.cryptocompare.com/news/79/default.png', 'lang': 'EN'}",cointurken,2024-11-08 16:07:05
35930955,https://www.cryptopolitan.com/?p=611119,1731082033,https://resources.cryptocompare.com/news/43/35930955.jpeg,Empowering Users in Blockchain: DOP’s Selective Transparency Brings True Data Ownership to Decentralized Tech,https://www.cryptopolitan.com/empowering-users-in-blockchain-dops-selective-transparency-brings-true-data-ownership-to-decentralized-tech/,"Blockchain is perhaps the most progressive tech paradigm to emerge in recent history. It has helped make transactions and storage decentralized, intermediary-free, democratic, equitable, and inclusive. All these have resulted in low-cost transactions as well. However, for any emerging technology that deals with user data, privacy is pivotal to success. At its core, privacy means",Press Release,EN,0,0,BLOCKCHAIN|TECHNOLOGY,"{'name': 'Cryptopolitan', 'img': 'https://images.cryptocompare.com/news/default/cryptopolitan.png', 'lang': 'EN'}",cryptopolitan,2024-11-08 16:07:13
35930822,https://en.coinotag.com/solanas-market-cap-surge-can-sol-sustain-momentum-amid-rising-volatility/,1731082074,https://resources.cryptocompare.com/news/77/35930822.jpeg,Solana’s Market Cap Surge: Can SOL Sustain Momentum Amid Rising Volatility?,https://en.coinotag.com/solanas-market-cap-surge-can-sol-sustain-momentum-amid-rising-volatility/,Solana’s remarkable rise in market capitalization to $94.04 billion is stirring debates about its capability to maintain this momentum amidst increasing volatility. The cryptocurrency’s recent achievements may point towards ongoing,News|SOL,EN,0,0,SOL|MARKET,"{'name': 'CoinOtag', 'img': 'https://resources.cryptocompare.com/news/77/default.png', 'lang': 'EN'}",coinotag,2024-11-08 16:07:54
35930852,https://finbold.com/?p=211726,1731082144,https://images.cryptocompare.com/news/default/finbold.png,Here’s what happened to Ripple’s prepared ‘largest XRP dump’ in 7 years,https://finbold.com/heres-what-happened-to-ripples-prepared-largest-xrp-dump-in-7-years/,"On November 1, Ripple unlocked 1 billion XRP and prepared its potential largest dump in seven years, as Finbold reported. … Continue reading The post Here’s what happened to Ripple’s prepared ‘largest XRP dump’ in 7 years appeared first on Finbold .",Cryptocurrency news|November|Ripple|sell off|token unlock|XRP,EN,0,0,XRP,"{'name': 'Finbold', 'img': 'https://images.cryptocompare.com/news/default/finbold.png', 'lang': 'EN'}",finbold,2024-11-08 16:09:04
35933909,https://zycrypto.com/?p=97315,1731085752,https://images.cryptocompare.com/news/default/zycrypto.png,"Solana’s Price Jumps Above $200 As Bitcoin Nails New All-Time High Near $77,000",https://zycrypto.com/solanas-price-jumps-above-200-as-bitcoin-nails-new-all-time-high-near-77000/,"The price of Solana’s native token SOL has been on a tear, leading gains among the crypto majors this week following Donald Trump’s historic win on Wednesday.",Cryptocurrency|News|Bitcoin News|SOL|Solana,EN,0,0,SOL|TRADING|BTC,"{'name': 'ZyCrypto', 'img': 'https://images.cryptocompare.com/news/default/zycrypto.png', 'lang': 'EN'}",zycrypto,2024-11-08 17:09:12
35934324,https://timestabloid.com/?p=49375,1731085758,https://resources.cryptocompare.com/news/67/default.png,"“XRP Unleashed” Producer to Change Title to “Rigged, Exposing the SEC’s War on Crypto”",https://timestabloid.com/xrp-unleashed-producer-to-change-title-to-rigged-exposing-the-secs-war-on-crypto/,"Fruition Productions, the company behind the documentary “XRP Unleashed,” revealed on X that it is considering renaming its documentary to “RIGGED: Exposing the SEC’s War on Crypto” to reach a wider audience. The decision comes after feedback during the world premiere at the American Film Market indicating limited public awareness of XRP beyond the cryptocurrency The post “XRP Unleashed” Producer to Change Title to “Rigged, Exposing the SEC’s War on Crypto” appeared first on Times Tabloid .",Cryptocurrency|News|Ripple|Ripple-SEC Case|SEC|XRP,EN,0,0,XRP|REGULATION|MARKET,"{'name': 'TimesTabloid', 'img': 'https://resources.cryptocompare.com/news/67/default.png', 'lang': 'EN'}",timestabloid,2024-11-08 17:09:18
35933549,https://en.coinotag.com/potential-ethereum-support-at-2899-could-shape-future-price-trends-amid-increased-whale-activity/,1731085772,https://resources.cryptocompare.com/news/77/35933549.jpeg,"Potential Ethereum Support at $2,899 Could Shape Future Price Trends Amid Increased Whale Activity",https://en.coinotag.com/potential-ethereum-support-at-2899-could-shape-future-price-trends-amid-increased-whale-activity/,"Ethereum’s recent 20% rally has brought renewed investor optimism as it hits a three-month high amid increasing whale activity. Significantly, whale accumulations among high-value Ethereum holders surged by 17% and",Analysis|Ethereum|News|ETH,EN,0,0,ETH|TRADING|MARKET|BUSINESS,"{'name': 'CoinOtag', 'img': 'https://resources.cryptocompare.com/news/77/default.png', 'lang': 'EN'}",coinotag,2024-11-08 17:09:32
35934503,https://coinedition.com/?p=542408,1731085800,https://resources.cryptocompare.com/news/7/default.png,El Salvador’s Bitcoin Gamble Pays Off Big Time: Nets $100M Yield in 24 Hours,https://coinedition.com/el-salvadors-bitcoin-gamble-pays-off-big-time-nets-100m-yield-in-24-hours/,"With Bitcoin trading at an all-time high, El Salvador is sitting on an unrealized profit of nearly $300 million from its Bitcoin investment strategy. Over the past two years, President Nayib Bukele has directed daily purchases of 722 BTC, acquiring them at an average price below $42,000. El Salvador’s decision to invest in Bitcoin through The post El Salvador’s Bitcoin Gamble Pays Off Big Time: Nets $100M Yield in 24 Hours appeared first on Coin Edition .",Market|Market News|News|Bitcoin|Bitcoin News|Cryptocurrency,EN,0,0,BTC|MARKET|TRADING|BUSINESS|REGULATION,"{'name': 'Coin Edition', 'img': 'https://resources.cryptocompare.com/news/7/default.png', 'lang': 'EN'}",coinquora,2024-11-08 17:10:00
35933679,https://en.bitcoinsistemi.com/?p=144703,1731085883,https://resources.cryptocompare.com/news/81/35933679.jpeg,3 Altcoins That Could Outperform Polkadot’s 500% Rally,https://en.bitcoinsistemi.com/3-altcoins-that-could-outperform-polkadots-500-rally/,"Polkadot’s recent surge caught the attention of many in the crypto world. Yet, there are other digital coins that might deliver even bigger returns. This article looks at three alternative cryptocurrencies that could surpass Polkadot’s impressive growth, offering exciting opportunities in the ever-changing crypto market. CYBRO Presale Climbs Past $4 Million: A One-in-a-Million DeFi Investment Continue Reading: 3 Altcoins That Could Outperform Polkadot’s 500% Rally",Sponsored,EN,0,0,DOT|ALTCOIN|TRADING|SPONSORED|MARKET,"{'name': 'BitcoinSistemi', 'img': 'https://resources.cryptocompare.com/news/81/default.png', 'lang': 'EN'}",bitcoinsistemi,2024-11-08 17:11:23
35933720,https://coinpedia.org/?p=377674,1731085973,https://images.cryptocompare.com/news/default/coinpedia.png,"Fed Rate Cut and Record Inflows into BTC and ETH ETFs, Top 3 RWAs Set to Rally",https://coinpedia.org/guest-post/fed-rate-cut-and-record-inflows-btc-eth-etfs-top-3-rwas-to-rally/,"The post Fed Rate Cut and Record Inflows into BTC and ETH ETFs, Top 3 RWAs Set to Rally appeared first on Coinpedia Fintech News Trump has secured US Presidency over Harris, bringing into power a pro-crypto government in the financial heart of the world. The crypto community expects great things; for instance, the Bitcoin Act is expected to be passed. Trump’s win is also serving as a catalyst for the next bull run, as evidenced by Bitcoin’s new ATH …",Guest Post,EN,0,0,BTC|TRADING|ETH,"{'name': 'coinpedia', 'img': 'https://images.cryptocompare.com/news/default/coinpedia.png', 'lang': 'EN'}",coinpedia,2024-11-08 17:12:53
35933911,https://zycrypto.com/?p=97318,1731085984,https://images.cryptocompare.com/news/default/zycrypto.png,Bitcoin Whales Move $132M Off Binance as “Bitcoin President” Trump Takes Office,https://zycrypto.com/bitcoin-whales-move-132m-off-binance-as-bitcoin-president-trump-takes-office/,"Though once skeptical of Bitcoin, Donald Trump gained strong support from the crypto community as a pro-crypto candidate in the 2024 U.S. presidential election.",Bitcoin|News|Bitcoin News,EN,0,0,BTC|BNB|EXCHANGE|REGULATION,"{'name': 'ZyCrypto', 'img': 'https://images.cryptocompare.com/news/default/zycrypto.png', 'lang': 'EN'}",zycrypto,2024-11-08 17:13:04
35933773,https://www.cryptoglobe.com/latest/2024/11/celebrating-the-success-of-zircuits-zrc-eigenlayer-fairdrop/,1731086021,https://resources.cryptocompare.com/news/2/35933773.jpeg,Celebrating the Success of Zircuit’s ZRC EigenLayer Fairdrop,https://www.cryptoglobe.com/latest/2024/11/celebrating-the-success-of-zircuits-zrc-eigenlayer-fairdrop/,"George Town, Grand Cayman, November 8th, 2024, Chainwire Zircuit, the chain where innovation meets security, is thrilled to announce the success of its EIGEN Fairdrop initiative. With a first-of-its-kind distribution of 2% of ZRC tokens to eligible EIGEN holders, Zircuit has introduced a model of fairness and inclusivity in the Ethereum staking ecosystem, underscoring a",Zircuit|Press Releases,EN,0,0,ETH,"{'name': 'CryptoGlobe', 'img': 'https://images.cryptocompare.com/news/default/cryptoglobe.png', 'lang': 'EN'}",cryptoglobe,2024-11-08 17:13:41
35933943,https://cointelegraph.com/news/tether-expands-oil-trading-45-m-transaction,1731086100,https://images.cryptocompare.com/news/default/cointelegraph.png,Tether expands into oil trading with $45M transaction,https://cointelegraph.com/news/tether-expands-oil-trading-45-m-transaction?utm_source=rss_feed&utm_medium=rss&utm_campaign=rss_partner_inbound,"Completed in October 2024, the deal facilitated the transport of 670,000 barrels of crude oil and marked Tether’s entry into the commodity trading market.",Tether|stablecoin|oil trade,EN,0,0,USDT|COMMODITY|TRADING|MARKET,"{'name': 'CoinTelegraph', 'img': 'https://images.cryptocompare.com/news/default/cointelegraph.png', 'lang': 'EN'}",cointelegraph,2024-11-08 17:15:00
35933857,https://en.coinotag.com/solanas-defi-sector-sees-growth-with-cbbtc-integration-and-tvl-surge/,1731086135,https://resources.cryptocompare.com/news/77/35933857.jpeg,Solana’s DeFi Sector Sees Growth with cbBTC Integration and TVL Surge,https://en.coinotag.com/solanas-defi-sector-sees-growth-with-cbbtc-integration-and-tvl-surge/,"Solana’s decentralized finance (DeFi) sector is experiencing unprecedented growth, driven by the recent launch of Wrapped Bitcoin by Coinbase. As the Total Value Locked (TVL) on the Solana blockchain skyrockets,",Bitcoin|News|BTC|DRIFT|ETH|JUP|SOL|WBTC,EN,0,0,SOL|BTC|ETH|JUP|BLOCKCHAIN,"{'name': 'CoinOtag', 'img': 'https://resources.cryptocompare.com/news/77/default.png', 'lang': 'EN'}",coinotag,2024-11-08 17:15:35
35934340,https://zycrypto.com/?p=97321,1731086335,https://images.cryptocompare.com/news/default/zycrypto.png,"Trump Victory Sending Bitcoin Price Past $90,000 As Crypto Markets Gain Super Bullish Steam",https://zycrypto.com/trump-victory-sending-bitcoin-price-past-90000-as-crypto-markets-gain-super-bullish-steam/,"Bitcoin (BTC) surged past $76,000 on Friday, November 8, reaching an all-time high as political certainty surrounding the U.S. presidential election provided a boost to the cryptocurrency. At the time of writing, Bitcoin was trading at $75,959, marking a 5.3% increase within 24 hours and bringing its market capitalization to $1.5 trillion. Notably, the surge",Bitcoin|News|Bitcoin News,EN,0,0,BTC|TRADING|MARKET,"{'name': 'ZyCrypto', 'img': 'https://images.cryptocompare.com/news/default/zycrypto.png', 'lang': 'EN'}",zycrypto,2024-11-08 17:18:55
35933944,https://coingape.com/?p=224210,1731086336,https://images.cryptocompare.com/news/default/coingape.png,Shiba Inu Price Eyes 300% Rally As SHIB Whale Activity Surges,https://coingape.com/shiba-inu-price-eyes-300-rally-as-shib-whale-activity-surges/,"The Shiba Inu price could rally as much as 300% as SHIB whale activity is on the rise, a bullish development for the second-largest meme coin by market cap. Other on-chain metrics also paint a bullish for SHIB and indicate that its bull run could begin anytime from now. Shiba Inu Price Eyes 300% Rally The post Shiba Inu Price Eyes 300% Rally As SHIB Whale Activity Surges appeared first on CoinGape .",24/7 Cryptocurrency News|Altcoin News|Meme Coins|SHIB|SHIB Price|shiba inu|Shiba Inu Price,EN,0,0,SHIB|TRADING|MARKET,"{'name': 'CoinGape', 'img': 'https://images.cryptocompare.com/news/default/coingape.png', 'lang': 'EN'}",coingape,2024-11-08 17:18:56
35934193,https://crypto.news/?p=14309231,1731086489,https://resources.cryptocompare.com/news/73/35934193.jpeg,California permanently cuts off BlockFi’s license over bad lending practices,https://crypto.news/california-permanently-cuts-off-blockfis-license-over-bad-lending-practices/,"The California Department of Financial Protection and Innovation has permanently revoked BlockFi’s lending license following its bankruptcy and regulatory issues. BlockFi, a crypto lending platform, collapsed in 2022 amid financial troubles tied to the downfall of crypto exchange FTX. BlockFi…",News|BlockFi|California|FTX,EN,0,0,EXCHANGE,"{'name': 'crypto.news', 'img': 'https://resources.cryptocompare.com/news/73/default.png', 'lang': 'EN'}",crypto_news,2024-11-08 17:21:29
35934071,https://crypto.news/?p=14309231,1731086489,https://resources.cryptocompare.com/news/74/35934071.jpeg,California permanently cuts off BlockFi’s license over bad lending practices,https://crypto.news/california-permanently-cuts-off-blockfis-license-over-bad-lending-practices/,"The California Department of Financial Protection and Innovation has permanently revoked BlockFi’s lending license following its bankruptcy and regulatory issues. BlockFi, a crypto lending platform, collapsed in 2022 amid financial troubles tied to the downfall of crypto exchange FTX. BlockFi…",News|BlockFi|California|FTX,EN,0,0,EXCHANGE,"{'name': 'nft.news', 'img': 'https://resources.cryptocompare.com/news/74/default.png', 'lang': 'EN'}",nft_news,2024-11-08 17:21:29
35934273,https://bitcoinworld.co.in/?p=96926,1731086695,https://resources.cryptocompare.com/news/82/default.png,Google Cloud’s New Initiatives to Empower Indian AI Startups,https://bitcoinworld.co.in/google-cloud-initiatives-indian-ai-startups/,"Google Cloud’s New Initiatives to Empower Indian AI Startups In a significant move to bolster the Indian AI startup ecosystem, Google Cloud has announced a series of new initiatives under its Google for Startups Cloud Program. Unveiled at the recent Google AI Startups Summit in Bengaluru, these initiatives provide financial backing, technical resources, and mentorship",AI News|Google Cloud Initiatives for Indian AI Startups,EN,0,0,TRADING,"{'name': 'Bitcoin World', 'img': 'https://resources.cryptocompare.com/news/82/default.png', 'lang': 'EN'}",bitcoinworld,2024-11-08 17:24:55
35934341,https://zycrypto.com/?p=97323,1731086833,https://images.cryptocompare.com/news/default/zycrypto.png,Dogecoin Could See Mysterious 1000% Jump Following Elon Musk’s Latest Remarks,https://zycrypto.com/dogecoin-could-see-mysterious-1000-jump-following-elon-musks-latest-remarks/,"Dogecoin saw a massive surge in value, jumping around 25.4% over the past 24 hours, briefly reaching $0.2, according to data from CoinMarketCap.",Cryptocurrency|News|Dogecoin|Elon Musk,EN,0,0,DOGE,"{'name': 'ZyCrypto', 'img': 'https://images.cryptocompare.com/news/default/zycrypto.png', 'lang': 'EN'}",zycrypto,2024-11-08 17:27:13
35934414,https://en.coinotag.com/ethereum-foundation-reports-970-million-treasury-with-majority-in-eth-amid-calls-for-financial-transparency/,1731086867,https://resources.cryptocompare.com/news/77/35934414.jpeg,Ethereum Foundation Reports $970 Million Treasury with Majority in ETH Amid Calls for Financial Transparency,https://en.coinotag.com/ethereum-foundation-reports-970-million-treasury-with-majority-in-eth-amid-calls-for-financial-transparency/,"The release of the Ethereum Foundation’s financial report underscores a significant reduction in its treasury, now totaling $970.2 million as of October 31. This marks a staggering 39% decline from",Ethereum|News|ETH,EN,0,0,ETH|REGULATION,"{'name': 'CoinOtag', 'img': 'https://resources.cryptocompare.com/news/77/default.png', 'lang': 'EN'}",coinotag,2024-11-08 17:27:47
35934417,https://en.coinotag.com/tom-lee-suggests-possibility-of-bitcoin-surpassing-100000-amid-diminishing-regulatory-concerns/,1731086939,https://resources.cryptocompare.com/news/77/default.png,"Tom Lee Suggests Possibility of Bitcoin Surpassing $100,000 Amid Diminishing Regulatory Concerns",https://en.coinotag.com/tom-lee-suggests-possibility-of-bitcoin-surpassing-100000-amid-diminishing-regulatory-concerns/,"In a bold forecast, Fundstrat’s Tom Lee suggests Bitcoin (BTC) could soar past the $100,000 mark this year amid a shifting regulatory landscape. Lee emphasizes that diminishing regulatory pressures could",Analysis|Bitcoin|News,EN,0,0,BTC|MARKET,"{'name': 'CoinOtag', 'img': 'https://resources.cryptocompare.com/news/77/default.png', 'lang': 'EN'}",coinotag,2024-11-08 17:28:59
35934525,https://coincu.com/291177-missed-ico-of-avalanche-heres-what-you-need,1731087000,https://resources.cryptocompare.com/news/96/35934525.jpeg,Missed ICO of Avalanche? Here’s What You Need to Know and Why This Crypto Coin Could Be Your Next Best Investment,https://coincu.com/291177-missed-ico-of-avalanche-heres-what-you-need,"For those who missed the initial coin offering (ICO) of Avalanche, it’s a reminder of just how rapidly promising blockchain projects can emerge and capture the market. Read original article on coincu.com",news|Press Releases|news|CMC|Avalanche ICO Missed? Why This Crypto Coin Could Be Your Best 2024 Investment|Avalanche: Missed the ICO? Here’s Why You Should Invest Now|Missed Avalanche ICO? Here’s Why This Coin Is Worth Considering for Your Portfolio|Missed the Avalanche ICO? Here’s Why It’s Still a Top Investment Opportunity|What You Need to Know About Avalanche and Why It’s a Strong Investment Choice,EN,0,0,TOKEN SALE|BLOCKCHAIN|MARKET,"{'name': 'Coincu', 'img': 'https://resources.cryptocompare.com/news/96/default.png', 'lang': 'EN'}",coincu,2024-11-08 17:30:00
35934549,https://blockworks.co/news/ethereum-devs-milestone-call,1731087000,https://images.cryptocompare.com/news/default/blockworks.png,Ethereum devs mark milestone ahead of Devcon,https://blockworks.co/news/ethereum-devs-milestone-call,Ethereum’s 200th ACD call brought updates on the Pectra upgrade and the new Mekong testnet — just in time for Devcon in Thailand,0xResearch Newsletter|DeFi,EN,0,0,ETH,"{'name': 'Blockworks', 'img': 'https://images.cryptocompare.com/news/default/blockworks.png', 'lang': 'EN'}",blockworks,2024-11-08 17:30:00
