id,guid,published_on,imageurl,title,url,body,tags,lang,upvotes,downvotes,categories,source_info,source,date
35903245,https://en.coinotag.com/bitcoin-sees-1-995-billion-surge-in-spot-etf-inflows-following-trumps-victory-announcement/,1731043586,https://resources.cryptocompare.com/news/77/35903245.jpeg,Bitcoin Sees $1.995 Billion Surge in Spot ETF Inflows Following Trump’s Victory Announcement,https://en.coinotag.com/bitcoin-sees-1-995-billion-surge-in-spot-etf-inflows-following-trumps-victory-announcement/,"As reported by COINOTAG News on November 8th, recent data from Farside Investors indicates a significant surge in *institutional interest* in cryptocurrency ETFs following the announcement of *Trump’s electoral victory*.",News|BTC|ETH,EN,0,0,BTC|ETH|BUSINESS,"{'name': 'CoinOtag', 'img': 'https://resources.cryptocompare.com/news/77/default.png', 'lang': 'EN'}",coinotag,2024-11-08 05:26:26
35903281,https://en.coinotag.com/mkr-whales-dominate-vote-to-maintain-sky-branding-amid-rebranding-controversy/,1731043719,https://resources.cryptocompare.com/news/77/35903281.jpeg,MKR Whales Dominate Vote to Maintain Sky Branding Amid Rebranding Controversy,https://en.coinotag.com/mkr-whales-dominate-vote-to-maintain-sky-branding-amid-rebranding-controversy/,"A significant governance vote within the Sky ecosystem has reaffirmed support for the Sky brand, despite a strong push to revert to the Maker name. The recent vote, held on",News|MKR,EN,0,0,MKR,"{'name': 'CoinOtag', 'img': 'https://resources.cryptocompare.com/news/77/default.png', 'lang': 'EN'}",coinotag,2024-11-08 05:28:39
35903282,https://en.coinotag.com/wonderfi-ceo-dean-skurka-released-after-kidnapping-incident-raising-concerns-over-crypto-related-crime-trends/,1731043780,https://resources.cryptocompare.com/news/77/35903282.jpeg,"WonderFi CEO Dean Skurka Released After Kidnapping Incident, Raising Concerns Over Crypto-Related Crime Trends",https://en.coinotag.com/wonderfi-ceo-dean-skurka-released-after-kidnapping-incident-raising-concerns-over-crypto-related-crime-trends/,The recent kidnapping of WonderFi’s CEO Dean Skurka raises serious concerns about security in the crypto sector amidst rising crime rates. This incident underscores the intersection of rising crypto values,Bitcoin|News|BTC,EN,0,0,BTC,"{'name': 'CoinOtag', 'img': 'https://resources.cryptocompare.com/news/77/default.png', 'lang': 'EN'}",coinotag,2024-11-08 05:29:40
35903421,https://news.bitcoin.com/?p=683161&preview=true&preview_id=683161,1731043817,https://resources.cryptocompare.com/news/14/35903421.jpeg,El Salvador Leader and Trump Discuss High Stakes: Dangerous Past and Future Strategy,https://news.bitcoin.com/el-salvador-leader-and-trump-discuss-high-stakes-dangerous-past-and-future-strategy/,"El Salvador’s President Nayib Bukele has shared details of his conversation with U.S. President-elect Donald Trump, touching on Trump’s victory, near-death experience, and their shared ambitions. El Salvador Leader and Trump’s Private Exchange: From Victory to a Brush With Deaths El Salvador’s President Nayib Bukele shared details of his phone conversation with U.S. President-elect Donald",Featured|Donald Trump|El Salvador,EN,0,0,REGULATION|SPONSORED|EXCHANGE,"{'name': 'Bitcoin.com', 'img': 'https://images.cryptocompare.com/news/default/bitcoincom.png', 'lang': 'EN'}",bitcoin.com,2024-11-08 05:30:17
35903416,https://coincu.com/291023-detroit-crypto-payments-to-be-accepted-for-taxes,1731043818,https://resources.cryptocompare.com/news/96/35903416.jpeg,Detroit Crypto Payments To Be Accepted For City Taxes,https://coincu.com/291023-detroit-crypto-payments-to-be-accepted-for-taxes,Detroit will become the largest U.S. city to accept crypto payments for taxes and fees through PayPal’s platform in mid-2025. Read original article on coincu.com,news|News|City Taxes|Crypto Payments|Detroit,EN,0,0,REGULATION,"{'name': 'Coincu', 'img': 'https://resources.cryptocompare.com/news/96/default.png', 'lang': 'EN'}",coincu,2024-11-08 05:30:18
35903335,https://www.newsbtc.com/?p=652107,1731043821,https://images.cryptocompare.com/news/default/newsbtc.png,$13 Million Bitcoin? Sounds ‘Bearish’: Expert Hints At Even Greater Heights Ahead,https://www.newsbtc.com/bitcoin-news/13-million-bitcoin-sounds-bearish-expert-hints-at-even-greater-heights-ahead/,"The recent presidential election has sent ripples through the cryptocurrency market, with Bitcoin prices reacting positively to Donald Trump’s victory over Kamala Harris. As Trump prepares to take office for a second term, his ongoing commitment to making the United States the “crypto capital of the world” has ignited bullish sentiment among investors, positioning Bitcoin at the center of his economic proposals. ‘$13 Million Bitcoin Price Target Is Bearish’ Dennis Porter, CEO and co-founder of the Satoshi Action Fund has been vocal about the implications of Trump’s win for Bitcoin and the broader cryptocurrency landscape. In a series of posts on social media platform X (formerly Twitter), Porter highlighted the potential for Bitcoin to experience significant price discoveries in the coming years. He emphasized that the election outcome signals a substantial shift in the political landscape regarding cryptocurrency. Porter stated that after the 2024 presidential election, it is “abundantly clear” that Bitcoin is a “winning issue,” claiming that opposing Bitcoin support is “political suicide,” with a forecast that the United States will lead on BTC. The Satoshi Act Fund CEO believes that as the global community comes to terms with this reality, a “dramatic” acceleration in Bitcoin adoption will follow. Related Reading: CNBC Projects Bitcoin Could Hit $100,000 Before Presidential Inauguration – Details In addition to Trump’s victory, the Republican Party has secured a majority in Congress, further enhancing the prospects for cryptocurrency legislation. Porter noted that over 250 members of Congress are now pro-Bitcoin, which could facilitate a more favorable regulatory environment for the crypto market to thrive. This newfound political support could lead to legislation clarifying regulations and encouraging innovation and investment in the digital asset sector. It could also pave the way for the approval and introduction of one of Trump’s key promises: to make BTC a strategic reserve asset for the country. One of Porter’s most striking comments came just 24 hours after the election when he suggested a forecast of $13 million per Bitcoin could be considered bearish. “Expect the unexpected,” he said, hinting at the possibility of even higher valuations for Bitcoin shortly. Extended Bull Run For BTC? In an update on social media, market expert Rekt Capital provided insights into BTC’s short-term price action. He highlighted the importance of a weekly candle close above $71,500, which could signal the start of a breakout from the current re-accumulation range. Rekt Capital notes that Bitcoin has been in a prolonged re-accumulation phase for over 200 days since the last Halving event, which occurred earlier this year in April. The expert points out that the historical trend suggests bullish sentiment, as Bitcoin’s cycle has dramatically reduced from an average of 260 days to just 13 days in the current post-Halving context. This reduction in cycle duration indicates that Bitcoin is in a slightly accelerated phase compared to previous cycles. However, the current rate of acceleration is not as steep as earlier in the year, particularly in March 2024, suggesting a stabilizing trend. Due to this extended consolidation period, Bitcoin has almost completely realigned with historical Halving cycles. Rekt believes this resynchronization could lead to a longer, more robust bull run than anticipated. Related Reading: Ethereum Price Rallies 10%: Will Bulls Push It Higher? In a related analysis, crypto analyst Ali Martinez speculates on the potential timing of the next market peak for Bitcoin. He highlights a historical pattern wherein Bitcoin typically reaches market tops 8 to 12 months after achieving a monthly close above its previous all-time high. Ali Martinez predicts that the next significant market top for the leading crypto could occur between July and November 2025 if this pattern holds. At the time of writing, BTC was trading at $75,100. Featured image from DALL-E, chart from TradingView.com",Bitcoin News|bitcoin|Bitcoin chart|Bitcoin news|bitcoin price|btc|btc price|btcusd|BTCUSDT|crypto|crypto analyst|crypto news,EN,0,0,BTC|TRADING|MARKET|REGULATION|BUSINESS,"{'name': 'NewsBTC', 'img': 'https://images.cryptocompare.com/news/default/newsbtc.png', 'lang': 'EN'}",newsbtc,2024-11-08 05:30:21
35903415,https://timestabloid.com/?p=49313,1731043921,https://resources.cryptocompare.com/news/67/default.png,"Ripple CEO to Donald Trump: Fire SEC Chair Gensler On Day 1, No Delays",https://timestabloid.com/ripple-ceo-to-donald-trump-fire-sec-chair-gensler-on-day-1-no-delays/,"Ripple CEO Brad Garlinhouse has congratulated Donald Trump for his victory in the U.S. Presidential election. The CEO expects Trump to hit the ground running as he emphasized several critical actions for the new administration’s first 100 days. Garlinghouse’s first point is the immediate dismissal of SEC Chairman Gary Gensler. “Fire Gensler. Day 1, no The post Ripple CEO to Donald Trump: Fire SEC Chair Gensler On Day 1, No Delays appeared first on Times Tabloid .",Cryptocurrency|News|Brad Garlinghouse|Donald Trump|Gary Gensler|Ripple|Ripple CEO|SEC,EN,0,0,REGULATION,"{'name': 'TimesTabloid', 'img': 'https://resources.cryptocompare.com/news/67/default.png', 'lang': 'EN'}",timestabloid,2024-11-08 05:32:01
35903528,https://coinpedia.org/?p=377252,1731044059,https://images.cryptocompare.com/news/default/coinpedia.png,Robinhood CLO To Become SEC’s Next Chairperson Under Trump Leadership,https://coinpedia.org/news/robinhood-clo-to-become-secs-next-chairperson-under-trump-leadership/,"The post Robinhood CLO To Become SEC’s Next Chairperson Under Trump Leadership appeared first on Coinpedia Fintech News With Donald Trump returning to the White House for a 2nd term, new changes may be on the horizon that could benefit the crypto industry. A major campaign promise from Trump was to replace Gary Gensler as the head of the U.S. (SEC) who has been strict on crypto regulations, with a more crypto-friendly leader. …",News,EN,0,0,REGULATION,"{'name': 'coinpedia', 'img': 'https://images.cryptocompare.com/news/default/coinpedia.png', 'lang': 'EN'}",coinpedia,2024-11-08 05:34:19
35903529,https://www.cryptointelligence.co.uk/?p=24393,1731044100,https://resources.cryptocompare.com/news/95/default.png,"Trump is Back (TRUMBACK) Solana Memecoin Will Explode 19,000% Before Exchange Listing, As SHIB and DOGE Lag",https://www.cryptointelligence.co.uk/trump-is-back-trumback-solana-memecoin-will-explode-19000-before-exchange-listing-as-shib-and-doge-lag/,"Trump is Back could turn early investors into multi-millionaires, like Shiba Inu (SHIB) and Dogecoin (DOGE) did. Trump is Back (TRUMBACK), a new Solana memecoin that was launched today, is set to explode over 19,000% in price in the coming days. This is because TRUMBACK is set to soon be listed on numerous crypto exchanges, according to reports. This will give the Solana memecoin exposure to millions of additional investors, who will pour funds into the coin and drive its price up. Currently, Trump is Back can only be purchased via Solana decentralized exchanges, like Jup.ag and Raydium.io, and early",Blockchain News|Crypto News Today,EN,0,0,SHIB|SOL|DOGE|EXCHANGE|BUSINESS,"{'name': 'CryptoIntelligence', 'img': 'https://resources.cryptocompare.com/news/95/default.png', 'lang': 'EN'}",cryptointelligence,2024-11-08 05:35:00
35903610,https://coinpedia.org/?p=377270,1731044161,https://images.cryptocompare.com/news/default/coinpedia.png,XRP Lawsuit Update: When Ripple vs SEC Will End? Legal Analyst Fred Rispoli’s Take,https://coinpedia.org/news/xrp-lawsuit-update-when-ripple-vs-sec-will-end-legal-analyst-fred-rispolis-take/,"The post XRP Lawsuit Update: When Ripple vs SEC Will End? Legal Analyst Fred Rispoli’s Take appeared first on Coinpedia Fintech News Donald Trump’s recent U.S. presidential election win has energized the cryptocurrency community, particularly regarding the SEC v. Ripple lawsuit. Legal analyst Fred Rispoli suggests that the case could see a settlement as early as March 2025 under Trump’s administration. Possibility of XRP Lawsuit Resolution, If? #xrpcommuity My thoughts on how @realDonaldTrump win changes @ripple appeal …",News|Ripple (XRP),EN,0,0,REGULATION|XRP,"{'name': 'coinpedia', 'img': 'https://images.cryptocompare.com/news/default/coinpedia.png', 'lang': 'EN'}",coinpedia,2024-11-08 05:36:01
35903636,https://en.coin-turk.com/?p=172581,1731044202,https://resources.cryptocompare.com/news/79/35903636.jpeg,Cryptocurrency Market Experiences Volatility with Key Insights,https://en.coin-turk.com/cryptocurrency-market-experiences-volatility-with-key-insights/,"The cryptocurrency market shows mixed movements today, with Bitcoin trading positively. Neiro becomes the top gainer, while Lido DAO faces significant losses. Continue Reading: Cryptocurrency Market Experiences Volatility with Key Insights The post Cryptocurrency Market Experiences Volatility with Key Insights appeared first on COINTURK NEWS .",Cryptocurrency News,EN,0,0,MARKET|LDO|BTC|TRADING,"{'name': 'CoinTurk News', 'img': 'https://resources.cryptocompare.com/news/79/default.png', 'lang': 'EN'}",cointurken,2024-11-08 05:36:42
35903748,https://cointelegraph.com/news/robinhood-legal-boss-trump-top-pick-sec-chair-reuters,1731044285,https://images.cryptocompare.com/news/default/cointelegraph.png,Robinhood legal boss is being considered for SEC chair shortlist: Report,https://cointelegraph.com/news/robinhood-legal-boss-trump-top-pick-sec-chair-reuters?utm_source=rss_feed&utm_medium=rss&utm_campaign=rss_partner_inbound,"Robinhood’s legal chief, Dan Gallagher, is reportedly one of the top picks to head the SEC under Trump, who promised to fire its current chair “on day one.”",dan Gallagher|trump|donald trump|sec|chair|gary gensler,EN,0,0,REGULATION,"{'name': 'CoinTelegraph', 'img': 'https://images.cryptocompare.com/news/default/cointelegraph.png', 'lang': 'EN'}",cointelegraph,2024-11-08 05:38:05
35903695,https://coinpedia.org/?p=377287,1731044349,https://images.cryptocompare.com/news/default/coinpedia.png,"Bitcoin ETF Inflows Hit Record $1.37B, Largest Ever",https://coinpedia.org/crypto-live-news/bitcoin-etf-inflows-hit-record-1-37b-largest-ever/,"The post Bitcoin ETF Inflows Hit Record $1.37B, Largest Ever appeared first on Coinpedia Fintech News As the crypto bull run began with Trump’s political win, the institutional support for Bitcoin surged. 11 U.S.-spot Bitcoin ETF recorded the biggest net inflow ever of $1.372 billion. The record has been broken after 167 days and was spearheaded by BlackRock’s IBIT, which witnessed the massive inflow of $1.169 billion yesterday. This is the …",Crypto Live News|Bitcoin ETF,EN,0,0,BTC|TRADING,"{'name': 'coinpedia', 'img': 'https://images.cryptocompare.com/news/default/coinpedia.png', 'lang': 'EN'}",coinpedia,2024-11-08 05:39:09
35903778,https://coinpedia.org/?p=377291,1731044433,https://images.cryptocompare.com/news/default/coinpedia.png,Binance and Coinbase See $9.3B Stablecoin Inflow,https://coinpedia.org/crypto-live-news/binance-and-coinbase-see-9-3b-stablecoin-inflow/,"The post Binance and Coinbase See $9.3B Stablecoin Inflow appeared first on Coinpedia Fintech News As the crypto bull run gains momentum, Binance and Coinbase, two major centralized cryptocurrency exchanges, receive a massive inflow of ERC-20 stablecoins. With a $9.3 billion inflow, this is one of the largest inflows in the crypto industry. Such large-scale entry of huge ERC-20 stablecoins was last seen in September 2020 and February 2021, coinciding …",Crypto Live News|Binance|Crypto news,EN,0,0,EXCHANGE|BNB|TRADING,"{'name': 'coinpedia', 'img': 'https://images.cryptocompare.com/news/default/coinpedia.png', 'lang': 'EN'}",coinpedia,2024-11-08 05:40:33
35903860,https://coinpedia.org/?p=377281,1731044462,https://images.cryptocompare.com/news/default/coinpedia.png,"Solana Competitor Confirms 5,607% Forecast, CoinMarketCap Debuts Increases Chances of Violent Rally",https://coinpedia.org/sponsored/propichain-coinmarketcap-listing-to-spark-violent-rally/,"The post Solana Competitor Confirms 5,607% Forecast, CoinMarketCap Debuts Increases Chances of Violent Rally appeared first on Coinpedia Fintech News Solana (SOL) has shaken pre-U.S. election premarket jitters with an explosive rally. The layer-1 blockchain could soon reach $200. However, investor attention has shifted to PropiChain (PCHAIN), a tokenized real estate platform recently listed on CoinMarketCap. The listing has cemented investors’ trust in the innovative project. The CoinMarketCap debut for PropiChain lays the ground for …",Sponsored,EN,0,0,SOL|TRADING|BUSINESS|SPONSORED|BLOCKCHAIN,"{'name': 'coinpedia', 'img': 'https://images.cryptocompare.com/news/default/coinpedia.png', 'lang': 'EN'}",coinpedia,2024-11-08 05:41:02
35903861,https://coinpedia.org/?p=377292,1731044480,https://images.cryptocompare.com/news/default/coinpedia.png,"Ethereum Whale Offloads $85M ETH, Realizes 810x ROI",https://coinpedia.org/crypto-live-news/ethereum-whale-offloads-85m-eth-realizes-810x-roi/,"The post Ethereum Whale Offloads $85M ETH, Realizes 810x ROI appeared first on Coinpedia Fintech News As the Ethereum price crosses $2900 per token, an Ethereum whale has begun to sell off its long-term holdings. The whale holds 398,891 ETH tokens worth $1.14 billion and has recently sold off a small chunk of its holdings. The recent sale of 29,897 ETH tokens for 84.87 million USDC was completed at an average …",Crypto Live News|Ethereum,EN,0,0,ETH|ZRX|TRADING|USDC,"{'name': 'coinpedia', 'img': 'https://images.cryptocompare.com/news/default/coinpedia.png', 'lang': 'EN'}",coinpedia,2024-11-08 05:41:20
35903902,https://en.coinotag.com/bitcoin-surges-past-76000-microstrategys-holdings-now-see-9-28-billion-unrealized-gain/,1731044545,https://resources.cryptocompare.com/news/77/35903902.jpeg,"Bitcoin Surges Past $76,000: MicroStrategy’s Holdings Now See $9.28 Billion Unrealized Gain",https://en.coinotag.com/bitcoin-surges-past-76000-microstrategys-holdings-now-see-9-28-billion-unrealized-gain/,"On November 8, Bitcoin’s price surged past the $76,000 mark, currently sitting at $76,084. This significant milestone has implications for institutional investors, with MicroStrategy now reporting an impressive unrealized gain",News|BTC,EN,0,0,BTC|BUSINESS|TRADING,"{'name': 'CoinOtag', 'img': 'https://resources.cryptocompare.com/news/77/default.png', 'lang': 'EN'}",coinotag,2024-11-08 05:42:25
35904077,https://en.coinotag.com/blackrocks-ishares-bitcoin-trust-sees-record-1-12-billion-net-inflows-amid-optimism-from-market-conditions-and-trumps-election-victory/,1731044734,https://resources.cryptocompare.com/news/77/35904077.jpeg,BlackRock’s iShares Bitcoin Trust Sees Record $1.12 Billion Net Inflows Amid Optimism from Market Conditions and Trump’s Election Victory,https://en.coinotag.com/blackrocks-ishares-bitcoin-trust-sees-record-1-12-billion-net-inflows-amid-optimism-from-market-conditions-and-trumps-election-victory/,"BlackRock’s iShares Bitcoin Trust (IBIT) has set a new benchmark in the cryptocurrency market, achieving a staggering net inflow of $1.12 billion. IBIT’s latest record underscores a significant shift in",News|BTC,EN,0,0,BTC|MARKET,"{'name': 'CoinOtag', 'img': 'https://resources.cryptocompare.com/news/77/default.png', 'lang': 'EN'}",coinotag,2024-11-08 05:45:34
35904076,https://coincu.com/291026-bitcoin-spot-etf-inflows-hit-record-1-376b-nov-7,1731044795,https://resources.cryptocompare.com/news/96/35904076.jpeg,Bitcoin Spot ETF Inflows Hit Record $1.376 Billion on Nov 7,https://coincu.com/291026-bitcoin-spot-etf-inflows-hit-record-1-376b-nov-7,"Bitcoin Spot ETF Inflows reach $1.376 billion on November 7, with BlackRock ETF IBIT seeing $1.12 billion, both setting new records on a historic day. Read original article on coincu.com",news|News,EN,0,0,BTC,"{'name': 'Coincu', 'img': 'https://resources.cryptocompare.com/news/96/default.png', 'lang': 'EN'}",coincu,2024-11-08 05:46:35
35904241,https://en.coinotag.com/dan-gallagher-of-robinhood-emerges-as-potential-sec-chair-candidate-under-trump-amid-ongoing-transition-discussions/,1731044971,https://resources.cryptocompare.com/news/77/35904241.jpeg,Dan Gallagher of Robinhood Emerges as Potential SEC Chair Candidate Under Trump Amid Ongoing Transition Discussions,https://en.coinotag.com/dan-gallagher-of-robinhood-emerges-as-potential-sec-chair-candidate-under-trump-amid-ongoing-transition-discussions/,"The possible appointment of Robinhood’s legal chief, Dan Gallagher, to lead the SEC highlights critical shifts ahead in U.S. financial regulation. This development has sparked significant interest within the crypto",News,EN,0,0,REGULATION,"{'name': 'CoinOtag', 'img': 'https://resources.cryptocompare.com/news/77/default.png', 'lang': 'EN'}",coinotag,2024-11-08 05:49:31
35905188,https://coinedition.com/?p=541675,1731045019,https://resources.cryptocompare.com/news/7/default.png,Crypto Advocacy Gains Traction: Ripple CEO Spotlights Pro-Crypto Voter Influence in U.S. Politics,https://coinedition.com/crypto-advocacy-gains-traction-ripple-ceo-spotlights-pro-crypto-voter-influence-in-u-s-politics/,"Brad Garlinghouse, CEO of Ripple, emphasized the growing influence of crypto voters in shaping U.S. elections. In a post on social media, he pointed to Massachusetts Senate race data as an example of this emerging trend. The contest between incumbent Senator Elizabeth Warren and Republican challenger John Deaton revealed surprising voting dynamics, particularly among those The post Crypto Advocacy Gains Traction: Ripple CEO Spotlights Pro-Crypto Voter Influence in U.S. Politics appeared first on Coin Edition .",Market|Market News|News|Cryptocurrency|ripple|XRP News,EN,0,0,MARKET|REGULATION,"{'name': 'Coin Edition', 'img': 'https://resources.cryptocompare.com/news/7/default.png', 'lang': 'EN'}",coinquora,2024-11-08 05:50:19
35904352,https://coinpedia.org/?p=377298,1731045125,https://images.cryptocompare.com/news/default/coinpedia.png,SEC’s Uyeda and Peirce Plan New Crypto Regulation Under Trump’s Leadership,https://coinpedia.org/news/secs-uyeda-and-peirce-plan-new-crypto-regulation-under-trumps-leadership/,"The post SEC’s Uyeda and Peirce Plan New Crypto Regulation Under Trump’s Leadership appeared first on Coinpedia Fintech News SEC Commissioner Mark Uyeda, known for his vocal criticism of the agency’s approach to crypto regulation, is backing President-elect Donald Trump’s pledge to end what many see as the Biden Administration’s anti-crypto crackdown. Uyeda, who joined the SEC in 2022, could assume the acting chair role when Trump takes office in January 2025. Speaking with …",News|Crypto Regulations,EN,0,0,REGULATION,"{'name': 'coinpedia', 'img': 'https://images.cryptocompare.com/news/default/coinpedia.png', 'lang': 'EN'}",coinpedia,2024-11-08 05:52:05
35904480,https://www.cryptonewsz.com/crypto-prices-surge-following-rate-cut-us-fed/,1731045246,https://images.cryptocompare.com/news/default/cryptonewsz.png,Crypto Prices Surge Following Rate Cut by the US Federal Reserve: Nov. 08 Update,https://www.cryptonewsz.com/crypto-prices-surge-following-rate-cut-us-fed/,"The global crypto market cap is down by 0.60%, hovering around $2.5 trillion with an FGI of 72…",,EN,0,0,MARKET|FIAT,"{'name': 'CryptoNewsZ', 'img': 'https://images.cryptocompare.com/news/default/cryptonewsz.png', 'lang': 'EN'}",cryptonewsz,2024-11-08 05:54:06
35904649,https://cointelegraph.com/news/bitcoin-all-time-highs-not-overheated-signals-crypto-analysts,1731045511,https://images.cryptocompare.com/news/default/cointelegraph.png,"Bitcoin shows no ‘overheated’ signals despite new highs, says analyst",https://cointelegraph.com/news/bitcoin-all-time-highs-not-overheated-signals-crypto-analysts?utm_source=rss_feed&utm_medium=rss&utm_campaign=rss_partner_inbound,"From a fundamental standpoint, Bitcoin is showing no signs of the asset overheating, according to Galaxy’s head of research.",CoinGlass|Galaxy Digital|Alex Thorn|Nansen|Aurelie Barthere,EN,0,0,BTC|RESEARCH,"{'name': 'CoinTelegraph', 'img': 'https://images.cryptocompare.com/news/default/cointelegraph.png', 'lang': 'EN'}",cointelegraph,2024-11-08 05:58:31
35904730,https://www.cryptoknowmics.com/news/?p=256383,1731045645,https://images.cryptocompare.com/news/default/cryptoknowmics.png,Hester Peirce Unlikely to Succeed Gensler as SEC Chair,https://www.cryptoknowmics.com/news/hester-peirce-unlikely-to-succeed-gensler-as-sec-chair/?utm_source=rss&utm_medium=rss&utm_campaign=hester-peirce-unlikely-to-succeed-gensler-as-sec-chair,"In recent developments, SEC Commissioner Hester Peirce, known affectionately in the industry as “Crypto Mom” for her favorable stance on digital assets, has indicated she is not interested in taking over as SEC Chair. This news comes amid rumors of Gary Gensler’s imminent departure, creating a stir in the crypto and financial sectors. Dan Gallagher … Continue reading ""Hester Peirce Unlikely to Succeed Gensler as SEC Chair"" The post Hester Peirce Unlikely to Succeed Gensler as SEC Chair appeared first on Cryptoknowmics-Crypto News and Media Platform .",Altcoin News|Breaking News|Live Crypto News|News|Gensler as SEC Chair,EN,0,0,REGULATION,"{'name': 'Cryptoknowmics', 'img': 'https://images.cryptocompare.com/news/default/cryptoknowmics.png', 'lang': 'EN'}",cryptoknowmics,2024-11-08 06:00:45
