id,guid,published_on,imageurl,title,url,body,tags,lang,upvotes,downvotes,categories,source_info,source,date
35885582,https://thecoinrise.com/which-cryptos-are-dominating-2024/,1731018041,https://resources.cryptocompare.com/news/60/35885582.jpeg,Which Cryptos Are Dominating 2024?,https://thecoinrise.com/which-cryptos-are-dominating-2024/,Which Cryptos Are Dominating 2024? The post Which Cryptos Are Dominating 2024? appeared first on TheCoinrise.com .,Token Presale and ICO Insights|Qubetics,EN,0,0,OTHER,"{'name': 'The Coin Rise', 'img': 'https://images.cryptocompare.com/news/default/thecoinrise.png', 'lang': 'EN'}",thecoinrise,2024-11-07 22:20:41
35884252,https://www.cryptointelligence.co.uk/?p=24389,1731018060,https://resources.cryptocompare.com/news/95/default.png,"Dogecoin and BONK Rival Memecoin Donald Beats Kamala to Rally 16,000% Ahead of First Exchange Listing",https://www.cryptointelligence.co.uk/dogecoin-and-bonk-rival-memecoin-donald-beats-kamala-to-rally-16000-ahead-of-first-exchange-listing/,"Donald Beats Kamala could turn early investors into multi-millionaires, like other memecoins, such as Shiba Inu (SHIB) and Dogecoin (DOGE), did. Donald Beats Kamala (DONALKAM), a Solana memecoin launched today, is set to explode over 16,000% in price in the coming days. This is because DONALKAM is set to soon be listed on numerous crypto exchanges, according to reports. This will give the Solana memecoin exposure to millions of additional investors, who will pour funds into the coin and cause its price to rally, which will benefit investors who buy before these new exchange listings. Currently, Donald Beats Kamala can",Blockchain News|Crypto News Today,EN,0,0,TRADING|DOGE|EXCHANGE|BONK|SHIB,"{'name': 'CryptoIntelligence', 'img': 'https://resources.cryptocompare.com/news/95/default.png', 'lang': 'EN'}",cryptointelligence,2024-11-07 22:21:00
35884224,https://www.newsbtc.com/?p=652130,1731018096,https://images.cryptocompare.com/news/default/newsbtc.png,"Bitcoin Hits $76,000 All-Time High As Market Reacts To Fed’s Interest Rate Cuts",https://www.newsbtc.com/breaking-news-ticker/bitcoin-hits-76000-all-time-high-as-market-reacts-to-feds-interest-rate-cuts/,"Bitcoin (BTC), the leading cryptocurrency by market capitalization, surged to a new all-time high of $76,800 buoyed by the recent US presidential election which saw Donald Trump secure another term in the White House and a more favorable monetary policy from the US Federal Reserve (Fed). Fed’s Second Consecutive Rate Cut On Thursday, the Federal Reserve announced its decision to cut its benchmark overnight lending rate by 25 basis points to a target range of 4.50%-4.75%, adding to the bullish sentiment surrounding crypto prices. This marks the second consecutive rate cut, following a half-percentage point reduction in September. The unanimous vote at this meeting, which included participation from Governor Michelle Bowman, reflects a shift in the Fed’s approach to balancing inflation control with labor market support. Related Reading: CNBC Projects Bitcoin Could Hit $100,000 Before Presidential Inauguration – Details In its post-meeting statement, the Federal Open Market Committee (FOMC) noted a revised assessment of economic risks, indicating that the outlook for achieving employment and inflation goals is now seen as balanced, a departure from the previous month’s more optimistic stance. Crypto analyst Doctor Profit commented on the recent surge in both stock and crypto markets, suggesting that the price increases were in anticipation of the Fed’s rate cut. He predicts that continued rate cuts in the coming quarters could further drive up prices for both stocks and cryptocurrencies. Positive Trends For Bitcoin And Ethereum Post-Election In an exclusive interview with NewsBTC, Nansen’s Principal Research Analyst, Aurelie Barthere, highlighted that Bitcoin rise above its previous all-time high, coupled with high trading volumes, signals a strong positive momentum in the market. The analyst noted a period of “de-risking” in the run-up to the election, likely influenced by unfavorable polls for Trump, but observed a subsequent rush to “re-risk” as confidence returned following the election result, further evidenced by the rise in prices. Related Reading: Solana Breaks Above Key Resistance – Top Analyst Sets $300 Target Barthere also pointed out that the Republican victory in the House of Representatives could further amplify this rally. However, she cautioned that profit-taking may occur in the coming weeks as new policies are tested, particularly regarding the potential political pressure on the US SEC chair to step down. The analyst pointed out that Ethereum is also gaining traction as expectations rise for a resurgence in decentralized finance (DeFi). Barthere noted an interesting uptick in the ETH/BTC price ratio, accompanied by significant net inflows into Ethereum exchange-traded funds (ETFs), totaling $52 million on the day of the election results. The analyst suggests that these continued inflows into the recently approved ETF market are seen as indicative of broader retail interest in the second largest cryptocurrency, which she ultimately believes has yet to see significant adoption. At the time of writing, Bitcoin was trading at $76,629, up nearly 10% in the seven-day time frame. Similarly, ETH has also seen significant gains, rising 14% in the same period to reach a current price of $2,885. Featured image from DALL-E, chart from TradingView.com",Breaking News Ticker|bitcoin|Bitcoin chart|Bitcoin news|bitcoin price|bitcoin technical analysis|bitcoin trading|btc|btc price|btcusd|BTCUSDT|crypto|crypto analyst|crypto news,EN,0,0,MARKET|BTC|TRADING|ETH|BUSINESS,"{'name': 'NewsBTC', 'img': 'https://images.cryptocompare.com/news/default/newsbtc.png', 'lang': 'EN'}",newsbtc,2024-11-07 22:21:36
35884639,https://cointelegraph.com/magazine/asias-crypto-traders-celebrate-trumps-win-coinbase-expands-singapore-asia-express/,1731018291,https://images.cryptocompare.com/news/default/cointelegraph.png,"Asian crypto traders profit from Trump’s win, China’s 2025 CBDC deadline: Asia Express",https://cointelegraph.com/magazine/asias-crypto-traders-celebrate-trumps-win-coinbase-expands-singapore-asia-express/?utm_source=rss_feed&utm_medium=rss&utm_campaign=rss_partner_inbound,"Asian investors trade overnight to catch the Trump-fueled Bitcoin surge, China accelerates digital yuan push: Asia Express",Asia Express|Columns,EN,0,0,ASIA|BUSINESS|BTC,"{'name': 'CoinTelegraph', 'img': 'https://images.cryptocompare.com/news/default/cointelegraph.png', 'lang': 'EN'}",cointelegraph,2024-11-07 22:24:51
35884419,https://crypto.news/?p=14308461,1731018342,https://resources.cryptocompare.com/news/73/35884419.jpeg,What is a crypto swap in cryptocurrency?,https://crypto.news/what-is-crypto-swap/,"A token swap, or crypto swap, is like trading your favorite Pokemon cards with anyone you like online. But instead of trading cards, you can trade digital crypto assets in exchange for your favorite crypto tokens, often, without a conventional…",Learn|Crypto education|education,EN,0,0,TRADING|EXCHANGE,"{'name': 'crypto.news', 'img': 'https://resources.cryptocompare.com/news/73/default.png', 'lang': 'EN'}",crypto_news,2024-11-07 22:25:42
35884418,https://crypto.news/?p=14308461,1731018342,https://resources.cryptocompare.com/news/74/35884418.jpeg,What is a crypto swap in cryptocurrency?,https://crypto.news/what-is-crypto-swap/,"A token swap, or crypto swap, is like trading your favorite Pokemon cards with anyone you like online. But instead of trading cards, you can trade digital crypto assets in exchange for your favorite crypto tokens, often, without a conventional…",Learn|Crypto education|education,EN,0,0,TRADING|EXCHANGE,"{'name': 'nft.news', 'img': 'https://resources.cryptocompare.com/news/74/default.png', 'lang': 'EN'}",nft_news,2024-11-07 22:25:42
35884642,https://cryptopotato.com/?p=369509,1731018597,https://resources.cryptocompare.com/news/27/35884642.jpeg,Wintermute Pushes for Ethena Fee Switch to Benefit sENA Token Holders,https://cryptopotato.com/wintermute-pushes-for-ethena-fee-switch-to-benefit-sena-token-holders/,"To ensure sENA holders benefit from Ethena's revenue, Wintermute proposed a fee switch framework.",AA News|Crypto News|Stablecoins,EN,0,0,BUSINESS,"{'name': 'Crypto Potato', 'img': 'https://images.cryptocompare.com/news/default/cryptopotato.png', 'lang': 'EN'}",cryptopotato,2024-11-07 22:29:57
35884646,https://news.bitcoin.com/?p=683039&preview=true&preview_id=683039,1731018610,https://resources.cryptocompare.com/news/14/35884646.jpeg,"Mastercard’s Pay Local Launches, Connecting 2 Billion Users to 35 Million Merchants",https://news.bitcoin.com/mastercards-pay-local-launches-connecting-2-billion-users-to-35-million-merchants/,"Mastercard’s Pay Local is set to transform digital payments globally, connecting 2 billion users with 35 million merchants. Mastercard Pay Local Unlocks Global Reach: 2 Billion Users, 35 Million Merchants Payment giant Mastercard announced on Monday the launch of Pay Local, a global service designed to expand the reach of digital wallets by providing access",Finance|MasterCard|Pay Local,EN,0,0,OTHER,"{'name': 'Bitcoin.com', 'img': 'https://images.cryptocompare.com/news/default/bitcoincom.png', 'lang': 'EN'}",bitcoin.com,2024-11-07 22:30:10
35884668,https://decrypt.co/?p=290718,1731018635,https://resources.cryptocompare.com/news/44/35884668.jpeg,Who is Most Likely to Replace Gary Gensler After Trump Win?,https://decrypt.co/290718/who-is-most-likely-to-replace-gary-gensler-after-trump-win,President-elect Donald Trump has promised to replace the agency figurehead that oversaw a regulatory onslaught against the crypto industry.,Law and Order,EN,0,0,OTHER,"{'name': 'Decrypt', 'img': 'https://images.cryptocompare.com/news/default/decrypt.png', 'lang': 'EN'}",decrypt,2024-11-07 22:30:35
35884672,https://coinpedia.org/?p=377243,1731018669,https://images.cryptocompare.com/news/default/coinpedia.png,"Chainlink (LINK) Analysis, Traders Eyes on $15",https://coinpedia.org/news/chainlink-link-analysis-traders-eyes-on-15/,"The post Chainlink (LINK) Analysis, Traders Eyes on $15 appeared first on Coinpedia Fintech News It appears that the bull market has officially begun, as the majority of cryptocurrencies are on the verge of a breakout. Today, on November 8, 2024, Chainlink (LINK) looks bullish, having formed a bullish price action pattern and being on the verge of a breakout. Chainlink (LINK) Technical Analysis and Key Levels On a daily …",News|Crypto news|Cryptocurrency|Price Analysis,EN,0,0,LINK|MARKET|TRADING,"{'name': 'coinpedia', 'img': 'https://images.cryptocompare.com/news/default/coinpedia.png', 'lang': 'EN'}",coinpedia,2024-11-07 22:31:09
35885528,https://www.cryptopolitan.com/?p=610719,1731019225,https://resources.cryptocompare.com/news/43/35885528.jpeg,Astro Bot launches verticle speedrun challenge,https://www.cryptopolitan.com/astro-bot-launches/,Asrto Bot has included a verticle speedrun level aka Helium Heights. the consistent updates are keeping the players engaged as one of the most favorite games of 2024. Sony announced a new speedrun level for Astro Bot called Helium Heights with a video. 🚨 New Astro Bot Speedrun Klaxon 🚨 Helium Heights is now live,Gaming|Astro Bot,EN,0,0,OTHER,"{'name': 'Cryptopolitan', 'img': 'https://images.cryptocompare.com/news/default/cryptopolitan.png', 'lang': 'EN'}",cryptopolitan,2024-11-07 22:40:25
35885383,https://coingape.com/?p=224056,1731019665,https://images.cryptocompare.com/news/default/coingape.png,Vladimir Putin Reveals BRICS Dollar Strategy Amid Donald Trump Policy Shifts,https://coingape.com/vladimir-putin-reveals-brics-dollar-strategy-amid-donald-trump-policy-shifts/,"Russian President Vladimir Putin addressed Russia’s position within the BRICS alliance regarding using the U.S. dollar. Contrary to the BRICS bloc’s ongoing de-dollarization efforts, Putin clarified that Russia is not planning to abandon the dollar entirely but will limit its use as a settlement currency. Describing the dollar as a “pillar of U.S. power,” Putin The post Vladimir Putin Reveals BRICS Dollar Strategy Amid Donald Trump Policy Shifts appeared first on CoinGape .",24/7 Cryptocurrency News|BRICS|donald trump|Vladimir Putin,EN,0,0,FIAT|REGULATION,"{'name': 'CoinGape', 'img': 'https://images.cryptocompare.com/news/default/coingape.png', 'lang': 'EN'}",coingape,2024-11-07 22:47:45
35885912,https://crypto.news/?p=14308949,1731020369,https://resources.cryptocompare.com/news/74/35885912.jpeg,How many cryptocurrencies are there? A growing industry,https://crypto.news/how-many-cryptocurrencies-are-there/,"The first cryptocurrency appeared in 2009, and today, its name is known by almost everyone — Bitcoin. What made it so intriguing was the promise of a new kind of money: no government interference, full privacy, and everyone having the…",Learn|Crypto assets,EN,0,0,BTC,"{'name': 'nft.news', 'img': 'https://resources.cryptocompare.com/news/74/default.png', 'lang': 'EN'}",nft_news,2024-11-07 22:59:29
35885911,https://crypto.news/?p=14308949,1731020369,https://resources.cryptocompare.com/news/73/35885911.jpeg,How many cryptocurrencies are there? A growing industry,https://crypto.news/how-many-cryptocurrencies-are-there/,"The first cryptocurrency appeared in 2009, and today, its name is known by almost everyone — Bitcoin. What made it so intriguing was the promise of a new kind of money: no government interference, full privacy, and everyone having the…",Learn|Crypto assets,EN,0,0,BTC,"{'name': 'crypto.news', 'img': 'https://resources.cryptocompare.com/news/73/default.png', 'lang': 'EN'}",crypto_news,2024-11-07 22:59:29
35886004,https://ambcrypto.com/?p=440650,1731020423,https://images.cryptocompare.com/news/default/ambcrypto.png,Raydium delivers better gains than Bitcoin as RAY soars to 2024 high,https://ambcrypto.com/raydium-delivers-better-gains-than-bitcoin-as-ray-soars-to-2024-high/,RAY emerges as one of the best performing cryptocurrencies as it surges to its highest level in 2024.,Altcoin|News|News 1|Social|Trading View,EN,0,0,RAY|BTC|ALTCOIN,"{'name': 'AMB Crypto', 'img': 'https://images.cryptocompare.com/news/default/ambcrypto.png', 'lang': 'EN'}",ambcrypto,2024-11-07 23:00:23
35886025,https://bitcoinworld.co.in/?p=96603,1731020423,https://resources.cryptocompare.com/news/82/default.png,"XRP Price Projection: Possible 11% Decline Causes Investors To Move Into AI Coin For 17,000% ROI In 28 Days",https://bitcoinworld.co.in/xrp-price-projection-possible-11-decline-causes-investors-to-move-into-ai-coin-for-17000-roi-in-28-days/,"Over the past 14 days, the XRP price has declined, bowing to the volatility rocking the crypto market. A recent analysis has further suggested that the XRP price will dip by another 11%. This continuous decline is especially worrying for XRP investors, causing many to diversify into the buzzing AI coin, WallitIQ (WLTQ). This coin",Crypto News|Investing|Press Release|AI Coin|WallitIQ|WLTQ|XRP|xrp price,EN,0,0,XRP|TRADING|BUSINESS|MARKET,"{'name': 'Bitcoin World', 'img': 'https://resources.cryptocompare.com/news/82/default.png', 'lang': 'EN'}",bitcoinworld,2024-11-07 23:00:23
35886050,https://cointelegraph.com/news/crypto-ceo-kidnapped-forced-pay-1-million-ransom,1731020468,https://images.cryptocompare.com/news/default/cointelegraph.png,WonderFi CEO kidnapped and forced to pay $1M ransom: Report,https://cointelegraph.com/news/crypto-ceo-kidnapped-forced-pay-1-million-ransom?utm_source=rss_feed&utm_medium=rss&utm_campaign=rss_partner_inbound,WonderFi CEO Dean Skurka reportedly said in an email that he is “safe” now and that no company funds and data were impacted.,Den Skurka|WonderFi|Kidnapping|Ransom|Kevin O'Leary|CBC|Report|Toronto Stock Exchange|WNDR,EN,0,0,OTHER,"{'name': 'CoinTelegraph', 'img': 'https://images.cryptocompare.com/news/default/cointelegraph.png', 'lang': 'EN'}",cointelegraph,2024-11-07 23:01:08
35886052,https://dailyhodl.com/?p=308391,1731020505,https://images.cryptocompare.com/news/default/dailyhodl.png,Former FTX Executive Caroline Ellison Set To Begin Two-Year Prison Sentence for Role in FTX Fiasco,https://dailyhodl.com/2024/11/07/sam-bankman-frieds-ex-girlfriend-caroline-ellison-set-to-begin-two-year-prison-sentence-for-role-in-ftx-fiasco/,"Former FTX executive Caroline Ellison is set to start her two-year prison term in Connecticut. According to a new report by CNBC, a Bureau of Prison (BOP) spokesperson said that Caroline Ellison – the former CEO of FTX’s sister company Alameda Research – will begin her two-year sentence after serving as the prosecution’s star witness. The post Former FTX Executive Caroline Ellison Set To Begin Two-Year Prison Sentence for Role in FTX Fiasco appeared first on The Daily Hodl .","Scams, Hacks & Breaches|Caroline Ellison|crime|Crypto|crypto exchange|fraud|FTX|News|prison|Sam Bankman-Fried",EN,0,0,RESEARCH,"{'name': 'The Daily Hodl', 'img': 'https://images.cryptocompare.com/news/default/dailyhodl.png', 'lang': 'EN'}",dailyhodl,2024-11-07 23:01:45
35886299,https://en.coinotag.com/ray-reaches-two-year-high-amid-growing-dex-momentum-and-potential-for-further-gains/,1731020734,https://resources.cryptocompare.com/news/77/35886299.jpeg,RAY Reaches Two-Year High Amid Growing DEX Momentum and Potential for Further Gains,https://en.coinotag.com/ray-reaches-two-year-high-amid-growing-dex-momentum-and-potential-for-further-gains/,"Raydium’s native token, RAY, achieves a significant milestone as it reaches its highest valuation since 2021, marking a pivotal moment in the crypto landscape. The cryptocurrency surged by 276%, outperforming",Bitcoin|News|BTC|FLOW|RAY|SOL,EN,0,0,RAY|BTC|FLOW|SOL,"{'name': 'CoinOtag', 'img': 'https://resources.cryptocompare.com/news/77/default.png', 'lang': 'EN'}",coinotag,2024-11-07 23:05:34
35886285,https://en.coin-turk.com/?p=172560,1731020791,https://resources.cryptocompare.com/news/79/35886285.jpeg,Bitcoin Price Surge Causes Major Loss for Whale During US Elections,https://en.coin-turk.com/bitcoin-price-surge-causes-major-loss-for-whale-during-us-elections/,Bitcoin prices surged sharply during the US presidential elections. A whale investor faced a $75 million loss on election day. Continue Reading: Bitcoin Price Surge Causes Major Loss for Whale During US Elections The post Bitcoin Price Surge Causes Major Loss for Whale During US Elections appeared first on COINTURK NEWS .,Bitcoin (BTC),EN,0,0,BTC|TRADING|BUSINESS|MARKET,"{'name': 'CoinTurk News', 'img': 'https://resources.cryptocompare.com/news/79/default.png', 'lang': 'EN'}",cointurken,2024-11-07 23:06:31
35886492,https://decrypt.co/?p=290728,1731020975,https://resources.cryptocompare.com/news/44/35886492.jpeg,Hackers Demand $125K in French Bread in Crypto Ransomware Attack,https://decrypt.co/290728/hackers-demand-125k-french-bread-crypto-ransomware-attack,"A ransomware gang insists on being paid with $125,000 worth of baguettes, though reportedly the hackers would be happy with Monero too.",monero|Coins,EN,0,0,XMR,"{'name': 'Decrypt', 'img': 'https://images.cryptocompare.com/news/default/decrypt.png', 'lang': 'EN'}",decrypt,2024-11-07 23:09:35
35886695,https://bitcoinworld.co.in/?p=96608,1731021354,https://resources.cryptocompare.com/news/82/default.png,"Top CoinMarketCap Altcoins Listing for the Post US Election Rally: PCHAIN, Trump47, Baby Maga",https://bitcoinworld.co.in/top-coinmarketcap-altcoins-listing-for-the-post-us-election-rally-pchain-trump47-baby-maga/,"The post-election period has caused excitement around some altcoins, particularly the top-listed CoinMarketCap altcoins with viable niche propositions. PropiChain (PCHAIN), Trump47, and Baby Maga are top listings. Most investors consider their options on the table as the bull run lurks around after the US Elections. Let’s analyze what motivates the likely success behind these projects.",Crypto News|Investing|Press Release|ALTCOINS|Baby Maga|CoinMarketCap Altcoins|PCHAIN|Trump47,EN,0,0,ALTCOIN|TRADING|BUSINESS,"{'name': 'Bitcoin World', 'img': 'https://resources.cryptocompare.com/news/82/default.png', 'lang': 'EN'}",bitcoinworld,2024-11-07 23:15:54
35886823,https://en.coinotag.com/bitcoin-surges-to-record-high-amid-trump-victory-and-interest-rate-cuts-raising-speculation-on-future-growth/,1731021511,https://resources.cryptocompare.com/news/77/35886823.jpeg,"Bitcoin Surges to Record High Amid Trump Victory and Interest Rate Cuts, Raising Speculation on Future Growth",https://en.coinotag.com/bitcoin-surges-to-record-high-amid-trump-victory-and-interest-rate-cuts-raising-speculation-on-future-growth/,"Bitcoin has surged to unprecedented heights, breaking records twice in just two days, fueled by political and economic events in the U.S. This remarkable rally is primarily attributed to Donald",News|BTC|ETH|SOL,EN,0,0,BTC|ETH|SOL|TRADING,"{'name': 'CoinOtag', 'img': 'https://resources.cryptocompare.com/news/77/default.png', 'lang': 'EN'}",coinotag,2024-11-07 23:18:31
35886959,https://en.coinotag.com/wonderfi-ceos-reported-kidnapping-highlights-ongoing-security-concerns-in-the-crypto-industry/,1731021686,https://resources.cryptocompare.com/news/77/35886959.jpeg,WonderFi CEO’s Reported Kidnapping Highlights Ongoing Security Concerns in the Crypto Industry,https://en.coinotag.com/wonderfi-ceos-reported-kidnapping-highlights-ongoing-security-concerns-in-the-crypto-industry/,"The recent kidnapping incident involving WonderFi CEO Dean Skurka highlights escalating security concerns within the cryptocurrency industry. This disturbing event underscores the increasing trend of targeted abductions of cryptocurrency executives,",News|BTC,EN,0,0,BTC,"{'name': 'CoinOtag', 'img': 'https://resources.cryptocompare.com/news/77/default.png', 'lang': 'EN'}",coinotag,2024-11-07 23:21:26
35887209,3EGWOEXFZFC6TD3FDDOKTD5GXI,1731021802,https://resources.cryptocompare.com/news/5/35887209.jpeg,Jack Dorsey's Square to Invest More in Bitcoin Mining and Shut Decentralized 'Web5' Venture,https://www.coindesk.com/business/2024/11/07/jack-dorseys-square-to-invest-more-in-bitcoin-mining-and-shut-decentralized-web5-web-venture/?utm_medium=referral&utm_source=rss&utm_campaign=headlines,The company's shares fell after reporting third quarter sales that missed estimates by 4%.,Finance|news|Square|Block|Bitcoin Mining|Wallet|Bitkey,EN,0,0,BTC|MINING,"{'name': 'CoinDesk', 'img': 'https://images.cryptocompare.com/news/default/coindesk.png', 'lang': 'EN'}",coindesk,2024-11-07 23:23:22
35889880,https://cryptonews.com/?p=304262,1731022200,https://resources.cryptocompare.com/news/52/35889880.jpeg,South Korean Regulator to Rule on Corporate Crypto Investment Next Month,https://cryptonews.com/news/south-korean-regulator-to-rule-on-corporate-crypto-investment-next-month/,A South Korean financial regulator will make “a final decision” on whether or not to approve corporate crypto investment next month. The post South Korean Regulator to Rule on Corporate Crypto Investment Next Month appeared first on Cryptonews .,Blockchain News|News|Regulation|South Korea,EN,0,0,REGULATION,"{'name': 'cryptonews', 'img': 'https://images.cryptocompare.com/news/default/cryptonews.png', 'lang': 'EN'}",cryptonews,2024-11-07 23:30:00
35887383,https://news.bitcoin.com/?p=683111&preview=true&preview_id=683111,1731022222,https://resources.cryptocompare.com/news/14/35887383.jpeg,Anti-Crypto Senator Ousted: Ohio Rejects ‘Crypto Public Enemy’ for New Era,https://news.bitcoin.com/anti-crypto-senator-ousted-ohio-rejects-crypto-public-enemy-for-new-era/,"Ohio’s Senate race delivered a major win for the crypto industry, as Bernie Moreno unseated crypto critic Sherrod Brown, signaling a shift toward pro-digital finance leadership. ‘Crypto Public Enemy’ Defeated as Ohio Elects Digital Finance Champion In Ohio’s Senate election this week, blockchain entrepreneur Bernie Moreno defeated three-term Democratic incumbent Senator Sherrod Brown, a prominent",Regulation|Congress|Sherrod Brown,EN,0,0,REGULATION|BLOCKCHAIN,"{'name': 'Bitcoin.com', 'img': 'https://images.cryptocompare.com/news/default/bitcoincom.png', 'lang': 'EN'}",bitcoin.com,2024-11-07 23:30:22
