id,guid,published_on,imageurl,title,url,body,tags,lang,upvotes,downvotes,categories,source_info,source,date
35919840,https://crypto.news/?p=14309072,1731065867,https://resources.cryptocompare.com/news/73/35919840.jpeg,DOGE on the verge of crash as whales dump millions to buy into ETFSwap,https://crypto.news/doge-on-the-verge-of-crash-as-whales-dump-millions-to-buy-into-etfswap-2/,"With Dogecoin's price facing a potential crash, whales are flocking to ETFSwap for its 40,000% growth potential ahead of a bull run. #partnercontent",Partner Content|sponsored,EN,0,0,DOGE|SPONSORED|TRADING,"{'name': 'crypto.news', 'img': 'https://resources.cryptocompare.com/news/73/default.png', 'lang': 'EN'}",crypto_news,2024-11-08 11:37:47
35919839,https://crypto.news/?p=14309072,1731065867,https://resources.cryptocompare.com/news/74/35919839.jpeg,DOGE on the verge of crash as whales dump millions to buy into ETFSwap,https://crypto.news/doge-on-the-verge-of-crash-as-whales-dump-millions-to-buy-into-etfswap-2/,"With Dogecoin's price facing a potential crash, whales are flocking to ETFSwap for its 40,000% growth potential ahead of a bull run. #partnercontent",Partner Content|sponsored,EN,0,0,DOGE|SPONSORED|TRADING,"{'name': 'nft.news', 'img': 'https://resources.cryptocompare.com/news/74/default.png', 'lang': 'EN'}",nft_news,2024-11-08 11:37:47
35920039,https://thedefiant.io/news/defi/makerdao-governance-confirms-sky-rebrand-will-go-ahead,1731066240,https://resources.cryptocompare.com/news/101/35920039.jpeg,MakerDAO Governance Confirms Sky Rebrand Will Go Ahead,https://thedefiant.io/news/defi/makerdao-governance-confirms-sky-rebrand-will-go-ahead,"The project transitioned to the Sky brand identity on Sept. 18, but community members expressed confusion.",,EN,0,0,MKR,"{'name': 'The Defiant', 'img': 'https://resources.cryptocompare.com/news/101/default.png', 'lang': 'EN'}",thedefiant,2024-11-08 11:44:00
35920500,https://u.today/ethereum-etf-validates-inflow-streak-eth-price-reacts,1731066360,https://resources.cryptocompare.com/news/64/35920500.jpeg,"Ethereum ETF Validates Inflow Streak, ETH Price Reacts",https://u.today/ethereum-etf-validates-inflow-streak-eth-price-reacts,Ethereum ETF products recorded second day of inflow to prove institutional interest is growing,Ethereum ETF|ETH,EN,0,0,ETH|TRADING,"{'name': 'U.Today', 'img': 'https://images.cryptocompare.com/news/default/utoday.png', 'lang': 'EN'}",utoday,2024-11-08 11:46:00
35920166,https://en.coinotag.com/ethereum-foundation-report-2024-highlights-970-million-treasury-focused-on-ether-and-new-research-initiatives/,1731066393,https://resources.cryptocompare.com/news/77/35920166.jpeg,Ethereum Foundation Report 2024 Highlights $970 Million Treasury Focused on Ether and New Research Initiatives,https://en.coinotag.com/ethereum-foundation-report-2024-highlights-970-million-treasury-focused-on-ether-and-new-research-initiatives/,"The Ethereum Foundation has released its 2024 report, revealing robust treasury reserves and pivotal areas of focus for the upcoming year. This year’s analysis highlights the foundation’s significant investment in",Analysis|Ethereum|News|Core|ETH|UNI,EN,0,0,ETH|REGULATION|RESEARCH|MARKET|UNI,"{'name': 'CoinOtag', 'img': 'https://resources.cryptocompare.com/news/77/default.png', 'lang': 'EN'}",coinotag,2024-11-08 11:46:33
35920249,https://cointelegraph.com/news/decentralized-finance-regulation-agne-linge,1731066472,https://images.cryptocompare.com/news/default/cointelegraph.png,DeFi needs regulation to drive adoption — Web3 exec,https://cointelegraph.com/news/decentralized-finance-regulation-agne-linge?utm_source=rss_feed&utm_medium=rss&utm_campaign=rss_partner_inbound,"Web3 professional Agne Linge believes that for broader DeFi adoption, regulations must catch up to make people feel safe.",DeFi regulation|Agne Linge Binance|Binance Blockchain Week Dubai|decentralized finance adoption|crypto regulations|DeFi ecosystem,EN,0,0,REGULATION,"{'name': 'CoinTelegraph', 'img': 'https://images.cryptocompare.com/news/default/cointelegraph.png', 'lang': 'EN'}",cointelegraph,2024-11-08 11:47:52
35920440,https://coinpedia.org/?p=377506,1731066750,https://images.cryptocompare.com/news/default/coinpedia.png,What’s Causing the Bitcoin Bull Rally? QCP Capital Reveals Top Factors,https://coinpedia.org/news/qcp-capital-notes-factors-that-propelled-bitcoin-to-77k-highlights-btcs-sustained-bullishness/,"The post What’s Causing the Bitcoin Bull Rally? QCP Capital Reveals Top Factors appeared first on Coinpedia Fintech News This week has ended on an incredibly positive note, with a wave of favorable news sparking renewed optimism in the crypto market. Bitcoin ETFs saw a record-breaking $1.38 billion in net inflows on Thursday, following Donald Trump’s victory in the U.S. Presidential race. Bitcoin, in turn, continues to break new highs, with the market momentum …",News|Bitcoin|Crypto news,EN,0,0,BTC|MARKET|TRADING,"{'name': 'coinpedia', 'img': 'https://images.cryptocompare.com/news/default/coinpedia.png', 'lang': 'EN'}",coinpedia,2024-11-08 11:52:30
35920492,https://coingape.com/?post_type=markets&p=224155,1731066886,https://images.cryptocompare.com/news/default/coingape.png,Will Solana Price Hit $800 After Breaking a 5-Month High?,https://coingape.com/markets/will-solana-price-hit-800-after-breaking-a-5-month-high/,"Solana (SOL) price, a Layer 1 blockchain, has recently demonstrated significant upward momentum in the cryptocurrency market. Since the beginning of November, SOL’s price has surged by 21%, breaking a five-month high amid strengthening bullish sentiment. This impressive rally follows a broader market rebound, positioning Solana for a potential breakout as consolidation patterns appear. Analysts The post Will Solana Price Hit $800 After Breaking a 5-Month High? appeared first on CoinGape .",Price Analysis|solana|Solana (SOL)|Solana All-time high|Solana Price Prediction,EN,0,0,SOL|TRADING|MARKET|BLOCKCHAIN,"{'name': 'CoinGape', 'img': 'https://images.cryptocompare.com/news/default/coingape.png', 'lang': 'EN'}",coingape,2024-11-08 11:54:46
35920602,https://decrypt.co/?p=290813,1731066941,https://resources.cryptocompare.com/news/44/35920602.jpeg,How Solana Meme Coins and DeFi Pushed SOL Above $200,https://decrypt.co/290813/solana-tops-200-trump-reelection,"Solana breaks $200 for the first time since April 1, thanks to Donald Trump securing U.S. Presidential election.",|Coins,EN,0,0,SOL,"{'name': 'Decrypt', 'img': 'https://images.cryptocompare.com/news/default/decrypt.png', 'lang': 'EN'}",decrypt,2024-11-08 11:55:41
35920629,https://en.coinotag.com/breakingnews/october-bitcoin-production-soars-by-13-to-3630-btc-reveals-farside-investors-report/,1731066990,https://resources.cryptocompare.com/news/77/35920629.jpeg,"October Bitcoin Production Soars by 13% to 3,630 BTC, Reveals Farside Investors Report",https://en.coinotag.com/breakingnews/october-bitcoin-production-soars-by-13-to-3630-btc-reveals-farside-investors-report/,"In a recent update from COINOTAG News dated November 8th, industry insights reveal a notable uptick in Bitcoin mining outputs for October. Data sourced from Farside Investors indicates that publicly",BTC,EN,0,0,BTC|BUSINESS|MINING,"{'name': 'CoinOtag', 'img': 'https://resources.cryptocompare.com/news/77/default.png', 'lang': 'EN'}",coinotag,2024-11-08 11:56:30
35920605,https://finbold.com/?p=211491,1731066996,https://images.cryptocompare.com/news/default/finbold.png,"Why Dogecoin’s next minimum target is $3.5, according to analyst",https://finbold.com/why-dogecoins-next-minimum-target-is-3-5-according-to-analyst/,"Dogecoin (DOGE) is maintaining an upward momentum, capitalizing on the impact of the Donald Trump victory with an analyst projecting … Continue reading The post Why Dogecoin’s next minimum target is $3.5, according to analyst appeared first on Finbold .",Cryptocurrency news|crypto|cryptocurrency|DOGE,EN,0,0,DOGE,"{'name': 'Finbold', 'img': 'https://images.cryptocompare.com/news/default/finbold.png', 'lang': 'EN'}",finbold,2024-11-08 11:56:36
35920909,https://www.cryptoglobe.com/latest/2024/11/bybit-and-aptos-launch-airdrop-ahead-of-massive-apt-token-unlock/,1731067020,https://resources.cryptocompare.com/news/2/35920909.jpeg,Bybit and Aptos Launch Airdrop Ahead of Massive APT Token Unlock,https://www.cryptoglobe.com/latest/2024/11/bybit-and-aptos-launch-airdrop-ahead-of-massive-apt-token-unlock/,"The second-largest cryptocurrency exchange by trading volume Bybit, has partnered with Aptos, a high-performance Layer-1 blockchain, to launch an exclusive airdrop for Web3 creators and enthusiasts. The airdrop, hosted on Bybit’s Airdrop Arcade, offers 18,000 APT tokens up for grabs in an initiative that aligns with Bybit’s commitment to fostering innovation and empowering the Web3",Altcoins|Aptos ($APT),EN,0,0,APT|EXCHANGE|AIRDROP|ALTCOIN|BLOCKCHAIN,"{'name': 'CryptoGlobe', 'img': 'https://images.cryptocompare.com/news/default/cryptoglobe.png', 'lang': 'EN'}",cryptoglobe,2024-11-08 11:57:00
35920646,https://crypto.news/?p=14308954,1731067080,https://resources.cryptocompare.com/news/73/35920646.jpeg,What Trump’s US presidential win means for crypto | Opinion,https://crypto.news/what-trumps-presidential-win-means-for-crypto-opinion/,Trump’s win and previous support for crypto will result in the US becoming a superpower in this space—outpacing countries such as China.,Opinion|Adoption|Cryptocurrency|Donald Trump|Regulation|United States,EN,0,0,REGULATION|ASIA,"{'name': 'crypto.news', 'img': 'https://resources.cryptocompare.com/news/73/default.png', 'lang': 'EN'}",crypto_news,2024-11-08 11:58:00
35920642,https://crypto.news/?p=14308954,1731067080,https://resources.cryptocompare.com/news/74/35920642.jpeg,What Trump’s US presidential win means for crypto | Opinion,https://crypto.news/what-trumps-presidential-win-means-for-crypto-opinion/,Trump’s win and previous support for crypto will result in the US becoming a superpower in this space—outpacing countries such as China.,Opinion|Adoption|Cryptocurrency|Donald Trump|Regulation|United States,EN,0,0,REGULATION|ASIA,"{'name': 'nft.news', 'img': 'https://resources.cryptocompare.com/news/74/default.png', 'lang': 'EN'}",nft_news,2024-11-08 11:58:00
35921084,https://u.today/xrp-network-plummets-by-50-whats-happening,1731067140,https://resources.cryptocompare.com/news/64/35921084.jpeg,XRP Network Plummets by 50%: What's Happening?,https://u.today/xrp-network-plummets-by-50-whats-happening,XRP network gradually losing power as whales are not ready to support rally continuation,XRP,EN,0,0,XRP|TRADING,"{'name': 'U.Today', 'img': 'https://images.cryptocompare.com/news/default/utoday.png', 'lang': 'EN'}",utoday,2024-11-08 11:59:00
35921606,https://coinedition.com/?p=541975,1731067200,https://resources.cryptocompare.com/news/7/default.png,Cardano’s Price Surges 15%: A Temporary Rally or a Sustainable Trend?,https://coinedition.com/cardanos-price-surges-15-a-temporary-rally-or-a-sustainable-trend/,"Cardano’s price is surging, raising back-and-forth on the sustainability of this rally. The increase in ADA’s value has also reignited discussions on its long-term prospects and leadership under Charles Hoskinson. This sharp price movement has fueled optimism watching for signs of whether this trend is truly robust or a fleeting spike. ADA’s price rose from The post Cardano’s Price Surges 15%: A Temporary Rally or a Sustainable Trend? appeared first on Coin Edition .",Market|Market News|News|Cardano (ADA)|Cardano News,EN,0,0,TRADING|ADA|MARKET,"{'name': 'Coin Edition', 'img': 'https://resources.cryptocompare.com/news/7/default.png', 'lang': 'EN'}",coinquora,2024-11-08 12:00:00
35920745,https://news.bitcoin.com/?p=683262&preview=true&preview_id=683262,1731067200,https://resources.cryptocompare.com/news/14/35920745.jpeg,TRON DAO Unveils TRON-Peg USD Coin: A New Gateway to Borderless Transactions,https://news.bitcoin.com/tron-dao-unveils-tron-peg-usd-coin-a-new-gateway-to-borderless-transactions/,"PRESS RELEASE. Geneva, Switzerland, November 7, 2024 – TRON DAO has officially launched the TRON-Peg USD Coin on the TRON blockchain, an innovative cross-chain solution designed to streamline borderless transactions and broaden TRON’s stablecoin ecosystem. By facilitating seamless and efficient cross-chain transfers, TRON-Peg USD Coin expands the possibilities for users to leverage USDC across the",Press release,EN,0,0,SPONSORED|BLOCKCHAIN|USDC,"{'name': 'Bitcoin.com', 'img': 'https://images.cryptocompare.com/news/default/bitcoincom.png', 'lang': 'EN'}",bitcoin.com,2024-11-08 12:00:00
35921230,https://www.cryptonewsz.com/3-altcoins-poised-for-100x-gains-shib-pepe-and-intelmarkets/,1731067214,https://images.cryptocompare.com/news/default/cryptonewsz.png,"3 Altcoins Poised for 100x Gains: SHIB, PEPE, and IntelMarkets",https://www.cryptonewsz.com/3-altcoins-poised-for-100x-gains-shib-pepe-and-intelmarkets/,Investors seek tokens that can deliver substantial returns as the year draws to a close. Their focus has…,Altcoin News,EN,0,0,ALTCOIN|PEPE|SHIB|ZRX|BUSINESS,"{'name': 'CryptoNewsZ', 'img': 'https://images.cryptocompare.com/news/default/cryptonewsz.png', 'lang': 'EN'}",cryptonewsz,2024-11-08 12:00:14
35920804,https://ambcrypto.com/?p=440708,1731067219,https://images.cryptocompare.com/news/default/ambcrypto.png,PEPE nears key resistance – Here’s why a 200% rally could be next,https://ambcrypto.com/pepe-nears-key-resistance-heres-why-a-200-rally-could-be-next/,"PEPE was testing a resistance, and a breakout could lead to a 200% rally.",Memecoins|News|News 1|Pepe|Social|Trading View,EN,0,0,PEPE|TRADING,"{'name': 'AMB Crypto', 'img': 'https://images.cryptocompare.com/news/default/ambcrypto.png', 'lang': 'EN'}",ambcrypto,2024-11-08 12:00:19
35920824,https://coingape.com/?post_type=trending&p=224138,1731067343,https://images.cryptocompare.com/news/default/coingape.png,Inside The $1.6M Crypto Scam: 81 Arrested After Scammers Made This Mistake,https://coingape.com/trending/inside-the-1-6m-crypto-scam-81-arrested-after-scammers-made-this-mistake/,"Crypto scams have surrounded the industry, where scamming incidents have grown exponentially. The most recent news from South Korea uncovered a new type of investment scam. Not crypto hacks or thefts, the swindlers are now targeting people with high-yield investment scams. With that, they have allegedly scammed $1.6M from victims, but one mistake made them The post Inside The $1.6M Crypto Scam: 81 Arrested After Scammers Made This Mistake appeared first on CoinGape .",24/7 Cryptocurrency News|Bitcoin miner scam|crypto scam|South korea crypto news,EN,0,0,ASIA,"{'name': 'CoinGape', 'img': 'https://images.cryptocompare.com/news/default/coingape.png', 'lang': 'EN'}",coingape,2024-11-08 12:02:23
35920908,https://www.bitdegree.org/crypto/news/bitdegree-launches-xt-com-mission-with-up-to-135-in-bonuses-for-crypto-traders,1731067356,https://resources.cryptocompare.com/news/66/35920908.jpeg,BitDegree Launches XT.com Mission With up to $135 in Bonuses for Crypto Traders,https://www.bitdegree.org/crypto/news/bitdegree-launches-xt-com-mission-with-up-to-135-in-bonuses-for-crypto-traders,"BitDegree has announced a new Mission, “ XT.com: Your Digital Asset Gateway ,” offering users a unique opportunity to explore XT.com, a global cryptocurrency exchange platform.",breaking-news,EN,0,0,EXCHANGE,"{'name': 'BitDegree', 'img': 'https://images.cryptocompare.com/news/default/bitdegree.png', 'lang': 'EN'}",bitdegree,2024-11-08 12:02:36
35920857,https://coinpedia.org/?p=377473,1731067415,https://images.cryptocompare.com/news/default/coinpedia.png,Binance To Overtake Coinbase as Bitcoin Exchange Reserves Hit ATH 25%,https://coinpedia.org/news/binance-to-overtake-coinbase-as-bitcoin-exchange-reserves-hit-ath-25/,"The post Binance To Overtake Coinbase as Bitcoin Exchange Reserves Hit ATH 25% appeared first on Coinpedia Fintech News Binance, one of the world’s largest cryptocurrency exchanges, is growing stronger. Recent data shows that its reserve percentage has reached an all-time high of 25%. This means Binance now holds a large share of all crypto reserves across exchanges, only behind Coinbase, which has around 33%. This surge highlights how Binance is becoming a bigger …",News,EN,0,0,EXCHANGE|BNB|BTC|FIAT,"{'name': 'coinpedia', 'img': 'https://images.cryptocompare.com/news/default/coinpedia.png', 'lang': 'EN'}",coinpedia,2024-11-08 12:03:35
35920873,https://crypto.news/?p=14309085,1731067425,https://resources.cryptocompare.com/news/74/35920873.jpeg,LetsExchange expands cross-chain capabilities with new crypto bridge mode,https://crypto.news/letsexchange-expands-cross-chain-capabilities-with-new-crypto-bridge-mode/,"LetsExchange has unveiled crypto bridge, a new exchange mode for its widget. Learn the details of this new feature and how it helps to enhance users' crypto exchange experience. #partnercontent",Partner Content|sponsored,EN,0,0,EXCHANGE|SPONSORED,"{'name': 'nft.news', 'img': 'https://resources.cryptocompare.com/news/74/default.png', 'lang': 'EN'}",nft_news,2024-11-08 12:03:45
35920870,https://crypto.news/?p=14309085,1731067425,https://resources.cryptocompare.com/news/73/35920870.jpeg,LetsExchange expands cross-chain capabilities with new crypto bridge mode,https://crypto.news/letsexchange-expands-cross-chain-capabilities-with-new-crypto-bridge-mode/,"LetsExchange has unveiled crypto bridge, a new exchange mode for its widget. Learn the details of this new feature and how it helps to enhance users' crypto exchange experience. #partnercontent",Partner Content,EN,0,0,EXCHANGE,"{'name': 'crypto.news', 'img': 'https://resources.cryptocompare.com/news/73/default.png', 'lang': 'EN'}",crypto_news,2024-11-08 12:03:45
35920939,https://coinpedia.org/?p=377504,1731067442,https://images.cryptocompare.com/news/default/coinpedia.png,"Ethereum Price Prediction : ETH Price Poised to Surge Nearly 200%, Here’s When",https://coinpedia.org/news/ethereum-price-prediction-eth-price-poised-to-surge-nearly-200-heres-when/,"The post Ethereum Price Prediction : ETH Price Poised to Surge Nearly 200%, Here’s When appeared first on Coinpedia Fintech News Donald Trump’s second presidential win has sent ripples of excitement across the cryptocurrency market. Bitcoin led the charge, surging 10% to a new all-time high of $76,203, as buying activity spiked amid renewed optimism. Investors are showing confidence, with Trump’s pro-crypto stance expected to influence favorable policies for digital assets. This victory is fueling hopes …",News|Ethereum|Price Analysis,EN,0,0,ETH|TRADING|BTC|BUSINESS|MARKET,"{'name': 'coinpedia', 'img': 'https://images.cryptocompare.com/news/default/coinpedia.png', 'lang': 'EN'}",coinpedia,2024-11-08 12:04:02
35920966,https://en.bitcoinsistemi.com/is-el-salvador-in-profit-or-loss-after-receiving-1-btc-every-day-after-bitcoins-recent-rise/,1731067447,https://resources.cryptocompare.com/news/81/35920966.jpeg,Is El Salvador in Profit or Loss After Receiving “1 BTC Every Day” After Bitcoin’s Recent Rise?,https://en.bitcoinsistemi.com/is-el-salvador-in-profit-or-loss-after-receiving-1-btc-every-day-after-bitcoins-recent-rise/,"Having accumulated one Bitcoin every day since November 18, 2022, El Salvador's assets reached 722 BTC and he made a profit. Continue Reading: Is El Salvador in Profit or Loss After Receiving “1 BTC Every Day” After Bitcoin’s Recent Rise?",Analysis|Bitcoin|News,EN,0,0,BTC|BUSINESS|MARKET,"{'name': 'BitcoinSistemi', 'img': 'https://resources.cryptocompare.com/news/81/default.png', 'lang': 'EN'}",bitcoinsistemi,2024-11-08 12:04:07
35921045,https://en.coin-turk.com/?p=172647,1731067600,https://resources.cryptocompare.com/news/79/35921045.jpeg,Beta Finance Transfers Significant BETA Coins to Binance,https://en.coin-turk.com/beta-finance-transfers-significant-beta-coins-to-binance/,"Beta Finance transferred 170 million BETA coins to Binance, valued at $7.37 million. This transfer has raised concerns about potential market impacts among BETA coin holders. Continue Reading: Beta Finance Transfers Significant BETA Coins to Binance The post Beta Finance Transfers Significant BETA Coins to Binance appeared first on COINTURK NEWS .",Altcoin News,EN,0,0,BNB|EXCHANGE|MARKET,"{'name': 'CoinTurk News', 'img': 'https://resources.cryptocompare.com/news/79/default.png', 'lang': 'EN'}",cointurken,2024-11-08 12:06:40
35921431,https://www.cryptopolitan.com/?p=610908,1731067645,https://resources.cryptocompare.com/news/43/35921431.jpeg,Polymarket value drops off a cliff after settling its biggest political market,https://www.cryptopolitan.com/polymarket-value-drops-after-biggest-market/,"Polymarket lost up to 50% of its value just days after settling its biggest political market. Traders also decreased, as smaller bets did not gain the same exposure, but Polymarket countered with an airdrop offer.",News|ETH|MATIC|POL|Polymarket,EN,0,0,MARKET|ETH|MATIC|AIRDROP,"{'name': 'Cryptopolitan', 'img': 'https://images.cryptocompare.com/news/default/cryptopolitan.png', 'lang': 'EN'}",cryptopolitan,2024-11-08 12:07:25
35921074,https://finbold.com/?p=211488,1731067655,https://images.cryptocompare.com/news/default/finbold.png,Analyst highlights next 30x opportunity as liquidity flows into altcoins,https://finbold.com/analyst-highlights-next-30x-opportunity-as-liquidity-flows-into-altcoins/,"Analysts weighed in as Bitcoin (BTC) shows strong momentum, expecting liquidity will soon “start to flow into altcoins.” While some … Continue reading The post Analyst highlights next 30x opportunity as liquidity flows into altcoins appeared first on Finbold .",Cryptocurrency news|Altcoin season|altcoins|Altseason|EGLD|MultiversX,EN,0,0,ALTCOIN|ZRX|EGLD|BTC,"{'name': 'Finbold', 'img': 'https://images.cryptocompare.com/news/default/finbold.png', 'lang': 'EN'}",finbold,2024-11-08 12:07:35
35921217,https://cryptodaily.co.uk/2024/11/amid-cardano-ada-and-solana-sol-success-a-promising-altcoin-joins-their-ranks,1731067825,https://resources.cryptocompare.com/news/75/35921217.jpeg,Amid Cardano (ADA) and Solana (SOL) Success: A Promising Altcoin Joins Their Ranks,https://cryptodaily.co.uk/2024/11/amid-cardano-ada-and-solana-sol-success-a-promising-altcoin-joins-their-ranks,"Both Cardano (ADA) and Solana (SOL) are pushing higher today on good news. Top altcoin Rollblock (RBLK) may be about to join them as it races toward the eighth stage of its crypto presale and an accompanying 6% price hike. This crypto casino has already returned 230% to its earliest investors, and it is now on track for over 100x growth in early 2025.",More News,EN,0,0,ADA|SOL|ALTCOIN|ZRX|BUSINESS,"{'name': 'Crypto Daily', 'img': 'https://resources.cryptocompare.com/news/75/default.png', 'lang': 'EN'}",cryptodaily,2024-11-08 12:10:25
35921292,https://en.coinotag.com/breakingnews/stacks-co-founder-launches-bitcoin-l2-labs-with-20-million-funding-to-enhance-stacks-development/,1731067945,https://resources.cryptocompare.com/news/77/35921292.jpeg,Stacks Co-Founder Launches Bitcoin L2 Labs with $20 Million Funding to Enhance Stacks Development,https://en.coinotag.com/breakingnews/stacks-co-founder-launches-bitcoin-l2-labs-with-20-million-funding-to-enhance-stacks-development/,Stacks Co-founder Muneeb Ali revealed on November 8th via social media that a new venture named Bitcoin L2 Labs has been launched. This initiative has successfully raised $20 million in,ALGO|BTC|Core|STX,EN,0,0,BTC|ALGO|STX,"{'name': 'CoinOtag', 'img': 'https://resources.cryptocompare.com/news/77/default.png', 'lang': 'EN'}",coinotag,2024-11-08 12:12:25
35921478,UGAHCE3ZWNCR7CTWPPOL7AMNWU,1731068031,https://resources.cryptocompare.com/news/5/35921478.jpeg,"Cardano Pumps 16%, Bitcoin Could Pop to $100K After Fed Rate Cut",https://www.coindesk.com/markets/2024/11/08/cardano-pumps-16-bitcoin-could-pop-to-100k-after-fed-rate-cut/?utm_medium=referral&utm_source=rss&utm_campaign=headlines,"Majors cryptocurrencies are surging as a bullish backdrop gives traders reason to set a $100,000 price target for BTC in the near term.",Markets|news|Trading|Bitcoin|Markets|Market Wrap,EN,0,0,BTC|ADA|MARKET|TRADING,"{'name': 'CoinDesk', 'img': 'https://images.cryptocompare.com/news/default/coindesk.png', 'lang': 'EN'}",coindesk,2024-11-08 12:13:51
35921395,https://cointelegraph.com/news/bitcoin-nears-77k-investor-confidence-post-us-election,1731068048,https://images.cryptocompare.com/news/default/cointelegraph.png,Bitcoin eyes $77K as investor confidence spikes post-US election,https://cointelegraph.com/news/bitcoin-nears-77k-investor-confidence-post-us-election?utm_source=rss_feed&utm_medium=rss&utm_campaign=rss_partner_inbound,Spot Bitcoin ETF recorded a new all-time high of over $1.37 billion in net inflows a day after Trump’s victory.,Bitcoin price|BTC|Bitcoin nears $77k|Bitcoin ETF inflows|Record ETF inflows|post-election rate cut|interest rates|Trump,EN,0,0,BTC|BUSINESS,"{'name': 'CoinTelegraph', 'img': 'https://images.cryptocompare.com/news/default/cointelegraph.png', 'lang': 'EN'}",cointelegraph,2024-11-08 12:14:08
35921400,https://cryptobriefing.com/?p=153493,1731068109,https://images.cryptocompare.com/news/default/cryptobriefing.png,TRON DAO unveils TRON-peg USD Coin: A new gateway to borderless transactions,https://cryptobriefing.com/tron-peg-usd-coin-borderless-transactions/,"TRON's new stablecoin bridge enhances global financial inclusivity, potentially reshaping cross-border transactions and digital finance. The post TRON DAO unveils TRON-peg USD Coin: A new gateway to borderless transactions appeared first on Crypto Briefing .",Sponsored,EN,0,0,SPONSORED,"{'name': 'Crypto Briefing', 'img': 'https://images.cryptocompare.com/news/default/cryptobriefing.png', 'lang': 'EN'}",cryptobriefing,2024-11-08 12:15:09
