id,guid,published_on,imageurl,title,url,body,tags,lang,upvotes,downvotes,categories,source_info,source,date
51414604,https://en.coinotag.com/megaeths-yield-bearing-usdm-stablecoin-could-subsidize-ethereum-sequencer-fees/,1757371629,https://resources.cryptocompare.com/news/77/default.png,MegaETH’s Yield-Bearing USDm Stablecoin Could Subsidize Ethereum Sequencer Fees,https://en.coinotag.com/megaeths-yield-bearing-usdm-stablecoin-could-subsidize-ethereum-sequencer-fees/,"USDm stablecoin is a yield-bearing dollar peg launched by MegaETH with Ethena’s USDtb reserves routed into tokenized US Treasuries; its treasury yield will be used to subsidize Ethereum sequencer fees,",News,EN,0,0,CRYPTOCURRENCY|ETH|DIGITAL ASSET TREASURY|MACROECONOMICS|REGULATION,"{'name': 'CoinOtag', 'img': 'https://resources.cryptocompare.com/news/77/default.png', 'lang': 'EN'}",coinotag,2025-09-08 22:47:09
13617214,https://www.cryptopolitan.com/?p=315144,1757372061,https://resources.cryptocompare.com/news/43/13617214.jpeg,Optimism price prediction 2025–2031: Will OP token gain momentum?,https://www.cryptopolitan.com/optimism-price-prediction/,"Key takeaways: By the end of 2025, OP is expected to have a minimum and maximum price of about $0.451 and $2.05, respectively. Optimism price prediction for 2028 suggests the token could reach a maximum value of $11.14. In 2031, OP tokens will range between $27.9 and $33.66, with an average value of $28.88. Optimism’s (OP) commitment to innovation is highlighted by its support for Layer-3 solutions. These solutions enable the development of decentralized applications (dApps) on top of Layer-2 chains, contributing to the expansive Optimism Superchain. The platform’s initiatives, including introducing custom gas tokens and Plasma mode aimed at reducing onboarding and operational costs, make it more accessible for new users and developers. As the market closely watches the price movements and growth trajectory of the token, can Optimism reach $10 soon? Let’s get into the OP price prediction for 2025 – 2031. Overview Cryptocurrency Optimism Token OP Price $0.7528 Market Cap $1.33B Trading Volume $172.64M Circulating Supply 1.778B OP All-time High $4.85 (Mar 06, 2024) All-time Low $0.4005 (Jun 18, 2022) 24-hour High $0.7571 24-hour Low $0.7172 Optimism price prediction: Technical analysis Metric Value Volatility (30-day Variation) 4.98% 50-Day SMA $0.7228 Sentiment Bullish Fear & Greed Index 51 (Neutral) Green Days 15/30 (50%) 200-Day SMA $0.7521 Optimism price analysis TL;DR Breakdown: OP could be testing a key breakout level soon. Momentum is shifting in favor of buyers. Optimism 1-day price chart Today’s candle surged to $0.7513, breaking above the mid-Bollinger Band at $0.7216 and closing near session highs. This move follows weeks of sideways action, suggesting a potential trend shift. OPUSDT 1-day price chart by TradingView The MACD histogram just flipped green while lines are crossing upward, reinforcing bullish momentum. The next major test is the upper Bollinger Band at $0.791, while support now sits around $0.721. A daily close back below $0.720 would weaken this breakout attempt, but holding current levels keeps $0.791 in sight. Optimism 4-hour price chart The 4-hour shows a sharp rally with volume expansion, pushing directly into $0.750 resistance. Immediate support lies at $0.732 and the 21-SMA at $0.722. If price consolidates above $0.732, continuation toward $0.770–$0.791 is likely. However, rejection here could trigger a pullback to retest $0.710 or $0.697 as demand zones. OPUSDT 4-hour price chart by TradingView Optimism technical indicators: Levels and action Daily simple moving average (SMA) Period Value Action SMA 3 $0.7157 BUY SMA 5 $0.7121 BUY SMA 10 $0.7221 BUY SMA 21 $0.7252 BUY SMA 50 $0.7228 BUY SMA 100 $0.6665 BUY SMA 200 $0.7521 SELL Daily exponential moving average (EMA) Period Value Action EMA 3 $0.7000 BUY EMA 5 $0.7028 BUY EMA 10 $0.7116 BUY EMA 21 $0.7204 BUY EMA 50 $0.7107 BUY EMA 100 $0.7198 BUY EMA 200 $0.8603 SELL What to expect from Optimism? OP is at a breakout zone. Holding above $0.732 keeps momentum toward $0.791, while rejection at $0.750 risks a pullback into the $0.710–$0.722 demand area before bulls try again. Is Optimism a good crypto investment? Optimism (OP) could be a good investment if you believe in Ethereum scaling and the growth of Layer 2 solutions. However, like all crypto, it’s risky, and its value depends on adoption and market trends. Only invest what you’re willing to lose! Will OP recover? A recovery is possible, but we fear the overall bearish sentiment makes a short-term rebound unlikely. However, as the market consolidates, we expect reduced volatility, which may lead to a breakout in either direction, depending on market dynamics. Will Optimism reach $10? Yes, Optimism is projected to close up to $10 by 2028. Will OP reach $50? Reaching $50 for Optimism (OP) would be an ambitious target, requiring a significant increase in its price. This level would likely only be achievable in a highly favorable market environment, with substantial advancements in Ethereum adoption, widespread use of Layer 2 solutions, and strong overall market growth. Will OP reach $100? Reaching $100 for Optimism (OP) would be extremely ambitious and require unprecedented growth and adoption. Does Optimism have a good long-term future? Yes, Optimism shows strong potential for growth and sustained interest, indicating a positive long-term outlook. Recent news/opinion on Optimism On August 31, 2025, Optimism released 31.34 million OP tokens worth about 24.36 million dollars in its latest vesting round, with 16.54 million allocated to core contributors and 14.8 million to early investors. 3 upcoming token unlocks 🔓 $OP ( @optimism ) 31 Aug 2025 31.34MM Token Unlock 👉 https://t.co/MdYenQp1yS $SUI ( @suinetwork ) 01 Sep 2025 44MM Token Unlock 👉 https://t.co/UstBXRC2PU $ENA ( @ethena_labs ) 02 Sep 2025 40.63MM Token Unlock 👉 https://t.co/NpfPZmnvBs More token… pic.twitter.com/FNtyRS7fOa — CoinMarketCal (@CoinMarketCal) August 29, 2025 Optimism price prediction September 2025 Optimism’s price prediction for September 2025 suggests a potential low of $0.608, an average of $0.7832, and a high of $0.9200. Optimism price prediction Potential Low Potential Average Potential High Optimism price prediction September 2025 $0.608 $0.7132 $0.8600 Optimism price prediction 2025 The price of Optimism is predicted to reach a maximum value of $2.05 in 2025. Traders can anticipate a minimum price of $0.451 and an average trading price of $1.12. Optimism price prediction Potential Low Potential Average Potential High Optimism price prediction 2025 $0.451 $1.12 $2.05 Optimism price predictions 2026–2031 Year Minimum Price ($) Average Price ($) Maximum Price ($) 2026 4.49 4.64 5.14 2027 6.36 6.54 7.7 2028 9.37 9.69 11.14 2029 13.6 14.08 16.38 2030 18.79 19.49 23.62 2031 27.9 28.88 33.66 Optimism price prediction 2026 In 2026, the price of Optimism is forecasted to be around $4.64. OP’s value can reach a maximum of $5.14 and an average trading value of $4.64. Optimism price prediction 2027 In 2027, Optimism price prediction suggests a maximum price of $7.70, an average trading price of $6.54, and a minimum price of $6.36. Optimism price prediction 2028 Per the Optimism price forecast for 2028, OP could reach a peak price of $11.14. The average price is projected to stabilize around $9.69, with a minimum expected at $9.37. Optimism price prediction 2029 The Optimism price prediction for 2029 suggests a peak value of $16.38. The minimum trading price is expected to be $13.60. The average market value is projected to be around $14.08. Optimism price prediction 2030 The Optimism forecast for 2030 suggests a minimum price of $18.79, a maximum price of $23.62, and an average price of $19.49. Optimism price prediction 2031 According to the Optimism price prediction for 2031, OP could potentially reach a maximum price of $33.66, a minimum price of $27.90, and an average value of around $28.88. Optimism price prediction 2025 – 2031 Optimism market price prediction: Analysts’ OP price forecast Firm 2025 2026 CoinCodex $0.73 $2.01 CoinPedia $3.82 $5.13 DigitalCoinPrice $1.64 $1.94 Cryptopolitan’s Optimism (OP) price prediction Cryptopolitan’s overall price prediction for Optimism (OP) suggests a conservative outlook for the cryptocurrency in the near term. For 2025, the maximum forecast price is between $1 and $2. Over the next few years, Optimism is projected to experience substantial appreciation, with prices anticipated to rise from a minimum of $20.65 to a maximum of $31.98 by 2031. Optimism historic price sentiment Optimism price history by Coingecko OP launched with an initial value of $4.57 on May 31 but dropped sharply in June due to the UST stablecoin de-pegging and LUNA collapse, closing June at $0.5434. It further declined to $0.4147 by mid-July. In August, OP briefly surged above $1.90, but by mid-October, it dropped to $0.70 following the FTX collapse. In Q1 2023, OP surged past $3.00 during a crypto bull run but lost 66% shortly after. A recovery saw it close the year at $3.90. OP saw an eventful 2024, reaching an all-time high of $4.85 in March before sliding below $2.30 by mid-April. After a brief recovery to over $2.90 in May, it entered a bearish phase, trading at $1.82–$1.96 by July and $1.54–$1.62 by October. November brought a spark of hope with a peak at $2.60. OP closed December within the range of $1.611–$2.773. In January 2025, OP peaked at $2.18 but lost momentum, dropping to as low as $0.84 in February. OP peaked at $0.9346 in March, $0.8523 in May, $0.7478 in June, and in July, $0.86. In August, OP traded between $0.6178 and $0.880. At the time of writing, September, OP is trading at an average of $0.74.",Crypto Price Predictions|Optimism,EN,0,0,ETH|TRADING|ICO|BLOCKCHAIN|OP|FORKS|MARKET|LUNA|RESEARCH|BUSINESS|CRYPTOCURRENCY,"{'name': 'Cryptopolitan', 'img': 'https://images.cryptocompare.com/news/default/cryptopolitan.png', 'lang': 'EN'}",cryptopolitan,2025-09-08 22:54:21
51414959,https://cryptonews.com/?p=420374,1757372105,https://resources.cryptocompare.com/news/52/51414959.jpeg,Bitcoin Price Prediction: Nasdaq’s Tokenized Stocks and Whale Buys Boost $130K Hype,https://cryptonews.com/news/bitcoin-price-prediction-nasdaqs-tokenized-stocks-and-whale-buys-boost-130k-hype/,"Price is at $112,341, up 0.98% in the last 24 hours, and volume is at $40.5 billion. The market cap is $2.24 trillion, with a supply of 19.92 million BTC. Beyond price action, the backdrop for Bitcoin is being reshaped by three powerful forces: Nasdaq’s push into tokenized stocks, growing institutional accumulation, and a tightening technical structure that hints at an imminent breakout. Nasdaq has officially filed with the SEC to allow trading of tokenized U.S. equities, a landmark step in merging blockchain with traditional markets. The proposal would allow investors to choose between conventional stock trades and blockchain-backed tokens flagged at settlement. It's official. @Nasdaq filed with @SECGov to enable tokenized securities trading, a historic move by a U.S. traditional exchange. Tokenization is now becoming Wall Street policy, and Sonic is the fast, global chain built to scale it. pic.twitter.com/4rI8WNy7bz — Sonic (@SonicLabs) September 8, 2025 If approved, the move would not only modernize financial markets but also underscore the growing relevance of blockchain infrastructure in mainstream finance. At the same time, institutions and sovereign players continue to accumulate Bitcoin. Japanese firm Metaplanet added 136 BTC this week, raising its holdings to more than 20,000 BTC (over $2 billion). Market in Gear: Metaplanet buys 136 $BTC , holdings now worth $2B+ El Salvador adds 21 #BTC for Bitcoin Day, bringing total to 6,313.18 BTC Fidelity launches tokenized US Treasuries fund on Ethereum #SmartDelivery pic.twitter.com/5WqmQwG15u — Bitget (@bitgetglobal) September 8, 2025 El Salvador marked “Bitcoin Day” with a symbolic purchase of 21 BTC, lifting national reserves to 6,313 BTC. And Michael Saylor’s Strategy acquired another 1,955 BTC, worth about $217 million, bringing its total stash to 638,460 BTC, cementing its position as the largest corporate holder worldwide. These combined moves signal that Bitcoin is not only being adopted at the financial infrastructure level but is also being increasingly absorbed by long-term holders, thereby reducing the available supply. MICHAEL SAYLOR JUST BOUGHT $217M $BTC AT $111,196 STRATEGY CURRENTLY HOLDS $71.58 BILLION OF BITCOIN AVERAGE PRICE: $73,880 pic.twitter.com/8X0G6RQ0py — Arkham (@arkham) September 8, 2025 What These Moves Mean for Bitcoin The implications of these events extend far beyond the headlines. Nasdaq’s tokenization leap could accelerate institutional adoption, providing new legitimacy for blockchain-based settlement and giving Bitcoin indirect exposure through increased trust in the ecosystem. Sovereign and corporate purchases underscore a growing conviction that Bitcoin can serve as a hedge against economic fragility and fiat currency devaluation, Metaplanet’s goal of reaching 210,000 BTC by 2027 underlines this strategic shift. Constrained supply —with more than 19.9 million BTC mined and fewer than 1.1 million left to be issued—means that institutional buying directly amplifies scarcity pressures. Together, these drivers create a foundation for Bitcoin to extend its gains higher, provided technical levels remain aligned. Bitcoin (BTC/USD) Technical Outlook: Triangle Breakout in Focus Bitcoin is consolidating in an ascending triangle, a bullish continuation pattern. Price is at $112,387, pressing against resistance at $113,400 and making higher lows since late August. The 50 SMA at $111,230 is support, while the 200 SMA at $112,777 is the immediate resistance. A sustained EMA crossover here would add fuel to the fire. Candlestick action has gone from indecision (Doji and spinning tops) to green closes, accumulation. The RSI at 62 remains firm but not overheated, suggesting upside room remains before momentum stretches. Bitcoin Price Chart – Source: Tradingview If Bitcoin breaks $113,400 with volume, the following upside targets sit at $115,400 and $117,150, levels highlighted by TradingView’s breakout path. Such a move would confirm that recent compression was the staging ground for renewed strength. Conversely, a failure to hold $111,500 risks a drop to $110,000 or $108,450; however, the rising trendline suggests that dips remain corrective rather than signs of reversal. For traders, a long entry above $113,400 presents an attractive setup, with stops placed below $111,200 to manage risk. A breakout could position Bitcoin for its next leg higher, potentially setting the stage for a push toward six-figure territory and even the $130,000 milestone in the coming cycle. Presale Bitcoin Hyper ($HYPER) Combines BTC Security With Solana Speed Bitcoin Hyper ($HYPER) is positioning itself as the first Bitcoin-native Layer 2 powered by the Solana Virtual Machine (SVM). Its goal is to expand the BTC ecosystem by enabling lightning-fast, low-cost smart contracts, decentralized apps, and even meme coin creation. By combining BTC’s unmatched security with Solana’s high-performance framework, the project opens the door to entirely new use cases, including seamless BTC bridging and scalable dApp development. The team has put strong emphasis on trust and scalability, with the project audited by Consult to give investors confidence in its foundations. Momentum is building quickly. The presale has already crossed $14.6 million, leaving only a limited allocation still available. At today’s stage, HYPER tokens are priced at just $0.012875—but that figure will increase as the presale progresses. You can buy HYPER tokens on the official Bitcoin Hyper website using crypto or a bank card. Click Here to Participate in the Presale The post Bitcoin Price Prediction: Nasdaq’s Tokenized Stocks and Whale Buys Boost $130K Hype appeared first on Cryptonews .",Price Analysis|Bitcoin|Cryptocurrency,EN,0,0,CRYPTOCURRENCY|BTC|TRADING|MARKET|BUSINESS,"{'name': 'cryptonews', 'img': 'https://images.cryptocompare.com/news/default/cryptonews.png', 'lang': 'EN'}",cryptonews,2025-09-08 22:55:05
51415197,https://cointelegraph.com/news/sec-financial-surveillance-privacy-crypto-task-force,1757372340,https://images.cryptocompare.com/news/default/cointelegraph.png,US SEC crypto task force to tackle financial surveillance and privacy,https://cointelegraph.com/news/sec-financial-surveillance-privacy-crypto-task-force?utm_source=rss_feed&utm_medium=rss&utm_campaign=rss_partner_inbound,The task force has already conducted roundtables to address issues related to digital asset regulation while proposing changes to the commission's rules.,,EN,0,0,CRYPTOCURRENCY|REGULATION,"{'name': 'CoinTelegraph', 'img': 'https://images.cryptocompare.com/news/default/cointelegraph.png', 'lang': 'EN'}",cointelegraph,2025-09-08 22:59:00
51415167,https://ambcrypto.com/?p=526268,1757372421,https://images.cryptocompare.com/news/default/ambcrypto.png,Altcoins are shifting: Why the crypto market can see a major rotation soon,https://ambcrypto.com/altcoins-are-shifting-why-the-crypto-market-can-see-a-major-rotation-soon/,Dropping BTC.D and rising outflows start talk of an incoming mega altseason.,Altcoin|Bitcoin|BTC Trading View|News|News 1|Social|Trading View,EN,0,0,ALTCOIN|CRYPTOCURRENCY|MARKET|BTC,"{'name': 'AMB Crypto', 'img': 'https://images.cryptocompare.com/news/default/ambcrypto.png', 'lang': 'EN'}",ambcrypto,2025-09-08 23:00:21
51415125,https://www.newsbtc.com/?p=818213,1757372424,https://resources.cryptocompare.com/news/21/51415125.jpeg,Tom Lee Predicts $200K Bitcoin — Peter Schiff Isn’t Buying It,https://www.newsbtc.com/news/bitcoin/tom-lee-predicts-200k-bitcoin-peter-schiff-isnt-buying-it/,"Peter Schiff has renewed his critique of Bitcoin as Tom Lee of Fundstrat pushes a headline-grabbing $200,000 price target for the cryptocurrency. Related Reading: Why $50 XRP By December 2025 Isn’t ‘Hopium’ If ETFs Get Greenlight: Analyst According to reports, Lee says the market’s recent weakness is tied to the Federal Reserve’s reluctance to cut interest rates, while Schiff points to gold’s recent rally as a warning sign for Bitcoin. Schiff Points To Gold’s Rally In an X post, the gold bug Schiff highlighted that the yellow metal rose 10% over the last two months and reached a new high of $3,620. “Markets are forward-looking. That’s why gold is up 10% in advance of coming rate cuts,” he said, arguing that gold’s move shows traders expect easier policy ahead. Bitcoin, he added, has not followed gold’s lead, and that gap worries him. Permabull @fundstrat forecast Bitcoin will hit $200K by year-end, as Bitcoin is sensitive to Fed rate cuts. He said the Fed’s two-month pause is why Bitcoin hasn’t rallied over that time period. But gold rallied 10% during those two months, hitting a record $3,620 as he spoke. — Peter Schiff (@PeterSchiff) September 8, 2025 Lee’s $200,000 Call And His Explanation Tom Lee remains optimistic. He has argued that the influx of institutional investors gives Bitcoin new “counter-cyclical characteristics,” and that bigger players could push prices much higher over time. Based on reports, Lee blames the recent underperformance on the Fed and keeps the $200,000 figure in public view. His stance continues to make him one of Wall Street’s best-known permabulls – persons who maintain a perpetually optimistic outlook. Market Odds And Traders’ View Polymarket users appear unconvinced by Lee’s timetable. At press time, markets show an 8% chance of Bitcoin reaching $200k this year. The same markets place roughly an 8% chance on Bitcoin dropping below $70,000 by the end of 2025. Those odds suggest bettors are split and that headline targets are being treated with skepticism. Source: Polymarket A Broader Performance Check Schiff has also pointed to longer-term measurements. He noted that Bitcoin is down 16% against gold over the past four years, even though the cryptocurrency has posted strong gains versus the US dollar in that span. He warned that when “more air” comes out of the Bitcoin bubble, the four-year returns may look weak. The idea that the old four-year cycle tied to halvings may be fading was raised by other analysts in recent commentary, and that debate is ongoing. Related Reading: Tighter Premiums Put Crypto Treasuries On Risky Road, According To NYDIG What Comes Next For Bitcoin Schiff went further by saying Bitcoin is more likely to sink below $100k than to reach $200k, putting a cautious spin on the outlook. This view makes clear where Schiff stands: he treats gold’s rally as a forward signal about future policy and believes Bitcoin’s lag is not a short-term quirk but a structural concern. Lee’s counter is that institutional flows could change how Bitcoin moves over time. Featured image from Meta, chart from TradingView",Bitcoin|bitcoin|btc|btcusd|crypto|fed|Fundstrat|gold|peter schiff|Polymarket|Tom Lee|yellow metal,EN,0,0,CRYPTOCURRENCY|BTC|FIAT|MACROECONOMICS|MARKET,"{'name': 'NewsBTC', 'img': 'https://images.cryptocompare.com/news/default/newsbtc.png', 'lang': 'EN'}",newsbtc,2025-09-08 23:00:24
51415174,https://en.coinotag.com/alterego-wearable-from-mit-research-could-enable-silent-speech-to-control-ai/,1757372434,https://resources.cryptocompare.com/news/77/51415174.jpeg,AlterEgo Wearable From MIT Research Could Enable Silent Speech to Control AI,https://en.coinotag.com/alterego-wearable-from-mit-research-could-enable-silent-speech-to-control-ai/,"AlterEgo wearable is a non‑invasive silent communication device that decodes subvocal neuromuscular signals from the face and throat into text or commands using machine learning, while returning private audio via",News,EN,0,0,RESEARCH,"{'name': 'CoinOtag', 'img': 'https://resources.cryptocompare.com/news/77/default.png', 'lang': 'EN'}",coinotag,2025-09-08 23:00:34
51415133,576070,1757372450,https://resources.cryptocompare.com/news/13/51415133.jpeg,"El Salvador’s Bitcoin Journey Hits 4-Year Mark, Results Still Divisive",https://bitcoinist.com/el-salvadors-bitcoin-journey-hits-4-year-mark-results-still-divisive/,"El Salvador marked the fourth anniversary of its Bitcoin legal tender law with another purchase — a deliberate, headline-ready buy that keeps the country’s crypto holdings on display. Government Figures Show 21 BTC Were Added According to President Nayib Bukele and the country’s Bitcoin Office, the government bought 21 BTC on Sunday as a symbolic nod to Bitcoin’s 21 million supply cap. Reports show the state has continued buying one BTC per day. The buying has been carried out since March 2024. Based on government figures and blockchain data, El Salvador now holds 6,313 BTC. The holdings are valued at about $700 million at current prices. Small in daily budget terms, these moves carry big political weight. Buying 21 bitcoin for Bitcoin Day. pic.twitter.com/3X4yKeiqzg — Nayib Bukele (@nayibbukele) September 7, 2025 Clash With IMF Loan Terms Reports have disclosed that the purchases confound a $1.4 billion IMF loan agreement signed in December last year. The deal required public entities to halt voluntary accumulation of Bitcoin and called for a freeze on further acquisitions under the finalized Extended Fund Facility. As part of the agreement, the government revised the Bitcoin Law so merchant acceptance is voluntary, agreed to liquidate the Fidebitcoin trust, and planned an exit from the Chivo wallet program. Yet purchases have continued. That has left IMF officials and outside observers watching whether future disbursements will be granted, since compliance reviews are scheduled through 2027. IMF Estimates And The Question Of Disclosure Based on an IMF report from March, the fund estimates El Salvador spent roughly $300 million on Bitcoin since 2021. At current market levels, those purchases represent more than $400 million in unrealized gains. But the IMF also noted that limited disclosure around transactions and holdings makes a full independent assessment difficult. Government disclosure of Bitcoin activity remains incomplete, even with public dashboards now in place. Reports have noted that unrealized gains could be affected if market prices decline. On Bitcoin, Security Moves And Public Transparency Late last month, the National Bitcoin Office redistributed holdings across multiple addresses, placing a cap of roughly 500 BTC per address. Officials said the change was motivated by concerns about future quantum computing threats . The new addresses were published on a public dashboard, a move intended to boost clarity over custody. Some market and industry observers welcome the dashboard. Others say the quantum argument sounds precautionary and that clearer audit standards are still needed. Bold But Divisive Four years after adopting Bitcoin as legal tender, El Salvador’s approach is still splitting opinion. Supporters say the country has built strong gains and stayed committed to its plan, while critics warn it has created problems with international lenders. The anniversary shows that El Salvador’s Bitcoin push is still seen by many as bold, but also deeply disputed. Featured image from Unsplash, chart from TradingView",Bitcoin|bitcoin|btc|btcusd|crypto|El Salvador|IMF|Legal Tender|Nayib Bukele,EN,0,0,CRYPTOCURRENCY|BTC|MARKET|REGULATION|BLOCKCHAIN,"{'name': 'Bitcoinist', 'img': 'https://images.cryptocompare.com/news/default/bitcoinist.png', 'lang': 'EN'}",bitcoinist,2025-09-08 23:00:50
