id,guid,published_on,imageurl,title,url,body,tags,lang,upvotes,downvotes,categories,source_info,source,date
51394045,https://www.cryptopolitan.com/?p=802611,1757397623,https://resources.cryptocompare.com/news/43/51394045.jpeg,Bybit taps Sygnum Bank for Swiss-regulated custody and off-exchange settlement,https://www.cryptopolitan.com/bybit-taps-sygnum-bank-for-swiss-regulated-custody-and-off-exchange-settlement/,"In this post: Bybit has partnered with Sygnum Bank to provide institutional clients with secure and off-exchange custody of their digital assets via the Sygnum Protect Platform. The collaboration allows the exchange’s clients to hold assets off-balance sheet at Sygnum Bank while trading spot and derivatives on Bybit. Asset balances on the exchange and trading P&L will be settled automatically every eight hours for capital efficiency and operational transparency. Bybit has partnered with global digital asset group Sygnum to provide institutional clients with secure, off-exchange custody. The world’s second-largest crypto exchange by trading volume said it will offer off-exchange custody through the Sygnum Protect Platform. Bybit said the collaboration with the bank positions the company as a trusted partner for institutions. The integration combines the crypto exchange’s broad product range and deep liquidity with the bank-grade security of Swiss-regulated custody. Bybit hopes to strengthen institutional crypto security Counterparty risk awareness in the crypto industry moves in cycles, with peaks triggered by major crises. The Bybit hack, arguably the most significant risk-off event since the FTX collapse in November 2022, is shaping up to be the catalyst for the next wave of heightened… pic.twitter.com/TAxkI1Nra6 — Sygnum Bank (@sygnumofficial) February 26, 2025 The Dubai-based crypto exchange revealed that its clients can now hold assets off-balance sheet at Sygnum Bank while trading spot and derivatives on Bybit. The initiative will instantly mirror asset balances on the exchange. According to Bybit, trading P&L will also be settled automatically every eight hours to ensure both capital efficiency and operational transparency. Bybit said it chose Sygnum Protect because it’s the largest bank-operated Off-Exchange Custody platform. The bank also currently covers crypto exchanges that collectively account for over 50% of global spot and derivatives volumes. The crypto exchange said the initiative reinforces its commitment to providing institutional investors with the highest standards of security, resilience, and trust. Sygnum integrates multiple security layers, including advanced software-hardware controls, strict governance and independent audits. The bank also integrates the legal protection of bankruptcy-remote asset custody under Swiss banking law. The crypto exchange argued that Sygnum’s security measures give institutional clients peace of mind that their assets are safeguarded even in times of market uncertainty. Dominic Lohberger, Sygnum’s chief product officer, said the organization is committed to working with leading exchanges to enhance the resilience of the crypto industry and empower institutions to trade with peace of mind. He noted that the rapid adoption of Sygnum Project by institutional clients trading on Binance, Deribit, and now Bybit, suggests the urgent need for bank-grade, off-balance sheet custody solutions. Bybit plans to expand its custody ecosystem Bybit said it plans to expand its custody ecosystem, having built a robust network of trusted custody partners, including Fireblocks, Copper, and Cactus. The firm said the custody ecosystem gives its clients flexibility and confidence in safeguarding their assets. “Our partnership with Sygnum Bank not only gives clients access to Bybit’s industry-leading products and liquidity, but also ensures their assets are safeguarded with the highest standards of Swiss banking. Together, we are building a secure and transparent foundation for institutions to trade with confidence.” -Yoyoo Wang, Head of Bybit’s Business-to-Business Unit (BBU). The B2B official also acknowledged that crypto and stablecoin infrastructure is evolving and managing counterparty risks is essential for further institutional adoption. The crypto exchange added that the collaboration with Sygnum Bank marks a new milestone in its strategy and will bring regulated, bank-grade off-exchange custody into the Bybit ecosystem. Sygnum revealed that the next phase of its roadmap will be to introduce automated collateral transfers between exchanges. The bank hopes to further enhance capital efficiency and asset allocation for institutional clients. Bybit also said the partnership complements its mission of creating a secure, transparent, and innovative trading environment for institutions to thrive in the crypto industry.",Industry Thoughts,EN,0,0,CRYPTOCURRENCY|EXCHANGE|FIAT|TRADING|REGULATION,"{'name': 'Cryptopolitan', 'img': 'https://images.cryptocompare.com/news/default/cryptopolitan.png', 'lang': 'EN'}",cryptopolitan,2025-09-09 06:00:23
51431251,https://ambcrypto.com/?p=526399,1757397633,https://images.cryptocompare.com/news/default/ambcrypto.png,Paxos proposes USDH stablecoin with 95% buybacks to boost HYPE ecosystem,https://ambcrypto.com/paxos-proposes-usdh-stablecoin-with-95-buybacks-to-boost-hype-ecosystem/,Could Paxos’s USDH stablecoin spark the next DeFi boom?,Altcoin|News|News 1|Social|Stablecoins|Trading View,EN,0,0,CRYPTOCURRENCY|ALTCOIN,"{'name': 'AMB Crypto', 'img': 'https://images.cryptocompare.com/news/default/ambcrypto.png', 'lang': 'EN'}",ambcrypto,2025-09-09 06:00:33
51431210,576210,1757397640,https://resources.cryptocompare.com/news/13/51431210.jpeg,XRP Futures Cooloff: Binance OI Declines 37% From Peak,https://bitcoinist.com/xrp-futures-cooloff-binance-oi-declines-37-peak/,"Data shows the XRP Open Interest on cryptocurrency exchange Binance has seen a significant drop recently, a sign traders are repositioning. XRP Binance Open Interest Has Dropped To $1.1 Billion As pointed out by an analyst in a CryptoQuant Quicktake post , XRP traders on Binance have closed off futures market positions recently. The indicator of relevance here’s the “ Open Interest ,” which measures the total amount of derivatives positions related to XRP that are currently open on a given exchange. When the value of the metric goes up, it means users are setting up fresh positions on the platform. Generally, the total leverage in the sector increases when new positions pop up, so this kind of trend can lead to the asset’s price behaving in a more volatile manner. On the other hand, the indicator observing a decline suggests traders are either closing up positions of their own volition or getting forcibly liquidated by the exchange. The cryptocurrency may become more stable following such a trend, due to the reduced leverage. Now, here is a chart that shows the trend in the XRP Open Interest for the largest digital asset exchange by trading volume, Binance: As displayed in the above graph, the XRP Binance Open Interest saw a sharp surge between late 2024 and early 2025, implying the price surge was accompanied by a wave of speculative positioning from the investors. As bullish momentum cooled off, mass liquidations took place and investors started pulling back on their positions, leading to a plummet in the indicator. From the chart, it’s visible that the metric remained at its lows until the rally in July. This price surge was once again accompanied by a burst of speculative interest in the XRP market, but the Open Interest spike lasted only briefly as another deleveraging event soon followed. At its peak in July, the metric hit the $1.76 billion mark, but today, it has come down to $1.1 billion, implying a significant decline of over 37%. Though, while the drawdown has been steep, the indicator’s current value is still high when compared to the past. “The stabilization of OI near $1.1 billion after the peak, along with the price’s decline from its highs, indicates a repositioning phase,” explains the quant. “Leveraged positions remain in the market, but at a lower level than during the July/August peak.” Where the XRP Open Interest heads next may be interesting to watch, as it could have a direct impact on the stability of the market. A surge from here without a price rally, for instance, would make traders more vulnerable to a long squeeze . XRP Price XRP has enjoyed a price jump of more than 3.5% over the last 24 hours that has taken its price to the $2.93 level.",XRP|binance|XRP futures|XRP Open interest|XRPUSDT,EN,0,0,CRYPTOCURRENCY|XRP|EXCHANGE|TRADING|BNB,"{'name': 'Bitcoinist', 'img': 'https://images.cryptocompare.com/news/default/bitcoinist.png', 'lang': 'EN'}",bitcoinist,2025-09-09 06:00:40
51431204,https://www.newsbtc.com/?p=818345,1757397641,https://resources.cryptocompare.com/news/21/51431204.jpeg,This Week In Crypto: What Investors Need To Know And Why It Matters,https://www.newsbtc.com/news/this-week-in-crypto-what-investors-need-to-know-and-why-it-matters/,"This week is shaping up to be critical for the broader crypto market, marked by a prevailing sense of caution as prices consolidate ahead of their next direction. According to market analysis firm Bull Theory, the forthcoming Federal Open Market Committee (FOMC) meeting is on the horizon, and its outcome will largely hinge on the economic data released this week. Stability Or Further Pressure For Crypto? The Federal Reserve (Fed) has two primary mandates: to maintain inflation around 2% and to support employment levels. Currently, the landscape appears challenging, with rising unemployment juxtaposed against persistent inflation. Related Reading: Solana Rally in Sight? Traders Eye Breakout That Could Push SOL Toward $250 On September 9, the Bureau of Labor Statistics will revise the previous year’s non-farm payrolls (NFP). This annual revision often reveals downward adjustments, indicating weaker job growth than initially reported. For instance, last August, the revision was significantly lower than expected, with a downward adjustment of 818,000 jobs—the second worst in US history. This prompted the Fed to implement a more aggressive 50 basis point cut instead of the anticipated 25 basis points. If this repeats, it could raise the likelihood of another substantial cut, which would be viewed positively for liquidity and, by extension, the crypto market. The Producer Price Index (PPI) report, scheduled for September 10, will provide insights into inflation at the business level. A PPI reading that meets or falls below expectations is likely to boost market sentiment, while a higher-than-expected figure could dampen it. Last month, the PPI was unexpectedly high, coinciding with Bitcoin’s (BTC) peak near $124,000 before it began to cool. A softer PPI this time could grant the Fed more leeway to implement cuts, alleviating pressure on cryptocurrencies. Three Scenarios For Fed’s Upcoming Rate Cut Decision Following that, on September 11, the Consumer Price Index (CPI), a key inflation gauge, will be released. If CPI readings come in hotter than anticipated, it complicates the Fed’s decision-making process. For the crypto market, a CPI result at or below expectations would be the most favorable outcome. Also on September 11, initial jobless claims will be reported, indicating how many individuals filed for unemployment benefits last week. A higher-than-expected figure would signal weakness in the job market, thereby increasing pressure on the Fed to act. As all eyes turn to the FOMC meeting, the data collected this week will be instrumental in determining whether the Fed opts for a 25 basis point or a more aggressive 50 basis point cut. Related Reading: Dogecoin Leads Altcoin Rally Amid ETF Speculation: Is $1.50 the Next Big Target? There are three potential scenarios that could unfold. The first, a larger cut of 50 basis points, is likely if the NFP is sharply revised downwards, CPI and PPI data are soft, and jobless claims are high. This scenario, which indicates a rapidly weakening economy, could provide robust liquidity support for the market. However, the Bull Theory estimates this outcome has a 20%-25% probability. The second scenario, a standard cut of 25 basis points, appears more probable, with a 70%-74% chance. This would occur if NFP revisions are moderately weaker, CPI is slightly elevated, and jobless claims remain steady. While this would still be positive for crypto, it may not yield the same liquidity burst as a 50 basis point cut. Lastly, a scenario where the Fed pauses or delays changes is also possible. The firm asserts that if NFP data holds steady, CPI readings are hotter than expected, and jobless claims decrease, the Fed might take a more cautious approach, potentially leading to short-term pressures and further consolidation for Bitcoin and altcoins. Featured image from DALL-E, chart from TradingView.com",Cryptocurrency Market News|bitcoin|BTCUSDT|crypto|crypto market|crypto news|cryptocurrency|federal reserve|FOMC|FOMC Meeting|US Federal Reserve,EN,0,0,MACROECONOMICS|CRYPTOCURRENCY|MARKET|TRADING|BTC,"{'name': 'NewsBTC', 'img': 'https://images.cryptocompare.com/news/default/newsbtc.png', 'lang': 'EN'}",newsbtc,2025-09-09 06:00:41
51431344,https://cryptonews.com/?p=420401,1757397696,https://resources.cryptocompare.com/news/52/51431344.jpeg,US Devised Crypto Scheme to Erase Massive $35T Debt: Putin Advisor,https://cryptonews.com/news/us-devised-crypto-scheme-to-erase-massive-35t-debt-putin-advisor/,"Anton Kobyakov, a senior adviser to Russian President Vladimir Putin, made a bold claim that the US is preparing to use crypto to wipe out its massive $35 trillion national debt. Speaking at the Eastern Economic Forum in Vladivostok on Monday, he alleged that the US is “trying to rewrite the rules of the gold and cryptocurrency markets.” Remember the size of their debt — $35 trillion. These two sectors are essentially alternatives to the traditional global currency system,” Kobyakov said. Per the US Treasury data , the nation’s debt is more than $37 trillion now, which stood at $18.15 trillion ten years ago. The nation has seen a 10-fold increase in its debt since 1981. Further, he stated that Washington is attempting to solve its financial problems at the world’s expense. The nation’s debt will eventually be shifted into USD stablecoins to devalue it, he noted. This will ultimately shrink what it owns, allowing the US to “start from scratch,” Kobyakov added. He warned that this would push the world into what he calls the “crypto cloud.” The US Has a History of Debt Issues – Kobyakov Draws Historical Parallels According to Kobyakov, the current crisis is similar to two earlier resets in U.S. monetary history. The government was pushed to take unusual steps in the 1930s during the Great Depression. He also highlighted President Nixon’s 1970s decision to end the dollar’s final link to gold. “As in the 1930s and the 1970s, the US plans to solve its financial problems at the world’s expense,” he said, per a translated transcript. BREAKING: Putin’s advisor Kobyakov says 'The U.S. has devised a CRYPTO scheme to erase its massive $ 35 trillions debt at the world’s expense. pic.twitter.com/P0PWKq70aW — Megatron (@Megatron_ron) September 8, 2025 Kobyakov believes that today’s tools might just be serving an old goal with a modern twist, if the past is any guide. The US is Building Crypto Frameworks The US has been laying out rules for digital assets, with officials floating the idea of holding crypto as part of national reserves. For instance, Senator Cynthia Lummis said in May that Bitcoin “is the only solution” to the US’s $36 trillion debt. She promoted the BITCOIN Act, which urges the government to buy 1 million Bitcoin in the next five years and hold it for 20 years. Besides, US officials note that the stablecoin framework will focus more on ensuring that the USD remains a dominant currency. Scott Bessent, Secretary of the Treasury and a supporter of the GENIUS bill, has claimed it could help reduce the national debt . However, the debate is that it might have an opposite effect on the national debt. Stablecoins would increase demand for Treasuries, which means more debt issuance. The post US Devised Crypto Scheme to Erase Massive $35T Debt: Putin Advisor appeared first on Cryptonews .",Crypto Regulation News|Bitcoin|Debt|United States,EN,0,0,CRYPTOCURRENCY|BTC|REGULATION|FIAT|MACROECONOMICS,"{'name': 'cryptonews', 'img': 'https://images.cryptocompare.com/news/default/cryptonews.png', 'lang': 'EN'}",cryptonews,2025-09-09 06:01:36
51431320,https://bitcoinworld.co.in/?p=201428,1757397712,https://resources.cryptocompare.com/news/82/51431320.jpeg,CLAPS Crypto Casino Launches New Promotion: 100 Free Spins for Deposits Starting at €20,https://bitcoinworld.co.in/claps-crypto-casino-launches-new-promotion-100-free-spins-for-deposits-starting-at-e20/,"BitcoinWorld CLAPS Crypto Casino Launches New Promotion: 100 Free Spins for Deposits Starting at €20 Anjouan, Anjouan, September 9th, 2025, Chainwire In August 2025, CLAPS Crypto Casino announced a new bonus offer for new players. When making the first deposit of €20 or the equivalent in cryptocurrency, users can claim an extra 100 free spins — by using the promo code CLAPSFS100 at registration. These spins can be used on top-performing slot from Pragmatic Play Sweet Bonanza 1000. All free spins come with no wagering requirements, meaning players can withdraw their potential winnings immediately after playing — no extra conditions attached. CLAPS positions itself as a next-generation crypto casino: registration without verification, the ability to deposit from any wallet or buy crypto with a bank card, fast payouts, and weekly cashback. The platform already offers over 4,500 games and is actively expanding its bonus system for new users. This new offer is part of a larger 2025 strategy to attract the crypto-savvy audience. It targets those who want to try online casino gaming with zero risk but a chance to win. Promotion details, free spin terms, and the full list of eligible games are available on the official CLAPS Casino website — claps.com . About CLAPS CLAPS is a crypto-native iGaming platform built to offer a seamless, transparent, and high-speed experience for digital asset users. Designed with a web3-first approach, CLAPS combines on-chain transparency with the performance of off-chain systems to deliver a user-centric environment for gaming and sports betting. The platform supports a wide range of popular cryptocurrencies and includes integrated wallet solutions to simplify user onboarding. CLAPS also provides partnership opportunities through its affiliate program, fostering growth within the decentralized gaming ecosystem. Contact PR Manager Liubov l.perlyna@gmail.com This post CLAPS Crypto Casino Launches New Promotion: 100 Free Spins for Deposits Starting at €20 first appeared on BitcoinWorld and is written by chainwire",Press Release,EN,0,0,CRYPTOCURRENCY|FIAT,"{'name': 'Bitcoin World', 'img': 'https://resources.cryptocompare.com/news/82/default.png', 'lang': 'EN'}",bitcoinworld,2025-09-09 06:01:52
51431342,https://timestabloid.com/?p=82443,1757397756,https://resources.cryptocompare.com/news/67/default.png,Pundit Warns XRP Investors: This Is Going to Impact You and Your XRP,https://timestabloid.com/pundit-warns-xrp-investors-this-is-going-to-impact-you-and-your-xrp/,"Crypto commentator Austin Hilton has addressed XRP holders in a recent tweet and video, stating that the digital asset will likely remain in a period of limited price activity until the upcoming Federal Reserve meeting on September 17. He described the current situation as a “waiting game,” emphasizing that the Fed’s decision on interest rate cuts will directly influence overall market liquidity and, consequently, the price movement of XRP. Hilton explained that the Federal Reserve is expected to announce a reduction in interest rates, with his view being that a quarter-basis point cut is the most likely outcome. He added that a more aggressive 50 basis point cut would be a significant shock to markets, but did not expect that scenario to unfold. In his analysis, he projected that the Fed may implement at least one additional rate cut before the end of the year, and potentially as many as two, bringing the total number of reductions to three by the close of 2025. XRP Holders! Now We Wait! This IS Going To Impact YOU and YOUR XRP! pic.twitter.com/QGJqyEj5QT — Austin Hilton (@austinahilton) September 7, 2025 Short-Term Outlook for XRP Price According to Hilton, XRP’s price action is not expected to experience major developments in the days leading up to the Fed’s announcement. He observed that XRP is currently trading within a consolidation range between $2.80 and $3.30 and suggested that this range would likely persist until September 17. Although he acknowledged that XRP could climb back above $3, Hilton emphasized that substantial price shifts are unlikely in the short term, given the market’s anticipation of the Fed’s decision. Despite these near-term limitations, Hilton highlighted XRP’s 3% daily gain at the time of his video, noting that while modest, such increases are preferable to declines. He reiterated that until the Federal Reserve provides macroeconomic clarity, traders should expect XRP to remain confined within its existing trading boundaries. Longer-Term Projections and Market Expectations Looking beyond September, Hilton predicted that the final quarter of the year could bring significant bullish momentum to the cryptocurrency market. He said that October could mark the beginning of a gradual upward movement for XRP, with late October through December being the period where he expects a strong bull run to take shape. In his forecast, Hilton projected that Bitcoin could rise to between $150,000 and $200,000 during this period. For XRP, he stated that a price range of $10 to $20 is possible, representing a 3 to 7x increase from current levels. He stressed that such outcomes remain within the realm of possibility as broader market conditions shift with central bank policy adjustments and renewed capital flows into digital assets. Continued Accumulation and Personal Strategy Hilton disclosed that he has been consistently adding to his XRP holdings, purchasing more of the asset every week. He described the current market conditions as an attractive entry point for accumulation, while clarifying that his statements should not be taken as financial advice. In his view, September is best understood as a transitional month in which patience will be required before more favorable conditions develop in the fourth quarter. We are on X, follow us to connect with us :- @TimesTabloid1 — TimesTabloid (@TimesTabloid1) June 15, 2025 Hilton closed his video by reiterating that XRP holders should remain aware that the asset’s next significant movement will be tied closely to the Federal Reserve’s rate cut decisions. Until then, he believes the cryptocurrency will continue to move within its established trading range, with broader momentum resuming in the final months of the year. Disclaimer : This content is meant to inform and should not be considered financial advice. The views expressed in this article may include the author’s personal opinions and do not represent Times Tabloid’s opinion. Readers are advised to conduct thorough research before making any investment decisions. Any action taken by the reader is strictly at their own risk. Times Tabloid is not responsible for any financial losses. Follow us on X , Facebook , Telegram , and Google News The post Pundit Warns XRP Investors: This Is Going to Impact You and Your XRP appeared first on Times Tabloid .",Cryptocurrency|News|XRP|XRP Army|XRP Holders,EN,0,0,CRYPTOCURRENCY|XRP|MACROECONOMICS|TRADING|MARKET,"{'name': 'TimesTabloid', 'img': 'https://resources.cryptocompare.com/news/67/default.png', 'lang': 'EN'}",timestabloid,2025-09-09 06:02:36
51431501,https://www.investing.com/news/cryptocurrency-news/bitcoin-price-today-recovers-to-near-112k-on-rate-cut-bets-but-caution-persists-4230480,1757398094,https://resources.cryptocompare.com/news/106/default.png,"Bitcoin price today: recovers to near $112k on rate cut bets, but caution persists",https://www.investing.com/news/cryptocurrency-news/bitcoin-price-today-recovers-to-near-112k-on-rate-cut-bets-but-caution-persists-4230480,,,EN,0,0,BTC|CRYPTOCURRENCY|MACROECONOMICS|TRADING,"{'name': 'Investing.com Crypto News', 'img': 'https://resources.cryptocompare.com/news/106/default.png', 'lang': 'EN'}",investing_comcryptonews,2025-09-09 06:08:14
