id,guid,published_on,imageurl,title,url,body,tags,lang,upvotes,downvotes,categories,source_info,source,date
51420176,https://bitcoinworld.co.in/?p=201356,1757380512,https://resources.cryptocompare.com/news/82/51420176.jpeg,Crypto Laundering Unveiled: California Man Faces Serious Prison Time for $37M Scheme,https://bitcoinworld.co.in/california-crypto-laundering-sentence/,"BitcoinWorld Crypto Laundering Unveiled: California Man Faces Serious Prison Time for $37M Scheme The world of digital assets, while promising innovation and financial freedom, also grapples with serious challenges like crypto laundering . A recent, high-profile case highlights the severe consequences awaiting those who exploit this space for illicit gains. In a stark reminder of robust regulatory efforts and law enforcement’s growing capabilities, a California man has been sentenced to a substantial 51 months in prison for his central role in a massive $37 million crypto laundering operation. What Exactly Happened in This Shocking Crypto Laundering Scheme? This intricate case, first brought to light by Decrypt, details how U.S. federal prosecutors successfully pursued charges against the individual. The accused masterminded a sophisticated scam, leveraging trust and deceptive tactics. He engaged victims through persuasive messages and seemingly credible phone calls, building rapport under false pretenses. His goal was to entice them with promises of lucrative, high-return cryptocurrency investments, only to siphon off their hard-earned funds for himself. Victim Deception: The perpetrator skillfully built a façade of legitimacy, convincing numerous victims to transfer their money into what they believed were legitimate investment vehicles. Rapid Digital Conversion: Once acquired, the illicit funds were swiftly converted into USDT (Tether), a popular stablecoin. This conversion was a key step in the crypto laundering process, designed to obscure the money’s origins and make it significantly harder for authorities to trace. Massive Scale of Fraud: The operation successfully laundered an astonishing $37 million. This substantial figure underscores the significant financial impact and the broad reach of such sophisticated digital asset frauds. This detailed account provides a chilling look into the methods employed by criminals in the digital age, emphasizing the constant need for user vigilance. Why is Crypto Laundering a Growing Global Concern? The incident underscores a critical and evolving issue in the global digital economy: the persistent misuse of cryptocurrencies for illegal activities. While the underlying blockchain technology offers unprecedented transparency and immutability, bad actors relentlessly seek innovative ways to obscure their tracks and exploit perceived loopholes. The inherent characteristics of cryptocurrencies—such as the ease of cross-border transactions, the speed of transfers, and the potential for pseudo-anonymity—can unfortunately make them attractive tools for money launderers and other criminals. However, it is crucial to recognize that law enforcement agencies and financial intelligence units worldwide are becoming increasingly sophisticated in their methods for tracking, investigating, and prosecuting these complex digital crimes. This particular sentencing serves as a powerful and unambiguous deterrent, unequivocally demonstrating that illicit financial activities, even those conducted entirely within the digital asset space, will not go unpunished. The global effort to combat crypto laundering is intensifying, with significant resources being dedicated to tracing illicit flows. What Are the Far-Reaching Ramifications of Such Crypto Laundering Cases? The 51-month prison sentence handed down to the California man sends a clear, resounding message about the legal system’s unwavering commitment to combating financial crime in the digital realm. Such high-profile convictions have several profound and far-reaching ramifications, impacting victims, regulators, and the broader cryptocurrency industry: Justice for Victims: While full financial recovery is not always guaranteed, these legal actions are vital for providing a measure of justice and closure for those who suffered significant financial losses. They also deter future criminal activity. Enhanced Regulatory Scrutiny: Cases like this invariably spur further discussions, reviews, and the development of more robust cryptocurrency regulations. The aim is to create a safer, more compliant, and more trustworthy environment for all legitimate users and innovators within the digital asset space. Building Industry Trust: By actively identifying, apprehending, and prosecuting bad actors involved in crypto laundering , the cryptocurrency industry can gradually build greater trust with the public, traditional financial institutions, and governments. This is absolutely crucial for achieving wider mainstream adoption and fostering responsible innovation. This case emphatically highlights the critical importance of conducting thorough due diligence for anyone considering engaging with cryptocurrency platforms or individuals offering investment opportunities. Always verify legitimacy, research extensively, and remain highly skeptical of promises that seem too good to be true. Protecting yourself in this dynamic landscape is paramount. Protecting Yourself: Actionable Insights Against Crypto Laundering Scams To navigate the crypto world safely and avoid falling victim to similar scams or inadvertently participating in illicit activities, consider these actionable insights: Research Thoroughly: Before investing in any crypto project or platform, conduct extensive research. Check reviews, team backgrounds, and project whitepapers. Be Skeptical of High Returns: If an investment promises unusually high, guaranteed returns with little to no risk, it’s almost certainly a scam. Verify Identity: Always verify the identity of individuals offering investment advice or soliciting funds. Be cautious of unsolicited messages or calls. Use Reputable Exchanges: Stick to well-known, regulated cryptocurrency exchanges that have strong security protocols and comply with AML (Anti-Money Laundering) and KYC (Know Your Customer) requirements. Secure Your Wallets: Use strong, unique passwords, enable two-factor authentication (2FA), and consider hardware wallets for significant holdings. Report Suspicious Activity: If you encounter suspicious activity or believe you’ve been targeted by a scam, report it to the relevant authorities immediately. In conclusion, the sentencing of the California man for his central role in a $37 million crypto laundering scheme is a landmark event, signaling a new era of accountability in the digital asset space. It powerfully illustrates the unwavering commitment of federal prosecutors and global law enforcement to combating financial crime within the cryptocurrency ecosystem. This case serves as a vital reminder for both potential criminals and everyday users: the digital world is not a lawless frontier. Vigilance, robust security practices, and strict adherence to legal and ethical frameworks are absolutely paramount for fostering a secure, trustworthy, and ultimately prosperous digital future. The ongoing fight against crypto laundering is intensifying, but justice is increasingly catching up with those who seek to exploit the system for illicit gain. Frequently Asked Questions (FAQs) Q1: What is crypto laundering? Crypto laundering refers to the process of concealing the origins of illegally obtained funds by converting them into cryptocurrencies, then moving them through various digital wallets and exchanges to make them appear legitimate. Q2: How was the California man able to launder $37 million? He gained victims’ trust through messages and phone calls, posing as an investment opportunity. Once funds were received, he converted them into USDT to obscure their source, effectively laundering the money. Q3: What is USDT and why is it used in crypto laundering? USDT (Tether) is a stablecoin, meaning its value is pegged to the U.S. dollar. It’s often used in illicit activities because it offers liquidity and can be moved quickly across borders, making it a convenient tool for criminals to convert and transfer large sums while attempting to evade detection. Q4: What are the penalties for crypto laundering? Penalties for crypto laundering can be severe, including lengthy prison sentences, substantial fines, and forfeiture of assets. The specific punishment depends on the amount laundered, the jurisdiction, and the specifics of the crime, as evidenced by the 51-month sentence in this case. Q5: How can individuals protect themselves from crypto investment scams? Always conduct thorough research on any investment opportunity, be wary of promises of guaranteed high returns, verify the identity of those soliciting funds, use reputable and regulated exchanges, and enable strong security measures like two-factor authentication on your accounts. If it seems too good to be true, it likely is. This case serves as a critical reminder of the ongoing fight against digital financial crime. If you found this article insightful, please consider sharing it with your network to raise awareness about the dangers of crypto laundering and investment scams. Your vigilance helps create a safer crypto ecosystem for everyone! To learn more about the latest crypto crime trends, explore our article on key developments shaping cryptocurrency regulation. This post Crypto Laundering Unveiled: California Man Faces Serious Prison Time for $37M Scheme first appeared on BitcoinWorld and is written by Editorial Team",Crypto News|crypto crime|CRYPTOCURRENCY|federal prosecutors|Money Laundering|USDT,EN,0,0,CRYPTOCURRENCY|USDT|REGULATION|RESEARCH|BLOCKCHAIN,"{'name': 'Bitcoin World', 'img': 'https://resources.cryptocompare.com/news/82/default.png', 'lang': 'EN'}",bitcoinworld,2025-09-09 01:15:12
51420276,https://cointelegraph.com/news/us-is-using-stablecoins-devalue-debt-putin-advisor,1757380598,https://images.cryptocompare.com/news/default/cointelegraph.png,"Putin adviser claims US using stablecoins, gold to devalue its $37T debt",https://cointelegraph.com/news/us-is-using-stablecoins-devalue-debt-putin-advisor?utm_source=rss_feed&utm_medium=rss&utm_campaign=rss_partner_inbound,An adviser to Russian President Vladimir Putin is accusing the Trump administration of using stablecoins and gold to devalue its $37 trillion in outstanding debt.,,EN,0,0,FIAT|REGULATION,"{'name': 'CoinTelegraph', 'img': 'https://images.cryptocompare.com/news/default/cointelegraph.png', 'lang': 'EN'}",cointelegraph,2025-09-09 01:16:38
51420625,8db672b4-c131-4a03-b507-715bbface924,1757380931,https://resources.cryptocompare.com/news/5/51420625.jpeg,"Asia Morning Briefing: Equities Rally on Rate-Cut Bets, Crypto Stays Cautious",https://www.coindesk.com/markets/2025/09/09/asia-morning-briefing-equities-rally-on-rate-cut-bets-crypto-stays-cautious,"Good Morning, Asia. Here's what's making news in the markets: Welcome to Asia Morning Briefing, a daily summary of top stories during U.S. hours and an overview of market moves and analysis. For a detailed overview of U.S. markets, see CoinDesk's Crypto Daybook Americas. Crypto traders remain cautious ahead of Thursday’s U.S. CPI report, with BTC trading flat above $111,600, and ETH at $4,298. The CD20 , a measure of the performance of the largest digital assets, is trading above 4,000, up 1.6%. The August Nonfarm Payrolls miss , just 22,000 jobs added versus expectations of 75,000, pushed futures higher and dragged 2-year Treasury yields to year-lows as markets priced in 72 bps of cuts this year. Yet crypto remains rangebound, diverging from broader risk sentiment. Options markets confirm the defensive stance. QCP Capital noted in its recent Asia Market Update that risk reversals are increasingly skewed toward puts, with short-dated implied vols elevated into CPI. Polymarket data backs this positioning: ETH carries a 70% chance of staying above $4,600 this month but only 13% odds of breaking $5,600. Traders are bracing for turbulence, not chasing upside. SOL is the outlier , with odds of a new all-time high before 2026 rising sharply, signaling improving breadth beneath the surface. In a note to CoinDesk, market maker Enflux argues that the SEC’s forward-looking rules for token sales and listings, combined with the steady march of institutions like Coinbase into major indices, show how deeply crypto is embedding into the system. This is the “split-screen reality” of 2025: speculation dominates headlines, while adoption rails are being laid in the background. The legitimacy narrative also played out in real time on Friday. Michael Saylor’s Strategy was left out of the S&P 500 despite meeting all criteria, while Robinhood was unexpectedly included instead, sending its stock up 7% and underscoring that crypto-adjacent firms with diversified business lines may reach blue-chip status faster than pure treasury plays. WLFI’s turmoil illustrates the speculative side of the split-screen. The protocol froze over 270 wallets, including Justin Sun’s, to “protect users” after phishing-related compromises. ""On one side, speculative narratives like WLFI risk cannibalizing themselves through governance drama,"" Enflux wrote in its note. ""On the other hand, institutional-grade infrastructure and regulation are solidifying at a pace that suggests the rails for mainstream adoption are being laid faster than most expect."" Onchain data shows Sun’s transfers came hours after WLFI’s crash , which was instead driven by shorting and dumping across exchanges. Yet the freeze rattled whales and market makers – shocked that the free market of crypto could be broken by protocol governance fiat – with insiders asking: “If they can do it to Sun, who’s next?”. The takeaway: near-term volatility and governance drama may cap upside, but the deeper story is that crypto’s institutional and regulatory foundations are hardening. ""Structural legitimacy, not speculation, remains the real story of 2025,"" Enflux continued. For traders, that means bracing for CPI noise; for investors, it means the legitimacy story continues to build. Market Movement: BTC: Bitcoin is holding steady above $111K, with support from consolidation near key resistance levels and solid on‑chain support zones. Analysts suggest this stability could pave the way for a breakout, though some caution about a possible pullback toward $100K exists ETH: Ethereum’s price has eased slightly intraday, trading around $4.3K. This movement may reflect broader crypto market dynamics, including relatively subdued demand and positioning around current technical levels. Gold: Gold has surged to fresh record highs, recently hitting ~$3,636/oz, as expectations of U.S. interest rate cuts rise amid weak labor data, a soft U.S. dollar, geopolitical concerns, and continued central bank demand. Nikkei 225: Japan’s Nikkei 225 rose 0.9% to a record high and the Topix gained 0.52% as investors bet a new LDP leader could deliver fresh fiscal stimulus following Prime Minister Shigeru Ishiba’s resignation. S&P 500: U.S. stocks edged higher Monday, with the S&P 500 up 0.2%, as investors awaited inflation data to gauge the likelihood of a jumbo Fed rate cut next week. Elsewhere in Crypto Upbit Parent Files ‘GIWA’ Trademarks Amid Rumors of New Blockchain Launch ( CoinDesk ) How Trump Came Around to Crypto and What Crypto Wants in Return ( Bloomberg ) Kalshi’s $875 million in August trading volume, recent funding signal rising competition with Polymarket ( The Block )",Markets|btc|ETH|Asia|CPI|News,EN,0,0,CRYPTOCURRENCY|MACROECONOMICS|MARKET|ASIA|TRADING,"{'name': 'CoinDesk', 'img': 'https://resources.cryptocompare.com/news/5/default.png', 'lang': 'EN'}",coindesk,2025-09-09 01:22:11
51420529,https://bitcoinworld.co.in/?p=201362,1757381111,https://resources.cryptocompare.com/news/82/51420529.jpeg,Astounding ENA Purchase: Arthur Hayes Invests $1 Million,https://bitcoinworld.co.in/arthur-hayes-ena-purchase-2/,"BitcoinWorld Astounding ENA Purchase: Arthur Hayes Invests $1 Million The cryptocurrency world is buzzing with news of a significant move by a well-known figure. Arthur Hayes, the visionary co-founder of BitMEX, has just made a substantial ENA purchase , injecting over $1 million into the Ethena ecosystem. This isn’t just another transaction; it’s a statement that has caught the attention of investors and analysts alike. Understanding the Astounding ENA Purchase Details surrounding this major acquisition highlight its strategic nature. Reports from EmberCN confirm that Hayes acquired a staggering 1.395 million ENA tokens. This equates to approximately $1.01 million at the time of purchase. He executed this impressive ENA purchase through two prominent platforms: Binance and Flowdesk. The average price per token stood at a notable $0.73. Such a large-scale investment from a figure of Hayes’ stature often signals confidence in a project’s future. It prompts a closer look at the Ethena protocol and the potential trajectory of its native token, ENA. Who is Arthur Hayes and Why Does His ENA Purchase Matter? Arthur Hayes is not just any investor; he is a highly influential voice in the crypto space. As the co-founder and former CEO of BitMEX, one of the earliest and largest cryptocurrency derivatives exchanges, his insights and actions carry significant weight. His market commentary and investment decisions are closely watched by a global audience. Therefore, his recent ENA purchase is more than just a personal investment; it’s often interpreted as a bullish signal for the asset. Market Influence: Hayes’ public endorsements or investments can sway market sentiment. Strategic Acumen: Known for his deep understanding of market mechanics and macroeconomics. Early Adopter: Often identifies promising projects before they reach mainstream attention. What is the Ethena Protocol and Its ENA Token? To fully grasp the significance of Hayes’ investment, it’s essential to understand Ethena. The Ethena protocol is an innovative synthetic dollar protocol built on Ethereum. It aims to provide a censorship-resistant, scalable, and stable cryptocurrency solution. Its core offering is USDe, a synthetic dollar that maintains its peg through delta hedging staked Ethereum and Bitcoin. The ENA token, on the other hand, is the native governance token of the Ethena protocol. Holders of ENA can participate in the decentralized governance of the protocol. This includes voting on key decisions that shape its future development and operational parameters. A major ENA purchase by an influential figure like Hayes naturally brings more eyes to the protocol’s underlying technology and vision. Potential Implications of This Major ENA Purchase Hayes’ substantial investment could have several ripple effects across the crypto market, particularly for ENA. Firstly, it could generate increased interest and demand for the token. This heightened visibility might attract new investors who see his move as a vote of confidence. Secondly, it validates Ethena’s model in the eyes of many. An expert like Hayes putting significant capital into the project suggests he sees genuine value and potential for growth. However, it is crucial to remember that while influential endorsements can be positive, market dynamics are complex. Investors should always conduct their own research before making investment decisions. This ENA purchase serves as a strong indicator, but it doesn’t guarantee future performance. Arthur Hayes’ $1 million ENA purchase is undoubtedly a pivotal moment for the Ethena protocol and its community. It underscores the growing interest in innovative synthetic dollar solutions and the power of influential figures in the crypto landscape. As the market continues to evolve, keeping an eye on such strategic investments can offer valuable insights into emerging trends and potential future leaders in the decentralized finance space. Frequently Asked Questions (FAQs) About the ENA Purchase 1. Who is Arthur Hayes? Arthur Hayes is the co-founder and former CEO of BitMEX, a prominent cryptocurrency derivatives exchange. He is a highly influential figure in the crypto industry, known for his market insights and investment strategies. 2. What is ENA? ENA is the native governance token of the Ethena protocol. It allows holders to participate in the decentralized governance of the protocol, voting on important decisions related to its future. 3. What is the Ethena protocol? Ethena is a synthetic dollar protocol built on Ethereum. It provides USDe, a stablecoin that maintains its peg through delta hedging staked Ethereum and Bitcoin, offering a censorship-resistant and scalable solution. 4. Why is Arthur Hayes’ ENA purchase significant? His significant ENA purchase is seen as a strong vote of confidence in the Ethena protocol and its token. It often signals a bullish outlook from an influential expert, potentially attracting more attention and investment to ENA. 5. Where did Arthur Hayes acquire the ENA tokens? He acquired the 1.395 million ENA tokens through Binance and Flowdesk, at an average price of $0.73 per token. Did you find this analysis of Arthur Hayes’ significant ENA purchase insightful? Share this article with your network on social media to keep the conversation going and inform fellow crypto enthusiasts about this crucial market development! To learn more about the latest crypto market trends, explore our article on key developments shaping Ethena price action. This post Astounding ENA Purchase: Arthur Hayes Invests $1 Million first appeared on BitcoinWorld and is written by Editorial Team",Crypto News|Arthur Hayes|Crypto Investment|ENA|Ethena|Market Analysis,EN,0,0,CRYPTOCURRENCY|ENA|BLOCKCHAIN|MARKET|TRADING,"{'name': 'Bitcoin World', 'img': 'https://resources.cryptocompare.com/news/82/default.png', 'lang': 'EN'}",bitcoinworld,2025-09-09 01:25:11
51420613,https://en.coinotag.com/breakingnews/blockbeats-whale-spends-8m-usdt-to-acquire-911-8-eth-plus-35-28-wbtc-on-chain-analyst-ai-auntie-reports/,1757381248,https://resources.cryptocompare.com/news/77/51420613.jpeg,"BlockBeats: Whale Spends $8M USDT to Acquire 911.8 ETH (Plus 35.28 WBTC), On-Chain Analyst Ai Auntie Reports",https://en.coinotag.com/breakingnews/blockbeats-whale-spends-8m-usdt-to-acquire-911-8-eth-plus-35-28-wbtc-on-chain-analyst-ai-auntie-reports/,COINOTAG reported on September 9 that on-chain analyst Ai Auntie (@ai_9684xtpa) identified wallet 0x22a…6a2A0 as engaging in accumulation activity. The observation was recorded as occurring during a recent market downtrend,,EN,0,0,CRYPTOCURRENCY|ETH|USDT|ZRX|MARKET,"{'name': 'CoinOtag', 'img': 'https://resources.cryptocompare.com/news/77/default.png', 'lang': 'EN'}",coinotag,2025-09-09 01:27:28
51420758,https://en.coinotag.com/putin-adviser-suggests-us-may-use-bitcoin-stablecoins-and-gold-to-devalue-37-trillion-debt/,1757381349,https://resources.cryptocompare.com/news/77/51420758.jpeg,"Putin Adviser Suggests US May Use Bitcoin, Stablecoins and Gold to Devalue $37 Trillion Debt",https://en.coinotag.com/putin-adviser-suggests-us-may-use-bitcoin-stablecoins-and-gold-to-devalue-37-trillion-debt/,Russian adviser Anton Kobyakov alleges the US may use dollar-backed stablecoins and gold to reduce or devalue its roughly $37.4 trillion national debt by shifting obligations into crypto instruments; the,Analysis|News|BTC|Core|TRX,EN,0,0,CRYPTOCURRENCY|BTC|FIAT|MARKET|TRX,"{'name': 'CoinOtag', 'img': 'https://resources.cryptocompare.com/news/77/default.png', 'lang': 'EN'}",coinotag,2025-09-09 01:29:09
51420771,https://news.bitcoin.com/?p=754775&preview=true&preview_id=754775,1757381451,https://resources.cryptocompare.com/news/14/51420771.jpeg,Hashkey Plans to Launch Asia’s Largest Multi-Currency Digital Asset Treasury Fund,https://news.bitcoin.com/hashkey-plans-to-launch-asias-largest-multi-currency-digital-asset-treasury-fund/,"Hashkey aims to launch Asia’s largest digital asset treasury fund, unlocking a new era of institutional finance converging with crypto through a perpetual, multi-currency ecosystem. Hashkey Aims to Bridge Finance and Crypto With Digital Asset Treasury Fund Hashkey Group, a digital asset financial services firm based in Hong Kong, announced on Sept. 8 that it",Featured|bitcoin treasuries|ETF|Hong Kong,EN,0,0,CRYPTOCURRENCY|ASIA|DIGITAL ASSET TREASURY|MACROECONOMICS|REGULATION,"{'name': 'Bitcoin.com', 'img': 'https://images.cryptocompare.com/news/default/bitcoincom.png', 'lang': 'EN'}",bitcoin.com,2025-09-09 01:30:51
51421076,https://decrypt.co/?p=338569,1757381872,https://resources.cryptocompare.com/news/44/51421076.jpeg,"US Lawmakers Seek Treasury Report on Feasibility, Security of Government-Held Bitcoin",https://decrypt.co/338569/us-lawmakers-treasury-report-feasibility-security-government-bitcoin,The House spending bill seeks to direct the Treasury to assess the feasibility and governance of a Strategic Bitcoin Reserve.,|Law and Order,EN,0,0,BTC|CRYPTOCURRENCY|DIGITAL ASSET TREASURY|MACROECONOMICS|REGULATION,"{'name': 'Decrypt', 'img': 'https://images.cryptocompare.com/news/default/decrypt.png', 'lang': 'EN'}",decrypt,2025-09-09 01:37:52
