id,guid,published_on,imageurl,title,url,body,tags,lang,upvotes,downvotes,categories,source_info,source,date
51425235,https://bitcoinworld.co.in/?p=201390,1757388311,https://resources.cryptocompare.com/news/82/51425235.jpeg,Binance Alpha SWTCH: Exclusive Unveiling of a Revolutionary Listing,https://bitcoinworld.co.in/binance-alpha-swtch-listing/,"BitcoinWorld Binance Alpha SWTCH: Exclusive Unveiling of a Revolutionary Listing The cryptocurrency world is buzzing with significant news! Binance Alpha has officially announced the addition of SWTCH to its innovative on-chain trading platform. This exciting Binance Alpha SWTCH listing, effective September 9, marks a pivotal moment, opening new avenues for traders seeking early-stage coin opportunities within the secure and trusted environment of the Binance Wallet. What Makes the Binance Alpha SWTCH Listing a Game-Changer? Binance Alpha is not just another trading service; it is a specialized, on-chain platform integrated directly within the Binance Wallet. Its core mission focuses on identifying and listing promising early-stage cryptocurrencies, providing a unique entry point for investors. The addition of SWTCH on Binance Alpha highlights the platform’s commitment to innovation and growth. This dedicated service allows users to engage with nascent projects before they typically reach broader market exposure, potentially offering significant advantages to early adopters. Unlocking Exclusive Opportunities: Benefits of the SWTCH Listing on Binance Alpha The Binance Alpha SWTCH integration brings a host of benefits for both the project and the crypto community. For investors, it means: Early Access: Gain the chance to invest in SWTCH during its formative stages, which could lead to substantial returns if the project gains traction. Curated Selection: Binance Alpha’s focus on early-stage coins suggests a vetting process, potentially reducing some of the risks associated with entirely unknown projects. Seamless Integration: Trading SWTCH directly within the Binance Wallet offers unparalleled convenience and security, leveraging Binance’s robust infrastructure. For the SWTCH project itself, this listing on Binance Alpha SWTCH significantly boosts its visibility, liquidity, and overall credibility within the vast Binance ecosystem. Navigating the Early-Stage Crypto Market: What Should You Consider with SWTCH? While the prospect of early gains is enticing, it is crucial to approach early-stage crypto investments with a clear understanding of the inherent risks. The market for new projects can be highly volatile, and success is never guaranteed. When considering SWTCH on Binance Alpha , remember to: Conduct Thorough Research: Understand SWTCH’s whitepaper, team, technology, and use case. Assess Risk Tolerance: Only invest what you can afford to lose, as early-stage assets carry higher risk. Stay Informed: Follow project developments and market sentiment closely. Binance Alpha aims to provide a platform for these opportunities, but individual due diligence remains paramount for every investor. How Does On-Chain Trading Elevate Your Binance Alpha SWTCH Experience? The on-chain nature of Binance Alpha’s platform means that transactions for assets like Binance Alpha SWTCH occur directly on the blockchain. This method offers several key advantages: Transparency: All transactions are recorded on a public ledger, providing verifiable proof of ownership and activity. Security: By minimizing the need for off-chain intermediaries, on-chain trading can enhance security and reduce counterparty risk. Control: Users maintain greater control over their assets, as trades are executed directly from their Binance Wallet. This direct approach streamlines the trading process and reinforces trust in the platform, making the Binance Alpha SWTCH listing even more appealing for discerning traders. The Binance Alpha SWTCH listing represents a significant step forward for both Binance Alpha’s platform and the broader early-stage crypto market. By providing a secure and accessible avenue for trading promising new coins, Binance Alpha continues to solidify its position as a key player in the evolving digital asset landscape. This move not only expands the options available to traders but also underscores the growing demand for carefully curated early-stage investment opportunities. Frequently Asked Questions (FAQs) 1. What is Binance Alpha? Binance Alpha is an on-chain trading platform within the Binance Wallet specifically designed to list and facilitate trading of early-stage cryptocurrencies. 2. When was SWTCH added to Binance Alpha? Binance Alpha announced the addition of SWTCH on September 9. 3. What are the main benefits of trading early-stage coins on Binance Alpha? Benefits include early access to potentially high-growth projects, trading within the secure Binance Wallet environment, and leveraging Binance Alpha’s focus on curated early listings. 4. Is trading SWTCH on Binance Alpha considered risky? Like all early-stage cryptocurrency investments, trading SWTCH carries inherent risks due to market volatility and the nascent stage of the project. It is crucial to conduct thorough research and invest responsibly. 5. How does on-chain trading work on Binance Alpha? On-chain trading means transactions are executed directly on the blockchain, offering enhanced transparency, security, and user control, all integrated seamlessly within your Binance Wallet. If you found this article insightful, consider sharing it with your network! Help others discover the exciting developments surrounding the Binance Alpha SWTCH listing and the world of early-stage crypto opportunities. To learn more about the latest crypto market trends, explore our article on key developments shaping the cryptocurrency landscape and institutional adoption. This post Binance Alpha SWTCH: Exclusive Unveiling of a Revolutionary Listing first appeared on BitcoinWorld and is written by Editorial Team",Crypto News|BINANCE|crypto listing|Early-stage Coins|On-chain Trading|SWTCH,EN,0,0,CRYPTOCURRENCY|BNB|EXCHANGE|TRADING|MARKET,"{'name': 'Bitcoin World', 'img': 'https://resources.cryptocompare.com/news/82/default.png', 'lang': 'EN'}",bitcoinworld,2025-09-09 03:25:11
51425355,https://en.coinotag.com/breakingnews/bitcoin-sth-rp-only-0-69-low-volatility-and-high-concentration-point-to-imminent-market-inflection-blockbeats-news-sept-9/,1757388505,https://resources.cryptocompare.com/news/77/51425355.jpeg,"Bitcoin STH-RP Only 0.69% — Low Volatility and High Concentration Point to Imminent Market Inflection (BlockBeats News, Sept 9)",https://en.coinotag.com/breakingnews/bitcoin-sth-rp-only-0-69-low-volatility-and-high-concentration-point-to-imminent-market-inflection-blockbeats-news-sept-9/,"On-chain data analyst Murphy reported a period of low volatility coupled with elevated market concentration, noting the 7-day change in STH-RP (Short-Term Holder Realized Price) at just 0.69%. This subdued",BTC,EN,0,0,BTC|CRYPTOCURRENCY|MARKET|TRADING,"{'name': 'CoinOtag', 'img': 'https://resources.cryptocompare.com/news/77/default.png', 'lang': 'EN'}",coinotag,2025-09-09 03:28:25
51425444,https://bitcoinworld.co.in/?p=201389,1757388611,https://resources.cryptocompare.com/news/82/51425444.jpeg,"Massive Crypto Liquidations: $152M Wiped Out in 24 Hours, MYX Leads the Plunge",https://bitcoinworld.co.in/crypto-liquidations-market-impact-2/,"BitcoinWorld Massive Crypto Liquidations: $152M Wiped Out in 24 Hours, MYX Leads the Plunge The cryptocurrency market, known for its dynamic swings, recently witnessed a staggering event: over $152 million in crypto liquidations within just 24 hours. This sudden market movement has left many traders reeling and highlights the inherent volatility of digital asset trading. Understanding what drives these significant events is crucial for anyone involved in the crypto space. What Are Crypto Liquidations, and Why Do They Matter? At its core, a liquidation in the crypto world occurs when an exchange forcefully closes a trader’s leveraged position due to a sudden and substantial price movement against their trade. Traders use leverage to amplify their potential gains, but it also magnifies their risks. If the market moves unfavorably, the exchange closes the position to prevent the trader’s balance from falling below zero, effectively wiping out their collateral. These forced closures, or crypto liquidations , are a common feature of perpetual futures markets. They act as a critical mechanism to maintain market stability and prevent excessive risk-taking. However, when they happen on a large scale, they can create a cascading effect, pushing prices further in the direction of the initial move and trapping more traders. Who Led the Recent Wave of Crypto Liquidations? The latest data reveals a clear picture of the assets most affected by this dramatic market event. Here’s a breakdown of the largest perpetual futures liquidations by volume over the past 24 hours: MYX: $64.23 million – A significant portion, 82.38%, of these were short positions. This indicates that traders betting on a price decline for MYX were caught off guard by an unexpected upward movement or sideways consolidation. ETH: $48.97 million – Here, long positions accounted for 53.97%. This suggests that traders expecting Ethereum’s price to rise faced unexpected selling pressure, leading to their positions being closed out. BTC: $39.52 million – Bitcoin, the market leader, saw 56.2% of its liquidations come from short positions. Similar to MYX, this points to a squeeze on traders who were bearish on BTC’s immediate future. The dominance of MYX in these crypto liquidations is particularly noteworthy, signaling a specific event or trend impacting this particular asset that triggered a widespread unwinding of leveraged bets. Understanding Long vs. Short Liquidations: What Does It Mean? When we talk about long or short liquidations, we are referring to the direction of the trade that was closed. A ‘long’ position is a bet that an asset’s price will increase, while a ‘short’ position is a bet that its price will decrease. Therefore: Short liquidations occur when the price of an asset unexpectedly rises, forcing those who bet on a fall to close their positions. Long liquidations happen when the price of an asset unexpectedly drops, forcing those who bet on a rise to close their positions. The recent figures demonstrate a mixed bag, with MYX and BTC experiencing more short liquidations, while ETH saw more long liquidations. This diverse impact underscores the unpredictable nature of the market and the different pressures affecting various assets simultaneously. How Can Traders Navigate Volatile Periods and Avoid Crypto Liquidations? Navigating periods of high volatility requires a strategic approach. Here are some actionable insights to help mitigate the risk of forced crypto liquidations : Manage Leverage Wisely: While leverage can amplify gains, it dramatically increases risk. Use it cautiously and understand the liquidation price of your positions. Set Stop-Loss Orders: These orders automatically close your position if the price hits a predetermined level, limiting potential losses before a full liquidation occurs. Diversify Your Portfolio: Spreading investments across different assets can help reduce exposure to single-asset volatility. Stay Informed: Keep abreast of market news, economic indicators, and technical analysis to make more informed trading decisions. Ultimately, understanding the mechanisms behind crypto liquidations and implementing robust risk management strategies are paramount for long-term success in the crypto futures market. In conclusion, the recent $152 million in crypto liquidations serves as a potent reminder of the inherent risks and rewards in cryptocurrency trading. While such events can be daunting, they also offer valuable lessons in market dynamics and risk management. By staying informed and adopting disciplined trading practices, participants can better navigate these turbulent waters and potentially turn volatility into opportunity. Frequently Asked Questions (FAQs) What is a crypto liquidation? A crypto liquidation is the forced closure of a trader’s leveraged position by an exchange when the market moves against their trade, causing their margin balance to fall below a required threshold. Why did MYX have the highest crypto liquidations? MYX experienced the highest liquidations, predominantly from short positions, suggesting a significant price surge or an unexpected market move that caught bearish traders off guard. How do long and short liquidations differ? Long liquidations occur when the price drops, closing positions that bet on a rise. Short liquidations happen when the price rises, closing positions that bet on a fall. Can I prevent my crypto positions from being liquidated? While you cannot entirely prevent liquidations in extreme market conditions, you can mitigate the risk by using lower leverage, setting stop-loss orders, and maintaining sufficient margin in your account. What is the impact of large-scale crypto liquidations on the market? Large-scale liquidations can create a cascade effect, pushing prices further in the direction of the initial move, increasing volatility, and potentially leading to further liquidations across the market. Did you find this article insightful? Share it with your friends and fellow crypto enthusiasts on social media to help them understand the complexities of market liquidations and how to navigate them effectively! To learn more about the latest crypto market trends, explore our article on key developments shaping Bitcoin price action. This post Massive Crypto Liquidations: $152M Wiped Out in 24 Hours, MYX Leads the Plunge first appeared on BitcoinWorld and is written by Editorial Team",Crypto News|CRYPTOCURRENCY|Finance|futures|Market Analysis|trading.,EN,0,0,CRYPTOCURRENCY|TRADING|MARKET|BTC|ETH,"{'name': 'Bitcoin World', 'img': 'https://resources.cryptocompare.com/news/82/default.png', 'lang': 'EN'}",bitcoinworld,2025-09-09 03:30:11
51425473,https://news.bitcoin.com/?p=754641&preview=true&preview_id=754641,1757388624,https://resources.cryptocompare.com/news/14/51425473.jpeg,"Coinshares Set for Nasdaq Debut on $1.2B Valuation, 200% Expansion",https://news.bitcoin.com/coinshares-set-for-nasdaq-debut-on-1-2b-valuation-200-expansion/,"Coinshares is storming into the U.S. market with a $1.2 billion Nasdaq debut, aiming to dominate digital asset investing and scale its $10 billion platform globally. Coinshares Moves Toward Nasdaq Debut Backed by $1.2B Value and 200% Growth Coinshares International Ltd. (Nasdaq Stockholm: CS; US OTCQX: CNSRF) announced on Sept. 8 that it will merge",Featured|Coinshares|Initial Public Offering (IPO)|nasdaq,EN,0,0,CRYPTOCURRENCY|SPONSORED|MARKET,"{'name': 'Bitcoin.com', 'img': 'https://images.cryptocompare.com/news/default/bitcoincom.png', 'lang': 'EN'}",bitcoin.com,2025-09-09 03:30:24
3110759,https://www.cryptopolitan.com/?p=119161,1757389113,https://resources.cryptocompare.com/news/43/3110759.jpeg,ICP price prediction 2025-2031: Is ICP a good investment?,https://www.cryptopolitan.com/icp-price-prediction/,"Key takeaways: ICP is expected to attain a maximum price of $10.77 in 2025. Internet Computer protocol price forecast for 2028 expects the token to reach a peak price of $23.39. By 2031, the price of Internet Computer might reach a maximum of $38.01. Internet Computer (ICP) is a groundbreaking blockchain network developed by the DFINITY Foundation. It aims to extend the functionality of the internet, enabling it to host backend software and transforming it into a global, decentralized computer. Internet computer blockchain incorporates advanced cryptography and innovative technology to provide scalable, efficient, and secure decentralized applications (dApps). Given its robust technology and expanding utility, the Internet Computer blockchain’s future price prospects look promising. As more developers build on the platform and adoption increases, ICP token demand will likely rise. Does Internet Computer coin have a future? How much will Internet Computer coin cost in 2025? Will ICP reach $1000? Let’s get into the current price analysis and predictions. Overview Cryptocurrency Internet Computer Token ICP Price $4.88 Market Cap $2.62B Trading Volume $60.24M Circulating Supply 537.51M ICP All-time High $750.73 (May 10, 2021) All-time Low $2.86 (Sep 2023) 24-h High $4.95 24-h Low $4.80 Internet Computer Network technical analysis Metric Value Volatility (30-day period) 6.08% 14-Day RSI 42.43 50-Day SMA $5.29 Sentiment Neutral Fear & Greed Index 51 (Neutral) Green Days 12/30 (40%) 200-Day SMA $5.42 Internet Computer price analysis TL;DR Breakdown ICP shows a slight recovery on the daily chart, but remains below the moving average. The $4.96 resistance level is critical to ICP’s upside or breakdown. Internet Computer (ICP) coin must hold the $4.82 support to keep the current structure intact. ICP 1-day price analysis As seen on the ICP daily chart for September 9, the coin is hovering around $4.88, struggling just below the mid-Bollinger Band at $4.96. The MACD histogram has just turned positive after a long bearish stretch, hinting at an early momentum shift. ICPUSDT 1-day price chart by TradingView However, until a daily close clears $4.96 convincingly, upside remains capped, with the next resistance at $5.42. On the downside, $4.50 serves as the nearest support, and a break below it risks dragging the price back toward $4.30. ICP 4-hour price analysis The 4-hour chart shows ICP recently spiking toward $4.96 but facing rejection, now consolidating above the $4.82–$4.85 zone where short-term moving averages (Alligator) are clustered. ICPUSDT 4-hour price chart by TradingView The RSI sits near 55, meaning the coin is neither overbought nor oversold. Additionally, the OBV remains negative, suggesting buying pressure is still fragile. If the support at $4.82 holds, another test of $4.96 is likely. If the bears override the $4.82 level, ICP could slip to $4.75 or lower. ICP technical indicators: Levels and action Daily simple moving average (SMA) Period Value Action SMA 3 $4.82 BUY SMA 5 $4.86 BUY SMA 10 $4.91 SELL SMA 21 $5.06 SELL SMA 50 $5.29 SELL SMA 100 $5.24 SELL SMA 200 $5.42 SELL Daily exponential moving average (EMA) Period Value Action EMA 3 $4.81 BUY EMA 5 $4.86 BUY EMA 10 $4.97 SELL EMA 21 $5.11 SELL EMA 50 $5.23 SELL EMA 100 $5.35 SELL EMA 200 $5.90 SELL What to expect from ICP price analysis ICP needs a daily close above $4.96 to unlock upside toward $5.42. Until then, traders can expect choppy range-bound moves with the $4.82–$4.50 price region as key support zones. Is Internet Computer a good investment? The Internet Computer (ICP) has shown significant potential and volatility since its launch, which is common for relatively new and ambitious blockchain projects. Its technology aims to decentralize the internet and bring smart contract functionality to the web, which could have wide-ranging implications for the future of web speed. However, the market performance of ICP has been highly volatile, and its success depends heavily on the adoption of its technology and the broader market environment for cryptocurrencies. Please note that before you make an investment decision, seek independent professional consultation. Will Internet Computer reach $25? Yes, Internet Computer ICP might reach and surpass $25 as early as 2029. Will Internet Computer reach $50? Yes, Internet Computer is expected to reach $50. Though the current internet computer sentiment is sideways, future price movements and market cap are expected to be positive. Will ICP reach $1000? Although its ATH sits at $750.73, attaining $1000 in the foreseeable future might be impossible. ICP is down 99% from its ATH and will require a massive turnaround in market fortunes to recapture previous highs. However, current price levels provide a good buying opportunity. Where can I buy Internet Computer? You can buy Internet Computer on the crypto market via Binance, Bybit, Coinbase Exchange, OKX, KuCoin, and more . Does Internet Computer have a good long-term future? Yes, the Internet Computer coin shows a promising long-term future. Price predictions indicate steady growth, with a potential increase year-on-year, reflecting a positive trend and strong market potential. Recent news/opinion on ICP The DFINITY Foundation has rolled out upgrades to the Internet Computer’s governance dapp, adding a redesigned portfolio page, simplified reward and vote delegation tools, and new privacy and reporting features. The changes aim to lower entry barriers and make participation in DAOs more accessible for ICP holders. 🏛️ A Transparent and Rewarding #ICP Governance Participation We just completed a new milestone that improves the DAO participant experience. Let’s take a closer look at the first part of the endeavor – managing staking and rewards.👇 🧵 pic.twitter.com/TByr71zQhm — DFINITY Foundation (@dfinity) September 8, 2025 DFINITY brings LLMs to the Internet Computer ecosystem, allowing developers to build creative dapps, conversational AI in crypto wallets, and DAOs with sentiment analysis. ⭐ MAJOR UPGRADE ⭐ 🚀 With just a few lines of code, you can now use LLMs from within canister smart contracts on #ICP ♾️ Find details, examples and demos you can use to put this into practice, in the article below: https://t.co/UfJv5f6CeS — DFINITY Foundation (@dfinity) August 22, 2025 Internet Computer price prediction September 2025 In September 2025, ICP (Internet Computer) is expected to see a price range with a minimum of $4.05, an average of $4.75, and a maximum of $5.25. Month Minimum price Average price Maximum price ICP price prediction September 2025 $4.05 $4.75 $5.25 Internet Computer price prediction 2025 For 2025, ICP’s price is projected to range between a minimum of $4.15 and a maximum of $10.77, with an average estimate of $6.28. Year Minimum price Average price Maximum price ICP price prediction 2025 $4.15 $6.28 $10.77 Internet Computer price predictions 2026 – 2031 Year Minimum Price Average Price Maximum Price 2026 $10.72 $12.18 $13.64 2027 $15.59 $17.05 $18.52 2028 $20.47 $21.93 $23.39 2029 $25.34 $26.80 $28.26 2030 $30.21 $31.67 $33.14 2031 $35.08 $36.55 $38.01 Internet Computer price prediction 2026 In 2026, analysts suggest a maximum price of $13.64 for ICP. Traders and investors can anticipate an average price of $12.18 and a minimum price of $10.72. Internet Computer price forecast 2027 Projections suggest that in 2027, the Internet Computer (ICP) coin could peak at $18.52, with a minimum forecasted at $15.59 and an average of around $17.05. Internet Computer token price prediction 2028 In 2028, ICP could potentially reach a high of $23.39, with a projected low of around $20.47 and an average trading price of approximately $21.93. Internet Computer ICP price prediction 2029 The 2029 forecast indicates that ICP could reach up to $28.26, with an average price forecasted at $26.80 and a minimum expected around $25.34. Internet Computer ICP price prediction 2030 In 2030, ICP is expected to fluctuate between $30.21 and $33.14, with an average projected price of $31.67. Internet Computer ICP price prediction 2031 Prediction suggests that the price of ICP could potentially reach a peak of $38.01 by 2031, with a projected minimum of around $35.08 and an average of approximately $36.55. Internet Computer ICP price prediction 2025 – 2031 Internet Computer market price prediction: Analysts’ ICP price forecast Firm Name 2025 2026 Changelly $5.46 $6.73 Digitalcoinprice $10.68 $12.60 Coincodex $6.31 $14.26 Cryptopolitan’s Internet Computer (ICP) price prediction Cryptopolitan’s Internet Computer prediction showcases a gradual upward trajectory. In 2025, ICP is forecasted to range between $4 and $8, averaging around $6. Subsequent years show increasing potential, with projections for 2026 aiming at a maximum of $12 and averaging $8. By 2031, Cryptopolitan anticipates ICP could peak at $75, with an average price of around $58. Internet Computer historic price sentiment ICP Price history by Coingecko ICP began trading in June at $49.75. It peaked at $128.43 from June to August and dropped to $37.61. It fluctuated between $39.53 and $45.15 from September to November, ending November at $38.18. From December to February 2022, it ranged from $18.14 to $24.64. From March to August 2022, ICP declined significantly from $14.55 to $5.66. Between September and November, it continued to drop, ending at $3.52 in November. From March to November 2023, ICP prices fluctuated between $2.88 and $6.49, ending November at $3.77. From December 2023 to February 2024, ICP rose to $12.58 before closing February at $10.56. Between March and May, it ranged from $10.70 to $13.98, ending May at $11.21. June to August saw fluctuations between $5.88 and $13.00, while September traded around $9.55–$9.98. ICP peaked at $8.66 in October, averaged $12.20 in November, and started December strong at $12.44 before dropping 20% to close the year at $9.88. In January 2025, Internet Computer peaked at $12.5 but soon fell, hitting a low of $5.9 in February. In April, ICP maintained an average of $5.03, and in June, it traded between $4.34 and $6.31. July saw a high of $6.25 and a low of $4.67. In August, ICP maintained a trading range of $4.61 to $6.08. As of the time of writing, September, ICP is trading between $4.80 and $4.95.",Crypto Price Predictions,EN,0,0,TRADING|BLOCKCHAIN|TECHNOLOGY|ICP|MARKET|CRYPTOCURRENCY,"{'name': 'Cryptopolitan', 'img': 'https://images.cryptocompare.com/news/default/cryptopolitan.png', 'lang': 'EN'}",cryptopolitan,2025-09-09 03:38:33
