id,guid,published_on,imageurl,title,url,body,tags,lang,upvotes,downvotes,categories,source_info,source,date
49956138,https://timestabloid.com/?p=77999,1754975749,https://resources.cryptocompare.com/news/67/default.png,"Trend Watch 2025: The Top 10 Meme Coins to Invest Are Snek, Gigachad, and a Cat Ready to Leap 312%",https://timestabloid.com/trend-watch-2025-the-top-10-meme-coins-to-invest-are-snek/,"Ever had that moment when you check your portfolio and wish you’d bought just one week earlier? In the meme coin jungle of 2025, timing isn’t just important, it’s everything. Between Snek making waves on Cardano, Gigachad building its own crypto cult, and a live presale where staking pays double-digit APY before the token even launches, there’s serious money being made by those moving fast. The Top Meme Coins to Invest are the ones where momentum meets mechanics. Troller Cat is sitting in Stage 17 of its presale, with over $450,000 already raised and a projected ROI of 2,471.80% at listing. Prices climb every stage, so hesitation costs you entry power. Miss this window, and you’re watching from the sidelines while others cash in. 1. Troller Cat ($TCAT) Right now, Trollercat presale is priced at $0.00012859. That’s up from its humble $0.00000500 launch in Stage 1, with 17 of 26 stages complete and over 1,700 holders already on board. When it lists at $0.0005309, buyers today could be looking at gains north of 312%, and that’s just from price action, not the extras. This presale is anything but boring. Each stage celebrates a legendary trolling stunt, with Stage 17 honoring the cheeky “Short Shorts” jab at Wall Street. The branding is fun, the vibe is unapologetically mischievous, but under the surface sits an Ethereum-based project with a verified audit, KYC clearance, a deflationary Play-to-Earn Game Center, and a staking feature that’s drawing in yield hunters as fast as meme lovers. Staking With 69% APY Staking during a presale is rare. Staking at 69% APY while the price is still climbing? That’s almost unheard of. Trollercat lets you lock tokens instantly after buying, with rewards distributed automatically. You can unstake anytime, but to keep whales from dumping, the earned rewards stay locked for two months post-launch, a move designed to maintain price stability after listing. Picture this: invest $3,000 in Stage 17 at $0.00012859, hold until it hits $0.0005309, and you’re looking at around $12,390 from price appreciation alone. Factor in two months of staking rewards at 69% APY, and you’ve got a return that can pay off a loan, fund a trip, or even roll into your next big trade. That’s why $TCAT isn’t just another presale, it’s one of the Top Meme Coins to Invest if you want your bag to work overtime before it even hits the market. Why This Coin Made It to the List: High-yield staking, deflationary burns, and staged price growth make Troller Cat one of the smartest meme plays of the year. 2. Snek ($SNEK) Snek’s rise on the Cardano network has been nothing short of explosive. Its snake-themed branding resonates with a broad crypto audience, but it’s more than a meme; the token boasts consistent liquidity, an active DAO-driven treasury, and a steady schedule of token burns that support price stability. Holders participate in “Snek Challenges” for rewards, and Cardano’s low transaction fees make onboarding cheaper for new investors. The project also benefits from Cardano’s growing DeFi scene, with partnerships forming between Snek and Cardano-native dApps to create staking pools and yield opportunities. This cross-integration keeps the token relevant beyond just hype cycles, giving it real staying power in the Top Meme Coins to Invest category. Why This Coin Made It to the List: Low fees, consistent burns, and integration with Cardano DeFi make Snek an attractive long-term meme asset. 3. Gigachad ($GIGA) Gigachad has mastered the art of branding in crypto. It’s positioned as the ultimate “alpha” coin, with its community members calling themselves “The Chad Army.” Weekly meme battles, influencer partnerships, and competitive challenges create constant buzz, while the project’s tokenomics limit supply to create scarcity. Gigachad also invests heavily in social presence, dominating TikTok and Twitter with high-quality meme videos that spread virally. On-chain, GIGA runs a staking program with flexible terms, and plans to release an NFT series featuring rare Chad characters that double as governance passes. These mechanics turn GIGA from a short-term pump into a potential Top Meme Coins to Invest contender with real community engagement. Why This Coin Made It to the List: Scarcity, nonstop viral marketing, and an engaged holder base give GIGA the hype and structure to perform. 4. ANDY ($ANDY) ANDY’s strategy is pure nostalgia meets innovation. By reviving a beloved meme character, the project taps into long-standing internet culture while introducing gamified leaderboards for top holders. Holders can earn points by staking, trading, or participating in community challenges, and those points translate into airdrops or exclusive NFTs. The token supply is structured to reward long-term holders, with a portion locked for liquidity and community incentives. Strategic partnerships with meme NFT marketplaces ensure that ANDY’s branding stays visible across Web3 spaces, keeping it firmly on the Top Meme Coins to Invest radar. Why This Coin Made It to the List: A mix of nostalgia, gamification, and consistent visibility makes ANDY stand out from the crowd. 5. Coq Inu ($COQ) Coq Inu thrives on humor, leaning into rooster memes while adopting proven Inu coin strategies. It’s not just for laughs, the project runs seasonal token burns, charity drives for animal welfare, and meme creation contests that keep its social platforms active. The token’s smart contract is designed for transparency, with liquidity locked to ensure stability. COQ has also experimented with “Meme Farming,” a system where users submit content and earn tokens based on community votes. This interactive model pushes it into the Top Meme Coins to Invest conversation by turning holders into active brand builders. Why This Coin Made It to the List: Its clever engagement model and locked liquidity combine humor with a sustainable structure. 6. Bone ShibaSwap ($BONE) BONE plays a key role in ShibaSwap’s ecosystem, serving as a governance token and fee token for the Shibarium Layer 2 network. As ShibaSwap expands its DeFi services, BONE’s role grows, giving it both meme appeal and practical use. The token has benefited from Shiba Inu’s massive community, but unlike pure meme coins, it’s tied directly to infrastructure growth. As Shibarium adoption rises, demand for BONE increases, a critical factor for anyone ranking the Top Meme Coins to Invest. Why This Coin Made It to the List: Dual utility in governance and transaction fees sets BONE apart from pure hype plays. 7. AI Companions ($AIC) AI Companions merges AI technology with meme culture, offering customizable virtual pets that live on the blockchain. Holders can train, trade, and even “battle” their AI companions, creating a gamified layer that appeals to both tech and meme audiences. The team plans to launch an AI Companion marketplace, letting users sell rare traits or personalities, with transactions generating token burns. This mix of personalization and deflationary mechanics is rare in meme coins, placing AIC in the Top Meme Coins to Invest conversation for its innovation. Why This Coin Made It to the List: Tech-driven engagement and a deflationary twist make AIC a fresh entry in the meme coin space. 8. Moo Deng ($MOODENG) Moo Deng’s piglet mascot and Thai street food inspiration give it a unique cultural hook. Beyond branding, the project allocates part of its treasury to animal rescue charities, giving it a wholesome image that resonates globally. NFT drops themed around Moo Deng’s adventures provide utility, with holders gaining access to community events and physical merch giveaways. This combination of culture, charity, and collectibility keeps Moo Deng visible in Top Meme Coins to Invest discussions. Why This Coin Made It to the List: Its charitable impact and cultural branding offer emotional and financial appeal. 9. Doginme ($DOGINME) Doginme thrives on unpredictability. Holders never quite know what’s coming next, it might be a sudden meme drop, a surprise burn, or a random airdrop to active wallets. This chaos is part of the brand, turning every week into a guessing game that keeps engagement high. DOGINME’s small supply and strong liquidity backing give it market resilience, while the project’s devs are experimenting with meme-based governance proposals. This unpredictable energy makes it one of the Top Meme Coins to Invest for high-risk, high-reward players. Why This Coin Made It to the List: Unpredictable events and solid liquidity create a unique high-volatility meme play. 10. Ponke ($PONKE) Ponke infuses punk aesthetics into the meme coin world, collaborating with underground digital artists to produce limited-edition NFT collections. These NFTs unlock access to “Ponke Parties,” exclusive online and IRL events for holders. The tokenomics are designed for scarcity, with regular burns and airdrops that reward active participation. This rebellious branding gives Ponke a niche, helping it stand out in Top Meme Coins to Invest lists despite fierce competition. Why This Coin Made It to the List: Subculture branding and exclusive events keep Ponke’s community tight and engaged. Conclusion Based on the latest research, the Top Meme Coins to Invest in June 2025 are Troller Cat, Snek, Gigachad, ANDY, Coq Inu, Bone ShibaSwap, AI Companions, Moo Deng, Doginme, and Ponke. Each brings something different, from utility to culture to pure meme firepower. Trollercat stands out for its mix of staking at 69% APY, deflationary burns, and presale pricing that rewards early movers. That blend of passive income and scarcity could keep value rising long after listing day. Get in before this cat lands on a higher branch, once it jumps, the view changes. For More Information: Website: https://www.trollercat.io/ Buy Now: https://www.trollercat.io/buy-now/ X: https://x.com/trollercat FAQs If I invest $3,000 in Stage 17 of Troller Cat, what’s the potential return? Around $12,390 at listing, plus two months of staking rewards at 69% APY. How does Troller Cat staking work during presale? Buy tokens, stake instantly, and earn 69% APY with rewards unlocked two months after launch. Why are coins like Snek and Gigachad trending? They combine strong branding with community activity that fuels buying pressure. What’s special about Troller Cat’s presale structure? Each stage raises the price and builds hype through themed trolling events. Will Troller Cat still burn tokens after launch? Yes, ad revenue from its Game Center funds monthly buybacks and burns. Glossary of Terms APY: The percentage of yearly return earned from staking. Stage: A pricing phase in a presale where the cost per token increases. Deflationary: Token model that reduces supply over time. KYC: Verification process for project compliance. Liquidity Lock: A safeguard that prevents sudden fund withdrawal. NFT Drop: Limited release of non-fungible tokens to holders. Listing Price: Initial trading price when a token hits an exchange. Disclaimer: This is a sponsored press release for informational purposes only. It does not reflect the views of Times Tabloid, nor is it intended to be used as legal, tax, investment, or financial advice. Times Tabloid is not responsible for any financial losses. The post Trend Watch 2025: The Top 10 Meme Coins to Invest Are Snek, Gigachad, and a Cat Ready to Leap 312% appeared first on Times Tabloid .",Finance|News,EN,0,0,CRYPTOCURRENCY|TRADING|ADA|REGULATION|SPONSORED,"{'name': 'TimesTabloid', 'img': 'https://resources.cryptocompare.com/news/67/default.png', 'lang': 'EN'}",timestabloid,2025-08-12 05:15:49
49956230,https://www.newsbtc.com/?p=803138,1754975930,https://resources.cryptocompare.com/news/21/49956230.jpeg,BNB Price Coiling for Breakout—Next Leg Higher in Sight,https://www.newsbtc.com/analysis/bnb/bnb-price-coiling-for-breakout-820/,"BNB price is correcting gains from the $825 zone. The price is now facing hurdles near $815 and might aim for a fresh surge in the near term. BNB price is correcting gains and traded below the $815 support zone. The price is now trading above $800 and the 100-hourly simple moving average. There is a key contracting triangle forming with support at $804 on the hourly chart of the BNB/USD pair (data source from Binance). The pair must stay above the $792 level to start another increase in the near term. BNB Price Holds Support After a steady increase, BNB price failed to clear the $830 zone. There was a downside correction below the $820 and $815 levels, like Ethereum and Bitcoin . The price even dipped below $800 and tested $792. A low was formed at $792 and the price is now attempting a fresh increase. There was a move above the 50% Fib retracement level of the downward move from the $827 swing high to the $792 low. The price is now trading above $810 and the 100-hourly simple moving average. There is also a key contracting triangle forming with support at $804 on the hourly chart of the BNB/USD pair. On the upside, the price could face resistance near the $815 level or the 61.8% Fib retracement level of the downward move from the $827 swing high to the $792 low. The next resistance sits near the $820 level. A clear move above the $820 zone could send the price higher. In the stated case, BNB price could test $832. A close above the $832 resistance might set the pace for a larger move toward the $840 resistance. Any more gains might call for a test of the $850 level in the near term. Another Decline? If BNB fails to clear the $815 resistance, it could start another decline. Initial support on the downside is near the $804 level. The next major support is near the $800 level. The main support sits at $792. If there is a downside break below the $792 support, the price could drop toward the $780 support. Any more losses could initiate a larger decline toward the $768 level. Technical Indicators Hourly MACD – The MACD for BNB/USD is gaining pace in the bullish zone. Hourly RSI (Relative Strength Index) – The RSI for BNB/USD is currently above the 50 level. Major Support Levels – $804 and $792. Major Resistance Levels – $815 and $820.",BNB|Binance Coin|BNB Price|bnbbtc|BNBUSD|bnbusdt,EN,0,0,TRADING|CRYPTOCURRENCY|BNB|BTC|ETH,"{'name': 'NewsBTC', 'img': 'https://images.cryptocompare.com/news/default/newsbtc.png', 'lang': 'EN'}",newsbtc,2025-08-12 05:18:50
49956488,https://en.bitcoinsistemi.com/jeff-bezos-company-makes-a-move-into-cryptocurrency-even-bezos-cant-ignore-it/,1754976247,https://resources.cryptocompare.com/news/81/49956488.jpeg,Jeff Bezos’ Company Makes a Move into Cryptocurrency: Even Bezos Can’t Ignore It,https://en.bitcoinsistemi.com/jeff-bezos-company-makes-a-move-into-cryptocurrency-even-bezos-cant-ignore-it/,"NYSE-listed integrated payments company Shift4 Payments announced a partnership with Jeff Bezos' space travel company Blue Origin, allowing customers to purchase space trips with cryptocurrencies and stablecoins such as Bitcoin, Ethereum, Solana, USDT and USDC. Under the new agreement, payments for space flights aboard Blue Origin's reusable New Shepard rocket will be made directly through popular wallets like Coinbase and MetaMask, thanks to Shift4's payment infrastructure. These commercial flights, which have seen more than 75 people cross the Kármán Line into space, will now be available with cryptocurrency payment options. Related News: Everyone Buys Bitcoin and Ethereum: But This Company Has Its Eyes on Another Altcoin - It Made a Hefty Purchase “Our goal has always been to transform commerce. Now we're taking that vision beyond Earth. Together with Blue Origin, we're enabling adventure-seeking travelers to easily plan the trip of a lifetime with the payment method of their choice,” said Shift4 CEO Taylor Lauber. Shift4's Head of Crypto, Alex Wilson, reminded the public that cryptocurrencies have now reached a $4 trillion asset class, saying, “Crypto and stablecoin payments will grow in popularity, especially for high-cost purchases. Both consumers and businesses will benefit financially from these transactions.” *This is not investment advice. Continue Reading: Jeff Bezos’ Company Makes a Move into Cryptocurrency: Even Bezos Can’t Ignore It",News,EN,0,0,CRYPTOCURRENCY|BTC|ETH|ALTCOIN|BUSINESS,"{'name': 'BitcoinSistemi', 'img': 'https://resources.cryptocompare.com/news/81/default.png', 'lang': 'EN'}",bitcoinsistemi,2025-08-12 05:24:07
49956489,https://bitcoinworld.co.in/?p=187911,1754976310,https://resources.cryptocompare.com/news/82/49956489.jpeg,Malaysian Central Bank’s Bold Revelation: Bitcoin & XRP as Monetary Alternatives,https://bitcoinworld.co.in/malaysian-central-bank-crypto/,"BitcoinWorld Malaysian Central Bank’s Bold Revelation: Bitcoin & XRP as Monetary Alternatives A fascinating development recently emerged from the heart of Malaysia, sparking significant discussion in the financial world. The Malaysian Central Bank , officially known as Bank Negara Malaysia (BNM), published a working paper that delves into the intriguing possibility of cryptocurrencies like Bitcoin (BTC) and Ripple (XRP) serving as future monetary alternatives . This isn’t just a casual observation; it suggests these digital assets could potentially replace traditional currency in circulation or bank deposits, becoming widespread payment methods outside the conventional banking system. This exploration by the Malaysian Central Bank signals a growing acknowledgment of digital currency ‘s evolving role in global finance. What Did the Malaysian Central Bank Paper Reveal? The working paper, a significant document from the Malaysian Central Bank , explored various scenarios where cryptocurrencies might fit into the nation’s financial landscape. It specifically highlighted Bitcoin and XRP as examples of digital assets with the potential to act as substitutes for existing money forms. The paper considered cryptocurrencies as potential replacements for traditional currency in circulation (CIC). It also looked at their capacity to serve as alternatives to bank deposits. Crucially, the study envisioned these digital assets becoming widespread payment methods, operating independently of the established banking infrastructure. This detailed analysis from a central bank is a powerful indicator of the shifting perspectives on cryptocurrency adoption . Why Are Bitcoin and XRP Being Considered as Monetary Alternatives? The paper’s focus on Bitcoin XRP is particularly noteworthy. Both assets possess unique characteristics that make them intriguing candidates for future payment systems. Bitcoin, known for its decentralization and robust network, offers a censorship-resistant form of value transfer. XRP, on the other hand, is celebrated for its speed and low transaction costs, making it appealing for cross-border payments. The discussion revolves around their ability to facilitate transactions efficiently and offer a degree of independence from traditional financial intermediaries. As the world becomes increasingly digital, the appeal of a streamlined digital currency for everyday transactions grows stronger. Challenges and Opportunities for Cryptocurrency Adoption While the prospect of cryptocurrencies as monetary alternatives is exciting, the Malaysian Central Bank ‘s paper also implicitly acknowledges the challenges. Regulatory frameworks, consumer protection, price volatility, and scalability are all crucial considerations that need addressing before widespread cryptocurrency adoption can occur. However, these challenges also present opportunities for innovation and collaboration between traditional finance and the crypto sector. Key Considerations: Regulatory Clarity: Clear rules are essential for mainstream integration. Consumer Protection: Safeguarding users from risks like fraud and loss. Price Stability: Addressing volatility to ensure cryptocurrencies can function as a reliable store of value. Technological Infrastructure: Building robust systems to handle high transaction volumes. Overcoming these hurdles will pave the way for a more integrated and efficient financial future. What Does This Mean for the Monetary Future? The fact that a major institution like the Malaysian Central Bank is openly discussing Bitcoin XRP and other digital assets as potential replacements for traditional money is a significant paradigm shift. It indicates that central banks worldwide are seriously evaluating how digital innovations will reshape the financial landscape. This isn’t about replacing fiat currency overnight, but rather acknowledging the growing demand for and potential of decentralized and digital forms of money. This exploration by the Malaysian Central Bank could inspire other nations to conduct similar studies, accelerating the global conversation around digital currency and its role in our collective monetary future . The financial world is undoubtedly on the cusp of profound transformation. The working paper from the Malaysian Central Bank represents a pivotal moment in the ongoing narrative of cryptocurrencies. By openly considering Bitcoin and XRP as viable monetary alternatives , Malaysia has signaled a forward-thinking approach to the evolving financial landscape. While significant challenges remain, this official acknowledgment underscores the irreversible trend towards cryptocurrency adoption and the increasing prominence of digital currency in our lives. The journey towards a more digitally integrated financial system is underway, and nations like Malaysia are at the forefront of this exciting exploration. Frequently Asked Questions (FAQs) Q1: What exactly did the Malaysian Central Bank’s paper say about Bitcoin and XRP? The working paper from the Malaysian Central Bank (BNM) stated that cryptocurrencies like Bitcoin (BTC) and Ripple (XRP) could potentially serve as widespread payment methods, replacing traditional currency in circulation or bank deposits outside the conventional banking system. Q2: Does this mean Malaysia will adopt Bitcoin and XRP as official currencies soon? Not necessarily. The paper is a working document exploring potential scenarios and implications. It indicates that the Malaysian Central Bank is studying the feasibility and impact of such a shift, but it does not confirm immediate plans for adoption as official currencies. Q3: What are the main benefits of using cryptocurrencies as monetary alternatives? Benefits include potentially lower transaction costs, faster cross-border payments, increased financial inclusion for the unbanked, and greater efficiency compared to traditional banking systems, especially for specific cryptocurrencies like Bitcoin XRP. Q4: What challenges does the Malaysian Central Bank likely consider for cryptocurrency adoption? Key challenges include regulatory uncertainty, price volatility of cryptocurrencies, consumer protection issues, cybersecurity risks, and the need for robust technological infrastructure to handle large-scale transactions. These factors are crucial for successful digital currency integration. Q5: How does this development compare to other countries’ approaches to digital currency? Many central banks globally are exploring central bank digital currencies (CBDCs) or researching the implications of private cryptocurrencies. The Malaysian Central Bank’s explicit mention of Bitcoin and XRP as potential monetary alternatives, rather than solely focusing on CBDCs, positions it among the more open-minded institutions regarding existing decentralized digital assets. If you found this article insightful, please consider sharing it with your network! Help us spread awareness about the evolving landscape of cryptocurrency adoption and the future of digital currency by sharing on social media. To learn more about the latest crypto market trends, explore our article on key developments shaping Bitcoin institutional adoption . This post Malaysian Central Bank’s Bold Revelation: Bitcoin & XRP as Monetary Alternatives first appeared on BitcoinWorld and is written by Editorial Team",Crypto News|#Central Bank|BITCOIN|CRYPTOCURRENCY|Malaysia|XRP,EN,0,0,CRYPTOCURRENCY|MACROECONOMICS|FIAT|BTC|XRP,"{'name': 'Bitcoin World', 'img': 'https://resources.cryptocompare.com/news/82/default.png', 'lang': 'EN'}",bitcoinworld,2025-08-12 05:25:10
