id,guid,published_on,imageurl,title,url,body,tags,lang,upvotes,downvotes,categories,source_info,source,date
49940196,https://news.bitcoin.com/?p=747734,1754952628,https://resources.cryptocompare.com/news/14/49940196.jpeg,Bitunix Analyst Predicts $127K BTC Top—If Volume Confirms Breakout,https://news.bitcoin.com/bitunix-analyst-predicts-127k-btc-top-if-volume-confirms-breakout/,"Analysts believe a bitcoin rally to $127,000 is possible if the cryptocurrency closes above the $120,000 mark with strong volume, but they warn of a potential retest of the $114,000 to $116,000 range if the rally is rejected. BTC Enters ‘Wait-for-Confirmation’ Phase Bitcoin (BTC) broke past the $122,000 mark late on Aug. 10, marking the",Markets and Prices|Bitcoin (BTC)|Bullish,EN,0,0,CRYPTOCURRENCY|BTC|TRADING,"{'name': 'Bitcoin.com', 'img': 'https://images.cryptocompare.com/news/default/bitcoincom.png', 'lang': 'EN'}",bitcoin.com,2025-08-11 22:50:28
49940619,https://ambcrypto.com/?p=518090,1754953216,https://images.cryptocompare.com/news/default/ambcrypto.png,Ethena crypto price prediction – Can ENA breach $1 without whale support?,https://ambcrypto.com/ethena-crypto-price-prediction-can-ena-breach-1-without-whale-support/,Ethena surged by 30% in 7 days to a 7-month high amid strengthening actual demand.,Altcoin|News|News 1|Social|Trading View|ambcrypto,EN,0,0,CRYPTOCURRENCY|ENA|TRADING|ALTCOIN,"{'name': 'AMB Crypto', 'img': 'https://images.cryptocompare.com/news/default/ambcrypto.png', 'lang': 'EN'}",ambcrypto,2025-08-11 23:00:16
49943129,553533,1754953224,https://resources.cryptocompare.com/news/13/49943129.jpeg,"Crypto Rules Should Shield People, Not Amplify Corruption In Government: US Senator",https://bitcoinist.com/crypto-rules-should-shield-people-not-amplify-corruption-in-government-us-senator/,"Senator Elizabeth Warren is stepping up her call for strict cryptocurrency regulation, worried that industry-backed legislation can undermine consumer protections and weaken oversight. She is calling for measures that exclude corporate influence from policy-making and keep public servants from holding financial interests that could sway their decisions. Warren Rejects Industry-Written Rules In her recent remarks, Warren opposed pro-crypto legislation including the GENIUS Act and the CLARITY Act , referring to them as “gifts” for the big players in the digital asset space. Her reasoning is that these bills would create holes in accountability along with further empowering large corporations. Her stance is Congress—and not the crypto world—should be the one to create legislation governing the industry. In a speech to WNBC, Warren cautioned of “corruption” linked to elected representatives benefitting from crypto ventures. We need strong crypto regulation – not an industry giveaway that puts our economy at risk and supercharges President Trump’s corruption. pic.twitter.com/6sVbwMiSFf — Elizabeth Warren (@SenWarren) August 10, 2025 Warren pointed to connections to stablecoins and meme coins, stating that such associations could have an impact on national policy that serves private interests at the expense of the public. The anti-corruption framework subjects government officials with cryptocurrency investments or crypto business relationships to stringent disclosure and enforces compliance with more vigor. Stablecoins Under The Lens In July 2025, Warren presented her comprehensive framework to regulate crypto market activities. It outlines five core priorities, including applying existing securities protections to digital assets while keeping the regulatory structure of other markets unchanged. A central part of her plan targets stablecoins. Her proposal would block large technology companies, including Meta—the parent of Facebook—from issuing digital currencies. The senator argues that bringing in big tech companies to the stablecoin space would endanger privacy and financial stability, hence putting both consumers as well as the economy at risk. Her bill, according to reports, is aimed at keeping systemic risk in check while ensuring strict regulations and oversight for stablecoin issuers. US President Donald Trump is heading in the opposite direction. In July 2025, he signed the GENIUS Act , establishing a federal stablecoin regime with 100% reserve backing, monthly public reporting, and consumer protection provisions. The legislation divides power between state and federal regulators but still permits stablecoin holders to enjoy insolvency arrangements. Warren insists that the focus should be on safeguarding ordinary folks from financial threats and political manipulation. She demands that crypto regulations be for the public good, not to “power up corruption in government,” and cautions that allowing industry participants to dictate the laws will prioritize profits over accountability. Featured image from Unsplash, chart from TradingView",Crypto News|bitcoin|btc|btcusd|CLARITY Act|crypto|Elizabeth Warren|GENIUS Act|Stablecoins|Trump,EN,0,0,CRYPTOCURRENCY|REGULATION|BTC|MARKET|BUSINESS,"{'name': 'Bitcoinist', 'img': 'https://images.cryptocompare.com/news/default/bitcoinist.png', 'lang': 'EN'}",bitcoinist,2025-08-11 23:00:24
49940651,https://en.bitcoinsistemi.com/?p=174110,1754953243,https://resources.cryptocompare.com/news/81/49940651.jpeg,Chainlink (LINK) Eyes $100 Breakout — ADA & Lido Rally While StarkNet Sees Record Inflows This Week,https://en.bitcoinsistemi.com/chainlink-link-eyes-100-breakout-ada-lido-rally-while-starknet-sees-record-inflows-this-week/,"The crypto market is buzzing with bullish setups across multiple sectors. Chainlink (LINK) is breaking multi-year resistance with whale accumulation accelerating, and Cardano (ADA) is flashing patterns from its historic bull run. Starknet (STRK) is setting Layer 2 benchmarks while Lido navigates internal changes. Meanwhile, ROI-focused traders are turning their eyes toward MAGACOIN FINANCE, targeting massive returns in the next cycle. Chainlink Breaks Multi-Year Resistance Chainlink has surged past the key $20–$22 resistance level after years of sideways movement, triggering technical breakout signals on multi-week charts. Analysts now eye targets of $35, $50, and even $100 if LINK can hold above this zone. On-chain data from Santiment shows large holders accumulating aggressively, with wallets holding 100,000 to 1 million LINK up 4.2% in just one week. Historically, such accumulation precedes significant price rallies, reinforcing the bullish case. Chainlink’s Cross-Chain Interoperability Protocol (CCIP) further strengthens fundamentals, paving the way for greater adoption and potential real-world asset tokenization. Cardano Repeats Historic Bull Pattern Cardano is trading near $0.72, sitting just under a key Fibonacci retracement level that mirrors its 2020–2021 setup. Analyst Ali Martinez highlights striking similarities to ADA’s previous cycle, where the coin rocketed 32x from $0.0944 to above $3. Current Fibonacci projections suggest a path toward $3.09, $4.19, and even $6.25 in the most bullish case. While the market pace is slower this cycle, ADA’s fundamentals are stronger than ever, with over 300,000 smart contracts deployed. Technical structures, including a “cup and handle” pattern spotted by other analysts, support the case for a breakout in the months ahead. Lido Soars 36% While Starknet Expands As of now, the LDO token boasts a 36% weekly surge as it trades at $1.17. The Lido team announced a workforce reduction across its core teams, aiming to streamline operations and secure long-term sustainability. The protocol continues innovating, with its v3 upgrade introducing modular “stVaults” for flexible staking. In contrast, Starknet is experiencing growth momentum, setting itself apart as a top Ethereum Layer 2 with its advanced ZK-Rollup architecture. The network’s SN Stack allows developers to build fully customizable chains with Ethereum-grade security. STRK’s expanding utility, covering transaction fees, governance, and upcoming staking, has positioned it as a serious scalability leader. Over 700 million STRK have been allocated to early supporters via the Starknet Provisions program, underscoring the protocol’s commitment to decentralization and ecosystem growth. ROI Specialists Target MAGACOIN FINANCE for an 85x Return While established projects draw attention, a growing number of ROI-driven analysts are focusing on MAGACOIN FINANCE, projecting potential gains of up to 85x in the coming cycle. The project’s ongoing phase has already attracted thousands of holders, and its combination of strong community backing and early-stage positioning makes it a standout for high-multiplier seekers. With its market entry still in the early phase, MAGACOIN is increasingly being discussed as a tactical play for traders seeking exponential upside before wider exchange listings. Conclusion From Chainlink’s bullish breakout to Starknet’s infrastructure expansion, the crypto landscape is primed for high-momentum plays. Yet, the biggest upside bets, according to some market watchers, may be in early-stage projects like MAGACOIN FINANCE. Learn more via the official links: Website: https://magacoinfinance.com Presale: https://magacoinfinance.com/presale X: https://x.com/magacoinfinance Telegram: https://t.me/magacoinfinance Continue Reading: Chainlink (LINK) Eyes $100 Breakout — ADA & Lido Rally While StarkNet Sees Record Inflows This Week",Sponsored,EN,0,0,CRYPTOCURRENCY|LINK|TRADING|ADA|MARKET,"{'name': 'BitcoinSistemi', 'img': 'https://resources.cryptocompare.com/news/81/default.png', 'lang': 'EN'}",bitcoinsistemi,2025-08-11 23:00:43
49940642,https://www.newsbtc.com/?p=802804,1754953256,https://resources.cryptocompare.com/news/21/49940642.jpeg,"Ethereum Nears $5,000 After 45% Monthly Rally, Whale Buying and Regulatory Clarity Fuel Surge",https://www.newsbtc.com/news/ethereum/ethereum-nears-5000-after-45-monthly-rally-whale-buying-and-regulatory-clarity-fuel-surge/,"Ethereum (ETH) has extended its bullish run, surging past $4,300 and posting a staggering 45% gain over the past month. The world’s second-largest cryptocurrency now eyes the $5,000 milestone, triggered by unprecedented whale accumulation, institutional inflows, and a wave of regulatory clarity in the U.S. Related Reading: Ethereum Bullish Fundamentals Clash With Short-Term Leverage Risks In just the past four weeks, over $4.17 billion has flowed into Ethereum-focused investment products, with entities like Galaxy Digital, FalconX, and BitGo facilitating large-scale purchases. One “mysterious institution” reportedly acquired 221,166 ETH worth nearly $1 billion in a single week, signaling long-term confidence at elevated prices. Whale Buying and Institutional Inflows Strengthen Ethereum (ETH)’s Bullish Case Whale addresses holding more than 10,000 ETH have climbed to their highest level in a year, while public companies added 304,000 ETH ($1.3B) to their treasuries last week alone. Notably, BitMine Immersion Technologies accounted for $900 million of these purchases. Ethereum spot ETFs have also recorded significant inflows, with $327 million added in just the first week of August. Analysts note that the combination of whale activity and institutional buying has historically preceded major rallies, and with ETH breaking above the stubborn $4,000 resistance for the first time since 2021, market sentiment remains firmly bullish. ETH's price trends to the upside on the daily chart. Source: ETHUSD on Tradingview Regulatory Clarity and Network Growth Add Fuel to the Rally Recent U.S. regulatory developments have removed key uncertainties from the crypto market. The White House’s new digital asset framework, the Ripple-SEC case resolution, and President Donald Trump’s executive order allowing crypto in retirement accounts have boosted Ethereum’s legitimacy in traditional finance. Related Reading: Bitcoin Open Interest Flips Negative After July Peak – Risk Appetite Cools On-chain data reflects the momentum, with daily Ethereum transactions averaging 1.74 million and over 36 million ETH, roughly 30% of supply, locked in staking contracts. The ETH/BTC ratio has also climbed to near yearly highs, indicating a shift in market preference toward Ethereum. Bottom Line If ETH can break the $4,430 resistance, its previous all-time high of $4,860 is within reach. From there, bullish projections point to $5,000 and even $6,500 in 2025. While short-term corrections remain possible, the structural trend suggests Ethereum may be entering a new phase of price discovery. Cover image from ChatGPT, ETHUSD chart from Tradingview",Ethereum|ETH|eth price|ETH price analysis|ethereum|ethusd,EN,0,0,CRYPTOCURRENCY|ETH|TRADING|MARKET|BTC,"{'name': 'NewsBTC', 'img': 'https://images.cryptocompare.com/news/default/newsbtc.png', 'lang': 'EN'}",newsbtc,2025-08-11 23:00:56
49940818,https://decrypt.co/?p=334646,1754953487,https://resources.cryptocompare.com/news/44/49940818.jpeg,"SharpLink Stock Rises, Then Falls Following $400M Deal to Boost Ethereum Treasury",https://decrypt.co/334646/sharplink-stock-jumps-falls-400-million-deal-boost-ethereum-treasury,SharpLink Gaming says it plans to boost its Ethereum treasury above $3 billion with the proceeds of its latest stock sale.,|Business,EN,0,0,BUSINESS|CRYPTOCURRENCY|DIGITAL ASSET TREASURY|ETH|MACROECONOMICS,"{'name': 'Decrypt', 'img': 'https://images.cryptocompare.com/news/default/decrypt.png', 'lang': 'EN'}",decrypt,2025-08-11 23:04:47
49940919,https://en.coinotag.com/ethenas-recent-surge-suggests-potential-for-continued-growth-amid-strong-retail-demand-and-network-adoption/,1754953684,https://resources.cryptocompare.com/news/77/49940919.jpeg,Ethena’s Recent Surge Suggests Potential for Continued Growth Amid Strong Retail Demand and Network Adoption,https://en.coinotag.com/ethenas-recent-surge-suggests-potential-for-continued-growth-amid-strong-retail-demand-and-network-adoption/,"Ethena’s recent price surge of 31% is attributed to strong network adoption, increased retail buying, and bullish technical indicators. Ethena’s price climbed from $0.51 to $0.855, marking a 7-month high.",News|ENA,EN,0,0,CRYPTOCURRENCY|TRADING|ENA,"{'name': 'CoinOtag', 'img': 'https://resources.cryptocompare.com/news/77/default.png', 'lang': 'EN'}",coinotag,2025-08-11 23:08:04
49941070,https://en.coinotag.com/ethereum-faces-key-resistance-at-4-2k-analysts-consider-breakout-or-potential-dip-to-3-2k/,1754953888,https://resources.cryptocompare.com/news/77/49941070.jpeg,Ethereum Faces Key Resistance at $4.2K: Analysts Consider Breakout or Potential Dip to $3.2K,https://en.coinotag.com/ethereum-faces-key-resistance-at-4-2k-analysts-consider-breakout-or-potential-dip-to-3-2k/,"Ethereum is currently testing a critical resistance level near $4.2K, with analysts predicting a potential breakout towards $5.5K or a correction to $3.2K. Ethereum’s price action shows strong momentum, testing",Ethereum|News|ETH,EN,0,0,CRYPTOCURRENCY|ETH|TRADING,"{'name': 'CoinOtag', 'img': 'https://resources.cryptocompare.com/news/77/default.png', 'lang': 'EN'}",coinotag,2025-08-11 23:11:28
49941135,https://en.coin-turk.com/?p=199543,1754953974,https://resources.cryptocompare.com/news/79/49941135.jpeg,Cryptocurrency Market Hits New Peak: Risks Loom for Three Key Altcoins,https://en.coin-turk.com/cryptocurrency-market-hits-new-peak-risks-loom-for-three-key-altcoins/,"The cryptocurrency market surpassed $4 trillion, indicating heightened trading activity. ETH, ENA, and XRP face significant liquidation risks amid market fluctuations. Continue Reading: Cryptocurrency Market Hits New Peak: Risks Loom for Three Key Altcoins The post Cryptocurrency Market Hits New Peak: Risks Loom for Three Key Altcoins appeared first on COINTURK NEWS .",Altcoin News,EN,0,0,MARKET|ALTCOIN|CRYPTOCURRENCY|ENA|ETH,"{'name': 'CoinTurk News', 'img': 'https://resources.cryptocompare.com/news/79/default.png', 'lang': 'EN'}",cointurken,2025-08-11 23:12:54
49941225,https://cryptonews.com/?p=406685,1754954162,https://resources.cryptocompare.com/news/52/49941225.jpeg,Stellar Price Prediction: 100% Move in Sight After XLM Breaks Out of Bullish Flag,https://cryptonews.com/news/stellar-price-prediction-100-move-in-sight-after-xlm-breaks-out-of-bullish-flag/,"The Stellar price has rallied in the past 24 hours, rising to $0.4563 after Bitcoin (BTC) threatened to pass its all-time high of $122,000 overnight. XLM is now up by 9% in a week and by 20% in a month, with the altcoin – the 16th-biggest token in the market – also boasting an impressive 340% increase in the past year. Yet such gains may be only the beginning, since the token has just broken out of a bullish flag, suggesting that it may continue rallying over the coming weeks, if not longer. And with Stellar’s fundamentals as a platform continue to improve steadily, the long-term Stellar price prediction looks very healthy. Stellar Price Prediction: 100% Move in Sight After XLM Breaks Out of Bullish Flag It’s actually not the first time the Stellar price has broken out of a bullish flag in recent weeks, with the coin moving above a seven-month flag at the beginning of July. This marked the opening of a new medium- and long-term upwards trend, and what’s exciting now is that, after correcting a little over the course of late-July/early-August, XLM has broken out of another pennant. This looks more like a short-term phase, one that may last for much of this week, before another correction arrives. Source: TradingView Other bullish signs include XLM’s relative strength index (yellow), which rose back up to 75 last night, and which remains at around 60. This indicates ongoing buying pressure, although the recent history of its MACD (orange, blue) suggests that such pressure may not last for too long. As such, there’s no guarantee that we’ll witness a big and sustained spike anytime soon, although Stellar’s fundamentals would point towards long-term growth. Stellar is turning up the pace On Aug 8, @StellarOrg processed 13.4M+ txns, a 13% jump from its previous peak A borderless, decentralized network empowering builders to move value globally & expand access to the financial system at scale https://t.co/APrNPIk4oK pic.twitter.com/CnpJ2UcJ2r — Chainspect (@chainspect_app) August 8, 2025 In fact, the Stellar price remains 47% down on its ATH of $0.8756, set back in January 2018. This arguably means that it still has lots of potential to rise vigorously this year, with the market’s growth and Stellar’s own growth increasing demand for it. Indeed, Stellar’s total value locked has risen by 242% since the beginning of 2025, while it has welcomed several new partnerships in recent months, including a deal with PayPal that will bring the payment giant’s PYUSD stablecoin to Stellar . Now is therefore a good time for the alt, with the Stellar price likely to hit $0.50 in the next few weeks, and $0.70 by Q4. Maxi Doge Raises 650,000 in Presale: Is This the Next Viral Meme Coin? For traders unconvinced by Stellar, there are other altcoins that could be worth a look, including several new presale tokens that may have the potential to take off once they list. One of the newest is Maxi Doge (MAXI) , an Ethereum-based and hyper-bullish riff on the Dogecoin template. It opened its presale a couple of weeks ago, and has since gone on to raise just over $650,000, a sign of its snowballing popularity. Maxi Doge’s premise is simple: to develop a community and ecosystem of aggressive traders, who are intent on pumping and promoting MAXI at every available opportunity. To this end, Maxi Doge will operate social media channels (on Telegram and Discord) where it will run trading challenges and competitions, encouraging holders to push their trading to its limits. Its social media channels will also be a space where holders can share trading strategies and tips, helping to boost a shared sense of community. On top of this, Maxi Doge will also maintain a Maxi Fund, equal to 25% of its max supply. It will use this fund to finance projects and support marketing initiatives, helping to spread word of Maxi Doge and recruit to new converts to its cause. Interested investors can join MAXI’s presale by going to the official Maxi Doge website , where the coin is currently selling at $0.0002515. This price will rise regularly over the course of the sale, so buyers should act sooner rather than later, in order to lock in the biggest possible returns. Click Here to Participate in the Presale The post Stellar Price Prediction: 100% Move in Sight After XLM Breaks Out of Bullish Flag appeared first on Cryptonews .",Industry Talk|$XLM|Price Prediction|Stellar,EN,0,0,CRYPTOCURRENCY|TRADING|XLM|MARKET|ALTCOIN,"{'name': 'cryptonews', 'img': 'https://images.cryptocompare.com/news/default/cryptonews.png', 'lang': 'EN'}",cryptonews,2025-08-11 23:16:02
49941617,https://cointelegraph.com/news/bitcoin-miners-acquires-majority-stake-iai-firm-exaion,1754954485,https://images.cryptocompare.com/news/default/cointelegraph.png,"Bitcoin miner MARA to acquire majority stake in Exaion in AI, HPC play",https://cointelegraph.com/news/bitcoin-miners-acquires-majority-stake-iai-firm-exaion?utm_source=rss_feed&utm_medium=rss&utm_campaign=rss_partner_inbound,"MARA Holding’s expansion into AI and high-performance computing is expected to close in Q4, and comes amid a steep rise in Bitcoin mining difficulty.",,EN,0,0,BTC|CRYPTOCURRENCY|MINING,"{'name': 'CoinTelegraph', 'img': 'https://images.cryptocompare.com/news/default/cointelegraph.png', 'lang': 'EN'}",cointelegraph,2025-08-11 23:21:25
49941582,https://en.coinotag.com/sharplink-gaming-aims-to-expand-ethereum-treasury-above-3-billion-with-new-stock-sale/,1754954628,https://resources.cryptocompare.com/news/77/49941582.jpeg,SharpLink Gaming Aims to Expand Ethereum Treasury Above $3 Billion with New Stock Sale,https://en.coinotag.com/sharplink-gaming-aims-to-expand-ethereum-treasury-above-3-billion-with-new-stock-sale/,"SharpLink Gaming is raising $400 million to expand its Ethereum treasury, aiming to exceed $3 billion in total ETH holdings, reflecting investor confidence in Ethereum’s potential. SharpLink’s stock fluctuated, ending",News|ETH,EN,0,0,CRYPTOCURRENCY|ETH|BUSINESS|DIGITAL ASSET TREASURY|MACROECONOMICS,"{'name': 'CoinOtag', 'img': 'https://resources.cryptocompare.com/news/77/default.png', 'lang': 'EN'}",coinotag,2025-08-11 23:23:48
