id,guid,published_on,imageurl,title,url,body,tags,lang,upvotes,downvotes,categories,source_info,source,date
49945595,553573,1754960412,https://resources.cryptocompare.com/news/13/49945595.jpeg,"Bitcoin Surges Past $122K, Nearing All-Time High on ETF Inflows and Corporate Buys",https://bitcoinist.com/bitcoin-surges-past-122k-nearing-all-time-high-etf/,"Bitcoin (BTC) surged past $122,000 on Monday, coming within 1% of its all-time high of $123,218. The rally has been fueled by high spot Bitcoin ETF inflows, renewed corporate accumulation, and a pro-crypto policy shift from the White House. Over the last three days of trading, U.S. spot Bitcoin ETFs absorbed $773 million in net inflows, according to Farside Investors . BlackRock’s IBIT fund now holds $80 billion in BTC, closing in on the $94 billion held by the largest gold ETF. On the corporate front, Michael Saylor’s MicroStrategy signaled continued Bitcoin purchases, expanding its already massive $76.8 billion treasury. Henrik Andersson, CIO at Apollo Crypto, described the move above $122K as “just a matter of time” after a month-long consolidation between $115K and $120K. Trump’s Pro-Crypto Policies Ignite Wave of Bitcoin Optimism A major catalyst has been President Donald Trump’s recent executive order enabling 401(k) retirement plans to invest in cryptocurrencies. This policy could open up $9 trillion in retirement assets to Bitcoin , potentially driving significant long-term demand. Technical indicators remain bullish. The daily RSI sits at 67.7, signaling strong momentum without entering overbought territory, while the MACD has posted a bullish crossover. Analysts believe a decisive break above $123K could trigger algorithmic buying and retail FOMO, pushing BTC toward the $126K–$129K range. Broader Crypto Market Hits $4.14 Trillion Bitcoin’s rally has helped lift the total cryptocurrency market capitalization to an all-time high of $4.14 trillion. Ethereum (ETH) also surged, crossing $4,300 for the first time since 2021, supported by $4 billion in institutional inflows and the launch of ETH-focused ETFs. Despite the bullish trend, sentiment remains measured. The Crypto Fear & Greed Index stands at 70/100, indicating enthusiasm but avoiding extreme euphoria. Google search interest for Bitcoin has also risen modestly, suggesting room for further retail participation. With institutional inflows strong, corporate adoption rising, and regulatory clarity improving, analysts say Bitcoin is well-positioned for another leg higher. A clean break above $123K could open the door to $130K in the near term, and potentially $150K by year-end if macroeconomic conditions remain favorable. Cover image from ChatGPT, chart from Tradingview",Bitcoin News|bitcoin|btc|btc price|btcusd,EN,0,0,CRYPTOCURRENCY|BTC|TRADING|MARKET|ETH,"{'name': 'Bitcoinist', 'img': 'https://images.cryptocompare.com/news/default/bitcoinist.png', 'lang': 'EN'}",bitcoinist,2025-08-12 01:00:12
49945727,https://en.bitcoinsistemi.com/?p=174141,1754960455,https://resources.cryptocompare.com/news/81/49945727.jpeg,"Ethereum (ETH) Breaks $4K, $105M Shorts Wiped — BTC & SOL Surge as Traders Target a Low-Cap Altcoin With 20x Potential",https://en.bitcoinsistemi.com/ethereum-eth-breaks-4k-105m-shorts-wiped-btc-sol-surge-as-traders-target-a-low-cap-altcoin-with-20x-potential/,"Ethereum (ETH) is back in the headlines—this time for a bullish breakout that traders have been waiting years to see. On August 8, ETH surged past the $4,000 mark and briefly touched $4,200, its highest point since late 2021. The move forced $105 million in short positions to close, giving bulls the upper hand as momentum builds. Driving this rally were $222 million in ETH ETF inflows over just two days, led by BlackRock’s ETHA product. That kind of institutional buying power has reignited speculation that ETH could challenge Bitcoin’s dominance in the months ahead. Meanwhile, capital rotation into altcoins is picking up pace—lifting not just majors like Bitcoin and Solana, but also early-stage projects such as MAGACOIN FINANCE that traders believe could deliver outsized returns. Why ETH’s Rally Matters for the Market Ethereum’s move past $4,000 wasn’t just a chart milestone—it was backed by strong fundamentals. Alongside the ETF inflows, trading volumes spiked to three times their daily average. Bitcoin dominance slipped below 60%, showing clear evidence of altseason activity. Technical traders point to a clean breakout pattern, with a retest of $4,000 potentially setting the stage for another push higher. Layer-2 networks like Optimism and Polygon are also benefiting from the ETH surge, with rising user activity and transaction volumes. Bitcoin and Solana Keep Pace Bitcoin (BTC) is holding steady near $117,000, just shy of its yearly high. Institutional interest remains strong, and analysts believe a breakout above $120,000 could trigger a wave of new buying. Solana (SOL) has also been quietly building strength, now up nearly 10% over the past week to $180.49. Infrastructure upgrades and rising network adoption have fueled optimism, with traders eyeing the $200 level as the next big target. PEPE and SHIB Millionaires Turning to MAGACOIN FINANCE for the Next Big Run While big names dominate headlines, MAGACOIN FINANCE is attracting its own share of attention. PEPE and SHIB millionaires—who’ve already seen most of their upside in earlier meme coin runs—are rotating into MAGACOIN FINANCE in search of the next breakout. The project’s momentum is hard to ignore. Wallet activity is climbing, whales are steadily accumulating, and the presale is moving at record speed. Analysts say the blend of political meme culture, verified smart contract security, and a fast-growing community make MAGACOIN FINANCE one of the most compelling early-stage plays of 2025. Also, investor interest is at an all-time high, and MAGACOIN FINANCE presale demand is exploding. Final Thoughts Ethereum’s surge past $4,000 has sparked a wave of bullish sentiment across the crypto market. Bitcoin, Solana, and Layer-2 projects are all benefiting from the renewed momentum—and smaller altcoins are riding the same tide. With demand rising and presale allocations disappearing fast, MAGACOIN FINANCE is quickly becoming the low-cap name to watch. For investors seeking high-upside plays during this rally, it might just be the next headline-maker of the year. To learn more about MAGACOIN FINANCE, visit: Website: https://buy.magacoinfinance.com Access: https://magacoinfinance.com/access Twitter/X: https://x.com/magacoinfinance Telegram: https://t.me/magacoinfinance Continue Reading: Ethereum (ETH) Breaks $4K, $105M Shorts Wiped — BTC & SOL Surge as Traders Target a Low-Cap Altcoin With 20x Potential",Sponsored,EN,0,0,CRYPTOCURRENCY|ETH|BTC|SOL|TRADING,"{'name': 'BitcoinSistemi', 'img': 'https://resources.cryptocompare.com/news/81/default.png', 'lang': 'EN'}",bitcoinsistemi,2025-08-12 01:00:55
49945626,https://ambcrypto.com/?p=518150,1754960458,https://images.cryptocompare.com/news/default/ambcrypto.png,"Nearly every Ethereum holder in green, BUT ETH’s rally may be far from over!",https://ambcrypto.com/nearly-every-ethereum-holder-in-green-but-eths-rally-may-be-far-from-over/,There may be some news ahead for the world's largest altcoin.,Altcoin|Ethereum|News|News 1|Social|Trading View|ambcrypto|featured,EN,0,0,CRYPTOCURRENCY|ETH|TRADING|ALTCOIN|SPONSORED,"{'name': 'AMB Crypto', 'img': 'https://images.cryptocompare.com/news/default/ambcrypto.png', 'lang': 'EN'}",ambcrypto,2025-08-12 01:00:58
49945717,https://en.coin-turk.com/?p=199546,1754960569,https://resources.cryptocompare.com/news/79/49945717.jpeg,Ethereum Transactions Soar as Network Approaches All-Time Highs,https://en.coin-turk.com/ethereum-transactions-soar-as-network-approaches-all-time-highs/,Ethereum network sees a surge in daily transactions nearing all-time highs. Technical enhancements and price movements drive increased transaction volume. Continue Reading: Ethereum Transactions Soar as Network Approaches All-Time Highs The post Ethereum Transactions Soar as Network Approaches All-Time Highs appeared first on COINTURK NEWS .,Ethereum (ETH),EN,0,0,CRYPTOCURRENCY|ETH|TRADING,"{'name': 'CoinTurk News', 'img': 'https://resources.cryptocompare.com/news/79/default.png', 'lang': 'EN'}",cointurken,2025-08-12 01:02:49
49945711,https://en.coinotag.com/ethereum-profit-surge-suggests-potential-for-continued-growth-amid-short-term-investor-activity/,1754960577,https://resources.cryptocompare.com/news/77/49945711.jpeg,Ethereum Profit Surge Suggests Potential for Continued Growth Amid Short-Term Investor Activity,https://en.coinotag.com/ethereum-profit-surge-suggests-potential-for-continued-growth-amid-short-term-investor-activity/,"Currently, 97% of Ethereum holders are in profit, indicating a strong market performance and potential for further gains. 97% of Ethereum addresses are profitable, suggesting a healthy market. Short-term holders",News|ETH,EN,0,0,BUSINESS|CRYPTOCURRENCY|ETH|MARKET,"{'name': 'CoinOtag', 'img': 'https://resources.cryptocompare.com/news/77/default.png', 'lang': 'EN'}",coinotag,2025-08-12 01:02:57
49945930,https://en.coinotag.com/fg-nexus-invests-200-million-in-ethereum-aiming-for-10-network-stake-and-enhanced-yield-opportunities/,1754960891,https://resources.cryptocompare.com/news/77/49945930.jpeg,"FG Nexus Invests $200 Million in Ethereum, Aiming for 10% Network Stake and Enhanced Yield Opportunities",https://en.coinotag.com/fg-nexus-invests-200-million-in-ethereum-aiming-for-10-network-stake-and-enhanced-yield-opportunities/,"FG Nexus has allocated $200 million to purchase Ethereum, acquiring 47,331 ETH, with plans to stake for a 10% yield in the network. FG Nexus holds 47,331 ETH at an",Ethereum|News|ETH,EN,0,0,CRYPTOCURRENCY|ETH,"{'name': 'CoinOtag', 'img': 'https://resources.cryptocompare.com/news/77/default.png', 'lang': 'EN'}",coinotag,2025-08-12 01:08:11
49945933,https://en.coinotag.com/breakingnews/musk-threatens-to-sue-apple-in-an-x-post-alleges-app-store-rigging/,1754960896,https://resources.cryptocompare.com/news/77/default.png,"MUSK THREATENS TO SUE APPLE IN AN X POST, ALLEGES APP STORE RIGGING",https://en.coinotag.com/breakingnews/musk-threatens-to-sue-apple-in-an-x-post-alleges-app-store-rigging/,"MUSK THREATENS TO SUE APPLE IN AN X POST, ALLEGES APP STORE RIGGING $TSLA $AAPL $GOOG",,EN,0,0,OTHER,"{'name': 'CoinOtag', 'img': 'https://resources.cryptocompare.com/news/77/default.png', 'lang': 'EN'}",coinotag,2025-08-12 01:08:16
49946020,https://bitcoinworld.co.in/?p=187864,1754961011,https://resources.cryptocompare.com/news/82/49946020.jpeg,Crypto Whales Unveil Massive XRP and ADA Purchases: 900M XRP and 200M ADA Acquired,https://bitcoinworld.co.in/crypto-whales-xrp-ada/,"BitcoinWorld Crypto Whales Unveil Massive XRP and ADA Purchases: 900M XRP and 200M ADA Acquired The cryptocurrency market is always buzzing with activity, but few events capture attention quite like the movements of large holders, often called crypto whales . Recently, renowned crypto analyst and trader Ali Martinez shared a fascinating insight on X: these powerful entities have made substantial acquisitions. In just 48 hours, they purchased a staggering 900 million XRP and 200 million ADA. This massive accumulation by XRP whales and ADA whales raises important questions about market sentiment and potential future price action. Understanding why these significant players make such moves can offer valuable perspectives for all market participants. Understanding the Influence of XRP Whales and ADA Whales When we talk about crypto whales , we refer to individuals or entities holding vast amounts of a particular cryptocurrency. Their trades are so large that they can significantly influence market prices and liquidity. Ali Martinez’s report highlights an extraordinary buying spree, indicating strong conviction among these large holders. The acquisition of 900 million XRP by XRP whales is particularly noteworthy. XRP, a digital asset designed for global payments, has a large circulating supply. A purchase of this magnitude suggests a bullish outlook on its future utility and adoption. Similarly, the 200 million ADA acquired by ADA whales points to confidence in Cardano’s ecosystem and its ongoing development. What Does This Mean for XRP Price and ADA Price ? The immediate impact of such large purchases is often a subject of intense speculation. While direct correlation is not guaranteed, significant accumulation by whales can signal a few key things: Increased Demand: Large purchases absorb available supply, potentially driving up the XRP price and ADA price if demand continues to outpace supply. Investor Confidence: Whale activity can inspire confidence among smaller investors, leading to a broader buying trend. Anticipation of Events: Whales might be positioning themselves ahead of anticipated positive news, network upgrades, or regulatory clarity for XRP and ADA. However, it’s crucial to remember that whale movements are just one piece of the puzzle. Market sentiment, global economic factors, and project developments also play significant roles in determining the long-term trajectory of the XRP price and ADA price . Navigating the Market: Actionable Insights from Crypto Whales For everyday investors, monitoring whale activity can be a useful, though not foolproof, strategy. It provides a glimpse into the actions of those with deep pockets and potentially insider knowledge or advanced market analysis capabilities. Here are some actionable insights: Observe Trends: Look for consistent accumulation or distribution patterns rather than isolated events. Sustained buying by crypto whales often indicates a stronger conviction. Do Your Own Research (DYOR): Always complement whale watching with thorough research into the fundamentals of XRP and ADA. Understand their use cases, technology, and development roadmaps. Risk Management: Never invest more than you can afford to lose. Even significant whale activity does not eliminate market volatility or the potential for price corrections. Diversify Your Portfolio: Relying solely on whale movements can be risky. A diversified portfolio helps mitigate exposure to the performance of any single asset. The recent acquisitions of XRP and ADA by these influential market players serve as a powerful reminder of the dynamic nature of the crypto space. While their actions offer intriguing signals, a balanced approach combining market observation with diligent research remains paramount for informed decision-making. The recent reports of crypto whales accumulating vast amounts of XRP and ADA underscore the ongoing confidence among major investors in these digital assets. Whether these strategic moves lead to significant upward momentum for the XRP price and ADA price remains to be seen, but they certainly add an exciting layer to the current market narrative. For investors, these insights offer a chance to consider broader market sentiment while always prioritizing their own investment strategies and risk tolerance. Frequently Asked Questions (FAQs) What are crypto whales? Crypto whales are individuals or entities that hold a very large amount of a particular cryptocurrency. Their significant holdings mean their buying or selling activities can have a substantial impact on the market price and liquidity of that asset. Why do whale movements matter for XRP and ADA? Whale movements for assets like XRP and ADA matter because they can signal shifts in market sentiment, potential future demand, or anticipation of major project developments. Large purchases often suggest confidence in the asset’s future prospects. Does whale accumulation guarantee price increases for XRP or ADA? No, whale accumulation does not guarantee price increases. While it can be a bullish signal, the market is influenced by numerous factors including overall market trends, regulatory news, global economic conditions, and project-specific developments. Whales can also sell their holdings, impacting prices. How can I track crypto whale activity? You can track crypto whale activity through various on-chain analytics platforms and services that monitor large transactions. Many crypto news outlets and social media analysts also report on significant whale movements. What are the risks associated with following whale movements? Risks include misinterpreting whale intentions (they might be accumulating for other reasons), market manipulation, and the possibility that even large holdings can be liquidated, leading to price drops. Always conduct your own research and consider your personal financial situation. If you found this analysis insightful, please consider sharing it with your network on social media! Your support helps us continue providing valuable crypto market insights. To learn more about the latest crypto market trends, explore our article on key developments shaping XRP and ADA price action. This post Crypto Whales Unveil Massive XRP and ADA Purchases: 900M XRP and 200M ADA Acquired first appeared on BitcoinWorld and is written by Editorial Team",Crypto News|ADA|crypto whales|CRYPTOCURRENCY|Market Analysis|XRP,EN,0,0,CRYPTOCURRENCY|ADA|XRP|MARKET|TRADING,"{'name': 'Bitcoin World', 'img': 'https://resources.cryptocompare.com/news/82/default.png', 'lang': 'EN'}",bitcoinworld,2025-08-12 01:10:11
49946410,https://cryptopotato.com/?p=408121,1754961669,https://resources.cryptocompare.com/news/27/49946410.jpeg,"Binance Coin (BNB) Pushes Higher, Surpasses Nike, DoorDash in Market Cap",https://cryptopotato.com/binance-coin-bnb-pushes-higher-surpasses-nike-doordash-in-market-cap/,"Binance’s exchange token continues to thrive and post notable results. With strong backing from investors and institutions, coupled with social media engagement, it seems poised for new, uncharted territories. Surpassing Retail Giants BNB, the native token of the Binance ecosystem, has achieved an impressive feat by surpassing the market capitalizations of sports retailer Nike and food delivery company DoorDash. It is also currently flirting with the caps of Interactive Brokers, and the Michael Saylor-led MicroStrategy. Source: 8marketcap This accomplishment is likely further bolstered by the rise in BNB treasury companies, which continue to inject capital into the coin, driving further growth. CryptoPotato recently covered how Nano Labs, a crypto infrastructure company, announced $500 million deal via convertible notes to acquire BNB, and how today, BNC unveiled their $160M bid for acquiring the asset. At the time of writing, the coin is trading at $795, representing an increase of over 15% for the month. It had recently hit an all-time high (ATH) of $800 on July 23rd, followed by a new record just 5 days later, when the asset closed the day at $844. Source: CoinMarketCap The BNB Chain is also a host of various protocols and NFTs, to name just a few of the use cases. The top 20 NFT collections on the Binance market are mainly in the green over the last 24 hours. Source: Binance Additionally, PancakeSwap, a decentralized exchange (DEX) built on top of it, has benefited from the recent price action, with its native token, CAKE, up over 10% for the month. Where To Now? A large portion of the discussion on X related to Binance Coin is positive, indicating strong investor interest, which is supported by recent gains in adoption and price. Prominent analyst Ali Martinez has taken the recent price structure and compared it to that of Bitcoin, hinting at an early-stage rally and a very optimistic new ATH. $BNB is mirroring Bitcoin $BTC price structure and could be in the early stages of a bull rally to $1,200! pic.twitter.com/mohHzP5B0Z — Ali (@ali_charts) August 9, 2025 The post Binance Coin (BNB) Pushes Higher, Surpasses Nike, DoorDash in Market Cap appeared first on CryptoPotato .",AA News|Crypto News|Binance Coin|Binance Coin (BNB) Price,EN,0,0,CRYPTOCURRENCY|BNB|EXCHANGE|TRADING|MARKET,"{'name': 'Crypto Potato', 'img': 'https://images.cryptocompare.com/news/default/cryptopotato.png', 'lang': 'EN'}",cryptopotato,2025-08-12 01:21:09
49946521,https://en.coin-turk.com/?p=199549,1754961772,https://resources.cryptocompare.com/news/79/49946521.jpeg,"Bitcoin Investors Reap Profits While Prices Hold Steady at $120,000",https://en.coin-turk.com/bitcoin-investors-reap-profits-while-prices-hold-steady-at-120000/,"The Glassnode report shows extensive profit-taking by investors as Bitcoin stabilizes. Short-term investors play a big role in profit realization at peak levels. Continue Reading: Bitcoin Investors Reap Profits While Prices Hold Steady at $120,000 The post Bitcoin Investors Reap Profits While Prices Hold Steady at $120,000 appeared first on COINTURK NEWS .",Bitcoin News,EN,0,0,BUSINESS|BTC|CRYPTOCURRENCY|MARKET,"{'name': 'CoinTurk News', 'img': 'https://resources.cryptocompare.com/news/79/default.png', 'lang': 'EN'}",cointurken,2025-08-12 01:22:52
49946729,https://decrypt.co/?p=334666,1754961997,https://resources.cryptocompare.com/news/44/49946729.jpeg,Kakao Prepares Korean Won Stablecoin on Kaia as Lawmakers Weigh New Rules,https://decrypt.co/334666/kakao-korean-won-stablecoin-kaia-lawmakers-weigh-new-rules,"Kakao's KRW-linked trademarks signal a potential cross-border payments push, though the rollout hinges on pending legislation.",Business,EN,0,0,BUSINESS|REGULATION,"{'name': 'Decrypt', 'img': 'https://images.cryptocompare.com/news/default/decrypt.png', 'lang': 'EN'}",decrypt,2025-08-12 01:26:37
