id,guid,published_on,imageurl,title,url,body,tags,lang,upvotes,downvotes,categories,source_info,source,date
49949885,https://bitcoinworld.co.in/?p=187880,1754966710,https://resources.cryptocompare.com/news/82/49949885.jpeg,Massive BitMine ETH Purchase: Unprecedented Institutional Ethereum Acquisition Unveiled,https://bitcoinworld.co.in/bitmine-eth-purchase-analysis/,"BitcoinWorld Massive BitMine ETH Purchase: Unprecedented Institutional Ethereum Acquisition Unveiled A fascinating development has captured the attention of the cryptocurrency world: a massive BitMine ETH purchase worth approximately $1.24 billion. On-chain analysis points to Nasdaq-listed Bitcoin mining firm BitMine Immersion as the likely Ethereum whale behind this colossal acquisition. This significant move, involving 293,186 ETH, occurred over eight days through major platforms like FalconX, Galaxy Digital, and BitGo. This suggests a calculated and substantial institutional ETH acquisition , sparking widespread discussion about the future of crypto investments. What’s Behind This Unprecedented BitMine ETH Purchase? On-chain analyst @EmberCN, citing Arkham data, first highlighted these significant movements. The data strongly suggests that the addresses involved are connected to BitMine Immersion. This isn’t the company’s first foray into substantial Ethereum holdings; just last week, BitMine announced an additional purchase of 317,000 ETH. This latest acquisition brings their total reported large ETH holdings to an astonishing 1.15 million ETH. Such consistent, large-scale buying by a publicly traded entity underscores a strategic shift or diversification within their asset portfolio. Understanding the mechanisms behind such a transaction is key. Utilizing over-the-counter (OTC) desks like FalconX and Galaxy Digital, along with custody solutions like BitGo, allows for the execution of massive trades without significantly impacting market prices. This method is typical for large institutional players seeking to acquire or divest substantial amounts of cryptocurrency discreetly. Why Are Institutions Making Such Large ETH Holdings? The decision by a Bitcoin mining firm, traditionally focused on BTC, to accumulate such significant amounts of Ethereum is highly noteworthy. There are several compelling reasons why an entity like BitMine Immersion might pursue an institutional ETH acquisition : Diversification: Spreading risk across different digital assets can strengthen a portfolio. Ethereum, with its robust ecosystem for DeFi, NFTs, and dApps, offers distinct growth potential separate from Bitcoin. Staking Yields: Ethereum’s transition to Proof-of-Stake allows holders to earn staking rewards, providing a passive income stream on their large ETH holdings . This can be an attractive financial incentive for institutional investors. Ecosystem Growth: Ethereum remains the dominant smart contract platform. Investing in ETH provides exposure to the vast and continuously expanding decentralized economy built upon it. Future Prospects: Many analysts project strong long-term growth for Ethereum due to ongoing network upgrades and increasing adoption of its underlying technology. What Does This Institutional ETH Acquisition Mean for the Market? A BitMine ETH purchase of this magnitude carries significant implications for the broader cryptocurrency market. Firstly, it signals increasing institutional confidence in Ethereum as a legitimate and valuable asset beyond Bitcoin. This could encourage other traditional and crypto-native institutions to consider similar investments, potentially driving further demand for ETH. Moreover, the sheer volume of this acquisition could contribute to upward price pressure on Ethereum. While OTC trades aim to minimize market impact, the removal of such a large supply from public exchanges naturally tightens availability. This consistent accumulation by an Ethereum whale like BitMine suggests a long-term bullish outlook, which can positively influence market sentiment among retail and institutional investors alike. Tracking the Ethereum Whale: Transparency in On-Chain Data The ability to identify and track such massive movements, like this recent BitMine ETH purchase , highlights the power and transparency of on-chain analytics. Platforms like Arkham Intelligence provide invaluable insights into blockchain activity, allowing analysts to piece together narratives from public data. This level of transparency is unique to the crypto space, offering a window into the strategies of major players and contributing to a more informed market. The meticulous work of on-chain analysts like @EmberCN is crucial in uncovering these large-scale transactions. Their ability to connect dots between addresses and real-world entities provides a deeper understanding of market dynamics and the evolving landscape of institutional crypto adoption. This continuous monitoring helps everyone stay informed about significant capital flows and potential market shifts driven by entities with large ETH holdings . In conclusion, the suspected BitMine Immersion acquisition of over $1.24 billion in Ethereum is a compelling narrative of institutional foresight and diversification. It underscores the growing appeal of Ethereum beyond its foundational role as a smart contract platform, positioning it as a strategic asset for significant capital deployment. As more traditional firms explore digital assets, such moves by publicly traded companies will likely become more common, reshaping the future of the crypto market. Frequently Asked Questions (FAQs) Q1: Who is BitMine Immersion? BitMine Immersion is a Nasdaq-listed company primarily known as a Bitcoin mining firm. Their recent activities suggest a strategic diversification into other major cryptocurrencies like Ethereum. Q2: How much Ethereum (ETH) did BitMine Immersion reportedly acquire? According to on-chain analysis, BitMine Immersion is likely behind the acquisition of 293,186 ETH, valued at approximately $1.24 billion. This brings their total reported large ETH holdings to 1.15 million ETH. Q3: Why is this large ETH purchase by BitMine Immersion significant? This acquisition is significant because it represents a substantial institutional ETH acquisition by a publicly traded company, signaling growing confidence in Ethereum. It also highlights a trend of diversification among crypto firms and could influence market sentiment and ETH’s price. Q4: How was this BitMine ETH purchase identified? On-chain analysts, specifically @EmberCN, used data from platforms like Arkham Intelligence to track the movements of funds from major OTC desks (FalconX, Galaxy Digital) and custodians (BitGo) to addresses linked to BitMine Immersion. Q5: What are the potential implications for Ethereum’s price? While OTC trades aim to minimize immediate market impact, such a massive BitMine ETH purchase by an Ethereum whale can create long-term upward price pressure by reducing available supply and boosting overall market confidence in Ethereum’s value proposition. Q6: Does this mean other Bitcoin miners will buy ETH? This specific institutional ETH acquisition by BitMine Immersion could inspire other Bitcoin mining firms to consider diversifying their portfolios. However, each company’s strategy will depend on its financial goals, risk tolerance, and market outlook. If you found this analysis insightful, share it with your network! Stay informed on the latest cryptocurrency market trends. Explore our article on key developments shaping Ethereum’s institutional adoption and future price action. This post Massive BitMine ETH Purchase: Unprecedented Institutional Ethereum Acquisition Unveiled first appeared on BitcoinWorld and is written by Editorial Team",Crypto News|Bitmine|crypto whales|ETHEREUM|Institutional Investment|on-chain analysis,EN,0,0,CRYPTOCURRENCY|ETH|MARKET|BTC|TRADING,"{'name': 'Bitcoin World', 'img': 'https://resources.cryptocompare.com/news/82/default.png', 'lang': 'EN'}",bitcoinworld,2025-08-12 02:45:10
49950079,https://bitcoinworld.co.in/?p=187879,1754967010,https://resources.cryptocompare.com/news/82/49950079.jpeg,SOL Selling Activity: Crucial Warning from Three Whale Addresses,https://bitcoinworld.co.in/sol-selling-activity-warning/,"BitcoinWorld SOL Selling Activity: Crucial Warning from Three Whale Addresses Recent reports have sent ripples through the crypto community, highlighting significant SOL selling activity from prominent whale addresses. This development prompts investors and enthusiasts to pay close attention to the movements of large holders, as their actions often foreshadow broader market shifts. Understanding these patterns is crucial for anyone navigating the volatile world of cryptocurrencies, especially concerning Solana price impact . What’s Behind These Major SOL Whale Movements ? On-chain analytics platform Lookonchain recently reported on X about three distinct whale addresses that appear to have initiated substantial transfers of SOL to various exchanges. These movements are typically interpreted as a strong signal of an intent to sell, which could potentially influence Solana’s market dynamics and overall Solana market trends . Address CMJiHu: This address made a massive deposit of 96,996 SOL (approximately $17.45 million) to exchanges. This transfer occurred about nine hours prior to the report, indicating a swift move. Address 5PjMxa: Another significant transfer involved 91,890 SOL (roughly $15.98 million), which was deposited to Kraken. This transaction took place three hours before the report, signaling another large-scale move and contributing to the observed SOL selling activity . Address HiN7sS: This whale deposited 37,658 SOL (worth about $6.73 million) to Binance. Notably, this particular address realized a profit of $1.63 million from this specific transaction, which happened eight hours before the report. While deposits to exchanges are generally seen as a precursor to selling, it is important to remember that not all such transfers definitively result in immediate sales. However, the sheer volume of these large SOL transactions certainly warrants careful observation for their potential Solana price impact . How Do Large SOL Transactions Influence Solana’s Price? When significant amounts of a cryptocurrency like SOL are moved to exchanges by whales, it can create a supply overhang. This increased supply, if met with insufficient demand, could exert downward pressure on the asset’s price. The market often reacts to these large-scale crypto whale movements , as they can signal a shift in sentiment among major holders. The collective action of these three addresses, totaling over 226,000 SOL, represents a substantial amount that could impact Solana’s valuation. Such large-scale transfers can trigger speculative trading and influence short-term price volatility, directly affecting the Solana price impact . Traders and investors closely monitor these on-chain metrics to gauge potential market direction and adjust their strategies accordingly, staying ahead of developing Solana market trends . Navigating Current Solana Market Trends : What Should Investors Consider? For those invested in or considering Solana, understanding these ongoing Solana market trends is paramount. While whale activity can be a strong indicator, it is only one piece of the puzzle. Other factors, such as broader market sentiment, technological developments within the Solana ecosystem, and macroeconomic indicators, also play crucial roles in determining long-term value beyond immediate SOL selling activity . Actionable Insights for Investors: Stay Informed: Regularly check on-chain data and reliable crypto news sources for updates on whale movements and exchange flows. Understanding these crypto whale movements can provide an edge. Diversify Your Portfolio: Avoid over-reliance on a single asset. Diversifying your investments can help mitigate risks associated with sudden market shifts and unexpected Solana price impact . Implement Risk Management: Use tools like stop-loss orders and define clear entry and exit strategies to protect your investments during periods of increased volatility. Distinguish Short-Term from Long-Term: Differentiate between short-term price fluctuations caused by whale activity and the long-term fundamentals and growth potential of the Solana project. The recent SOL selling activity serves as a reminder of the dynamic nature of the crypto markets. While these whale movements indicate potential selling pressure, the overall resilience and ongoing innovation within the Solana ecosystem will be key determinants of its future trajectory. In Summary: The recent deposits of substantial SOL amounts by three whale addresses to exchanges signal potential selling pressure, prompting close observation of Solana’s market. These significant crypto whale movements highlight the importance of monitoring on-chain data to anticipate market shifts and manage investment risks effectively, especially concerning the potential Solana price impact and evolving Solana market trends . Frequently Asked Questions (FAQs) Q1: What does “SOL selling activity” by whales mean? A1: “SOL selling activity” by whales refers to large cryptocurrency holders (whales) moving significant amounts of Solana (SOL) from their private wallets to centralized exchanges, which is often interpreted as an intention to sell these assets. Q2: How can I track crypto whale movements? A2: You can track crypto whale movements using on-chain analytics platforms like Lookonchain, Whale Alert, or Nansen, which monitor large transactions and provide insights into significant wallet activity. Q3: Do all whale deposits to exchanges result in sales? A3: No, not all whale deposits to exchanges definitively result in immediate sales. While it’s a strong indicator of selling intent, whales might also move funds for other reasons, such as liquidity provision or rebalancing portfolios. Q4: What is the potential Solana price impact of these large transactions? A4: Large SOL transactions moved to exchanges can increase the available supply, potentially leading to downward pressure on Solana’s price if demand does not match the increased supply. This can cause short-term volatility and affect the Solana price impact . Q5: How can investors react to these Solana market trends? A5: Investors can react by staying informed with on-chain data, diversifying their portfolios, implementing robust risk management strategies (like stop-loss orders), and distinguishing between short-term price fluctuations and Solana’s long-term fundamentals. Did you find this analysis helpful? Share this article on your social media to help others understand the critical SOL selling activity by whales and its potential impact on the Solana market! To learn more about the latest crypto market trends, explore our article on key developments shaping Solana price action . This post SOL Selling Activity: Crucial Warning from Three Whale Addresses first appeared on BitcoinWorld and is written by Editorial Team",Crypto News|crypto whales|Cryptocurrency news|Market Analysis|SOL|Solana,EN,0,0,CRYPTOCURRENCY|SOL|MARKET|TRADING|BUSINESS,"{'name': 'Bitcoin World', 'img': 'https://resources.cryptocompare.com/news/82/default.png', 'lang': 'EN'}",bitcoinworld,2025-08-12 02:50:10
49950187,https://cryptonews.com/?p=407188,1754967129,https://resources.cryptocompare.com/news/52/49950187.jpeg,Terraform Co-Founder Do Kwon to Plead Guilty in $40B UST Fiasco,https://cryptonews.com/news/terraform-labs-cofounder-do-kwon-change-guilty-plea-ust-fiasco/,"Terraform Labs co-founder Do Kwon is expected to plead guilty in a US fraud case tied to the 2022 collapse of the TerraUSD (UST) stablecoin , which wiped out $40b in value and sent shockwaves through the cryptocurrency industry. US District Judge Paul Engelmayer has scheduled a change of plea hearing for Tuesday 10:30 am in Manhattan federal court. In an order on Monday, the judge directed Kwon to be ready to explain in detail how he broke the law if he admits guilt. The 33-year-old South Korean entrepreneur had pleaded not guilty in January after a prolonged extradition dispute over whether he would first be prosecuted in the US or in South Korea. Montenegro Arrest Capped Months-Long International Manhunt Both countries have charged Kwon in connection with the implosion of TerraUSD, a Singapore-based algorithmic stablecoin designed to maintain a one-to-one peg to the US dollar through a mint-and-burn mechanism with its sister token Luna. Do Kwon Update: The plea hearing is tomorrow August 12th. Do Kwon was extradited to the United States from Montenegro on December 31, 2024. He initially pleaded not guilty to nine felony counts, including securities fraud, market manipulation, money laundering, and wire fraud.… pic.twitter.com/TJTPmCAATB — MartyParty (@martypartymusic) August 11, 2025 That mechanism failed in May 2022, causing TerraUSD to lose its peg and triggering a market crash that contributed to the downfall of crypto exchange FTX. The collapse erased billions in investor wealth and damaged confidence in digital asset markets. Kwon was a fugitive for months before he and Terraform’s former chief financial officer, Han Chang-joon, were arrested in Montenegro in March 2023 while attempting to board a Dubai-bound private jet using fake passports. He spent months in detention as Montenegro weighed competing extradition requests from Washington and Seoul. Kwon’s 92% Stake Reflects Personal Ties to Firm’s Collapse The US SEC had already won a civil fraud case against Kwon and Terraform in April 2024. Moreover, a New York jury found they misled investors about the stability of TerraUSD. The jury also concluded they falsely claimed that Chai, a popular Korean payments app, was using Terraform’s blockchain for transactions. Under a settlement, Kwon and Terraform agreed to pay $4.47b. In addition, they committed to winding down operations . They also pledged to use remaining assets to repay creditors. Notably, Kwon personally owned 92% of the company. In the US criminal case, Kwon had faced a nine-count indictment including securities fraud, wire fraud, commodities fraud,and conspiracy to commit money laundering. Judge Engelmayer has instructed the defendant’s legal team to prepare a detailed statement covering each charge Kwon plans to admit. Guilty Plea Could Shape US and South Korea Prosecutions Court documents suggest the plea deal could streamline proceedings in the US. However, it may also influence ongoing investigations in South Korea. There, Kwon faces separate fraud and financial misconduct charges under capital markets laws. If accepted, the guilty plea would mark a dramatic turn in one of the most high-profile prosecutions in the crypto sector. It would also close a chapter on a saga that has spanned continents, courtrooms and regulatory jurisdictions. The outcome of Kwon’s case could set important precedents for how international crypto fraud is prosecuted in the future. The post Terraform Co-Founder Do Kwon to Plead Guilty in $40B UST Fiasco appeared first on Cryptonews .",Blockchain News|Do Kwon|Terraform Labs,EN,0,0,LUNA|CRYPTOCURRENCY|MARKET|ASIA|REGULATION,"{'name': 'cryptonews', 'img': 'https://images.cryptocompare.com/news/default/cryptonews.png', 'lang': 'EN'}",cryptonews,2025-08-12 02:52:09
49950329,https://bitcoinworld.co.in/?p=187887,1754967310,https://resources.cryptocompare.com/news/82/49950329.jpeg,U.S. Spot Bitcoin ETFs See Astounding $178.99M Inflow Surge,https://bitcoinworld.co.in/us-spot-bitcoin-etf-inflows-19/,"BitcoinWorld U.S. Spot Bitcoin ETFs See Astounding $178.99M Inflow Surge The cryptocurrency world is buzzing with exciting news! U.S. spot Bitcoin ETFs recently experienced a significant surge, recording a combined net inflow of $178.99 million on August 11. This remarkable achievement marks the fourth consecutive day of positive inflows, signaling growing confidence and interest in these investment vehicles. For those tracking Bitcoin investment trends, this consistent momentum highlights a maturing market. What’s Driving the Astounding Momentum in U.S. Spot Bitcoin ETFs? On August 11, U.S. spot Bitcoin ETFs witnessed a substantial injection of capital, totaling $178.99 million. This figure, reported by Trader T on X, extends a positive streak that began days prior. The sustained interest in Bitcoin ETF inflows suggests a deeper trend at play beyond mere daily fluctuations. Growing Institutional Confidence: Major financial institutions are increasingly comfortable allocating capital to digital assets. Accessibility: Spot Bitcoin ETFs offer a regulated and familiar pathway for traditional investors to gain exposure to Bitcoin without directly holding the cryptocurrency. Market Maturation: The consistent inflows reflect a broader acceptance of Bitcoin as a legitimate asset class. This trend is crucial for the overall crypto market, indicating robust demand from a diverse range of investors. Key Players Shaping Bitcoin ETF Inflows Several prominent funds contributed significantly to the recent Bitcoin ETF inflows . BlackRock’s IBIT led the pack, demonstrating its strong market presence. BlackRock’s IBIT: Dominating the day with an impressive $139.08 million in inflows. This makes IBIT a powerhouse in the spot Bitcoin ETF arena. Grayscale’s Mini BTC: Added a notable $14.24 million, showing continued interest in Grayscale’s offerings. Fidelity’s FBTC: Secured $12.99 million, reinforcing Fidelity’s position as a key player in crypto ETF products. Grayscale’s GBTC and Bitwise’s BITB: Also saw positive contributions of $7.49 million and $5.19 million respectively. Other ETFs reported no change in their holdings for the day. These figures illustrate a broad-based positive sentiment across multiple providers of U.S. spot Bitcoin ETFs . The Broader Impact of Sustained Spot Bitcoin ETF Adoption The consistent stream of Bitcoin ETF inflows holds significant implications for the wider cryptocurrency ecosystem. This isn’t just about daily numbers; it reflects a fundamental shift in how large-scale investors view and access digital assets. Market Validation: Sustained inflows provide validation for Bitcoin as a stable and attractive investment vehicle. Increased Liquidity: More capital flowing into these ETFs enhances market liquidity for Bitcoin itself. Paving the Way: The success of spot Bitcoin ETF products could encourage the development and approval of other crypto ETF products, potentially including those for Ethereum or other major cryptocurrencies. Mainstream Integration: As traditional financial products, these ETFs bridge the gap between conventional finance and the digital asset space, fostering greater mainstream integration of Bitcoin investment . Ultimately, these inflows are a strong indicator of growing institutional and retail confidence in Bitcoin’s long-term potential. The impressive $178.99 million in net inflows into U.S. spot Bitcoin ETFs on August 11, marking a fourth consecutive day of growth, underscores a powerful trend. Major players like BlackRock, Grayscale, and Fidelity are leading this charge, channeling significant capital into the Bitcoin market. This sustained interest not only validates Bitcoin’s position as a viable asset but also signals increasing institutional adoption and market maturity. The consistent positive Bitcoin ETF inflows are a testament to the evolving landscape of digital asset investment. Frequently Asked Questions (FAQs) What is a U.S. spot Bitcoin ETF? A U.S. spot Bitcoin ETF is an exchange-traded fund that directly holds Bitcoin. It allows investors to gain exposure to Bitcoin’s price movements without needing to buy, store, or manage the actual cryptocurrency themselves. Why are Bitcoin ETF inflows important? Bitcoin ETF inflows indicate growing investor demand, particularly from institutional and traditional finance sectors. Consistent inflows can contribute to increased liquidity and price stability for Bitcoin, signaling broader market acceptance and confidence in Bitcoin investment . Which Bitcoin ETFs saw the most inflows on August 11? On August 11, BlackRock’s IBIT led with $139.08 million in inflows, followed by Grayscale’s Mini BTC ($14.24 million) and Fidelity’s FBTC ($12.99 million). How do these inflows affect the crypto market? These inflows generally have a positive impact. They bring new capital into the crypto ecosystem, enhance market liquidity, and validate Bitcoin as a legitimate asset class, potentially encouraging further institutional and retail Bitcoin investment . Did you find this analysis of U.S. spot Bitcoin ETF inflows insightful? Share this article with your network on social media to keep others informed about the latest trends in cryptocurrency investment! To learn more about the latest Bitcoin ETF trends, explore our article on key developments shaping Bitcoin’s institutional adoption. This post U.S. Spot Bitcoin ETFs See Astounding $178.99M Inflow Surge first appeared on BitcoinWorld and is written by Editorial Team",Crypto News|Bitcoin ETFs|BlackRock IBIT|Crypto Inflows|Digital Assets|Investment Trends,EN,0,0,CRYPTOCURRENCY|BTC|MARKET|BUSINESS|TRADING,"{'name': 'Bitcoin World', 'img': 'https://resources.cryptocompare.com/news/82/default.png', 'lang': 'EN'}",bitcoinworld,2025-08-12 02:55:10
