id,guid,published_on,imageurl,title,url,body,tags,lang,upvotes,downvotes,categories,source_info,source,date
37523508,https://www.cryptopolitan.com/?p=626276,1733962305,https://resources.cryptocompare.com/news/43/37523508.jpeg,Ubisoft and Arbitrum set Dec. 18 for the launch of Web3 shooter ‘Captain Laserhawk’,https://www.cryptopolitan.com/ubisoft-set-for-launch-of-captain-laserhawk/,"Arbitrum Foundation and Ubisoft have chosen Dec. 18 as the launch date for the web3 shooter game Captain Laserhawk: The G.A.M.E. Inspired by the animated Netflix series Captain Laserhawk: A Blood Dragon Remix, the game will debut on Arbitrum. Ubisoft, known for publishing popular franchises like Assassin’s Creed and Just Dance, has featured a cast of characters from its previous titles, including Far Cry: Rayman, Assassin’s Creed, Blood Dragon, Beyond Good and Evil, The Crew, Rainbow Six, Splinter Cell, and Watch Dogs. Ubisoft has a free NFT mint for the game While gamers await the launch in a week, a free NFT mint is happening today. Niji Warrior, the games’ NFT collection, is launching today on the Magic Eden Marketplace . The NFT allows holders to make inputs into game mechanics, map designs, and storylines. Holders of these tokens will have access to exclusive perks and the leeway to participate in community governance. They could also evolve their NFTs based on how deeply they engage. Ubisoft’s Technical Director and Executive Producer, Didier Genevois, spoke on the project: This project represents a new frontier in collaborative game development, where players become co-creators. ~ Didier Genevois All the 10,000 Niji warrior NFTs portray a pixel of a robot or creature. The art is similar to the artwork for Warlords NFTs, released earlier by Ubisoft’s Champions Tactics last year. Web3 gaming continues to gain momentum The Web3 gaming space has taken an upward trajectory, and there are signs that it’s not stopping anytime soon. Non-fungible token sales have also been growing steadily since October. The first week of November was pleasing, as the sale volumes settled at $187 million. While NFTs are regaining attention, the Beam Foundation is preparing to launch a $150 million fund to improve Web3 gaming in Abu Dhabi. Although the NFT sector has been struggling for years after the 2021 NFT boom, Web3 gaming, and leisure-based apps have continued to show a bullish nature as we move towards 2025. Ubisoft’s entry into web3 gaming has been smooth due to how organized they were while venturing. The French firm included alpha and beta tests, which allowed users to give feedback, thus ensuring that game mechanics were well-balanced. Land a High-Paying Web3 Job in 90 Days: The Ultimate Roadmap",News|USD,EN,0,0,SPONSORED|TRADING|ARB|TOKEN SALE,"{'name': 'Cryptopolitan', 'img': 'https://images.cryptocompare.com/news/default/cryptopolitan.png', 'lang': 'EN'}",cryptopolitan,2024-12-12 00:11:45
37523494,https://thecoinrise.com/dont-regret-missing-floki-inu-seize-the-wealth-building-chance-with-this-best-ongoing-meme-coin-presale/,1733962535,https://resources.cryptocompare.com/news/60/37523494.jpeg,Don’t Regret Missing FLOKI Inu—Seize the Wealth Building Chance with This Best Ongoing Meme Coin Presale!,https://thecoinrise.com/dont-regret-missing-floki-inu-seize-the-wealth-building-chance-with-this-best-ongoing-meme-coin-presale/,"Cryptocurrency has a way of turning ordinary folks into overnight millionaires, and nowhere is that more evident than with meme coins. If you missed the FLOKI Inu hype train back in the day, here’s your shot at redemption. BTFD Coin (BTFD) is not just another meme coin; it’s attracting the bulls with its lucrative presale, already raising over $3.4 million and selling more than 50 billion coins to over 4,400 holders. At just $0.00012 in its 11th presale stage, BTFD promises massive gains for early investors. But why is BTFD creating such a buzz? For starters, it’s all about turning market dips into opportunities. With features like staking, a P2E game, and an incredibly loyal Bulls Squad community, BTFD is carving its place in the meme coin hall of fame. Let’s dive into why BTFD is set to dethrone FLOKI as the meme coin to watch. BTFD Coin: The Rise of the Dip-Seizing Movement The phrase “Buy the F***ing Dip” (BTFD) is a rallying cry in the crypto world, and BTFD Coin embodies this ethos like no other. Born from the concept of turning price dips into opportunities, BTFD Coin is designed for savvy investors who want to grab low-priced coins before the next market surge. The presale started at $0.000004 and has already climbed to $0.00012, showing an 11th-stage presale momentum that’s hard to ignore. With a total supply of 173 billion coins, BTFD is primed for scarcity-driven price growth. Imagine investing $1,800 today at $0.00012 per coin. You’d snag 15 million coins. By the time the coin hits its listing price of $0.0006, your investment will be worth $9,000. That’s a 400% gain without even factoring in potential bull-run profits. BTFD isn’t just about flipping coins; it’s about community and innovation. The Bulls Squad—a core group of crypto enthusiasts—drives engagement through memes, market insights, and community support. Plus, the BTFD Play-to-Earn (P2E) game’s beta version is live. While rewards aren’t active yet, players are raving about the immersive experience and potential for future earnings. Staking is another big draw. With an average APY of 90%, BTFD rewards holders who play the long game. Stake $10,000 BTFD, and in a year, you could see your holdings nearly double. Combine that with the upcoming listing on major exchanges, and it’s clear why analysts are bullish on BTFD hitting $0.002 by late 2025. How to Buy BTFD The presale process is straightforward. For $1 USDT, you can grab 8,341 BTFD coins. If you’re holding Ethereum, Bitcoin, Binance Coin, or Solana, you’re in luck. Just one Ethereum gets you 30,507,083 BTFD coins, while a single Bitcoin lands you over 813 million coins . The entry points are accessible, and the rewards are potentially massive. With over $3.4 million raised so far and only a few presale stages left, now’s the time to act. Don’t let FOMO keep you from securing your stake in the Best Ongoing Meme Coin Presale. FLOKI Inu: The Meme Coin You Wish You Hadn’t Missed FLOKI Inu emerged in 2021 as part of the Dogecoin and Shiba Inu-inspired meme coin frenzy. Named after Elon Musk’s pet Shiba Inu, FLOKI combined the power of internet culture with a solid community-driven approach. Early adopters saw astronomical returns, with FLOKI’s price skyrocketing by over 10,000% in its initial run. FLOKI’s roadmap has been anything but ordinary. From launching FlokiFi, its DeFi ecosystem, to developing Valhalla, a blockchain-based metaverse game, FLOKI has consistently delivered on its promises. Today, it’s trading at $0.00003456, boasting a market cap of $325 million. While the price may seem small, the returns for early investors were anything but. A modest $100 investment during FLOKI’s infancy could’ve turned into a small fortune. But as they say, hindsight is 20/20. Despite its success, FLOKI hasn’t been without challenges. The crypto market’s volatility and competition from newer meme coins have tempered its growth. Still, FLOKI remains a strong contender in the meme coin space, particularly with its push into NFTs and metaverse gaming. Why BTFD Could Be the Best Overall While FLOKI has already established itself, BTFD is just getting started. Its presale price offers incredible upside, and the project’s innovative features —from staking to its P2E game—are already generating buzz. With FLOKI, the ship might’ve sailed for 1,000x returns, but with BTFD, the journey is just beginning. The Verdict: Don’t Miss Out Again Cryptocurrency is about timing, and if FLOKI taught us anything, it’s that early birds truly get the worm. BTFD Coin’s presale is shaping up to be the Best Ongoing Meme Coin Presale of 2024, with analysts predicting explosive growth. Whether you’re looking to play the P2E game, stake your coins for long-term rewards, or simply ride the next meme coin wave, BTFD has something for everyone. Don’t let this opportunity slip through your fingers. Sign up today and secure your stake before the presale ends. Your financial future might just thank you. Find Out More: Website: https://www.btfd.io/ X/Twitter: https://x.com/BTFD_COIN Telegram: https://t.me/btfd_coin The post Don’t Regret Missing FLOKI Inu—Seize the Wealth Building Chance with This Best Ongoing Meme Coin Presale! appeared first on TheCoinrise.com .",Token Presale and ICO Insights|BTFD,EN,0,0,BUSINESS|MARKET|SHIB|TRADING|FLOKI,"{'name': 'The Coin Rise', 'img': 'https://images.cryptocompare.com/news/default/thecoinrise.png', 'lang': 'EN'}",thecoinrise,2024-12-12 00:15:35
37523514,https://coingape.com/?p=228908,1733962797,https://images.cryptocompare.com/news/default/coingape.png,"Stablecoin Market Hits Record $200B Milestone, $400B by 2025?",https://coingape.com/stablecoin-market-hits-record-200b-milestone-400b-by-2025/,"The stablecoin market has crossed a significant threshold, with its total market capitalization reaching $200 billion for the first time. This growth marks a sharp rise signaling the increasing adoption of these digital assets across various sectors. According to data from CCData and DefiLlama, the stablecoin market has added $10 billion in value in just two weeks, surpassing the $190 billion peak seen during the 2022 crypto market rally. Stablecoin Market Surpasses $200B, Poised to Double to $400B in 2025, Experts Say According to DefiLlama , the stablecoin market cap has surpassed $200 billion, driven by the ongoing crypto rally and increasing use cases beyond digital currencies. The growth of stablecoins has been fueled by a rise in crypto trading and the increasing adoption of non-crypto applications such as payments, remittances, and savings. This shift is particularly noticeable in regions with fragile financial systems and high inflation. Tether’s USDT has seen its market value soar to a record $139 billion. This represents a 12% increase in just one month, according to data from DefiLlama. Moreover, over 109 million on-chain wallets are holding USDT by Q4 2024, making it one of the most widely held digital assets. USDC, the second-largest stablecoin issued by Circle, has also grown, reaching nearly $41 billion in market value, up by 5% in the same period. Key Factors Driving Growth Several factors are contributing to the rapid expansion of the stablecoin market. One of the main drivers is the increasing integration in everyday financial systems, including remittances and peer-to-peer payment platforms. Stablecoins offer an alternative means of transferring value, especially in countries with depreciating local currencies. In addition, stablecoins are gaining traction as a yield-generating investment vehicle. New products like Ethena’s USDe token, which uses a strategy of shorting Bitcoin and Ether, have been increasingly popular. Meanwhile, Tether’s USDT stablecoin has been recognized as an Accepted Virtual Asset by Abu Dhabi Global Market’s Financial Services Regulatory Authority. This milestone allows licensed entities to offer USDT-related services, supporting the UAE’s vision to become a global digital finance hub. Future Outlook: Market Could Reach $400B by 2025 Additionally, experts predict that the stablecoin market could grow even further, potentially reaching $400 billion by 2025. A report from asset manager Bitwise suggests that U.S. legislation could be a major catalyst for this growth. If the U.S. Congress passes clear regulatory frameworks, it would encourage more businesses and consumers to adopt them. This regulatory clarity will enable traditional financial institutions, like banks, to enter the cryptocurrency market. Meanwhile, Goldman Sachs CEO David Solomon recently signaled the firm’s potential cryptocurrency expansion, dependent on regulatory shifts. The bank has built a digital asset infrastructure but remains constrained by legal limitations. Solomon indicated readiness to engage with Bitcoin and Ethereum if the regulatory environment is favorable. In addition, fintech companies are increasingly integrating stablecoins into their services, following the example set by PayPal with its PYUSD token. The use case expansion of global payments will continue, as it offers a stable alternative to volatile cryptos and traditional financial services. More so, reports from Standard Chartered and Zodia Markets suggest that stablecoins could eventually make up 10% of the U.S. money supply and foreign exchange transactions. This represents a substantial increase from the current 1% share. The post Stablecoin Market Hits Record $200B Milestone, $400B by 2025? appeared first on CoinGape .",24/7 Cryptocurrency News|Stablecoin News|stablecoin|Tether USDT,EN,0,0,BTC|MARKET|REGULATION|TRADING|USDT,"{'name': 'CoinGape', 'img': 'https://images.cryptocompare.com/news/default/coingape.png', 'lang': 'EN'}",coingape,2024-12-12 00:19:57
37523546,https://ambcrypto.com/?p=451352,1733963433,https://images.cryptocompare.com/news/default/ambcrypto.png,USDT vs. USDC: Will Circle’s plans help it give a boost over Tether?,https://ambcrypto.com/usdt-vs-usdc-will-circles-plans-help-it-give-a-boost-over-tether/,"A look at the gap between USDT and USDC, as well as a recent development that could boost USDC in the coming months.",Analysis|Global News|Google News|News|News 1|Stablecoins,EN,0,0,MARKET|USDT|USDC,"{'name': 'AMB Crypto', 'img': 'https://images.cryptocompare.com/news/default/ambcrypto.png', 'lang': 'EN'}",ambcrypto,2024-12-12 00:30:33
37523570,https://news.bitcoin.com/?p=691233,1733963531,https://resources.cryptocompare.com/news/14/37523570.jpeg,Analyst: XRP’s Open Interest Spike Points to its Growing Appeal and Foundational Strengths,https://news.bitcoin.com/analyst-xrps-open-interest-spike-points-to-its-growing-appeal-and-foundational-strengths/,"A surge in XRP’s open interest suggests continued investor interest in the cryptocurrency, according to analyst Iliya Kalchev. XRP Open Interest Leverage Driven The recent spike in XRP’s open interest suggests the number four digital asset is likely to remain “a focal point in the crypto space for the foreseeable future,” according to Iliya Kalchev,",Markets and Prices|Open Interest|XRP,EN,0,0,BUSINESS|XRP,"{'name': 'Bitcoin.com', 'img': 'https://images.cryptocompare.com/news/default/bitcoincom.png', 'lang': 'EN'}",bitcoin.com,2024-12-12 00:32:11
37523606,https://decrypt.co/?p=296145,1733963622,https://resources.cryptocompare.com/news/44/37523606.jpeg,Less than 1% of Microsoft Shareholders Voted in Favor of Investing in Bitcoin,https://decrypt.co/296145/less-than-1-of-microsoft-shareholders-voted-in-favor-of-investing-in-bitcoin,"More than 28.23 million Microsoft shareholder votes were cast in favor for Bitcoin, compared to an overwhelming 5.148 billion against.",|Business,EN,0,0,BTC|BUSINESS,"{'name': 'Decrypt', 'img': 'https://images.cryptocompare.com/news/default/decrypt.png', 'lang': 'EN'}",decrypt,2024-12-12 00:33:42
37523608,https://www.cryptointelligence.co.uk/?p=26276,1733964155,https://resources.cryptocompare.com/news/95/default.png,"Pepe MAGA (PEPEMAGA) Solana Memecoin to Rally 18,000% Ahead of Exchange Listing, While Shiba Inu, WIF and BONK Underperform",https://www.cryptointelligence.co.uk/pepe-maga-pepemaga-solana-memecoin-to-rally-18000-ahead-of-exchange-listing-while-shiba-inu-wif-and-bonk-underperform/,"Pepe MAGA could turn early investors into multi-millionaires, like Shiba Inu (SHIB) and Dogecoin (DOGE) did. Pepe MAGA (PEPEMAGA), a new Solana memecoin that was launched today, is set to explode over 18,000% in price in the coming days. This is because PEPEMAGA is set to soon be listed on numerous crypto exchanges, according to reports. This will give the Solana memecoin exposure to millions of additional investors, who will pour funds into the coin and drive its price up. Currently, Pepe MAGA can only be purchased via Solana decentralized exchanges, like Jup.ag and Raydium.io, and early investors stand to make huge returns in the coming days. Early investors in SHIB and DOGE made astronomical returns, and Pepe MAGA could become the next viral memecoin. Pepe MAGA launched with over $9,000 of liquidity, giving it a unique advantage over the majority of other new memecoins, and early investors could make huge gains. How to Buy To buy Pepe MAGA on Raydium.io or Jup.ag ahead of the CEX listings, users need to connect their Solflare, MetaMask, or Phantom wallet, and swap Solana for Pepe MAGA by entering its contract address – C3zan7DDUAxZDSLnSxpptmyARsvGAbah4KWQB5QokoFM – in the receiving field. If you don’t have one of these wallets already, you can create a new wallet in a few minutes and transfer some Solana to it (which will then be used to buy the memecoin) from an exchange like Coinbase, Binance, and many others. In fact, early investors could make returns similar to those who invested in Shiba Inu (SHIB) and Dogecoin (DOGE) before these memecoins went viral and exploded in price. If this happens, a new wave of memecoin millionaires could be created in a matter of weeks – or potentially even sooner. The Solana memecoin craze continues amid larger memecoins, like Shiba Inu (SHIB), Dogecoin (DOGE), and DogWifHat (WIF), trading sideways in recent weeks and losing momentum. This is why many SHIB, DOGE, and WIF investors are instead investing in new Solana memecoins, like PEPEMAGA. Such memecoins have no utility and no inherent value, but investors looking for high gains have been investing in them due to their potential to rapidly rise in price.",Blockchain News|Crypto News Today|Press Releases,EN,0,0,BUSINESS|DOGE|SHIB|SOL|TRADING,"{'name': 'CryptoIntelligence', 'img': 'https://resources.cryptocompare.com/news/95/default.png', 'lang': 'EN'}",cryptointelligence,2024-12-12 00:42:35
37523619,https://cointelegraph.com/news/desci-project-researchhub-featured-on-major-scientifc-journal,1733964313,https://images.cryptocompare.com/news/default/cointelegraph.png,Major scientific journal Nature features DeSci project ResearchHub,https://cointelegraph.com/news/desci-project-researchhub-featured-on-major-scientifc-journal?utm_source=rss_feed&utm_medium=rss&utm_campaign=rss_partner_inbound,ResearhHub is backed by Coinbase CEO Brian Armstrong who has strongly advocated for science peer reviewers to get paid.,ResearchHub|ResearchCoin|Crypto Peer Research|Decentralized Science|Nature.com|Brian Armstrong,EN,0,0,EXCHANGE,"{'name': 'CoinTelegraph', 'img': 'https://images.cryptocompare.com/news/default/cointelegraph.png', 'lang': 'EN'}",cointelegraph,2024-12-12 00:45:13
37523671,https://dailyhodl.com/?p=312346,1733965208,https://images.cryptocompare.com/news/default/dailyhodl.png,"Analyst Says Dogecoin in Early Bull Market Stage, Sees DOGE Skyrocketing to Huge Target ‘If Things Go Wild’",https://dailyhodl.com/2024/12/11/analyst-says-dogecoin-in-early-bull-market-stage-sees-doge-skyrocketing-to-huge-target-if-things-go-wild/,"A closely followed crypto trader believes that top memecoin Dogecoin ( DOGE ) could soar to double digits based on historical patterns. Crypto strategist Ali Martinez tells his 97,000 followers on the social media platform X that DOGE appears to be in the phase of the cycle when it pauses before skyrocketing to new record highs. The trader shares a chart suggesting that DOGE is mirroring its price action during the 2017 and 2021 market cycles while trading in a large ascending channel. “Check out where we are in the Dogecoin DOGE bull cycle! Very early, right? For that reason, I’m thankful for the dip and will buy more between $0.40-$0.30. The target remains $3, and if things go wild, $18!” Source: Ali Martinez/X At time of writing, DOGE is trading for $0.391, down nearly 5% on the day. Turning to the layer-1 protocol Cardano ( ADA ), Martinez says that the altcoin can find support at the $1 level based on the In/Out of the Money Around Price (IOMAP) metric. IOMAP classifies crypto addresses as either profiting, breaking even, or losing money – to determine support and resistance levels for ADA. According to the metric, 41,720 addresses have accumulated over one billion ADA at $1. Source: Ali Martinez/X Zooming out, Martinez says Cardano appears to be following its 2020 price action when it witnessed a period of retracement before soaring to fresh highs. “Cardano is doing the same as it did in 2020, which is why I’m buying! Even if it dips down to $0.76, I’m buying more and plan to book profits between $4 and $6.” Source: Ali Martinez/X At time of writing, ADA is trading at $1. Don't Miss a Beat – Subscribe to get email alerts delivered directly to your inbox Check Price Action Follow us on X , Facebook and Telegram Surf The Daily Hodl Mix Disclaimer: Opinions expressed at The Daily Hodl are not investment advice. Investors should do their due diligence before making any high-risk investments in Bitcoin, cryptocurrency or digital assets. Please be advised that your transfers and trades are at your own risk, and any losses you may incur are your responsibility. The Daily Hodl does not recommend the buying or selling of any cryptocurrencies or digital assets, nor is The Daily Hodl an investment advisor. Please note that The Daily Hodl participates in affiliate marketing. Generated Image: Midjourney The post Analyst Says Dogecoin in Early Bull Market Stage, Sees DOGE Skyrocketing to Huge Target ‘If Things Go Wild’ appeared first on The Daily Hodl .",Altcoins|Trading|ada|Cardano|doge|dogecoin|News,EN,0,0,ADA|ALTCOIN|DOGE|MARKET|TRADING,"{'name': 'The Daily Hodl', 'img': 'https://images.cryptocompare.com/news/default/dailyhodl.png', 'lang': 'EN'}",dailyhodl,2024-12-12 01:00:08
37523656,https://ambcrypto.com/?p=451195,1733965244,https://images.cryptocompare.com/news/default/ambcrypto.png,Bitcoin defends support at $96k: Can BTC target $105k next?,https://ambcrypto.com/bitcoin-defends-support-at-96k-can-btc-target-105k-next/,The falling Open Interest indicated that speculators were waiting for the market to make up its mind and break the range.,Analysis|Bitcoin|BTC Trading View|HideCryptopanic|News|News 1|No Homepage|Social|Trading View|ambcrypto,EN,0,0,BTC|MARKET,"{'name': 'AMB Crypto', 'img': 'https://images.cryptocompare.com/news/default/ambcrypto.png', 'lang': 'EN'}",ambcrypto,2024-12-12 01:00:44
37523711,https://decrypt.co/?p=296147,1733965259,https://resources.cryptocompare.com/news/44/37523711.jpeg,ChatGPT Goes Dark Following Apple Intelligence Integration,https://decrypt.co/296147/chatgpt-goes-dark-following-apple-intelligence-integration,"“We're experiencing an outage right now. We have identified the issue and are working to roll out a fix,” OpenAI said on X on Wednesday.",Artificial Intelligence,EN,0,0,OTHER,"{'name': 'Decrypt', 'img': 'https://images.cryptocompare.com/news/default/decrypt.png', 'lang': 'EN'}",decrypt,2024-12-12 01:00:59
37523772,https://news.bitcoin.com/?p=691261&preview=true&preview_id=691261,1733967015,https://resources.cryptocompare.com/news/14/37523772.jpeg,Eric Trump Predicts $1M Bitcoin as America Welcomes Most Pro-Crypto President in History,https://news.bitcoin.com/eric-trump-predicts-1m-bitcoin-as-america-welcomes-most-pro-crypto-president-in-history/,"Eric Trump confidently predicted bitcoin will surpass $1 million, crediting the “most pro-crypto president in the history of America” for spearheading a global financial revolution. Eric Trump: Bitcoin to $1M With Most Pro-Crypto President in US History Eric Trump, son of U.S. President-elect Donald Trump, confidently predicted on Dec. 10 at the Bitcoin MENA conference",Markets and Prices|Bitcoin|eric trump,EN,0,0,BTC|REGULATION,"{'name': 'Bitcoin.com', 'img': 'https://images.cryptocompare.com/news/default/bitcoincom.png', 'lang': 'EN'}",bitcoin.com,2024-12-12 01:30:15
