id,guid,published_on,imageurl,title,url,body,tags,lang,upvotes,downvotes,categories,source_info,source,date
1708327,https://www.cryptopolitan.com/?p=75735,1733955686,https://resources.cryptocompare.com/news/43/1708327.jpeg,Polkadot price prediction 2024-2030: A bullish pattern?,https://www.cryptopolitan.com/polkadot-price-prediction/,"Key takeaways : Polkadot is predicted to reach a minimum and maximum value of $3.94 and $4.48 in 2024. In 2027, the DOT price can reach a maximum price of $15.15 with an average of $13.23. The price of Polkadot is predicted to reach a maximum value of $47.13 in 2030. Polkadot (DOT) has shown impressive growth and resilience in a volatile cryptocurrency market, supported by its strong multichain protocol architecture and investor confidence. A major contributor to this success is the Sinai Upgrade on its Acala Network, enhancing functionality and security. With over 32 million transactions validated in October 2024 by the Polkadot Relay Chain, the network demonstrates significant activity and utility. A notable increase in unique wallets further signals growing user adoption and engagement, strengthening Polkadot’s position as a leading blockchain platform. Will DOT reach new heights soon? Let’s get into the Polkadot price prediction for 2024-2030. Overview Cryptocurrency Polkadot Token DOT Price $10.52 Market Cap $16.11B Trading Volume $1.33B Circulating Supply 1.53B DOT All-time High $55.00 Nov 4, 2021 All-time Low $2.69 Aug 19, 2020 24-hour High $11.21 24-hour Low $10.04 Polkadot Price Prediction: Technical Analysis Price Prediction $ 20.40 (97.40%) Volatility 29.62% 50-Day SMA $ 5.75 14-Day RSI 82.02 Sentiment Bullish Fear & Greed Index 72 (Greed) Green Days 19/30 (63%) 200-Day SMA $ 5.70 Polkadot price analysis: DOT sees resilience amid market fluctuations Key takeaways Polkadot price analysis shows a downtrend Polkadot had surged 56% in 30 days, stabilizing at $8.48 Resistance at $9.00 and support at $7.50 are critical for DOT Polkadot DOT price analysis on December 11 shows that the cryptocurrency has experienced significant volatility, reaching a peak of $10.19 before settling at a current trading price of around $8.48. Over the last 30 days, DOT has surged by 56%, marking an impressive gain amidst broader market dynamics. The U.S. president-elect’s recent nomination of a crypto-friendly leader for the SEC has injected optimism into the market. However, in the last two days, we have seen a general bearish trend in the crypto sphere. DOT and TON have recorded double-digit losses over the past week. Today’s market activity for Polkadot reflects a mixed sentiment among traders. Following an overall recovery in the market, Polkadot’s price briefly rallied but encountered resistance at $5.50, prompting caution among traders. The daily trading volume and a market cap of $15.52 billion indicate significant investor interest and participation in DOT transactions. For Polkadot, resistance levels around $5.50 have added to the hesitancy among traders, even as broader crypto recovery trends remain supportive Daily chart analysis: Bears gear for a move below $8.0 The daily chart for Polkadot reveals significant volatility as the coin consolidates after its recent upward rally. The price trades near the 20-day EMA at $8.772, indicating short-term bearish pressure. However, it remains above the 50-day ($7.214) and 100-day EMAs ($6.225), signaling a longer-term bullish outlook. The RSI currently reads 52.70, placing DOT in a neutral zone with room for upward or downward movement. DOT/USD chart The MACD indicator on the daily timeframe displays a bearish crossover, with the signal line positioned above the MACD line. This suggests declining momentum in the short term, although the histogram shows reduced bearish activity, hinting at potential stabilization. Support levels at $7.50 remain critical for maintaining upward momentum, while resistance around $9.00 will be closely monitored by traders seeking bullish confirmation. 4-Hour chart analysis: DOT stumbles to remain above $8.0 The 4-hour chart highlights Polkadot’s efforts to stabilize following its recent dip. The SMA at $8.353 acts as a critical support level, with the price oscillating around this point. The MACD on this timeframe remains in bearish territory, with the signal line slightly above the MACD line. However, the histogram reflects weakening bearish momentum, indicating a potential shift in sentiment. DOT/USD chart The Average Directional Index (ADX) reads 41.62, signalling a strong directional trend. While the current trend favours the bears, a breakout above $9.00 could reverse this dynamic. Short-term traders are likely watching the RSI on this timeframe for signs of oversold or overbought conditions, as these could trigger rapid price movements. After peaking, DOT has corrected significantly but is now showing signs of stabilization around the $8.50 mark. The SMA on the 4-hour chart at 8.353 acts as a short-term support level, with the price oscillating around this point. The MACD on this timeframe is slightly bearish, with the histogram displaying increased bearish momentum, while the ADX at 41.62 signifies a strong directional trend, which currently favours the bears. What to expect from Polkadot price analysis Polkadot’s recent performance reflects a broader trend of increased volatility in the cryptocurrency market. Despite significant selling pressure, the coin’s ability to sustain its gains underscores its resilience. Technical indicators suggest that DOT’s future movements will depend on its ability to maintain key support levels while overcoming resistance around $9.00 and $10.0.With the growing adoption of Polkadot’s ecosystem and continued development in the blockchain space, the coin remains a focal point for traders and investors. Market analysts are closely watching the $9.00 resistance level, as overcoming this hurdle could be critical for Polkadot’s short-term price trajectory. The interplay between the RSI and MACD suggests that while the immediate outlook may lean bearish, the underlying bullish trend from the past month could reassert itself if market conditions align favourably. Polkadot technical indicators: Levels and action Daily simple moving average (SMA) Period Value ($) Action SMA 3 $ 8.46 BUY SMA 5 $ 8.89 BUY SMA 10 $ 8.70 BUY SMA 21 $7.74 BUY SMA 50 $ 5.75 BUY SMA 100 $5.05 BUY SMA 200 $5.70 BUY Daily exponential moving average (EMA) Period Value ($) Action EMA 3 $ 7.41 BUY EMA 5 $6.50 BUY EMA 10 $ 5.54 BUY EMA 21 $4.93 BUY EMA 50 $ 4.66 BUY EMA 100 $4.90 BUY EMA 200 $ 5.48 SELL What to expect from Polkadot price analysis Overall, Polkadot price analysis shows a descending pattern in DOT’s market as sellers remain in control over buyers. The technical indicators point towards a bearish trend, but buying pressure could resurface if support near $10.04 holds. The resistance at $11.21 must be broken for a higher price push. Is Polkadot a good investment? Investing in Polkadot offers advantages for those interested in advanced blockchain solutions. Its multi-chain framework enables interoperability and scalability through its innovative relay chain and parachain architecture, improving transaction efficiency. The platform’s para-chain slot auction system allows democratic participation, and holding DOT tokens grants governance rights, giving investors a voice in the network’s future. These features make Polkadot a strategic addition for investors looking to capitalize on cutting-edge blockchain technology and the potential for future digital transformation. Will Polkadot recover? Polkadot (DOT) shows signs of recovery with a recent upward trend. If positive market conditions continue, Polkadot has the potential for further recovery. Will Polkadot reach $10? Yes, Pollkadot is projected to reach up to $10 by 2026 according to the long-term predictions. Will Polkadot reach $100? Reaching $100 for Polkadot (DOT) is highly ambitious and unlikely in the near term due to its current price level in the year 2030 is $45.80. Does Polkadot have a good long-term future? Based on the recent upward movement of DOT, Polkadot has a promising long-term future. Recent news/opinion on Polkadot Hydration launches its decentralized borrowing platform on Polkadot, offering innovative DeFi tools like on-chain prioritized liquidations for enhanced security. Hydration has launched its decentralized borrowing platform, the Hydration Money Market, on the Polkadot blockchain. This platform allows users to deposit cryptocurrency as collateral, earn interest, and borrow digital assets. It includes innovative features such as over-collateralized borrowing and on-chain prioritized liquidations, enhancing security and efficiency in DeFi transactions. Hydration aims to expand financial accessibility and innovation, leveraging Polkadot’s features for a robust, user-centric DeFi ecosystem. More details are available on hydration.net and app.hydration.net. Polkadot Price Prediction December 2024 Polkadot (DOT) is expected to exhibit a range of price movements in December 2024. The potential low is $3.36, while the average price might be around $4.01. On the higher end, DOT could reach up to $7.25. Month Potential Low Potential Average Potential High December $3.36 $4.01 $7.25 Polkadot Price Prediction 2024 By 2024, DOT is expected to have a minimum value of $3.94 and a maximum value of $4.48. The coin’s average value could be around $4.36. Polkadot Price Prediction Potential Low Potential Average Potential High 2024 $3.94 $4.36 $4.48 Polkadot Price Predictions 2025-2030 Year Minimum Price Average Price Maximum Price 2025 $6.09 $6.27 $7.42 2026 $8.86 $9.11 $10.30 2027 $12.87 $13.23 $15.15 2028 $18.57 $19.23 $22.18 2029 $27.17 $27.94 $32.77 2030 $40.28 $41.39 $47.13 Polkadot price prediction 2025 According to the Polkadot price forecast for 2025, DOT could reach a maximum price of $7.42, a minimum price of $6.09 in 2025, and an average forecast price of $6.27. Polkadot price prediction 2026 The price of Polkadot is predicted to reach a minimum value of $8.86 in 2026. Per expert analysis, DOT token could reach a maximum value of $10.30, and an average trading price of $9.11. Polkadot price prediction 2027 Per the DOT price prediction for 2027, Polkadot is predicted to reach a minimum price level of $12.87, a maximum price of $14.83, and an average trading price of $13.23. Polkadot price prediction 2028 The price of Polkadot is predicted to reach a minimum value of $18.57 in 2028. Traders can anticipate a maximum value of $22.18 and an average trading price of $19.53. Polkadot price prediction 2029 According to the Polkadot price prediction for 2029, DOT could reach a maximum price of $32.77, a minimum price of $27.17 in 2025, and an average forecast price of $27.94. Polkadot price prediction 2030 In 2030, the price of Polkadot is predicted to reach a minimum level of $40.28. Should positive market sentiment persist, DOT can attain a maximum price of $47.13 and an average trading price of $41.39. DOT price prediction 2024 – 2030 Polkadot market price prediction: Analysts’ DOT price forecast Firm Name 2024 2025 Gov.Capital $5.47 $6.694 DigitalCoinPrice $22.76 $26.66 Coincodex $9.67 $26.00 Cryptopolitan’s Polkadot (DOT) Price Prediction Per Cryptopolitan’s DOT price forecast, the coin’s price is projected to trend upward, reaching as high as $7.42 in 2025, and making an attempt to reclaim $47.13 by 2030. Polkadot historic price sentiment Looking at the Polkadot price action over the past years, Polkadot’s price has been heavy since the beginning of 2021. After spending most of the second half of 2020 trading around $4-$5, the price broke above the previous all-time high of $7 on December 29 and quickly reached the Polkadot price projection of $10. Polkadot price history | Coinmarketcap Polkadot experienced rapid growth, with its price climbing from around $3 in January to an all-time high of approximately $57.50 in May 2021. After the peak, the price declined sharply, falling to around $10 by July before partially recovering to over $40 in November 2021. In 2022, Polkadot price steadily declined, starting the year around $30 and dropping below $10 by mid-year. By the end of 2022, the price stabilized near $5 as bearish market conditions dominated the cryptocurrency space. The price of DOT hovered between $5 and $7 for most of 2023, reflecting a period of consolidation and limited market excitement. In January 2024, Polkadot’s price remained relatively stable, trading around the $5–$6 range. By July 2024, Polkadot showed slight signs of recovery, with its price rising to around $7–$8. This modest uptick was likely driven by increasing market interest. In the year 2024 December, Polkadot has shown signs of recovery, with its price climbing to around $10.4, as of the current data.",Crypto Price Predictions,EN,0,0,BLOCKCHAIN|BUSINESS|DOT|MARKET|TRADING,"{'name': 'Cryptopolitan', 'img': 'https://images.cryptocompare.com/news/default/cryptopolitan.png', 'lang': 'EN'}",cryptopolitan,2024-12-11 22:21:26
37521437,https://cryptopotato.com/?p=374285,1733955755,https://images.cryptocompare.com/news/default/cryptopotato.png,New Crypto Scam Uses Fake Influencer Accounts to Lure Victims Into Telegram Malware Trap,https://cryptopotato.com/new-crypto-scam-uses-fake-influencer-accounts-to-lure-victims-into-telegram-malware-trap/,"A new wave of crypto scams has emerged, with attackers using fake X accounts to impersonate popular influencers and lure unsuspecting users into fraudulent Telegram groups. Users are then manipulated into installing malware that compromises crypto wallet data. Scammers Moving Beyond Simple Phishing Scams According to blockchain security firm Scam Sniffer, the scammers comment on legitimate posts, enticing users with offers of exclusive investment insights and “alpha” tips. Once individuals join these Telegram groups, they are immediately prompted to undergo a verification process via a bot called OfficiaISafeguardBot. The bot creates a false sense of urgency and pushes users to quickly complete the verification. However, this seemingly harmless step is a trap – by completing the verification, the bot injects malicious PowerShell code into the user’s clipboard. When executed, the code downloads malware designed to compromise the system and steal sensitive data, including crypto wallet information. Scam Sniffer said that the malware has been flagged by VirusTotal as harmful, and previous instances of similar attacks have resulted in private key theft, leading to significant financial losses. “This represents a new evolution in crypto scams – moving beyond simple phishing to combine social engineering with malware. Stay vigilant and share this to protect others.” Rampant Scams Last month, Casa CEO Nick Neuman shared a harrowing tale of a phishing scam that targeted him. In a post on X, Neuman described a call he received from a scammer pretending to be a Coinbase support agent. The scammer claimed that Neuman’s password change request had been canceled and encouraged him to click on a link in a suspicious email. When Neuman started questioning the scammer, they dropped the act and revealed the operation’s true nature. The scammer bragged about having recently stolen $35,000 from a victim and made it clear that the scam targets only rich crypto investors. More recently, a crypto user under the pseudonym “LeftsideEmiri,” reported losing $300,000 due to a social engineering attack. According to the user, the attack began when they received a message containing a link to a KakaoTalk conversation, which was supposedly for a partnership meeting. Although the link seemed broken, the user clicked on it, believing it to be harmless. In hindsight, they suspect that clicking the link triggered the installation of malware, which compromised their Ethereum and Solana wallets, along with several other wallets. The user made it clear that they had not approved or signed any transactions, indicating that the attack was covert and took advantage of social engineering techniques to steal funds. The post New Crypto Scam Uses Fake Influencer Accounts to Lure Victims Into Telegram Malware Trap appeared first on CryptoPotato .",AA News|Crypto News|Crypto Scams|Hacks,EN,0,0,BLOCKCHAIN|BUSINESS|ETH|EXCHANGE|SOL,"{'name': 'Crypto Potato', 'img': 'https://images.cryptocompare.com/news/default/cryptopotato.png', 'lang': 'EN'}",cryptopotato,2024-12-11 22:22:35
37521531,https://decrypt.co/?p=296139,1733955783,https://resources.cryptocompare.com/news/44/37521531.jpeg,"Apple Partners with Broadcom to Develop First AI Server Chips, Launch Set for 2026",https://decrypt.co/296139/apple-partners-with-broadcom-to-develop-first-ai-server-chips-launch-set-for-2026,Apple is partnering with semiconductor developer Broadcom and plans to launch a new AI chip to boost future server performance.,Artificial Intelligence,EN,0,0,OTHER,"{'name': 'Decrypt', 'img': 'https://images.cryptocompare.com/news/default/decrypt.png', 'lang': 'EN'}",decrypt,2024-12-11 22:23:03
37521607,https://crypto.news/?p=14318564,1733956003,https://resources.cryptocompare.com/news/74/37521607.jpeg,"3 hidden gems with 9,000% growth potential in December’s bull market",https://crypto.news/3-hidden-gems-with-9000-growth-potential-in-decembers-bull-market/,"Analyzing three hidden gems that could surge by 9,000% in December’s bull market. #partnercontent",Partner Content|sponsored,EN,0,0,MARKET|SPONSORED|TRADING,"{'name': 'nft.news', 'img': 'https://resources.cryptocompare.com/news/74/default.png', 'lang': 'EN'}",nft_news,2024-12-11 22:26:43
37521592,https://crypto.news/?p=14318564,1733956003,https://resources.cryptocompare.com/news/73/37521592.jpeg,"3 hidden gems with 9,000% growth potential in December’s bull market",https://crypto.news/3-hidden-gems-with-9000-growth-potential-in-decembers-bull-market/,"Disclosure: This article does not represent investment advice. The content and materials featured on this page are for educational purposes only. Analyzing three hidden gems that could surge by 9,000% in December’s bull market. Table of Contents CYBRO aims for 1000% growth after raising $7M AVAX: Low fees and high throughput Chainlink: Smart contracts and secure real-world data Conclusion As December progresses, the cryptocurrency market teems with fresh opportunities. Amid countless digital currencies, three obscure altcoins are drawing attention for their exceptional growth potential. These hidden gems could see their values surge by nearly 9,000% this bull market. CYBRO aims for 1000% growth after raising $7M CYBRO, an AI-powered multichain marketplace, is approaching a pivotal moment with its Token Generation Event (TGE). Following a fast presale that raised $7 million and attracted nearly 20,000 investors, CYBRO is set to list on Gate.io and other major exchanges on December 14th. During the presale, CYBRO experienced a 450% price surge, climbing from $0.01 to $0.055. The token’s listing at $0.06 has already generated immense demand, with many experts predicting a potential 1000% growth as it enters the open market, driven by strong momentum and solid fundamentals. CYBRO seamlessly combines advanced AI with a user-friendly DeFi platform, providing tools for staking, farming, and lending that cater to both cautious beginners and experienced investors. Its presale accomplishments highlight its quick development and transformative features: CYBRO app: Offering over 30 vaults with competitive APYs to match a variety of investment strategies. Blast Index: A one-click investment solution that simplifies DeFi participation by integrating with lending protocols. Robust platform foundation: Creating a seamless and intuitive user experience for investors. CYBRO’s plans extend through 2025, including advanced features like leverage farming, lending aggregators, and smarter AI tools. These developments aim to solidify its position as a transformative player in the decentralized finance space. As CYBRO prepares for its market debut, the momentum from its presale and novel features position it as a token to watch. Interested investors can still join CYBRO before the listing . AVAX: Low fees and high throughput AVAX is the native token of Avalanche, a Layer-1 blockchain known for low fees and efficient transactions. Avalanche can process up to 4,500 transactions per second, using a hybrid consensus mechanism combining Classical and Nakamoto principles. Avalanche has three chains: X-Chain, C-Chain, and P-Chain. These chains handle different operations like transactions and smart contracts. The platform also allows users to create custom blockchains called subnets. AVAX has utility in payments, staking, and enabling the creation of custom tokens and blockchains. Chainlink: Smart contracts and secure real-world data Chainlink is a decentralized network that connects smart contracts with real-world data. It allows blockchain applications to interact with external data sources, APIs, and systems securely. Chainlink uses a reputation system to ensure data accuracy and reliability. By bridging blockchain and external data, it enhances the capabilities of smart contracts. The network operates through a three-step process: Oracles retrieve data, aggregate to confirm accuracy, and deliver securely to smart contracts. Chainlink also combines on-chain and off-chain components for efficient data processing. The LINK token is central to the Chainlink ecosystem, rewarding data providers, supporting staking for security, and serving as payment for services. This design promotes a reliable and decentralized system. Conclusion In the current bull market, AVAX and LINK offer growth prospects but may have limited short-term potential. In contrast, CYBRO stands out as a promising opportunity for investors aiming for significant returns. The advanced DeFi platform will use AI-powered yield aggregation on the Blast blockchain to enhance earnings. It will also provide attractive staking rewards, exclusive airdrops, and cashback on purchases. CYBRO users will enjoy seamless deposits and withdrawals, ensuring a smooth experience. With a strong emphasis on transparency, compliance, and quality, CYBRO has drawn substantial interest from major crypto investors and influencers. Its unique approach positions it as a compelling choice in today’s dynamic market. To learn more about CYBRO, visit their website , Twitter , Discord , or Telegram . Read more: Holiday crypto rally: 5 altcoins for a Christmas with 12,000% gains Disclosure: This content is provided by a third party. crypto.news does not endorse any product mentioned on this page. Users must do their own research before taking any actions related to the company.",Partner Content|sponsored,EN,0,0,AVAX|BUSINESS|LINK|MARKET|TRADING,"{'name': 'crypto.news', 'img': 'https://resources.cryptocompare.com/news/73/default.png', 'lang': 'EN'}",crypto_news,2024-12-11 22:26:43
37521777,https://cointelegraph.com/news/dogecoin-rally-to-0-50-imminent-after-doge-s-overbought-conditions-cool-down,1733956200,https://images.cryptocompare.com/news/default/cointelegraph.png,Dogecoin rally to $0.50 imminent after DOGE’s ‘overbought’ conditions cool down,https://cointelegraph.com/news/dogecoin-rally-to-0-50-imminent-after-doge-s-overbought-conditions-cool-down?utm_source=rss_feed&utm_medium=rss&utm_campaign=rss_partner_inbound,Dogecoin’s next possible stop is $0.50 and above. Especially if a historical price fractal fails to play out.,Dogecoin price|DOGE USD|Dogecoin price prediction|Memecoins|Market analysis,EN,0,0,DOGE|TRADING,"{'name': 'CoinTelegraph', 'img': 'https://images.cryptocompare.com/news/default/cointelegraph.png', 'lang': 'EN'}",cointelegraph,2024-12-11 22:30:00
