id,guid,published_on,imageurl,title,url,body,tags,lang,upvotes,downvotes,categories,source_info,source,date
37526773,https://coingape.com/?p=228911,1733975538,https://images.cryptocompare.com/news/default/coingape.png,"Crypto Prices Today December 12: BTC at $101K, SUI Soars 30%, ENA Climbs 23%",https://coingape.com/crypto-prices-today-december-12-btc-at-101k-sui-soars-30-ena-climbs-23/,"The crypto prices today showed bullish momentum, with Bitcoin trading above $100K. Major altcoins like Ethereum rose by 6%, while XRP and Solana gained 5% to 6%. SUI emerged as the top gainer, up 30% in the last 24 hours, followed by Ethena (ENA) with a 23% jump. The crypto market cap increased by 5%, reaching $3.59 trillion. However, the 24-hour trading volume dropped by 31%, now at $214 billion. The Fear and Greed Index stands at 80, reflecting extreme greed in the market. Here’s a brief overview of some leading cryptocurrencies by market cap and their prices today, December 12. Crypto Prices Today: BTC Surge Above $100K, ETH, XRP, SOL Rise The US CPI inflation data , reported at 2.7%, boosted market sentiment, fueling a rally in Bitcoin and altcoins. BTC reclaimed the $100K mark, now trading at $101K. Major altcoins like Ethereum (ETH), XRP, and Solana (SOL) showed a positive outlook, each gaining in single digits over the last 24 hours. Meme coins also mirrored this trend, reflecting overall bullish momentum. Bitcoin Price Today BTC price traded at $101,356, marking a 4% increase in the past 24 hours. Its 24-hour low and high were $97,173 and $101,872, respectively. The market cap stood at $2 trillion, with a trading volume of $81 billion and a dominance of 55.08%. Farside Investors reported BTC ETFs had an inflow of $223 million. Fidelity contributed $121 million, while data from BlackRock remains anticipated. Ethereum Price Today ETH price was trading at $3,875, reflecting a 6% increase in the last 24 hours. Its 24-hour low and high were $3,647 and $3,881, respectively. Over the past week, ETH has gained 17%. The market cap stood at $466 billion, with a trading volume of $34 billion. ETH ETFs saw an inflow of $27 million, while BlackRock’s data remains awaited. Grayscale purchased $13 million worth of ETH ETFs on Wednesday. Top analysts have predicted a 150% increase in Bitcoin, Ethereum, and Solana prices during the first year of a potential crypto-friendly Trump presidency. XRP Price Today Crypto prices today highlighted XRP trading at $2.418, up by 5% in the last 24 hours. Its 24-hour low and high were $2.291 and $2.464, respectively. With a market cap of $137 billion and a trading volume of $12 billion, XRP holds its position as the 4th largest cryptocurrency by market cap. Crypto analyst Dark Defender has predicted that XRP price could rally to $5 in the coming days. Solana Price Today Crypto prices today showed Solana (SOL) trading at $229, reflecting a 6% increase in the last 24 hours. Its 24-hour low and high were $217 and $230, respectively. SOL’s market cap stood at $109 billion, with a trading volume of $5 billion. Additionally, Solana meme coin PNUT surged 35% following its listing announcement on Coinbase. Meme Crypto Prices Today Meme coins showed strong bullish momentum today, with Dogecoin (DOGE) up by 7%, trading at $0.4187, and Shiba Inu (SHIB) rising 10% to $0.00002969. Analyst Ali Martinez has predicted that DOGE could reach $8 in this bull market cycle. Other notable meme coins like PEPE, BONK, and WIF saw gains of 11% to 15% in the last 24 hours. Top Crypto Gainer Prices Today Sui Sui (SUI) price was trading at $4.81, reflecting a 30% increase in the last 24 hours, making it the top gainer for today. Its market cap stands at $14 billion, with a trading volume of $3 billion. Ethena Ethena (ENA) price was trading at $1.101, reflecting a 23% increase in the last 24 hours. Its 24-hour low was $0.90, and it has risen by 80% over the past month. Virtual Protocol VIRTUAL price was up by 21%, now trading at $1.91. Its market cap is $1.94 billion, and it was recently listed on Binance . Top Crypto Loser Prices Today XDC Network XDC price was trading at $0.088, down by 4% in the last 24 hours. It is the worst performer today among the top 100 cryptocurrencies. Besides this, hourly charts also look bullish for Bitcoin and top altcoins, with BTC up by 1% in the past 24 hours. Ethereum, XRP, and Solana each gained 2% in the last hour, signaling a positive trend in crypto prices today. The post Crypto Prices Today December 12: BTC at $101K, SUI Soars 30%, ENA Climbs 23% appeared first on CoinGape .",24/7 Cryptocurrency News|Altcoin News|Bitcoin News|Bitcoin (BTC) Price|Crypto price today|Dogecoin (DOGE)|Ethereum (ETH) price|Shiba Inu (SHIB)|Solana (SOL)|XRP,EN,0,0,BTC|ETH|MARKET|SOL|TRADING,"{'name': 'CoinGape', 'img': 'https://images.cryptocompare.com/news/default/coingape.png', 'lang': 'EN'}",coingape,2024-12-12 03:52:18
37526864,https://coinpedia.org/?p=392049,1733975616,https://images.cryptocompare.com/news/default/coinpedia.png,Pro-XRP Lawyer Slams SEC’s Crenshaw as ‘Disgrace’ As Senate Panel Delays Vote,https://coinpedia.org/news/pro-xrp-lawyer-slams-secs-crenshaw-as-disgrace-as-senate-panel-delays-vote/,"The post Pro-XRP Lawyer Slams SEC’s Crenshaw as ‘Disgrace’ As Senate Panel Delays Vote appeared first on Coinpedia Fintech News Democrat Caroline Crenshaw’s nomination for another term as a commissioner at the Securities and Exchange Commission has faced new setbacks. A planned vote by the Senate Banking Committee was postponed after Senate Banking Committee Chair Sherrod Brown delayed the vote just minutes before it was set to occur on Wednesday morning, after the committee’s GOP members had arrived. Republican senators blocked Brown’s request to waive procedural rules and hold the vote later in the day, according to a Senate aide. The delay pushed Crenshaw’s vote into the afternoon, conflicting with a Senate rule that restricts committees from meeting after the Senate has been in session for two hours or past 2:00 p.m. EST. A waiver could have allowed the vote to proceed, but Republicans, under the direction of Ranking Member Senator Tim Scott, blocked the waiver. As a result, Brown will need to reschedule the vote, though it is unclear when this will happen. The request for comment is pending. As reported by Fox Business journalist Eleanor Terrett, Brown said, “This is why people hate Washington. Corporate special interests have run a disgusting smear campaign against Caroline Crenshaw, an Army reservist and public servant who has been nominated and confirmed by a Republican President and Republican Senate. She has been thoroughly vetted and has gone through every step in the nomination process. Republican Senators are doing the bidding of corporate special interests and standing in the way of her confirmation.” Crenshaw literally advocated for ignoring the Court of Appeals that oversees the SEC. As a party, you can’t constantly state that we are a nation of laws and then ignore the law when you don’t like it or disagree with it. What she did was a disgrace and it dishonored the oath she… — John E Deaton (@JohnEDeaton1) December 11, 2024 In response to Brown’s statement, pro-XRP lawyer John Deaton criticized Caroline Crenshaw’s actions, accusing her of advocating for ignoring the Court of Appeals that oversees the SEC. Deaton argued that as a member of the SEC, Crenshaw cannot claim to uphold the rule of law while disregarding it when it doesn’t align with her views. He called her actions a “disgrace” and claimed it dishonored the oath she took.",News|Crypto news|Crypto Regulations,EN,0,0,BUSINESS|EXCHANGE|REGULATION,"{'name': 'coinpedia', 'img': 'https://images.cryptocompare.com/news/default/coinpedia.png', 'lang': 'EN'}",coinpedia,2024-12-12 03:53:36
37527076,https://ambcrypto.com/?p=451264,1733976006,https://images.cryptocompare.com/news/default/ambcrypto.png,Bitcoin: THIS group starts selling BTC – Troubling times ahead?,https://ambcrypto.com/bitcoin-this-group-starts-selling-btc-troubling-times-ahead/,"Bitcoin is currently trading in a mid-range, with long-term holders continuing to take profits.",Bitcoin|BTC Trading View|News|News 1|Social|Trading View|ambcrypto,EN,0,0,BTC|TRADING,"{'name': 'AMB Crypto', 'img': 'https://images.cryptocompare.com/news/default/ambcrypto.png', 'lang': 'EN'}",ambcrypto,2024-12-12 04:00:06
37527121,https://www.cryptointelligence.co.uk/?p=26284,1733976120,https://resources.cryptocompare.com/news/95/default.png,"Pepe MAGA (PEPEMAGA) Solana Memecoin to Rally Over 18,000% Ahead of Exchange Listing, While Shiba Inu, WIF and BONK Underperform",https://www.cryptointelligence.co.uk/pepe-maga-pepemaga-solana-memecoin-to-rally-over-18000-ahead-of-exchange-listing-while-shiba-inu-wif-and-bonk-underperform/,"Pepe MAGA could turn early investors into multi-millionaires, like Shiba Inu (SHIB) and Dogecoin (DOGE) did. Pepe MAGA (PEPEMAGA), a new Solana memecoin that was launched today, is set to explode over 18,000% in price in the coming days. This is because PEPEMAGA is set to soon be listed on numerous crypto exchanges, according to reports. This will give the Solana memecoin exposure to millions of additional investors, who will pour funds into the coin and drive its price up. Currently, Pepe MAGA can only be purchased via Solana decentralized exchanges, like Jup.ag and Raydium.io, and early investors stand to make huge returns in the coming days. Early investors in SHIB and DOGE made astronomical returns, and Pepe MAGA could become the next viral memecoin. Pepe MAGA launched with over $9,000 of liquidity, giving it a unique advantage over the majority of other new memecoins, and early investors could make huge gains. How to Buy To buy Pepe MAGA on Raydium.io or Jup.ag ahead of the CEX listings, users need to connect their Solflare, MetaMask, or Phantom wallet, and swap Solana for Pepe MAGA by entering its contract address – C3zan7DDUAxZDSLnSxpptmyARsvGAbah4KWQB5QokoFM – in the receiving field. If you don’t have one of these wallets already, you can create a new wallet in a few minutes and transfer some Solana to it (which will then be used to buy the memecoin) from an exchange like Coinbase, Binance, and many others. In fact, early investors could make returns similar to those who invested in Shiba Inu (SHIB) and Dogecoin (DOGE) before these memecoins went viral and exploded in price. If this happens, a new wave of memecoin millionaires could be created in a matter of weeks – or potentially even sooner. The Solana memecoin craze continues amid larger memecoins, like Shiba Inu (SHIB), Dogecoin (DOGE), and DogWifHat (WIF), trading sideways in recent weeks and losing momentum. This is why many SHIB, DOGE, and WIF investors are instead investing in new Solana memecoins, like PEPEMAGA. Such memecoins have no utility and no inherent value, but investors looking for high gains have been investing in them due to their potential to rapidly rise in price.",Blockchain News|Crypto News Today|Press Releases,EN,0,0,BUSINESS|DOGE|SHIB|SOL|TRADING,"{'name': 'CryptoIntelligence', 'img': 'https://resources.cryptocompare.com/news/95/default.png', 'lang': 'EN'}",cryptointelligence,2024-12-12 04:02:00
37527289,https://www.newsbtc.com/?p=661184,1733976510,https://images.cryptocompare.com/news/default/newsbtc.png,XRP Price Winning Streak: Is More Upside on The Horizon?,https://www.newsbtc.com/analysis/xrp/xrp-price-winning-streak-2-50/,"XRP price started a strong increase above the $2.25 resistance zone. The price is up over 10% and might aim for a move above the $2.50 resistance zone. XRP price started a fresh increase above the $2.25 zone. The price is now trading above $2.30 and the 100-hourly Simple Moving Average. There was a break above a key bearish trend line with resistance at $2.215 on the hourly chart of the XRP/USD pair (data source from Kraken). The pair might start another increase if it clears the $2.475 resistance. XRP Price Starts Fresh Increase XRP price started a decent upward move above the $2.20 level, beating Bitcoin and Ethereum . There was a move above the $2.25 and $2.30 resistance levels. During the increase, there was a break above a key bearish trend line with resistance at $2.215 on the hourly chart of the XRP/USD pair. The pair was able to surpass the 61.8% Fib retracement level of the downward wave from the $2.64 swing high to the $1.899 low. However, the bears are active below the $2.475 level. It coincides with the 76.4% Fib retracement level of the downward wave from the $2.64 swing high to the $1.899 low. The price is now trading above $2.350 and the 100-hourly Simple Moving Average. On the upside, the price might face resistance near the $2.45 level. The first major resistance is near the $2.4750 level. The next resistance is $2.50. A clear move above the $2.50 resistance might send the price toward the $2.550 resistance. Any more gains might send the price toward the $2.650 resistance or even $2.720 in the near term. The next major hurdle for the bulls might be $2.880. Another Pullback? If XRP fails to clear the $2.475 resistance zone, it could start another decline. Initial support on the downside is near the $2.280 level. The next major support is near the $2.20 level. If there is a downside break and a close below the $2.20 level, the price might continue to decline toward the $2.080 support. The next major support sits near the $2.00 zone. Technical Indicators Hourly MACD – The MACD for XRP/USD is now gaining pace in the bullish zone. Hourly RSI (Relative Strength Index) – The RSI for XRP/USD is now above the 50 level. Major Support Levels – $2.280 and $2.200. Major Resistance Levels – $2.4750 and $2.6450.",XRP|Ripple|XRPBTC|XRPUSD|xrpusdt,EN,0,0,BTC|ETH|EXCHANGE|TRADING|XRP,"{'name': 'NewsBTC', 'img': 'https://images.cryptocompare.com/news/default/newsbtc.png', 'lang': 'EN'}",newsbtc,2024-12-12 04:08:30
37528384,https://crypto.news/?p=14318607,1733978750,https://resources.cryptocompare.com/news/74/37528384.jpeg,Algorand’s weekly returns go red as investors buy into these two altcoins,https://crypto.news/algorands-weekly-returns-go-red-as-investors-buy-into-these-two-altcoins/,"Rollblock hits a $7m milestone as Algorand cools off and Litecoin eyes a bullish breakout, signaling exciting opportunities in the evolving crypto market. #partnercontent",Partner Content|sponsored,EN,0,0,ALGO|ALTCOIN|BUSINESS|LTC|SPONSORED,"{'name': 'nft.news', 'img': 'https://resources.cryptocompare.com/news/74/default.png', 'lang': 'EN'}",nft_news,2024-12-12 04:45:50
37528426,https://decrypt.co/?p=296164,1733978784,https://resources.cryptocompare.com/news/44/37528426.jpeg,"American Egg Board Debuts “Tower of Eggs” Activation in Roblox, Featuring Obstacle Gameplay and Recipe Challenges",https://decrypt.co/296164/american-egg-board-debuts-tower-of-eggs-activation-in-roblox-featuring-obstacle-gameplay-and-recipe-challenges,"Chicago, United States, 12th December 2024, GamingWire",Press Releases - Gaming,EN,0,0,OTHER,"{'name': 'Decrypt', 'img': 'https://images.cryptocompare.com/news/default/decrypt.png', 'lang': 'EN'}",decrypt,2024-12-12 04:46:24
37528563,https://cointelegraph.com/news/openai-apologizes-after-apple-integration-of-chatgpt-causes-outage,1733979007,https://images.cryptocompare.com/news/default/cointelegraph.png,OpenAI apologizes for outage after Apple update combines Siri and ChatGPT,https://cointelegraph.com/news/openai-apologizes-after-apple-integration-of-chatgpt-causes-outage?utm_source=rss_feed&utm_medium=rss&utm_campaign=rss_partner_inbound,ChatGPT went down globally around 11:07 pm UTC on Dec. 11 but has started coming back online in some regions of the world.,AI Chatbot|Apple Intelligence|iPhone|iPad|Mac|Siri|Network Outage|Meta|Facebook|Instagram,EN,0,0,OTHER,"{'name': 'CoinTelegraph', 'img': 'https://images.cryptocompare.com/news/default/cointelegraph.png', 'lang': 'EN'}",cointelegraph,2024-12-12 04:50:07
37528549,https://ambcrypto.com/?p=451431,1733979021,https://images.cryptocompare.com/news/default/ambcrypto.png,U2U Network’s December Listing: Pioneering a Comprehensive Blockchain for DePIN,https://ambcrypto.com/u2u-networks-december-listing-pioneering-a-comprehensive-blockchain-for-depin/,"U2U Network, a leading DePIN Layer-1 platform, has announced the closure of all funding rounds",HideCryptopanic|Press Release,EN,0,0,BLOCKCHAIN,"{'name': 'AMB Crypto', 'img': 'https://images.cryptocompare.com/news/default/ambcrypto.png', 'lang': 'EN'}",ambcrypto,2024-12-12 04:50:21
37528730,https://en.coinotag.com/vancouver-council-approves-motion-to-explore-bitcoin-friendly-financial-strategies-for-the-city/,1733979356,https://resources.cryptocompare.com/news/77/37528730.jpeg,Vancouver Council Approves Motion to Explore Bitcoin-Friendly Financial Strategies for the City,https://en.coinotag.com/vancouver-council-approves-motion-to-explore-bitcoin-friendly-financial-strategies-for-the-city/,"The Canadian city of Vancouver has officially taken a step towards becoming a bitcoin-friendly municipality, reflecting a broader trend of crypto integration into municipal financial strategies. This decision, approved during",News|BTC,EN,0,0,BTC,"{'name': 'CoinOtag', 'img': 'https://resources.cryptocompare.com/news/77/default.png', 'lang': 'EN'}",coinotag,2024-12-12 04:55:56
37529382,https://coinedition.com/?p=559816,1733979409,https://resources.cryptocompare.com/news/7/default.png,Crypto and AI Projects See Growth Despite Fundraising Slowdown,https://coinedition.com/crypto-and-ai-projects-see-growth-despite-fundraising-slowdown/,"Render (RNDR) leads the Crypto+AI space with a $4.61B market cap despite slight weekly dip. Fetch.ai (FET) faces volatility but maintains growth potential in AI and blockchain. Crypto+AI fundraising peaked in July 2024, with $130M raised, despite later slowdown. The intersection of crypto and artificial intelligence (AI) is driving significant innovation, with Crypto+AI projects gaining traction despite recent fundraising slowdowns. Data reveals Render (RNDR) as a standout performer in this sector, maintaining a $4.61 billion market cap and leading decentralized GPU rendering. According to the data, Render (RNDR) has a market cap of $4.61 billion in the Crypto+AI market. Despite a slight decline of 0.23% over the past week, it remains a leading player in decentralized GPU rendering. Rootdata has counted the top fifteen Crypto+AI projects by market value, including RENDER, FET, TAO, WLD, VIRTUAL, AIOZ, AI16Z, PRIME, ROSE, GRASS, GOAT, ARKM, ACT, IO, and ATH. There has been a lot of discussion and controversy surrounding Crypto+AI recently. pic.twitter.com/OO1REHmIfi — Wu Blockchain (@WuBlockchain) December 11, 2024 Render’s innovation in connecting … The post Crypto and AI Projects See Growth Despite Fundraising Slowdown appeared first on Coin Edition .",Market|Market News|News|AI (Tokens)|Fetch.ai (FET)|Render Token (RNDR),EN,0,0,BLOCKCHAIN|MARKET|RNDR|FET|AIOZ,"{'name': 'Coin Edition', 'img': 'https://resources.cryptocompare.com/news/7/default.png', 'lang': 'EN'}",coinquora,2024-12-12 04:56:49
37528865,https://ambcrypto.com/?p=451308,1733979639,https://images.cryptocompare.com/news/default/ambcrypto.png,"Zano crypto crosses $10 mark, but can struggle to reach $15.5",https://ambcrypto.com/zano-crypto-crosses-10-mark-but-can-struggle-to-reach-15-5/,The low volume surge was a warning sign that the move might be unsustainable.,Altcoin|Analysis|HideCryptopanic|News|News 1|No Homepage|Social|Trading View|ambcrypto,EN,0,0,ALTCOIN|MARKET,"{'name': 'AMB Crypto', 'img': 'https://images.cryptocompare.com/news/default/ambcrypto.png', 'lang': 'EN'}",ambcrypto,2024-12-12 05:00:39
37528857,https://coinpedia.org/?p=392054,1733979681,https://images.cryptocompare.com/news/default/coinpedia.png,"Elon Musk’s Net Worth Crosses $400 Billion: Bitcoin, Tesla, and SpaceX Holding Surge",https://coinpedia.org/news/elon-musks-net-worth-crosses-400-billion-bitcoin-tesla-and-spacex-holding-surge/,"The post Elon Musk’s Net Worth Crosses $400 Billion: Bitcoin, Tesla, and SpaceX Holding Surge appeared first on Coinpedia Fintech News Elon Musk has once again shattered records, becoming the first person ever to reach a net worth exceeding $400 billion. This achievement marks a historic milestone, driven by surging valuations of his companies, particularly Tesla and SpaceX, along with the remarkable performance of his crypto investments as the Bitcoin price surged past the $100k milestone. Musk Networth Crossed $447 Billion Recent reports indicate that Musk’s net worth has skyrocketed to $447 billion, fueled by a series of strategic developments. A major contributor was a private share sale of SpaceX, adding $50 billion to his wealth. SpaceX’s valuation climbed to $350 billion following this transaction, with Musk’s 42% stake playing a pivotal role. What’s really crazy about this is that almost no investors wanted to sell shares even at a $350B valuation! SpaceX reduced the amount of shares it bought back from employees in order to allow some new investors in. — Elon Musk (@elonmusk) December 11, 2024 At the same time, Tesla’s remarkable performance in the stock market has played a crucial role. The company’s market value has risen to nearly $1.315 trillion, with its shares climbing 71% in 2024. Tesla’s stock recently hit $424.77, marking its first record high since 2021. Musk Crypto Investments Paying Off Musk’s involvement in cryptocurrency has also brought significant returns. Tesla and SpaceX now hold a combined $2 billion in Bitcoin, profiting from the cryptocurrency’s surge past $100K. According to Arkham Intelligence, Tesla owns 11,509 BTC valued at $1.17 billion, while SpaceX holds 8,285 BTC worth $842 million. ELON MUSK’S COMPANIES’ BITCOIN NOW WORTH $2 BILLION Tesla: 11,509 BTC ($1.17B USD) SpaceX: 8,285 BTC ($842M USD) This Bitcoin was acquired at an average cost basis of $34.98K per BTC, meaning they are up $1.3 BILLION (186%) on these purchases. pic.twitter.com/FF77kBnOxE — Arkham (@arkham) December 6, 2024 These companies bought Bitcoin at an average price of $34,980 per coin, resulting in a combined unrealized gain of $1.3 billion, a 186% return on investment. Musk Role in Government Musk’s recent appointment by President-elect Donald Trump as head of the Department of Government Efficiency (DOGE) has added political weight to his already towering influence. This role has favored better market conditions for Musk’s businesses, further boosting his wealth.",News,EN,0,0,BTC|BUSINESS|MARKET|TRADING|ARKM,"{'name': 'coinpedia', 'img': 'https://images.cryptocompare.com/news/default/coinpedia.png', 'lang': 'EN'}",coinpedia,2024-12-12 05:01:21
37528929,ea2d589a-c733-420a-b316-e58f1b7abf46,1733979745,https://resources.cryptocompare.com/news/5/37528929.jpeg,Vancouver City Council Passes Pro-Bitcoin Motion Citing Fiat Challenges,https://www.coindesk.com/policy/2024/12/12/vancouver-city-council-passes-pro-bitcoin-motion-citing-fiat-challenges,"Vancouver, British Columbia's city council has passed a motion to explore the possibility of accepting bitcoin (BTC) for payment of taxes and fees as well as establishing a bitcoin reserve. The motion, prepared by Mayor Ken Sim, calls for ""diversifying the City of Vancouver's financial reserves and payment options to include bitcoin."" ""It would be irresponsible for the City of Vancouver to not look at the merits of adding bitcoin to the City’s strategic assets to preserve the City’s financial stability,"" reads the motion. The motion calls for City staff to report back to the Council on the feasibility of a ""bitcoin-friendly city"" strategy by the end of the first quarter of 2025. This motion marks a significant change in City policy towards BTC, as Vancouver's prior Mayor, Kennedy Stewart tried to outright ban bitcoin ATMs within city limits in 2019 (Vancouver was home to the world's first bitcoin ATM). Vancouver is also the childhood home of former Binance CEO Changpeng 'CZ' Zhao, and where failed crypto exchange QuadrigaCX was headquartered.",Policy,EN,0,0,BTC|EXCHANGE|FIAT|REGULATION|BNB,"{'name': 'CoinDesk', 'img': 'https://images.cryptocompare.com/news/default/coindesk.png', 'lang': 'EN'}",coindesk,2024-12-12 05:02:25
