id,guid,published_on,imageurl,title,url,body,tags,lang,upvotes,downvotes,categories,source_info,source,date
37530637,https://www.newsbtc.com/?p=660998,1733983219,https://resources.cryptocompare.com/news/21/37530637.jpeg,"Bitcoin On Track For $275,000? Analyst Cites Cup And Handle Formation",https://www.newsbtc.com/bitcoin-news/bitcoin-on-track-for-275000-analyst-cites-cup-and-handle-formation/,"Bitcoin (BTC) fell to $94,500 yesterday after Microsoft shareholders decisively rejected a Bitcoin treasury proposal to allocate 1% of the company’s total assets to buy BTC as an inflation hedge. However, analysts are still confident of further appreciation of the BTC price. Bitcoin May Surge As High As $275,000 According to data from Coinglass, over $478 million worth of contracts – primarily long positions – were liquidated in the past 24 hours following the plunge in BTC and other cryptocurrencies. Interestingly, liquidation volumes were higher in altcoins compared to Bitcoin. Related Reading: Bitcoin Resets Open Interest, Targets $100,000 After Holding Key Support – Details However, some analysts view this price dip as a buying opportunity. Seasoned crypto analyst Ali Martinez took to X to highlight a long cup and handle pattern forming on Bitcoin’s weekly chart. For those unfamiliar, the cup and handle pattern is a bullish technical formation that resembles a rounded “cup” followed by a brief consolidation period or “handle.” It typically signals the potential for a continuation of an uptrend, often leading to significant price gains. Martinez noted that the pattern suggests Bitcoin could surge as high as $275,000, based on its technical structure. However, he also urged traders to exercise caution and avoid overleveraging their positions. On the other hand, prominent crypto analyst @Trader_XO warned that Bitcoin must maintain its support at $90,000 to avoid further downside. Should BTC lose this critical level, it could drop as low as $85,000. Conversely, holding above $90,000 would allow the cryptocurrency to rebound and resume its uptrend. BTC Takes Another Jab At Breaking Through $100,000 Despite yesterday’s dip, Bitcoin recovered swiftly, trading near $100,000 at the time of writing. The flagship cryptocurrency has remained in an overall uptrend, likely bolstered by today’s US inflation data for November, which largely aligned with market expectations. Related Reading: Bitcoin Price Could Peak In 200 Days, Before US Recession In Mid-2025, Report Says Bitcoin recently hit a new all-time high (ATH) of $103,679, according to data from CoinGecko. However, its price has fluctuated above and below the pivotal $100,000 mark, leading to over $1.5 billion in liquidations in the past week. Several factors could drive Bitcoin’s price to a new ATH. For instance, BTC reserves on cryptocurrency exchanges have hit multi-year lows, reflecting rising demand for the digital asset. American financier and former investment banker Anthony Scaramucci recently predicted China might establish its own Bitcoin reserve if the US proceeds with its strategic Bitcoin reserve plans. National BTC reserves are expected to reinforce Bitcoin’s supply scarcity narrative, potentially driving prices higher. At the same time, BTC adoption among corporations continues to rise, as Canadian video-sharing firm Rumble became the latest company to unveil a BTC treasury strategy. BTC trades at $100,453 at press time, up 4.1% in the past 24 hours. Featured image from Unsplash, Charts from X and TradingView.com",Bitcoin News|bitcoin|bitcoin reserve|btc|BTCUSDT|cryptocurrency|Cup-and Handle|digital asset|inflation|technical analysis,EN,0,0,BTC|FIAT|MARKET|REGULATION|TRADING,"{'name': 'NewsBTC', 'img': 'https://images.cryptocompare.com/news/default/newsbtc.png', 'lang': 'EN'}",newsbtc,2024-12-12 06:00:19
37530677,https://ambcrypto.com/?p=451383,1733983251,https://images.cryptocompare.com/news/default/ambcrypto.png,All about TRX’s latest pullback after altcoin hits new ATH on the charts,https://ambcrypto.com/all-about-trxs-latest-pullback-after-altcoin-hits-new-ath-on-the-charts/,"Tron [TRX] recently hit a new ATH after a strong rally. Will it sustain momentum, or is a correction likely?",Altcoin|News|News 1|Social|Trading View,EN,0,0,ALTCOIN|TRADING|TRX,"{'name': 'AMB Crypto', 'img': 'https://images.cryptocompare.com/news/default/ambcrypto.png', 'lang': 'EN'}",ambcrypto,2024-12-12 06:00:51
37530781,https://u.today/microstrategy-has-90-chance-of-being-added-to-nasdaq-100,1733983271,https://resources.cryptocompare.com/news/64/37530781.jpeg,MicroStrategy Has 90% Chance of Being Added to Nasdaq 100,https://u.today/microstrategy-has-90-chance-of-being-added-to-nasdaq-100,Bettors see high odds of MicroStrategy making it to the Nasdaq 100,MicroStrategy News,EN,0,0,OTHER,"{'name': 'U.Today', 'img': 'https://images.cryptocompare.com/news/default/utoday.png', 'lang': 'EN'}",utoday,2024-12-12 06:01:11
37530634,https://coingape.com/?p=228912,1733983295,https://images.cryptocompare.com/news/default/coingape.png,Will a16z Crypto Policy Lead Brian Quintenz be the new US CFTC Chair?,https://coingape.com/will-a16z-crypto-policy-lead-brian-quintenz-be-the-new-us-cftc-chair/,"As the Donald Trump administration looks to appoint the US Commodity Futures Trading Commission (CFTC) chairman, a16z Crypto policy lead Brian Quintenz emerged as the top contender. According to sources familiar with the matter, the Trump team has recently interviewed Quintenz for the top job at US CFTC. Brian Quintenz Is the Top Choice for US CFTC Chair As per a Bloomberg report , former Republican CFTC Commissioner Brian Quintenz was interviewed for the top position in the regulatory body. He is currently leading the crypto policy division at the digital asset wing of VC giant Andreessen Horowitz, a16z Crypto. President-elect Donald Trump’s team has been actively conducting interviews for the US CFTC chair position, with an announcement likely in the coming days. Republican CFTC Commissioners Summer Mersinger and Caroline Pham have also been in the race for the same. Last month, reports suggested that Crypto Dad Chris Giancarlo could be the top boss at CFTC, however, he dispelled the rumors. If chosen to lead CFTC, Brian Quintenz could bring a new perspective that bridges traditional finance (TradFi) and digital assets. During his previous tenure as CFTC Commissioner under the Donald Trump administration, Quintenz advocated for the agency to embrace innovative financial services, that included crypto derivatives and event contracts. In a crypto blog last month, co-authored with a16z, Quintenz shared his perspective on the election’s implications for the future of crypto. He wrote: “While we’ll likely have greater flexibility to experiment, we can’t forget that the fundamental regulatory principles applicable to blockchain systems remain unchanged. There will still be valid scrutiny from regulators and policymakers of certain aspects of the industry irrespective of progress on new legislation or a re-calibrated regulatory environment”. Since joining venture capital firm Andreessen Horowitz (a16z), Quintenz has continued championing progressive regulatory approaches for these industries. Quintenz’s extensive experience positions him to navigate the agency through significant policy changes under the Biden administration. Furthermore, recent reports suggest that the Donald Trump administration is considering giving US CFTC the oversight of the $3 trillion crypto market. The proposal focuses on digital assets like Bitcoin and Ethereum, classified as commodities under current law. If implemented, it would grant the CFTC authority to oversee spot markets and exchanges. US Crypto Policy to Undergo Key Changes Crypto market analysts hope for a major US crypto policy shift under the Trump administration, with Brian Quintenz as CFTC Chair expected to play a key role. The appointment of pro-crypto Paul Atkins as the next US SEC chair already hints at this possibility and a conducive environment for crypto innovation. The crypto industry has been demanding clarity on crypto policy from the US Congress and regulators on which products and services fall under the jurisdiction of the US CFTC or the US SEC. During his election campaign, Donald Trump pledged to make America the Crypto Capital of the world. The post Will a16z Crypto Policy Lead Brian Quintenz be the new US CFTC Chair? appeared first on CoinGape .",24/7 Cryptocurrency News|Regulation News|a16z|Andreessen Horowitz|US CFTC|US SEC,EN,0,0,BLOCKCHAIN|BTC|COMMODITY|MARKET|REGULATION,"{'name': 'CoinGape', 'img': 'https://images.cryptocompare.com/news/default/coingape.png', 'lang': 'EN'}",coingape,2024-12-12 06:01:35
37530797,https://coinpedia.org/?p=392069,1733983473,https://images.cryptocompare.com/news/default/coinpedia.png,Chainlink (LINK) & Aave (AAVE) Explode as Trump’s Firm Buys $1M Worth of Tokens Each—A New ATH at $100 & $1000 is Loading,https://coinpedia.org/price-analysis/chainlink-link-aave-aave-explode-as-trumps-firm-buys-1m-worth-of-tokens-each-a-new-ath-at-100-1000-is-loading/,"The post Chainlink (LINK) & Aave (AAVE) Explode as Trump’s Firm Buys $1M Worth of Tokens Each—A New ATH at $100 & $1000 is Loading appeared first on Coinpedia Fintech News Bitcoin price is back above $100K! After juggling below the levels for a couple of days, the token raised, squashing the bearish possibility This shook up the entire market, while positive rounds around the popular tokens like ETH, LINK, & AAVE attracted double-digit gains. As per the reports, the company owned by the new president-elect Donald Trump, World Liberty Financial, swapped over $5 million USDC for Ethereum, Chainlink, & Aave. With this, the ETH holdings reached $55 million, and LINK & AAVE reached above $1 million each. Soon after this, the prices of LINK & AAVE triggered a massive upswing, attracting over 15% gains; meanwhile, the ETH price continues with its consolidated gains. The LINK price has attained levels not seen since January 2022, suggesting a strong influx of bullish volume onto the token. Donald Trump’s win had triggered the markets and the round of LINK accumulation is expected to elevate the LINK price rally towards new highs. The LINK price rally has surpassed the crucial resistance zone between $27.32 and $28.26 with huge backing from the bulls. While the weekly RSI surged above the upper threshold, the MACD shows the rise in the buying volume. Moreover, the token underwent a bullish ‘Golden Cross’ that may offer more momentum. The next level to watch is around $34.39, which may clear the path to $40 if the zone between $37 & $37.5 is cleared. The current trade set-up suggests the Chainlink price has just entered a bullish range and a bullish yearly close above $40 could trigger a massive bullish wave towards a 3-digit figure. On the other hand, AAVE, in which Trump’s company holds over $1 million, also demonstrated a similar rise, suggesting a huge confidence of traders over the token. The AAVE price is about to reach the neckline of the parabolic recovery curve that could further push the price towards the final resistance zone between $516 and $566. With this, the weekly RSI has surpassed the upward threshold for the first time since inception. Moreover, the token may experience the very first weekly Golden Cross that could push the price beyond the current ATH at $668. Once these levels are reached, then the AAVE price is expected to surge and reach the milestone at $1000 during the upcoming Altseason.",Price Analysis|Altcoins,EN,0,0,AAVE|ETH|LINK|MARKET|TRADING,"{'name': 'coinpedia', 'img': 'https://images.cryptocompare.com/news/default/coinpedia.png', 'lang': 'EN'}",coinpedia,2024-12-12 06:04:33
37530818,https://en.coinotag.com/breakingnews/trumps-crypto-project-wlfi-holds-14573-eth-and-over-57-million-in-digital-assets/,1733983515,https://resources.cryptocompare.com/news/77/37530818.jpeg,"Trump’s Crypto Project WLFI Holds 14,573 ETH and Over $57 Million in Digital Assets",https://en.coinotag.com/breakingnews/trumps-crypto-project-wlfi-holds-14573-eth-and-over-57-million-in-digital-assets/,Recent data from COINOTAG,Aave|ARKM|USDC,EN,0,0,ETH|USDC|ARKM,"{'name': 'CoinOtag', 'img': 'https://resources.cryptocompare.com/news/77/default.png', 'lang': 'EN'}",coinotag,2024-12-12 06:05:15
37530894,4e51fc1d-599e-4184-8f8d-c6eea6aec405,1733983649,https://resources.cryptocompare.com/news/5/37530894.jpeg,"LINK, AAVE Rocket 30% as Trump’s World Liberty Financial Buys $2M Tokens",https://www.coindesk.com/markets/2024/12/12/link-aave-rocket-30-as-trump-s-world-liberty-financial-buys-2-m-tokens,"Crypto wallets connected to the Trump family-supported World Liberty Financial project purchased millions of dollars worth of various major tokens early Thursday, causing their prices to rocket. World Liberty Financial is a unified platform where users can borrow and lend cryptocurrencies, create liquidity pools and transact with stablecoins. WLFI serves as a governance token for the platform. President-elect Donald Trump is ""chief crypto advocate"" of the project. Two of his sons, Eric and Donald Trump Jr., are ""web3 ambassadors,"" while Barron holds the title of ""DeFi visionary."" Data shows the project purchased $10 million in ether (ETH), and $1 million each in aave (AAVE) and Chainlink’s LINK tokens early Thursday. ETH prices surged 7% in Asian morning hours after the purchases, while AAVE and LINK prices surged 30% on the bullish sentiment. The wallet has additionally spent $30 million to buy 8,105 ETH at an average price of $3,700 in the past 12 days, per Spot on Chain . Well-followed crypto trader @TheFlowHorse speculated that the tokens were likely part of bigger plans in the coming months: “Trump’s account is buying the crypto pairs that are set to benefit heavily from his plans.” World Liberty Financial uses data provider Chainlink's services for better integrating with the wider crypto ecosystem. Chainlink supports the platform by providing crucial pricing data and cross-chain interoperability infrastructure, per a November report. Last week, the platform’s DAO proposed deploying a World Liberty Financial Aave v3 instance. This instance will be managed through external risk managers, built on the existing Aave v3 infrastructure, and released on Ethereum. An instance refers to a specific deployment or version of a protocol, application, or service on a blockchain network. The vote has already met quorum ahead of its end date on Dec. 13, governance data shows , and key objectives include attracting first-time users to the platform as well as sharing a piece of revenues with those who provide liquidity.",Markets,EN,0,0,AAVE|BLOCKCHAIN|ETH|LINK|MARKET,"{'name': 'CoinDesk', 'img': 'https://images.cryptocompare.com/news/default/coindesk.png', 'lang': 'EN'}",coindesk,2024-12-12 06:07:29
37530969,https://coinpedia.org/?p=392070,1733983845,https://images.cryptocompare.com/news/default/coinpedia.png,Trump-Linked DeFi Giant WLFI Shakes Crypto Market,https://coinpedia.org/news/trump-linked-defi-giant-wlfi-shakes-crypto-market/,"The post Trump-Linked DeFi Giant WLFI Shakes Crypto Market appeared first on Coinpedia Fintech News The DeFi project supported by President elect Donald Trump, World Liberty Finance or WLFI is in the news again. The project made huge moves in the crypto world by buying millions of dollars worth of Ethereum, Chainlink and AAVE. These purchases not only got the ecosystem interested but also helped the prices to soar. Let’s dive into the details to see what they are doing. Ethereum’s Big Day WLFI spent a whopping $10 million in USD Coin (USDC) to buy 2,631 Ether (ETH). At the time, Ether was priced at an average of $3,801 per token. This massive purchase caused the price to have a sudden spike of 2.36%. By the end of the day, ETH had already jumped by 6.86%. This gives a clear idea of how just one big transaction can send ripples throughout the market. Source : Arkham Intelligence But that wasn’t all. WLFI’s move boosted investor confidence, proving how much influence this DeFi project has on the crypto scene. Chainlink and AAVE Get Their Moment It wasn’t just Ethereum feeling the love. WLFI dropped another $1 million USDC to snag 41,335 Chainlink (LINK) tokens at $24.2 each. This caused LINK’s price to shoot up by 20.56%, reaching $26.72 in just 24 hours. That’s a serious surge, even for a volatile market. AAVE didn’t miss out either. WLFI spent $1 million on 3,357 AAVE tokens at $297 each. While the market impact wasn’t as dramatic as with LINK, it still cemented WLFI’s role as a heavy hitter in the DeFi space. Justin Sun’s Big Bet Adding to the excitement, Justin Sun, founder of Tron, announced a $30 million investment in WLFI . This makes him the project’s largest investor. He’s also taken on an advisory role, bringing his years of blockchain experience to the table. Exciting Announcement! We’re honored to welcome @justinsuntron as an advisor to World Liberty Financial (WLFI)! Justin is the founder of @TRONDAO , an advisor to @HTX_Global , and a supporter of @BitTorrent . A graduate of the University of Pennsylvania, he recently won… pic.twitter.com/wJD24nztab — WLFI (@worldlibertyfi) November 26, 2024 Sun’s endorsement underscores WLFI’s growing credibility. In his own words, the U.S. is on its way to becoming a blockchain hub, and Trump’s involvement is a game-changer. What’s Next? WLFI isn’t slowing down. With a wallet packed with $74.36 million in cryptocurrencies , including 14,570 Ether and nearly 103 wrapped Bitcoin, this project is clearly in it for the long haul. Investors will be watching closely, especially with Justin Sun now onboard. Will WLFI continue to dominate the DeFi space? The signs point to yes, but in crypto, anything can happen. One thing’s",News|Crypto news,EN,0,0,AAVE|BUSINESS|ETH|LINK|MARKET,"{'name': 'coinpedia', 'img': 'https://images.cryptocompare.com/news/default/coinpedia.png', 'lang': 'EN'}",coinpedia,2024-12-12 06:10:45
37531081,https://timestabloid.com/?p=51938,1733983946,https://resources.cryptocompare.com/news/67/default.png,Uphold CRMO Highlights “Anything To Anything” Model to Benefit XRP and RLUSD,https://timestabloid.com/uphold-crmo-highlights-anything-to-anything-model-to-benefit-xrp-and-rlusd/,"Nancy Beaton, Chief Revenue and Marketing Officer (CRMO) at Uphold has emphasized the platform’s dedication to making digital asset trading more accessible and versatile. Speaking about Uphold’s innovative approach, Beaton highlighted the use of RLUSD, Ripple’s stablecoin, as a prime example of the exchange’s commitment to flexibility and user convenience. In a video shared on X by blockchain researcher and crypto enthusiast Collin Brown (@CollinBrownXRP), Beaton described Uphold’s “anything to anything” trading model, which allows users to directly exchange a wide range of assets without being restricted by conventional pairings. She pointed out that RLUSD, Ripple’s stablecoin, can be easily swapped for Bitcoin, gold, or other financial instruments. This model aims to streamline the trading experience, offering users greater autonomy over their transactions. Seamless Trading Across the Market Uphold’s unique pairing system is part of a broader strategy to enhance transaction efficiency and bridge traditional financial tools with digital assets. By simplifying the trading process, Uphold has positioned itself as a leader in improving the accessibility of cryptocurrency markets for both experienced traders and newcomers. The launch of RLUSD aligns with Uphold’s goal of expanding asset choices while catering to users seeking stability amid volatility in the cryptocurrency market. The stablecoin has been a focal point for many crypto traders as it recently received final approval from the New York State Department of Financial Services (NYDFS). Uphold’s support of this stablecoin reflects its broader mission of fostering interconnected financial systems and advancing the role of blockchain technology in traditional markets. We are on twitter, follow us to connect with us :- @TimesTabloid1 — TimesTabloid (@TimesTabloid1) July 15, 2023 Potential Benefits for XRP As part of the XRP Ledger (XRPL) ecosystem, RLUSD could play a critical role in boosting XRP utility. XRP is the primary bridge asset for transactions on the XRPL, facilitating rapid and cost-effective exchanges between different assets. The synergy between RLUSD and XRP adoption is expected to have far-reaching implications. With RLUSD’s integration, XRP’s usage for fees, liquidity, and network operations is expected to grow, further solidifying its position in the broader blockchain space. In his post, Brown stated, “With XRP as the auto-bridge asset, the future is looking GOLDEN!” With RLUSD’s launch approaching, its potential impact on the cryptocurrency landscape is becoming increasingly apparent. Uphold executives have previously shown support for RLUSD and its role in global finance, and this forward-thinking approach positions the exchange as a key driver of innovation within the industry, paving the way for a more inclusive and efficient financial ecosystem. Disclaimer : This content is meant to inform and should not be considered financial advice. The views expressed in this article may include the author’s personal opinions and do not represent Times Tabloid’s opinion. Readers are urged to do in-depth research before making any investment decisions. Any action taken by the reader is strictly at their own risk. Times Tabloid is not responsible for any financial losses. Follow us on Twitter , Facebook , Telegram , and Google News The post Uphold CRMO Highlights “Anything To Anything” Model to Benefit XRP and RLUSD appeared first on Times Tabloid .",Cryptocurrency|News|RLUSD|Uphold|XRP,EN,0,0,BLOCKCHAIN|MARKET|TRADING|XRP|BTG,"{'name': 'TimesTabloid', 'img': 'https://resources.cryptocompare.com/news/67/default.png', 'lang': 'EN'}",timestabloid,2024-12-12 06:12:26
37531097,https://cointelegraph.com/news/vancouver-passes-motion-become-bitcoin-friendly-city,1733984111,https://images.cryptocompare.com/news/default/cointelegraph.png,Vancouver passes motion to become a ‘Bitcoin-friendly city’,https://cointelegraph.com/news/vancouver-passes-motion-become-bitcoin-friendly-city?utm_source=rss_feed&utm_medium=rss&utm_campaign=rss_partner_inbound,"Six councilors supported the motion, and two opposed it over concerns about digital assets’ potential for use in illicit activities and environmental impacts through mining.",Vancouver City Council|Bitcoin-friendly city|Mayor Ken Sim|Bitcoin financial strategy|Inflation protection|Digital assets in government.,EN,0,0,MINING,"{'name': 'CoinTelegraph', 'img': 'https://images.cryptocompare.com/news/default/cointelegraph.png', 'lang': 'EN'}",cointelegraph,2024-12-12 06:15:11
37531177,https://en.bitcoinsistemi.com/bankrupt-company-ftx-may-have-sold-a-lot-of-this-altcoin-according-to-onchain-data/,1733984287,https://resources.cryptocompare.com/news/81/37531177.jpeg,Bankrupt Company FTX May Have Sold a Lot of This Altcoin According to Onchain Data,https://en.bitcoinsistemi.com/bankrupt-company-ftx-may-have-sold-a-lot-of-this-altcoin-according-to-onchain-data/,"A crypto wallet linked to the defunct company Alameda Research transferred 3.36 million FTT tokens worth $11 million to Binance, according to crypto onchain data The Binance address in question is reportedly linked to a wallet belonging to a company called Mirana Ventures. Looking at historical onchain data, it appears that Alameda Research previously sent these FTT tokens to the Mantle Treasure wallet 3 years ago, and then moved them to FTX’s multisig wallets about a year ago. Interestingly, FTT, the cryptocurrency of bankrupt company FTX, has gained more than 50% in value in the last month. Related News: Two Metrics in Bitcoin Hit Critical Levels - What Happens Next? However, FTX is currently going through a bankruptcy process and the value of FTT could be liquidated by the company and experience significant volatility. Therefore, it is worth being careful. The token's price rose to an all-time high of $85 3 years ago. It is currently trading 96% lower than that level. *This is not investment advice. Continue Reading: Bankrupt Company FTX May Have Sold a Lot of This Altcoin According to Onchain Data",News,EN,0,0,ALTCOIN|EXCHANGE|RESEARCH|BNB|FTT,"{'name': 'BitcoinSistemi', 'img': 'https://resources.cryptocompare.com/news/81/default.png', 'lang': 'EN'}",bitcoinsistemi,2024-12-12 06:18:07
37531179,https://en.coinotag.com/vancouver-city-council-considers-bitcoin-integration-amid-financial-stability-concerns-and-environmental-debate/,1733984289,https://resources.cryptocompare.com/news/77/37531179.jpeg,Vancouver City Council Considers Bitcoin Integration Amid Financial Stability Concerns and Environmental Debate,https://en.coinotag.com/vancouver-city-council-considers-bitcoin-integration-amid-financial-stability-concerns-and-environmental-debate/,"The Vancouver City Council has taken a pivotal step towards embracing cryptocurrency, specifically Bitcoin, as part of its financial strategy. Mayor Ken Sim’s proposal aims to position Vancouver as a",News|BTC,EN,0,0,BTC,"{'name': 'CoinOtag', 'img': 'https://resources.cryptocompare.com/news/77/default.png', 'lang': 'EN'}",coinotag,2024-12-12 06:18:09
