id,guid,published_on,imageurl,title,url,body,tags,lang,upvotes,downvotes,categories,source_info,source,date
43304739,https://timestabloid.com/?p=63939,1744582524,https://resources.cryptocompare.com/news/67/default.png,"Meme Coins With Killer Potential: Gigachad, Apu Apustaja, and One Cat That’s Ready to Roar",https://timestabloid.com/meme-coins-with-killer-potential-gigachad-apu-apustaja-and-one/,"Have you noticed the meteoric rise of meme coins in the cryptocurrency world? What started as an online joke has quickly evolved into a lucrative investment opportunity, with meme coins like Gigachad and Apu Apustaja making waves in the market. But with new meme coins emerging every day, which one is truly set to break through and capture the spotlight next? In the crowd of rising stars, TrollerCat ($TCAT) stands out as a dominant force with a unique set of features that could make it the next big thing. While other meme coins, including Gigachad, Non-Playable Coin, and Apu Apustaja, are starting to show promise, Troller Cat is already positioning itself as a powerful contender. This article will cover the developments and updates of all 3 coins—Troller Cat, Gigachad, and Apu Apustaja—but stay tuned for why Troller Cat’s whitelist opportunity is where the real action is. 1. Join the Whitelist of the Next Meme Coin Superstar – Why Troller Cat is a Must-Join Opportunity If you’re looking for the next big meme coin investment, now is the time to join the whitelist for Troller Cat ($TCAT). Troller Cat is gearing up for an incredible launch, and early access to the presale could mean huge rewards for those who get in before the masses. Rumors have been swirling about Troller Cat’s rumored high staking rewards, with early adopters set to benefit from extraordinary returns. The Troller Cat whitelist is not just an opportunity to secure your position in this hot new meme coin project—it’s your ticket to becoming part of something that could redefine the meme coin space. Analysts are already predicting big things for Troller Cat, with the potential for it to go viral thanks to its exciting play-to-earn game center, which is expected to make the token deflationary. As supply is reduced, demand will rise, and those who are early on this exciting opportunity stand to reap substantial rewards. Don’t miss out on securing your spot on the whitelist for Troller Cat. The next meme coin explosion could be just around the corner! Troller Cat Presale – Why Timing is Everything The Troller Cat presale is gearing up to be one of the most anticipated events in the meme coin world. As this exciting project prepares to launch, early investors have the chance to position themselves at the forefront of the next major meme coin revolution. With Troller Cat’s presale right around the corner, the buzz is palpable—and for good reason. The rumored high staking rewards and the deflationary mechanism tied to the play-to-earn game center make this one of the most enticing presale opportunities to date. Timing is key when it comes to meme coins, and with Troller Cat’s presale, early investors are in line to potentially see massive returns. The coin’s unique features set it apart from the rest, and its exciting whitelist opportunities offer a chance to get in before everyone else. This is your chance to ride the wave of excitement surrounding Troller Cat, so don’t wait until the hype is too big to jump in. Secure your spot on the whitelist now, and get ready for the next big meme coin success story. 2. Gigachad – The Meme Coin with a Cult Following Gigachad has quickly garnered attention in the meme coin space, thanks to its dedicated community and the viral nature of the project. While not as established as some of the more prominent meme coins, Gigachad has gained significant traction, and its market movements indicate growth potential. The coin’s community-driven approach and the humor behind its branding have made it a fan favorite, and as more people join in on the fun, Gigachad continues to rise. Its unique blend of meme culture and cryptocurrency has earned it a solid place in the meme coin universe. Why Gigachad made it to this list: Its viral following and community-centric nature set it up for future success. 3. Non-Playable Coin – A Unique Meme Coin with Great Potential Non-Playable Coin (NPC) stands out for its uniqueness in the meme coin market. While it may have started as a meme, NPC has evolved into a serious contender with a growing community and increasing interest from investors. The coin’s focus on humor and its connection to video games and digital culture have helped it gain a niche audience. The potential for NPC to continue growing rests on its ability to leverage its meme status into real-world value. Why Non-Playable Coin made it to this list: Its unique twist on meme culture gives it strong potential for growth in the crypto space. 4. Apu Apustaja – A Meme Coin Gaining Momentum Apu Apustaja ($APU) is another meme coin that has been making waves. Priced at $0.0001139, it has shown a solid increase of 3.96% in the past 24 hours, with a market cap of $38.5M. Apu Apustaja has steadily built a loyal following, and its market performance suggests it could continue to rise in the coming months. As meme coins become more popular, Apu Apustaja’s position in the market seems poised for growth. Why Apu Apustaja made it to this list: Strong community support and its consistent performance make it a coin to watch in the meme coin sector. 5. Simon’s Cat Pounces Into the Crypto World Simon’s Cat has taken the internet by storm as a viral sensation, and now it’s bringing its quirky charm to the meme coin market. Based on the famous animated character, this coin blends humor with cryptocurrency, attracting a unique crowd of both cat lovers and meme coin enthusiasts. With a community-driven approach, Simon’s Cat has gained significant traction, making it one of the more fun and culturally relevant options in the meme coin sector. It’s not just a coin—it’s a lifestyle for the internet’s funniest followers. Why Simon’s Cat made it to this list : Its widespread popularity and strong community make Simon’s Cat a standout meme coin that captures the hearts and wallets of crypto enthusiasts. 6. Degen Coin: Embrace the Wild Side of Crypto with Risk and Rewards For those who live on the edge, Degen is the perfect meme coin. Inspired by the high-risk, high-reward mentality that defines the crypto world, Degen is all about taking bold chances and reaping big rewards. Catering to the risk-takers and thrill-seekers, this coin offers both the excitement of volatile price movements and the potential for massive gains. It’s a coin for those who are not afraid to gamble, and with its growing community, Degen might just become the go-to coin for adventurous investors. Why Degen made it to this list : Degen embraces the wild, unpredictable nature of crypto investing, appealing to those who love to take risks and chase huge rewards. 7. ANDY: A Meme Coin with Heart, Culture, and Crypto Potential Named after a popular internet persona, ANDY is quickly gaining traction in the meme coin space by drawing inspiration from both internet culture and gaming. Combining fun and profitability, ANDY has the potential to attract a strong, engaged following. The project promises an engaging experience for holders, offering both viral appeal and the possibility of rewarding its loyal community. As it continues to develop, ANDY could soon be a big player in the meme coin market. Why ANDY made it to this list : With its deep connection to gaming culture and internet trends, ANDY holds strong potential to captivate both meme lovers and crypto investors alike. 8. Osaka Protocol: A Fresh Cultural Twist on Meme Coins Blending crypto with global appeal, Osaka Protocol is bringing a unique cultural edge to the meme coin market. Inspired by the vibrant city of Osaka, Japan, this coin offers a mix of novelty and creative branding that stands out in the meme coin world. With its potential for worldwide recognition and a strong cultural identity, Osaka Protocol aims to attract investors who are looking for something more than just another coin—it’s about building a global community. Why Osaka Protocol made it to this list : Osaka Protocol’s fusion of Japanese cultural elements with the meme coin trend gives it a unique and intriguing place in the market, drawing in a global audience. Conclusion: The Future of Meme Coins is Bright, But Troller Cat Leads the Way Based on research and market trends, Troller Cat , Gigachad, and Apu Apustaja are all contenders for the meme coin crown. However, Troller Cat stands out as the most exciting opportunity for early investors. The upcoming whitelist and rumored high staking rewards make it a project to keep an eye on. As Troller Cat’s presale draws closer, now is the time to get involved in this promising meme coin and position yourself for the next big opportunity. Don’t miss out on your chance to be part of Troller Cat’s journey to the top! For More Information: Website: https://www.trollercat.com/ Telegram: https://t.me/trollercat X: https://x.com/trollercat_ Reddit: https://www.reddit.com/r/TrollerCat/ Frequently Asked Questions What is the Troller Cat whitelist, and why should I join? The Troller Cat whitelist gives early investors access to the presale, with exclusive opportunities to earn high staking rewards. How does Troller Cat differ from other meme coins? Troller Cat stands out with its rumored play-to-earn game center, which could make it deflationary and increase its value over time. What is the potential of Gigachad in the meme coin space? Gigachad has a strong community and viral potential, positioning it as a meme coin to watch for growth. Why is Apu Apustaja gaining traction? Apu Apustaja has shown solid market performance and a loyal following, suggesting it could see continued growth in the future. How can I participate in Troller Cat’s presale? To participate in Troller Cat’s presale, you need to join the whitelist and sign up for early access. Glossary of Key Terms Whitelist : A list of approved participants who gain early access to a crypto project’s presale. Presale : The initial sale of a cryptocurrency before it becomes available to the public. Staking Rewards : Earnings received by investors who lock their crypto in a network to support its operation. Deflationary : A system where the total supply of a currency is gradually reduced, increasing its value over time. Meme Coin : A type of cryptocurrency that is often created as a joke but can gain popularity due to community support. Market Cap : The total value of a cryptocurrency, calculated by multiplying its current price by the total supply. P2E : Play-to-earn, a gaming model where players can earn cryptocurrency rewards for in-game achievements. Crypto : Digital or virtual currency that uses cryptography for security. Disclaimer: This is a sponsored press release for informational purposes only. It does not reflect the views of Times Tabloid, nor is it intended to be used as legal, tax, investment, or financial advice. Times Tabloid is not responsible for any financial losses. The post Meme Coins With Killer Potential: Gigachad, Apu Apustaja, and One Cat That’s Ready to Roar appeared first on Times Tabloid .",Finance|News,EN,0,0,BLOCKCHAIN|BUSINESS|MARKET|REGULATION|SPONSORED,"{'name': 'TimesTabloid', 'img': 'https://resources.cryptocompare.com/news/67/default.png', 'lang': 'EN'}",timestabloid,2025-04-13 22:15:24
43304834,https://en.coin-turk.com/?p=188934,1744583386,https://resources.cryptocompare.com/news/79/43304834.jpeg,Dave the Wave Predicts Bitcoin’s Bullish Trend with a Head and Shoulders Formation,https://en.coin-turk.com/dave-the-wave-predicts-bitcoins-bullish-trend-with-a-head-and-shoulders-formation/,"Dave the Wave identifies a bullish head and shoulders pattern in Bitcoin. Bitcoin price may reach $200,000 as investor interest grows. Continue Reading: Dave the Wave Predicts Bitcoin’s Bullish Trend with a Head and Shoulders Formation The post Dave the Wave Predicts Bitcoin’s Bullish Trend with a Head and Shoulders Formation appeared first on COINTURK NEWS .",Bitcoin (BTC),EN,0,0,BTC|BUSINESS|TRADING,"{'name': 'CoinTurk News', 'img': 'https://resources.cryptocompare.com/news/79/default.png', 'lang': 'EN'}",cointurken,2025-04-13 22:29:46
43305782,https://thecoinrise.com/could-magacoinfinance-100x-while-xrp-stalls-at-0-70/,1744583415,https://resources.cryptocompare.com/news/60/43305782.jpeg,Could MAGACOINFINANCE 100x While XRP Stalls at $0.70?,https://thecoinrise.com/could-magacoinfinance-100x-while-xrp-stalls-at-0-70/,"With XRP hovering around $0.70 and struggling to break higher, many investors are beginning to shift focus toward faster, leaner, more explosive alternatives. That’s where MAGACOINFINANCE enters the conversation—a fast-growing altcoin project that’s not just aiming for 10x or 25x… but potentially 100x by the end of 2025 . ⚠️ LIMITED SPOTS — JOIN 2025’S BIGGEST PRESALE! ROI Snapshot: XRP, SOL, AVAX, HBAR vs. MAGACOINFINANCE XRP – $0.70 (ROI potential: 2x–3x ) Solana (SOL) – $182 (ROI potential: 3x ) Avalanche (AVAX) – $49.20 (ROI potential: 4x ) Hedera (HBAR) – $0.17 (ROI potential: 5x ) MAGACOINFINANCE – $0.0002908 (confirmed 25x ROI to $0.007 , or 3,745% with MAGA50X bonus) The top coins are moving, but they’re not delivering life-changing returns . MAGACOINFINANCE is—and Stage 7 is where it’s all happening. 🟢 JOIN 12,500+ NOW — BUY BEFORE PRICE JUMPS! MAGACOINFINANCE – STAGE 7 IS LIVE AND HEATING UP MAGACOINFINANCE is priced at only $0.0002908 , with a confirmed listing at $0.007 . That’s a 25x ROI baked in , and if you use MAGA50X , your bonus boosts gains to 3,745% . Over 12,500 holders are already in—and with Stage 6 sold out , FOMO is off the charts . Buy at: $0.0002908 Listing Target: $0.007 25x ROI Potential (Up to 3,745% with MAGA50X) Final Take XRP may break $1 someday—but MAGACOINFINANCE is breaking boundaries now . The tokenomics are simple, the hype is real, and the numbers don’t lie. This could be the next 100x coin for those smart (and early) enough to get in during Stage 7. ⚠️ FINAL HOURS: CLAIM 50% EXTRA BONUS — CODE MAGA50X Conclusion As the cryptocurrency market continues to evolve, both established and emerging digital assets present unique opportunities. While Bitcoin (BTC) , Ripple (XRP) , and Solana (SOL) pursue growth strategies, MAGACOINFINANCE distinguishes itself with its innovative approach and attractive pre-sale incentives. Investors are encouraged to conduct thorough research, stay informed about market trends, and consider diversifying their portfolios to navigate this dynamic landscape effectively. Website: magacoinfinance.com Twitter/X: https://x.com/magacoinfinance The post Could MAGACOINFINANCE 100x While XRP Stalls at $0.70? appeared first on TheCoinrise.com .",Token Presale and ICO Insights|MAGACOINFINANCE,EN,0,0,AVAX|BTC|SOL|XRP|ZRX,"{'name': 'The Coin Rise', 'img': 'https://images.cryptocompare.com/news/default/thecoinrise.png', 'lang': 'EN'}",thecoinrise,2025-04-13 22:30:15
13806811,https://cointelegraph.com/news/what-happened-in-crypto-today,1744583478,https://resources.cryptocompare.com/news/16/13806811.jpeg,Here’s what happened in crypto today,https://cointelegraph.com/news/what-happened-in-crypto-today?utm_source=rss_feed&utm_medium=rss&utm_campaign=rss_partner_inbound,"Today in crypto, the price of the Mantra token collapses, a non-fungible token (NFT) trader could face up to six years in prison after pleading guilty to underreporting nearly $13 million in profits from trading CryptoPunks, crypto gaming and gambling campaigns are proving tougher to onboard crypto users than other sectors of the industry. Mantra token collapses by 90% but retraces some value following statements from team The price of the Mantra token collapsed by over 90% on April 13 but regained some lost value following statements from the Mantra team and co-founder JP Mullin. Mantra's ( OM ) price collapsed to a low of approximately $0.38 before crossing back over $1, and is currently at that level. Mantra token price and overview. Source: CoinGecko According to the Mantra team, OM's price decline was due to ""reckless liquidations"" that the Mantra team is investigating. ""One thing we want to be clear on: this was not our team. We are looking into it and will share more details about what happened as soon as we can,"" the team wrote in an April 13 X post . NFT trader faces prison for $13 million tax fraud on CryptoPunk profits A non-fungible token (NFT) trader could face up to six years in prison after pleading guilty to underreporting nearly $13 million in profits from trading CryptoPunks, according to the US Attorney’s Office for the Middle District of Pennsylvania. Waylon Wilcox, 45, admitted to filing false income tax returns for the 2021 and 2022 tax years. The former CryptoPunk investor pleaded guilty on April 9 to two counts of filing false individual income tax returns , federal prosecutors said in an April 11 press release . Back in April 2022, Wilcox filed a false individual income tax return for the tax year 2021, which underreported his income tax by roughly $8.5 million and reduced his tax due by approximately $2.1 million. In October 2023, Wilcox filed another false individual tax income return for the fiscal year of 2022, underreporting his income tax by an estimated $4.6 million and reducing his tax due by nearly $1.1 million. Wilcox pleads guilty to false tax filing, press release. Source: Attorney’s Office for the Middle District of Pennsylvania “The total maximum penalty under federal law for these offenses is up to six years of imprisonment, a term of supervised release following imprisonment, and a fine,” according to the statement. However, the exact details and timing of his sentence remain unclear. Crypto gaming and gambling ads “most expensive” for onboarding users Crypto gaming and gambling campaigns are the most expensive way to acquire users with existing crypto wallets, ranking highest in cost among all sectors of the crypto industry, recent data shows. “Gaming and gambling campaigns are the most expensive, with a median CPW of $8.74 and a lower quartile of $3.40,” Web3 marketing firm Addressable co-founder Asaf Nadler said in a recent report posted on X. CPW results across various sectors of the crypto industry. Source: Asaf Nadler CPW, or cost per wallet, is deemed a higher “quality” metric because it tracks the cost of website visitors with a crypto wallet already installed in their browser. Nadler previously told Cointelegraph that their analysis data showed that users with a wallet are more likely to convert to crypto products.",Trump memecoin|Solana memecoin|TRUMP token|Solana|SOL|Nova Labs|SEC|Securities and Exchange Commission|crypto regulation|TRUMP rally|Bitcoin,EN,0,0,ADA|ALTCOIN|ASIA|AVAX|BCH|BLOCKCHAIN|BTC|BUSINESS|ETH|EXCHANGE|FIAT|ICO|LINK|MARKET|MATIC|MINING|REGULATION|SOL|SPONSORED|TRADING|USDT|XRP|ZRX|RESEARCH|APT|ARB|BNB|FDUSD|TON|USDC|ZK|WLD|KAVA|ARKM,"{'name': 'CoinTelegraph', 'img': 'https://images.cryptocompare.com/news/default/cointelegraph.png', 'lang': 'EN'}",cointelegraph,2025-04-13 22:31:18
43304980,https://www.cryptopolitan.com/?p=709600,1744583587,https://resources.cryptocompare.com/news/43/43304980.jpeg,Binance users targeted in SMS phishing scam using fake security alerts,https://www.cryptopolitan.com/binance-users-targeted-in-sms-phishing-scam/,"Phishing scammers have targeted Binance users in a new campaign using text messages. According to reports from users of the exchanges, the scammers are sending messages that look genuine. Text messages shared by users follow a similar pattern. They call attention to a security issue and require the user to call a number to resolve it. By doing this, they bypass anti-phishing safeguards that detect malicious links but not phone numbers. Users were getting alerts from various issues including reports of log-in from a different location, adding a new 2-factor authentication device, or connecting to a new hardware wallet. So far, there has been no report of any victim, but users on X have alerted others about the risks, noting that Binance will never ask its customers to call a number. Meanwhile, one user mentioned that he called the number. SMS Phishing scam to Binance user (Source: X/ Public_Enemy_01) He said: “New scam @binance …… it came from the same number you text me from aswell. Rang it, spoke to Abdul in Landan, who didn’t like my tone for some reason and hung up. Watch out people.” Interestingly, several users claim the text messages come from the same sender ID Binance uses for communications, leading to more uncertainty among users about the authenticity of the messages. Binance says the data leak is not from its systems Meanwhile, there are speculations about how the scammers got user data. Many believe they bought it from the dark web and are now using it for a targeted campaign. According to one user, an anonymous actor recently offered a database of Gemini and Binance users for sale. The user claimed that a 2019 leak of Binance Know Your Customer (KYC) data is the source of the database. However, Binance has denied this, noting that it examined the hacker’s data and that the records are not connected to Binance. Nevertheless, Binance.US has warned users about phishing sites that impersonate its website. A post on X warned that scammers are using lookalike websites to collect user data. It added that users should always confirm the authenticity of the QR code and website link, as it will never request a multi-factor authentication code outside its platform. Binance CSO warns users about InfoStealers malware A potential explanation also comes from Binance Chief Security Officer Jimmy Su , who said in a recent post that hackers are gaining access to user data due to malware on user devices and not a breach of Binance systems. According to him, the bad actors are using malware known as InfoStealers to collect users’ credentials from their browsers. He claimed the malware collects all information saved on browsers, including passwords and clipboard data. He added that users can unknowingly download the malware through phishing links on social media, unofficial software downloads, and malicious add-ons. Therefore, he advised them to download software only from official sources and avoid saving passwords in browsers. Su said: “This is not an isolated case. Our security team continuously monitors dark web sources and malware campaigns to identify potential threats to our users.” Meanwhile, Binance has now extended an anti-phishing code for SMS to enable users to recognize genuine text messages. The code, which is set by each user, accompanies every authentic text message from the exchange and is reportedly available in all jurisdictions where Binance has a license to operate. Cryptopolitan Academy: Coming Soon - A New Way to Earn Passive Income with DeFi in 2025. Learn More",News|Binance|Phishing,EN,0,0,EXCHANGE|TECHNOLOGY|BNB,"{'name': 'Cryptopolitan', 'img': 'https://images.cryptocompare.com/news/default/cryptopolitan.png', 'lang': 'EN'}",cryptopolitan,2025-04-13 22:33:07
