id,guid,published_on,imageurl,title,url,body,tags,lang,upvotes,downvotes,categories,source_info,source,date
43302530,https://en.bitcoinsistemi.com/?p=160563,1744578170,https://resources.cryptocompare.com/news/81/43302530.jpeg,$10 MAGACOINFINANCE vs $80K BTC — Which One’s 50x Closer?,https://en.bitcoinsistemi.com/10-magacoinfinance-vs-80k-btc-which-ones-50x-closer/,"If you’re betting $10 in April 2025 , would you put it into Bitcoin (BTC) at over $80K—or a breakout altcoin still priced at fractions of a cent? While BTC is the gold standard for stability, MAGACOINFINANCE is the one delivering unmatched ROI potential. Early investors aren’t guessing anymore—they’re moving fast on the fast-growing altcoin project built for velocity, not just volume. ACT NOW — STAGE 6 SOLD OUT ROI Comparison Table – MAGACOINFINANCE vs Top Coins Coin Current Price ROI Potential Upside Notes Bitcoin (BTC) $81,812 2x High entry, limited multiplier left XRP $1.99 3x–4x Climbing again, but slow TON $5.30 4x Moderate upside, already well-known Chainlink (LINK) $12.30 3x Reliable, but not early-stage Hedera (HBAR) $0.17 5x Growing utility, but limited buzz MAGACOINFINANCE $0.0002909 25x or 3,745% Ultra-early entry, explosive momentum, still under $0.001 MAGACOIN FINANCE UNDER $0.0004 — 100x COMING! MAGACOINFINANCE – STAGE 7 IS LIVE AND GAINING TRACTION MAGACOINFINANCE is now deep into Stage 7 , right after a full Stage 6 sellout . Priced at only $0.0002909 , with a listing target of $0.007 , it offers early investors a 25x built-in return . Use promo code MAGA50X , and that ROI spikes to 3,745% . With 12,500+ holders already in, this presale is one of April’s most-watched. Buy at: $0.0002909 Listing Target: $0.007 25x ROI Potential 3,745% with MAGA50X Why MAGACOINFINANCE Stands Out in April XRP, TON, and LINK have potential—but they’ve already moved. MAGACOINFINANCE is still in pre-launch , still under a penny, and still offering one of the last high-velocity entry points left in crypto this cycle. FINAL HOURS: CLAIM 50% EXTRA BONUS — CODE MAGA50X Conclusion As the cryptocurrency market continues to evolve, both established and emerging digital assets present unique opportunities. While Bitcoin (BTC) , Ripple (XRP) , and Solana (SOL) pursue growth strategies, MAGACOINFINANCE distinguishes itself with its innovative approach and attractive pre-sale incentives. Investors are encouraged to conduct thorough research, stay informed about market trends, and consider diversifying their portfolios to navigate this dynamic landscape effectively. Website: magacoinfinance.com Twitter/X: https://x.com/magacoinfinance Continue Reading: $10 MAGACOINFINANCE vs $80K BTC — Which One’s 50x Closer?",Sponsored,EN,0,0,BTC|BUSINESS|LINK|XRP|ZRX,"{'name': 'BitcoinSistemi', 'img': 'https://resources.cryptocompare.com/news/81/default.png', 'lang': 'EN'}",bitcoinsistemi,2025-04-13 21:02:50
43302626,https://en.coinotag.com/xrp-market-analysis-bearish-trends-anticipate-possible-short-squeeze-as-traders-remain-cautious/,1744578480,https://resources.cryptocompare.com/news/77/43302626.jpeg,XRP Market Analysis: Bearish Trends Anticipate Possible Short Squeeze as Traders Remain Cautious,https://en.coinotag.com/xrp-market-analysis-bearish-trends-anticipate-possible-short-squeeze-as-traders-remain-cautious/,"The cryptocurrency market has been witnessing significant shifts, particularly with Ripple’s XRP, which recently broke through its long-held trendline resistance. The breakout comes amid broader market trends indicating potential volatility",News|Ripple|AUCTION|XRP,EN,0,0,MARKET|TRADING|XRP,"{'name': 'CoinOtag', 'img': 'https://resources.cryptocompare.com/news/77/default.png', 'lang': 'EN'}",coinotag,2025-04-13 21:08:00
43302627,https://bitzo.com/2025/04/hedera-hbars-bullish-outlook-suggests-major-upside-as-cardano-ada-prices-poise-for-a-jump-buy-ada-hbar-now,1744578517,https://resources.cryptocompare.com/news/104/43302627.jpeg,"Hedera (HBAR)’s Bullish Outlook Suggests Major Upside, as Cardano (ADA) Prices Poise for a Jump – Buy ADA & HBAR Now?",https://bitzo.com/2025/04/hedera-hbars-bullish-outlook-suggests-major-upside-as-cardano-ada-prices-poise-for-a-jump-buy-ada-hbar-now,"Hedera (HBAR) shows impressive potential for significant growth. Cardano (ADA) also appears set for a price increase. Investors might find it an opportune moment to consider these digital assets. The forthcoming analysis reveals which cryptocurrencies are primed for a bullish run and why they deserve attention now. Cardano: Recent Trends and Key Price Levels in Focus ADA price action over the past month shows a modest drop of roughly 8%, with weekly declines near 1.22%. Over the last six months, Cardano has surged close to 77%, marking a strong upward push for longer-term holders. This blend of short-term softness paired with solid long-term gains highlights a period of volatility and gradual recovery. Current levels see Cardano trading between $0.47 and $1.02, with resistance around $1.37 and support near $0.27. Technical signals point to a slight bearish leaning without a decisive trend, presenting a range-bound market. Traders might consider buying near support and testing resistance while keeping an eye on any emerging breakouts. Hedera HBAR: Six-Month Surge Meets Short-Term Correction Over the past month, HBAR price declined nearly 9.6%, while the six-month period delivered a robust 219% gain. Prices ranged between $0.117 and $0.248, indicating a volatile swing that contrasts short-term pullbacks with long-term upward momentum. This behavior shows clear recovery potential even amid recent dips. Current price action trades within the $0.117-$0.248 corridor, with immediate resistance at $0.33 and a further hurdle at $0.47. Support appears near $0.07. Despite strong long-term gains, short-term indicators lean slightly bearish with an RSI around 48. Traders may look for a steady break above $0.33 while watching for reversals near support levels. Conclusion ADA and HBAR have shown promising potential for growth. Both coins have unique features and strong communities supporting them. The bullish outlook for HBAR and the anticipated price rise for ADA highlight their attractiveness. This could be a good time to consider investing in these two assets. Disclaimer: This article is provided for informational purposes only. It is not offered or intended to be used as legal, tax, investment, financial, or other advice.",Breaking News,EN,0,0,ADA|MARKET|REGULATION|TRADING|HBAR,"{'name': 'Bitzo', 'img': 'https://resources.cryptocompare.com/news/104/default.png', 'lang': 'EN'}",bitzo,2025-04-13 21:08:37
43302635,https://news.bitcoin.com/?p=719278,1744578552,https://resources.cryptocompare.com/news/14/43302635.jpeg,China Demands US ‘Completely Cancel’ Tariffs After Trade Spat Escalates,https://news.bitcoin.com/china-demands-us-completely-cancel-tariffs-after-trade-spat-escalates/,"China isn’t budging following U.S. President Donald Trump’s move to slap a 145% tariff on the country. On Sunday, the Chinese Ministry of Commerce fired back, saying the United States must rethink what it called an “erroneous” approach—urging Washington to “completely cancel” the tariffs in no uncertain terms. Chinese Foreign Ministry Warns: Americans Will Pay",Economics|China|economics|United States US,EN,0,0,ASIA|BUSINESS|REGULATION,"{'name': 'Bitcoin.com', 'img': 'https://images.cryptocompare.com/news/default/bitcoincom.png', 'lang': 'EN'}",bitcoin.com,2025-04-13 21:09:12
43302662,https://en.coin-turk.com/?p=188926,1744578592,https://resources.cryptocompare.com/news/79/43302662.jpeg,Market Shakes as OM Coin Faces Dramatic Price Drop,https://en.coin-turk.com/market-shakes-as-om-coin-faces-dramatic-price-drop/,"OM Coin's price plummeted over 90%, raising concerns among the community. MANTRA's team claims the drop is unrelated to their project or actions. Continue Reading: Market Shakes as OM Coin Faces Dramatic Price Drop The post Market Shakes as OM Coin Faces Dramatic Price Drop appeared first on COINTURK NEWS .",Altcoin News,EN,0,0,MARKET|TRADING|OM,"{'name': 'CoinTurk News', 'img': 'https://resources.cryptocompare.com/news/79/default.png', 'lang': 'EN'}",cointurken,2025-04-13 21:09:52
43303326,https://thecoinrise.com/why-qubetics-leads-as-the-best-crypto-under-a-penny-sei-and-injective-bring-speed-and-scalability-to-the-table/,1744578957,https://resources.cryptocompare.com/news/60/43303326.jpeg,Why Qubetics Leads as the Best Crypto Under a Penny—SEI and Injective Bring Speed and Scalability to the Table,https://thecoinrise.com/why-qubetics-leads-as-the-best-crypto-under-a-penny-sei-and-injective-bring-speed-and-scalability-to-the-table/,"In the fast-paced world of blockchain and crypto, new projects are constantly emerging, each with its unique value proposition. With the continued rise of decentralized finance (DeFi) and the growing adoption of blockchain technology, it’s important to keep an eye on the projects that are standing out. These aren’t just flashy names but solid, long-term alternatives to traditional investment avenues. Among these projects, Qubetics , SEI, and Injective have firmly established themselves as key players. In this article, we’ll dive deep into what each one brings to the table, their milestones, and how they position themselves as alternatives to traditional investments. Whether the priority is utility, performance, or scalability, these projects are not merely adapting—they are leading the charge. They represent the forward-thinking alternatives that discerning crypto backers are turning to, while traditional financial markets continue to rely on outdated models. Let’s find out the best crypto under a penny. Qubetics: The World’s First Web3 Aggregator Qubetics has emerged as a revolutionary force in the crypto world, bringing together various blockchain technologies and providing a seamless multi-chain experience. Known for its Non-Custodial Multi-Chain Wallet, it allows users to safely store and manage their assets across multiple blockchains. Businesses, professionals, and individuals alike can benefit from this wallet, which offers enhanced security and ease of use, addressing major concerns about asset management in the digital age. Whether you’re a crypto novice or a seasoned pro, having control over your assets without relying on centralized exchanges is a game-changer. The latest updates surrounding Qubetics’ crypto presale show that it’s quickly gaining traction. As of now, over $16 million has been raised, with more than 24,600 community members onboard and over 507 million $TICS tokens sold. Currently priced at $0.1573, Qubetics holds tremendous growth potential. Analysts predict massive returns with projections showing a 536% ROI if $TICS hits $1, and even more as it climbs higher. This makes Qubetics one of the best crypto under a penny with significant upside. If you’re looking for a serious alternative investment, Qubetics stands out. Non-Custodial Multi-Chain Wallet: Real-Life Utility in Action A non-custodial multi-chain wallet puts users in full control of their assets across multiple blockchains—no middleman, no centralized gatekeeper. Picture a freelance designer in Argentina getting paid in ETH for one project, SOL for another, and receiving stablecoins on Polygon from a client in Brazil. Instead of juggling three different apps or risking funds on centralized exchanges, they can manage, swap, and send all those tokens from one secure interface, right on their phone or desktop. The wallet interacts directly with each blockchain’s smart contracts, using private keys stored only on the user’s device, not in some third-party database. That means tighter security, total autonomy, and instant access to cross-chain assets without delays or custodial risks—perfect for everyday users navigating an increasingly multi-chain world. SEI: DeFi Innovation and Speed at Its Core SEI has positioned itself as a powerhouse in decentralized finance (DeFi), known for its focus on scalability and speed. Built on top of the Cosmos SDK, SEI boasts high transaction throughput and near-instant finality, ensuring that users can conduct fast and secure transactions. The platform’s unique architecture has attracted a diverse community of developers, businesses, and adopters. SEI’s native token, SEI, has become a staple in the DeFi ecosystem, with multiple DeFi protocols integrating it for governance, staking, and liquidity provision. In terms of milestones, SEI has made tremendous strides, seeing rapid adoption since its launch. The project is entering new stages with the mainnet launch looming on the horizon, offering exciting possibilities for its community members. It’s clear that SEI is not just another DeFi project, but one that has the potential to challenge existing platforms and bring forward a new wave of blockchain adoption. Injective: Bridging DeFi and TradFi Injective is well-known for its mission to bring decentralized finance closer to traditional financial systems. It provides decentralized trading infrastructure, including derivatives and order book trading, with a focus on low-latency and high throughput. With partnerships and collaborations under its belt, Injective is growing in its niche as an advanced decentralized exchange (DEX) platform. Injective’s presale saw impressive numbers, helping it secure a strong market position. The platform’s flexibility in offering derivatives and decentralized futures trading has appealed to a wide range of backers. As it continues to gain momentum, Injective stands as a key player in the growing movement that seeks to reshape finance by giving more power and control to individuals. If you’re interested in decentralized trading options, Injective should be on your radar. The Best Cryptos to Join This Month Qubetics, SEI, and Injective are leading the charge in decentralized finance, providing promising options for anyone looking to break away from the traditional financial systems. These projects are rapidly becoming go-to solutions for users who want more autonomy, security, and returns on their digital assets. Keep a close watch on these blockchain titans as they continue to define the future of investment. Conclusion: Why These Crypto Projects Matter In a world where people are constantly looking for better ways to grow and secure their wealth, projects like Qubetics, SEI, and Injective stand out for their innovative approaches to crypto and blockchain technology. As we move further away from traditional investments, these platforms offer valuable alternatives, allowing users to diversify their portfolios and take control of their financial futures. With Qubetics in particular presenting a solid opportunity for best crypto under a penny growth, it’s clear why the crypto community is keeping a close eye on it. If you’re looking to make your move into the future of finance, these projects are well worth considering. Whether you’re after security, speed, or innovative solutions to old problems, the next stage of crypto adoption is already here. For More Information: Qubetics: https://qubetics.com Presale: https://buy.qubetics.com/ Telegram: https://t.me/qubetics Twitter: https://x.com/qubetics FAQs What makes Qubetics a top choice for crypto buyers? Qubetics is known for its unique Non-Custodial Multi-Chain Wallet, which provides users with the ability to store their assets across multiple blockchains securely. This wallet is designed to cater to businesses, professionals, and individuals, one of the best crypto under a penny. Is SEI a good investment option? Yes, SEI is a strong player in decentralized finance (DeFi) with its focus on scalability, speed, and high transaction throughput. As more DeFi projects integrate it, SEI is likely to see increased adoption, making it an attractive investment. What sets Injective apart from other DeFi platforms? Injective provides decentralized derivatives and order book trading, setting it apart from traditional DEX platforms. With its low-latency and high throughput, it caters to users seeking a more advanced and comprehensive decentralized exchange. The post Why Qubetics Leads as the Best Crypto Under a Penny—SEI and Injective Bring Speed and Scalability to the Table appeared first on TheCoinrise.com .",Token Presale and ICO Insights|Qubetics,EN,0,0,ATOM|BLOCKCHAIN|EXCHANGE|TRADING|SEI,"{'name': 'The Coin Rise', 'img': 'https://images.cryptocompare.com/news/default/thecoinrise.png', 'lang': 'EN'}",thecoinrise,2025-04-13 21:15:57
43303102,https://zycrypto.com/?p=104907,1744579470,https://images.cryptocompare.com/news/default/zycrypto.png,Tron Founder Celebrates 300 Million Addresses as TRX Crosses $0.25,https://zycrypto.com/tron-founder-celebrates-300-million-addresses-as-trx-crosses-0-25/,"Tron (TRX) founder Justin Sun recently took to X (formerly Twitter) to celebrate a major milestone for his digital currency network. The crypto entrepreneur claimed that the programmable blockchain now boasts massive accounts, totaling 300 million worldwide. This figure dwarfs the 1 billion+ figure commanded by Bitcoin, but it is only slightly less than Ethereum’s 321 million public addresses. It is a massive achievement by the Tron Foundation, considering its standing in the charts. In the same tweet, Sun revealed that the Total Value Locked (TVL) in the crypto’s staking and DeFi ecosystem is nearing record highs and hovering just below $20 billion. At the same time, the total transfer volume, another on-chain statistic, is close to $17 trillion. These figures are being used by Sun to drum up support for his altcoin, and the price has since surpassed the resistance at around $0.25. However, the move above this figure has been less than convincing, and the crypto could face some pressure going into the first day of the new week. Does Tron Boast 300 Million Users? Despite Sun’s claim of hundreds of millions of users, on further on-chain investigation, it was found out by the ZyCrypto team that the founder is conflating the number of users with the number of blockchain addresses created on the network. This is often used by promoters looking to get their cryptocurrency into discussion circles on social media. The reality is that this metric is far from a reliable statistic when calculating the number of users of a blockchain network because a single user can create multiple accounts, as they have done for all major blockchains. According to Dune Analytics , this is the graph of active addresses on the TRX blockchain: Image Source: Dune Analytics Currently, the number of active daily addresses on the Tron network hovers around 13.6 million, which is a healthy figure but only a fraction of the figure claimed by Sun. Many users also maintain multiple active addresses, so the actual figure is likely to be even lower. There is no concrete way of knowing the exact number of unique individual users using TRX, but it is expected to be in several million. Is Tron back? Tron has had a strong last two to three quarters as it managed to capture the attention of the market after several years of relative hiatus. The cryptocurrency was launched during the first altcoin boom of 2017-2018 and experienced massive gains before capitulating much of them in a major crash in 2018 that wiped out more than 90% of its value. TRX then had a lacklustre 2020-2021 bull market, fading away in the coin market charts. However, 2024 saw the once-fancied digital cryptocurrency awaken from its deep slumber and post a new All-Time High (ATH) of $0.45 in the buildup of the calendar year. While TRX has lost around 45% of its value ever since amid even deeper short-term plunges, the altcoin could be in for a major end to 2025 if the larger bull market resumes at some point in 2025.",Cryptocurrency|News|Tron News|TRX,EN,0,0,ALTCOIN|BLOCKCHAIN|MARKET|TRADING|TRX,"{'name': 'ZyCrypto', 'img': 'https://images.cryptocompare.com/news/default/zycrypto.png', 'lang': 'EN'}",zycrypto,2025-04-13 21:24:30
43303199,https://en.coin-turk.com/?p=188931,1744579802,https://resources.cryptocompare.com/news/79/43303199.jpeg,World Liberty Financial Diversifies Portfolio with SEI Token Acquisition,https://en.coin-turk.com/world-liberty-financial-diversifies-portfolio-with-sei-token-acquisition/,World Liberty Financial invests heavily in SEI tokens to diversify its portfolio. SEI token price surged significantly following this major acquisition. Continue Reading: World Liberty Financial Diversifies Portfolio with SEI Token Acquisition The post World Liberty Financial Diversifies Portfolio with SEI Token Acquisition appeared first on COINTURK NEWS .,Cryptocurrency News,EN,0,0,TRADING|SEI,"{'name': 'CoinTurk News', 'img': 'https://resources.cryptocompare.com/news/79/default.png', 'lang': 'EN'}",cointurken,2025-04-13 21:30:02
43303579,https://zycrypto.com/?p=104909,1744580223,https://images.cryptocompare.com/news/default/zycrypto.png,Market Pundit Predicts 400% Shiba Inu Rally as Bullish SHIB Chart Structure Holds,https://zycrypto.com/market-pundit-predicts-400-shiba-inu-rally-as-bullish-shib-schart-structure-holds/,"Shiba Inu (SHIB) has faced significant volatility in recent weeks, with its price dropping over 15% in the past week alone. Despite this decline, SHIB has fared better than Dogecoin (DOGE), which has seen a steeper drop of 27% over the same period. The downturn aligns with a broader cryptocurrency market correction, led by Bitcoin’s fall below the $78,000 mark. Notably, even before the latest market decline, on-chain data signaled diminishing interest in SHIB. Crypto analyst Ali Martinez recently highlighted this trend tweeting , “Whale activity on the ShibaInu network has declined by 79% over the past three months.” Despite the recent weakness, some analysts remain optimistic about SHIB’s potential. On Wednesday, analyst Javon Marks pointed to a bullish chart formation that suggests a massive rally could be on the horizon. “SHIB (Shiba Inu) prices maintaining the structure of a large Inverse Head & Shoulder and with the $0.000081 target still in play, an over 402% run to reach it could come out of this.” He tweeted. Meanwhile, other indicators point to signs of accumulation and a possible reversal for SHIB. The price is currently consolidating, with the RSI at 54.72, indicating neutral momentum. While buying pressure is present, it remains insufficient for a breakout. The Stochastic RSI at 54.72/57.76 has cooled off but could signal renewed buying if it turns upward. A move above 60 RSI may spark an uptrend, while a drop below 50 could signal further downside. At the same time, the Moving Average Convergence Divergence (MACD) indicator is flattening from bearish territory, hinting at a possible shift in momentum. Additionally, although trading volume has only increased by 13% in the past 24 hours to $312 million, it still signals ongoing accumulation. Beyond price action, SHIB’s ecosystem continues to expand with key developments aimed at improving liquidity and user experience. Earlier this week, the Shiba Inu team introduced upgraded liquidity pools designed to enhance liquidity management. The update allows users to seamlessly migrate, import, or create liquidity pools, streamlining the process. These advancements have generated significant interest in Shiba Inu, driving a surge in wallet addresses on its Ethereum Layer 2 network. Over the past week, the number of wallet addresses has skyrocketed by around 500%, jumping from approximately 9.4 million on February 17 to over 55.7 million as of February 24. Another bullish factor for SHIB is its increasing token burn rate. On Thursday, the Shiba Inu burn rate spiked by over 1,300%, removing over 30 million SHIB tokens from circulation in just one day. Token burning helps reduce supply, making SHIB scarcer, which could positively impact its price in the long run. At press time, SHIB was trading at $0.000012, reflecting a 3.91% drop in the past 24 hours.",Cryptocurrency|News|SHIB|SHIBA INU,EN,0,0,DOGE|MARKET|MINING|SHIB|TRADING,"{'name': 'ZyCrypto', 'img': 'https://images.cryptocompare.com/news/default/zycrypto.png', 'lang': 'EN'}",zycrypto,2025-04-13 21:37:03
43303495,https://news.bitcoin.com/?p=719168&preview=true&preview_id=719168,1744580457,https://resources.cryptocompare.com/news/14/43303495.jpeg,Unocoin Launches Bitcoin Payments Over Lightning Network in India,https://news.bitcoin.com/unocoin-launches-bitcoin-payments-over-lightning-network-in-india/,"Unocoin, India’s longest-standing cryptocurrency exchange, has announced the integration of the Lightning Network, powered by Voltage, marking an advancement in bitcoin and stablecoin adoption within the growing Indian crypto market. This new feature allows Unocoin users to send and receive bitcoin and tether ( USDT) instantly and at a fraction of the cost of traditional",News Bytes|India|lightning network|News Bytes - 5,EN,0,0,BTC|EXCHANGE|MARKET|USDT,"{'name': 'Bitcoin.com', 'img': 'https://images.cryptocompare.com/news/default/bitcoincom.png', 'lang': 'EN'}",bitcoin.com,2025-04-13 21:40:57
