id,guid,published_on,imageurl,title,url,body,tags,lang,upvotes,downvotes,categories,source_info,source,date
43305783,https://thecoinrise.com/rco-finances-token-presale-is-gaining-institutional-attention-and-its-not-too-late-to-join/,1744585233,https://resources.cryptocompare.com/news/60/43305783.jpeg,RCO Finance’s Token Presale Is Gaining Institutional Attention And It’s Not Too Late to Join,https://thecoinrise.com/rco-finances-token-presale-is-gaining-institutional-attention-and-its-not-too-late-to-join/,"As RCO Finance’s (RCOF) token presale approaches its conclusion, institutional investors are continuously monitoring the platform as pathways to engage further in the crypto landscape and potentially disrupt the traditional finance sector. By using the power of artificial intelligence (AI) technology, RCO Finance is positioned as a future-ready fintech solution aiming to democratize access to both conventional and decentralized finance. Among the many financial products the platform offers are staking, yield farming, loans, borrowing, token trading, and more all within a safe and decentralized environment. RCOF Token Presale’s Unique Opportunities Currently in stage five of the token presale, there are still abundant opportunities for those looking to participate. Having raised nearly $15 million, RCO Finance has also decided to launch its beta platform – a rare move in the DeFi space. This choice increases RCO Finance’s attractiveness by giving users the opportunity to try a broad spectrum of tools and solutions before the expected complete launch later this year. The platform’s utilities, which motivate user involvement in the governance model by compensating holders for voting on marketplace choices, help to encourage institutional interest in the token presale even more. By use of staking, RCOF owners may receive a 10% Annual Percentage Yield (APY). RCO Finance takes a different strategy than conventional staking pools with set quantities of liquidity. The next platform distributes 20% of every new RCOF deposit straight to liquidity. This suggests that you gain advantages, and your investments help the platform’s continuous enhancements. Holders of RCOF also receive notable trading fee savings. Holding and using RCOF for trading operations becomes financially beneficial since the more tokens a user owns, the greater the discount they get. Discover The Potential Of RCO Finance’s AI Power For anyone wishing to engage in RCO Finance’s token presale now and join over 10,000 users already enjoying such improvements, these advantages are only the tip of the iceberg. RCOF investors get free access to RCO Finance’s AI-powered analytical tools, which let them examine more than 150,000 distinct asset classes using sophisticated data-driven insights and performance criteria. This means that investors will have the chance to tackle both traditional and digital asset markets, including stocks, real-world assets (RWAs) and the successful Bitcoin (BTC) and Ethereum (ETH) exchange-traded funds (ETFs). RCOF holders may also use the platform’s AI-powered Robo Advisor , a one-of-a-kind DeFi tool providing very precise prediction insights. By use of machine learning algorithms, this tool creates tailored investment plans and modifies asset allocations to maximize performance, hence providing specific financial goals matching personal investment and trading suggestions. With the Robo Advisor, investors may control their portfolios efficiently across both conventional and cryptocurrency markets since it removes emotional biases and finds market trends human experts could miss. Investors can thus grab early chances in trendy cryptocurrencies, much as memecoins with possible exponential growth, as possibilities can be exploited only by traders using the advanced technologies of the Robo Advisor. The crypto market offers comparable possibilities around the clock, all year long; the Robo Advisor can assist in capturing them, maybe changing a $500 portfolio into $1 million in a fairly short period. Time Is Running Out The privacy-first atmosphere is another major advantage for investors taking part in RCOF’s token presale. Prioritizing user privacy and anonymity, RCO Finance runs in a know-your-customer (KYC)-free environment. Plus, continuous smart contract audits conducted by SolidProof, a leader in this space, ensures global regulatory compliance and the seamless operation of RCO Finance’s ecosystem for users worldwide. Since the first stage of the token presale, early investors have already witnessed a 700% rise in their investments. Those lucky enough to buy RCOF coins at this moment, however, are still set for significant short-term returns. Experts forecast a 600% growth for RCOF and its investors once listed on major crypto exchanges this year, as the token is expected to climb from $0.10 to $0.60, driven by increasing institutional interest and the platform’s services. This indicates that there is still an opportunity to engage. Participate in RCO Finance’s token presale now to be ahead of the curve before it is too late. For more information about the RCO Finance (RCOF) Presale: Visit RCO Finance Presale Join The RCO Finance Community The post RCO Finance’s Token Presale Is Gaining Institutional Attention And It’s Not Too Late to Join appeared first on TheCoinrise.com .",Token Presale and ICO Insights|RCO Finance,EN,0,0,BTC|BUSINESS|ETH|MARKET|TRADING,"{'name': 'The Coin Rise', 'img': 'https://images.cryptocompare.com/news/default/thecoinrise.png', 'lang': 'EN'}",thecoinrise,2025-04-13 23:00:33
43305624,https://ambcrypto.com/?p=482416,1744585241,https://images.cryptocompare.com/news/default/ambcrypto.png,PEPE’s golden cross: A sign for a rally to $0.0000078?,https://ambcrypto.com/pepes-golden-cross-a-sign-for-a-rally-to-0-0000078/,Is a profit-taking dip looming just beneath the surface?,Memecoins|News|News 1|Pepe|Social|Trading View|ambcrypto,EN,0,0,TRADING|PEPE,"{'name': 'AMB Crypto', 'img': 'https://images.cryptocompare.com/news/default/ambcrypto.png', 'lang': 'EN'}",ambcrypto,2025-04-13 23:00:41
43305786,https://en.bitcoinsistemi.com/?p=160567,1744585371,https://resources.cryptocompare.com/news/81/43305786.jpeg,"$1,000 Portfolio in Q2: XRP, SOL, and BTC All Eyeing New Highs",https://en.bitcoinsistemi.com/1000-portfolio-in-q2-xrp-sol-and-btc-all-eyeing-new-highs/,"With Q2 2025 underway, the crypto market is regaining steam—and names like XRP , Solana (SOL) , and Bitcoin (BTC) are again on every smart investor’s radar. These blue-chip plays are aiming for new highs, and they continue to attract institutional and retail money alike. But if you’re putting $1,000 into crypto right now , one opportunity stands far above the rest: MAGACOINFINANCE —the fast-growing altcoin project still under $0.001 , built for breakout momentum and real ROI. FINAL CALL — ACT NOW & SECURE YOUR SPOT! Beyond BTC and XRP: MAGACOINFINANCE Leads The ROI Charge XRP is currently trading around $1.99 , and while it could climb back to $5, the best-case scenario offers a 3x–4x return . Solana (SOL) , priced at $182 , may push to $600 by year-end, with a 3x upside if market sentiment stays bullish. Bitcoin (BTC) , sitting above $81,000 , still has long-term potential—but at most, analysts are projecting a 2x–3x return from here. Compare that with MAGACOINFINANCE , which is priced at just $0.0002909 and targeting a confirmed listing at $0.007 . That’s a 25x return locked in before public launch . And with the MAGA50X promo code giving investors an extra 50% bonus, the total upside reaches a staggering 3,745% . PRESALE SELLING OUT- CLICK HERE TO SECURE A SPOT Stage 7 Is Live — MAGACOINFINANCE Is Moving Fast MAGACOINFINANCE is in Stage 7 now , right after a full Stage 6 sellout. Over 12,500 investors are already in, and the current wave is filling quickly. The project has momentum, price positioning, and hype on its side. No other asset in the current market gives investors this kind of leverage on a $1,000 portfolio. Current Price: $0.0002909 Target Listing: $0.007 ROI: 25x standard, up to 3,745% with MAGA50X Over 12,500 holders and growing Still under $0.001 — but not for long ADA , SUI , and BCH are worth tracking, but none offer the explosive setup or early-stage power that MAGACOINFINANCE brings to Q2. This is where small capital meets massive potential. FINAL HOURS: CLAIM 50% EXTRA BONUS — CODE MAGA50X Conclusion As the cryptocurrency market continues to evolve, both established and emerging digital assets present unique opportunities. While Bitcoin (BTC) , Ripple (XRP) , and Solana (SOL) pursue growth strategies, MAGACOINFINANCE distinguishes itself with its innovative approach and attractive pre-sale incentives. Investors are encouraged to conduct thorough research, stay informed about market trends, and consider diversifying their portfolios to navigate this dynamic landscape effectively. Website: magacoinfinance.com Twitter/X: https://x.com/magacoinfinance Continue Reading: $1,000 Portfolio in Q2: XRP, SOL, and BTC All Eyeing New Highs",Sponsored,EN,0,0,BTC|BUSINESS|SOL|XRP|ZRX,"{'name': 'BitcoinSistemi', 'img': 'https://resources.cryptocompare.com/news/81/default.png', 'lang': 'EN'}",bitcoinsistemi,2025-04-13 23:02:51
43305887,https://coingape.com/?p=248430,1744585845,https://images.cryptocompare.com/news/default/coingape.png,Mantra Team Responds As The OM Token Price Crashes Over 80% In 24 Hours,https://coingape.com/mantra-team-responds-as-the-om-token-price-crashes-over-80-in-24-hours/,"The Mantra team has addressed the crypto community following the Mantra (OM) token price crash of over 80% in the last 24 hours. Despite the statement, the community is still concerned that this might have been a rug pull by the team, which controls a huge amount of the token’s total supply. Mantra Team Responds Following Token Crash In an X post , the Mantra team assured the community that the token is “fundamentally strong” despite the crash that occurred in the last 24 hours. The team blamed the crash on “reckless liquidations” and denied it had anything to do with the project. They further assured that this had nothing to do with the team and revealed that they were looking into the Mantra price crash and would share more details about what happened as soon as possible. In an X post, the project’s co-founder, John Patrick Mullin, further revealed that there was a massive forced liquidation from a large OM investor on a Centralized Exchange (CEX). However, he didn’t reveal whether it was one of the top crypto exchanges . In another X post, Mullin tried to set the record straight. He stated that they didn’t delete the Telegram channel. He further remarked that the team’s tokens all remain in custody and provided a wallet address (mantra…..quam) for community members to verify this claim. The Mantra co-founder added that they are actively figuring out why these massive forced liquidations occurred and will provide more information as soon as possible. He assured that they are still here and not going anywhere. Mantra Price Crashes By Over 80% In 24 Hours CoinMarketCap data shows that the Mantra price has crashed by over 80% in the last 24 hours. The token sharply dropped from an intra-day high of $6.3 to as low as $0.4. However, it has reclaimed the $1 price level following the team’s statement. However, amid this statement, some community members still seem convinced that this was a rug pull, as the team controls a huge amount of the token’s supply. Crypto commentator Sjuul described the OM token as the LUNA of this cycle. He further explained why the community believes the crash was a rug pull, stating that the crash began when a wallet believed to be connected to the team suddenly deposited 3.9 million OM tokens to the OKX crypto exchange. This deposit led to significant selling pressure, which caused the Mantra price to crash. Besides the token’s crash, the broader crypto market is witnessing a downtrend following US President Donald Trump’s statement in which he debunked reports of an exemption. This comes just a day after the crypto market rebounded following reports that the US president had exempted computers, phones, and chips from his tariffs on China and other countries. The post Mantra Team Responds As The OM Token Price Crashes Over 80% In 24 Hours appeared first on CoinGape .",24/7 Cryptocurrency News|Altcoin News|MANTRA (OM)|MANTRA (OM) price,EN,0,0,EXCHANGE|MARKET|REGULATION|TRADING|OM,"{'name': 'CoinGape', 'img': 'https://images.cryptocompare.com/news/default/coingape.png', 'lang': 'EN'}",coingape,2025-04-13 23:10:45
43306395,https://timestabloid.com/?p=63954,1744586451,https://resources.cryptocompare.com/news/67/default.png,Here’s the New Largest Single XRP Wallet Holder,https://timestabloid.com/see-who-beats-ripple-to-become-largest-single-xrp-wallet-holder/,"Xaif (@Xaif_Crypto), a well-known crypto influencer on X, has brought attention to a notable change in the XRP ecosystem. According to the data he posted , Uphold has become the largest known XRP holder, overtaking Ripple and major exchanges like Bithumb and Binance in wallet holdings. The exchange’s wallet now holds over 2 billion XRP, with a reported value of approximately $3.7 billion. The address shared by Xaif is confirmed to be associated with Uphold and displays a total XRP balance of 1,833,932,521 XRP. The wallet was last active on April 11, 2025, at 9:54 PM UTC, indicating it is actively maintained. BREAKING: Uphold Surpasses Ripple! Uphold Becomes the Largest $XRP Holder Reveals over 2 Billion XRP in balance — worth $3.7 Billion! pic.twitter.com/Kn1xbTJOyP — 𝕏aif | (@Xaif_Crypto) April 12, 2025 Uphold’s Pro-XRP Stance Reinforced Uphold has long maintained a clear position supporting XRP, notably continuing to list and provide access to the asset during Ripple’s now-concluded legal conflict with the U.S. Securities and Exchange Commission. Throughout that period, Uphold did not delist or restrict access to the asset, and that loyalty has not gone unnoticed by the XRP community. Uphold’s accumulation of over 2 billion XRP further reinforces its alignment with long-term XRP holders and confidence in the asset’s future utility. Uphold has consistently supported and encouraged the XRP army and has put its money where its mouth is with its strong support and large holdings. Uphold Surpasses Ripple’s Holdings Although Ripple still controls a large volume of XRP through its escrow mechanisms and company wallets, Uphold holds the most significant number of tokens in a single wallet, with recent data putting Ripple’s holdings as the fourth and fifth largest. We are on twitter, follow us to connect with us :- @TimesTabloid1 — TimesTabloid (@TimesTabloid1) July 15, 2023 While Uphold has achieved this feat, Ripple still holds over 36 billion XRP in its escrow system. While Ripple maintains substantial holdings through escrow and company-controlled wallets, this latest development highlights how exchanges like Uphold take the lead among the XRP army. This shift signals a growing role for private platforms in distributing large-scale XRP holdings. Uphold’s accumulation reflects a deliberate approach to long-term positioning within the XRP ecosystem. Implications for XRP’s Future The presence of an exchange at the top of the XRP wallet rankings could influence how institutional and retail participants assess the asset’s distribution. Uphold’s visible support and sustained involvement may strengthen its standing among XRP holders while reinforcing confidence in the token’s infrastructure and accessibility. Disclaimer : This content is meant to inform and should not be considered financial advice. The views expressed in this article may include the author’s personal opinions and do not represent Times Tabloid’s opinion. Readers are urged to do in-depth research before making any investment decisions. Any action taken by the reader is strictly at their own risk. Times Tabloid is not responsible for any financial losses. Follow us on X , Facebook , Telegram , and Google News The post Here’s the New Largest Single XRP Wallet Holder appeared first on Times Tabloid .",Cryptocurrency|News|Ripple|Uphold|XRP|XRP Holders,EN,0,0,EXCHANGE|REGULATION|XRP|RESEARCH|BNB,"{'name': 'TimesTabloid', 'img': 'https://resources.cryptocompare.com/news/67/default.png', 'lang': 'EN'}",timestabloid,2025-04-13 23:20:51
43306458,https://news.bitcoin.com/?p=719212,1744587049,https://resources.cryptocompare.com/news/14/43306458.jpeg,Senate Democrats Propose Emissions Caps on Crypto Mining and AI Data Centers,https://news.bitcoin.com/senate-democrats-propose-emissions-caps-on-crypto-mining-and-ai-data-centers/,"Democratic Senators Sheldon Whitehouse and John Fetterman introduced the “Clean Cloud Act of 2025” this week, proposing regional emissions limits and financial penalties for cryptocurrency mining operations and artificial intelligence (AI) data centers that exceed environmental standards. Senate Bill Aims to Impose Fines on High-Emitting Crypto Mines and Data Centers The bill, formally titled the",Mining|Bitcoin (BTC)|mining,EN,0,0,MINING|REGULATION,"{'name': 'Bitcoin.com', 'img': 'https://images.cryptocompare.com/news/default/bitcoincom.png', 'lang': 'EN'}",bitcoin.com,2025-04-13 23:30:49
43306684,https://en.coin-turk.com/?p=188937,1744587607,https://resources.cryptocompare.com/news/79/43306684.jpeg,Binance Pushes for Lighter Regulations in Crucial Meeting with U.S. Officials,https://en.coin-turk.com/binance-pushes-for-lighter-regulations-in-crucial-meeting-with-u-s-officials/,Binance is seeking to reduce regulatory oversight from U.S. authorities. Continue Reading: Binance Pushes for Lighter Regulations in Crucial Meeting with U.S. Officials The post Binance Pushes for Lighter Regulations in Crucial Meeting with U.S. Officials appeared first on COINTURK NEWS .,Binance,EN,0,0,EXCHANGE|BNB,"{'name': 'CoinTurk News', 'img': 'https://resources.cryptocompare.com/news/79/default.png', 'lang': 'EN'}",cointurken,2025-04-13 23:40:07
43308011,https://timestabloid.com/?p=63960,1744588280,https://resources.cryptocompare.com/news/67/default.png,Here’s Most Underrated Part of the XRP Ecosystem,https://timestabloid.com/heres-most-underrated-part-of-the-xrp-ecosystem/,"All Things XRP (@XRP_investing), a well-known figure in the XRP community, recently emphasized the overlooked role of automated market maker (AMM) liquidity pools within the XRP Ledger. According to the analyst, these pools absorb increasing amounts of XRP, effectively removing them from the circulating supply. This observation brings attention to a critical factor in XRP’s evolving market structure. As more liquidity pools go live, the amount of XRP locked in them grows, gradually shrinking the available supply. This shift comes as the XRP Ledger (XRPL) continues to evolve with DeFi capabilities, particularly since the launch of AMM features during an upgrade in 2024. IMPORTANT: I CAN’T STRESS THIS ENOUGH: AMM liquidity pools are the most underrated part of the XRP ecosystem. Why? Because XRP used in these pools is LOCKED UP. It’s not circulating. It’s not selling. It’s gone. And as more assets get tokenized… That locked supply… — All Things XRP (@XRP_investing) April 12, 2025 Supply Reduction via Liquidity Pools The design of AMM pools on the XRP Ledger requires participants to commit XRP in exchange for yield. Once deposited, that XRP remains in the pool and cannot be used elsewhere unless withdrawn. The longer this XRP stays in AMMs, the less of it remains in active circulation. This is particularly relevant as many participants provide liquidity for extended periods to earn passive income. While the digital asset’s total supply remains fixed at 100 billion tokens, only a portion is circulating due to Ripple’s large holdings of escrowed XRP. Liquidity pools now introduce a mechanism by which even circulating XRP becomes temporarily inaccessible. We are on twitter, follow us to connect with us :- @TimesTabloid1 — TimesTabloid (@TimesTabloid1) July 15, 2023 This effectively functions as a supply reduction mechanism. As the tokenization of assets grows on the XRPL, more users are expected to provide liquidity across a range of asset pairs, which may further expand the number of tokens locked away. Impact of the Increased Demand On XRP With tokenization gaining traction across institutional and retail segments, demand for XRP’s underlying infrastructure may increase. If this growth coincides with a shrinking liquid supply due to liquidity pooling, the balance between supply and demand could shift. “When demand rises while supply falls… price has to move,” All Things XRP noted. This scenario depends on the broader adoption of the AMM system and the continued growth of tokenized asset markets using the XRP Ledger. If both trends hold, the XRP locked in pools could play a more direct role in supporting upward price movement by limiting immediate sell pressure. Before the launch, Ripple CTO David Schwartz stated that he was personally excited about the AMM upgrade, and the positive effects show that Ripple’s development team is making the best moves for the digital asset’s long-term future. Disclaimer : This content is meant to inform and should not be considered financial advice. The views expressed in this article may include the author’s personal opinions and do not represent Times Tabloid’s opinion. Readers are urged to do in-depth research before making any investment decisions. Any action taken by the reader is strictly at their own risk. Times Tabloid is not responsible for any financial losses. Follow us on X , Facebook , Telegram , and Google News The post Here’s Most Underrated Part of the XRP Ecosystem appeared first on Times Tabloid .",Cryptocurrency|News|XRP,EN,0,0,MARKET|MINING|TRADING|WALLET|XRP,"{'name': 'TimesTabloid', 'img': 'https://resources.cryptocompare.com/news/67/default.png', 'lang': 'EN'}",timestabloid,2025-04-13 23:51:20
43307020,https://en.coinotag.com/breakingnews/trumps-tariffs-threaten-dollar-stability-amid-trade-war-uncertainty/,1744588283,https://resources.cryptocompare.com/news/77/43307020.jpeg,Trump’s Tariffs Threaten Dollar Stability Amid Trade War Uncertainty,https://en.coinotag.com/breakingnews/trumps-tariffs-threaten-dollar-stability-amid-trade-war-uncertainty/,"On April 14th, COINOTAG News reported that the recent suspension of tariffs on popular consumer electronics has provided a temporary buffer for the **U.S. dollar**, which had been experiencing significant",,EN,0,0,FIAT,"{'name': 'CoinOtag', 'img': 'https://resources.cryptocompare.com/news/77/default.png', 'lang': 'EN'}",coinotag,2025-04-13 23:51:23
43307141,https://en.coinotag.com/breakingnews/trumps-warning-no-country-escapes-punishment-over-trade-deficits-as-america-prepares-for-a-golden-era/,1744588650,https://resources.cryptocompare.com/news/77/43307141.jpeg,Trump’s Warning: No Country Escapes Punishment Over Trade Deficits as America Prepares for a Golden Era,https://en.coinotag.com/breakingnews/trumps-warning-no-country-escapes-punishment-over-trade-deficits-as-america-prepares-for-a-golden-era/,"In a recent statement on social media, former President Trump emphasized the need for equitable trade practices, asserting that no nation will be allowed to “escape punishment” for its persistent",,EN,0,0,REGULATION,"{'name': 'CoinOtag', 'img': 'https://resources.cryptocompare.com/news/77/default.png', 'lang': 'EN'}",coinotag,2025-04-13 23:57:30
