id,guid,published_on,imageurl,title,url,body,tags,lang,upvotes,downvotes,categories,source_info,source,date
43304218,https://www.cryptopolitan.com/?p=709105,1744581600,https://resources.cryptocompare.com/news/43/43304218.jpeg,Solana Price Prediction: Why SOL and This Viral Token Could 50x Before The Next Bitcoin Halving,https://www.cryptopolitan.com/why-sol-and-this-viral-token-could-50x-before-the-next-bitcoin-halving/,"As the crypto market continues to change in 2025, Solana (SOL), currently priced around $107, is gaining attention for its potential to experience a strong rebound. Despite some market fluctuations, Solana could soar to new heights, potentially reaching over $300 by the time of the next Bitcoin halving. However, the next big disruptor in the crypto market is Mutuum Finance (MUTM). The fourth phase of Mutuum Finance presale continues while this high-growth altcoin sells for $0.025 and has collected $6.6 million. The next stage of the presale will boost MUTM’s price to $0.03 while attracting more than 8200 investors. The initial investors during this phase will receive a 140% payback when the launch price reaches $0.06. A DeFi Giant on the Rise Mutuum Finance pushes forward decentralized lending through dual lending while promoting mass adoption because of its transformative structure. More than 8200 investors joined the presale funding to support the project which received $6.6 million in total. Mutuum Finance’s price currently reaches $0.025 in Phase 4 even though investors anticipate a 20% price increase in Phase 5 which will generate considerable profit potential. The analysts forecast MUTM to surge beyond $5 in upcoming months when it launches at $0.06 because its distinctive lending approach meets rising market requirements thus making it an underappreciated yet promising DeFi resource. MUTM has introduced tangible features, including a new dashboard leaderboard that tracks its top 50 holders, who will be rewarded with bonus tokens for maintaining their rank. As investors grow more utility-focused, MUTM’s rise signals what could be the next win in crypto, substance over spectacle. The Dual-Model System for Enhanced DeFi Lending Mutuum Finance transforms DeFi lending through the combination of Peer-to-Contract (P2C) and Peer-to-Peer (P2P) lending systems. Through the P2C model users can achieve passive income by lending their USDT through liquidity pools that operate automatically through smart contracts. The P2P model provides transactions which operate without intermediaries allowing users to personally manage their assets through direct deals. Mutuum Finance unites P2C and P2P lending methods to secure and streamline its decentralized operation thus creating profitable opportunities for investors looking to maximize yield in DeFi. Friendly Tokenomics for Lasting Expansion Tokenomics in the project follows a strategy designed for both limited token circulation management and continuous appreciation of value. The presale limitation combined with anti-inflationary procedures enables Mutuum Finance to establish scarcity which creates possible upward token value potential. Staking rewards users for token involvement by delivering valuable incentives that strengthen the ecosystem sustainability of its native token. To attract more community members Mutuum Finance implements profitable incentive programs at an aggressive pace. The program will use $100,000 to give ten investors $10,000 worth of MUTM tokens and the referral system gives rewards to users who bring in new investors to the platform. The platform gives early supporters exclusive benefits including staking pools and governance rights and VIP-exclusive updates to enhance their connection with the platform. A Reliable and Secure Financial Network Mutuum Finance creates a launch plan for its new collateralized USD-backed stablecoin developed for Ethereum blockchain usage. Insolvency risks that threaten algorithmic stablecoins will not affect this over-collateralized asset because it will maintain long-term reliability. A complete audit system of smart contracts together with transparent financial mechanisms establishes trust with investors as it fixes numerous security problems observed with past decentralized finance projects. While Solana (SOL) is primed for a potential rebound, reaching over $300 by the next Bitcoin halving, Mutuum Finance (MUTM) could outperform expectations with a forecasted 50x growth. The fourth phase of its presale has already raised $6.6 million, with MUTM tokens priced at $0.025 and set to rise to $0.06 at launch. Don’t miss out on this high-growth opportunity. For more information about Mutuum Finance (MUTM) visit the links below: Website: https://www.mutuum.finance/ Linktree: https://linktr.ee/mutuumfinance",Press Release,EN,0,0,BTC|BUSINESS|SOL|TRADING|ZRX,"{'name': 'Cryptopolitan', 'img': 'https://images.cryptocompare.com/news/default/cryptopolitan.png', 'lang': 'EN'}",cryptopolitan,2025-04-13 22:00:00
43304102,https://thecoinrise.com/blockdag-presale-crosses-214m-mark-after-keynote-3-btc-eth-drop-15-in-3-months/,1744581607,https://resources.cryptocompare.com/news/60/43304102.jpeg,"BlockDAG Presale Crosses $214M Mark After Keynote 3, BTC & ETH Drop 15% in 3 Months",https://thecoinrise.com/blockdag-presale-crosses-214m-mark-after-keynote-3-btc-eth-drop-15-in-3-months/,"Crypto’s unpredictable nature continues to shape market sentiment, and the past three months have reinforced that reality. Bitcoin, widely seen as the bedrock of the digital asset space, has experienced a notable retreat in price and market cap. Ethereum, though still central to DeFi and smart contracts, has taken an even steeper fall. These movements are prompting investors to reconsider where momentum is truly building. That’s where BlockDAG enters the picture. While many projects remain in the concept stage, BlockDAG is actively rolling out products—its Beta Testnet is live, its miner app has attracted hundreds of thousands, and over 19.2 billion coins have already sold during presale. With $214 million raised so far, BlockDAG is shaping the conversation—not just joining it. For a growing number of buyers, this isn’t a Bitcoin or Ethereum replacement—it’s a new contender with something concrete to offer. Bitcoin Faces Pressure, but Remains a Long-Term Anchor As of April 4, 2025, Bitcoin (BTC) is trading around $83,844 with a total market cap of $1.66 trillion. Just three months earlier, BTC was priced at $98,236 and carried a $1.95 trillion market cap. This marks a 14.7% drop in value and a 14.5% market cap decline over the quarter. Despite the correction, Bitcoin still holds firm as a long-term play. Compared to the same time last year, its market cap has grown nearly 28%—a sign of continued institutional and retail belief. As the original cryptocurrency, it maintains its leadership by market size, even during temporary downtrends. Ethereum Sees a 50% Slide, but Fundamentals Remain Solid Ethereum (ETH) currently sits at $1,805 with a market capitalization of $218.4 billion. Three months ago, ETH was trading at $3,658 with a $440.7 billion market cap. That’s a steep drop—down 50.6% in price and 50.4% in market cap during the first quarter of 2025. This pullback follows a strong year in 2024 and reflects wider market corrections. Yet, Ethereum continues to lead in smart contracts, NFTs, and DeFi. Its scaling solutions and Layer-2 developments are progressing steadily. Although its market cap has declined about 45% year-over-year, Ethereum still holds a central role in Web3’s future. BlockDAG’s Presale Soars Past $214M After Keynote 3 Rollout BlockDAG’s third Keynote wasn’t just an update—it was a game-changer. The live demo of its Beta “Primordial” Testnet and visuals of 10,000 ASIC miners being shipped sent a strong message: this project is executing. With 750,000 users mining via the X1 App and 400,000 playing Tap Miner, the user base is expanding rapidly. In the days following the Keynote, presale numbers surged. BlockDAG crossed $214 million raised, with over 19.2 billion coins sold. At the current Batch 27 price of $0.0248, early adopters have already realized a 2,380% ROI since Batch 1. These aren’t projected gains—they’re realized returns backed by working tech. This kind of growth, coupled with tangible milestones, has made BlockDAG one of the most talked-about presales in crypto. Its hybrid DAG + PoW structure, active user adoption, and clear development roadmap are building serious momentum. Each batch increases in price, meaning delayed action equals higher cost. Keynote 3, for many, was the clear signal to act. With credible infrastructure, a growing ecosystem, and real-time delivery, BlockDAG is attracting buyer interest not by hype—but by proving value. Buyers Are Watching Where Progress Happens While Bitcoin and Ethereum remain dominant names, their recent pullbacks have prompted investors to explore other options. The focus is now shifting toward projects that are actively building and delivering results—something BlockDAG has made central to its strategy. With a working Testnet, a highly engaged community, and $214 million raised, BlockDAG is moving beyond potential—it’s becoming reality. This isn’t about dethroning the giants, but rather identifying where the next wave of growth may come from. As others consolidate or tread water, BlockDAG is advancing on all fronts. In 2025, that kind of momentum is exactly what forward-looking buyers are tracking. Presale: https://purchase.blockdag.network Website: https://blockdag.network Telegram: https://t.me/blockDAGnetworkOfficial Discord: https://discord.gg/Q7BxghMVyu The post BlockDAG Presale Crosses $214M Mark After Keynote 3, BTC & ETH Drop 15% in 3 Months appeared first on TheCoinrise.com .",Token Presale and ICO Insights|BlockDAG,EN,0,0,BTC|BUSINESS|ETH|MARKET|TRADING,"{'name': 'The Coin Rise', 'img': 'https://images.cryptocompare.com/news/default/thecoinrise.png', 'lang': 'EN'}",thecoinrise,2025-04-13 22:00:07
43304069,https://en.bitcoinsistemi.com/?p=160519,1744581636,https://resources.cryptocompare.com/news/81/43304069.jpeg,"Whales Pump Solana, XRP Nears $2.50 – BlockDAG Users Earn USDT on Repeat with Just $100",https://en.bitcoinsistemi.com/whales-pump-solana-xrp-nears-2-50-blockdag-users-earn-usdt-on-repeat-with-just-100/,"What if the biggest crypto gains right now aren’t from buying—but from sharing? While the Solana (SOL) price today just spiked to $118 on fresh whale activity and XRP technical analysis points to a bullish breakout after Ripple’s $1.25B Hidden Road acquisition, another opportunity is quietly stacking up returns under the radar. BlockDAG , already climbing presale charts with over $214 million raised, now has users buzzing—not just for its coin, but for its affiliate loop. The model? Earn USDT instantly by referring others, then reinvest it to scoop up more BDAG coins. It’s turning $100 into a snowball effect—“USDT in, BDAG up.” Crypto circles are calling it a launchpad with ROI baked in. It’s the kind of setup that’s catching attention from everyone tracking the next top 10 crypto—and it’s happening while most are still watching charts. The Passive Income Loop That’s Fueling BlockDAG’s Growth BlockDAG’s affiliate program is quickly becoming the easiest passive earning play in crypto. With just one referral link, users are getting paid in USDT instantly every time someone buys BDAG coins. But it’s not just about earning—those rewards can be immediately reinvested, creating a compounding loop where your holdings grow without extra effort. It’s why people are saying, “USDT in, BDAG up.” The program lets you earn 6% to 10% cashback per referral, with no cap on how many people you bring in. What makes it different is how fast it works—rewards hit your wallet right after a qualifying buy, and there’s no waiting period or payout limit. People are literally using the same $100 five times—and getting paid each time. It’s simple: share, earn, reinvest, repeat. BlockDAG’s presale is now in its 27th batch, with BDAG priced at $0.0248. Over 19.2 billion coins have been sold, raising more than $214 million—all without any venture capital. Those who joined early are already up over 2,380%. The presale is tied to key launches too, with a beta testnet live, a 150% retro bonus for all buyers, and listings planned on 10 major CEXs. With momentum this strong, it’s no surprise that BlockDAG is being discussed as a top 10 crypto contender. Its affiliate model is adding fuel to that push, creating a snowball effect of users stacking BDAG while they sleep. For anyone eyeing the next top 10 crypto, this loop might be the real alpha. Solana (SOL) Price Today Spikes After Whale Buy Solana (SOL) price today jumped 8% to $118 after a whale snapped up 32,000 SOL for $3.72 million, according to Lookonchain. This sudden move came after weeks of downward pressure and has put Solana back in focus as traders speculate whether it’s building toward another rally. The same whale had also bought at higher levels before—$157 and $216—suggesting long-term confidence despite market dips. Supporters are watching key technical levels, with $112 recently breaking down and $118 now acting as potential resistance. However, the Firedancer upgrade, expected to improve Solana’s speed and scalability, could be a game-changer. Solana (SOL) price today is still far below its all-time high, but the bullish setup around whale accumulation, ETF rumors, and inclusion in U.S. digital asset funds is creating buzz. If the trend holds, SOL could challenge higher zones soon, especially if it breaks resistance and finds support above key EMAs. XRP Technical Analysis Turns Bullish After SEC Update XRP just jumped 30% after Ripple and the SEC filed a joint motion to pause their legal appeals, hinting that a long-awaited settlement could be close. Adding fuel to the rally, Ripple announced a $1.25 billion acquisition of Hidden Road, a London-based prime brokerage. This move is expected to boost institutional liquidity and support the rollout of Ripple’s stablecoin RLUSD through Hidden Road’s global network. According to XRP technical analysis, the token has broken above its 50-day moving average for the first time in months and is now trading at $2.00. Analysts are eyeing $2.50 as the next resistance zone, while support holds near $1.50. The RSI is nearing 65, showing bullish strength but hinting at a possible cooldown. Still, with over 70 financial institutions already using Ripple’s cross-border payment network and the legal case nearly resolved, XRP technical analysis now supports a potential breakout scenario in the weeks ahead. Summing Up Solana (SOL) price today is holding above $118 after a major whale buy, with the Firedancer upgrade and ETF speculation keeping bullish interest alive. Meanwhile, XRP technical analysis shows strength after Ripple’s $1.25 billion Hidden Road deal and signs of a legal settlement with the SEC. Both networks are gaining momentum, but they still face short-term resistance and volatility. That’s where BlockDAG shifts the game. Its affiliate loop is turning everyday users into repeat earners with instant USDT payouts. People are reinvesting cashback to grow their bags while the presale has already raised $214M and BDAG is still only at $0.0248. This isn’t just referral income—“USDT in, BDAG up” is becoming the playbook. For anyone eyeing the next top 10 crypto, BlockDAG’s model is creating a real shot at compounding gains. This is more than promotion—it’s a loop with built-in momentum and a clear path to scaling while others just trade. Presale: https://purchase.blockdag.network Website: https://blockdag.network Telegram: https://t.me/blockDAGnetworkOfficial Discord: https://discord.gg/Q7BxghMVyu Continue Reading: Whales Pump Solana, XRP Nears $2.50 – BlockDAG Users Earn USDT on Repeat with Just $100",Sponsored,EN,0,0,MARKET|SOL|TRADING|USDT|XRP,"{'name': 'BitcoinSistemi', 'img': 'https://resources.cryptocompare.com/news/81/default.png', 'lang': 'EN'}",bitcoinsistemi,2025-04-13 22:00:36
43304322,https://news.bitcoin.com/?p=719218,1744582218,https://resources.cryptocompare.com/news/14/43304322.jpeg,"4.5M ETH Burned, Yet Supply Grows: Ethereum’s Deflation Dilemma",https://news.bitcoin.com/4-5m-eth-burned-yet-supply-grows-ethereums-deflation-dilemma/,"Three years after Ethereum’s London Hard Fork aimed to curb supply growth, the network remains inflationary, defying initial deflationary promises. Ether’s Deflation Promise Continues to Remain Unmet As of April 13, 2025, Ethereum’s net ETH supply has grown by 0.805% annually since the London Hard Fork in August 2021, with 3,477,830.85 ETH added to circulation.",Crypto News|Blockchain|Ethereum (ETH),EN,0,0,BLOCKCHAIN|ETH|FORKS,"{'name': 'Bitcoin.com', 'img': 'https://images.cryptocompare.com/news/default/bitcoincom.png', 'lang': 'EN'}",bitcoin.com,2025-04-13 22:10:18
43304396,https://en.bitcoinsistemi.com/confusing-statements-from-the-trump-administration-on-tariffs-again-us-secretary-of-commerce-speaks-today/,1744582507,https://resources.cryptocompare.com/news/81/43304396.jpeg,Confusing Statements from the Trump Administration on Tariffs Again: US Secretary of Commerce Speaks Today,https://en.bitcoinsistemi.com/confusing-statements-from-the-trump-administration-on-tariffs-again-us-secretary-of-commerce-speaks-today/,"The Trump administration's temporary tariff exemption for consumer electronics such as smartphones and computers is expected to expire soon, according to U.S. Commerce Secretary Howard Lutnick. Speaking on ABC's This Week today, Lutnick explained that smartphones, laptops and other key consumer electronics were temporarily exempted from high import tariffs earlier this month, but that the exemption would never become permanent. “All of these products will fall under semiconductors and will have a special focus tariff to ensure the resupply of these products,” Lutnick said. Related News: Ethereum Founder Vitalik Buterin Praises This Altcoin Unknown to Most New duties targeting semiconductors and electronic components are expected to be implemented next month, and additional duties on pharmaceuticals will follow in one to two months, Lutnick added. The administration’s overall goal is to bolster domestic manufacturing in sectors vital to national security, including chipmaking and flat-panel manufacturing. “We need chips, we need flat panels, we need them made in America,” Lutnick said. The statements came just days after U.S. Customs and Border Protection issued a bulletin late Friday confirming temporary exemptions for a number of electronics from reciprocal tariffs that President Donald Trump announced at the beginning of the month. *This is not investment advice. Continue Reading: Confusing Statements from the Trump Administration on Tariffs Again: US Secretary of Commerce Speaks Today",Economy|News,EN,0,0,ALTCOIN|BUSINESS|ETH|REGULATION,"{'name': 'BitcoinSistemi', 'img': 'https://resources.cryptocompare.com/news/81/default.png', 'lang': 'EN'}",bitcoinsistemi,2025-04-13 22:15:07
