id,guid,published_on,imageurl,title,url,body,tags,lang,upvotes,downvotes,categories,source_info,source,date
40475901,https://cointelegraph.com/news/programmer-burn-eth-wikileaks-brain-computer-weapons,1739840671,https://images.cryptocompare.com/news/default/cointelegraph.png,"Whistleblower sends $2M ETH to WikiLeaks, alleging ‘brain-computer weapons’",https://cointelegraph.com/news/programmer-burn-eth-wikileaks-brain-computer-weapons?utm_source=rss_feed&utm_medium=rss&utm_campaign=rss_partner_inbound,A Chinese programmer who sent 711.5 Ether to WikiLeaks included a bizarre onchain message about his country’s military in the transfer.,,EN,0,0,ETH,"{'name': 'CoinTelegraph', 'img': 'https://images.cryptocompare.com/news/default/cointelegraph.png', 'lang': 'EN'}",cointelegraph,2025-02-18 01:04:31
40476724,207753,1739840700,https://resources.cryptocompare.com/news/68/40476724.jpeg,XrossRoad Announces Strategic Partnership with Berachain to Expand Japanese IP in Web3,https://chainwire.org/2025/02/18/xrossroad-announces-strategic-partnership-with-berachain-to-expand-japanese-ip-in-web3/,"Community-driven IP platform "" Xross Road "" and advanced AI technology provider "" Allora Network "" have formed a strategic partnership to accelerate business growth and success in the IP industry. Through this collaboration, the two companies will jointly develop next-generation AI x IP solutions leveraging AI technology to create a new dynamic between IP rights holders and the community. Background and Purpose of the Partnership While the IP (Intellectual Property) industry is rapidly growing outside of Japan, there is a need to update traditional management methods and development methods for a global audience due to the varying understanding of IP across cultures and legal frameworks. Xross Road aims to provide a platform where IP rights holders, fans, and creators can actively engage, and to fulfill this mission, it is building a new infrastructure utilizing AI and data analysis technology. On the other hand, Allora Network offers innovative technology in AI prediction models and data analysis, supported by a global community of data scientists. Through this partnership, the two companies will leverage data analysis to enhance the IP market, create customized user experiences, detect IP misuse, and develop new markets using AI Agents-ultimately shaping the future of the IP industry. Examples of AI Solutions Considerations Specific to the IP Industry: Detection and Protection of IP Misuse: AI automatically detects IP infringement on and off the platform, strengthening rights protection. Creation of New Markets by AI Agents: AI Agents, trained with IP characters, are deployed to create new revenue opportunities. IP Market Data Analysis: AI analyzes consumer preferences and trends to support optimal content development and licensing strategies. Customized User Experience for Customers: Personalized content and services are delivered using AI technology to enhance fan engagement. Future Prospects Xross Road aims to expand Japanese IP content into the global market while building stronger connections with fans. In collaboration with Allora Network, it will deliver innovative AI solutions and drive new value creation within the IP industry. About Xross Road Xross Road is a community-focused IP incubation and acceleration platform leveraging Web3 technology. Originally designed for Japanese IP fans, it aims to expand IP content globally. Xross Road is also strengthening its support for existing IPs and enhancing fan engagement, ushering in a new era for IP platforms. Official website: https://xross-road.com X (formerly Twitter): @xross__road About Allora Network Allora is a self-improving decentralized AI network. It enables applications to leverage smarter, more secure AI through a self-improving network of ML models. Combining innovations in crowdsourced intelligence, reinforcement learning, and regret minimization, Allora unlocks a vast new design space of applications at the intersection of crypto and AI. To learn more about Allora Network, users can visit the Allora website , X , Blog , Discord , Research Hub , and developer docs . Media & Business Inquiries For media coverage requests or IP collaboration inquiries, users can contact: extra mile Inc. Public Relations e-mail: web3-pr@extramile.jp Official website: https://extramile.jp/en/",Newsroom,EN,0,0,MARKET|TECHNOLOGY|BUSINESS|ASIA|REGULATION,"{'name': 'Chainwire', 'img': 'https://resources.cryptocompare.com/news/68/default.png', 'lang': 'EN'}",chainwire,2025-02-18 01:05:00
40475783,https://en.coinotag.com/chinese-programmer-allegedly-links-ether-donation-to-military-control-claims-in-bizarre-wikileaks-message/,1739840734,https://resources.cryptocompare.com/news/77/40475783.jpeg,Chinese Programmer Allegedly Links Ether Donation to Military Control Claims in Bizarre WikiLeaks Message,https://en.coinotag.com/chinese-programmer-allegedly-links-ether-donation-to-military-control-claims-in-bizarre-wikileaks-message/,"A recent high-profile transaction involving 711.5 Ether sent to WikiLeaks has sparked controversy, revealing alarming claims about China’s military involvement with advanced technology. The transaction, valued at approximately $2 million,",News,EN,0,0,ASIA|TECHNOLOGY,"{'name': 'CoinOtag', 'img': 'https://resources.cryptocompare.com/news/77/default.png', 'lang': 'EN'}",coinotag,2025-02-18 01:05:34
40475759,https://en.coin-turk.com/?p=183007,1739840749,https://resources.cryptocompare.com/news/79/40475759.jpeg,Binance Leaders Address Rumors and Outline Strategic Collaborations,https://en.coin-turk.com/binance-leaders-address-rumors-and-outline-strategic-collaborations/,Binance executives reject rumors of a sale and clarify ongoing collaborations. Yi He critiques competitor tactics and emphasizes strategic partnerships. Continue Reading: Binance Leaders Address Rumors and Outline Strategic Collaborations The post Binance Leaders Address Rumors and Outline Strategic Collaborations appeared first on COINTURK NEWS .,Binance,EN,0,0,BNB|EXCHANGE,"{'name': 'CoinTurk News', 'img': 'https://resources.cryptocompare.com/news/79/default.png', 'lang': 'EN'}",cointurken,2025-02-18 01:05:49
40475767,https://bitcoinworld.co.in/?p=130137,1739840762,https://resources.cryptocompare.com/news/82/default.png,XrossRoad Announces Strategic Partnership with Berachain to Expand Japanese IP in Web3,https://bitcoinworld.co.in/xrossroad-announces-strategic-partnership-with-berachain-to-expand-japanese-ip-in-web3/,"Community-driven IP platform “ Xross Road ” and advanced AI technology provider “ Allora Network ” have formed a strategic partnership to accelerate business growth and success in the IP industry. Through this collaboration, the two companies will jointly develop next-generation AI x IP solutions leveraging AI technology to create a new dynamic between IP rights holders and the community. Background and Purpose of the Partnership While the IP (Intellectual Property) industry is rapidly growing outside of Japan, there is a need to update traditional management methods and development methods for a global audience due to the varying understanding of IP across cultures and legal frameworks. Xross Road aims to provide a platform where IP rights holders, fans, and creators can actively engage, and to fulfill this mission, it is building a new infrastructure utilizing AI and data analysis technology. On the other hand, Allora Network offers innovative technology in AI prediction models and data analysis, supported by a global community of data scientists. Through this partnership, the two companies will leverage data analysis to enhance the IP market, create customized user experiences, detect IP misuse, and develop new markets using AI Agents-ultimately shaping the future of the IP industry. Examples of AI Solutions Considerations Specific to the IP Industry: Detection and Protection of IP Misuse: AI automatically detects IP infringement on and off the platform, strengthening rights protection. Creation of New Markets by AI Agents: AI Agents, trained with IP characters, are deployed to create new revenue opportunities. IP Market Data Analysis: AI analyzes consumer preferences and trends to support optimal content development and licensing strategies. Customized User Experience for Customers: Personalized content and services are delivered using AI technology to enhance fan engagement. Future Prospects Xross Road aims to expand Japanese IP content into the global market while building stronger connections with fans. In collaboration with Allora Network, it will deliver innovative AI solutions and drive new value creation within the IP industry. About Xross Road Xross Road is a community-focused IP incubation and acceleration platform leveraging Web3 technology. Originally designed for Japanese IP fans, it aims to expand IP content globally. Xross Road is also strengthening its support for existing IPs and enhancing fan engagement, ushering in a new era for IP platforms. Official website: https://xross-road.com X (formerly Twitter): @xross__road About Allora Network Allora is a self-improving decentralized AI network. It enables applications to leverage smarter, more secure AI through a self-improving network of ML models. Combining innovations in crowdsourced intelligence, reinforcement learning, and regret minimization, Allora unlocks a vast new design space of applications at the intersection of crypto and AI. To learn more about Allora Network, users can visit the Allora website , X , Blog , Discord , Research Hub , and developer docs . Media & Business Inquiries For media coverage requests or IP collaboration inquiries, users can contact: extra mile Inc. Public Relations e-mail: web3-pr@extramile.jp Official website: https://extramile.jp/en/",Press Release|BLOCKCHAIN|blockchain marketing|Crypto|PR,EN,0,0,MARKET|TECHNOLOGY|BUSINESS|ASIA|REGULATION,"{'name': 'Bitcoin World', 'img': 'https://resources.cryptocompare.com/news/82/default.png', 'lang': 'EN'}",bitcoinworld,2025-02-18 01:06:02
40475950,https://www.cryptonewsz.com/javier-milei-only-shared-information-libra/,1739841075,https://images.cryptocompare.com/news/default/cryptonewsz.png,"Javier Milei Defends $LIBRA Post Amid Controversy, Claims He Only ‘Shared’ Information",https://www.cryptonewsz.com/javier-milei-only-shared-information-libra/,"Argentine President Javier Milei has faced backlash after promoting the controversial cryptocurrency $LIBRA on social media, only to…",Celebrity,EN,0,0,REGULATION,"{'name': 'CryptoNewsZ', 'img': 'https://images.cryptocompare.com/news/default/cryptonewsz.png', 'lang': 'EN'}",cryptonewsz,2025-02-18 01:11:15
40476118,https://en.coinotag.com/bitcoins-price-could-dip-to-95-2k-before-possible-rebound-to-94k-or-recovery-toward-99k/,1739841353,https://resources.cryptocompare.com/news/77/40476118.jpeg,Bitcoin’s Price Could Dip to $95.2K Before Possible Rebound to $94K or Recovery Toward $99K,https://en.coinotag.com/bitcoins-price-could-dip-to-95-2k-before-possible-rebound-to-94k-or-recovery-toward-99k/,Bitcoin’s recent price fluctuations have drawn attention as it attempted to defend the crucial $95.5k level amidst low trading volume and market uncertainty. The ongoing bearish swing structure has implications,Bitcoin|News|AUCTION|BTC,EN,0,0,BTC|TRADING|MARKET,"{'name': 'CoinOtag', 'img': 'https://resources.cryptocompare.com/news/77/default.png', 'lang': 'EN'}",coinotag,2025-02-18 01:15:53
40476119,https://en.coinotag.com/breakingnews/ethereum-signals-potential-trend-reversal-against-bitcoin-says-lmax-strategist/,1739841421,https://resources.cryptocompare.com/news/77/40476119.jpeg,"Ethereum Signals Potential Trend Reversal Against Bitcoin, Says LMAX Strategist",https://en.coinotag.com/breakingnews/ethereum-signals-potential-trend-reversal-against-bitcoin-says-lmax-strategist/,"According to a report from COINOTAG on February 18, the prevailing market sentiment regarding Ethereum indicates a possible shift in its long-term trajectory against Bitcoin. LMAX Group’s market strategist, Joel",BTC|ETH,EN,0,0,BTC|ETH|MARKET,"{'name': 'CoinOtag', 'img': 'https://resources.cryptocompare.com/news/77/default.png', 'lang': 'EN'}",coinotag,2025-02-18 01:17:01
40476230,https://coingape.com/?post_type=markets&p=239483,1739841654,https://images.cryptocompare.com/news/default/coingape.png,Ripple (XRP) Price Risks $2.50 Reversal as Speculative Demand Subsides,https://coingape.com/markets/ripple-xrp-price-risks-2-50-reversal-as-speculative-demand-subsides/,"Ripple (XRP) price held firmly above the $2.65 mark on Monday, as bulls warded off bearish tailwinds from short-term traders who took profits when the US SEC acknowledged an XRP spot ETF on Feb. 13. Ripple (XRP) Tumbles 6% in 3-Days as Traders Take Profits on ETF Hype Ripple (XRP) price came under noticeable selling pressure over the weekend, as investors capitalized on the recent buzz surrounding a potential XRP spot ETF to lock in profits. The week began on a high note, with XRP surging by 22% between Feb. 10 and Feb. 14. Much of this upside momentum stemmed from renewed optimism that the US SEC’s acknowledgment of the Grayscale’s Dogecoin and XRP spot ETF filings could lead to an influx of institutional demand. However, the gains were short-lived. Hours after the official confirmation surfaced, XRP’s price retraced sharply, reflecting a classic “sell-the-news” scenario often observed in cryptocurrency markets. Ripple (XRP) Price Action The Ripple price action chart above highlights how quickly market sentiment can shift when major announcements fail to deliver immediate follow-through. Having reached a peak of $2.80 on Friday, XRP shed roughly 7% to trade at $2.60 by Monday morning. This rapid reversal indicates that, despite the bullish catalyst of the SEC acknowledgment, many short-term traders deemed the move overextended and chose to exit their positions. A look at the chart reveals three consecutive losing sessions since the ETF acknowledgment. This pullback underscores the delicate balance between bullish optimism over potential regulatory breakthroughs and the reality of profit-taking by short-term traders. As is often the case in crypto markets, a single catalyst can spark both surges and sell-offs in quick succession, leaving the long-term direction in question. Still, XRP’s ability to remain above the $2.60–$2.65 support zone has provided a degree of optimism. While the market has witnessed a steady outflow of speculative capital, the robust bid at these price levels suggests that buyers remain prepared to defend XRP against further declines. Whether this support will hold if the broader market sentiment sours remains to be seen, but for now, it has acted as a buffer against a steeper correction. The price reversal in recent days may also reflect a typical pattern in cryptocurrency trading, where investors buy the rumor (or hype) and sell the news. Once the acknowledgment of the ETF filing was made public, many short-term speculators who had been anticipating a more substantial surge found an opportunity to take profits. As a result, the market is now in a consolidation phase, with XRP looking to establish a new equilibrium before the next major move. Speculative Demand Plunges into Negative Values as Markets Await Next Bullish Catalyst Even as XRP has lost 7% of its value since the SEC acknowledged the XRP spot ETF, the derivatives market offers a deeper glimpse into the evolving sentiment. Data from CryptoQuant ’s Taker Buy/Sell ratio reveals that bearish momentum could persist unless a fresh catalyst materializes. This ratio measures whether the most recently executed trades were initiated by buyers or sellers, providing real-time insight into the market’s appetite for risk. According to the chart below, XRP’s Taker Buy/Sell ratio dropped into negative territory at 0.93 on Feb. 17, an 8% decline from the 1.02 reading recorded on Feb. 13. A negative Taker Buy/Sell ratio implies that sellers are more aggressive than buyers, often indicating waning speculative demand. Ripple (XRP) Take Buy/Sell Ratio | Source: CryptoQuant In other words, instead of stepping in to buy the dip, traders appear to be positioning for further downside or closing out existing positions in anticipation of more significant volatility ahead. Such a drop in speculative demand can be concerning for a market reliant on momentum-driven inflows. Historically, when Taker Buy/Sell ratios fall below 1.0 for an extended period, it suggests that the path of least resistance may be to the downside. This is particularly relevant now, given XRP’s proximity to the $2.60 support level. If that level fails, the psychological $2.50 mark could be tested next, potentially triggering a wave of sell orders from traders seeking to minimize losses. Still, the situation is not entirely bearish. A quick recovery in the Taker Buy/Sell ratio—coupled with a renewed wave of buying interest—could reignite upward momentum, especially if broader market sentiment turns positive or additional regulatory progress unfolds. Until then, XRP appears to be in a wait-and-see phase, with its near-term fate hinging on whether buyers can outmatch the current wave of speculative selling. XRP Price Forecast: Bulls Struggle to Hold Key Support at $2.59 Amid Weak Momentum Ripple’s XRP trades at $2.639, down 0.79% on the day, as price action battles to maintain footing above the 50-day EMA at $2.5889. The coin remains trapped between the 50-day EMA and the 200-day EMA at $1.7337, forming a precarious range where a decisive break could determine the next trend. XRP Price Forecast A short-term bullish setup emerged with a 21.95% gain in five days, but sellers quickly erased momentum, leading to a 6.87% retracement in three days with high selling volume. The 100-day EMA at $2.2536 is a crucial support level; a breakdown below could see XRP testing the 200-day EMA at $1.7337. However, a strong recovery above $2.6453, the 20-day EMA, could re-ignite bullish sentiment. Volume bars reveal declining bullish activity, reinforcing concerns about a sustained rally. If bulls fail to reclaim $2.65, XRP risks slipping toward $2.25. A breakout above $2.65, however, could see renewed strength toward $3.00. Until a definitive move occurs, traders remain cautious. The post Ripple (XRP) Price Risks $2.50 Reversal as Speculative Demand Subsides appeared first on CoinGape .",Price Analysis|Ripple price|XRP price|XRP price analysis,EN,0,0,XRP|TRADING|MARKET|REGULATION|BUSINESS,"{'name': 'CoinGape', 'img': 'https://images.cryptocompare.com/news/default/coingape.png', 'lang': 'EN'}",coingape,2025-02-18 01:20:54
40476448,https://en.coinotag.com/javier-milei-reflects-on-libra-meme-coin-incident-denies-promotion-amid-ongoing-controversy-in-argentina/,1739842062,https://resources.cryptocompare.com/news/77/40476448.jpeg,"Javier Milei Reflects on LIBRA Meme Coin Incident, Denies Promotion Amid Ongoing Controversy in Argentina",https://en.coinotag.com/javier-milei-reflects-on-libra-meme-coin-incident-denies-promotion-amid-ongoing-controversy-in-argentina/,"Argentina’s President Javier Milei has recently addressed the controversy surrounding the LIBRA meme coin, denying any malicious intent regarding his involvement and emphasizing the valuable lessons learned from the experience.",News,EN,0,0,REGULATION,"{'name': 'CoinOtag', 'img': 'https://resources.cryptocompare.com/news/77/default.png', 'lang': 'EN'}",coinotag,2025-02-18 01:27:42
40476506,https://news.bitcoin.com/?p=705685&preview=true&preview_id=705685,1739842215,https://resources.cryptocompare.com/news/14/40476506.jpeg,Elon Musk Urges Public to Help DOGE as US Bankruptcy Looms,https://news.bitcoin.com/elon-musk-urges-public-to-help-doge-as-us-bankruptcy-looms/,Elon Musk warns America is on the brink of financial collapse. Urgent help is needed to expose government waste before uncontrolled spending drives the nation to ruin. US Bankruptcy Looms—Elon Musk Says Only ‘Radical Action’ Can Save It The Department of Government Efficiency (DOGE) is seeking public assistance in reducing waste and fraud. Tesla and,Economics|Bankruptcy|Elon Musk|United States US,EN,0,0,DOGE,"{'name': 'Bitcoin.com', 'img': 'https://images.cryptocompare.com/news/default/bitcoincom.png', 'lang': 'EN'}",bitcoin.com,2025-02-18 01:30:15
40476509,https://www.newsbtc.com/?p=697690,1739842217,https://images.cryptocompare.com/news/default/newsbtc.png,Bitcoin Finally Independent? BTC-S&P 500 Correlation Hits Zero,https://www.newsbtc.com/bitcoin-news/bitcoin-independent-btc-sp-500-correlation-zero/,"Data shows the Correlation between Bitcoin and S&P 500 has declined to zero recently, a sign that BTC is no longer attached to the stock market. Bitcoin Correlation To S&P 500 Has Witnessed A Plunge Recently In a new post on X, the market intelligence platform IntoTheBlock has discussed about the trend in the Correlation between Bitcoin and S&P 500. The “Correlation” here refers to an indicator that keeps track of how tied together the prices of any two given assets are. Related Reading: Toncoin (TON) Investors Sitting On 54% Profit Despite Price Plunge When the value of this metric is positive, it means the price of one of the assets is reacting to movements in the other by traveling in the same direction. The closer is the indicator to 1, the stronger is this relationship. On the other hand, the metric being under the zero mark implies that while there is also some correlation present between the assets in this case, it’s a negative one. This suggests that the charts are moving in the opposite direction to each other. For this zone, the extreme point is -1, corresponding to the tightest relationship. Now, here is the chart for the Correlation shared by the analytics firm, which shows the trend in the metric’s value for Bitcoin and S&P 500 over the last few months: As displayed in the above graph, the Correlation between Bitcoin and S&P 500 rose close to the 1 mark during January, which means the prices of the two were showing a strong positive relationship. Since peaking at the start of this month, though, the indicator has observed a sharp downward trajectory, and its value has today come down to exactly zero. Such a value implies there is no correlation whatsoever present between the assets. In statistics, the variables are said to be independent in this scenario. The Correlation can be a useful indicator to watch for when an investor wants to diversify their holdings. Assets that have a close relationship may not be worth investing in at the same time, but ones that have a low value of the metric can make for smart diversification options. As it is currently, the S&P 500 could provide something different to Bitcoin investors and vice versa. Related Reading: Bitcoin Retail Volume Close To Growing Again: Bullish Sign? “The last time we saw such a low correlation was on November 5th, 2024, just before Bitcoin soared past the 100k mark,” notes IntoTheBlock. With BTC free from the stock market once more, it’s possible that the cryptocurrency could show a big move this time as well. It only remains to be seen, however, how long the coin can stay away from the influence of traditional assets. BTC Price Bitcoin has continued its recent trend of consolidation during the last few days as its price is still locked around the $96,000 level. Featured image from Dall-E, IntoTheBlock.com, chart from TradingView.com",Bitcoin News|bitcoin|bitcoin correlation|Bitcoin Correlation To Stocks|btc|BTCUSDT|S&P 500|Stock Market,EN,0,0,BTC|BUSINESS|MARKET|TRADING|SPONSORED,"{'name': 'NewsBTC', 'img': 'https://images.cryptocompare.com/news/default/newsbtc.png', 'lang': 'EN'}",newsbtc,2025-02-18 01:30:17
