id,guid,published_on,imageurl,title,url,body,tags,lang,upvotes,downvotes,categories,source_info,source,date
40472439,https://en.bitcoinsistemi.com/?p=150081,1739834123,https://resources.cryptocompare.com/news/81/40472439.jpeg,$500 to $1M? BITCOIN and XRP Holders Are Moving Into OFFICIALMAGACOIN.COM!,https://en.bitcoinsistemi.com/500-to-1m-bitcoin-and-xrp-holders-are-moving-into-officialmagacoin-com/,"The cryptocurrency world has seen incredible success stories, from Bitcoin’s meteoric rise to Ethereum’s dominance in decentralized applications. But every so often, a new opportunity emerges that captures the attention of savvy investors looking for the next big thing. OFFICIALMAGACOIN is that opportunity today, with predictions that it could become the next $2.5 million crypto sensation. >>> PRESALE LIVE NOW – LIMITED SPOTS! Why OFFICIALMAGACOIN Stands Out Having raised over $1.5 million during its presale, OFFICIALMAGACOIN is quickly building momentum. With a price under $0.20, the potential for massive returns has both retail and institutional investors flocking to secure their share. Let’s explore what makes OFFICIALMAGACOIN unique and how it stacks up against established players like Ethereum (ETH), Chainlink (LINK), Sei (SEI), and Bitcoin (BTC). 1. Rapid Investor ConfidenceOFFICIALMAGACOIN’s presale raised $1.5 million in record time, signaling strong confidence from early adopters. The combination of retail enthusiasm and growing institutional interest makes this coin a standout in the crowded crypto market. 2. Potential for Massive GrowthCrypto experts believe OFFICIALMAGACOIN could follow the trajectory of Bitcoin and Ethereum, offering exponential returns. With its low entry price and the scarcity created by exclusive distribution, the coin is primed for a rapid rise in value. >>>>>> PRESALE SELLING OUT – CLICK HERE TO SECURE YOUR SPOT! Comparing OFFICIALMAGACOIN to ETH, LINK, SEI, and BTC Ethereum (ETH): While ETH has revolutionized the crypto space, its maturity limits further exponential growth. Chainlink (LINK): A critical infrastructure coin, but focused more on utility than explosive price movement. Sei (SEI): A promising newcomer, but it lacks the excitement and exclusivity that OFFICIALMAGACOIN delivers. Bitcoin (BTC): The gold standard of crypto, but its early-stage growth potential is long gone. The Future Is OFFICIALMAGACOIN With its strong market momentum, low price, and massive growth potential, OFFICIALMAGACOIN is shaping up to be the investment of the year. Could it hit a $2.5 million valuation? Early investors are betting on it. Don’t miss your chance—secure your tokens now at MAGACOINOFFICIAL.COM and stay updated on Twitter/X. Website: MAGACOINOFFICIAL.COM Twitter/X: https://x.com/officialMAGAx Continue Reading: $500 to $1M? BITCOIN and XRP Holders Are Moving Into OFFICIALMAGACOIN.COM!",Sponsored,EN,0,0,ETH|BTC|LINK|XRP|BUSINESS,"{'name': 'BitcoinSistemi', 'img': 'https://resources.cryptocompare.com/news/81/default.png', 'lang': 'EN'}",bitcoinsistemi,2025-02-17 23:15:23
40472942,https://timestabloid.com/?p=57635,1739834142,https://resources.cryptocompare.com/news/67/default.png,"Explore the Top Cryptos to Invest in This Week: Qubetics’ Cross-Border Transactions, Internet Computer’s Web3 Future & SUI’s Bullish Run",https://timestabloid.com/explore-the-top-cryptos-to-invest-in-this-week-qubetics-cross-border/,"Crypto markets are heating up, and savvy investors are keeping an eye on projects with strong fundamentals. With the blockchain industry evolving rapidly, selecting the right investments can make all the difference between riding the next wave of innovation or missing out on game-changing opportunities. This week’s top picks include projects that are reshaping global finance, decentralized infrastructure, and Web3 applications. Qubetics ($TICS) is revolutionizing cross-border payments, ensuring fast, seamless, and cost-effective global transactions. Meanwhile, Internet Computer Protocol (ICP) is building the decentralized internet, aiming to replace centralized cloud infrastructure. And then there’s SUI, a high-performance Layer 1 blockchain that’s been making waves with massive gains and bullish market sentiment. With SUI currently trading at $3.29, showing strong momentum and liquidity inflows, it’s becoming one of the hottest cryptos of the week. As institutional adoption increases, ICP’s Web3 innovations are positioning it as a long-term winner. Meanwhile, Qubetics’ presale has raised $13.2 million, making it one of the most anticipated blockchain projects of the year. Qubetics: Cross-Border Transactions Simplified Qubetics is bringing a new era of seamless, low-cost international payments. Traditional remittance services are plagued by high fees, slow transactions, and hidden costs. Qubetics’ blockchain-based system eliminates intermediaries, enabling users to send money instantly, securely, and affordably. With TICS tokens, businesses and individuals can execute real-time cross-border transactions , making Qubetics a game-changer in financial services. Whether you’re a freelancer working with global clients, a business paying international suppliers, or an everyday user sending money abroad, Qubetics ensures that your funds arrive faster and at a fraction of traditional banking costs. Understanding Qubetics’ Cross-Border Payment System Qubetics’ payment network is designed to work across multiple fiat and digital currencies, giving users flexibility while ensuring compliance with international regulations. Smart contracts automate transactions, reducing errors and ensuring transparent, trustless payments. This is especially crucial for businesses looking to streamline supply chain payments, payroll processing, and B2B settlements. With 479 million tokens sold and over 20,300 holders, Qubetics has already gained massive traction. Its efficient cross-border system will help unbanked populations gain access to financial services, opening doors for economic inclusion worldwide. Internet Computer Protocol: The Future of Web3 Internet Computer Protocol (ICP) is rewriting the rules of the internet. Instead of relying on centralized cloud services like AWS or Google Cloud, ICP enables fully decentralized applications (dApps) to run directly on the blockchain. Unlike most blockchains, which still require centralized servers for certain operations, ICP aims to replace traditional web infrastructure, offering a trustless, autonomous, and censorship-resistant alternative. This means users can host websites, run applications, and store data securely on the blockchain, reducing reliance on Big Tech monopolies. The real value of ICP lies in its ability to provide scalable, low-cost decentralized hosting. Imagine a world where social media platforms, online marketplaces, and financial applications operate entirely on a blockchain, free from corporate control. That’s what ICP is building, making it one of the most important long-term investments in crypto. SUI: Bullish Momentum and Market Potential SUI is making headlines in the crypto world with its strong price movement and growing ecosystem. Currently trading at $3.29, SUI has shown remarkable resilience, maintaining a tight trading range between $3.00 and $4.00. One of the biggest reasons behind SUI’s bullish momentum is the recent launch of tokenized funds on its network, attracting new liquidity and institutional interest. As more financial products migrate to SUI, the demand for its native token continues to rise. However, SUI faces a critical resistance level at $3.50. If it breaks past this price, analysts believe it could enter a strong upward trend. On the flip side, failure to hold above $3.00 could see a retest of lower support levels around $2.34. Still, its growing adoption and integration into major DeFi projects make it one of the top cryptos to watch this week. Conclusion This week, Qubetics , ICP, and SUI are proving to be some of the most promising investment opportunities in the crypto market. Qubetics is disrupting cross-border payments, Internet Computer Protocol is pioneering the decentralized internet, and SUI is gaining momentum with institutional adoption. The innovation behind these projects is not just theoretical—it’s being implemented and refined every day. With real-world use cases, partnerships, and growing adoption, the potential upside remains significant. Investors who position themselves early in these emerging technologies could benefit from substantial gains as adoption increases. As blockchain technology continues to redefine global finance and digital infrastructure, these three projects are well-positioned to be major players in the next crypto bull run. Whether you’re looking for long-term growth, innovative use cases, or explosive short-term gains, these cryptos deserve a spot in your portfolio. For More Information: Qubetics: https://qubetics.com Telegram: https://t.me/qubetics Twitter: https://x.com/qubetics FAQs 1. Why is Qubetics one of the best cryptos to invest in this week? Qubetics is revolutionizing cross-border transactions , providing a secure, cost-effective, and instant payment system that eliminates intermediaries. 2. How does ICP’s decentralized internet differ from traditional cloud services? Unlike centralized cloud services, ICP allows developers to build and host applications entirely on the blockchain , ensuring privacy, security, and censorship resistance . 3. What is driving SUI’s bullish price movement? SUI has gained strong momentum due to tokenized fund launches , increasing institutional adoption and positioning it as one of the fastest-growing Layer 1 blockchains. 4. Is Qubetics’ presale still open? Yes! Qubetics’ presale is in stage 22 , with tokens priced at $0.0807 . So far, over 479 million tokens have been sold, raising $13.2 million . 5. What are the long-term prospects of these cryptos? Qubetics, ICP, and SUI offer real-world utility and strong adoption potential , making them top-tier investments for anyone looking to diversify their crypto portfolio. Disclaimer: This is a sponsored press release for informational purposes only. It does not reflect the views of Times Tabloid, nor is it intended to be used as legal, tax, investment, or financial advice. Times Tabloid is not responsible for any financial losses. The post Explore the Top Cryptos to Invest in This Week: Qubetics’ Cross-Border Transactions, Internet Computer’s Web3 Future & SUI’s Bullish Run appeared first on Times Tabloid .",Finance|News,EN,0,0,ICP|SUI|TRADING|BLOCKCHAIN|MARKET,"{'name': 'TimesTabloid', 'img': 'https://resources.cryptocompare.com/news/67/default.png', 'lang': 'EN'}",timestabloid,2025-02-17 23:15:42
40472524,https://en.coinotag.com/breakingnews/milei-explains-he-did-not-promote-but-only-disseminated-crypto-coin/,1739834440,https://resources.cryptocompare.com/news/77/40472524.jpeg,"MILEI EXPLAINS HE DID NOT PROMOTE, BUT ONLY DISSEMINATED CRYPTO COIN",https://en.coinotag.com/breakingnews/milei-explains-he-did-not-promote-but-only-disseminated-crypto-coin/,"MILEI EXPLAINS HE DID NOT PROMOTE, BUT ONLY DISSEMINATED CRYPTO COIN",,EN,0,0,OTHER,"{'name': 'CoinOtag', 'img': 'https://resources.cryptocompare.com/news/77/default.png', 'lang': 'EN'}",coinotag,2025-02-17 23:20:40
40472682,https://en.coinotag.com/breakingnews/federal-reserve-governor-waller-impact-of-trump-administration-tariffs-on-inflation-and-economic-policy/,1739834764,https://resources.cryptocompare.com/news/77/default.png,Federal Reserve Governor Waller: Impact of Trump Administration Tariffs on Inflation and Economic Policy,https://en.coinotag.com/breakingnews/federal-reserve-governor-waller-impact-of-trump-administration-tariffs-on-inflation-and-economic-policy/,"On February 18th, Federal Reserve Governor Christopher Waller articulated his perspective on the impact of the newly implemented tariffs by the Trump administration, suggesting that they will likely yield only",,EN,0,0,FIAT,"{'name': 'CoinOtag', 'img': 'https://resources.cryptocompare.com/news/77/default.png', 'lang': 'EN'}",coinotag,2025-02-17 23:26:04
40472929,https://www.cryptopolitan.com/?p=676702,1739834943,https://resources.cryptocompare.com/news/43/40472929.jpeg,Ripple’s RLUSD stablecoin surpasses $120 million supply,https://www.cryptopolitan.com/ripples-rlusd-stablecoin-surpasses/,"Ripple’s USD-pegged stablecoin, RLUSD, has reached a total supply of 120 million just two months after its official launch. The token associated with both Ethereum and the XRP Ledger (XRPL) has increased and is actively used in the cryptocurrency market. Blockchain data firm CryptoQuant noted that the supply expanded, which led to the upgrade. At first, stablecoins exhibited more activity on the Ethereum blockchain. However, the trend of adoption has shifted over time to select XRPL, reflecting the relatively cheaper fees of the transactions. Adoption and exchange listings The credibility of RLUSD is boosted through multiple listings on the exchange platforms. The stablecoin has recently been integrated into the Margex trading platform that offers high leverage trading. Also, an asset under NYDFS got a listing on Zero Hash, making it more accessible in addition to its expansion. Another key milestone was RLUSD’s integration with the popular financial application Revolut. These factors have enabled the expansion of the stablecoin supply and an expansion into a variety of financial industries. RLUSD may expand across its networks. Cardano founder Charles Hoskinson has hinted at plans to integrate the RLUSD into the Cardano blockchain. If successful, this could increase its accessibility. Prior to RLUSD’s official launch, Ripple performed test minting on Ethereum and the XRPL in August. A push towards it has been seen recently as it costs less than Ethereum in terms of transaction fees. Currently, the XRPL has 37.4 million RLUSD, while Ethereum’s RLUSD supply has fallen to 83.3 million. More adoption of RLUSD in the XRPL has also improved the steadiness of the XRP market. This has impacted the price pattern of altcoins since their use and demand for stablecoins are high. As of the time of writing, XRP was around $2.64, registering a 3% decline in the last 24 hours. According to Coingecko, the market cap of RLUSD currently stands at $108 million. Analysts predict that the RLUSD growth will boost XRP prices in the long run. The continued adoption of XRP due to factors such as RLUSD, amongst other factors, has seen the token anticipated to hit $250 by 2026. Analysts have hinted that the whale movements could trigger the next rallying points in prices. Cryptopolitan Academy: How to Write a Web3 Resume That Lands Interviews - FREE Cheat Sheet",News|Ripple|RLUSD,EN,0,0,ETH|MARKET|XRP|BLOCKCHAIN|TRADING,"{'name': 'Cryptopolitan', 'img': 'https://images.cryptocompare.com/news/default/cryptopolitan.png', 'lang': 'EN'}",cryptopolitan,2025-02-17 23:29:03
40472833,https://news.bitcoin.com/?p=705696,1739835013,https://resources.cryptocompare.com/news/14/40472833.jpeg,Hackers Impersonate Saudi Crown Prince to Launch Fake Memecoin,https://news.bitcoin.com/hackers-impersonate-saudi-crown-prince-to-launch-fake-memecoin/,"Hackers compromised the X account of the Saudi Law Conference to promote a fake memecoin called KSA. KSA Memecoin Fails to Gain Traction On Feb. 17, hackers impersonating Saudi Arabia’s Crown Prince Mohammed bin Salman launched a fake memecoin called KSA. The launch was announced on the X account of the Saudi Law Conference, which",Crypto News|Meme Coins|Saudi Arabia,EN,0,0,REGULATION,"{'name': 'Bitcoin.com', 'img': 'https://images.cryptocompare.com/news/default/bitcoincom.png', 'lang': 'EN'}",bitcoin.com,2025-02-17 23:30:13
40472957,https://cryptodaily.co.uk/2025/02/solana-etf-approval-could-be-as-early-as-march-with-altcoins-like-remittix-set-to-explode-as-btc-dominance-tops-out,1739835217,https://resources.cryptocompare.com/news/75/40472957.jpeg,Solana ETF Approval Could Be As Early As March With Altcoins Like Remittix Set To Explode As BTC Dominance Tops Out,https://cryptodaily.co.uk/2025/02/solana-etf-approval-could-be-as-early-as-march-with-altcoins-like-remittix-set-to-explode-as-btc-dominance-tops-out,"A potential Solana ETF approval in March 2025 creates market-wide enthusiasm among cryptocurrency stakeholders because the approval would dramatically affect altcoin projects including Remittix . Investors are moved toward emerging digital assets that offer both high returns and practical uses because Bitcoin's market control has hit its maximum. A Solana ETF approval by regulatory bodies has the potential to serve as the key driver for cryptocurrency adoption in combination with emerging market players like Remittix. 1. Solana ETF Approval Could Be As Early As March With Altcoins Like Remittix Set To Explode As BTC Dominance Tops Out 2. Solana ETF Approval: A Catalyst for Market Dynamics 3. Remittix: Bridging Crypto and Traditional Finance 4. Conclusion Solana ETF Approval: A Catalyst for Market Dynamics The acceptance of Solana ETF can transform the current cryptocurrency market dynamic. The blockchain network Solana stands among the most desired platforms because of its efficient transaction processing and affordable costs. A review from analysts indicates that Solana ETFs may receive SEC approval until March 2025 as the regulatory environment now welcomes cryptocurrency investment products. A potential regulatory approval will enable institutional investment in Solana thus enabling growth in market liquidity and price consistency and improved credibility with traditional financial institutions. Bitcoin ETFs succeeded in paving the way for crypto adoption so authorities now focus on approving the Solana blockchain for regulatory validation besides Bitcoin. An ETF focused on Solana investment would enable both institutional and retail investors to join traditional financial markets thus integrating cryptocurrencies much deeper. The proposed market shift will favor alternative digital currencies which provide functional advantages particularly Remittix. Remittix: Bridging Crypto and Traditional Finance Digital currencies have expanded during recent years but many people across the world still do not have access to traditional banking services. An estimate from the World Bank shows that 1.4 billion adults across the world lack bank accounts. A substantial number of unbanked people still possess mobile devices that let them execute digital wallet payments alongside cryptocurrency operations. The solution comes from the Remittix (RTX) system. Remittix resolves the key obstacle to cryptocurrency adoption through its capability to turn cryptocurrency into FIAT money to allow effortless transactions. Remittix enables users to turn cryptocurrency into FIAT allowing bank deposits directly from anywhere across the world through a banking intermediary-free system. Remittix provides critical support to users in developing economies who want to take advantage of mobile and crypto usage opportunities despite restricted banking options. Through its platform Remittix enables users to preserve cryptocurrency's native characteristics of anonymous asset management together with systems of modern finance. The future demonstrates credit payments to freelancers in Africa through crypto which then automatically transforms to FIAT currency and funds instantly reach them without depending on centralized banking services. Remittix is currently creating such a future. Currently in its presale stage, Remittix offers an opportunity for early investors to acquire RTX tokens before they hit major exchanges. The Remittix presale aims to raise $36 million with a structured tokenomics model designed for long-term stability and value appreciation . The RTX presale enables investors to acquire tokens at reduced prices that may produce substantial profits after the token launches successfully in the market. Early investors obtain dual advantages by participating in the development of a project that intends to change worldwide payment systems while earning financial gains. Remittix establishes leadership in crypto-finance through its solution which combats high remittance fees while cutting down transaction speeds and granting users FIAT money access. The current financial sector evolves because Remittix and similar initiatives take a leadership role in this changing environment. The platform charges lower fees when sending money than Western Union and PayPal do. Conclusion Illuminating financial developments through the Solana ETF regulatory verification provides the perfect moment to study new answers such as Remittix. Taking part in the RTX presale places you ahead of others in witnessing an economic transformation where crypto advantages align with banking systems. As the financial world embraces decentralized finance, Remittix is a critical player in bridging the gap between crypto and mainstream finance. Become a part of a movement that promotes financial inclusion, empowers people globally, and reimagines the future of payments by joining the Remittix community today. Discover the future of PayFi with Remittix by checking out their presale here: Website: https://remittix.io/ Socials: https://linktr.ee/remittix Disclaimer: This is a sponsored press release and is for informational purposes only. It does not reflect the views of Crypto Daily, nor is it intended to be used as legal, tax, investment, or financial advice.",More News,EN,0,0,SOL|MARKET|BTC|ALTCOIN|BUSINESS,"{'name': 'Crypto Daily', 'img': 'https://resources.cryptocompare.com/news/75/default.png', 'lang': 'EN'}",cryptodaily,2025-02-17 23:33:37
40473128,https://www.cryptopolitan.com/?p=676716,1739835418,https://resources.cryptocompare.com/news/43/40473128.jpeg,"Dave Portnoy claims to buy fake LIBRA worth $170,000 by mistake, the trenches aren’t convinced",https://www.cryptopolitan.com/dave-portnoy-claims-to-buy-fake-libra-worth-170000-by-mistake-the-trenches-arent-convinced/,"Dave Portnoy claimed to have mistakenly bought a fake LIBRA coin worth $170,000 instead of the controversial coin shared by Argentinian President Javier Milei. Portnoy then proceeded to share the token’s contract address on X, asking users not to invest more than they can lose. He said in the X post, “Anybody wanna buy some fake Libra? Warning. This is a meme coin. I bought it by accident.” Anybody wanna buy some fake Libra? Warning. This is a meme coin. I bought it by accident. It will be volatile. It will eventually go to zero. It may rip. It may tank. Don’t put on more than you can lose!!! It’s a collectible 7Zt2KUh5mkpEpPGcNcFy51aGkh9Ycb5ELcqRH1n2GmAe pic.twitter.com/DGugLNBz74 — Dave Portnoy (@stoolpresidente) February 17, 2025 He also mentioned that the fake LIBRA coin will be volatile and will eventually go to zero. He added, “It will be volatile. It will eventually go to zero. It may rip. It may tank. Don’t put on more than you can lose!!! It’s a collectible.” Transactions made by Dave Portnoy (Source: DexScreener) Dave’s $170,000 investment in this fake token is now worth only $50,000 according to Solscan data at press time. However, when Dave purchased the coin, its value initially pumped over 3000%, hitting a market cap of $27 million. Since then, it is down to a market cap of $2.46 million. Fake LIBRA coin’s chart showing Portnoy’s purchases (Source: DexScreener) If Dave sells his tokens now at the current price, he would lose more than two-thirds of his initial investment. The trenches are not convinced The trenches, however, are not fully convinced. Traders under Dave Portnoy’s X post are questioning whether it is a genuine mistake, or just a front for a grifting attempt. Usually, when an influencer mentions a coin publicly, it’s price and market cap go up. Since Dave shared the coin’s contract address, several users are accusing Dave Portnoy of trying to find exit liquidity to cover his losses. One user replied , “Dudes basically asking for charity exit liquidity” while another user accused Dave of grifting by stating, “Dude, you’re a multi-millionaire trying to grift off people who have less than you.” Some users went further to hit Dave Portnoy with banter. @100xgemfinder on X said to Dave Portnoy, “Bro buys a fake coin, realizes it’s fake and wants his money back” Dave Portnoy was involved in the original token launch Yesterday, Portnoy disclosed details about his role in the launch of the LIBRA token that pulled Javier Milei into a huge controversy . According to Portnoy, he had plans to become a part of the project as an advisor, and bought the coin when it launched. Later, Dave Portnoy returned 6 million tokens after Hayden Davis suggested not disclosing the gift. Dave said in an X Space , “I’m not going to tweet about this f—ing launch and act like I’m just, ‘Oh, Milei’s the f—ing best’…and not mention that they have given me coins.” Cryptopolitan Academy: Are You Making These Web3 Resume Mistakes? - Find Out Here",News|LIBRA,EN,0,0,MARKET|ZRX|TRADING|REGULATION,"{'name': 'Cryptopolitan', 'img': 'https://images.cryptocompare.com/news/default/cryptopolitan.png', 'lang': 'EN'}",cryptopolitan,2025-02-17 23:36:58
