id,guid,published_on,imageurl,title,url,body,tags,lang,upvotes,downvotes,categories,source_info,source,date
40473975,https://crypto.news/?p=14337315,1739837160,https://resources.cryptocompare.com/news/73/40473975.jpeg,"Ripple price prediction: A 1,500% boost to $27 — Is the 2017 bull run repeating?",https://crypto.news/xrp-price-prediction-ripple-sec-etf/,"XRP price prediction points to a 1,500% surge if the SEC approves an ETF. Could Ripple finally reach $27 and break resistance? Table of Contents Ripple’s wild ride Is the XRP ETF finally coming? XRP’s make-or-break moment looms XRP price prediction: Could history repeat itself? Ripple’s wild ride Ripple ( XRP ) has experienced a rollercoaster ride in recent months, capturing the market’s attention with large price swings and major regulatory developments. On Jan. 16, the token surged to a multi-year high of $3.39, fueled by strong market sentiment. However, the rally was short-lived. As of Feb. 17, XRP has pulled back to $2.68, marking a 21% decline from its January peak. It remains approximately 31% below its all-time high of $3.89, which was reached in January 2018. Despite this pullback, XRP remains one of the top-performing assets in the top 100, delivering an impressive 145% return over the past 90 days. This outpaces heavyweights like Ethereum ( ETH ) and Solana ( SOL ), both of which have lost value during the same period. Amid these fluctuations, broader market forces are also at play. The election of President Donald Trump introduced a more crypto-friendly atmosphere in the U.S., with the Trump administration’s positive stance on digital assets boosting investor confidence. This, in turn, has contributed to the upward trajectory of crypto assets, including XRP. Additionally, the resignation of SEC Chair Gary Gensler has further fueled optimism, as market participants anticipate a more accommodating regulatory environment under the new SEC leadership of acting chair Mark Uyeda. With a mix of strong price action, regulatory intrigue, and shifting political winds, what can we expect from XRP? Let’s explore this further in our Ripple price prediction. Is the XRP ETF finally coming? Amid ongoing volatility and key developments, XRP has remained in the spotlight. A major turning point came on Feb. 13, when the U.S. Securities and Exchange Commission formally acknowledged a filing from the New York Stock Exchange and Grayscale Investments for a spot XRP exchange-traded fund. The proposal outlines a plan to convert Grayscale’s existing $16.1 million XRP Trust into a fully tradable ETF, with Coinbase Custody Trust Company acting as the custodian and BNY Mellon handling administrative duties. Update: @NYSE & @Grayscale have filed to convert Grayscale's XRP trust into an ETF. The trust currently has ~$16 mln in assets. pic.twitter.com/QAufZoKDkA — James Seyffart (@JSeyff) January 30, 2025 The SEC’s acknowledgement means that the review process has officially begun, setting the stage for a potential approval or rejection within a 240-day window. The first key deadline is set for mid-March, marking the start of a 45-day review period. After that, the SEC may either make a decision or extend the timeline, with a final decision expected by mid-October 2025. But Grayscale isn’t the only firm pushing for an XRP ETF. The Chicago Board Options Exchange has also filed a 19b-4 application for Bitwise’s XRP ETF, with other firms also vying for approval. Unlike Grayscale, which seeks to convert an existing trust into an ETF, Bitwise is launching a completely new fund. 🚨NEW: The @CBOE has just filed the 19b-4s on behalf of @BitwiseInvest and @CanaryFunds for their $XRP ETFs. The 19b-4 forms are the next step in the ETF approval process after issuers file their S-1s. The 19b-4s basically ask the @SECGov to allow them to list and trade the… pic.twitter.com/vMkoTk6G3P — Eleanor Terrett (@EleanorTerrett) February 6, 2025 Matt Hougan, Bitwise’s Chief Investment Officer, recently discussed the challenges and progress of XRP ETF applications. He noted that while previous filings have seen starts and stops, with some firms withdrawing their applications, the fact that multiple issuers are now refiling suggests that the SEC is at least open to considering these ETFs. Hougan remains cautiously optimistic, pointing out that while approval could take time, the SEC is becoming more willing to engage in discussions about these products. He also highlighted a key difference between XRP and other commodity-based ETFs like Bitcoin and gold — those assets had regulated futures markets before their ETFs were approved, whereas XRP does not. Although a futures market is not mandatory for XRP ETFs, it would play a key role in the approval process. What makes these filings particularly striking is the ongoing legal battle between Ripple and the SEC. In December 2020, the SEC sued Ripple, arguing that XRP had been sold as an unregistered security. Ripple scored a partial victory in August 2023 when a federal judge ruled that XRP is not a security when traded on secondary markets. However, regulatory uncertainty still persists, making the ETF approval process for XRP more complex compared to spot Bitcoin ( BTC ) or Ethereum ETFs. Nate Geraci, president of the ETF Store, pointed out the irony — while the SEC remains in litigation with Ripple, it is simultaneously reviewing an ETF that would hold XRP. Geraci even called it an “enormous message,” suggesting that the SEC’s stance on XRP might be shifting. Shocked more people aren’t talking about SEC accepting XRP ETF filing… They have open litigation w/ Ripple. Meanwhile, they just acknowledged filing of ETF holding asset in dispute (they easily could have rejected this filing). Enormous message IMO. — Nate Geraci (@NateGeraci) February 14, 2025 Adding to the growing buzz, Bloomberg ETF analysts James Seyffart and Eric Balchunas have estimated a 65% probability of XRP ETF approval by the end of 2025. Our official alt coin ETF approval odds are out. Litecoin leads w 90% chance, then Doge, followed by Solana and XRP. We are only doing for 33 Act $IBIT -esque filings. But def poss to see futures or Cayman-subsidiary type 40 Act stuff get through as well. https://t.co/JSaNnifjbu — Eric Balchunas (@EricBalchunas) February 10, 2025 XRP’s make-or-break moment looms XRP is at a make-or-break moment, approaching a resistance level that has defined its fate for years. Over the past two months, XRP has tested the $3.15 to $3.50 range, a zone that has consistently determined whether XRP breaks into a major rally or gets stuck in consolidation. On Jan. 16, XRP reached a multi-year high of $3.39, but that attempt to push higher ultimately failed. Then, on Feb. 3, XRP plunged 43% to $1.94 as global markets were shaken by Trump’s tariff threats, causing a widespread selloff that led to one of the worst declines in crypto history. Despite the chaos, XRP has since rebounded and is once again nearing the same resistance level, setting the stage for another potential breakout. Beyond the short-term volatility, something even more significant is unfolding. XRP is nearing the completion of a rounding bottom pattern that has been forming since 2018, a structure that has taken nearly seven years to develop. XRP price chart | Source: crypto.news If XRP reaches its all-time high of $3.89, the pattern will officially complete, signalling the end of a prolonged accumulation phase. At that point, XRP would enter price discovery, meaning there would be no historical resistance left to hold it back. The question now is what will provide the final push. Broader market conditions are not fully supportive yet, as Bitcoin hasn’t hit a new all-time high, and liquidity remains concentrated in just a few assets. One of the biggest potential catalysts is ETF approval. If the SEC greenlights an XRP ETF, institutional demand could surge, driving prices past resistance with sheer volume. Another key factor could be strategic adoption — if XRP is included in a financial system reserve or gains a major institutional use case, the surge in demand could propel it into uncharted territory. The third wildcard is the SEC lawsuit appeal. If the appeal is dismissed, legal clarity alone could trigger a wave of buying. Now, all eyes are on whether XRP can finally push through or if history will repeat itself once again. The next attempt to clear $3.50 may prove to be the most significant in its history. XRP price prediction: Could history repeat itself? XRP’s 2017 bull run remains a key reference point, with several indicators suggesting that XRP is now mirroring the setup that led to its parabolic rise. One of the bullish arguments comes from Egrag Crypto, which points to the Bull Market Support Band (BMSB), a technical indicator used to determine whether an asset is in a bullish or bearish phase. #XRP – Double Digits – 1500% Pump ⛽️: Let’s break down what’s happening with #XRP : 1⃣ Bull Market Support Band (BMSB): This is our key indicator for determining whether we’re in a #BullRun or a #BearMarket . Currently, we're positioned above the BMSB. I mentioned in a previous… pic.twitter.com/PNB4OmuCN8 — EGRAG CRYPTO (@egragcrypto) February 6, 2025 “Currently, we’re positioned above the BMSB,” he explains, noting that he had predicted XRP would revisit this level, even when the price was at $3.40. A successful retest of this support could signal that the market is gathering strength for the next move. Egrag draws parallels to 2017 when XRP followed a nearly identical pattern. He notes that back then, XRP nearly hit the BMSB, which preceded a 1,500% surge in just four weeks, targeting the Fib 1.618 level. Fibonacci levels are widely used in technical analysis to predict price movements, and in 2017, XRP’s breakout followed this exact pattern. If history repeats itself, Egrag suggests a 1,500% surge to $27. Javon Marks takes this further, highlighting how XRP’s recent price action mirrors its 2017 breakout. Prices recently tested the all-time high as resistance, just as they did in 2017 before surging beyond it. Marks’ new second target is at $99, an astonishing 3,900% increase from current levels. $XRP to $99+🪞: The truth is, most of what we have to connect dots with on XRP is its past price performance and man oh man is this breakout and run shaping up extremely similar to 2017. Prices recently met the All Time High, using it as a resistance, just as it did in 2017… https://t.co/gjFsTxYSwG pic.twitter.com/F0wVWE8v0z — JAVON⚡️MARKS (@JavonTM1) February 7, 2025 Beyond Fibonacci extensions, Elliott Wave theory also points to significant potential for XRP. Dark Defender has been tracking XRP’s wave structure since July 2023, when the price was around 40 to 50 cents. XRP had a 4th Wave on his Intermediate Cycle, which I highlighted in Dark Blue, aiming for $5.85 with the 5th Wave. On the other hand, Primary Cycle Waves, highlighted in Light Blue, still aim for $18.22. (Not Financial Advice) I have used the same structure since July 23,… pic.twitter.com/CZXFSRyftb — Dark Defender (@DefendDark) February 3, 2025 According to his analysis, XRP is currently in Wave 4 of the Intermediate Cycle, with Wave 5 targeting $5.85. His Primary Cycle Waves, which track long-term movements, suggest a major upside target of $18.22. “I’ve used the same structure since July 2023, and we are following it as the Northern Star,” Dark Defender explains, suggesting XRP has consistently respected this pattern. If his wave count holds, XRP could be on the verge of completing a major cycle. However, big breakouts don’t happen in isolation. XRP still faces its biggest resistance zone between $3.15 and $3.50, which requires a major catalyst to break through. For traders looking to take advantage of this setup, risk management is key. Placing stop-loss orders can help minimize losses in case of rejection, and avoiding over-leveraging is crucial, as sudden pullbacks could lead to liquidation. However, nothing in the crypto market is guaranteed. The same indicators that suggest explosive upside potential can also fail under changing market conditions. Trade wisely, manage risk, and never invest more than you can afford to lose. Disclosure: This article does not represent investment advice. The content and materials featured on this page are for educational purposes only.",Markets|Feature|Bull Market|ETF|Prediction|RippleNet|SEC|XRP,EN,0,0,XRP|TRADING|MARKET|REGULATION|BTC,"{'name': 'crypto.news', 'img': 'https://resources.cryptocompare.com/news/73/default.png', 'lang': 'EN'}",crypto_news,2025-02-18 00:06:00
40474173,https://cointelegraph.com/news/police-uncover-stolen-bitcoin-atms-collector-cards-melbourne,1739837295,https://images.cryptocompare.com/news/default/cointelegraph.png,"Australian police find ‘Aladdin’s cave’ of stolen Bitcoin ATMs, Pokemon cards",https://cointelegraph.com/news/police-uncover-stolen-bitcoin-atms-collector-cards-melbourne?utm_source=rss_feed&utm_medium=rss&utm_campaign=rss_partner_inbound,"Four have been arrested for allegedly stealing $50,000 worth of trading cards, along with firearms, car keys and six crypto ATMs.",,EN,0,0,BTC|TRADING,"{'name': 'CoinTelegraph', 'img': 'https://images.cryptocompare.com/news/default/cointelegraph.png', 'lang': 'EN'}",cointelegraph,2025-02-18 00:08:15
40474087,https://en.coinotag.com/four-arrested-in-melbourne-for-allegedly-targeting-bitcoin-atms-and-collectible-card-stores/,1739837411,https://resources.cryptocompare.com/news/77/40474087.jpeg,Four Arrested in Melbourne for Allegedly Targeting Bitcoin ATMs and Collectible Card Stores,https://en.coinotag.com/four-arrested-in-melbourne-for-allegedly-targeting-bitcoin-atms-and-collectible-card-stores/,"In a striking development, four individuals have been arrested in Melbourne for allegedly orchestrating a series of burglaries targeting cryptocurrency ATMs and collectible card stores, leading to the theft of",News|BTC,EN,0,0,BTC,"{'name': 'CoinOtag', 'img': 'https://resources.cryptocompare.com/news/77/default.png', 'lang': 'EN'}",coinotag,2025-02-18 00:10:11
40474166,https://en.bitcoinsistemi.com/?p=150087,1739837423,https://resources.cryptocompare.com/news/81/40474166.jpeg,"Urgent: XRP, BITCOIN, and OFFICIALMAGACOIN.COM Could Be Ready for Explosive Growth!",https://en.bitcoinsistemi.com/urgent-xrp-bitcoin-and-officialmagacoin-com-could-be-ready-for-explosive-growth/,"In the ever-evolving landscape of cryptocurrency, new opportunities continually arise, presenting investors with the potential for significant gains. One such opportunity is THE OFFICIALMAGACOIN.COM, a platform that is rapidly gaining attention for its unique approach and promising prospects. The Rise of THE OFFICIALMAGACOIN THE MAGACOINOFFICIAL.COM has recently made headlines with its impressive presale performance, raising $1.5 million in mere minutes. This swift fundraising underscores the strong interest and confidence from the investor community. >>> PRESALE LIVE NOW – LIMITED SPOTS! Current Market Comparisons To provide context, here are the current prices of some notable cryptocurrencies: Cardano (ADA): Currently trading around $0.9648, ADA is renowned for its advanced blockchain ecosystem and commitment to scalability and sustainability. XRP: Priced at $3.14, XRP remains a leader in the cross-border payments space, backed by its high transaction speed and low fees. Kaspa (KAS): With a value of $0.1299, Kaspa focuses on faster block processing times, aiming to improve upon the inefficiencies of older blockchains. Aptos (APT): At $8.32, Aptos is a layer-one blockchain designed for reliability and security, appealing to developers and institutions alike. While these coins have established their market presence, they may not offer the same explosive potential as early-stage tokens like THE OFFICIALMAGACOIN. Why Consider Investing in THE OFFICIALMAGACOIN? Early Entry Advantage: Investing in a cryptocurrency during its early stages can lead to substantial returns as the project gains traction and wider adoption. Community and Vision: The team behind THE MAGACOINOFFICIAL.COM is focused on building a strong community and delivering on a clear vision, factors that are often critical in the success of a cryptocurrency project. CLICK HERE – SUPPLY IS LIMITED, BUY BEFORE IT’S GONE Final Thoughts While the cryptocurrency market is known for its volatility and inherent risks, the potential rewards can be significant for those who conduct thorough research and make informed decisions. THE MAGACOINOFFICIAL.COM presents an intriguing opportunity for investors looking to capitalize on the next big thing in the crypto space. As always, it’s essential to perform due diligence and consider your risk tolerance before making any investment. For more information and to secure your tokens, visit MAGACOINOFFICIAL.COM . Stay updated by following their official Twitter account: https://x.com/officialMAGAx . Continue Reading: Urgent: XRP, BITCOIN, and OFFICIALMAGACOIN.COM Could Be Ready for Explosive Growth!",Sponsored,EN,0,0,XRP|MARKET|ADA|APT|BUSINESS,"{'name': 'BitcoinSistemi', 'img': 'https://resources.cryptocompare.com/news/81/default.png', 'lang': 'EN'}",bitcoinsistemi,2025-02-18 00:10:23
40474165,https://cryptodaily.co.uk/2025/02/panshibi-shibi-fever-sweeps-the-crypto-world-record-buys-on-cardano-network-signal-a-new-era,1739837455,https://resources.cryptocompare.com/news/75/40474165.jpeg,Panshibi (SHIBI) Fever Sweeps the Crypto World: Record Buys on Cardano Network Signal a New Era,https://cryptodaily.co.uk/2025/02/panshibi-shibi-fever-sweeps-the-crypto-world-record-buys-on-cardano-network-signal-a-new-era,"Much like New York, the crypto market never sleeps as it is always replete with major financial activities. After a somewhat tricky 2024, many cryptocurrencies are looking to recoup losses, sustain gains and push beyond resistance levels. Cardano, in particular, has been dominating headlines with big moves and ecosystem development that have sparked a bullish Cardano price prediction. Late last month, the network announced the launch of its highly anticipated Plomin Upgrade and this month, it's the ETF hype. However, one underdog, Panshibi , has been outperforming ADA. This new kid has caused quite a stir with its Panda-themed revolution and AI innovation in the meme market. Let's dive in and explore the latest happenings around the crypto world. Panshibi's AI meme revolution heats up the crypto market. After weeks of presale, Panshibi is still raising the dust as one of the most outstanding meme projects of the year. The presale has already raked in close to a million dollars in its fourth stage after selling out three stages in record time. At its core, Panshibi is upgrading the meme culture from a mere fad-driven speculative hype to an ecosystem thriving on innovation and purpose. The project is a powerful synergy of communities that brings together Asian cultural heritage, Panda lovers and meme enthusiasts. It spices things further by incorporating AI and social-fi to give everyone a chance at an inclusive community and financial freedom. Among its many perks is the stake-to-earn program, which allows token holders to stake their tokens and receive up to 1200% APY annually. The fun doesn't end with the lovable Panda theme. Panshibi offers an immersive gamified experience with various in-game rewards and VIP perks. To show its commitment to security and transparency, the Panshibi team aced a smart contract audit, in addition to locked liquidity and team allocations. The demand and support Panshibi's visionary meme revolution saw is not surprising. Even many experts tip it as one of 2025’s most promising meme coins. Cardano’s Recent Price Surge: Will It Sustain A Bullish Run In 2025 Another altcoin that has been hitting the headlines frequently is Cardano. Despite a tumultuous 2024, Cardano turned its fortunes around in November 2024 after surging 286% to a yearly high of $1.3 after Trump's victory and increased ecosystem activities. While it has noticeably traded below the $1 mark for most of 2025, Cardano price predictions suggest a possible return to a >$1 price in the coming months. These projections are hinged partly on a steady increase in the accumulation of $ADA by Cardano whales. Over the last five days, Binance reports that Cardano whales have bought up about 170 million tokens, which amounts to approximately $136 million. These numbers, of course, suggest massive investor confidence tied not only to Cardano’s intrinsic promise but also to its recent projects and collaborations. Just recently, it announced a deal with Argentina company Globant, which involves the latter using the Cardano blockchain to create decentralized applications. In addition to that, Grayscale Investments also filed for an ADA spot ETF. X analyst Ali Martinez predicted a rebound from current levels at $0.77. The positive sentiment, whale accumulation and SEC projection could see Cardano price prediction surpass its yearly high of $1.3. Conclusion Cardano has been on the rise lately, and there are plenty of reasons to believe it may have a better year than it did in 2024. However, analysts predict a better outing for the Panshibi in 2025 due to its presale heroics. And with a possible 140,000% ROI awaiting token holders after said presale, a massive breakout is extremely likely. The best way to take advantage of Panshibi's promising run is by getting in early. The price now stands at $0.005 in stage 4. The revolution is just getting started, and Panshibi is at the helm! You can participate in the Panshibi presale here: Telegram: https://t.me/panshibi Twitter: https://x.com/panshibi_ Website: https://panshibi.com Disclaimer: This is a sponsored press release and is for informational purposes only. It does not reflect the views of Crypto Daily, nor is it intended to be used as legal, tax, investment, or financial advice.",More News,EN,0,0,ADA|TRADING|SPONSORED|MARKET|REGULATION,"{'name': 'Crypto Daily', 'img': 'https://resources.cryptocompare.com/news/75/default.png', 'lang': 'EN'}",cryptodaily,2025-02-18 00:10:55
