id,guid,published_on,imageurl,title,url,body,tags,lang,upvotes,downvotes,categories,source_info,source,date
40478410,http://bitcoinworld.co.in/?p=129593,1739846052,https://resources.cryptocompare.com/news/82/default.png,Crucial GBP/JPY Price Analysis: Support at 191.00 Under Pressure?,https://bitcoinworld.co.in/gbpjpy-price-analysis-support/,"Navigating the volatile landscape of the forex market can feel like riding a rollercoaster. Today, we’re diving deep into the GBP/JPY currency pair, which is currently at a fascinating juncture. After a recent dip, GBP/JPY is testing a critical support level around 191.00. Is this a temporary pause before a rebound, or are we looking at further declines? Let’s break down the latest GBP/JPY price analysis to understand what’s driving this currency cross and what traders should watch out for. Decoding the GBP/JPY’s Price Action: What’s Happening? The GBP/JPY pair is currently hovering around the 191.00 mark during the European trading session on Monday, continuing a losing streak for the third day in a row. This price point is particularly interesting because it coincides with the nine-day Exponential Moving Average (EMA). Let’s look at the key factors influencing this: Immediate Support Test: GBP/JPY is testing immediate support at the nine-day EMA, precisely at 191.00. This level is acting as a crucial near-term floor. Bearish Momentum Building: The 14-day Relative Strength Index (RSI) has dipped below 50. This is a significant signal, indicating that bearish momentum is gaining strength. Resistance Looms: On the upside, the pair faces immediate resistance at the 14-day EMA, currently positioned at 191.17. Breaking through this resistance is key for any potential bullish reversal. Descending Channel Pattern: A look at the daily chart reveals that GBP/JPY is moving within a descending channel. This pattern generally suggests a prevailing bearish bias in the medium term. Essentially, GBP/JPY is caught in a tug-of-war between short-term support and increasing bearish pressure. The next moves around these EMA levels will be critical in determining the pair’s direction. Technical Analysis Breakdown: EMAs and RSI in Focus For traders relying on technical analysis , several indicators are painting a mixed picture for GBP/JPY. Let’s dissect the key technical signals: Exponential Moving Averages (EMAs) Nine-day EMA (around 191.00): Currently acting as immediate support. A hold here could suggest a temporary stabilization. 14-day EMA (around 191.17): Serving as immediate resistance. Overcoming this level is needed to alleviate bearish pressure. Neutral Short-Term Momentum: The fact that GBP/JPY is trading around both the nine-day and 14-day EMAs suggests that short-term price momentum is currently neutral or indecisive. Relative Strength Index (RSI) Below 50 Level: The 14-day RSI falling below 50 is a significant bearish signal. It indicates that selling pressure is outweighing buying pressure, suggesting further potential downside. Descending Channel Bearish Bias: The descending channel pattern on the daily chart reinforces the overall bearish outlook for GBP/JPY. Traders often look for continuation patterns within channels. In summary, while the EMAs suggest short-term neutrality, the RSI and the descending channel pattern lean towards a bearish outlook. Traders should monitor these indicators closely for confirmation of the next directional move. Key Support Levels to Watch: Will 191.00 Hold? Identifying support levels is crucial for understanding potential downside targets and areas where buying interest might emerge. For GBP/JPY, here are the critical support zones: Immediate Support: Nine-day EMA at 191.00: This is the most immediate level currently being tested. A sustained break below this could open the door for further declines. Five-Month Low at 187.05 (February 7th): This recent low acts as a significant support zone. A move below 191.00 could target this level. Descending Channel Lower Boundary (around 186.00): The lower boundary of the descending channel, near the psychological level of 186.00, represents a more significant longer-term support. A break below the 191.00 level could trigger increased selling pressure, potentially leading GBP/JPY towards the 187.05 and then the 186.00 support zones. Traders should be prepared for potential volatility around these levels. Navigating Resistance Levels : Where Could GBP/JPY Rebound? On the flip side, understanding resistance levels is essential for identifying potential upside barriers and areas where selling pressure might strengthen. For GBP/JPY, key resistance levels include: Immediate Resistance: 14-day EMA at 191.17: This is the immediate hurdle for any potential bullish recovery. A break above this could signal weakening bearish momentum. Descending Channel Upper Boundary (around 192.50): The upper boundary of the descending channel represents a more significant resistance level. A successful break above this would be needed to negate the current bearish bias and suggest a potential trend reversal. If GBP/JPY manages to break above the 14-day EMA at 191.17, it could pave the way for a test of the descending channel’s upper boundary around 192.50. Overcoming this channel resistance is crucial for any sustained bullish recovery. British Pound (GBP) Performance in the Broader Forex Market To get a complete picture, it’s important to analyze the British Pound’s performance against other major currencies in the broader forex market . The table below provides a snapshot of the percentage change of GBP against various currencies today: USD EUR GBP JPY CAD AUD NZD CHF USD 0.08% -0.04% -0.24% 0.03% -0.18% -0.23% 0.09% EUR -0.08% 0.03% -0.37% 0.05% -0.17% -0.21% 0.12% GBP 0.04% -0.03% -0.29% 0.02% -0.15% -0.24% 0.08% JPY 0.24% 0.37% 0.29% 0.28% 0.10% 0.22% 0.32% CAD -0.03% -0.05% -0.02% -0.28% -0.18% -0.26% 0.07% AUD 0.18% 0.17% 0.15% -0.10% 0.18% -0.04% 0.29% NZD 0.23% 0.21% 0.24% -0.22% 0.26% 0.04% 0.32% CHF -0.09% -0.12% -0.08% -0.32% -0.07% -0.29% -0.32% The heat map above visualizes percentage changes of major currencies against each other. The base currency is on the left, and the quote currency is at the top. For instance, selecting British Pound (GBP) from the left and US Dollar from the top shows the percentage change for GBP/USD. As the table indicates, the British Pound was weakest against the Japanese Yen today. This reinforces the bearish sentiment observed in the GBP/JPY pair’s price action. Conclusion: Navigating the GBP/JPY Crossroads GBP/JPY is currently at a critical juncture, testing support around the nine-day EMA at 191.00. The increasing bearish momentum, signaled by the RSI and the descending channel pattern, suggests potential for further downside. However, the pair’s ability to hold above the 191.00 support could lead to a period of consolidation or a potential rebound towards the 14-day EMA resistance at 191.17. Traders should closely monitor price action around these key levels and be prepared for potential volatility as GBP/JPY navigates this crucial phase in the forex market . To learn more about the latest forex market trends, explore our articles on key developments shaping currency valuations and technical analysis insights.",Forex News|#Market Analysis|#Technical Analysis|Currency|Forex|GBPJPY,EN,0,0,TRADING|MARKET|FIAT,"{'name': 'Bitcoin World', 'img': 'https://resources.cryptocompare.com/news/82/default.png', 'lang': 'EN'}",bitcoinworld,2025-02-18 02:34:12
40478442,http://bitcoinworld.co.in/?p=129603,1739846151,https://resources.cryptocompare.com/news/82/default.png,"Defiant Gold Price Holds Strong at $2,900: Tariffs & Safe-Haven Demand",https://bitcoinworld.co.in/defiant-gold-price-tariffs/,"In the volatile world of cryptocurrency and global finance, even traditional safe havens like gold are experiencing significant price swings. Despite a slight uptick in the US Dollar, Gold price is demonstrating remarkable resilience, clinging to gains near the coveted $2,900 mark. What’s fueling this defiance, and can it sustain its upward trajectory? Let’s dive into the factors impacting the precious metal, including Trump’s tariff threats and the ever-influential Federal Reserve. Why is the Gold Price Showing Such Strength? Several factors are contributing to gold’s current robust position. Despite modest USD strength, gold is finding support from persistent concerns surrounding potential global trade wars. Former US President Donald Trump’s protectionist policies, particularly his threats of new tariffs, are injecting uncertainty into the global economic outlook. This uncertainty, in turn, is bolstering gold’s appeal as a safe-haven asset. Trump’s Tariff Threats: The specter of increased tariffs imposed by the US, especially on major trading partners like Mexico, China, and Canada, is creating jitters in the market. Investors are wary of the potential for retaliatory tariffs and the disruption to global trade flows, driving them towards safe assets like gold. USD Weakness (Relatively): While the US Dollar has seen a slight recovery, it remains under pressure following weaker-than-expected US Retail Sales data. This lingering USD weakness provides a tailwind for gold, making it relatively cheaper for investors holding other currencies. Geopolitical Tensions: Ongoing geopolitical risks, including the conflict in Ukraine, continue to underpin demand for safe-haven assets. Despite talks between US and Russian officials, escalating military actions in eastern Ukraine are keeping investors on edge. The Role of the Federal Reserve and Interest Rates The Federal Reserve’s monetary policy stance is always a critical factor influencing both the US Dollar and gold prices. Recently, market expectations regarding Fed interest rate cuts have shifted, further impacting the dynamics. Hawkish Fed Stance: Initially, there was anticipation of aggressive interest rate cuts by the Federal Reserve . However, recent economic data and Fed communications suggest a more cautious approach. The market is now increasingly pricing in a potential rate cut in September, rather than earlier in the year. Impact on USD: The perception of a less dovish Federal Reserve has provided some support to the US Dollar. A stronger dollar typically exerts downward pressure on gold prices, as gold is priced in US dollars. However, the impact has been modest, indicating the strength of other supporting factors for gold. Inflation Expectations: Comments from Kevin Hassett, former Director of the US National Economic Council, suggesting that a drop in Treasury yields could signal expectations of lower inflation, are also being factored into market sentiment. Lower inflation expectations can sometimes reduce the appeal of gold as an inflation hedge, but the current focus on safe-haven demand and tariff risks seems to be overriding this. Technical Analysis: Gold Price Outlook From a technical standpoint, Gold price charts suggest continued bullish momentum, although some caution is warranted at current levels. Key Technical Levels for Gold (XAU/USD) Level Type Price Significance Current Price (approx.) $2,900 Round Figure Support Immediate Support $2,885 Near-term Support Swing Low Support $2,855 Stronger Support Level Key Support Zone $2,834 – $2,815 Major Support Area Immediate Resistance $2,925 Horizontal Resistance All-Time High $2,942 – $2,943 Critical Resistance Level The Relative Strength Index (RSI) on the daily chart has retreated from overbought conditions, providing room for further upside. However, the $2,925 area and the all-time high near $2,942-$2,943 represent significant resistance levels. A decisive break above these levels could signal a powerful continuation of the uptrend. Conversely, failure to overcome these resistances could lead to a period of consolidation or a potential pullback towards support levels in the $2,885-$2,855 range. Tariffs and Trade Wars: A Looming Threat? Donald Trump’s tariff plans are a major talking point and a significant driver of market uncertainty. His proposals for reciprocal tariffs and threats of levies on automobiles are raising concerns about a potential global trade war. Tariffs FAQs What are tariffs? Tariffs are taxes imposed on imported goods, designed to protect domestic industries by making imported products more expensive. Tariffs vs. Taxes: Tariffs are paid by importers at the port of entry, while taxes are paid by consumers or businesses at the point of sale. Are tariffs good or bad? Economists are divided. Some argue tariffs protect domestic jobs and industries, while others warn they can lead to higher prices for consumers and retaliatory trade wars. Trump’s Tariff Plan: Trump aims to use tariffs to support the US economy, focusing on countries like Mexico, China, and Canada. He intends to use tariff revenue to reduce income taxes. Federal Reserve Policy: Understanding the Basics Understanding the Federal Reserve’s role is crucial for navigating financial markets. Here are some frequently asked questions about the Fed and its impact on the US Dollar. Fed FAQs What does the Federal Reserve do? The Fed is the central bank of the US, responsible for monetary policy, aiming for price stability and full employment. How does the Fed impact the USD? The Fed influences the USD primarily through interest rate adjustments. Higher rates tend to strengthen the USD, while lower rates can weaken it. How often does the Fed meet? The Federal Open Market Committee (FOMC) holds eight policy meetings per year to assess economic conditions and make monetary policy decisions. What is Quantitative Easing (QE)? QE is a policy where the Fed injects liquidity into the financial system by buying bonds, typically weakening the USD. What is Quantitative Tightening (QT)? QT is the reverse of QE, where the Fed reduces its balance sheet, generally positive for the USD. Conclusion: Gold’s Resilient Stance Gold price is currently navigating a complex landscape of USD fluctuations, tariff threats, and evolving Federal Reserve policy expectations. Despite headwinds from a slightly firmer dollar, the precious metal is drawing significant support from safe-haven demand fueled by geopolitical uncertainties and the looming possibility of trade wars. While technical indicators suggest further upside potential, key resistance levels are approaching. Investors should closely monitor developments related to US trade policy, Fed pronouncements, and global risk sentiment to gauge the next move for gold. To learn more about the latest Forex market trends, explore our article on key developments shaping Gold, US Dollar, interest rates liquidity.",Forex News|FED|Gold|safe haven|tariffs|USD,EN,0,0,FIAT|TRADING|MARKET|REGULATION|BUSINESS,"{'name': 'Bitcoin World', 'img': 'https://resources.cryptocompare.com/news/82/default.png', 'lang': 'EN'}",bitcoinworld,2025-02-18 02:35:51
40478625,https://en.coinotag.com/breakingnews/join-the-excitement-solana-global-creator-competition-kicks-off-soon/,1739846407,https://resources.cryptocompare.com/news/77/40478625.jpeg,Join the Excitement: Solana Global Creator Competition Kicks Off Soon!,https://en.coinotag.com/breakingnews/join-the-excitement-solana-global-creator-competition-kicks-off-soon/,"In an exciting development for the crypto community, Solana has officially announced the impending launch of its inaugural Solana Global Creator Competition, organized by Little Unusual. Scheduled to run from",SOL,EN,0,0,SOL,"{'name': 'CoinOtag', 'img': 'https://resources.cryptocompare.com/news/77/default.png', 'lang': 'EN'}",coinotag,2025-02-18 02:40:07
40478818,https://en.bitcoinsistemi.com/?p=150096,1739846724,https://resources.cryptocompare.com/news/81/40478818.jpeg,"Bitcoin’s Road to $500K: Why XRP and These 5 Cryptos Could Skyrocket 1,000x!",https://en.bitcoinsistemi.com/bitcoins-road-to-500k-why-xrp-and-these-5-cryptos-could-skyrocket-1000x/,"Bitcoin (BTC) has long been the standard for cryptocurrency investments, while Ripple (XRP) dominates cross-border payments. However, THE MAGACOINOFFICIAL is emerging as a potential game-changer, with analysts predicting a breakout of up to 50,000%. What Makes THE MAGACOINOFFICIAL Stand Out? 1. Limited Supply for Maximum Value: With a total supply of 100 billion tokens, THE OFFICIALMAGACOIN leverages a deflationary model to ensure scarcity and drive demand. This gives it a major edge over tokens like Solana (SOL) and Kaspa (KAS), which have higher supply and more gradual demand growth. 2. Exclusive Sale Platform: THE OFFICIALMAGACOIN is only available at MAGACOINOFFICIAL.COM , adding an exclusive appeal that many competitors lack. Unlike Solana or Optimism (OP), which are widely traded, this controlled distribution creates a sense of urgency for early investors. >>> PRESALE LIVE NOW – LIMITED SPOTS! >> DON’T MISS THE NEXT 1000X CRYPTO – CLICK HERE TO JOIN NOW! 3. Early-Stage Momentum: Raising $1.9 million within minutes, THE MAGACOINOFFICIAL has already proven its market appeal. With predictions of a 50,000% increase, it’s capturing attention as a high-potential token for investors seeking exponential returns. How It Stacks Up Against the Competition Solana (SOL, $25.01): Known for speed and scalability, but it lacks the exclusive presale advantage and early momentum of THE MAGACOINOFFICIAL . Kaspa (KAS, $0.12): A rising star in blockchain, yet its growth doesn’t match the explosive potential seen in this new token. Optimism (OP, $1.72): A solid project for scalability, but it’s overshadowed by THE OFFICIALMAGACOIN’s unique market positioning. Act Now Before It’s Too Late Analysts are calling THE MAGACOINOFFICIAL one of the most promising tokens for 2025, with unparalleled growth potential. Don’t miss this exclusive chance to invest in a token poised for a 50,000% breakout. Secure your tokens today, exclusively at MAGACOINOFFICIAL Website: magacoinofficial.com X/Twitter: https://x.com/officialMAGAx Continue Reading: Bitcoin’s Road to $500K: Why XRP and These 5 Cryptos Could Skyrocket 1,000x!",Sponsored,EN,0,0,ZRX|BTC|XRP|SOL|BUSINESS,"{'name': 'BitcoinSistemi', 'img': 'https://resources.cryptocompare.com/news/81/default.png', 'lang': 'EN'}",bitcoinsistemi,2025-02-18 02:45:24
40478842,https://coingape.com/?post_type=markets&p=239488,1739846979,https://images.cryptocompare.com/news/default/coingape.png,"3 Ethereum Rivals to Buy As ETH Price Trades Around $2,600 for 5 Consecutive Years",https://coingape.com/markets/3-ethereum-rivals-to-buy-as-eth-price-trades-around-2600-for-5-consecutive-years/,"The cryptocurrency market remains volatile as the Ethereum price hovers around $2,700, facing resistance in its upward movement. The broader market has struggled to regain strength, with most altcoins trading sideways. However, some Ethereum rivals have shown resilience, positioning themselves as strong alternatives. ​​Ethereum Rivals: Solana (SOL) Solana (SOL), a layer-one blockchain project, continues to gain attention as a major Ethereum rival. In the past 24 hours, the Solana price dropped over 5%, settling at $180 amid market volatility. Despite the decline, SOL has maintained steady growth, eyeing more gains ahead. Over the last year, its value surged more than 100%, reinforcing its position among Ethereum rivals. A crypto analyst highlighted that the $180 to $190 range remains a critical support zone for SOL. Meanwhile, Ethereum’s price has hovered around $2,600 for five consecutive years, underscoring the evolving competition between these two leading blockchain networks. Cardano (ADA) Cardano price climbed to $0.80, reflecting a 10% weekly gain amid a broader market rebound. The third-generation blockchain, known for its proof-of-stake (PoS) model, continues to attract investors seeking energy-efficient alternatives. Analysts highlight a potential breakout after ADA formed a cup-and-handle pattern, suggesting bullish momentum. With Ethereum trading around $2,600 for five years, Cardano remains among the top Ethereum rivals gaining attention. Market sentiment points to sustained upward pressure, reinforcing optimism among traders tracking ADA’s performance. Chainlink (LINK) Chainlink (LINK), a key blockchain abstraction layer, continues to enhance smart contract integration. Despite gaining over 160% in recent years, LINK struggles to sustain momentum. The LINK price is $18.89, reflecting a 0.38% daily dip. According to Coinglass, trading volume surged 85.79% to $874.14 million, while open interest declined 0.69% to $566.01 million. Source- Coinglass Conclusion These Ethereum rivals to buy offer distinct advantages and potential upside if bullish momentum returns. While market conditions remain uncertain, their ongoing development and adoption could make them promising alternatives in the crypto market. The post 3 Ethereum Rivals to Buy As ETH Price Trades Around $2,600 for 5 Consecutive Years appeared first on CoinGape .",Price Analysis|3 Ethereum Coins|Cardano (ADA) price|Chainlink (LINK)|solana,EN,0,0,ETH|TRADING|SOL|MARKET|ADA,"{'name': 'CoinGape', 'img': 'https://images.cryptocompare.com/news/default/coingape.png', 'lang': 'EN'}",coingape,2025-02-18 02:49:39
40479005,https://www.newsbtc.com/?p=698380,1739847306,https://images.cryptocompare.com/news/default/newsbtc.png,Bitcoin Price Pulls Back to Support—Breakdown or Bounce Ahead?,https://www.newsbtc.com/analysis/btc/bitcoin-price-pulls-back-to-support-95k/,"Bitcoin price started another decline below the $96,800 zone. BTC is retesting the $95,500 support zone and might struggle to recover losses. Bitcoin started a fresh decline from the $98,000 zone. The price is trading below $96,500 and the 100 hourly Simple moving average. There is a key bearish trend line forming with resistance at $96,400 on the hourly chart of the BTC/USD pair (data feed from Kraken). The pair could start another increase if it stays above the $95,000 zone. Bitcoin Price Dips To Support Bitcoin price failed to clear the $99,000 and $100,000 resistance levels . BTC formed a top and started a fresh decline below the $97,000 level. There was a clear move below the $96,500 support level. The price even dipped below the $95,000 level. However, the bulls appeared near $95,200. A low was formed at $95,224 and the price is now attempting to recover. There was a move above the $96,000 level. The price cleared the 23.6% Fib retracement level of the downward move from the $98,826 swing high to the $95,224 low. Bitcoin price is now trading below $96,500 and the 100 hourly Simple moving average . On the upside, immediate resistance is near the $96,400 level. There is also a key bearish trend line forming with resistance at $96,400 on the hourly chart of the BTC/USD pair. The first key resistance is near the $97,000 level or the 50% Fib retracement level of the downward move from the $98,826 swing high to the $95,224 low. The next key resistance could be $98,000. A close above the $98,000 resistance might send the price further higher. In the stated case, the price could rise and test the $98,800 resistance level. Any more gains might send the price toward the $100,000 level or even $100,500. More Losses In BTC? If Bitcoin fails to rise above the $97,000 resistance zone, it could start a fresh decline. Immediate support on the downside is near the $95,500 level. The first major support is near the $95,200 level. The next support is now near the $95,000 zone. Any more losses might send the price toward the $93,500 support in the near term. The main support sits at $92,200. Technical indicators: Hourly MACD – The MACD is now losing pace in the bearish zone. Hourly RSI (Relative Strength Index) – The RSI for BTC/USD is now below the 50 level. Major Support Levels – $95,500, followed by $95,000. Major Resistance Levels – $97,000 and $98,000.",BTC|bitcoin|bitcoin price|btcusd|BTCUSDT|xbtusd,EN,0,0,TRADING|BTC|EXCHANGE|MARKET,"{'name': 'NewsBTC', 'img': 'https://images.cryptocompare.com/news/default/newsbtc.png', 'lang': 'EN'}",newsbtc,2025-02-18 02:55:06
40479817,https://coinedition.com/?p=595301,1739847600,https://resources.cryptocompare.com/news/7/default.png,Crypto Market Check: Experts on Bitcoin’s Next Move,https://coinedition.com/crypto-market-check-experts-on-bitcoins-next-move/,"Experts flag soft economy impacting Bitcoin’s crypto market outlook Recession fears & regulatory scrutiny loom over Bitcoin economy Bitcoin’s future hinges on economy & institutional crypto adoption Expert crypto analysts on ‘Macro Monday’ dissected Bitcoin’s economic challenges, citing recession fears and ETF activity. The panel, with Noelle Acheson (filling in for Scott), Lawrence Lepard, Dave Weisberger, and Mike McGlone, then talked about the current economy and its effect on the cryptocurrency market, especially Bitcoin. Broadcast Delivers Key Economic & Crypto Insights As expected, there were some interesting insights in the broadcast. Specifically, the latest macro data showed weakness in the economy, with retail sales falling below expectations and higher-than-expected CPI (consumer price index) figures. The discussion touched upon the effects of rising tariffs and layoffs, which were adding to the economic uncertainty. Meme Coin Trend & Regulatory Shifts Discussed Also, the trend of meme coins, especially after the events in Argentina , seems to be peaking. The panel reflected on the speculative nature of these coins and how they co… The post Crypto Market Check: Experts on Bitcoin’s Next Move appeared first on Coin Edition .",Market|Market News|News|Top Crypto News|Bitcoin News,EN,0,0,BTC|MARKET|TRADING,"{'name': 'Coin Edition', 'img': 'https://resources.cryptocompare.com/news/7/default.png', 'lang': 'EN'}",coinquora,2025-02-18 03:00:00
