id,guid,published_on,imageurl,title,url,body,tags,lang,upvotes,downvotes,categories,source_info,source,date
56570573,https://timestabloid.com/?p=93625,1767060013,https://resources.cryptocompare.com/news/67/default.png,XRP Price Outlook if It Matches Silver’s $4.48 Trillion Market Cap,https://timestabloid.com/xrp-price-outlook-if-it-matches-silvers-4-48-trillion-market-cap/,"Analysts and crypto enthusiasts are exploring the potential price of XRP if it were to attain a market capitalization comparable to silver, which recently surpassed a $4.48 trillion valuation. Despite a strong performance for precious metals this year, XRP has struggled since October 2025, reflecting broader weakness across the cryptocurrency market. Silver’s Strong 2025 Performance Silver (XAG) has been one of the top-performing assets globally in 2025, even outpacing gold (XAU) in terms of annual gains. Starting the year at $28.95, silver has surged 174% to $79 per ounce at the time of writing. This growth, combined with its total supply of approximately 1.751 million metric tonnes, has pushed silver’s market capitalization to a record $4.485 trillion. While silver has captured investor attention, XRP has underperformed during the same period, falling from $2.07 at the start of the year to $1.87 at present, a decline of over 12%. XRP as Digital Silver Within the crypto community, XRP has often been referred to as “digital silver,” reflecting its potential for value preservation and transactional utility. Advocates argue that this characterization implies a capacity for substantial growth, drawing parallels with silver’s market trajectory. Jake Molter of Molt Media highlighted that many investors previously overlooked silver, only to rush into the market as prices climbed. He suggested that XRP could experience a similar dynamic if it begins to attract mainstream attention. Market analyst Steph also noted patterns reminiscent of precious metals’ movements, including extended consolidation phases, which may indicate potential for a future uptrend in XRP. We are on X, follow us to connect with us :- @TimesTabloid1 — TimesTabloid (@TimesTabloid1) June 15, 2025 Price Implications of a $4.48 Trillion Market Cap Currently, XRP’s circulating supply stands at 60.57 billion tokens, giving the crypto asset a market capitalization of approximately $111.99 billion. This is down from a peak of $216.69 billion in July 2025, reflecting a loss of over $104 billion. If XRP were to reach a market capitalization equal to silver’s $4.485 trillion, its price per token would rise to roughly $74. This represents a gain of 3,857% from its current level, demonstrating the significant upside potential implied by such a valuation. While the comparison with silver illustrates an extreme upside scenario, it is contingent on widespread adoption, investor interest, and regulatory clarity. XRP’s potential to achieve such a market cap relies on long-term structural growth within the cryptocurrency sector, institutional participation, and expanded use in cross-border payments and settlement systems. The “digital silver” narrative continues to influence both community sentiment and speculative projections. However, analysts caution that while matching silver’s market cap provides a useful framework for estimating potential price ceilings, practical market dynamics may prevent such rapid appreciation. Although XRP’s current market performance lags behind silver’s gains, the comparison highlights the token’s theoretical upside. For investors, the $74 target serves as a reference point for long-term planning, emphasizing the importance of adoption, liquidity, and market confidence in determining XRP’s future valuation. Disclaimer : This content is meant to inform and should not be considered financial advice. The views expressed in this article may include the author’s personal opinions and do not represent Times Tabloid’s opinion. Readers are urged to do in-depth research before making any investment decisions. Any action taken by the reader is strictly at their own risk. Times Tabloid is not responsible for any financial losses. Follow us on Twitter , Facebook , Telegram , and Google News The post XRP Price Outlook if It Matches Silver’s $4.48 Trillion Market Cap appeared first on Times Tabloid .",Cryptocurrency|News|XRP|XRP Price|XRP Price Prediction,EN,0,0,BUSINESS|MARKET|TRADING|XRP|CRYPTOCURRENCY,"{'name': 'TimesTabloid', 'img': 'https://resources.cryptocompare.com/news/67/default.png', 'lang': 'EN'}",timestabloid,2025-12-30 02:00:13
56570583,https://ambcrypto.com/?p=557355,1767060037,https://images.cryptocompare.com/news/default/ambcrypto.png,Bitcoin’s next shift hinges on THIS bold action by BTC bulls – Why?,https://ambcrypto.com/bitcoins-next-shift-hinges-on-this-bold-action-by-btc-bulls-why/,Bitcoin divergence in trader behavior emerges as a key risk.,Bitcoin|BTC Trading View|News|News 1|Social|Trading View,EN,0,0,BTC|CRYPTOCURRENCY,"{'name': 'AMB Crypto', 'img': 'https://images.cryptocompare.com/news/default/ambcrypto.png', 'lang': 'EN'}",ambcrypto,2025-12-30 02:00:37
56572569,649374,1767060055,https://resources.cryptocompare.com/news/13/56572569.jpeg,"Galaxy Digital Moves $39M In Bitcoin To Exchanges, Signaling Potential Sell-Off",https://bitcoinist.com/galaxy-digital-moves-39m-in-bitcoin-to-exchanges/,"Bitcoin has remained locked in a consolidation phase since late November, with price oscillating in a narrow range and failing to establish a clear directional trend. This prolonged period of sideways movement has left analysts divided about what comes next. Some expect the current weakness to evolve into a deeper downtrend as Bitcoin struggles to reclaim key resistance levels, while others argue that consolidation may be laying the groundwork for a renewed push higher once selling pressure fully subsides. For now, uncertainty dominates market sentiment. Against this backdrop, on-chain activity from major institutional players is drawing increased attention. Top analyst Darkfost recently highlighted a notable transaction involving Galaxy Digital, a prominent crypto-focused financial services firm founded by billionaire investor Mike Novogratz. Galaxy Digital operates across asset management, trading, investment banking, and venture capital, and its on-chain movements are closely monitored due to its role as a major institutional participant in the digital asset market. According to on-chain data, Galaxy Digital moved approximately 447 BTC, worth around $39 million, a few hours ago. Transactions of this size are significant, particularly during periods of low conviction and compressed volatility. Large transfers by institutional entities often raise questions about intent, whether related to portfolio rebalancing, liquidity management, or potential selling activity. Galaxy Digital Exchange Transfers Raise Short-Term Supply Concerns Darkfost explains that the destination of Galaxy Digital’s recent Bitcoin transfers adds important context to the move. On-chain data shows that the 447 BTC were sent directly to Bybit and Bitstamp, two centralized exchanges commonly used for spot and derivative trading. Transfers to exchanges are typically interpreted as a potential intent to sell or deploy liquidity, rather than long-term custody, making the transaction particularly relevant given current market conditions. Adding to the significance, Darkfost notes that an additional 200 BTC were moved just a few hours later, reinforcing the idea that this was not an isolated operational transfer. In total, the movements represent a sizable amount of Bitcoin entering exchange venues during a period of low conviction and compressed price action. Such timing naturally raises concerns about renewed sell-side pressure, especially as Bitcoin continues to struggle below key resistance levels. What stands out further is the historical context. It has been nearly one month since Galaxy Digital last transferred such a large quantity of BTC to exchanges. This pause suggests that the firm had largely remained inactive on the sell side throughout December, making the latest activity a notable change in behavior. While institutional transfers do not always translate into immediate market selling, they often precede shifts in short-term liquidity. As Bitcoin remains range-bound, Galaxy Digital’s renewed exchange activity could influence near-term price dynamics, particularly if broader sentiment fails to improve. Bitcoin Testing Structural Demand Level Bitcoin’s price action on the higher timeframe reflects a market stuck between structural support and persistent overhead pressure. After peaking above the $120,000 region earlier in the cycle, BTC has entered a clear corrective and consolidation phase, with price now trading near $87,300. The chart shows that Bitcoin has decisively lost the 50-day moving average (blue), which has rolled over and is acting as dynamic resistance during rebound attempts. More importantly, price is now compressing between the 100-day moving average (green) and the 200-day moving average (red). The 200-day MA, currently just below the $90,000 zone, has become a critical pivot. Multiple recent candles show rejection near this level, confirming it as a major supply area. As long as BTC remains below the 200-day MA, upside momentum is structurally limited. On the downside, the market has so far managed to defend the $85,000–$86,000 region, which aligns with prior consolidation and acts as short-term support. Volume has declined compared to the impulsive phases earlier in the trend, reinforcing the idea that the market is in a waiting mode rather than trending aggressively. From a broader perspective, the sequence of lower highs since October signals weakening bullish control, but the absence of a sharp breakdown below long-term averages suggests distribution rather than panic. Bitcoin remains range-bound, and a decisive move above the 200-day MA or a breakdown below $85,000 will likely determine the next directional phase. Featured image from ChatGPT, chart from TradingView.com",Bitcoin News|bitcoin|Bitcoin analysis|Bitcoin Galaxy Digital|Bitcoin Institutional Investors|bitcoin news|Bitcoin Whale Activity|btc|BTCUSDT,EN,0,0,BTC|EXCHANGE|MARKET|TRADING|CRYPTOCURRENCY,"{'name': 'Bitcoinist', 'img': 'https://images.cryptocompare.com/news/default/bitcoinist.png', 'lang': 'EN'}",bitcoinist,2025-12-30 02:00:55
56570532,https://www.newsbtc.com/?p=870771,1767060055,https://resources.cryptocompare.com/news/21/56570532.jpeg,Bitcoin Equilibrium: Active Market Participants Just Breaking Even,https://www.newsbtc.com/bitcoin-news/bitcoin-equilibrium-active-market-just-breaking/,"On-chain data shows the Bitcoin price is currently floating around the cost basis of the Active Investors, suggesting this cohort is at break-even. Bitcoin Is Trading At The Active Investors Mean In a new post on X, on-chain analytics firm Glassnode has shared an update on where the major Bitcoin on-chain levels currently stand. There are four pricing models of interest here, the most basic of which is the Realized Price. The Realized Price basically keeps track of the cost basis or acquisition level of the average investor on the BTC network. The spot price trading above this line means that the holders as a whole are in a state of net unrealized profit, while the reverse situation suggests the dominance of loss in the market. Related Reading: XRP Exchange Inflows Spike To End 2025: Will Price Decline Deepen? Below is the chart shared by Glassnode that shows the trend in this metric over the last few years. As displayed in the graph, the Bitcoin spot price crossed above the Realized Price back at the start of 2023, and since then, its value has remained above the indicator. At present, the Realized Price is sitting at $56,200, which means that the network as a whole is in a significant amount of profit at the current spot price. While the Realized Price does provide an overall view of the blockchain, it doesn’t tend to be too useful outside of bear markets as the asset rarely interacts with it. This is a consequence of the fact that it accounts for all tokens in circulation, even the ones that have become inaccessible due to lost wallet keys. Two other models in the chart, the True Market Mean and Active Realized Price, exist to solve this issue. These indicators only provide the cost basis of the active market participants. That is, the Bitcoin investors who have recently been involved in transaction activity. The first model, the True Market Mean, is situated at $81,100 right now. This is around where the cryptocurrency found its bottom when it crashed in November. Meanwhile, the Active Realized Price corresponds to $87,700, which is the level about which BTC has recently been consolidating. Related Reading: XRP Triangle Hints At Potential 10% Move—But In Which Direction? As Bitcoin is currently trading right at the Active Realize Price, the investors holding the economically active supply can be assumed to be just breaking even on their investment. While the active traders as a whole have a neutral profitability, the same isn’t true for a segment of them known as the short-term holders (STHs). Formally, the STHs are defined as the addresses who acquired their coins within the past 155 days. With the Bitcoin STH Realized Price equal to $99,900 at the moment, this cohort is in a state of net loss. BTC Price At the time of writing, Bitcoin is floating around $87,700, down 2.6% in the last seven days. Featured image from Dall-E, Glassnode.com, chart from TradingView.com",Bitcoin News|bitcoin|Bitcoin Active Investor Mean|Bitcoin Active Investors|btc|BTCUSDT,EN,0,0,BTC|BUSINESS|MARKET|TRADING|CRYPTOCURRENCY,"{'name': 'NewsBTC', 'img': 'https://images.cryptocompare.com/news/default/newsbtc.png', 'lang': 'EN'}",newsbtc,2025-12-30 02:00:55
56571183,https://en.coinotag.com/tokenized-stocks-reach-1-2b-market-cap-potentially-mirroring-early-stablecoins,1767060410,https://resources.cryptocompare.com/news/77/56571183.jpeg,"Tokenized Stocks Reach $1.2B Market Cap, Potentially Mirroring Early Stablecoins",https://en.coinotag.com/tokenized-stocks-reach-1-2b-market-cap-potentially-mirroring-early-stablecoins,"Tokenized stocks have achieved a combined market capitalization of $1.2 billion, signaling rapid growth akin to early stablecoins. This surge reflects strong institutional interest, improved blockchain liquidity, and positioning as a bridge between traditional equities and onchain finance. Tokenized stocks market cap hits $1.2 billion, up sharply since mainstream adoption this year. September and December [...]",Analysis|News,EN,0,0,BLOCKCHAIN|MARKET,"{'name': 'CoinOtag', 'img': 'https://resources.cryptocompare.com/news/77/default.png', 'lang': 'EN'}",coinotag,2025-12-30 02:06:50
56571184,https://en.coinotag.com/breakingnews/btc-and-sol-set-to-hit-all-time-highs-by-2026-delphi-ventures-partner-predicts-as-market-recovers,1767060829,https://resources.cryptocompare.com/news/77/56571184.jpeg,"BTC and SOL Set to Hit All-Time Highs by 2026, Delphi Ventures Partner Predicts as Market Recovers",https://en.coinotag.com/breakingnews/btc-and-sol-set-to-hit-all-time-highs-by-2026-delphi-ventures-partner-predicts-as-market-recovers,"BTC and SOL Set to Hit All-Time Highs by 2026, Delphi Ventures Partner Predicts as Market Recovers",Breaking News,EN,0,0,BTC|MARKET|SOL|CRYPTOCURRENCY,"{'name': 'CoinOtag', 'img': 'https://resources.cryptocompare.com/news/77/default.png', 'lang': 'EN'}",coinotag,2025-12-30 02:13:49
56571185,https://en.coinotag.com/bitcoin-spot-order-pattern-hints-at-potential-rally-amid-mixed-signals,1767060873,https://resources.cryptocompare.com/news/77/56571185.jpeg,Bitcoin Spot Order Pattern Hints at Potential Rally Amid Mixed Signals,https://en.coinotag.com/bitcoin-spot-order-pattern-hints-at-potential-rally-amid-mixed-signals,"Bitcoin's average spot order size indicates a bullish pattern with green and red dots following downtrends, historically signaling rallies. Spot traders accumulated $113 million in BTC over two days, while perpetual markets show buyer dominance and heavy short losses. Bullish spot order size pattern: Green dot after downtrend followed by red signals potential BTC uptrend. [...]",Bitcoin|News,EN,0,0,BTC|MARKET|TRADING|CRYPTOCURRENCY,"{'name': 'CoinOtag', 'img': 'https://resources.cryptocompare.com/news/77/default.png', 'lang': 'EN'}",coinotag,2025-12-30 02:14:33
56571186,https://en.coinotag.com/bitcoin-price-holds-near-87500-amid-feds-2-5b-liquidity-breakout-possible,1767060991,https://resources.cryptocompare.com/news/77/56571186.jpeg,"Bitcoin Price Holds Near $87,500 Amid Fed’s $2.5B Liquidity, Breakout Possible",https://en.coinotag.com/bitcoin-price-holds-near-87500-amid-feds-2-5b-liquidity-breakout-possible,"Bitcoin price holds steady near $87,500 after the Federal Reserve injected $2.5 billion in liquidity via overnight repurchase agreements. Support at $86,600 remains intact, with realized volatility at 37.8% and implied volatility at 15.1% signaling a potential breakout toward $90,000 or higher. Bitcoin price maintains support near $86,600 following Fed's $2.5 billion liquidity injection, fostering [...]",Analysis|Bitcoin|Guides|News,EN,0,0,BTC|MARKET|TRADING|MACROECONOMICS|CRYPTOCURRENCY,"{'name': 'CoinOtag', 'img': 'https://resources.cryptocompare.com/news/77/default.png', 'lang': 'EN'}",coinotag,2025-12-30 02:16:31
56571187,https://en.coinotag.com/breakingnews/elon-musk-linked-address-opens-106m-hyperliquid-eth-short-btc-and-sol-shorts-set-take-profit-levels,1767061151,https://resources.cryptocompare.com/news/77/56571187.jpeg,Elon Musk-Linked Address Opens $106M Hyperliquid ETH Short; BTC and SOL Shorts Set Take-Profit Levels,https://en.coinotag.com/breakingnews/elon-musk-linked-address-opens-106m-hyperliquid-eth-short-btc-and-sol-shorts-set-take-profit-levels,Elon Musk-Linked Address Opens $106M Hyperliquid ETH Short; BTC and SOL Shorts Set Take-Profit Levels,Breaking News,EN,0,0,BTC|ETH|SOL|CRYPTOCURRENCY,"{'name': 'CoinOtag', 'img': 'https://resources.cryptocompare.com/news/77/default.png', 'lang': 'EN'}",coinotag,2025-12-30 02:19:11
56571691,https://en.coinotag.com/breakingnews/lit-tge-nears-as-whale-bets-on-hyperliquid-pre-trading-with-1x-leverage-floating-loss-surpasses-652k,1767061227,https://resources.cryptocompare.com/news/77/56571691.jpeg,"LIT TGE Nears as Whale Bets on HyperLiquid Pre-Trading with 1x Leverage, Floating Loss Surpasses $652K",https://en.coinotag.com/breakingnews/lit-tge-nears-as-whale-bets-on-hyperliquid-pre-trading-with-1x-leverage-floating-loss-surpasses-652k,"LIT TGE Nears as Whale Bets on HyperLiquid Pre-Trading with 1x Leverage, Floating Loss Surpasses $652K",Breaking News,EN,0,0,OTHER,"{'name': 'CoinOtag', 'img': 'https://resources.cryptocompare.com/news/77/default.png', 'lang': 'EN'}",coinotag,2025-12-30 02:20:27
