id,guid,published_on,imageurl,title,url,body,tags,lang,upvotes,downvotes,categories,source_info,source,date
53435334,77c6104b-b927-40b7-b3ac-2d23ef079eb6,1761008196,https://resources.cryptocompare.com/news/5/53435334.jpeg,Senate Republicans Call for Own Meeting With Crypto CEOs After Democrats' Sitdown,https://www.coindesk.com/policy/2025/10/20/senate-republicans-call-for-own-meeting-with-crypto-ceos-after-democrats-sitdown,"GOP lawmakers are scheduling a followup meeting with crypto CEOs after they meet this week with Senate Democrats on the market structure bill, sources say.",Policy|U.S. Senate|crypto legislation|Regulation|Crypto lobbying|Coinbase|Chainlink|Breaking News|News,EN,0,0,REGULATION|CRYPTOCURRENCY|EXCHANGE|LINK|MARKET,"{'name': 'CoinDesk', 'img': 'https://resources.cryptocompare.com/news/5/default.png', 'lang': 'EN'}",coindesk,2025-10-21 00:56:36
53434075,https://cryptonews.com/?p=441077,1761008215,https://resources.cryptocompare.com/news/52/53434075.jpeg,"U.S. Government Shutdown Won’t End Until End of November, Polymarket Bettors Predict",https://cryptonews.com/news/u-s-government-shutdown-wont-end-until-end-of-november-polymarket-bettors-predict/,"The U.S. government shutdown may drag on for almost another month to become the longest in American history, Polymarket bettors predict. Majority Of Polymarket Bettors Predict Lengthy Shutdown According to the decentralized prediction market’s website , 25% of Polymarket bettors predict that the U.S. government shutdown will last until at least November 16. Should the prediction come true, it would put the length of the shutdown at 46 days – surpassing the 35-day mark to become the longest shutdown in American history . However, other participating Polymarket bettors believe that the political standstill will come to a close sooner, with 23% predicting that the government shutdown will end sometime between October 31 and November 3. Meanwhile, 18% of participating bettors estimate the shutdown will end much sooner between October 23 and October 26. Senate Democrats To Meet With Crypto CEOS The poll’s latest figures come as key executives in the blockchain sector prepare to meet with crypto-friendly Democratic senators on Wednesday in hopes of advancing digital asset market structure legislation. Spearheaded by Senator Kirsten Gillibrand, the October 22 roundtable is set to feature Coinbase CEO Brian Armstrong, Galaxy CEO Mike Novogratz, Chainlink CEO Sergey Nazarov, Kraken CEO David Ripley and Solana Policy Institute President Kristin Smith, Crypto in America journalist Eleanor Terrett. SCOOP: These crypto C-suites are expected to attend a roundtable with pro-crypto Senate Democrats on Wednesday to discuss market structure legislation and the path forward: Coinbase CEO @brian_armstrong Chainlink CEO @SergeyNazarov Galaxy CEO @novogratz Kraken CEO… — Eleanor Terrett (@EleanorTerrett) October 20, 2025 According to Terrett, other participants in the event include Jito CLO Rebecca Rettig, Circle CSO Dante Disparte, Uniswap CEO Hayden Adams, Ripple CLO Stuart Alderoty and Miles a16zmgeneral counsel Miles Jennings. News of the Wednesday roundtable comes just weeks after Senate Democrats unveiled their own crypto market structure proposal . In a October 9 statement, Blockchain Association CEO Summer Mersinger claimed the proposal would “drive responsible development overseas.” “The disappointing proposal outlined by Senate Democrats would effectively ban decentralized finance, wallet development, and other applications in the United States—an outcome that’s neither workable nor consistent with American innovation,” Mersinger said. However, with the government shutdown in full swing, it remains to be seen how U.S. lawmakers will put aside their differences to move policies forward. The post U.S. Government Shutdown Won’t End Until End of November, Polymarket Bettors Predict appeared first on Cryptonews .",Blockchain News|News|Congress|Crypto Policy|Polymarket,EN,0,0,MACROECONOMICS|CRYPTOCURRENCY|REGULATION|EXCHANGE|MARKET,"{'name': 'cryptonews', 'img': 'https://images.cryptocompare.com/news/default/cryptonews.png', 'lang': 'EN'}",cryptonews,2025-10-21 00:56:55
53434355,https://www.cryptopolitan.com/?p=840958,1761008366,https://resources.cryptocompare.com/news/43/53434355.jpeg,ECB’s Nagel warns undermining trust in statistics may trigger financial turmoil,https://www.cryptopolitan.com/ecb-warns-on-undermining-trust-in-statistics/,"A Member of the Governing Council of the European Central Bank (ECB), Joachim Nagel has warned that damaging public trust in statistics and central banks could result in negative economic consequences. According to him, independent and trustworthy statistics are crucial particularly for central banks, referring to them as “the backbone of sound monetary policy.” This comes as Nagel said that Europe must stop acting timidly in its trade relationship with China and start defending its own economic interests “in a more offensive way” during a financial gathering in Washington, Nagel said, “China needs Europe more than Europe needs China. We are a strong economy. We are four hundred fifty million people… So we should play the European card in a more offensive way.” According to the economist the continent should not rely on others to protect its markets. “The most important market for the European is Europe itself,” the ECB member said. As earlier reported by Cryptopolitan , Trump’s on-and-off-again tariffs on China this year have led to a new wave of retaliation from Beijing, forcing Chinese exporters to redirect goods to markets such as Europe, where they are often sold under local production costs. Nagel points out the risks associated with central banks failing to function independently Nagel noted that trustworthy statistics were facing challenges lately. This happens when elected officials begin to openly question the reliability of key economic data that does not match the government’s view. Following these claims, the ECB member acknowledged that such allegations are powerful and replacing individuals who share unwanted information brings about even greater consequences. His remarks were made at an event in New York, following US president Donald Trump’s dismissal of the Bureau of Labor Statistics commissioner due to disappointing job numbers and significant changes to previous data. Moreover, reports from sources highlighted that Trump frequently criticized Federal Reserve Chair Jerome Powell and tried to get rid of Fed Governor Lisa Cook. Regarding this report, Nagel cautioned against making decisions about monetary policy based on “political convenience” instead of careful economic analysis. He also mentioned that history clearly illustrates risks such as loss of public trust, financial chaos, and rampant inflation when central banks fail to function independently. Nagel expresses satisfaction with the ECB’s current monetary policy When the ECB developed their current monetary policy, Nagel expressed his satisfaction with the decision . He stated that he believed there was no need to make adjustments unless new data indicate a shift in the economic outlook. Regarding the situation, the president of the Bundesbank pointed out that he was very confident that the central bank is closing to its 2% price target. He added that he was not too worried about the bank missing this goal for a long time. “I feel quite comfortable with our current position,” Nagel stated during the IMF’s annual meetings in Washington. He further highlighted that if new information comes in that changes his view, then he will be open to adjusting his thoughts. However, for now, Nagel mentioned that he thinks they are in a good spot. Meanwhile, with inflation nearing the target and the economy proving resilience against challenges such as trade-related problems and wars, most policy makers are comfortable with current interest rates. Earlier this month, investors and economists anticipated that it is unlikely there will be another rate cut this year, despite eight cuts already in this cycle. This prediction was made after Nagel remarked that it would require a lot to shift his view that the ECB’s approach is suitable. On the other hand, some policy makers, such as Francois Villeroy de Galhau of France, have suggested that the bank should not rule out further cuts. They think the risks to growth and inflation are still greater. Join Bybit now and claim a $50 bonus in minutes",News|ECB,EN,0,0,MACROECONOMICS|FIAT|ASIA|MARKET|REGULATION,"{'name': 'Cryptopolitan', 'img': 'https://images.cryptocompare.com/news/default/cryptopolitan.png', 'lang': 'EN'}",cryptopolitan,2025-10-21 00:59:26
53434359,https://www.cryptopolitan.com/?p=840136,1761008400,https://resources.cryptocompare.com/news/43/53434359.jpeg,DOGE Dips 6% as Investors Turn Bullish on This New Crypto,https://www.cryptopolitan.com/doge-dips-6-as-investors-turn-bullish-on-this-new-crypto/,"Dogecoin (DOGE) has slipped by 6% to $0.18, extending its recent downtrend as traders lock in profits and shift focus toward emerging opportunities with stronger fundamentals. While DOGE remains one of crypto’s most recognized names, its momentum is fading as investors search for what crypto to buy next with higher growth potential. That growing curiosity has brought Mutuum Finance (MUTM) into the spotlight, a DeFi project currently in Phase 6 of its presale, where over 70% of tokens have already sold out at $0.035, raising more than $17.65 million. With its dual-lending model that merges Peer-to-Peer and Peer-to-Contract systems, Mutuum Finance is being hailed by traders as the best cryptocurrency to invest in 2025. As DOGE consolidates, many believe MUTM could be the next altcoin breakout, combining utility, innovation, and early-stage upside in a way Dogecoin never offered. Dogecoin (DOGE) Price Analysis From as high as $0.30, Dogecoin (DOGE) has not had the momentum to maintain its uptrend, constantly being rejected to create lower highs at $0.2897 and $0.2550. The meme-coin now trades around $0.184, which is a critical support level that will be the deciding factor in its future direction. As long as bulls hold this level, a short-term rally towards $0.22–$0.25 is to be expected; but a clean breakdown of support will continue the bear trend and welcome deeper correction. As DOGE’s price action remains uncertain, investor attention is already starting to flow into newer opportunities in the market, with soon-to-be-listed Mutuum Finance (MUTM) flying under the radar, capturing more attention before the next big crypto cycle. For traders evaluating what crypto to buy, Mutuum Finance is quickly becoming a standout option amid growing DeFi innovation. Mutuum Finance Presale Is Causing Heavy Hype Mutuum Finance (MUTM) dominates the news of the DeFi market and cryptocurrency world with growing investor mania driving the project ahead. Already sold out 70% in the sixth round of presale, the strong demand is considered a sign of growing faith in the project and has triggered rumors among investors seeking the safest cryptocurrency wagers to invest their money. The token can be bought for $0.035 today. So far, more than 17,320 investors have purchased a total of $17.65 million worth of MUTM tokens. The rush gives credence to growing worldwide demand for Mutuum Finance’s decentralized finance paradigm long-term and risk-taking approach. With momentum, MUTM is now the top crypto to invest in, drawing traders and investors seeking a new crypto coin that offers tangible real-world DeFi utility and value. For those asking what crypto to buy in 2025, analysts are now ranking MUTM as the best cryptocurrency to invest in for both short- and long-term portfolios. Mutuum Finance announced that it will soon release its lending and borrowing protocol , another huge leap toward establishing its decentralized infrastructure. Sepolia Testnet in Q4 2025 will see V1 launch of the platform. Mutuum Leaderboard Fuels Investor Frenzy Mutuum Finance leaderboard is bringing a buying frenzy to the investors with its reward and 24-hour contest. The top 24-hour buyers bought $519, $515, $424, $308 MUTM tokens respectively, evidence of the increasing activity and buying frenzy among the community players during presale. Individual players who achieve the top one spot on the leaderboard are rewarded $500 MUTM tokens for dedication and consistency. It is one trade made by a player within 24 hours that counts to qualify for a reward. As Dogecoin (DOGE) battles at $0.18, investors are flocking towards Mutuum Finance (MUTM), a new DeFi token selling at $0.035 in Phase 6 of its presale. Already having raised over $17.65 million and with 70% of tokens having sold out, Mutuum Finance is the word on every investor’s mouth as the best cryptocurrency to invest in 2025. Its double-lending model and its soon-to-be-released protocol give it serious potential as the next altcoin breakout. Join the Mutuum Finance presale today before the next phase of presale and receive MUTM tokens at the cheapest price. For more information regarding Mutuum Finance (MUTM) please use the following links: Website: https://mutuum.com/ Linktree: https://linktr.ee/mutuumfinance",Press Release,EN,0,0,CRYPTOCURRENCY|DOGE|BUSINESS|TRADING|MARKET,"{'name': 'Cryptopolitan', 'img': 'https://images.cryptocompare.com/news/default/cryptopolitan.png', 'lang': 'EN'}",cryptopolitan,2025-10-21 01:00:00
53434183,https://ambcrypto.com/?p=538574,1761008406,https://images.cryptocompare.com/news/default/ambcrypto.png,"Ethereum’s price prediction bullish in the long-term, but short-term doubts remain",https://ambcrypto.com/ethereums-price-prediction-bullish-in-the-long-term-but-short-term-doubts-remain/,Whether bulls can scale Ethereum's short-term supply zone will dictate whether an uptrend can be established.,Analysis|Ethereum|HideCryptopanic|News|News 1|No Homepage|Social|Trading View|ambcrypto,EN,0,0,TRADING|CRYPTOCURRENCY|ETH|MARKET,"{'name': 'AMB Crypto', 'img': 'https://images.cryptocompare.com/news/default/ambcrypto.png', 'lang': 'EN'}",ambcrypto,2025-10-21 01:00:06
53434149,https://www.newsbtc.com/?p=840705,1761008415,https://resources.cryptocompare.com/news/21/53434149.jpeg,Bitcoin Whale Goes Big — $255M Longs Opened Before Trump–China Summit,https://www.newsbtc.com/bitcoin-news/bitcoin-whale-goes-big-255m-longs-opened-before-trump-china-summit/,"Bitcoin and Ethereum rose after US President Donald Trump confirmed a meeting with China’s leader during the APEC summit on October 31. Based on reports, Bitcoin climbed nearly 4% while Ethereum gained about 5% and traded around $4,030. The whole market added roughly $100 billion in value in a short window, according to market watchers. Related Reading: $3M In Stolen XRP Tracked — But Victim May Never See It Again: Investigator Insider Whale Bets And Mixed Positions Reports have disclosed that an insider whale opened $255 million in long positions across Bitcoin and Ethereum. At the same time, the same trader put on a $76 million short on Bitcoin with 10x leverage. The moves look like a bet on swings in price rather than a single directional stake. Observers note the trader has a history of large, well-timed trades, including a prior $730 million short that paid off. There is no clear public ID for this whale, and the motives are being examined by analysts. Insider Bitcoin whale is back. He just opened a $76,195,977 $BTC short position with 10x leverage. Does he know something? pic.twitter.com/K4ldvQE1TN — Ted (@TedPillows) October 19, 2025 Political Shift Sends Prices Higher Based on reports, comments by US President Donald Trump helped calm markets. He reportedly said “it will all be fine” when speaking about China’s economy, and the tone toward Beijing softened after a week where he had announced a 100% tariff on Chinese goods. That tariff claim had sparked a big sell-off across traditional and crypto markets just days earlier. Market players reacted quickly to the latest signals of a thaw, viewing the upcoming meeting as a chance for reduced tension. 🚨BREAKING AN INSIDER WITH A 100% WIN RATE JUST OPENED $BTC AND $ETH LONGS WORTH $255 MILLION HE DEFINITELY KNOWS SOMETHING 👀 pic.twitter.com/hwAkXPzBwW — Wimar.X (@DefiWimar) October 19, 2025 On-Chain Activity And Institutional Moves According to on-chain data and exchange records, large-scale activity continued across spot markets. BitMine was reported to have picked up about $1.5 billion worth of Ether, a move that market participants say shows faith in Ethereum’s long-term outlook. Meanwhile, El Salvador quietly added eight BTC to its reserves, bringing its total holdings to 6,355.18 BTC. Exchange Flows Show Withdrawals Based on exchange records, major centralized platforms recorded a net outflow of roughly 21,000 BTC over the past week. Coinbase Pro and Binance were named among those with the biggest withdrawals, showing about 15,000 BTC and 12,000 BTC moved off exchanges, respectively. Traders interpret such flows in different ways: some see accumulation into private wallets, others see funds repositioned by large traders. Related Reading: Biggest Shiba Inu Burn In Months — And It Came From A Coinbase Account The Implications Of This Moving Forward Reports indicate that the market is reacting to both political signals and positions being adjusted by big hands. If the rhetoric between the US and China continues to show friendly signals, prices may push higher and retest monthly highs. But the presence of a sizeable short position alongside large long positions suggests that volatility will stay. Presently, data points are being watched closely and traders are establishing balances between advancing positions and hedging. Featured image from Gemini, chart from TradingView",Bitcoin News|bitcoin|btc|btcusd|china|crypto|ethereum|tariffs|trade war|Trump|us|Whale,EN,0,0,CRYPTOCURRENCY|BTC|MARKET|ETH|EXCHANGE,"{'name': 'NewsBTC', 'img': 'https://images.cryptocompare.com/news/default/newsbtc.png', 'lang': 'EN'}",newsbtc,2025-10-21 01:00:15
53434243,https://en.bitcoinsistemi.com/?p=180715,1761008447,https://resources.cryptocompare.com/news/81/53434243.jpeg,Solana Rebounds 4% Daily — Analysts Rank ADA and HYPE Among the Best Altcoins to Buy Under $1,https://en.bitcoinsistemi.com/solana-rebounds-4-daily-analysts-rank-ada-and-hype-among-the-best-altcoins-to-buy-under-1/,"Despite a bearish end to last week’s crypto liquidations, Solana price has managed to breakout soaring 5% today. In addition to SOL recovery, recoveries in Cardano and Hyperliquid were also steady with each recovering important support levels. This recovery has come about with an accumulation trend that will make the market ready for a wider breakout phase in late 2025. Concurrently, the rally has also revived the excitement to the presale projects like MAGACOIN FINANCE , which still has a good number of early investors calling it the best crypto to buy. Solana Builds Strength as Bulls Defend Key Levels Solana price rose 4% in the past 24 hours, indicating a new strength in the rising channel. The SOL price has been trading in a steady range of $185-$210, and buyers have been protecting the support at $190. According to the analysts, every test of this area is being received with active accumulation. This steady purchasing demand is a positive indicator of increasing confidence in the market. Technical traders regard the $205 to $210 as a possible breakout area that can cause the prices to go up to $246 and even to $300. Source; X Provided that Solana keeps holding above $180, it might proceed with its long-term growth pattern. Solana recovery has also led to a wider optimism in the altcoin market. Cardano Prepares for a Potential Technical Breakout Cardano is also exhibiting some stability with the token maintaining levels above the key support levels of approximately $0.65. ADA market data indicate that ADA is approaching a resistance area at $0.74 to $0.77, where sellers have been active in the last several sessions. When the market breaks out of this point it may indicate the beginning of a new short-term rise. Analyst Lark Davis observed that ADA recently showed a daily MACD golden cross, a precursor of large upsurge. Cardano has already shot up 150% since bottoming in September 2023 and has stayed in a distinct trend of higher lows. In the next major run, ADA may carry gains to $2.96 as long as the buying pressure is sustained. Source: X According to many traders, Cardano is currently one of the best crypto to buy at less than $1, as it has been assisted by technical strength and network enhancements that still continue to attract developers. Hyperliquid Growth Supported by Buyback Program Hyperliquid has been making continuous token buybacks amounting to over $521 million. These buybacks have replaced more than 5.6% of the circulating supply, which demonstrates steady protocol revenue. The gradual withdrawal of liquid supply has acted as a buffer when corrections were made recently and has thus created good grounds of recovery. Source: Tokenomist Under the new HyperEVM integration and active involvement in its ecosystem, the on-chain data of HYPE are healthy. The price action indicates that the token is trading within the range of $34 to $37 support indicating a sign of buyers accumulating in the range. With the trend, analysts estimate a possible rebound to a range of $45. The combination of lower supply, ecosystem growth, and long-term investor confidence have positioned Hyperliquid as a one of the most promising projects during periods of market consolidation to be the best crypto to own. MAGACOIN FINANCE Presale Attracts Investor Momentum Although there are already existing tokens that possess major support, new competitors such as MAGACOIN FINANCE are rapidly taking off. The presale that has been going on in the project has been registered with good participation of the retail and institutional investors. Subsequently, thousands of wallets have become part of the event and continue to boost the inflows every day as well as surpassing a few initial funding milestones. The PATRIOT50X bonus program, offered by MAGACOIN FINANCE has been the key to this rush. The incentive will reward the first participants who will earn up to 50% additional tokens. Analysts on X call it the XRP killer which may come to outperform even cryptos like Dogecoin or even Shiba Inu. Consequently, the presale is one of the most talked-about campaigns in all online communities, which makes MAGACOIN FINANCE one of the key upcoming listing candidates. It is now being listed as one of the best crypto to buy before the year 2025, as many traders note its large community base and clear presale process. Market Outlook The general market remains exhibiting a positive trend and Solana, Cardano and Hyperliquid are stable at strategic support points. All of the assets exhibit indications of gradual building up as the sentiment is slowly getting better. According to market analysts, the continued inflow into presale projects like MAGACOIN FINANCE makes investors ready to participate in the next stage of expansion. With the rotation of capital to new opportunities, it will be likely to focus on the developments which have both good fundamentals and community developments. As Solana has recovered, ADA has been on the technical upward trend, and HYPE has decreased supply, MAGACOIN FINANCE is currently one of the best altcoin to buy in the current accumulation phase. To learn more about MAGACOIN FINANCE, visit: Website: https://magacoinfinance.com Access: https://magacoinfinance.com/access Twitter/X: https://x.com/magacoinfinance Telegram: https://t.me/magacoinfinance Continue Reading: Solana Rebounds 4% Daily — Analysts Rank ADA and HYPE Among the Best Altcoins to Buy Under $1",News,EN,0,0,CRYPTOCURRENCY|ADA|SOL|TRADING|MARKET,"{'name': 'BitcoinSistemi', 'img': 'https://resources.cryptocompare.com/news/81/default.png', 'lang': 'EN'}",bitcoinsistemi,2025-10-21 01:00:47
