id,guid,published_on,imageurl,title,url,body,tags,lang,upvotes,downvotes,categories,source_info,source,date
56563365,https://bitcoinworld.co.in/?p=256435,1767045311,https://resources.cryptocompare.com/news/82/default.png,SEC Crypto Enforcement: Waters’ Scathing Critique Exposes Regulatory Retreat,https://bitcoinworld.co.in/maxine-waters-criticizes-sec-crypto-enforcement/,"BitcoinWorld SEC Crypto Enforcement: Waters’ Scathing Critique Exposes Regulatory Retreat WASHINGTON, D.C. – March 2025: Representative Maxine Waters has launched a significant critique against the Securities and Exchange Commission’s recent approach to cryptocurrency regulation. The ranking Democratic member of the House Financial Services Committee specifically targets the SEC’s decision to suspend enforcement actions against several prominent crypto firms. This development raises crucial questions about regulatory consistency and investor protection in the rapidly evolving digital asset space. SEC Crypto Enforcement Under Congressional Scrutiny Representative Waters’ formal letter to Committee Chairman French Hill reveals substantial concerns about regulatory enforcement patterns. The SEC has reportedly suspended or dropped actions against multiple companies and individuals accused of securities law violations. Notably, this list includes major industry players like Coinbase, Binance, and entrepreneur Justin Sun. Waters asserts the committee has failed to properly investigate why the SEC abandoned these actions. Furthermore, she questions how the regulatory body plans to prevent future fraud and market manipulation without consistent enforcement. The cryptocurrency industry has experienced dramatic regulatory shifts throughout the 2020s. Initially, the SEC under Chairman Gary Gensler pursued an aggressive enforcement strategy. However, recent court decisions and political pressure have created a more complex landscape. Consequently, regulatory agencies now face difficult decisions about resource allocation and legal strategy. Waters’ criticism emerges against this backdrop of changing regulatory priorities and increasing industry lobbying efforts. Historical Context of Cryptocurrency Regulation Understanding this controversy requires examining the SEC’s evolving stance on digital assets. The agency first asserted jurisdiction over certain cryptocurrencies as securities following the 2017 DAO Report. Subsequently, enforcement actions increased significantly during the 2021-2023 period. The SEC filed numerous cases alleging unregistered securities offerings and fraudulent activities. However, several high-profile legal setbacks have recently influenced the commission’s approach. Key Legal Decisions Impacting SEC Strategy Recent court rulings have substantially affected the SEC’s enforcement capabilities. For instance, the Ripple Labs decision created important distinctions between institutional and retail sales of XRP. Additionally, the Grayscale Bitcoin ETF approval signaled shifting judicial perspectives on cryptocurrency products. These legal developments have forced regulatory agencies to reassess their litigation strategies. Meanwhile, Congress continues debating comprehensive digital asset legislation that could clarify jurisdictional boundaries. The following table illustrates major SEC enforcement actions against cryptocurrency firms since 2020: Year Company/Individual Alleged Violation Current Status 2020 Telegram Unregistered $1.7B ICO Settled 2023 Coinbase Operating unregistered exchange Ongoing litigation 2023 Binance Multiple securities violations Partial settlements 2023 Justin Sun Fraud and market manipulation Dropped according to Waters Potential Impacts on Market Participants Reduced SEC enforcement could create significant consequences for various market participants. Retail investors might face increased risks without regulatory oversight. Meanwhile, legitimate cryptocurrency businesses could encounter unfair competition from non-compliant operators. The situation also raises questions about international regulatory coordination. Other jurisdictions might interpret reduced U.S. enforcement as signaling different standards. Industry experts express mixed reactions to these developments. Some legal scholars argue selective enforcement undermines regulatory credibility. Others suggest strategic retreats might allow better resource allocation. However, most agree that regulatory clarity remains essential for long-term industry growth. The current uncertainty potentially hinders institutional adoption and technological innovation. Investor Protection Considerations Representative Waters emphasizes investor protection concerns throughout her critique. She references previous cryptocurrency collapses that caused substantial investor losses. Without consistent enforcement, similar situations could potentially reoccur. The congresswoman specifically questions how the SEC plans to address: Market manipulation in decentralized and centralized exchanges Transparency requirements for cryptocurrency offerings Custody standards for digital asset storage Disclosure practices for project teams and promoters Political and Legislative Implications This controversy occurs during ongoing congressional debates about cryptocurrency regulation. Multiple legislative proposals currently address digital asset classification and regulatory jurisdiction. Waters’ letter adds urgency to these discussions. It also highlights partisan differences regarding financial regulation approaches. Democratic lawmakers generally favor stronger consumer protections. Meanwhile, Republican members often emphasize innovation and market development. The House Financial Services Committee plays a crucial role in shaping financial policy. Its oversight function includes monitoring regulatory agency performance. Waters’ criticism suggests potential committee investigations into SEC decision-making. Such inquiries could examine internal communications and resource allocation decisions. They might also consider political influences on enforcement priorities. Broader Regulatory Landscape Analysis The SEC represents just one component of the U.S. cryptocurrency regulatory framework. The Commodity Futures Trading Commission claims jurisdiction over certain digital assets as commodities. Additionally, banking regulators oversee cryptocurrency custody and banking relationships. State authorities maintain their own licensing and enforcement mechanisms. This fragmented approach creates complexity for market participants and regulators alike. International regulatory developments further complicate the situation. The European Union recently implemented comprehensive Markets in Crypto-Assets regulation. Asian jurisdictions have adopted diverse approaches ranging from restrictive to supportive. Global coordination remains limited despite cross-border nature of cryptocurrency markets. Inconsistent enforcement across jurisdictions could create regulatory arbitrage opportunities. Conclusion Representative Maxine Waters’ critique of SEC crypto enforcement actions highlights significant regulatory challenges. The suspension of cases against major industry participants raises questions about consistency and effectiveness. This development occurs amidst evolving legal precedents and ongoing legislative debates. Ultimately, regulatory clarity and consistent enforcement remain essential for market stability and investor protection. The cryptocurrency industry continues navigating complex regulatory waters while seeking legitimate pathways for innovation and growth. FAQs Q1: Why is Representative Waters criticizing the SEC? Representative Waters criticizes the SEC for suspending or dropping enforcement actions against cryptocurrency firms accused of securities violations. She believes this reduces investor protections and requires congressional investigation. Q2: Which companies does Waters mention in her criticism? Her letter specifically references Coinbase, Binance, and entrepreneur Justin Sun as examples where the SEC has reportedly halted enforcement actions. Q3: What committee does Representative Waters serve on? She serves as the ranking Democratic member of the House Financial Services Committee, which oversees financial regulation including SEC activities. Q4: How might reduced enforcement affect cryptocurrency investors? Reduced enforcement could potentially increase risks for investors through less oversight of market manipulation, fraud, and disclosure violations in the cryptocurrency space. Q5: What broader implications does this criticism have? This development highlights ongoing debates about cryptocurrency regulation, jurisdictional boundaries between agencies, and the appropriate balance between innovation and investor protection. This post SEC Crypto Enforcement: Waters’ Scathing Critique Exposes Regulatory Retreat first appeared on BitcoinWorld .",Crypto News|Congress|CRYPTOCURRENCY|enforcement|REGULATION|SEC,EN,0,0,BUSINESS|EXCHANGE|MARKET|REGULATION|CRYPTOCURRENCY,"{'name': 'Bitcoin World', 'img': 'https://resources.cryptocompare.com/news/82/default.png', 'lang': 'EN'}",bitcoinworld,2025-12-29 21:55:11
56564384,https://www.bitdegree.org/crypto/news/south-korean-mp-faces-heat-for-family-link-to-crypto-firm,1767045473,https://resources.cryptocompare.com/news/66/56564384.jpeg,South Korean MP Faces Heat for Family Link to Crypto Firm,https://www.bitdegree.org/crypto/news/south-korean-mp-faces-heat-for-family-link-to-crypto-firm,"Kim Byung-kee , a figure in South Korea’s Democratic Party, is facing questions about his actions toward Bithumb , a local cryptocurrency exchange.",regulation,EN,0,0,ASIA|EXCHANGE|REGULATION|CRYPTOCURRENCY,"{'name': 'BitDegree', 'img': 'https://images.cryptocompare.com/news/default/bitdegree.png', 'lang': 'EN'}",bitdegree,2025-12-29 21:57:53
56563598,https://www.cryptopolitan.com/?p=885452,1767045600,https://resources.cryptocompare.com/news/43/56563598.jpeg,Dogecoin (DOGE) Price Struggles Against Heavy Selling Pressure As Institutions Exit to This Cheapest Crypto to Buy,https://www.cryptopolitan.com/dogecoin-doge-price-struggles-against-heavy-selling-pressure-as-institutions-exit-to-this-cheapest-crypto-to-buy/,"The trading volume increased by as much as 76% for Dogecoin, amounting to $1.01 billion. However, its price dropped by 0.5% at $0.1254, signifying a considerable number of selling activities. The technical analysis indicates a bearish trend that may continue to press down the price. There is also another indicator that shows DOGE could be oversold, and this is at times an indicator of an approaching bounce. There has been a lack of interest from prominent investors, despite DOGE being part of an ETF and various companies holding DOGE within their portfolios. Dogecoin Undergoes Technical Pressure A significant discrepancy is presently evident in the case of DOGE: the volume of trading has increased, while the market price has not. This seems to be an indicator of high trading volume but low market price. The graph shown is negative; this is disappointing for the traders, as they expected a positive closing result at the end of the year. Year to date, Dogecoin is down by 61% in value despite the positive event of the launch of ETFs. The price of DOGE is strongly correlated to the price of Bitcoin. This means that if the price of Bitcoin improves, the price of DOGE will also go up. Mutuum Finance: A Leading Cryptocurrency for Investments As massive capital exits high-risk meme coins, investors are looking at better-sounding projects. Among the best available is that of Mutuum Finance (MUTM) ; it has an transparent presale process and functional technology. The presale has managed to raise $19.5 million from more than 18,600 investors. It is in Phase 6, which is 99% sold out. The pricing of the tokens is $0.035, indicating a 250% jump from phase one price. Speculative purchases might have seen a gain of about 420% during launch at $0.06. This makes MUTM a cheap cryptocurrency with promising prospects. With the end of Phase 6, Phase 7 begins immediately with a higher price of $0.04, indicating a 20% jump. This chance of purchase at a cheap price is short-lived. Dual-System Design – Durability Mutuum Finance uses two different loan platforms. The first one pools money for mainstream assets like ETH, while the other one allows customers to design their own loan programs for other assets. Clients receive exclusive loyalty tokens with which interest is accrued automatically. Mutuum Finance’s two-level system makes it more flexible compared to its rivals and thus the best crypto to invest in. One of the major considerations for the platform is security.Certik has carried out a major security audit, scoring MUTM highly. A bug bounty scheme worth $50,000 has been implemented. This has been done to satisfy the institutional investors. The first version of the platform is to be launched on a test network by the end of 2025. Buying MUTM is also easy, with direct credit/debit card purchases possible without restriction. There is also a $100,000 giveaway , where ten individuals win, in addition to a leaderboard from which $500 is given to the top trader each day. The Pending Opportunity at the Lowest Price With issues faced by Dogecoin, investments are moving towards platforms such as Mutuum Finance, due to their potential for development and not mere speculative endeavors. Phase 6 has been 99% sold out, thus a last chance exists for its purchase at $0.035 before price increments kick in. For more information about Mutuum Finance (MUTM) visit the links below: Website: https://mutuum.com/ Linktree: https://linktr.ee/mutuumfinance",Press Release,EN,0,0,BUSINESS|DOGE|MARKET|TRADING|CRYPTOCURRENCY,"{'name': 'Cryptopolitan', 'img': 'https://images.cryptocompare.com/news/default/cryptopolitan.png', 'lang': 'EN'}",cryptopolitan,2025-12-29 22:00:00
56563466,https://www.newsbtc.com/?p=870713,1767045604,https://resources.cryptocompare.com/news/21/56563466.jpeg,"Dogecoin Chart Mirrors Silver’s Breakout, Analyst Flags $9+ Scenario",https://www.newsbtc.com/news/dogecoin/dogecoin-mirrors-silver-analyst-9-scenario/,"Silver has staged a historic, late-December breakout, surging from roughly $50 an ounce in mid-November to an intraday all-time high above $83, before easing slightly as traders took profits. Will Dogecoin follow its lead? At press time, spot silver was holding near $76 after pulling back from the earlier record high of $83.62, with the metal up roughly 181% year-to-date in 2025, an outsized move for the precious-metal. The rally is attributed to a mix of macro and market-structure drivers including expectations for easier US monetary policy in 2026, strong industrial and investment demand, persistent supply shortfalls, and silver’s recent designation as a US “critical mineral,” which added a policy-sensitive supply narrative to an already tight market. The ‘Silver Fractal’ Pitch For Dogecoin That silver move is now being used as a visual analog in crypto. X analyst Cantonese Cat (@cantonmeow) posted a side-by-side TradingView comparison suggesting Dogecoin’s 6-month chart resembles silver’s 3-day structure from three weeks ago, implying DOGE could be positioned for a similarly persistent advance if the fractal holds. In the shared DOGE 6-month panel, Cantonese Cat shows a large selloff candle and frames it as a potential cyclical low. Based on the silver comparison, the interpretation is not “DOGE pumps next week,” but “DOGE trends for years.” Related Reading: Dogecoin Triangle Formation Breakdown Spells Trouble As 15% Move Nears – Time To Be Cautious? In the proposed fractal path, the current 6-month candle would mark the bottom, followed by eight additional 6-month candles spanning roughly four years where seven are green and only one is red. The lone red candle is mapped as the third in the sequence, implying the first half of 2027 could be a down half-year even within an overarching uptrend. If the pattern were to track silver “exactly,” the projected cycle peak would land in the second half of 2029, with a peak price “above $11” in that window. Related Reading: Dogecoin Is Repeating Its 2020 Accumulation Cycle, Analyst Says How It Fits His Earlier Wave Framework The comparison follows Cantonese Cat’s earlier Dec. 20 post outlining a longer-horizon DOGE roadmap on the weekly chart. “We’ve already had a 13 month bear market for DOGE, with my working hypothesis of this being likely a wave 2 correction prior to wave 3 explosion,” the analyst wrote. The accompanying weekly DOGE chart labels the prior advance as “Wave 1” and the subsequent decline as “Wave 2,” with a descending trendline drawn across the multi-year structure. The Dec. 20 weekly snapshot shows DOGE around $0.13160 with retracement levels including 0.382 at about $0.11771, and 0.236 at about $0.08427, with the base (“0”) around $0.04909. Above the current price, the analysis maps 0.5 at about $0.15422 as the next resistance, followed by 0.618 at about $0.20205, 0.707 at about $0.24770, 0.786 at about $0.29681, and 0.886 at about $0.37315, before the 1.0 level near $0.48442. Above the prior high, the same map plots extension targets often used in Elliott Wave projection frameworks, labeled near 1.272 ($0.90288), 1.414 ($1.24968), 1.618 ($1.99344), 2 ($4.77927), and 2.272 ($8.90771). The implication is conditional: the extensions matter only if DOGE completes the corrective phase and reclaims the prior impulse high. At press time, DOGE traded at $ Featured image created with DALL.E, chart from TradingView.com",Dogecoin|doge|DOGE news|Doge price|Dogecoin news|dogecoin price,EN,0,0,DOGE|MARKET|SPONSORED|TRADING|CRYPTOCURRENCY,"{'name': 'NewsBTC', 'img': 'https://images.cryptocompare.com/news/default/newsbtc.png', 'lang': 'EN'}",newsbtc,2025-12-29 22:00:04
56565152,649365,1767045624,https://resources.cryptocompare.com/news/13/56565152.jpeg,XRP ETFs Set To Trigger A Supply Squeeze? Here’s How Much Coins Are Left On Exchanges,https://bitcoinist.com/xrp-etfs-trigger-supply-squeeze/,"XRP ETF activity is pushing the asset into a phase where market structure increasingly outweighs market sentiment, as exchange-held supply continues to contract while institutional access expands. Analysts are now examining whether sustained ETF absorption could function as a long-term demand sink, tightening liquid supply and reshaping the mechanics of price discovery. Shrinking Supply? Institutional Absorption Of XRP ETFs Accelerates A market commentator on X has drawn attention to a sharp and sustained decline in XRP balances held across centralized exchanges, pointing to a structural change in how the asset is being absorbed and held. According to the figures cited, XRP ETFs have removed approximately 750 million XRP from exchanges within a matter of weeks, leaving an estimated 1.5 billion XRP remaining in liquid exchange reserves . This pace of absorption places exchange-held supply on a visibly contracting trajectory. The same X account shared an on-chain chart that visually substantiates the decline in exchange-held XRP. The data shows total balances across centralized exchanges trending steadily lower throughout 2025. Notably, this contraction occurs while price action remains relatively contained, indicating that supply is being withdrawn from exchanges without provoking sharp directional moves. This separation between declining liquidity and stable pricing points to deliberate, conviction-driven absorption, consistent with long-term institutional positioning . ETF-held XRP, by design, functions as locked capital rather than short-term liquidity. Once absorbed into exchange-traded products and institutional custody structures, tokens are effectively sidelined from day-to-day trading activity. This creates a largely one-directional supply dynamic , reducing the amount of XRP available to respond to new demand. On-chain data visualized in the chart supports this interpretation, showing consistent outflows that persist through both local price peaks and pullbacks. Regulatory developments further contextualize this trend. The market commentator explicitly links the tightening supply to the Clarity Act , which provides a framework for compliant institutional participation. With clearer legal treatment, XRP becomes suitable for long-term balance sheet exposure and operational use. Why 2026 Is Emerging As A Structural Inflection Point The supply narrative gains additional weight when viewed through a forward-looking lens. Projections pointing to early 2026 as a potential supply shock window are based not on aggressive acceleration, but on simple continuation. At the current rate of ETF-driven absorption, exchange balances could approach critically thin levels, creating a low-float market structure where marginal demand exerts disproportionate influence on price. The chart underscores this risk. As exchange-held XRP compresses toward historically low territory, the remaining liquid supply increasingly defines price discovery. In such conditions, price formation shifts away from speculative churn and toward liquidity mechanics, where availability, custody constraints, and institutional flows dominate outcomes. Taken together, falling exchange balances , sustained ETF absorption , and the regulatory clarity introduced by the Clarity Act all point to a market steadily tightening. Should these conditions persist into early 2026, XRP’s next major phase is likely to be shaped by scarcity and institutional liquidity dynamics, establishing a structural inflection point for the asset.",XRP|ripple|ripple news|XRP ETF|XRP ETFs|XRP news|XRP price|XRPUSD|XRPUSDT,EN,0,0,EXCHANGE|MARKET|TRADING|XRP|CRYPTOCURRENCY,"{'name': 'Bitcoinist', 'img': 'https://images.cryptocompare.com/news/default/bitcoinist.png', 'lang': 'EN'}",bitcoinist,2025-12-29 22:00:24
56563560,https://ambcrypto.com/?p=557456,1767045650,https://images.cryptocompare.com/news/default/ambcrypto.png,Solana rebounds from $119 support – But can SOL push higher?,https://ambcrypto.com/solana-rebounds-from-119-support-but-can-sol-push-higher/,"Solana rebounded from support as volume surged, but leverage clustered near resistance.",Altcoin|News|News 1|Social|Solana|Trading View,EN,0,0,ALTCOIN|SOL|CRYPTOCURRENCY,"{'name': 'AMB Crypto', 'img': 'https://images.cryptocompare.com/news/default/ambcrypto.png', 'lang': 'EN'}",ambcrypto,2025-12-29 22:00:50
56564385,https://www.bitdegree.org/crypto/news/bitcoin-crushes-gold-and-silver-with-27-701-decade-surge,1767046179,https://resources.cryptocompare.com/news/66/56564385.jpeg,"Bitcoin Crushes Gold and Silver with 27,701% Decade Surge",https://www.bitdegree.org/crypto/news/bitcoin-crushes-gold-and-silver-with-27-701-decade-surge,A new comparison by analyst and author Adam Livingston shows that Bitcoin’s BTC growth over the past decade has far exceeded that of gold and silver .,cryptocurrencies,EN,0,0,BTC|FIAT|CRYPTOCURRENCY,"{'name': 'BitDegree', 'img': 'https://images.cryptocompare.com/news/default/bitdegree.png', 'lang': 'EN'}",bitdegree,2025-12-29 22:09:39
