id,guid,published_on,imageurl,title,url,body,tags,lang,upvotes,downvotes,categories,source_info,source,date
53439149,https://www.newsbtc.com/?p=840629,1761019242,https://resources.cryptocompare.com/news/21/53439149.jpeg,Bitcoin Enters ‘Disbelief Phase’ – Could Short Sellers Face The Next Squeeze?,https://www.newsbtc.com/bitcoin-news/bitcoin-disbelief-phase-short-sellers-squeeze/,"After the massive crash on October 10 – which saw Bitcoin (BTC) touch $102,000 before recovering some losses – some analysts now predict that the top cryptocurrency may be on the verge of another bullish rally as it enters the ‘disbelief phase.’ Bitcoin In Disbelief Phase – Trouble For Bears? According to a CryptoQuant Quicktake post by contributor Darkfost, Bitcoin appears to be entering the disbelief phase, which increases the possibility of a rebound to the upside. The contributor emphasized the slightly negative funding rate to support their analysis. Related Reading: Bitcoin Cycle Score Turns Negative With Trend Below $106,780 – When Will The Correction End? For the uninitiated, the Bitcoin disbelief phase occurs when a new uptrend begins, but most investors remain skeptical after a recent correction, doubting that the recovery is real. During this phase, lingering bearish sentiment and short positions often act as fuel for a stronger rally once confidence returns. Darkfost stated that investors’ skepticism toward BTC returning to bullish mode can be gauged through BTC funding rates in the derivatives market. Funding rates remained negative at -0.004% on the exchange for six out of seven days over the past week, indicating traders are still slightly bearish. The likely reason behind traders’ short bias is the October 10 crypto market crash that led to a liquidation worth $19 billion. Since then, traders have consistently chosen to short the market instead of getting trapped in another price pullback. However, the longer BTC remains in the disbelief phase, the stronger the potential for an explosive upside move becomes. Darkfost added: If the current uptrend continues to establish itself, the growing pile of short positions against it could become a powerful fuel for the next leg higher. As these shorts get liquidated, it would drive prices upward, triggering a short squeeze. If a short squeeze happens, then BTC could quickly rally to major liquidity zones around $113,000 level, and even as high as $126,000 region, where significant short orders liquidations are clustered. The analyst shared two previous instance where such a pattern played out. In September 2024, BTC fell to $54,000 before surging to a new all-time high beyond $100,000. Similarly, in April 2025, the flagship digital asset rallied from $85,000 to $111,000, before climbing even higher to $123,000. To conclude, the Bitcoin market may be on the verge of another short squeeze, fueled by investors’ skepticism. BTC Investors Need To Be Cautious Although BTC is giving hints of a looming short squeeze, investors should still exercise some caution before entering the market in hopes of an instant turnaround in sentiment. For example, Bitcoin activity recently slumped below its 365-day average, raising fears of a loss of momentum. Related Reading: Bitcoin Market Feels “Too Efficient” As Arbitrage Opportunities Vanish – What It Means For Price? That said, some crypto analysts forecast that BTC is likely done with the price correction and is set to surge in the coming days. At press time, BTC trades at $110,814, up 2.8% in the past 24 hours. Featured image from Unsplash, charts from CryptoQuant and TradingView.com",Bitcoin News|Binance|bitcoin|bitcoin disbelief phase|btc|BTCUSDT|crypto|crypto exchange|cryptocurrency|digital asset|on-chain analysis,EN,0,0,CRYPTOCURRENCY|BTC|TRADING|MARKET|BUSINESS,"{'name': 'NewsBTC', 'img': 'https://images.cryptocompare.com/news/default/newsbtc.png', 'lang': 'EN'}",newsbtc,2025-10-21 04:00:42
53439509,https://cointelegraph.com/news/coinbase-urges-ai-blockchain-aml-crypto-crime?utm_source=rss_feed&utm_medium=rss&utm_campaign=rss_partner_inbound,1761019710,https://images.cryptocompare.com/news/default/cointelegraph.png,Coinbase to US: Embrace blockchain if you want to fight crime on it,https://cointelegraph.com/news/coinbase-urges-ai-blockchain-aml-crypto-crime?utm_source=rss_feed&utm_medium=rss&utm_campaign=rss_partner_inbound,Chief legal officer Paul Grewal said in his letter to Treasury that money laundering schemes have become increasingly sophisticated and law enforcement needs advanced technologies to counter them.,,EN,0,0,BLOCKCHAIN|CRYPTOCURRENCY|EXCHANGE|REGULATION|DIGITAL ASSET TREASURY,"{'name': 'Cointelegraph', 'img': 'https://images.cryptocompare.com/news/default/cointelegraph.png', 'lang': 'EN'}",cointelegraph,2025-10-21 04:08:30
53439402,https://en.coinotag.com/institutions-bullish-on-bitcoin-67-eye-price-rise-through-2026-amid-accumulation/,1761019757,https://resources.cryptocompare.com/news/77/53439402.jpeg,"Institutions Bullish on Bitcoin, 67% Eye Price Rise Through 2026 Amid Accumulation",https://en.coinotag.com/institutions-bullish-on-bitcoin-67-eye-price-rise-through-2026-amid-accumulation/,"Institutional investors maintain strong bullishness on Bitcoin, with nearly 67% anticipating price increases through 2026 amid ongoing accumulation by whales and long-term holders, signaling sustained confidence despite market volatility. Nearly",Bitcoin|News|BTC|ETH,EN,0,0,CRYPTOCURRENCY|BTC|TRADING|ETH|BUSINESS,"{'name': 'CoinOtag', 'img': 'https://resources.cryptocompare.com/news/77/default.png', 'lang': 'EN'}",coinotag,2025-10-21 04:09:17
53439451,https://en.coinotag.com/coinbase-urges-us-treasury-to-leverage-ai-and-blockchain-against-crypto-financial-crime/,1761019882,https://resources.cryptocompare.com/news/77/53439451.jpeg,Coinbase Urges US Treasury to Leverage AI and Blockchain Against Crypto Financial Crime,https://en.coinotag.com/coinbase-urges-us-treasury-to-leverage-ai-and-blockchain-against-crypto-financial-crime/,"Coinbase urges the US Treasury to adopt blockchain analytics, AI, and other advanced technologies to combat increasingly sophisticated money laundering in crypto. This approach modernizes anti-money laundering efforts under the",Analysis|News,EN,0,0,CRYPTOCURRENCY|BLOCKCHAIN|EXCHANGE|MACROECONOMICS|REGULATION,"{'name': 'CoinOtag', 'img': 'https://resources.cryptocompare.com/news/77/default.png', 'lang': 'EN'}",coinotag,2025-10-21 04:11:22
53439526,https://www.newsbtc.com/?p=840959,1761020060,https://resources.cryptocompare.com/news/21/53439526.jpeg,Bitcoin Price Stabilizes After Drop — Early Signs Of Recovery Emerge,https://www.newsbtc.com/analysis/btc/bitcoin-price-stabilizes-after-drop-early-signs-of-recovery-emerge/,"Bitcoin price is attempting to recover above $108,000 and $108,500. BTC tested $111,800 and is currently trimming recent gains. Bitcoin started a fresh recovery wave above the $108,000 resistance level. The price is trading above $108,000 and the 100 hourly Simple moving average. There is a bullish trend line with support at $108,800 on the hourly chart of the BTC/USD pair (data feed from Kraken). The pair might continue to move up if it trades above the $110,500 zone. Bitcoin Price Trims Some Gains Bitcoin price started a recovery wave above the $105,500 resistance. BTC was able to surpass the $107,500 and $108,500 resistance levels. The bulls pushed the price above $110,500. There was a clear move above the 50% Fib retracement level of the recent decline from the $115,975 swing high to the $103,582 low. However, the bulls struggled to keep the price above the $111,500 level. The price is slowly moving lower from the 61.8% Fib retracement level of the recent decline from the $115,975 swing high to the $103,582 low. Besides, there is a bullish trend line with support at $108,800 on the hourly chart of the BTC/USD pair. Bitcoin is now trading above $109,000 and the 100 hourly Simple moving average. Immediate resistance on the upside is near the $110,500 level. The first key resistance is near the $111,200 level. The next resistance could be $111,500. A close above the $111,500 resistance might send the price further higher. In the stated case, the price could rise and test the $112,500 resistance. Any more gains might send the price toward the $113,200 level. The next barrier for the bulls could be $115,000. Another Drop In BTC? If Bitcoin fails to rise above the $110,000 resistance zone, it could start a fresh decline. Immediate support is near the $108,800 level and the trend line. The first major support is near the $108,000 level. The next support is now near the $107,550 zone. Any more losses might send the price toward the $106,500 support in the near term. The main support sits at $105,500, below which BTC might struggle to recover in the short term. Technical indicators: Hourly MACD – The MACD is now gaining pace in the bearish zone. Hourly RSI (Relative Strength Index) – The RSI for BTC/USD is now below the 50 level. Major Support Levels – $108,800, followed by $108,000. Major Resistance Levels – $110,500 and $111,500.",BTC|bitcoin|bitcoin price|btcusd|BTCUSDT|xbtusd,EN,0,0,TRADING|CRYPTOCURRENCY|BTC|EXCHANGE|MARKET,"{'name': 'NewsBTC', 'img': 'https://images.cryptocompare.com/news/default/newsbtc.png', 'lang': 'EN'}",newsbtc,2025-10-21 04:14:20
53439992,https://cryptonews.com/?p=441088,1761020971,https://resources.cryptocompare.com/news/52/53439992.jpeg,"[LIVE] Crypto News Today: Latest Updates for Oct. 21, 2025 – Bitcoin Steadies Near $109K After Volatile Week; Ethereum Falls Below $3,900 as Market Remains Caut...",https://cryptonews.com/news/live-crypto-news-today-latest-updates-for-oct-2-2025/,"Bitcoin fell 1.5% below $109,000 on Tuesday during early Asian trading hours, while Ethereum dropped over 3% to under $3,900, as traders remain cautious despite modest gains in DeFi, PayFi, and meme sectors. According to Glassnode, last week’s sharp drop from $115,000 to $104,000 flushed out weak hands and triggered a defensive market rotation. Futures open interest and funding rates have declined, and demand for downside protection has surged, signaling a shift toward risk aversion. Although Bitcoin briefly rebounded to around $111,000, the market structure remains fragile and dominated by caution. The post [LIVE] Crypto News Today: Latest Updates for Oct. 21, 2025 – Bitcoin Steadies Near $109K After Volatile Week; Ethereum Falls Below $3,900 as Market Remains Cautious appeared first on Cryptonews .",Industry Talk|Bitcoin|Ethereum|Market,EN,0,0,BTC|ETH|MARKET|TRADING|CRYPTOCURRENCY,"{'name': 'cryptonews', 'img': 'https://images.cryptocompare.com/news/default/cryptonews.png', 'lang': 'EN'}",cryptonews,2025-10-21 04:29:31
53439993,https://cryptonews.com/?p=441089,1761021026,https://resources.cryptocompare.com/news/52/53439993.jpeg,Canada Province Shuts Door on New Crypto Mining Ventures — Here’s Why,https://cryptonews.com/news/canada-province-british-columbia-bans-new-crypto-mining-ventures/,"Canadian province British Columbia has moved to ban new cryptocurrency mining projects, tightening control over how its clean electricity is used and ensuring the province’s vast hydroelectric power benefits higher-value industries. The province’s energy ministry said on Monday that BC Hydro, a government-owned utility, will no longer accept new grid connection requests for crypto mining. The move comes after a two-year moratorium introduced in 2022, which officials say will now become a long-term policy aimed at protecting energy supplies and avoiding grid strain. Move Aims To Protect Electricity Supply For Job-Intensive And Revenue-Generating Projects BC, a global exporter of natural resources such as lumber, minerals and hydropower, plans to redirect available electricity toward industries that create more jobs and revenue for local communities. Future grid connections will be prioritized for sectors like natural gas processing, hydrogen production and manufacturing. According to Bloomberg, the Canadian province of British Columbia plans to limit power use by AI data centers and permanently ban new crypto mining projects. The province’s Energy Ministry said it will prioritize grid access for mining and natural gas industries to create more… — Wu Blockchain (@WuBlockchain) October 21, 2025 The government said cryptocurrency mining consumes a large amount of energy. However, it provides little economic benefit to the province. Officials believe that redirecting electricity to industries with higher employment and investment potential will create greater public value. In comparison, pending crypto projects would have demanded more than 11,700 gigawatt-hours of power each year. That is enough electricity to supply hundreds of thousands of homes across British Columbia. Province Targets Balanced Grid Expansion Linking Energy Supply To Job Creation The permanent restriction is part of a broader set of energy policy reforms planned for late 2025. These reforms will determine how industrial electricity is distributed across the province. They will also set rules for fast-growing, high-consumption sectors such as data centers and artificial intelligence. In early 2026, BC Hydro will begin a competitive bidding process to allocate 400 megawatts of power. Of this, 300 megawatts will go to AI projects and 100 to general data centers. The process will run over two years. Meanwhile, traditional sectors such as mining, oil and gas, forestry and manufacturing will continue to have unrestricted access to industrial power, the ministry said. By 2026, construction on new transmission lines is expected to start. The expansion will continue through 2034 to strengthen BC’s grid and meet rising industrial demand. Officials said this long-term approach will help link power development with the province’s goals of job creation and economic diversification. BC’s Move Reflects Global Shift Toward Powering AI Over Energy-Hungry Crypto Mining The moratorium introduced in 2022 followed a sharp rise in crypto mining activity across British Columbia. Many companies were drawn to the province by its low-cost and renewable hydroelectric power. Soon after, BC joined other provinces such as Manitoba and Quebec in restricting crypto-related electricity use. The decision came amid growing environmental concerns and the instability of digital asset markets. At the time, policymakers warned that crypto mining consumed vast amounts of energy. They feared it could divert clean power away from households, hospitals and critical industries. Moreover, they questioned whether the largely automated mining operations brought any real employment or economic value to local communities. Since then, the government’s priorities have evolved. Officials now see greater long-term benefits in supporting AI and industrial projects that rely on stable electricity and generate stronger tax and job contributions. They say the move aligns with BC’s broader climate objectives and its transition toward a more resilient economy. The post Canada Province Shuts Door on New Crypto Mining Ventures — Here’s Why appeared first on Cryptonews .",Blockchain News|Canada|Crypto Mining,EN,0,0,BLOCKCHAIN|BUSINESS|COMMODITY|MINING|CRYPTOCURRENCY,"{'name': 'cryptonews', 'img': 'https://images.cryptocompare.com/news/default/cryptonews.png', 'lang': 'EN'}",cryptonews,2025-10-21 04:30:26
53440009,https://news.bitcoin.com/?p=764918&preview=true&preview_id=764918,1761021029,https://resources.cryptocompare.com/news/14/53440009.jpeg,Russia Hits 95% De-Dollarization in Settlements With China and India,https://news.bitcoin.com/russia-hits-95-de-dollarization-in-settlements-with-china-and-india/,"Russia’s accelerating shift away from the U.S. dollar is shaking up global finance, with nearly all trade between Moscow, China, and India now conducted in national currencies—reshaping energy markets and propelling a new era of multipolar economic power. 95% of Russia’s China and India Trade Now Bypasses Dollar Systems Russia’s increasing pivot toward de-dollarization is",Economics|China|India|Russia,EN,0,0,ASIA|FIAT|MARKET,"{'name': 'Bitcoin.com', 'img': 'https://images.cryptocompare.com/news/default/bitcoincom.png', 'lang': 'EN'}",bitcoin.com,2025-10-21 04:30:29
53440152,https://en.coinotag.com/bitcoins-wedge-breakout-signals-potential-bullish-momentum-toward-113440/,1761021311,https://resources.cryptocompare.com/news/77/53440152.jpeg,"Bitcoin’s Wedge Breakout Signals Potential Bullish Momentum Toward $113,440",https://en.coinotag.com/bitcoins-wedge-breakout-signals-potential-bullish-momentum-toward-113440/,"Bitcoin’s wedge breakout confirms bullish momentum, propelling the price toward $113,440 resistance with a 117% surge in trading volume, indicating strong buyer interest and potential for further gains amid supportive",Analysis|Bitcoin|News|BTC,EN,0,0,BTC|MARKET|TRADING|CRYPTOCURRENCY,"{'name': 'CoinOtag', 'img': 'https://resources.cryptocompare.com/news/77/default.png', 'lang': 'EN'}",coinotag,2025-10-21 04:35:11
53440780,https://en.coin-turk.com/?p=204844,1761022703,https://resources.cryptocompare.com/news/79/53440780.jpeg,Strategy Increases Bitcoin Holdings Despite Falling Market,https://en.coin-turk.com/strategy-increases-bitcoin-holdings-despite-falling-market/,"Strategy acquired 168 BTC for approximately $18.8 million recently. It now holds 640,418 BTC, nearing 3% of total Bitcoin supply. Continue Reading: Strategy Increases Bitcoin Holdings Despite Falling Market The post Strategy Increases Bitcoin Holdings Despite Falling Market appeared first on COINTURK NEWS .",Bitcoin (BTC),EN,0,0,BTC|MARKET|CRYPTOCURRENCY,"{'name': 'CoinTurk News', 'img': 'https://resources.cryptocompare.com/news/79/default.png', 'lang': 'EN'}",cointurken,2025-10-21 04:58:23
53440792,https://www.newsbtc.com/?p=840917,1761022803,https://resources.cryptocompare.com/news/21/53440792.jpeg,"Bear Market Alert: Top Expert Claims Bitcoin Price Fate Hangs On $101,700 Support Level",https://www.newsbtc.com/bitcoin-news/bear-market-alert-top-expert-claims-bitcoin-price-fate-hangs-on-101700-support-level/,"The Bitcoin price showed some signs of recovery at the start of the week, trading above the $110,000 mark. This uptick follows two consecutive Fridays of major drops, igniting fears and uncertainty among investors. These concerns have been compounded by predictions from experts about a potential bear market on the horizon. Looming Bear Market Threat Market analyst Doctor Profit, known for his accurate forecasts regarding the recent Bitcoin price trajectory, has recently cast doubt on whether market makers will allow both retail and institutional investors to exit at more favorable prices after incurring losses. Related Reading: Dogecoin Price Moves: Can It Repeat The 36,000% Rally ‘Anomaly’ From Last Cycle? In a social media post on X (previously Twitter), he suggested that the maximum bullish scenario for the Bitcoin price in the near-term could reach around $116,500, representing a 9% increase from its current levels. However, he emphasizes that a drop below $101,700 would breach what he terms the “magic bull market line,” effectively confirming a bear market. Profit advises caution, predicting a significant move that could push the Bitcoin price below this critical threshold, signaling the end of the bull run. Adding to the bearish sentiment, the Bitcoin price is currently hovering below the short-term holder realized price of $112,500. This figure represents the average entry point for short-term traders and buyers, many of whom are now facing losses. On-chain data compiled by the expert also indicates that these traders are likely to sell off their positions if the Bitcoin price dips between 5% and 10%, potentially intensifying short-term selling pressure. Challenging Times Ahead For Bitcoin Price Profit further elaborates on the market conditions, pointing out that current price movements are indicative of market makers liquidating both bullish and bearish positions. “Nothing goes down in a straight line,” he notes, suggesting that while the market could be in a bear market, it is essential to remain aware of short-term fluctuations. He argues that high-leverage traders must be wiped out on both sides before the market experiences its next significant downward movement. Related Reading: Is The Dogecoin Bull Run Over? Analyst Sees Echoes Of 2021 The expert also warns that every brief rally is designed to mislead bullish traders and liquidate late bearish positions. The market makers’ strategy appears to involve pushing Bitcoin toward the $116,500 region to eliminate late bears and generate sufficient liquidity for another downward price adjustment, potentially leading to new local lows. Looking ahead, Doctor Profit predicts that such price movements will continue to recur in the coming weeks and months, creating a challenging environment for investors in the volatile digital asset market. Featured image from DALL-E, chart from TradingView.com",Bitcoin News|bitcoin|Bitcoin news|bitcoin price|Bitcoin price analysis|Bitcoin price crash|Bitcoin Price Forecast|bitcoin price news|btc price|BTCUSDT|crypto news,EN,0,0,BTC|BUSINESS|MARKET|TRADING|CRYPTOCURRENCY,"{'name': 'NewsBTC', 'img': 'https://images.cryptocompare.com/news/default/newsbtc.png', 'lang': 'EN'}",newsbtc,2025-10-21 05:00:03
53440852,610354,1761022846,https://resources.cryptocompare.com/news/13/53440852.jpeg,Bolivia’s New Leader Declares War On Corruption With Blockchain,https://bitcoinist.com/bolivias-new-leader-declares-war-on-corruption-with-blockchain/,"According to reports, Bolivia’s new president has put blockchain at the center of a plan to cut corruption and raise transparency in government finances. Rodrigo Paz Pereira , who won the runoff that ended nearly two decades of rule by the Movement for Socialism, has made clean government a clear promise. He says modern ledgers can make money flows harder to hide. Blockchain Plan For Transparency Paz’s team is proposing the use of distributed ledgers for key public processes, including procurement and the tracking of public funds. Based on reports, the Central Bank of Bolivia relaxed a previous ban on cryptocurrencies in June 2024, a move that has opened the door for banks and fintechs to work with digital assets while keeping the boliviano as the official currency. Crypto activity in the country has grown sharply. Reported figures show crypto transactions rising from about $46.5 million in the first half of 2024 to roughly $294 million in the same period of 2025, a more than 500% jump in volume that has grabbed the attention of regulators and lawmakers. Why The Push Matters Supporters say blockchain will add a public, tamper-resistant record to budgets and contracts, which could make it harder for officials to hide graft. Critics warn that technology alone won’t fix weak institutions. They argue that audits, strong oversight and clear rules are still needed for any system to work. Reports have disclosed that the new administration is exploring pilot projects and international cooperation to build capacity, including ties with other countries that already use blockchain tools in some government functions. International Links And Local Caveats Bolivia has been seeking outside help. Based on reports, officials signed a memorandum of understanding with partners abroad to share regulatory ideas and technical know-how. That exchange could speed up implementation. At the same time, analysts note that rapid growth in crypto use raises its own challenges, such as consumer protection and money-laundering risks that must be managed. The Central Bank’s move to allow crypto interactions through formal banking channels was intended to reduce informal activity, but regulators now face new work in supervision and enforcement. Implementation details remain thin. Reports say pilot programs are likely to come first, focusing on a few government services before broader rollout. Success will depend on how public agencies adopt the tools, how clearly rules are written, and whether independent audits are used to check results. If the pilots expose gaps, they will be revised. If they work, the government could expand the approach to more areas. Featured image from El Pais/STR EFE, chart from TradingView",Crypto News|bitcoin|blockchain|Bolivia|corruption|crypto,EN,0,0,BLOCKCHAIN|BTC|FIAT|MACROECONOMICS|CRYPTOCURRENCY,"{'name': 'Bitcoinist', 'img': 'https://images.cryptocompare.com/news/default/bitcoinist.png', 'lang': 'EN'}",bitcoinist,2025-10-21 05:00:46
