id,guid,published_on,imageurl,title,url,body,tags,lang,upvotes,downvotes,categories,source_info,source,date
53442708,https://bitzo.com/2025/10/bitcoin-price-analysis-btc-reclaims-110000-as-markets-rebound,1761027016,https://resources.cryptocompare.com/news/104/53442708.jpeg,"Bitcoin Price Analysis: BTC Reclaims $110,000 As Markets Rebound",https://bitzo.com/2025/10/bitcoin-price-analysis-btc-reclaims-110000-as-markets-rebound,"Bitcoin (BTC) has climbed above $110,000 as the cryptocurrency market rebounds, buoyed by a potential Fed policy shift and positive developments after the latest trade tensions between the US and China. However, market sentiment remains cautious, with the Crypto Fear & Greed Index still in “Fear” territory at 30. Bitcoin Profit Taking Keeping Prices Subdued Analysts believe Bitcoin’s price action will remain subdued until long-term holders take profits. According to analyst James Check, the crypto market’s failure to recover was due to selling pressure, not manipulation, paper Bitcoin, or suppression. According to Check, the volume of sell-side pressure from Bitcoin holders is the source of resistance at the moment. According to crypto investor Will Clemente, the last year of relative weakness for the flagship cryptocurrency has largely been due to a supply transfer from Bitcoin OGs to traditional finance. “This dynamic will be mostly irrelevant in the coming years, just as everyone is focused on BTC’s relative weakness.” Galaxy Digital CEO Mike Novogratz echoed the same sentiment in an interview with Raoul Pal, stating, “There are a lot of people in the Bitcoin world who had rode this so long and finally decided, ‘I wanna buy something. People trimming because they’ve had a great run and we’re just digesting that turnover.” Meanwhile, BTC held on to a key level between $108,000 and $109,000, with analyst Rekt Capital stating, “Continued holding here could see the price rally to $120k+ over time. Stability here is absolutely key.” Strategy Can Convert Capital Into Bitcoin (BTC) In Hours: Michael Saylor Strategy executive chairman Michael Saylor has said that Bitcoin treasury companies like Strategy can turn fresh capital into BTC almost instantly. Saylor also posted a fresh teaser about another BTC purchase on Sunday. The Strategy executive chairman stated during an interview, “The investment cycle is a thousand times faster than technology, real estate, oil and gas, or anything else you’ve ever seen before in your life. Sometimes we’re literally selling 50 million an hour or 100 million an hour and buying the $100 million of Bitcoin the same hour. Like we could do a billion dollars of capital raising in a day, and we might have 20 million of exposure at 4 pm, and by 5 pm, 6 pm, we’re fully done.” Strategy is preparing to buy more BTC even as treasury companies face growing pressure after a sharp drop in net asset value (NAV). Strategy’s BTC purchases are often viewed as a bullish catalyst for the asset. Strategy is the largest corporate holder of BTC , with 640,250 BTC after its latest purchase on October 13. According to Saylor, Strategy can accumulate BTC and provide a return for investors far quicker than other avenues. “You can essentially sell it before you build. We’re literally building it in real time. We’re open for business every day with four credit ATMs. If someone hit the bid and wanted to buy $500 million in a minute, we could build a building in a minute. In 60 seconds. Trade is done. Cash changes hands. We create the collateral. We bought the Bitcoin underlying that day.” Most Institutions Retain Positive Bitcoin Outlook A survey by Coinbase has revealed that almost two-thirds of institutional investors retain a positive outlook for Bitcoin. David Duong, head of research at Coinbase Institutional, stated in a research report that most respondents are bullish about Bitcoin over the next few months. The institutional investor survey had 124 respondents, with 67% reporting a positive outlook. Duong also added that Bitcoin treasury companies were buying the dip, stating, “Looking at the supply/demand picture, it’s hard to overstate the impact that digital asset treasury companies have had on markets this year.” Bitcoin (BTC) Price Analysis Bitcoin (BTC) has made a strong start to the week and has reclaimed the $110,000 level. The flagship cryptocurrency fell to an intraday low of $103,516 on Friday but recovered over the weekend, rising 0.70% on Saturday and 1.37% on Sunday to settle at $108,676. The price is up almost 2% during the ongoing session, trading around $110,697. Selling pressure eased over the weekend, allowing BTC to recover. However, analysts expect markets to remain volatile, and investors will be cautious ahead of the FOMC meeting. Daan Crypto Trades stated in a post on X, “Volatility is definitely high here due to the thin books post this massive market flush. Books are thin. Especially after the massive liquidation event last week. This combined with weekend price action and a lot of emotional traders makes for relatively volatile moves on low timeframes.” Meanwhile, data from CoinGlass put liquidations over the past 24 hours at over $200 million. One of the biggest reasons behind the market rebound is confirmation that senior Chinese officials will be meeting with representatives from the US to resolve trade issues ahead of the APEC summit in South Korea. Analysts believe several near-term catalysts are driving the recovery. The Federal Reserve’s FOMC meeting is set for October 28-29, with investors anticipating a 25 bps rate cut. Lower interest rates typically weaken the dollar and support risk assets like BTC . New spot ETF filings have also buoyed investor sentiment, helping price recovery. Analysts believe approval of the ETF proposals of the XRP and Solana ETFs could boost institutional capital and further strengthen the market. BTC and the broader crypto market crashed last Friday (October 10), after President Trump announced 100% tariffs on Chinese goods and new export controls for software. The announcement was made in retaliation for China's imposition of restrictions on rare earth mineral exports. As a result, BTC plunged to $102,000 on Binance before recovering and settling at $112,980. Selling pressure persisted on Saturday as the price fell almost 2% to $110,768. Despite the overwhelming selling pressure, markets recovered on Sunday as BTC rose nearly 4% to reclaim $115,000 and settle at $115,067. Source: TradingView The price faced selling pressure and volatility on Monday, ultimately registering a marginal increase and settling at $115,274. Selling pressure returned on Tuesday as BTC fell to an intraday low of $109,945. It recovered from this level to reclaim $113,000 and settle at $113,068, ultimately dropping 1.91%. Sellers retained control on Wednesday as the price fell 2% to $110,804. Bearish sentiment persisted on Thursday as BTC fell below $110,000 and settled at $108,198. The price plunged to a low of $103,516 on Friday as selling pressure intensified. However, it recovered from this level to settle at $106,463, ultimately dropping 1.60%. BTC rose on Saturday, rising 0.70% to reclaim $107,000 and settle at $107,208. Buyers retained control on Sunday as the price rose over 1% to cross $108,000 and settle at $108,676. The flagship cryptocurrency is up almost 2% during the ongoing session, trading around $110,700. Disclaimer: This article is provided for informational purposes only. It is not offered or intended to be used as legal, tax, investment, financial, or other advice.",More News|Breaking News|Bitcoin,EN,0,0,BTC|MARKET|TRADING|MACROECONOMICS|CRYPTOCURRENCY,"{'name': 'Bitzo', 'img': 'https://resources.cryptocompare.com/news/104/default.png', 'lang': 'EN'}",bitzo,2025-10-21 06:10:16
53442748,https://cointelegraph.com/news/corporate-blockchains-will-fail-starkware-ceo?utm_source=rss_feed&utm_medium=rss%3Fvfff%3D1761027091%26cb%3Du5b1ab%26noCache%3Dtrue&utm_campaign=rss_partner_inbound,1761027088,https://images.cryptocompare.com/news/default/cointelegraph.png,‘Corpo chains’ doomed unless they embrace crypto's ethos: StarkWare CEO,https://cointelegraph.com/news/corporate-blockchains-will-fail-starkware-ceo?utm_source=rss_feed&utm_medium=rss%3Fvfff%3D1761027091%26cb%3Du5b1ab%26noCache%3Dtrue&utm_campaign=rss_partner_inbound,"StarkWare CEO Eli Ben-Sasson said corporate blockchains will help with mainstream adoption, but long term, they will be abandoned if they try to retain control.",,EN,0,0,CRYPTOCURRENCY,"{'name': 'Cointelegraph', 'img': 'https://images.cryptocompare.com/news/default/cointelegraph.png', 'lang': 'EN'}",cointelegraph,2025-10-21 06:11:28
53442801,https://en.coinotag.com/bitmine-boosts-ethereum-holdings-with-250m-purchase-amid-volatility/,1761027197,https://resources.cryptocompare.com/news/77/53442801.jpeg,BitMine Boosts Ethereum Holdings with $250M Purchase Amid Volatility,https://en.coinotag.com/bitmine-boosts-ethereum-holdings-with-250m-purchase-amid-volatility/,"BitMine, led by Chairman Tom Lee, recently acquired $250 million worth of Ethereum during market volatility, boosting its holdings to over 3.3 million ETH, or 2.74% of the total supply.",Analysis|Ethereum|News|ARKM|ETH,EN,0,0,ETH|MARKET|ARKM|CRYPTOCURRENCY,"{'name': 'CoinOtag', 'img': 'https://resources.cryptocompare.com/news/77/default.png', 'lang': 'EN'}",coinotag,2025-10-21 06:13:17
53442911,https://cryptonews.com/?p=441114,1761027428,https://resources.cryptocompare.com/news/52/53442911.jpeg,‘Trump Insider’ Trader Expands Bitcoin Short by $22M — See What the Open Position Looks Like Today,https://cryptonews.com/news/trump-insider-trader-expands-bitcoin-short-position-worth-100m/,"A crypto whale known as the “Trump insider” has deepened their short position on Bitcoin , adding another 200 BTC worth about $22m to his existing bet against the market. Data from Onchain Lens , which cited Hyperbot, shows the trader now holds 900 BTC in short positions valued at roughly $99.6m. The trade, placed with 10x leverage, is currently showing an unrealized or “floating” loss of about $1.1m. This means the position is temporarily in the red based on current market prices but hasn’t yet been closed. His entry price is $109,521 per Bitcoin, while the liquidation point sits near $141,072. The #Bitcoin OG has increased his $BTC (10x) short position by 200 $BTC ($22.1M). currently the OG holds 900 $BTC valued at $99.6M with the floating loss of $1.1M Stats: – Amount: 900 $BTC – Value: $99.6M – Entry price: $ 109,521 – Liq price: $141,072 Data Credit: @Hyperbotai https://t.co/hdRl0JgOmS pic.twitter.com/Pe9ceCqSrC — Onchain Lens (@OnchainLens) October 20, 2025 Whale Extends Bearish Bitcoin Bets As Markets Struggle To Recover From Recent Sell-Off The trader’s recent activity extends a pattern of aggressive bearish positioning. Earlier this week, he deposited $30m in USDC to Hyperliquid before opening a Bitcoin short worth $76m . Just days earlier, he expanded his exposure again as Bitcoin attempted to recover from last week’s crash. Blockchain data suggests the same wallet entered around $115,783, bringing his total short exposure to 3,440 BTC valued at $392.6m at the time. Those positions briefly yielded about $5.7m in unrealized profit before prices rebounded. His latest $22m expansion signals that the trader expects further downside despite the recent stabilization in Bitcoin markets. The timing has drawn attention across crypto circles, with many traders speculating that the investor is positioning for another market correction. Reputation Built On Sharp Timing As Whale Profited From Bitcoin Downturns Linked To News Events The wallet first gained fame after reportedly earning $160m by shorting Bitcoin shortly before US President Donald Trump’s tariff announcement triggered a sell-off. That timing led online communities to label the account the “Trump insider,” a name that has stuck through several high-profile trades. While the trader’s strategy has so far proved opportunistic, it remains uncertain whether this new bearish bet will pay off. Bitcoin’s funding rates have turned negative in recent sessions, suggesting growing caution in futures markets. Two Expected Fed Rate Cuts Could Unlock Trillions In Cash Sitting On The Sidelines At the same time, sentiment among institutional investors is turning more optimistic. A recent Coinbase Institutional report found that 67% of professional investors expect a major Bitcoin rally in the next three to six months. That optimism comes as central banks are widely expected to ease monetary policy. Coinbase forecasts two more rate cuts by the US Federal Reserve this quarter, a move that could release some of the $7 trillion currently parked in money market funds. However, uncertainty remains. Both institutional and retail investors view the macroeconomic environment as the biggest near-term risk for digital assets. Market observers say this mix of optimism and caution could fuel higher volatility as Bitcoin hovers near key technical levels. For now, the “Trump insider” appears to be betting that the next major move will be down, and that the market has yet to price in the pressure ahead fully. The post ‘Trump Insider’ Trader Expands Bitcoin Short by $22M — See What the Open Position Looks Like Today appeared first on Cryptonews .",Bitcoin News|Bitcoin|Trump,EN,0,0,BTC|MARKET|TRADING|MACROECONOMICS|CRYPTOCURRENCY,"{'name': 'cryptonews', 'img': 'https://images.cryptocompare.com/news/default/cryptonews.png', 'lang': 'EN'}",cryptonews,2025-10-21 06:17:08
53442954,https://en.coin-turk.com/?p=204850,1761027557,https://resources.cryptocompare.com/news/79/53442954.jpeg,Witness Bitcoin’s Rollercoaster: How Global Conflict Influenced the Crypto Market,https://en.coin-turk.com/witness-bitcoins-rollercoaster-how-global-conflict-influenced-the-crypto-market/,"Bitcoin fell below $108,000 amid global trade tensions affecting investor sentiment. Macroeconomic concerns have caused significant volatility in the cryptocurrency market. Continue Reading: Witness Bitcoin’s Rollercoaster: How Global Conflict Influenced the Crypto Market The post Witness Bitcoin’s Rollercoaster: How Global Conflict Influenced the Crypto Market appeared first on COINTURK NEWS .",Bitcoin (BTC),EN,0,0,BTC|BUSINESS|MARKET|CRYPTOCURRENCY,"{'name': 'CoinTurk News', 'img': 'https://resources.cryptocompare.com/news/79/default.png', 'lang': 'EN'}",cointurken,2025-10-21 06:19:17
53442965,https://www.investing.com/news/cryptocurrency-news/bitcoin-price-today-sinks-to-107k-as-recovery-stalls-uptober-cheer-fizzles-4298242,1761027615,https://resources.cryptocompare.com/news/106/default.png,"Bitcoin price today: sinks to $107k as recovery stalls, ‘uptober’ cheer fizzles",https://www.investing.com/news/cryptocurrency-news/bitcoin-price-today-sinks-to-107k-as-recovery-stalls-uptober-cheer-fizzles-4298242,,,EN,0,0,BTC|TRADING|CRYPTOCURRENCY,"{'name': 'Investing.com Crypto News', 'img': 'https://resources.cryptocompare.com/news/106/default.png', 'lang': 'EN'}",investing_comcryptonews,2025-10-21 06:20:15
53443629,https://en.coinotag.com/ethereum-co-founder-lubin-defends-vc-funding-amid-centralization-concerns-for-blockchain-growth/,1761028989,https://resources.cryptocompare.com/news/77/53443629.jpeg,Ethereum Co-Founder Lubin Defends VC Funding Amid Centralization Concerns for Blockchain Growth,https://en.coinotag.com/ethereum-co-founder-lubin-defends-vc-funding-amid-centralization-concerns-for-blockchain-growth/,"Joseph Lubin, Ethereum co-founder and Consensys CEO, supports VC funding in Ethereum despite centralization worries, viewing it as essential for innovation and mainstream adoption until decentralized alternatives mature. VC funding",Analysis|News|ETH,EN,0,0,BLOCKCHAIN|ETH|MARKET|CRYPTOCURRENCY,"{'name': 'CoinOtag', 'img': 'https://resources.cryptocompare.com/news/77/default.png', 'lang': 'EN'}",coinotag,2025-10-21 06:43:09
53444213,https://nulltx.com/?p=152421,1761029046,https://images.cryptocompare.com/news/default/nulltx.png,HumidiFi Overtakes Solana DEX Leaders in Silent $34B Breakout,https://nulltx.com/humidifi-overtakes-solana-dex-leaders-in-silent-34b-breakout/,"Solana’s DeFi landscape has a new heavyweight. @HumidiFi_ has quietly surged to the top, overtaking every major decentralized exchange on the network. According to data from @DefiLlama, the platform logged $1.1 billion in 24-hour volume, $9.7 billion over the past week, and a massive $34 billion in 30 days, surpassing established giants like Meteora, Raydium, and Pump. That makes HumidiFi not just a rising player, but the largest DEX on Solana. The Silent Giant of Solana DeFi HumidiFi operates differently. It has no public frontend. Trades are executed privately through aggregators using a quoting model that conceals order details. In other words, it runs as a “dark pool”, a private liquidity venue where large orders can be executed without revealing size, price, or direction. While this structure keeps it largely out of public sight, it has made HumidiFi the preferred choice for whales, market makers, and professional traders who value execution quality and privacy over transparency. This quiet dominance has shifted the narrative of Solana DeFi. It’s no longer just about open liquidity pools, it’s about efficient execution behind the curtain. Dark Pools: Solana’s New Trend A new wave is forming across Solana’s DeFi ecosystem. Dark pool AMMs, or “private automated market makers”, are capturing an increasing share of the chain’s total trading activity. Data from Blockworks Research shows that last week alone, Solana’s dark AMMs processed over $6 billion, accounting for nearly 30% of all on-chain trading. HumidiFi led the charge, handling $3 billion of that total, roughly 15% of all Solana trading volume. This marks a major cultural shift: from full transparency to trade efficiency and privacy. For traders, that’s a significant evolution. In traditional AMMs, every order is public, visible to bots and front-runners, exposing traders to slippage and copy-trading risks. Dark pools solve that by hiding trade details until execution, giving large traders an edge. What Makes HumidiFi Different HumidiFi isn’t your typical DEX. It’s a proprietary AMM (prop AMM), meaning it operates with its own liquidity model and execution logic. Rather than listing tokens on an open interface, it routes liquidity through aggregators like Jupiter and Meteora’s vaults. Users may not even realize they’re executing through HumidiFi when swapping tokens, yet it’s often HumidiFi handling the trade in the background. This stealth-like model gives the platform an edge in speed, liquidity depth, and anonymity. By removing a public-facing interface, HumidiFi avoids the pitfalls of heavy traffic, front-end exploits, and MEV (miner extractable value) attacks that plague public DEXs. Instead, it serves as the invisible engine behind Solana’s largest trades. Why Traders Are Moving to the Dark Side Traders are not just chasing hype, they’re chasing results. Large players, or “whales,” often face slippage when executing million-dollar orders on public DEXs. Their transactions can move the market before they’re even complete. HumidiFi fixes this by executing orders privately, protecting them from copycats and frontrunners. For professional trading firms, that’s gold. It ensures better execution quality, lower price impact, and greater control over strategy visibility. It’s not just whales either. Even mid-level DeFi users are starting to favor private AMMs for their smoother experience and lower volatility exposure. The Numbers Tell the Story The growth curve is steep. From zero visibility six months ago to $34 billion in monthly trading volume, HumidiFi’s rise is unprecedented. According to @DefiLlama, that’s higher than Raydium’s $29B, Meteora’s $22B, and Pump’s $16B during the same period. Meanwhile, HumidiFi’s daily average exceeds $1B, a level that places it not only ahead on Solana but competitive with smaller Ethereum-based DEXs. For context, major DEXs like Sushiswap and PancakeSwap fluctuate around similar daily volumes, proof that Solana’s dark liquidity model is maturing fast. The Trade-Off: Privacy vs Transparency But this new model comes with trade-offs. While dark pools improve efficiency, they reduce visibility. Without a public order book, there’s less insight into where liquidity sits or how trades are being routed. That raises questions about centralization and oversight. Who controls these private AMMs? Who verifies fair pricing? Aggregators like Jupiter have attempted to balance this with audits and integration frameworks. Still, not all players are known. Anonymous operators like ZeroFi and GoonFi remain unverified, sparking concerns within the Solana community about hidden influence and potential manipulation. Transparency is the cost of performance, and Solana’s DeFi scene is now testing where that balance lies. Community Reaction and On-Chain Buzz The reaction on X (formerly Twitter) has been loud, despite HumidiFi’s quiet approach. As noted by @SolanaFloor, HumidiFi’s dominance marks a defining moment for Solana’s DeFi market, where invisible protocols are driving visible volume. NEW: @humidifi_ (Prop AMM) has become the largest DEX on @Solana by weekly trading volume, surpassing Meteora and Orca. pic.twitter.com/YPTQrqORfd — SolanaFloor (@SolanaFloor) October 20, 2025 Meanwhile, @CryptoMiners_Co highlighted how dark pool protocols are shaping the next evolution of DeFi infrastructure, emphasizing efficiency over exposure. HumidiFi Becomes Solana’s Largest DEX! @HumidiFi_ has overtaken all major Solana DEXs, logging $1.1B in 24h volume, $9.7B over 7 days and $34B in 30 days, surpassing Meteora, Raydium and Pump, according to @DefiLlama . Operating without a frontend and using private quoting,… pic.twitter.com/HhlOmALXeU — Crypto Miners (@CryptoMiners_Co) October 20, 2025 For many, HumidiFi’s rise proves that Solana’s ecosystem is maturing, catering to both retail traders and institutional-grade strategies. HumidiFi’s success is more than a leaderboard milestone. It reflects a deeper change in how DeFi participants think about trading. Solana’s speed and low fees already made it attractive to retail users. Now, with dark AMMs like HumidiFi, it’s becoming a magnet for sophisticated capital, the kind that once lived exclusively on centralized exchanges. As volumes rise and privacy tools expand, Solana could become the first blockchain to normalize private liquidity as a standard. Whether that’s a step forward or a compromise depends on what traders value more, visibility or results. Disclosure: This is not trading or investment advice. Always do your research before buying any cryptocurrency or investing in any services. Follow us on Twitter @nulltxnews to stay updated with the latest Crypto, NFT, AI, Cybersecurity, Distributed Computing, and Metaverse news !",Crypto|News,EN,0,0,MARKET|MINING|SOL|TRADING|CRYPTOCURRENCY,"{'name': 'NullTx', 'img': 'https://images.cryptocompare.com/news/default/nulltx.png', 'lang': 'EN'}",themerkle,2025-10-21 06:44:06
