id,guid,published_on,imageurl,title,url,body,tags,lang,upvotes,downvotes,categories,source_info,source,date
56566823,https://timestabloid.com/?p=93617,1767052801,https://resources.cryptocompare.com/news/67/default.png,XRP’s 2035 Worst-Case Scenario: Potential Price Projection,https://timestabloid.com/xrps-2035-worst-case-scenario-potential-price-projection/,"XRP has struggled in recent months following a market-wide downturn, which has triggered renewed interest in long-term valuation projections. The token reached a high of $3.66 in July 2025, leading many analysts to predict significant upward potential. However, price action since then has been weaker than expected, raising the question: if the most optimistic calls do not materialize, what could a conservative outcome look like by 2035? Unrealized Bullish Forecasts Earlier in the year, when XRP hovered around $3.15, several market watchers presented ambitious targets. Mario Nawfal suggested that a move to $10 was possible if Bitcoin reached $225,000 by the end of 2025. Around the same period, Carl Moon speculated that XRP could rise as high as $30 under extremely favorable conditions. As of now, those projections remain unmet. The asset has fallen by about 44% from its July peak to $1.86 , indicating that broad optimism does not always translate into immediate price appreciation. With the year closing out below bullish expectations, some investors have shifted focus to evaluating conservative outcomes further into the future. Examining Downside Scenarios Through 2035 To assess potential lower-bound valuations, Google Gemini was consulted for a worst-case forecast. The model proposed that XRP could reach approximately $8 by 2035 even under restricted growth conditions. This would represent about a fourfold increase from current pricing, modest when compared to multi-digit predictions, but still notable given current market pressure. Gemini outlined several elements that could limit expansion. These include competition from central bank digital currencies, continued reliance on legacy payment systems like SWIFT , unresolved debates regarding decentralization, and macroeconomic instability. Limited institutional integration or slow adoption could also suppress performance. We are on X, follow us to connect with us :- @TimesTabloid1 — TimesTabloid (@TimesTabloid1) June 15, 2025 Still, Gemini acknowledged that XRP is unlikely to remain at present levels indefinitely. It argued that progress in regulatory clarity following the SEC case and continued RippleNet usage, especially in emerging markets, may support gradual appreciation. Under the $8 outcome, XRP would retain a role within specific financial segments without becoming a dominant global settlement asset. Contrasting Forecasts Views among analysts differ widely. Researchers at Bitget presented an even more restrained outlook, proposing $3.8 as a potential floor and $5.55 as an upper limit by 2035. Their projected ceiling remains below Gemini’s worst-case scenario, illustrating how conservative some forecasts have become. Conversely, projections from Telegaon position XRP much higher. Their estimates suggest that by 2035, XRP could trade within a range of $35.47 to $40.29, assuming favourable adoption and macro conditions. This view maintains confidence in XRP’s long-term potential, although it depends on strong institutional integration and global expansion. While projections for XRP’s future vary widely, the estimates show that its performance over the next decade will largely depend on adoption, regulation, and real-world integration. Conservative models still indicate moderate growth by 2035, while more optimistic outlooks leave room for substantial appreciation if institutional usage increases. Disclaimer : This content is meant to inform and should not be considered financial advice. The views expressed in this article may include the author’s personal opinions and do not represent Times Tabloid’s opinion. Readers are urged to do in-depth research before making any investment decisions. Any action taken by the reader is strictly at their own risk. Times Tabloid is not responsible for any financial losses. Follow us on Twitter , Facebook , Telegram , and Google News The post XRP’s 2035 Worst-Case Scenario: Potential Price Projection appeared first on Times Tabloid .",Cryptocurrency|News|XRP|XRP Price|XRP Price Prediction,EN,0,0,MARKET|TRADING|XRP|MACROECONOMICS|CRYPTOCURRENCY,"{'name': 'TimesTabloid', 'img': 'https://resources.cryptocompare.com/news/67/default.png', 'lang': 'EN'}",timestabloid,2025-12-30 00:00:01
56566836,https://www.newsbtc.com/?p=870790,1767052801,https://resources.cryptocompare.com/news/21/56566836.jpeg,"US Strategic Bitcoin Reserve: Key Catalyst For Potential Surge Toward $150,000 Next Year",https://www.newsbtc.com/bitcoin-news/us-strategic-bitcoin-reserve-key-catalyst-for-potential-surge-toward-150000-next-year/,"As Bitcoin (BTC) maintains a consolidated trading range between $86,000 and $90,000 after experiencing a 30% correction from its all-time high in October, market expectations for the cryptocurrency’s future remain optimistic. Market analyst Dominic Basulto from The Motley Fool believes that despite the persistent challenges seen in the fourth quarter of the year, Bitcoin could soar to $150,000 by 2026, fueled by the newly established US Strategic Bitcoin Reserve. Is $150,000 Possible For Bitcoin? Historical context supports Basulto’s prediction; Bitcoin’s performance over the years has shown significant recovery potential, with 2015 marking its worst bull market year at just a 36% gain. Significantly, in seven of its years, Bitcoin has achieved triple-digit percentage returns. The analyst suggests that 2026 may resemble 2019, a year when Bitcoin appreciated by 95% following the dismal performance in 2018, when it plummeted by 74%. Related Reading: XRP Supply Shock Incoming? Expert Reveals The Truth In 2019, several catalysts, such as heightened global economic uncertainty and a surge in institutional interest, propelled Bitcoin upwards—situations that appear similar to current conditions. Institutional investors are increasingly adding BTC to their portfolios, driven by spot Bitcoin exchange-traded funds (ETFs). Meanwhile, concerns over global tariffs and macroeconomic instability in the US continue to resonate among investors, setting the stage for potential bullish movement. However, Basulto emphasizes that Bitcoin can only reach the $150,000 milestone if it is perceived as a long-term store of value. If investors view it merely as another high-risk asset, they may choose to favor physical gold over digital gold, which has seen a record-breaking year. The crux of his argument centers on one pivotal factor that could significantly impact Bitcoin’s price: a notable increase in purchases by the US Strategic Bitcoin Reserve. What Happens If Nations Stockpile BTC? Basulto claims that if the US government were to start buying substantial quantities of Bitcoin, it could trigger a global arms race among other countries keen to create their own strategic BTC reserves. According to the analyst, such purchases from national reserves could dramatically inflate Bitcoin’s price, likely surpassing the impact of corporate treasury companies that have already amassed close to 5% of the world’s circulating BTC supply. Related Reading: Investment Firm CEO Drops Utility Bomb On XRP, Is Community Hype A Detriment? Although reaching the $150,000 mark may seem ambitious given Bitcoin’s recent performance, more aggressive predictions exist for 2026. For instance, JPMorgan Chase has forecasted a potential price of $170,000, while Wall Street strategist Tom Lee from Fundstrat has suggested that BTC might even hit $250,000 next year. While a variety of factors must align for BTC to reclaim its status as digital gold, the possibility of elevated prices hinges on strategic actions by both the US government and institutional investors. Basulto concluded that if the leading cryptocurrency can consolidate its position and the Strategic Bitcoin Reserve gains traction, the predicted price of $150,000 could be achieved by next year. At the time of writing, BTC’s price retraced towards $87,330 following an early Monday move above $90,500. Featured image from DALL-E, chart from TradingView.com",Bitcoin News|bitcoin|Bitcoin news|bitcoin price|btc|BTC news|btc price|BTCUSDT|crypto|crypto market|crypto news|US Bitcoin reserve|US Strategic Bitcoin Reserve,EN,0,0,BTC|BUSINESS|FIAT|TRADING|CRYPTOCURRENCY,"{'name': 'NewsBTC', 'img': 'https://images.cryptocompare.com/news/default/newsbtc.png', 'lang': 'EN'}",newsbtc,2025-12-30 00:00:01
56568587,649304,1767052852,https://resources.cryptocompare.com/news/13/56568587.jpeg,Bitcoin Sees Post-Capitulation Conditions Align: Selling Pressure Falls 80%,https://bitcoinist.com/bitcoin-sees-post-capitulation-conditions-align/,"Bitcoin continues to trade below the $90,000 level after multiple failed attempts to break higher since December 14, reinforcing a growing sense of caution across the market. Each rejection near this psychological threshold has added weight to the bearish narrative, with an increasing number of analysts now warning that Bitcoin may be entering a prolonged corrective phase in the year ahead. Despite this muted price action, on-chain data suggests a more nuanced picture beneath the surface. Top analyst Axel Adler recently shared a chart tracking Bitcoin realized losses using a seven-day moving average and a z-score framework, highlighting a clear transition from November’s extreme capitulation to a period of normalization in December. This metric measures the volume of losses realized when coins move, with the z-score used to identify stress extremes within the market. November marked the peak of selling pressure. On November 21–22, the realized loss z-score surged to between 8.7 and 10.9, with daily losses exceeding $5 billion. In comparison, the late-December spike on December 26, which reached a z-score near 1.6, appears relatively minor. More importantly, weekly realized losses have collapsed from roughly $2.4 billion at the peak to around $0.5 billion, returning to levels last seen in September and October. According to Adler, this sharp decline points to structural seller exhaustion rather than a temporary lull. Historically, markets often stabilize after such conditions, suggesting that while the price remains weak, downside pressure may be fading. Bitcoin Indicator Signals Fading Downside Pressure Adler’s report also highlights Bitcoin’s Net Realized Profit/Loss (P/L) metric, smoothed using a seven-day moving average, offering further insight into the market’s internal dynamics. This indicator tracks the balance between realized profits and realized losses over time. When the value is negative, losses dominate and capital is being destroyed; when positive, profit-taking outweighs loss realization. Currently, Bitcoin’s net realized P/L remains in negative territory, confirming that the market has not fully exited a risk-off regime. However, the direction of travel is notable. Over the final week of December, the depth of negative net P/L shrank by nearly half, signaling a meaningful reduction in loss intensity. Importantly, this improvement has unfolded without a strong price recovery, suggesting that the change is driven by seller exhaustion rather than an artificial price squeeze or short-term speculation. According to Adler, this behavior is structurally significant. When net realized P/L trends upward toward the zero line, it reflects a transition phase in which forced selling subsides, and marginal supply weakens. Historically, a sustained move back into positive territory has coincided with the early stages of local market recoveries. Taken together, the realized loss and net P/L charts present a consistent narrative. November appears to have absorbed the majority of weak hands, December functioned as an absorption and stabilization phase, and January could represent a potential inflection point—provided new demand begins to enter the market. Price Remains Range-Bounded Bitcoin remains locked in a tight consolidation below the $90,000 level, as shown on the 4-hour chart, reflecting persistent indecision after repeated failed breakout attempts. Price is currently trading near $87,600, holding within a narrow range that has defined market behavior throughout the second half of December. This structure highlights a balance between buyers defending local support and sellers consistently fading rallies. From a technical standpoint, Bitcoin is trading below the declining 200-period moving average, which continues to act as a key dynamic resistance near the $89,000–$90,000 zone. The 100-period moving average has flattened and is closely aligned with price, signaling a lack of momentum in either direction. Meanwhile, the shorter-term moving average has rolled over, reinforcing the short-term bearish bias and confirming that upside attempts are being absorbed. The price action since mid-December shows a clear compression pattern, with lower highs forming beneath resistance and higher lows developing above the $86,000–$87,000 support region. This tightening range suggests that volatility is being suppressed, often preceding a decisive move. Structurally, the $86,000 level remains critical. A clean breakdown below this support could open the door to a deeper retracement toward the low $80,000s. Conversely, reclaiming and holding above $90,000 would invalidate the current bearish structure and signal renewed upside momentum. Featured image from ChatGPT, chart from TradingView.com",Bitcoin News|bitcoin|Bitcoin analysis|Bitcoin Capitulation|bitcoin news|bitcoin price|Bitcoin Selling|Bitcoin Selling Pressure|btc|BTCUSDT,EN,0,0,BTC|MARKET|SPONSORED|TRADING|CRYPTOCURRENCY,"{'name': 'Bitcoinist', 'img': 'https://images.cryptocompare.com/news/default/bitcoinist.png', 'lang': 'EN'}",bitcoinist,2025-12-30 00:00:52
56566943,https://u.today/crypto-market-prediction-shiba-inus-shib-first-big-test-in-2026-bitcoin-btc-enters-year-end-rally,1767052860,https://resources.cryptocompare.com/news/64/56566943.jpeg,"Crypto Market Prediction: Shiba Inu (SHIB) First Big Test is 2026, Bitcoin (BTC) Enters End of the Year Rally Again, XRP $2 Is the Target Again",https://u.today/crypto-market-prediction-shiba-inus-shib-first-big-test-in-2026-bitcoin-btc-enters-year-end-rally,"Market is mobilizing all resources it has left for a final push in 2025, but it might not succeed.",Shiba Inu,EN,0,0,BTC|MARKET|SHIB|TRADING|CRYPTOCURRENCY,"{'name': 'U.Today', 'img': 'https://images.cryptocompare.com/news/default/utoday.png', 'lang': 'EN'}",utoday,2025-12-30 00:01:00
56567332,https://en.coinotag.com/breakingnews/ethereum-whale-expands-short-bets-increases-10x-btc-short-and-adds-10x-eth-and-20x-sol-shorts,1767053159,https://resources.cryptocompare.com/news/77/56567332.jpeg,"Ethereum Whale Expands Short Bets, Increases 10x BTC Short and Adds 10x ETH and 20x SOL Shorts",https://en.coinotag.com/breakingnews/ethereum-whale-expands-short-bets-increases-10x-btc-short-and-adds-10x-eth-and-20x-sol-shorts,"Ethereum Whale Expands Short Bets, Increases 10x BTC Short and Adds 10x ETH and 20x SOL Shorts",Breaking News,EN,0,0,BTC|ETH|SOL|ZRX|CRYPTOCURRENCY,"{'name': 'CoinOtag', 'img': 'https://resources.cryptocompare.com/news/77/default.png', 'lang': 'EN'}",coinotag,2025-12-30 00:05:59
