id,guid,published_on,imageurl,title,url,body,tags,lang,upvotes,downvotes,categories,source_info,source,date
53965157,https://bitcoinworld.co.in/?p=214303,1762133410,https://resources.cryptocompare.com/news/82/53965157.jpeg,Spot XRP ETF: A Game-Changing Launch Expected Within Weeks,https://bitcoinworld.co.in/spot-xrp-etf-launch/,"BitcoinWorld Spot XRP ETF: A Game-Changing Launch Expected Within Weeks The cryptocurrency world is buzzing with excitement, and for good reason! Imagine a future where investing in XRP is as straightforward as buying a traditional stock. Well, that future might be just around the corner, as a is expected to launch in the U.S. within the next two weeks. This groundbreaking news comes from Nate Geraci, CEO of Novadius Wealth Management, who believes this development could be a significant turning point for the entire digital asset space. What is a and Why Does it Matter? Many investors are eager to understand the significance of a . An Exchange Traded Fund (ETF) is an investment vehicle that holds assets like stocks, bonds, or in this case, a cryptocurrency like XRP. Crucially, a spot ETF means it directly holds the underlying asset, rather than futures contracts, offering a more direct exposure to the asset’s price movements. The introduction of a carries several compelling benefits: Increased Accessibility: Traditional investors can gain exposure to XRP without the complexities of directly buying and securely storing the cryptocurrency themselves. This simplifies the investment process significantly. Regulatory Clarity: An ETF approval signals growing acceptance and regulatory comfort with the asset, which is vital for mainstream adoption. Institutional Adoption: It opens doors for large institutional investors, such as pension funds and wealth managers, who often prefer regulated investment products that fit within their existing frameworks. This direct exposure through a provides a more transparent and often more secure way for a broader audience to participate in XRP’s potential. The Road to a : A Regulatory Journey The path to a has been anything but smooth, especially given the challenging U.S. regulatory environment. For five long years, the Securities and Exchange Commission (SEC) was locked in litigation with Ripple, the company behind XRP. This extensive legal battle, which concluded just three months ago, was a major hurdle for any XRP-related investment product. The resolution of the SEC vs. Ripple case proved to be a pivotal moment. A U.S. court ruled that XRP is not a security when sold to the public on exchanges, providing much-needed clarity. This legal precedent has undoubtedly paved the way for serious discussions and potential approvals around an XRP-backed investment product. Nate Geraci suggests that the launch of such an ETF could deliver a ‘final blow’ to regulators who have historically taken an anti-crypto stance. This sentiment highlights a potential shift in the regulatory tide, indicating a growing acceptance of digital assets within traditional financial structures. Impact and Implications: What Does a Mean for Crypto? The potential launch of a carries profound implications for XRP and the broader cryptocurrency market. What could this mean for your portfolio and the future of digital finance? Potential Price Action: Increased demand from both institutional and retail investors, who now have an easier access point, could lead to significant price movements for XRP. Enhanced Legitimacy: An ETF approval further legitimizes XRP as a mainstream asset class. This can attract more capital, talent, and innovation into the ecosystem. Market Maturation: This development signifies the maturing state of the crypto market. It mirrors the evolution seen in traditional finance with commodity ETFs, indicating that digital assets are steadily integrating into global financial systems. This development could unlock substantial capital flows, propelling XRP into a new era of adoption and recognition, and potentially influencing other altcoins awaiting similar regulatory clarity. Preparing for the Future: Navigating the Landscape As we stand on the cusp of this potential launch, what should investors consider regarding a ? A well-informed approach is always crucial in the dynamic crypto market. Stay Informed: Keep a close watch on official announcements from the SEC and the asset managers involved. Dates and details can change rapidly. Understand Risks: While ETFs offer benefits like ease of access, all investments carry risks. Do your own thorough research and understand the underlying asset. Market Volatility: Be prepared for potential price volatility around the launch and in its initial trading period, as markets react to the news and new capital flows. Fees and Providers: Research different ETF providers and their associated fees to ensure you choose an option that aligns with your investment strategy. The arrival of a is undoubtedly a landmark event, but a measured and informed approach is always key to navigating the evolving digital asset landscape successfully. The anticipation surrounding a launch in the U.S. within weeks marks a pivotal moment for the cryptocurrency industry. This potential development, coming on the heels of significant regulatory clarity for XRP, promises to enhance accessibility, attract institutional capital, and further legitimize digital assets. It represents a powerful step forward, potentially reshaping how investors engage with XRP and signaling a new chapter for crypto in the regulated financial landscape. Frequently Asked Questions (FAQs) Q1: What exactly is a Spot XRP ETF? A Spot XRP ETF is an investment fund that directly holds XRP, allowing investors to gain exposure to the cryptocurrency’s price movements without having to buy and store XRP themselves. It trades on traditional stock exchanges. Q2: When is the Spot XRP ETF expected to launch? According to Nate Geraci, CEO of Novadius Wealth Management, a is expected to launch in the U.S. within the next two weeks. Q3: How does a Spot XRP ETF differ from a futures ETF? A spot ETF directly holds the underlying asset (XRP), while a futures ETF holds futures contracts that bet on the future price of XRP. Spot ETFs generally offer more direct price exposure. Q4: What are the potential benefits of a Spot XRP ETF for investors? Key benefits include increased accessibility for traditional investors, potential for greater institutional adoption, and a signal of regulatory clarity and legitimacy for XRP as an asset class. Q5: Will the Spot XRP ETF launch impact XRP’s price? While not guaranteed, the launch of a could lead to increased demand from new investor segments, potentially influencing XRP’s price positively. However, market volatility is always a factor. Did you find this article insightful? Share your thoughts and this groundbreaking news with your network! Help spread the word about the upcoming and its potential impact on the crypto world. Your shares help us keep you informed! To learn more about the latest crypto market trends, explore our article on key developments shaping XRP institutional adoption . This post Spot XRP ETF: A Game-Changing Launch Expected Within Weeks first appeared on BitcoinWorld .",Crypto News|CRYPTOCURRENCY|ETF|Ripple|Spot XRP ETF|XRP,EN,0,0,BUSINESS|MARKET|TRADING|XRP|CRYPTOCURRENCY,"{'name': 'Bitcoin World', 'img': 'https://resources.cryptocompare.com/news/82/default.png', 'lang': 'EN'}",bitcoinworld,2025-11-03 01:30:10
53965273,9e5039e6-9543-4260-921d-8e171638d62f,1762133667,https://resources.cryptocompare.com/news/5/53965273.jpeg,Asia Morning Briefing: Cautious Calm Returns to BTC Markets as Traders Rebuild Risk,https://www.coindesk.com/markets/2025/11/03/asia-morning-briefing-cautious-calm-returns-to-btc-markets-as-traders-rebuild-risk,"BTC holds near $110K and Ethereum trades around $3,900 as liquidations ease and market makers report clients slowly re-entering risk after the Fed-driven selloff.",Markets|btc|ETH|News,EN,0,0,ASIA|BTC|ETH|MARKET|CRYPTOCURRENCY,"{'name': 'CoinDesk', 'img': 'https://resources.cryptocompare.com/news/5/default.png', 'lang': 'EN'}",coindesk,2025-11-03 01:34:27
53965668,https://cointelegraph.com/news/aster-token-surges-after-cz-buys-two-million-tokens?utm_source=rss_feed&utm_medium=rss&utm_campaign=rss_partner_inbound,1762134250,https://images.cryptocompare.com/news/default/cointelegraph.png,Aster token goes flying after CZ reveals $2.5M personal stake,https://cointelegraph.com/news/aster-token-surges-after-cz-buys-two-million-tokens?utm_source=rss_feed&utm_medium=rss&utm_campaign=rss_partner_inbound,Aster pumped after Binance co-founder Changpeng Zhao shared a screenshot showing that he holds over 2 million Aster tokens.,,EN,0,0,EXCHANGE|BNB|CRYPTOCURRENCY,"{'name': 'Cointelegraph', 'img': 'https://images.cryptocompare.com/news/default/cointelegraph.png', 'lang': 'EN'}",cointelegraph,2025-11-03 01:44:10
53965664,https://en.coinotag.com/aster-token-surges-after-cz-discloses-over-2-5-million-holdings/,1762134395,https://resources.cryptocompare.com/news/77/53965664.jpeg,Aster Token Surges After CZ Discloses Over $2.5 Million Holdings,https://en.coinotag.com/aster-token-surges-after-cz-discloses-over-2-5-million-holdings/,"Aster token price surged over 30% after Binance co-founder Changpeng Zhao revealed holding over 2 million Aster tokens worth more than $2.5 million, sparking trader interest and boosting trading volume",Analysis|News|BNB|ZEC,EN,0,0,MARKET|TRADING|ZEC|BNB|CRYPTOCURRENCY,"{'name': 'CoinOtag', 'img': 'https://resources.cryptocompare.com/news/77/default.png', 'lang': 'EN'}",coinotag,2025-11-03 01:46:35
53965810,https://www.cryptopolitan.com/?p=851385,1762134464,https://resources.cryptocompare.com/news/43/53965810.jpeg,UK SMEs struggle to cash in on trade deals,https://www.cryptopolitan.com/uk-smes-struggle-to-cash-in-on-trade-deals/,"The UK government’s new trade deals do not particularly benefit small businesses in Britain, a new survey by the British Chambers of Commerce has found. The BCC’s Insights Unit surveyed 4,638 firms, most of them small and medium-sized enterprises (SMEs), and found that 84% of companies with 10 or fewer employees either receive too few export orders to make a difference or rarely engage in international trade. Bigger companies, which have more resources and well-established supply chains, are doing better: 42% of those with 250 or more employees have seen growth in their export orders. William Bain, the head of trade policy at the BCC, called the results “deeply worrying” and noted that the gap between small and big exporters is growing. The potential merits of new trade deals will not be realized unless small delegators receive more support. He added that a 25% improvement in UK exports could raise long-term GDP growth by 0.6%, but this would only be possible if smaller exporters were able to access new markets. However, the World Trade Organization recently supported such concerns. The report on the UK’s trade policy states that the country’s export contribution to GDP has returned to its pre-crisis level following the pandemic. Since Brexit, exports from the UK to the European Union have decreased by almost 30%, while the number of small enterprises that have ceased exporting to the bloc exceeds 16,000. Government signs trade deals, but small firms still struggle The UK government has struck a flurry of trade deals with countries such as Australia, Japan, New Zealand, and members of the Comprehensive and Progressive Agreement for Trans-Pacific Partnership, as well as holding talks with India, while renegotiating its digital trade agreement with the US. Despite the dispersal of such deals, the small firms they were intended to empower remain far removed from the debate. Bain, as well as the BCC and other business groups, argue that the government’s assistance is too concentrated and in dire need of modernization. Bain said that new trade deals were only as effective as a company’s capacity to apply them, warning that without government investment in trade education, digitisation, and local export advisers, small businesses would remain locked out. The Department for Business and Trade, however, refuted the claim, insisting that it was already taking action. The government has recently increased the lending limits of UK Export Finance from £60 billion to £80 billion, allowing small exporters to access affordable funding. The department said that encouraging exports was transformative for productivity, job creation, and economic growth. However, insiders revealed that it was making “across-the-board” cuts behind the scenes. According to a Financial Times survey, three private sources indicate that DBT reduced its labor by 20%. Many regional advisers who award one-on-one assistance to small firms were included in the reductions. Experts call for digital trade solutions and hands-on help Trade enthusiasts argue that the administration should streamline export processes and transition to digital trade systems . According to Chris Southworth, secretary-general of the International Chamber of Commerce UK, Structural barriers are holding back growth among the smallest businesses. First among them is the paper-heavy, bureaucratic red tape that accompanied leaving the EU. Additionally, access to cheap trade credit and information about what red tape to expect in new markets will be crucial. Small businesses require digital systems, accurate cost forecasts, and assurance that goods will move through security. The BCC is calling for a “Trade Accelerator” to help us achieve this goal. Additional online training for exporters will be included in the proposal, along with a simplified customs system and specific grants for small companies seeking to cross borders for the first time. The group has advised the Chancellor to lay the blueprint in the following week’s Budget or risk losing global growth prospects. If you're reading this, you’re already ahead. Stay there with our newsletter .",News|UK,EN,0,0,ASIA|BUSINESS|MARKET|TRADING|MACROECONOMICS|CRYPTOCURRENCY,"{'name': 'Cryptopolitan', 'img': 'https://images.cryptocompare.com/news/default/cryptopolitan.png', 'lang': 'EN'}",cryptopolitan,2025-11-03 01:47:44
53965910,https://en.coinotag.com/uk-trade-deals-may-fall-short-for-small-businesses-bcc-survey-indicates/,1762134911,https://resources.cryptocompare.com/news/77/default.png,"UK Trade Deals May Fall Short for Small Businesses, BCC Survey Indicates",https://en.coinotag.com/uk-trade-deals-may-fall-short-for-small-businesses-bcc-survey-indicates/,"UK trade deals do not significantly benefit small businesses, according to a British Chambers of Commerce survey of over 4,600 firms. Most SMEs with fewer than 10 employees report limited",News,EN,0,0,BUSINESS,"{'name': 'CoinOtag', 'img': 'https://resources.cryptocompare.com/news/77/default.png', 'lang': 'EN'}",coinotag,2025-11-03 01:55:11
53966078,https://www.cryptopolitan.com/?p=851392,1762135168,https://resources.cryptocompare.com/news/43/53966078.jpeg,Trump to skip Supreme Court hearing on legality of his global tariffs,https://www.cryptopolitan.com/trump-to-skip-supreme-court-hearing/,"President Donald Trump said he will not attend the Supreme Court hearing on his global tariffs next week. He added that the case is one of the most important in U.S. history and said he does not want to distract from the decision. The Supreme Court will hear two combined cases on November 5 that will question the President’s use of an emergency law to set global tariffs. The lawsuits say his actions went too far and even surpassed the limits of presidential power. Trump says tariffs make America great again Trump stated that he imposed tariffs to protect American workers and businesses from unfair competition from other countries that had taken advantage of the United States through unfavorable trade agreements for many years. He explained that the U.S. will only remain safe and powerful if it can use tariffs quickly and with full authority. But if that power is taken away from them, the economy will slowly fall behind those of other bidding countries. The President explained that the new agreements increased production in the United States and reduced the country’s dependence on essential goods. He said that without these tariffs, America will lose its bargaining power and one of the few tools that can quickly protect its economy in times of crisis or unfair treatment from foreign governments. The Oval Office leader said that if the Supreme Court rules against him, the decision could even push America to become a Third World country. He explained that all the country’s wealth and safety were tied to his ability to use the tariffs when necessary, so losing all that power could lead to years of decline. Trump spoke to reporters aboard Air Force One on November 2 and stated that he would not attend the Supreme Court hearing because he did not want to divert attention away from the significance of the case. He said the case should focus on the legal issues, rather than on him personally, because it was bigger than himself. Businesses and lawyers prepare for a historic Supreme Court battle The Supreme Court will decide whether President Donald Trump went too far when he used an emergency law from 1977 to set tariffs on imported goods. Congress created the International Emergency Economic Powers Act (IEEPA) to enable presidents to act quickly when the country faces threats from hostile foreign nations . However, Trump went overboard and applied the same law to both rival and ally nations, citing a desire to “protect national security and rebuild American industries.” The case consists of two separate lawsuits that American companies have filed against each other. Learning Resources, Inc. brought the first case, stating that they struggled to produce and sell affordable learning tools because the tariffs increased the cost of materials and manufacturing. V.O.S. Selections, Inc. brought the second case and stated that they had to increase their charges for liquor products because the tariffs had significantly increased importation costs. Both companies argued that the tariffs are illegal because Trump’s actions contravened the Constitution’s separation of powers. Jeffrey Schwab is the lead lawyer representing V.O.S. Selections and the interim director of litigation at the Liberty Justice Center. He said his team will show the Supreme Court that the IEEPA law was intended only to address serious threats, such as terrorism or financial attacks, not to set everyday trade policies. He added that the White House could gain too much power and the role of Congress could weaken if a president could use emergency laws to impose tariffs at will. Many legal experts and economists oppose Trump, but the president claims that his policies have strengthened America economically and strategically. The smartest crypto minds already read our newsletter. Want in? Join them .",News,EN,0,0,EXCHANGE|REGULATION|TRADING|MACROECONOMICS|CRYPTOCURRENCY,"{'name': 'Cryptopolitan', 'img': 'https://images.cryptocompare.com/news/default/cryptopolitan.png', 'lang': 'EN'}",cryptopolitan,2025-11-03 01:59:28
53966260,https://decrypt.co/?p=347136,1762135643,https://resources.cryptocompare.com/news/44/53966260.jpeg,South Australia Rounds Up Another 55 Suspects After High Court Backs Encrypted-App Sting,https://decrypt.co/347136/south-australia-55-suspects-high-court-backs-encrypted-app,"Authorities moved to the third phase of Operation Ironside, using AN0M intelligence to expand drug, weapons and laundering cases.",Law and Order,EN,0,0,OTHER,"{'name': 'Decrypt', 'img': 'https://images.cryptocompare.com/news/default/decrypt.png', 'lang': 'EN'}",decrypt,2025-11-03 02:07:23
53966381,https://en.coinotag.com/trump-skips-supreme-court-hearing-on-global-tariffs-amid-economic-debate/,1762135877,https://resources.cryptocompare.com/news/77/53966381.jpeg,Trump Skips Supreme Court Hearing on Global Tariffs Amid Economic Debate,https://en.coinotag.com/trump-skips-supreme-court-hearing-on-global-tariffs-amid-economic-debate/,"The Ethereum Pectra upgrade in 2025 combines the Prague and Electra updates to improve scalability, security, and user experience on the Ethereum blockchain, with key features like account abstraction and",Ethereum|News|ARB|Core|ETH|SOL,EN,0,0,ETH|SOL|ARB|MACROECONOMICS|CRYPTOCURRENCY,"{'name': 'CoinOtag', 'img': 'https://resources.cryptocompare.com/news/77/default.png', 'lang': 'EN'}",coinotag,2025-11-03 02:11:17
53966516,https://en.coinotag.com/australian-police-advance-operation-ironside-phase-seizing-crypto-in-drug-and-laundering-probes/,1762136184,https://resources.cryptocompare.com/news/77/53966516.jpeg,"Australian Police Advance Operation Ironside Phase, Seizing Crypto in Drug and Laundering Probes",https://en.coinotag.com/australian-police-advance-operation-ironside-phase-seizing-crypto-in-drug-and-laundering-probes/,"Operation Ironside, a joint Australian Federal Police and FBI investigation, has led to 55 arrests in South Australia during its third phase, focusing on drug trafficking, weapons, and money laundering",News,EN,0,0,OTHER,"{'name': 'CoinOtag', 'img': 'https://resources.cryptocompare.com/news/77/default.png', 'lang': 'EN'}",coinotag,2025-11-03 02:16:24
53966922,https://cointelegraph.com/news/elizabeth-warren-rebuffs-cz-defamation-threat-as-without-merit-report?utm_source=rss_feed&utm_medium=rss&utm_campaign=rss_partner_inbound,1762137017,https://images.cryptocompare.com/news/default/cointelegraph.png,Elizabeth Warren rebuffs CZ defamation threat as ‘without merit’,https://cointelegraph.com/news/elizabeth-warren-rebuffs-cz-defamation-threat-as-without-merit-report?utm_source=rss_feed&utm_medium=rss&utm_campaign=rss_partner_inbound,"Changpeng Zhao’s lawyer, Teresa Goody Guillén, reportedly threatened to sue Warren for “defamatory statements” on X after CZ secured a pardon from Trump.",,EN,0,0,OTHER,"{'name': 'Cointelegraph', 'img': 'https://images.cryptocompare.com/news/default/cointelegraph.png', 'lang': 'EN'}",cointelegraph,2025-11-03 02:30:17
53966897,https://news.bitcoin.com/?p=768061&preview=true&preview_id=768061,1762137056,https://resources.cryptocompare.com/news/14/53966897.jpeg,Billion-Dollar XRP ETF? Bitwise Sees It Happening Sooner Than Anyone Expects,https://news.bitcoin.com/billion-dollar-xrp-etf-bitwise-sees-it-happening-sooner-than-anyone-expects/,"XRP is igniting unstoppable bullish momentum as massive institutional moves, ETF anticipation, and record whale accumulation fuel investor frenzy over the token’s next explosive phase in digital finance. XRP ETF Buzz Sparks Massive Institutional Surge Investor sentiment toward XRP is turning sharply bullish as expectations mount for one of the most anticipated cryptocurrency fund approvals",Featured|Bitwise|ETF|Ripple XRP,EN,0,0,BUSINESS|SPONSORED|TRADING|XRP|CRYPTOCURRENCY,"{'name': 'Bitcoin.com', 'img': 'https://images.cryptocompare.com/news/default/bitcoincom.png', 'lang': 'EN'}",bitcoin.com,2025-11-03 02:30:56
53966989,https://en.coinotag.com/warrens-lawyer-rejects-czs-defamation-threat-over-trump-pardon-remarks/,1762137208,https://resources.cryptocompare.com/news/77/53966989.jpeg,Warren’s Lawyer Rejects CZ’s Defamation Threat Over Trump Pardon Remarks,https://en.coinotag.com/warrens-lawyer-rejects-czs-defamation-threat-over-trump-pardon-remarks/,"The controversy surrounding Changpeng Zhao’s Trump pardon escalated when his lawyer threatened to sue Senator Elizabeth Warren for defamation over her X post alleging money laundering ties, prompting a strong",News|SAGA,EN,0,0,OTHER,"{'name': 'CoinOtag', 'img': 'https://resources.cryptocompare.com/news/77/default.png', 'lang': 'EN'}",coinotag,2025-11-03 02:33:28
