id,guid,published_on,imageurl,title,url,body,tags,lang,upvotes,downvotes,categories,source_info,source,date
54628323,https://ambcrypto.com/?p=547538,1763593231,https://images.cryptocompare.com/news/default/ambcrypto.png,"21Shares launches TSOL, the sixth U.S. Solana ETF",https://ambcrypto.com/21shares-launches-tsol-the-sixth-u-s-solana-etf/,"21Shares launched TSOL on the Cboe BZX Exchange, becoming the sixth U.S. Solana ETF and entering a market with over $593 million in total assets.",News|News 1|Social|Solana|Trading View,EN,0,0,EXCHANGE|MARKET|SOL|CRYPTOCURRENCY,"{'name': 'AMB Crypto', 'img': 'https://images.cryptocompare.com/news/default/ambcrypto.png', 'lang': 'EN'}",ambcrypto,2025-11-19 23:00:31
54628289,https://www.newsbtc.com/?p=855569,1763593238,https://resources.cryptocompare.com/news/21/54628289.jpeg,Bitcoin Capitulation Deepens Around $90K Level: Classic Late-Stage Fear Structure Emerging,https://www.newsbtc.com/bitcoin-news/bitcoin-capitulation-deepens-around-90k-level-classic-late-stage-fear-structure-emerging/,"Bitcoin is trading at critical price levels as the market enters one of its most tense and uncertain stages of the year. The crypto market is showing clear signs of stress, and new data from CryptoQuant confirms that Bitcoin is now moving into one of the most severe short-term capitulation phases of this cycle. According to the latest on-chain metrics, short-term holders (STHs) are realizing losses at a scale typically seen only near major market turning points. Related Reading: XRP Supply In Profit Falls to 58.5% – Lowest Since 2024 Despite Higher Price The key indicator driving this analysis is STH-SOPR, which has plunged to deeply depressed readings around 0.97. This means STHs are selling coins at a clear loss, often driven by fear rather than strategy. Even more importantly, this metric has spent several consecutive weeks below the critical 1.0 threshold, forming what analysts refer to as a structural “capitulation band.” Historically, whenever STH-SOPR remained under 1.0 for extended periods, it signaled heavy emotional selling—typically from the most reactive and least informed market participants. These episodes have repeatedly aligned with late-stage corrections, market reversals, and shifts in long-term holder dominance. With Bitcoin now sitting at a crucial technical and psychological zone, the next phase could determine whether this becomes a deeper bear trend or a major reset before recovery. Short-Term Holders Under Extreme Stress as Capitulation Deepens According to XWIN Research on CryptoQuant, the current selloff is being amplified by the behavior of short-term holders, with the STH-MVRV ratio now sitting far below 1.0. This indicates that nearly all recent buyers are holding Bitcoin at a loss, placing short-term profitability in one of the weakest conditions in the entire dataset. Historically, these deep unrealized-loss phases are extremely rare and tend to compress selling pressure quickly, as weak hands eventually run out of coins to sell. This pattern is clearly visible in real market flows. A striking 65,200 BTC were recently sent to exchanges at a loss, showing that fear is not an abstract sentiment but is materializing in real, loss-driven capitulation. This kind of behavior aligns with classical capitulation structures: unrealized losses surge, panic selling intensifies, and eventually selling pressure becomes unsustainable. Once that happens, stronger hands begin absorbing supply quietly in the background. While this setup doesn’t guarantee an immediate rebound, the broader structure is shifting toward conditions that have historically preceded cyclical recoveries. STH losses remain at extreme levels, STH-SOPR is still below 1.0, and the pressure fueling exchange inflows is rooted in panic rather than fundamentals. Volatility is likely to persist, but the ongoing cleansing of weak hands is a process often seen near the end of major corrections — not at the start. Related Reading: Galaxy Digital Dumps 2,800 BTC as Bitcoin Crashes Below $90K Testing Weekly Support as Momentum Weakens Bitcoin’s weekly chart shows the market approaching a critical turning point as price trades just above $91,000 following a sharp multi-week decline. The recent breakdown from the $110,000–$105,000 range has confirmed a loss of bullish momentum, with sellers gaining control and pushing BTC toward its next major weekly support cluster near the 50-week moving average around $88,000–$90,000. This zone has historically acted as a key pivot level, often signaling whether a corrective phase deepens or stabilizes. Volume adds important context. The past several weekly candles show rising sell-side activity, reflecting panic-driven exits rather than orderly distribution. However, this surge in volume also indicates that the market may be approaching a capitulation threshold, where forced selling begins to exhaust itself — a setup often seen before stronger hands step in. Related Reading: Ethereum Approaches Historical Accumulation Level – Just 8% Away From LTH Cost Basis Structurally, Bitcoin is still trading above the 100-week and 200-week moving averages, both of which continue to trend upward. This suggests the aggressive downside move has not yet broken the broader macrotrend. But the loss of mid-term support levels and the sustained downward pressure highlight a market struggling to find confidence. Featured image from ChatGPT, chart from TradingView.com",Bitcoin News|bitcoin|bitcoin analysis|Bitcoin capitulation|Bitcoin fear|Bitcoin news|Bitcoin Selling Pressure|btc|BTCUSDT,EN,0,0,BTC|BUSINESS|MARKET|TRADING|CRYPTOCURRENCY,"{'name': 'NewsBTC', 'img': 'https://images.cryptocompare.com/news/default/newsbtc.png', 'lang': 'EN'}",newsbtc,2025-11-19 23:00:38
54630121,630711,1763593259,https://resources.cryptocompare.com/news/13/54630121.jpeg,Shiba Inu Receives Prestigious Honor Alongside Bitcoin and Ethereum In Japan,https://bitcoinist.com/shiba-inu-prestigious-honor/,"Japan has officially elevated Shiba Inu (SHIB) into its highest-tier crypto compliance category, placing it alongside Bitcoin and Ethereum. This milestone reflects a clear shift in how Japanese regulators view SHIB, recognizing it as more than a speculative token and validating its advancement into a government-approved digital asset. The designation is expected to reshape market perception, facilitate faster exchange listings, and enhance Shiba Inu’s readiness for participation at an institutional level within one of the world’s most tightly regulated financial markets . Shiba Inu’s Green-List Recognition Alongside Bitcoin And Ethereum The Japan Virtual and Crypto Assets Exchange Association (JVCEA) , operating under the Financial Services Agency, has added SHIB to its Green List. This whitelist is reserved for assets demonstrating strong liquidity, broad exchange presence, and consistent operational performance. Being included on the Green List signals regulatory confidence and allows domestic exchanges to list Shiba Inu without undergoing lengthy, asset-specific vetting procedures. For ecosystem operators and liquidity providers, this reduces barriers to entry, improves the efficiency of capital allocation, and expands Shiba Inu’s reach across Japan’s compliant digital-asset infrastructure. The Green List also carries significant symbolic weight. Only a handful of digital assets—including Bitcoin and Ethereum—have historically received this designation, according to the JVCEA’s November 12, 2025, update. Being recognized alongside these benchmark cryptocurrencies positions SHIB as a more credible and professionally managed asset, helping it shed some of the skepticism associated with meme-based tokens . Japan is also reviewing its cryptocurrency taxation framework . Current policy discussions propose reducing the tax rate on approved, Green-Listed assets from the highest income brackets to roughly 20%. If implemented, this reform could materially enhance Shiba Inu’s appeal to both retail and institutional investors, creating a strong incentive for participation in a lower-tax, regulated environment. Analysts suggest that aligning regulatory recognition with favorable tax treatment could lead to a significant rise in compliant inflows once the reform is enacted, further supporting liquidity and adoption. Impact On Market Positioning And Future Capital Flows This recognition comes at a critical time for Shiba Inu, which has been upgrading its infrastructure and reorganizing its ecosystem to move beyond a meme-asset reputation . Japan’s formal approval confirms SHIB’s improved risk profile and signals to global markets that it has reached a more regulated, professionally governed stage of adoption. Licensed exchanges in Japan can now deploy new Shiba Inu markets, structured products, and liquidity channels with shorter compliance timelines. Increased accessibility encourages higher transactional activity, strengthens liquidity, and improves SHIB’s suitability for institutional participation. The Green-List status also positions SHIB for future inclusion in regulated investment vehicles , such as exchange-traded notes and custodial products, pending further approvals. By joining Bitcoin and Ethereum in Japan’s top compliance tier, Shiba Inu secures a significant step forward in global credibility, institutional acceptance, and its potential to attract future capital flows .",Shiba Inu|shib|SHIB news|SHIB price|Shiba Inu news|Shiba Inu price|SHIBUSD|SHIBUSDT,EN,0,0,ASIA|BTC|ETH|SHIB|CRYPTOCURRENCY,"{'name': 'Bitcoinist', 'img': 'https://images.cryptocompare.com/news/default/bitcoinist.png', 'lang': 'EN'}",bitcoinist,2025-11-19 23:00:59
54628326,https://www.cryptonewsz.com/bitcoin-crashes-89k-abu-dhabis-3x-etf-stake/,1763593273,https://images.cryptocompare.com/news/default/cryptonewsz.png,Bitcoin Crashes Below $89K Despite Abu Dhabi’s 3X ETF Stake,https://www.cryptonewsz.com/bitcoin-crashes-89k-abu-dhabis-3x-etf-stake/,"Key Highlights November 19, Bitcoin dropped below $89,000 with 4% crash on the daily chart Abu Dhabi Investment…",Bitcoin News,EN,0,0,BTC|CRYPTOCURRENCY,"{'name': 'CryptoNewsZ', 'img': 'https://images.cryptocompare.com/news/default/cryptonewsz.png', 'lang': 'EN'}",cryptonewsz,2025-11-19 23:01:13
54628459,https://decrypt.co/?p=349244,1763593502,https://resources.cryptocompare.com/news/44/54628459.jpeg,New XRP and Dogecoin ETFs Expected to Begin Trading in the Coming Days,https://decrypt.co/349244/new-xrp-dogecoin-etfs-expected-begin-trading-coming-days,"New ETFs separately tracking XRP and Dogecoin could debut in the next three trading days, according to analysts.",dogecoin||Markets,EN,0,0,DOGE|MARKET|TRADING|XRP|CRYPTOCURRENCY,"{'name': 'Decrypt', 'img': 'https://images.cryptocompare.com/news/default/decrypt.png', 'lang': 'EN'}",decrypt,2025-11-19 23:05:02
54628588,https://decrypt.co/?p=349288,1763593755,https://resources.cryptocompare.com/news/44/54628588.jpeg,Pro-Crypto CFTC Chair Nominee Won’t Commit to More Agency Resources or Dem Commissioners,https://decrypt.co/349288/pro-crypto-cftc-chair-mike-selig-agency-resources-dem-commissioners,"During a Senate confirmation hearing, Mike Selig declined to say the CFTC needs more resources to regulate crypto—despite bipartisan support on the issue.",Law and Order,EN,0,0,REGULATION,"{'name': 'Decrypt', 'img': 'https://images.cryptocompare.com/news/default/decrypt.png', 'lang': 'EN'}",decrypt,2025-11-19 23:09:15
54628568,https://news.bitcoin.com/?p=771961&preview=true&preview_id=771961,1763593843,https://resources.cryptocompare.com/news/14/54628568.jpeg,Racing Solana Demand Drives TSOL’s Arrival With Staking-Focused Upside,https://news.bitcoin.com/racing-solana-demand-drives-tsols-arrival-with-staking-focused-upside/,"Accelerating demand for solana exposure is fueling a rapid expansion of new ETFs, highlighting strengthening institutional traction and staking-focused designs as 21shares pushes the momentum forward with its latest entry into an expanding market today. Issuers Ramp up Solana ETF Rollouts Amid Mounting Demand A rising number of issuers are accelerating the launch of solana",Featured|ETF|Solana (SOL),EN,0,0,MARKET|SOL|SPONSORED|CRYPTOCURRENCY,"{'name': 'Bitcoin.com', 'img': 'https://images.cryptocompare.com/news/default/bitcoincom.png', 'lang': 'EN'}",bitcoin.com,2025-11-19 23:10:43
54628728,https://cryptonews.com/?p=453650,1763594160,https://resources.cryptocompare.com/news/52/54628728.jpeg,XRP Price Prediction: 42% of Holders Are Losing Money – How Low Can XRP Fall?,https://cryptonews.com/news/xrp-price-prediction-42-of-holders-are-losing-money-how-low-can-xrp-fall/,"A new Glassnode report casts a bearish tone on the XRP price prediction , as data shows a large chunk of holders are still deep underwater. According to on-chain metrics, 42% of current XRP wallets accumulated their tokens near the $3 mark, leaving many with losses of 40% or more. Analysts warn that prolonged unrealized losses can trigger capitulation, adding pressure to an already fragile market outlook. While the XRP price is still nearly 4 times higher than it was in November last year, many investors appear to have entered during the post-SEC rally when sentiment was peaking. That surge, triggered by partial legal wins against the SEC, attracted a wave of buyers now sitting deep in the red. With sentiment still near historic lows, analysts warn that this group of underwater holders could start exiting if the broader market continues to slide. XRP Price Prediction: ETF Launches Could Trigger a Trend Reversal XRP is approaching a potential breakdown toward the $1.50 support zone after failing to hold above recent consolidation levels. The chart shows a descending structure forming, with any bounce likely facing resistance around $2.50 and again near the $3.60 high. If sentiment begins to turn and support holds, XRP may recover in phases — but for now, momentum remains weak. The upcoming launch of multiple XRP exchange-traded funds (ETFs) in the United States offers a long-term catalyst, potentially unlocking institutional demand once market conditions stabilize. In the meantime, storage and security remain key for any crypto portfolio. Best Wallet Token ($BEST) is gaining traction with its presale , offering a seamless way to manage assets, stake tokens, and gain early access to top crypto opportunities all from one platform. Best Wallet Token ($BEST) Presale Ends in 9 Days and Prepares for Its Official Launch The Best Wallet ecosystem is made up of more than just a top-notch crypto wallet. It includes a suite of decentralized applications (dApps) that will allow users to swap tokens with low fees and get access to exclusive opportunities in the crypto space. At the core of the ecosystem is Best Wallet Token ($BEST) , the access point to a suite of premium crypto features. Holders gain reduced fees, early entry into high-potential presales, and soon, the ability to make real-world purchases through the upcoming Best Card . The Best Wallet app has already received strong reviews on both Google Play and the Apple Store, reinforcing its reputation for delivering a seamless Web3 experience. As demand for integrated crypto tools continues to grow, interest in $BEST is expected to follow. To join before the presale closes, visit the official Best Wallet website or download the Best Wallet app . You can buy using USDT, ETH, or a bank card in just a few clicks. Buy $BEST Here. The post XRP Price Prediction: 42% of Holders Are Losing Money – How Low Can XRP Fall? appeared first on Cryptonews .",Price Analysis|Ripple|XRP News|XRP Price Prediction,EN,0,0,MARKET|REGULATION|TRADING|XRP|CRYPTOCURRENCY,"{'name': 'cryptonews', 'img': 'https://images.cryptocompare.com/news/default/cryptonews.png', 'lang': 'EN'}",cryptonews,2025-11-19 23:16:00
54628813,https://cryptonews.com/?p=453992,1763594321,https://resources.cryptocompare.com/news/52/54628813.jpeg,Why Bitcoin’s Latest Dip Has Supercharged Demand for Crypto Retirement Accounts,https://cryptonews.com/news/why-market-pullbacks-are-the-best-time-to-add-bitcoin-to-retirement-accounts/,"Recent Bitcoin ( BTC ) price swings have been unsettling for short-term traders, prompting some to question whether the market is undergoing a temporary correction or entering a prolonged do wnturn . However, for long-term retirement investors —particularly those using Bitcoin IRAs—price dips can offer strategic entry points rather than reasons for concern. Jonathan Rose, CEO of BlockTrust IRA, told Cryptonews that downturns often create the most compelling opportunities. He noted that the recent crypto pullback resulted in one of the busiest weeks ever for BlockTrust IRA, a U.S.-based platform that allows retail investors to hold crypto in tax-advantaged retirement accounts. “We are seeing a huge shift of investors putting crypto in BlockTrust IRAs, which indicates that Bitcoin is here to stay and that this is a great price entry opportunity,” he said. Data from Alto, a platform that allows users to add alternative assets to self-directed retirement accounts, echoes this trend. The company reported that its 29,000 self-directed IRA users executed over 240,000 crypto trades last year. Alto also stated that proprietary data from its platform reflects the growing confidence in crypto investments as part of a self-directed IRA. Crypto isn't just for traders. It's for planners. A Crypto IRA can help you secure your financial future. — BitcoinIRA (@Bitcoin_IRA) November 13, 2025 A Long-Awaited Entry Point for Retirement Investors Rose added that Bitcoin’s recent dip has opened the door for investors who previously felt like they had “missed the boat.” “For retirement investors who plan to hold Bitcoin for 10, 20, or even 30 years, dips simply represent lower entry points,” he said. This sentiment is shared across the industry. Ryan Flynn, head of Swan Advisor at Swan Bitcoin—a Bitcoin-only wealth management firm—told Cryptonews that Swan sees increased buying activity across all account types during drawdowns, including IRAs. “ Drawdowns in Bitcoin’s price are normal as Bitcoin continues its path of monetization and represents a buying opportunity for those who understand its fundamentals,” Flynn said. Jad Comair, CEO of Melanion Capital, added that Bitcoin’s pullbacks differ from traditional assets. He explained that traditional stock investments typically drop when fundamentals are deteriorating. However, Comair pointed out that Bitcoin investments work differently. “Bitcoin’s fundamentals don’t change when the price pulls back. The supply schedule remains fixed, the halving cadence continues, and global adoption keeps expanding,” he stated. Tax Benefits Strengthen the Case for Buying the Dip While lower prices alone create attractive buying conditions, Bitcoin IRAs offer additional advantages. The most obvious advantage of a Bitcoin dip is the chance to acquire more BTC for the same dollar amount. In a tax-advantaged retirement account , this effect compounds over decades. With a Traditional Bitcoin IRA, gains are tax-deferred; in a Roth Bitcoin IRA, gains can grow tax-free. Accumulating BTC at discounted prices inside these structures maximizes long-term appreciation without triggering taxable events along the way. “In Roth IRAs specifically, this allows for more of Bitcoin’s future price action to be captured as tax-free appreciation. Drawdowns allow retirement investors to max out capped annual contributions, increasing the account’s Bitcoin exposure,” Flynn explained. He added that when Bitcoin pulls back from $125k to $90k, the same $7k annual contribution purchases nearly 40% more Bitcoin. “These advantages accrue mostly to the investor who is preparing for retirement in the next 5-10 or more years,” Flynn stated. Yet, Flynn pointed out that disadvantages can particularly impact those investors who are already in retirement or are nearing that period. This is because these individuals have less time to recover to previous highs before distributions begin. “There is a behavioral risk that puts those investors who don’t understand what Bitcoin represents at a disadvantage where they may be more likely to panic sell near local bottoms,” Flynn said. Jonathan Bander, CPA at a New York-based public accounting firm ExperityCPA, further told Cryptonews that while a drop in BTC enables tax-loss harvesting to offset gains, disadvantages include no offset for personal income inside IRAs and ongoing volatility risk. Who Should Consider a Bitcoin IRA? While industry experts generally agree that Bitcoin dips can favor long-term retirement investors, suitability varies by investor. Crypto is highly volatile and may be more susceptible to manipulation than registered securities. Because of this, Comair believes younger investors may be best positioned to benefit. “They have the longest runway to let Bitcoin’s structural appreciation compound and can treat volatility the same way they would treat another major company’s historic drawdowns,” he said. Comair added that investors with stable cash flow and low liquidity pressure may also find a Bitcoin IRA appealing. “These individuals can keep contributing during corrections without being forced to sell.” Investors worried about long-term fiat debasement could also be a good fit, as Comair commented that Bitcoin’s fixed supply and institutional adoption make it a strategic hedge for retirement portfolios that are otherwise concentrated in assets tied to central bank policy. A Crypto IRA might offer tax-deferred growth and diversification. Just make sure it lines up with your risk tolerance and retirement timeline before jumping in. — Digital Wealth Partners (@DWP_advisors) November 14, 2025 However, investors who are more cautious or close to retirement and cannot tolerate large swings may want to rethink having a Bitcoin IRA. Fidelity research found that adding BTC to a portfolio would have enhanced returns during specific periods in the past, but also that even a small allocation of Bitcoin meaningfully increased portfolio volatility. Source: Fidelity Research The Future Growth of Bitcoin IRAs As the broader crypto market matures , demand for Bitcoin IRAs appears set to accelerate. Rose said BlockTrust is already seeing increased interest from international investors seeking exposure through U.S.-based Bitcoin IRAs. Comair believes this trend is only just beginning. He predicts that by 2026, Bitcoin will sit “much closer to the center of retirement strategies.” “Exchange-traded fund penetration will be broader, corporate ownership more common, and the post-halving supply regime will be tighter. For retirement investors, this period will be remembered as the phase when buying dips in a structurally appreciating asset became standard practice, not a contrarian move.” The post Why Bitcoin’s Latest Dip Has Supercharged Demand for Crypto Retirement Accounts appeared first on Cryptonews .",Bitcoin News|News|Bitcoin|Bitcoin Price|btc,EN,0,0,BTC|BUSINESS|MARKET|TRADING|CRYPTOCURRENCY,"{'name': 'cryptonews', 'img': 'https://images.cryptocompare.com/news/default/cryptonews.png', 'lang': 'EN'}",cryptonews,2025-11-19 23:18:41
