id,guid,published_on,imageurl,title,url,body,tags,lang,upvotes,downvotes,categories,source_info,source,date
54631814,https://bitcoinworld.co.in/?p=220886,1763600110,https://resources.cryptocompare.com/news/82/default.png,"Bitcoin Price Surge: Remarkable Rally Pushes BTC Above $92,000 Milestone",https://bitcoinworld.co.in/bitcoin-price-surge-milestone-10/,"BitcoinWorld Bitcoin Price Surge: Remarkable Rally Pushes BTC Above $92,000 Milestone The cryptocurrency market is witnessing an extraordinary moment as Bitcoin achieves a significant milestone. According to Bitcoin World market monitoring, BTC has surged past the $92,000 mark, currently trading at $92,011.04 on the Binance USDT market. This remarkable Bitcoin price surge represents one of the most impressive performances in recent cryptocurrency history. What’s Driving This Bitcoin Price Surge? Several key factors are contributing to this impressive Bitcoin price surge. Market analysts point to increased institutional adoption as a primary driver. Moreover, growing mainstream acceptance and regulatory clarity have boosted investor confidence. The current trading volume indicates strong buying pressure across major exchanges. Technical analysis reveals that Bitcoin has broken through multiple resistance levels. This breakthrough suggests sustained momentum could continue. However, traders should remain cautious about potential volatility. How Significant Is This $92,000 Achievement? Reaching $92,000 marks a crucial psychological barrier for Bitcoin. This Bitcoin price surge demonstrates the asset’s resilience and growing maturity. The market has shown remarkable recovery from previous corrections. Key observations from this movement include: Strong institutional interest continues to support prices Retail participation is increasing steadily Global economic factors are favoring alternative assets Technical indicators suggest potential for further gains What Does This Mean for Crypto Investors? This Bitcoin price surge offers both opportunities and challenges for investors. Newcomers should approach the market with careful research and risk management. Experienced traders might consider profit-taking strategies while monitoring key support levels. The current Bitcoin price surge reflects broader market trends. Altcoins often follow Bitcoin’s lead, though timing and magnitude can vary. Diversification remains a wise strategy in volatile markets. Future Outlook for Bitcoin’s Trajectory Market experts are closely watching several indicators that could influence future price movements. The current Bitcoin price surge might test higher resistance levels if buying pressure continues. However, corrections are normal in cryptocurrency markets. Factors to monitor include: Regulatory developments in major economies Institutional investment flows Global macroeconomic conditions Technological advancements in blockchain Conclusion: Navigating the Bitcoin Landscape This Bitcoin price surge above $92,000 demonstrates the cryptocurrency’s enduring appeal and market strength. While current momentum is impressive, investors should maintain balanced perspectives and thorough research. The cryptocurrency market continues to evolve, offering both substantial opportunities and inherent risks that require careful navigation. Frequently Asked Questions What caused Bitcoin to surge above $92,000? Multiple factors contributed, including increased institutional adoption, positive regulatory developments, and growing mainstream acceptance of cryptocurrencies. Is this a good time to invest in Bitcoin? While the current Bitcoin price surge is impressive, investors should conduct personal research and consider their risk tolerance before making investment decisions. How high can Bitcoin price go? Price predictions vary widely among analysts. Market conditions, adoption rates, and global economic factors will influence future price movements. Should I be concerned about a price correction? Price corrections are normal in cryptocurrency markets. Long-term investors typically focus on fundamental value rather than short-term fluctuations. What’s the best way to track Bitcoin prices? Reputable cryptocurrency exchanges and financial platforms provide real-time price tracking. Always verify information from multiple reliable sources. How does this affect other cryptocurrencies? Bitcoin often leads market trends, but individual cryptocurrencies may respond differently based on their specific fundamentals and market position. Found this analysis helpful? Share this article with fellow crypto enthusiasts on social media to spread awareness about this significant Bitcoin price surge and help others stay informed about market developments. To learn more about the latest Bitcoin trends, explore our article on key developments shaping Bitcoin price action and institutional adoption. This post Bitcoin Price Surge: Remarkable Rally Pushes BTC Above $92,000 Milestone first appeared on BitcoinWorld .",Crypto News|BITCOIN|BLOCKCHAIN|CRYPTOCURRENCY|Market Analysis|trading.,EN,0,0,BTC|BUSINESS|MARKET|TRADING|CRYPTOCURRENCY,"{'name': 'Bitcoin World', 'img': 'https://resources.cryptocompare.com/news/82/default.png', 'lang': 'EN'}",bitcoinworld,2025-11-20 00:55:10
54631944,https://bitcoinworld.co.in/?p=220885,1763600411,https://resources.cryptocompare.com/news/82/default.png,Revealing: Altcoin Season Index Plummets to 26 – What This Means for Your Crypto Portfolio,https://bitcoinworld.co.in/altcoin-season-index-drops-9/,"BitcoinWorld Revealing: Altcoin Season Index Plummets to 26 – What This Means for Your Crypto Portfolio Have you been watching the cryptocurrency markets lately? The latest data reveals a significant shift that every crypto investor needs to understand. The Altcoin Season Index has dropped five crucial points to just 26, signaling a potential change in market dynamics that could impact your investment strategy. What Exactly is the Altcoin Season Index? CoinMarketCap’s Altcoin Season Index serves as a crucial market indicator for cryptocurrency investors. This important metric defines an “altcoin season” as a period where 75% of the top 100 cryptocurrencies outperform Bitcoin over 90 days. The current Altcoin Season Index reading of 26 suggests we’re firmly in Bitcoin season territory. Why Should You Care About This Altcoin Season Index Drop? The five-point decline in the Altcoin Season Index matters because it reflects changing investor sentiment and capital flows. When the index moves lower, it indicates: Bitcoin is outperforming most alternative cryptocurrencies Investor confidence may be shifting toward established assets Market risk appetite could be decreasing Capital rotation from altcoins to Bitcoin is occurring How Does the Altcoin Season Index Actually Work? Understanding the mechanics behind the Altcoin Season Index helps you make better investment decisions. The index excludes stablecoins and wrapped coins from its calculation, focusing purely on performance comparisons. A score closer to 100 indicates strong altcoin season conditions, while lower scores like the current 26 point toward Bitcoin dominance. What Investment Strategies Make Sense Now? With the Altcoin Season Index sitting at 26, investors should consider several approaches. First, recognize that Bitcoin seasons often precede altcoin rallies. Historical patterns show that after extended Bitcoin dominance, capital typically flows back into altcoins. However, timing these transitions requires careful market observation and risk management. Consider these actionable insights: Diversify strategically rather than abandoning altcoins completely Monitor the Altcoin Season Index weekly for trend changes Focus on fundamentals rather than short-term price movements Set clear entry and exit points for your altcoin positions When Might We See the Next Altcoin Season? Predicting the exact timing of market shifts remains challenging, but the Altcoin Season Index provides valuable clues. The current reading suggests we’re not in altcoin season territory yet. However, market conditions can change rapidly based on several factors including regulatory developments, technological advancements, and macroeconomic trends. Conclusion: Navigating the Current Market Landscape The Altcoin Season Index drop to 26 presents both challenges and opportunities for cryptocurrency investors. While Bitcoin appears to be dominating currently, this often sets the stage for future altcoin rallies. By understanding what the Altcoin Season Index measures and how to interpret its movements, you can make more informed decisions about your cryptocurrency portfolio allocation and timing. Frequently Asked Questions What does an Altcoin Season Index of 26 mean? An Altcoin Season Index of 26 indicates that Bitcoin is significantly outperforming most alternative cryptocurrencies. The index measures how many of the top 100 cryptocurrencies are beating Bitcoin’s performance over 90 days. How often does the Altcoin Season Index update? The Altcoin Season Index typically updates regularly as market data becomes available, providing ongoing insights into market dynamics between Bitcoin and altcoins. Should I sell my altcoins when the index is low? Not necessarily. While a low Altcoin Season Index suggests Bitcoin dominance, it often precedes altcoin rallies. Consider your investment strategy and risk tolerance rather than making reactionary decisions. What’s the difference between Bitcoin season and altcoin season? Bitcoin season occurs when Bitcoin outperforms most altcoins, while altcoin season happens when 75% of top cryptocurrencies outperform Bitcoin over 90 days. Can the Altcoin Season Index predict market crashes? The index measures relative performance between assets rather than predicting absolute price movements or market crashes. It’s best used as one of several market analysis tools. How reliable is the Altcoin Season Index for trading decisions? While valuable for understanding market trends, the index should complement rather than replace comprehensive research and risk management in trading decisions. Found this analysis helpful? Share these crucial Altcoin Season Index insights with fellow cryptocurrency enthusiasts on your social media channels to help them navigate these market conditions too! To learn more about the latest cryptocurrency market trends, explore our article on key developments shaping Bitcoin price action and institutional adoption. This post Revealing: Altcoin Season Index Plummets to 26 – What This Means for Your Crypto Portfolio first appeared on BitcoinWorld .",Crypto News|Altcoin|BITCOIN|Crypto Investing|CRYPTOCURRENCY|Market Analysis,EN,0,0,ALTCOIN|BTC|BUSINESS|MARKET|CRYPTOCURRENCY,"{'name': 'Bitcoin World', 'img': 'https://resources.cryptocompare.com/news/82/default.png', 'lang': 'EN'}",bitcoinworld,2025-11-20 01:00:11
54631960,https://www.newsbtc.com/?p=855571,1763600430,https://resources.cryptocompare.com/news/21/54631960.jpeg,"Dogecoin Flashes Major Rebound Signal As Exchange Flows Flip, Analyst Warns",https://www.newsbtc.com/news/dogecoin/dogecoin-major-rebound-signal-exchange-flows/,"Dogecoin’s exchange dynamics have flipped at a key moment, with fresh on-chain data pointing to a shift in short-term market structure. Crypto analyst Ali Martinez (@ali_charts) highlighted a Glassnode chart showing that Dogecoin’s net supply on centralized exchanges has just turned positive, noting on X: “Dogecoin supply on exchanges just turned positive! This shift has marked sharp rebounds before.” Dogecoin Rebound Loading? The chart in his post, “DOGE: Exchange Net Position Change – All Exchanges,” tracks monthly exchange inflows and outflows as a histogram, alongside DOGE’s price in US dollars. Green bars indicate net inflows (more DOGE moving to exchanges than leaving), while red bars show net outflows. From mid-2024 through late 2024, the series alternates between modest red and green periods before a sustained cluster of strong green bars emerges around the fourth quarter of 2024. During that phase, net inflows rise to several billion DOGE per month. At the same time, the price line accelerated from below $0.10 to a local peak to $0.48, illustrating how heavy exchange-side activity accompanied the rally. Related Reading: Dogecoin Breakdown Or Bottom? On-Chain Risk Hits Extreme Value Zone After that peak, the structure changes. Through early and mid-2025, the histogram becomes more mixed, with smaller positive and negative reads as price oscillates broadly between roughly $0.12 and $0.30. Heading into late 2025, however, the chart shows a pronounced sequence of red bars, with net outflows extending down toward roughly −5 to −6 billion DOGE while the price trends lower from the mid-$0.20s toward the low-$0.20s and below. The final data point, emphasized by a circular highlight on the right edge of the chart, marks a clear break in that pattern: a tall green bar crosses back above the zero line, indicating that net flows have turned positive again. At that moment, the price line sits slightly above the $0.15 mark on the vertical scale. Martinez interprets this as a “major rebound signal,” pointing to previous instances where a similar transition from persistent outflows to strong inflows coincided with sharp directional moves. DOGE On Thin Ice Below $0.16 A second chart he shared, an ATH-partitioned UTXO Realized Price Distribution (URPD), sets out where the current DOGE supply last moved on-chain. A single, dominant bar appears around $0.07392452 and accounts for 28,260,298,271.803 DOGE, or 18.62% of the measured supply. Martinez summarizes this by stating that 27.4 billion DOGE have accumulated at roughly $0.08, calling it the “most significant support level.” Between that $0.07–$0.08 block and approximately $0.16, the URPD shows a shaded “GAP” with only small intermediate bars around levels such as $0.096, $0.125 and $0.155. Above the gap, a smaller but still notable cluster appears at about $0.162633395, containing 4,399,496,300.739 DOGE (2.9% of supply). “Below $0.16, support for Dogecoin $DOGE disappears quickly,” Martinez warns, adding that the “next real demand zone sits at $0.07.” Related Reading: One Slip And Dogecoin Could Plunge Back Into A Bear Market: Analyst A third chart, a cost-basis distribution heatmap, tracks DOGE’s price against horizontal bands representing where holders’ cost bases are concentrated. It confirms two core cohorts: a lower band between $0.0812497 and $0.08279775 with 27,397,971,652.123432 DOGE, and an upper band from $0.20103297 to $0.20486326 containing 12,156,333,652.493444 DOGE. Together with the newly positive exchange flows, these data points define a market caught between a dense realized floor around $0.08 and a substantial holder cluster near $0.20, with the latest flow reversal now in focus for traders tracking DOGE’s next move. At press time, DOGE traded at $0.158. Featured image created with DALL.E, chart from TradingView.com",Dogecoin|doge|DOGE news|Doge price|Dogecoin news|dogecoin price,EN,0,0,DOGE|EXCHANGE|MARKET|TRADING|CRYPTOCURRENCY,"{'name': 'NewsBTC', 'img': 'https://images.cryptocompare.com/news/default/newsbtc.png', 'lang': 'EN'}",newsbtc,2025-11-20 01:00:30
54631970,630587,1763600432,https://resources.cryptocompare.com/news/13/54631970.jpeg,First Bitcoin-Backed Municipal Bond Launches In New Hampshire,https://bitcoinist.com/first-bitcoin-backed-municipal-bond-new-hampshire/,"New Hampshire has authorized the first US municipal security explicitly backed by Bitcoin, approving a $100 million “conduit” bond that uses over-collateralized BTC rather than tax revenues or project cash flows as its primary backstop. The decision by the state’s Business Finance Authority (BFA) positions New Hampshire as an early test bed for integrating digital assets into the roughly $140 trillion global bond market. New Hampshire Continues To Lead US States Into Bitcoin Adoption Governor Kelly Ayotte framed the move as a way to attract capital while insulating residents from balance-sheet risk, saying she is “proud that New Hampshire is once again first in the nation to embrace new technologies with this historic Bitcoin-backed bond,” and calling it “an innovative way to bring more investment opportunities to our state and position us as a leader in digital finance without risking state funds or taxpayer dollars.” The bond follows a standard conduit structure: the BFA authorizes the issuance, but the credit risk rests with the private borrower, not the state’s general fund. What is novel is the collateral package. The borrower must post about 160 percent of the bond’s notional value in Bitcoin, held by digital asset custodian BitGo . If BTC’s price falls and the collateralization ratio approaches roughly 130 percent, automatic liquidation of part of the Bitcoin stack is triggered to protect bondholders and preserve principal. The BFA oversees the framework but does not guarantee repayment. SCOOP: New Hampshire Launches First Bitcoin-Backed Municipal Bond The Granite State just became the first to approve a muni bond backed by $BTC , a milestone that could pave the way for digital assets to enter the $140 trillion global debt market. https://t.co/18XTtMK9Tw — Eleanor Terrett (@EleanorTerrett) November 19, 2025 The structure was designed by Wave Digital Assets and municipal specialist Rosemawr Management, with BitGo as custodian and Orrick, Herrington & Sutcliffe as legal counsel. Wave co-founder Les Borsai described the transaction as “the opening of a new debt market,” arguing that it shows how “public and private sectors can collaborate to responsibly unlock the value of digital assets.” Orrick partner Orion Mountainspring called it “the first municipal security backed by cryptocurrency” and a potential “game-changer for digital currency and municipal finance.” Fees and any Bitcoin appreciation associated with the transaction will flow into a dedicated Bitcoin Economic Development Fund, intended to support innovation and business growth in the state, rather than the general budget. The bond also dovetails with New Hampshire’s recently authorized Strategic Bitcoin Reserve, which allows the state treasury to allocate up to 5 percent of funds into highly capitalized digital assets, in practice making Bitcoin the only viable candidate under today’s market conditions. Republican representative Keith Ammon, the driving force behind much of the state’s Bitcoin legislation, has presented the framework as a controlled way to test BTC as high-grade collateral for public finance without exposing taxpayers to direct losses. Because the bond is not a general-obligation security and relies on over-collateralization plus pre-defined liquidation thresholds, officials argue that Bitcoin’s volatility is ring-fenced within the structure. Whether the model scales beyond this initial authorization will depend on investor demand, pricing and ratings treatment once an actual borrower brings a deal to market. For now, New Hampshire has moved the concept of Bitcoin-backed public debt from theory into the machinery of US municipal finance, creating a live template other states and issuers can study or choose to emulate. At press time, BTC traded at $91,401.",Bitcoin News|bitcoin|bitcoin news|bitcoin price|btc|BTC news|btc price,EN,0,0,BTC|BUSINESS|MARKET|REGULATION|CRYPTOCURRENCY,"{'name': 'Bitcoinist', 'img': 'https://images.cryptocompare.com/news/default/bitcoinist.png', 'lang': 'EN'}",bitcoinist,2025-11-20 01:00:32
54631995,https://ambcrypto.com/?p=547343,1763600453,https://images.cryptocompare.com/news/default/ambcrypto.png,What is the current state of XRP’s price action?,https://ambcrypto.com/what-is-the-current-state-of-xrps-price-action/,"A daily session close below $2.06, or a 4-hour session close below $1.97, would confirm the downtrend's continuation.",Altcoin|Analysis|HideCryptopanic|News|News 1|No Homepage|Social|Trading View|ambcrypto,EN,0,0,ALTCOIN|MARKET|TRADING|XRP|CRYPTOCURRENCY,"{'name': 'AMB Crypto', 'img': 'https://images.cryptocompare.com/news/default/ambcrypto.png', 'lang': 'EN'}",ambcrypto,2025-11-20 01:00:53
54632074,https://en.coinotag.com/breakingnews/bitcoin-outflows-hit-blackrocks-ibit-1-7822b-net-outflow-since-november-and-record-0-5232b-in-one-day,1763600663,https://resources.cryptocompare.com/news/77/default.png,🚨 Bitcoin Outflows Hit BlackRock’s IBIT: $1.7822B Net Outflow Since November and Record $0.5232B in One Day,https://en.coinotag.com/breakingnews/bitcoin-outflows-hit-blackrocks-ibit-1-7822b-net-outflow-since-november-and-record-0-5232b-in-one-day,Bitcoin Outflows Hit BlackRock’s IBIT: $1.7822B Net Outflow Since November and Record $0.5232B in One Day,Breaking News,EN,0,0,BTC|CRYPTOCURRENCY,"{'name': 'CoinOtag', 'img': 'https://resources.cryptocompare.com/news/77/default.png', 'lang': 'EN'}",coinotag,2025-11-20 01:04:23
54632961,https://decrypt.co/?p=349294,1763602212,https://resources.cryptocompare.com/news/44/54632961.jpeg,NASA Insists Interstellar Visitor Is ‘Just a Comet’ as Public Speculation Lingers,https://decrypt.co/349294/nasa-insists-interstellar-visitor-comet-public-speculation-persists,Agency officials said data showed nothing unusual about Comet 3I Atlas despite weeks of speculation.,Technology,EN,0,0,TECHNOLOGY,"{'name': 'Decrypt', 'img': 'https://images.cryptocompare.com/news/default/decrypt.png', 'lang': 'EN'}",decrypt,2025-11-20 01:30:12
54632942,https://news.bitcoin.com/?p=771980&preview=true&preview_id=771980,1763602229,https://resources.cryptocompare.com/news/14/54632942.jpeg,CME Announces Spot-Quoted XRP and SOL Futures as Institutional Demand Escalates,https://news.bitcoin.com/cme-announces-spot-quoted-xrp-and-sol-futures-as-institutional-demand-escalates/,"Exploding institutional appetite for regulated altcoin derivatives is driving a powerful new wave of product growth, with fresh XRP and SOL futures poised to accelerate liquidity, sharpen price discovery, and redefine the next phase of digital-asset market evolution. XRP and SOL Futures Expand Regulated Crypto Access Growing demand for regulated digital-asset derivatives is accelerating product",Featured|CME|derivatives|Ripple XRP|Solana (SOL),EN,0,0,ALTCOIN|SOL|SPONSORED|XRP|CRYPTOCURRENCY,"{'name': 'Bitcoin.com', 'img': 'https://images.cryptocompare.com/news/default/bitcoincom.png', 'lang': 'EN'}",bitcoin.com,2025-11-20 01:30:29
54632996,https://en.coinotag.com/breakingnews/trump-considers-executive-order-to-regulate-ai-launches-ai-litigation-task-force-with-cryptocurrency-advisors,1763602323,https://resources.cryptocompare.com/news/77/default.png,"🚨 Trump Considers Executive Order to Regulate AI, Launches AI Litigation Task Force with Cryptocurrency Advisors",https://en.coinotag.com/breakingnews/trump-considers-executive-order-to-regulate-ai-launches-ai-litigation-task-force-with-cryptocurrency-advisors,"Trump Considers Executive Order to Regulate AI, Launches AI Litigation Task Force with Cryptocurrency Advisors",Breaking News,EN,0,0,OTHER,"{'name': 'CoinOtag', 'img': 'https://resources.cryptocompare.com/news/77/default.png', 'lang': 'EN'}",coinotag,2025-11-20 01:32:03
54632995,https://en.coinotag.com/breakingnews/trump-mulls-executive-order-to-regulate-ai-launches-ai-litigation-task-force-to-challenge-state-laws-tied-to-white-house-cryptocurrency-advisory-group,1763602323,https://resources.cryptocompare.com/news/77/default.png,"🚨 Trump Mulls Executive Order to Regulate AI, Launches AI Litigation Task Force to Challenge State Laws, Tied to White House Cryptocurrency Advisory Group",https://en.coinotag.com/breakingnews/trump-mulls-executive-order-to-regulate-ai-launches-ai-litigation-task-force-to-challenge-state-laws-tied-to-white-house-cryptocurrency-advisory-group,"Trump Mulls Executive Order to Regulate AI, Launches AI Litigation Task Force to Challenge State Laws, Tied to White House Cryptocurrency Advisory Group",Breaking News,EN,0,0,OTHER,"{'name': 'CoinOtag', 'img': 'https://resources.cryptocompare.com/news/77/default.png', 'lang': 'EN'}",coinotag,2025-11-20 01:32:03
54633221,https://en.coinotag.com/us-eyes-delay-on-semiconductor-tariffs-to-avoid-china-trade-tensions,1763602453,https://resources.cryptocompare.com/news/77/default.png,US Eyes Delay on Semiconductor Tariffs to Avoid China Trade Tensions,https://en.coinotag.com/us-eyes-delay-on-semiconductor-tariffs-to-avoid-china-trade-tensions,"US officials have indicated a delay in implementing semiconductor tariffs under President Trump, potentially disrupting economic plans amid trade tensions with China. This cautious approach aims to avoid escalation while protecting supply chains for critical technologies. Officials shared updates with stakeholders, signaling no immediate action on tariffs. The administration is proceeding carefully to prevent conflicts",News,EN,0,0,ASIA|REGULATION|MACROECONOMICS,"{'name': 'CoinOtag', 'img': 'https://resources.cryptocompare.com/news/77/default.png', 'lang': 'EN'}",coinotag,2025-11-20 01:34:13
