id,guid,published_on,imageurl,title,url,body,tags,lang,upvotes,downvotes,categories,source_info,source,date
55111067,https://en.coinotag.com/coinshares-halts-solana-staking-etf-amid-strong-sol-inflows,1764444434,https://resources.cryptocompare.com/news/77/55111067.jpeg,CoinShares Halts Solana Staking ETF Amid Strong SOL Inflows,https://en.coinotag.com/coinshares-halts-solana-staking-etf-amid-strong-sol-inflows,"CoinShares has halted its plans for Solana staking, XRP, and Litecoin ETFs in the US, shifting focus amid a slowing altcoin market. Meanwhile, existing Solana ETFs continue to attract strong inflows, highlighting investor confidence in SOL despite broader challenges. CoinShares withdraws Solana staking ETF application as competing SOL funds report significant inflows, underscoring robust demand [...]",News|Ripple,EN,0,0,ALTCOIN|BUSINESS|LTC|SOL|CRYPTOCURRENCY,"{'name': 'CoinOtag', 'img': 'https://resources.cryptocompare.com/news/77/default.png', 'lang': 'EN'}",coinotag,2025-11-29 19:27:14
55111741,https://cryptopotato.com/?p=1421706,1764445611,https://resources.cryptocompare.com/news/27/55111741.jpeg,Ethereum’s November Trading Frenzy: Spot Volume Hits $375B as ETFs Add $35B Punch,https://cryptopotato.com/ethereums-november-trading-frenzy-spot-volume-hits-375b-as-etfs-add-35b-punch/,"The trading activity of Ethereum (ETH) has remained high throughout 2025. Interestingly, CryptoQuant data now reveals that spot trading volume across exchanges reached $375 billion in November. Meanwhile, exchange-traded fund (ETF) volume climbed to nearly $35 billion. Institutional Money Pours In According to the analysis, Ethereum began the year with significant volatility in monthly trading activity, with total volume fluctuating between roughly $280 billion and $380 billion before accelerating sharply in the middle of the year. That surge eventually led to a peak of more than $599 billion in August, and marked the highest monthly trading volume recorded during the period. Following this spike, trading activity eased but stayed comparatively strong, and ended November at around $375 billion, a level that indicates continued market participation despite ongoing price pressures. CryptoQuant found that Binance remained the dominant venue for Ethereum trading, and recorded approximately $198 billion in spot trading volume during November alone. This figure underscores Binance’s central role in real-time liquidity flows and its position as the leading platform for both institutional and retail traders executing high-volume transactions. Data also shows that institutional interest played a meaningful role through regulated investment vehicles, with Ethereum spot ETFs registering about $35 billion in trading volume for the month. Such a level of ETF activity points to continued engagement from traditional market participants and adds an additional layer of “organized liquidity” to overall Ethereum market flows during the period. Currently, Ethereum is seeing renewed confidence from large investors as whale activity increasingly leans toward long positions, according to Alphractal’s Whale vs Retail Delta metric. On the price front, ETH has climbed above $3,000. Despite remaining around 24% lower over the month, the asset’s recovery coincided with aggressive accumulation from major holders. As recently reported by CryptoPotato, wallets holding 10,000-100,000 ETH now control a record level of over 21 million ETH, while entities with over 100,000 ETH have expanded their balance to around 4.3 million ETH. ETH Near Neutral Zone Further analysis reveals that Ethereum is trading near fair-value territory, as important on-chain indicators point to a sensitive phase in the market. Ethereum’s Realized Price stands at $2,315 and an MVRV ratio of 1.27. This places the asset in a neutral zone where the market price sits just 27% above the Realized Price, which shows neither overbought nor oversold conditions. Binance-specific data reflects an even sharper shift, as Ethereum’s MVRV ratio on the exchange hovers near 0.999, just below the historically important threshold of 1.0. A reading under 1 means that market capitalization is aligning with the Realized Price, pushing most investors into a “no-profit, no-loss” position. This zone has historically coincided with early market bottoms or extended periods of price weakness. On the other hand, long-term MVRV readings above 3 typically correspond with overbought phases, while values below 1 indicate market troughs characterized by unrealized losses. The current ratio of 1.27 points to a balanced market structure with no strong signals of extreme valuation. The post Ethereum’s November Trading Frenzy: Spot Volume Hits $375B as ETFs Add $35B Punch appeared first on CryptoPotato .",AA News|Crypto News|Ethereum (ETH) Price|Ethereum ETF,EN,0,0,ETH|EXCHANGE|MARKET|TRADING|CRYPTOCURRENCY,"{'name': 'Crypto Potato', 'img': 'https://images.cryptocompare.com/news/default/cryptopotato.png', 'lang': 'EN'}",cryptopotato,2025-11-29 19:46:51
55111790,https://coinpaper.com/12754/arthur-hayes-predicts-collapse-of-most-layer-1-tokens-outside-ethereum-and-solana,1764445813,https://resources.cryptocompare.com/news/93/default.png,Arthur Hayes Predicts Collapse of Most Layer 1 Tokens Outside Ethereum and Solana,https://coinpaper.com/12754/arthur-hayes-predicts-collapse-of-most-layer-1-tokens-outside-ethereum-and-solana,"Arthur Hayes, co-founder of crypto derivatives exchange BitMEX, has warned that most Layer 1 blockchain tokens outside Ethereum and Solana are unlikely to survive long-term. In an interview with Altcoin Daily, he argued that many newly launched networks, despite attracting early investor attention, lack sustainable fundamentals and carry inflated valuations. Hayes emphasized that initial hype often creates short-term price gains but does not guarantee enduring success for these projects. Monad and the Risks of High-Valuation L1s Hayes specifically highlighted Monad, a recently launched L1 backed by Coinbase Ventures. At the time of his statement, MON token had risen 45% since its ICO, reaching roughly $0.037 with a market capitalization near $398 million. Despite these gains, Hayes expects a dramatic decline, citing the coin’s high fully diluted valuation and low circulating supply. He noted that many new L1s follow a pattern of early surges followed by sharp corrections, driven by initial investor optimism rather than fundamental value. According to Hayes, new L1 projects often attract attention because investors hope to discover the next Ethereum. Early pumps create excitement, but most tokens fail to maintain momentum once hype fades. Venture capital support may temporarily prop up prices, but Hayes warned that this does not guarantee long-term success. Consequently, he believes most L1 tokens outside Ethereum and Solana are destined for collapse. Ethereum and Solana: The Standout Networks Despite the challenges facing newer L1s, Hayes identifies Ethereum and Solana as exceptions. He sees Ethereum as the foundation for institutional blockchain adoption. Large banks and organizations now prefer public networks over private chains due to security and utility advantages. Layer 2 solutions like Arbitrum and Optimism will help Ethereum scale while maintaining privacy, positioning it for sustained growth. Solana, according to Hayes, remains the second-largest L1, benefiting previously from meme coin activity. However, he acknowledges that meme-driven growth has slowed. Solana will need a new catalyst to maintain user engagement and price momentum. While Hayes remains skeptical that it will surpass Ethereum, he believes the network will continue to play a significant role in the blockchain ecosystem. Hayes’ Magnificent Five In addition to Ethereum and Solana, Hayes named Bitcoin, Zcash, and Ethena as his top cryptocurrency picks. These networks combine adoption, security, and practical utility, which he considers critical for long-term success. By contrast, most other L1 tokens face a high risk of decline as early enthusiasm fades.",News|Crypto,EN,0,0,BLOCKCHAIN|BUSINESS|ETH|SOL|CRYPTOCURRENCY,"{'name': 'Coinpaper', 'img': 'https://resources.cryptocompare.com/news/93/default.png', 'lang': 'EN'}",coinpaper,2025-11-29 19:50:13
55111793,https://en.coin-turk.com/?p=207839,1764445829,https://resources.cryptocompare.com/news/79/55111793.jpeg,Solana Prices Tumble as Institutional Investors Hesitate,https://en.coin-turk.com/solana-prices-tumble-as-institutional-investors-hesitate/,"Solana couldn't stay above $140 despite ETF inflows and market recovery hints. On November 28, total Solana ETF net inflows hit $618.59 million. Continue Reading: Solana Prices Tumble as Institutional Investors Hesitate The post Solana Prices Tumble as Institutional Investors Hesitate appeared first on COINTURK NEWS .",Solana (SOL),EN,0,0,BUSINESS|MARKET|SOL|CRYPTOCURRENCY,"{'name': 'CoinTurk News', 'img': 'https://resources.cryptocompare.com/news/79/default.png', 'lang': 'EN'}",cointurken,2025-11-29 19:50:29
55112646,https://www.cryptopolitan.com/?p=869938,1764446400,https://resources.cryptocompare.com/news/43/55112646.jpeg,Investors Rush Into This New DeFi Cryptocurrency as Phase 6 Approaches 100% After 250% Jump,https://www.cryptopolitan.com/investors-rush-into-this-new-defi-cryptocurrency-as-phase-6-approaches-100-after-250-jump/,"An emerging crypto in the DeFi sector is attracting huge interest due to a fast 250% growth and investors are looking to invest before Phase 6 can be fully allocated. The momentum is gaining traction at an accelerated pace, and the preliminary indications are that this project could be among the best cryptocurrencies to follow in the coming 2026. As the demand is growing by the day, there are several traders who are worried about not getting one of the most desired early performances of the year. Mutuum Finance (MUTM) Mutuum Finance (MUTM) is building two lending markets in its protocol. P2C Lending: Under its derivative services called Peer-to-Contracts, buyers can post assets and earn mtTokens, which are equivalent to deposits for them and generate APY as borrowers use them. As an example, a person who provides $1,000 of USDC may be issued several mtUSDC, the value of which increases with the payment of interest by borrowers. The yield also depends on demand, and therefore, the more the borrowers the more the APY of the suppliers. P2P Marketplace: Mutuum Finance is also developing a Peer-to-peer marketplace and the users get to create single borrowing agreements. The rates are based on utilization and risk. Borrowers have options on whether to accept variable or in certain cases stable rates in case they want to have known costs on repaying loans. Loan to Value restrictions insure positions. The LTVs of lower-volatility investments such as the ETF remain at an average of 75%, whereas more aggressive prices remain only at 35%-40%. In case the value of collateral is low, the protocol causes the liquidation. Liquidators purchase collateral at a discount and redeem some of the debt held by the borrower, and this is to take care of system losses. Presale Progress, Funding Milestones and Demand Since it was launched in the beginning of 2025, momentum has been fast-paced at Mutuum Finance. The initial price was at $0.01 and now it is $0.035 with the price value increasing by 250%. The initial price is established as $0.06, which could imply a good increase in the price when the demand is maintained. The project has gathered a total of $19M funds and over 18,200 holders. Out of 4B supply of tokens, the presale has been allotted 45.5% which equals to 1.82B tokens. Of the same, 800M tokens are already owned. The momentum is high and Phase 6 is at the last leg with allocation standing at high above 92%. Mutuum Finance also operates a 24 hour leaderboard where the leader each day gets $500 in MUTM as a prize. This promotes the incessant use and assists in attracting new users into the system. The card payments also make participation possible in presale since buyers can immediately participate without any supplementary actions. The prelaunch crypto demand keeps gaining momentum with more and more traders seeking the most favorable crypto to purchase before launch. The window to enter at $0.035 is closing quicker than projected. V1 Check Mutuum Finance has assured using the official X account that the V1 of the protocol will launch on the Sepolia Testnet in Q4 2025. The initial one will consist of a liquidity pool, mtToken mechanisms, a debt-tracking token, and the liquidation bot. ETH and USDT will be accommodated initially. Another significant highlight is security. Mutuum Finance underwent a CertiK audit with a 90/100 Token Scan rating, with a thorough review of the lending and borrowing agreements currently being done by Halborn Security . This essay analyzes that a powerful audit, solid product roadmap, and fast presale growth, combined, might potentially put MUTM in one of the strongest early moves in 2026. According to the commentators in the market, it can further increase above $0.06 launch price in case the demand keeps rising considering the increased interest by the whale buyers. Layer-2 Expansion and Why It Matters The team is also gearing towards adding layer-2 expansion and seek to deploy on chains characterized by a lower fee and increased throughput. The reason behind this is that in cases where borrowing and lending are easy and inexpensive, DeFi platforms expand. Increased L2 coverage may also increase the number of total users and enhance liquidity. Such measures are important since users who seek to know what crypto to invest their money tend to select those projects that already display extensive planning rather than just through marketing or hype. Mutuum Finance possesses physical infrastructure in place, defined security level, and various avenues to grow upon the launching. Cash is flowing within investors and is moving fast with Phase 6 approaching a total of 100% sellout. Having increased its price by 250%, powerful DeFi mechanics, solid roadmap, large audits, plans of a layer-2, and growing purchasing force, Mutuum Finance is turning out to be among the most popular cryptocurrencies in 2026. For more information about Mutuum Finance (MUTM) visit the links below: Website: https://www.mutuum.com Linktree: https://linktr.ee/mutuumfinance",Press Release,EN,0,0,BLOCKCHAIN|BUSINESS|MARKET|TRADING|CRYPTOCURRENCY,"{'name': 'Cryptopolitan', 'img': 'https://images.cryptocompare.com/news/default/cryptopolitan.png', 'lang': 'EN'}",cryptopolitan,2025-11-29 20:00:00
