id,guid,published_on,imageurl,title,url,body,tags,lang,upvotes,downvotes,categories,source_info,source,date
54629182,https://timestabloid.com/?p=90120,1763595022,https://resources.cryptocompare.com/news/67/default.png,Is XRP Headed to $1.50? See What Just Happened,https://timestabloid.com/is-xrp-headed-to-1-50-see-what-just-happened/,"XRP continues to display signs of weakening momentum as sellers maintain pressure on the market. The asset has recorded a slight decline in the past 24 hours and is down by approximately 11% over the last week, reflecting the broader downturn across major cryptocurrencies. Despite this short-term weakness, XRP remains marginally profitable for investors who entered the market at the beginning of the year. The token has gained 2.58% on a year-to-date basis, positioning it alongside BNB and Tron as the only top-10 digital assets still showing positive returns in that period. Most other large-cap cryptocurrencies have surrendered earlier gains due to ongoing corrections. $XRP Lost the previous breakout level. Looks headed back to $1.50 area. pic.twitter.com/8VskyzrPXk — Nebraskangooner (@Nebraskangooner) November 17, 2025 Failed Breakout Raises Concern Market analyst Nebraskangooner has issued a cautious outlook for XRP, indicating that the token may be at risk of extending its downward movement. According to his assessment, XRP’s inability to confirm a breakout from a long-standing technical pattern is a key factor supporting a bearish scenario. He specifically referenced a descending triangle visible on the weekly chart, noting that XRP approached the upper boundary of the formation in late October but failed to secure upward continuation. The chart indicates that the triangle originated after XRP reached its yearly high of $3.66 in July. Subsequent trading activity kept the token within the confines of this formation until recent market conditions pushed it lower. Sellers eventually forced XRP below the triangle’s lower support zone near $2.20, marking a significant shift in structure. Based on this breakdown, Nebraskangooner projects that XRP could decline toward the $1.50 region. This level represents an estimated 30% slide from the current trading price of around $2.09 We are on X, follow us to connect with us :- @TimesTabloid1 — TimesTabloid (@TimesTabloid1) June 15, 2025 Shift in Long-Term Holder Sentiment In addition to technical weakness, changes in investor sentiment may intensify downward pressure. Data from Glassnode suggests that long-term holders have gradually moved away from the optimism observed earlier in the year. Their sentiment has transitioned from strong confidence to a more cautious stance as XRP continues to struggle with sustained upward momentum. This analysis relies on the net unrealized profit/loss (NUPL) metric for long-term holders, which evaluates whether these investors are predominantly sitting on gains or losses. The metric compares the market value of XRP to the realized value to determine the aggregate profitability of this group. Recent readings place long-term holders in the “anxiety” category. This state is characterized by modest unrealized gains but increasing uncertainty about future market direction. The shift toward anxiety implies that long-term participants are becoming more sensitive to price fluctuations. It also signals a greater likelihood of selling activity compared to earlier phases, when unrealized profits were larger and confidence was higher. This transition has appeared as XRP hovers near the $2 threshold, a level that carries psychological relevance for many traders. While the broader sentiment remains cautious, the coming weeks may provide clarity on whether XRP can stabilize above key support zones or whether the downward trend highlighted by analysts will persist. For now, technical indicators and sentiment signals continue to point toward the possibility of additional weakness unless buyers reclaim lost ground. Disclaimer : This content is meant to inform and should not be considered financial advice. The views expressed in this article may include the author’s personal opinions and do not represent Times Tabloid’s opinion. Readers are urged to do in-depth research before making any investment decisions. Any action taken by the reader is strictly at their own risk. Times Tabloid is not responsible for any financial losses. Follow us on Twitter , Facebook , Telegram , and Google News The post Is XRP Headed to $1.50? See What Just Happened appeared first on Times Tabloid .",Cryptocurrency|News|XRP|XRP Price|XRP Price Analysis|XRP Price Prediction,EN,0,0,BUSINESS|MARKET|TRADING|XRP|CRYPTOCURRENCY,"{'name': 'TimesTabloid', 'img': 'https://resources.cryptocompare.com/news/67/default.png', 'lang': 'EN'}",timestabloid,2025-11-19 23:30:22
54629269,https://cryptonews.com/?p=453959,1763595115,https://resources.cryptocompare.com/news/52/54629269.jpeg,DeFi Advocates Propose $30B Plan to Fight Global Poverty — Here’s the plan,https://cryptonews.com/news/defi-advocates-propose-30b-plan-to-fight-global-poverty/,"A growing coalition of decentralized finance advocates is pushing a new proposal they say could help ease the financial burdens faced by low-income households worldwide. The initiative, backed by the DeFi Education Fund (DEF) and several influential crypto policy groups, argues that decentralized financial tools could save people up to $30 billion a year in fees, money that is currently lost to what researchers describe as the “poverty premium.” NEW BLOG: Why is the cost of U.S. financial services for lower-income families continuing to rise despite technological advances? DEF's @jenn_rosenthal revisits a phrase coined in the early 2000s — ""the poverty premium"" — and explores the possibility of DeFi as a solution. pic.twitter.com/tScifp647x — DeFi Education Fund (@fund_defi) November 19, 2025 How Much Longer Can the Poor Afford an Expensive Financial System? The renewed push comes as global poverty levels remain stubbornly high. In 2025, an estimated 808 million people are living in extreme poverty on less than $3 a day, according to updated global estimates. Source: pip.worldbank.org Another 887 million are considered to be living in multidimensional poverty. Many of these households face overlapping pressures, including climate-related disasters, political instability, and rising economic fragility. The DeFi Education Fund says the financial system itself is part of the problem. In new research released this year, the group highlighted the long-standing cost gap between rich and poor households in the United States. Source: DEF Roughly 5.6 million U.S. households remain unbanked, and another 14.2% are underbanked, often forced to rely on costly financial alternatives. Cashing a paycheck can cost up to 5% of its value, and fees eat up an average of 7.1% of annual income for low-income families, compared with just 0.2% for wealthier households. These costs add up. DEF argues that removing intermediaries through decentralized financial rails could dramatically reduce basic expenses like remittances, money transfers, and bill payments. One estimate in the group’s proposal suggests DeFi infrastructure could cut global remittance costs by up to 80%, potentially saving the world’s unbanked populations $30 billion per year. Source: DEF The initiative lands at a moment when Americans appear increasingly open to alternatives. A DEF survey conducted with Ipsos found that 42% of Americans would likely try DeFi services if new legislation clarifying crypto privacy protections is passed. Many respondents expressed frustrations with banking delays, unexpected fees, and difficulty accessing their own funds. Across the sample, 56% of adults said they want full control of their money, and 54% said they want control over their financial data. As DeFi’s Real-World Role Grows, DEF Accelerates Washington Advocacy Alongside its economic arguments, the DeFi Education Fund (DEF) has expanded its policy efforts in Washington. In August, the organization launched the DeFi Education Foundation , a nonprofit designed to broaden its advocacy and deepen engagement with lawmakers. Around the same period, DEF and Andreessen Horowitz (a16z) urged the U.S. Securities and Exchange Commission to create a regulatory “safe harbor” for blockchain applications. The DeFi Education Fund and Andreeson Horowitz (a16z) are pushing the SEC to create a ""safe harbor"" for blockchain apps. #DeFi #a16z https://t.co/7OCIWRvUgk — Cryptonews.com (@cryptonews) August 13, 2025 They argued that neutral software interfaces should not be classified as brokers, warning that current interpretations risk forcing developers into unintended regulatory roles and discouraging innovation. DEF also submitted a formal response to the Senate Banking Committee’s draft Responsible Financial Innovation Act of 2025. In that filing, DEF and several major crypto firms, including Paradigm, Jump Crypto, Multicoin Capital, the Solana Policy Institute, and the Uniswap Foundation, called for clear regulatory separation between software builders and financial intermediaries. @fund_defi has called on the US Senate Banking Committee to take a more measured approach to DeFi regulation. #Regulation #DeFi https://t.co/9pZzvG6gkV — Cryptonews.com (@cryptonews) August 2, 2025 While debate over DeFi’s long-term value continues, advocates point to practical examples of how digital tools can expand access to financial services. Source: Poverty & Inequality Platform (PIP) In Nigeria and parts of East Africa, crypto-based networks allow users to transact with or without smartphones. In regions facing conflict or hyperinflation, including Venezuela, Zimbabwe, and Argentina, digital currencies have been used to move money and preserve savings. Some humanitarian groups have adopted blockchain systems to distribute aid with greater transparency. Still, researchers note that DeFi faces limits. Collateral-heavy lending models, volatile token markets, smart-contract vulnerabilities, and financial literacy barriers have slowed broader adoption. Much of today’s activity remains concentrated in speculative trading rather than real-world economic use. Even in El Salvador, where Bitcoin became legal tender in 2021 , daily usage has remained below expectations. DEF maintains that policymakers should protect the aspects of DeFi that directly reduce costs for consumers. The group argues that open access, low-cost settlement, and user control remain essential to reaching people living at the financial margins. The post DeFi Advocates Propose $30B Plan to Fight Global Poverty — Here’s the plan appeared first on Cryptonews .",Blockchain News|DeFi News|DeFi|defi technologies,EN,0,0,BLOCKCHAIN|BTC|REGULATION|TECHNOLOGY|CRYPTOCURRENCY,"{'name': 'cryptonews', 'img': 'https://images.cryptocompare.com/news/default/cryptonews.png', 'lang': 'EN'}",cryptonews,2025-11-19 23:31:55
54629568,23330434-480b-497a-bb77-56ff9fe06d1b,1763595835,https://resources.cryptocompare.com/news/5/54629568.jpeg,Stablecoin Spending Goes Mainstream With Opera MiniPay’s LatAm Integration,https://www.coindesk.com/business/2025/11/19/stablecoin-spending-goes-mainstream-with-opera-minipay-s-latam-integration,"The feature connects USDT balances to PIX and Mercado Pago, enabling users to pay with QR codes and converting to local currency instantly.",Finance|Opera|Stablecoins|News,EN,0,0,USDT|CRYPTOCURRENCY,"{'name': 'CoinDesk', 'img': 'https://resources.cryptocompare.com/news/5/default.png', 'lang': 'EN'}",coindesk,2025-11-19 23:43:55
54629791,https://en.coinotag.com/solana-etf-inflows-reach-26m-as-sol-price-rises-to-139,1763595915,https://resources.cryptocompare.com/news/77/default.png,Solana ETF Inflows Reach $26M as SOL Price Rises to $139,https://en.coinotag.com/solana-etf-inflows-reach-26m-as-sol-price-rises-to-139,"The spot Solana ETF in the U.S. saw $26.2 million in inflows on November 18, driven by major funds like Bitwise’s BSOL and Grayscale’s GSOL. This marks continued positive momentum since the ETF’s launch on October 31, boosting Solana’s integration into traditional finance. Solana ETF inflows reached $26.2 million on November 18, led by Bitwise’s",Bitcoin|News,EN,0,0,BTC|SOL|TRADING|CRYPTOCURRENCY,"{'name': 'CoinOtag', 'img': 'https://resources.cryptocompare.com/news/77/default.png', 'lang': 'EN'}",coinotag,2025-11-19 23:45:15
54629792,https://en.coinotag.com/potential-xrp-and-dogecoin-etfs-may-debut-this-week-analysts-suggest,1763595984,https://resources.cryptocompare.com/news/77/default.png,"Potential XRP and Dogecoin ETFs May Debut This Week, Analysts Suggest",https://en.coinotag.com/potential-xrp-and-dogecoin-etfs-may-debut-this-week-analysts-suggest,"New XRP and Dogecoin ETFs are poised to launch within the next three trading days, with Bitwise’s XRP ETF expected on Thursday and Grayscale and Franklin Templeton funds tracking XRP and Dogecoin on Monday, according to Bloomberg analyst James Seyffart. This follows recent Solana and XRP ETF debuts, signaling growing institutional interest in altcoin investment",News,EN,0,0,ALTCOIN|DOGE|SOL|XRP|CRYPTOCURRENCY,"{'name': 'CoinOtag', 'img': 'https://resources.cryptocompare.com/news/77/default.png', 'lang': 'EN'}",coinotag,2025-11-19 23:46:24
54630346,https://www.cryptopolitan.com/?p=864620,1763596284,https://resources.cryptocompare.com/news/43/54630346.jpeg,Senators grill crypto regulator Michael Selig in high-stakes bid to lead CFTC,https://www.cryptopolitan.com/selig-grilled-in-bid-to-lead-cftc/,"The senior crypto regulator Michael Selig, who is now chief counsel for the SEC’s Crypto Task Force, was also put under intense questioning by U.S. senators on Wednesday as he tried to advance to head the Commodity Futures Trading Commission. His hearing was a major moment for the future of digital-asset regulation in the United States. Selig testified before the Senate Agriculture Committee, the agency that supervises the CFTC. Lawmakers grilled him on his previous advisory work with digital-asset firms, his views on DeFi, his regulatory philosophy, and how he plans to stabilize an agency that has been operating with only one commissioner in place for months. His nomination arrived after President Donald Trump withdrew his first selection , Brian Quintenz. The committee is slated to vote on Selig’s nomination in the near future, and the discussion is expected to start on Thursday. The result could determine who will determine the next generation of crypto oversight in the U.S. Selig began by warning lawmakers that the country is at a turning point. He said markets all over the world are shifting rapidly, and the U.S. risks falling behind if regulators rely too heavily on enforcement rather than clear regulations. He argued aggressive actions would push firms overseas and weaken American competitiveness. He described the digital-asset market as a sector that has grown from a small curiosity to a nearly $4 trillion global economy. Senators pose questions to Selig about crypto oversight Committee Chairman John Boozman pressed Selig about how he would enforce rules in the spot digital-commodity market — something Congress is mulling over further inserting under the CFTC’s mandate. The senator cited Selig’s nomination as connected to pending negotiations over a major market-structure bill that would determine how digital assets are classified and what agency oversees them. Selig was asked multiple questions about how decentralized finance works. He said that while “DeFi” is often just a vague term, regulators need to understand how on-chain applications work. He explained that identifying when intermediaries are present and whether applications pose risks similar to traditional financial services requires recognizing them. Senator Amy Klobuchar, the committee’s leading Democrat, voiced concern about the prolonged leadership vacuum within the CFTC. She observed that for months now, the agency has been with only Acting Chair Caroline Pham serving as its single commissioner, even though it typically has five. Klobuchar said this instability has sparked confusion for businesses that rely heavily on steady regulatory oversight. The confusion at the agency, she said, has produced “more chaos for people who depend on the CFTC.” If Selig is confirmed, Pham is expected to resign, leaving the CFTC’s four commissioner seats empty unless the White House fills them up quickly. That would be a way Selig can direct an agency that was left unexpectedly fragile in this context. Selig said it needed more diversity of thought on its commission. He said he would cooperate with whichever commissioners the president nominates and argued that a greater diversity of perspectives bolsters regulatory decisions. What Selig’s nomination means for crypto regulation Selig’s appointment would be a pivotal moment for the digital assets industry, which has never been in a better position. His regulatory approach represents a shift toward one that is more conducive to innovation—and one that attaches greater emphasis to creating formal rules, engaging with the industry rather than relying heavily on enforcement actions. If he assumes such leadership, it would shape how crypto trading platforms function, how decentralized finance is understood and regulated, how U.S. exchanges compete in the global marketplace, and how the CFTC shares functions with the SEC. His viewpoint sharply contrasts with years of friction between crypto companies and American regulators, in part because critics say a perception of uncertainty and unpredictable enforcement has hindered their operations. But Selig’s possible tenure would not be an effort to start without difficulty. The CFTC remains vastly understaffed, and a commission bereft of several members can encounter political resistance and legal trouble when considering such significant regulatory decisions. Claim your free seat in an exclusive crypto trading community - limited to 1,000 members.",News|CFTC,EN,0,0,COMMODITY|MARKET|REGULATION|TRADING|CRYPTOCURRENCY,"{'name': 'Cryptopolitan', 'img': 'https://images.cryptocompare.com/news/default/cryptopolitan.png', 'lang': 'EN'}",cryptopolitan,2025-11-19 23:51:24
54630347,https://www.cryptopolitan.com/?p=864624,1763596372,https://resources.cryptocompare.com/news/43/54630347.jpeg,"AI music gets hot as Warner Music settles with Udio, Suno hits $2.45B valuation",https://www.cryptopolitan.com/warner-music-settles-with-udio-suno/,"Warner Music Group has settled a copyright lawsuit with AI firm Udio, while rival company Suno announced a $250 million funding round, which brought its valuation to $2.45 billion. The announcements, which came on the same day, show that major record labels and VCs are racing to capitalize on AI music technology after months of litigation, even as fundamental questions about copyright and fair use remain unresolved in the courts. Warner Music and Udio to launch a song creation platform Warner Music’s settlement with Udio makes it the second major label to resolve its dispute with the Massachusetts-based company in less than a month, following Universal Music Group’s October agreement. The companies plan to jointly launch a subscription service in 2026 that will use licensed music from Warner’s catalog to power AI-generated remixes, covers, and new songs featuring participating artists’ voices. “We’re unwaveringly committed to the protection of the rights of our artists and songwriters, and Udio has taken meaningful steps to ensure that the music on its service will be authorized and licensed,” said Robert Kyncl , Warner Music Group’s chief executive officer. The settlement also includes provisions for artist protection, as they can choose to opt in to participate and will receive credit and compensation. Sony Music Group remains the last major label still litigating against Udio. Suno’s valuation rises Suno’s latest funding round was led by Menlo Ventures and also saw participation from other investors, including Nvidia’s NVentures, Lightspeed, Hallwood Media, and Matrix. The raise values the company at $2.45 billion. The platform, which allows users to create full songs using text prompts and has become widely popular among first-time creators and professional producers alike, is also facing copyright litigation with Warner, Universal, and Sony Music. Suno’s co-founder and chief executive officer, Mikey Shulman, said the latest capital will be used to build more sophisticated tools and expand its platform as demand for generative audio continues to accelerate. He added that millions of users have produced music through Suno over the past two years. However, unlike Udio, Suno hasn’t settled or resolved the copyright battles it has with the world’s largest record labels, which allege that the company used protected recordings to train its model and risks flooding music platforms with AI-generated tracks that could “drown out” professional artists. From courtrooms to collaboration In 2024, when the major record labels first took Udio and Suno to court, they alleged that they used protected recordings to train their AI models without permission. The labels accused the companies of copying hundreds of songs from popular musicians to create systems that would “directly compete with, cheapen, and ultimately drown out” human artists. However, both AI startups claimed that they didn’t violate any US copyright law and characterized the lawsuits as attempts to stifle competition. Industry observers had predicted that major labels would seek equity stakes and licensing arrangements rather than pursue lengthy court battles, and that forecast seems to have largely materialized. Part of Universal Music’s settlement with Udio also involves them collaborating to launch a platform for generative AI music trained on authorized and licensed music. Warner Music also announced a separate partnership with Stability AI on Wednesday, November 19, to develop professional-grade AI tools for artists and producers using ethically trained models. Universal Music also struck a similar deal with Stability AI in October. Sharpen your strategy with mentorship + daily ideas - 30 days free access to our trading program",Tech|Suno|Udio,EN,0,0,BUSINESS|REGULATION|TECHNOLOGY|TRADING|CRYPTOCURRENCY,"{'name': 'Cryptopolitan', 'img': 'https://images.cryptocompare.com/news/default/cryptopolitan.png', 'lang': 'EN'}",cryptopolitan,2025-11-19 23:52:52
