id,guid,published_on,imageurl,title,url,body,tags,lang,upvotes,downvotes,categories,source_info,source,date
53977599,https://timestabloid.com/?p=88462,1762161466,https://resources.cryptocompare.com/news/67/default.png,Volume Bot Solana: Enhancing Liquidity Efficiency and Token Visibility,https://timestabloid.com/volume-bot-solana-enhancing-liquidity-efficiency-and-token-visibility/,"The Solana blockchain has established itself as one of the most advanced environments for decentralized trading. With its low fees and high transaction speed, it has become a magnet for developers launching new tokens and traders searching for early opportunities. However, in a space filled with constant competition, staying visible is not easy. That’s where the Volume Bot Solana comes in — an automated system that helps projects sustain activity, balance liquidity, and gain exposure across decentralized exchanges. For new tokens, maintaining consistent volume is often the difference between visibility and obscurity. The Volume Bot Solana provides a controlled way to keep markets active and data charts appealing to potential investors. What Is a Volume Bot Solana A Volume Bot Solana is an automated trading solution that continuously performs buy and sell transactions on decentralized exchanges such as Raydium, Meteora, and Jupiter. It uses randomized timing, varied trade sizes, and multiple wallets to create trading activity that resembles natural market movement. The main goal of a Volume Bot Solana is to maintain steady on-chain activity, which helps tokens appear on trending lists on analytics platforms like DexScreener and Birdeye. By keeping liquidity pools active, it enhances token visibility and supports healthier chart patterns that attract genuine traders. How a Volume Bot Solana Works When activated, the bot connects directly to Solana’s smart contracts and executes trades within designated liquidity pools. It can be configured to alternate between buys and sells, manage timing intervals, and adjust order amounts to create consistent yet unpredictable patterns. Many developers use control dashboards or Telegram interfaces to monitor and modify performance in real time. This allows for fine-tuning — keeping the activity natural while avoiding repetitive or detectable behavior. The Benefits of Using a Volume Bot Solana The Volume Bot Solana serves several important purposes for token teams and developers: Keeps liquidity stable by ensuring ongoing buy and sell activity Improves visibility on DEX analytics and trending boards Builds trader confidence through consistent chart performance Reduces slippage by maintaining depth in liquidity pools Creates a testing ground for evaluating price reactions and market behavior This combination of functionality and realism helps projects stand out during their early stages, when establishing market presence is most difficult. Risks and Responsible Usage While a Volume Bot Solana can significantly boost visibility, excessive or predictable trading can look unnatural and reduce credibility. Transparency and moderation are key to effective use. Developers should treat automation as a support mechanism, not a replacement for real trading and community interaction. A responsible approach focuses on sustainable growth — balancing automated trading with genuine participation, marketing, and utility. The Broader Role of Volume Bots in Solana DeFi The introduction of Volume Bots on Solana represents a growing shift toward algorithmic liquidity management. Instead of relying solely on external market makers, developers can use automation to maintain exposure and trading flow directly through smart contracts. This evolution highlights the importance of efficiency and decentralization in modern DeFi. Volume Bots allow projects to maintain a strong market presence while reducing the overhead and risks associated with centralized intervention. Conclusion A Volume Bot SOL is more than a tool for generating trades — it’s a system for maintaining market health, visibility, and engagement in a competitive DeFi ecosystem. By sustaining consistent and realistic activity, it helps projects stay on traders’ radar while supporting stable liquidity conditions. When implemented thoughtfully, a Volume Bot Solana can be the difference between a token that fades away and one that grows steadily through both automated and organic market participation. Disclaimer : This content is meant to inform and should not be considered financial advice. The views expressed in this article may include the author’s personal opinions and do not represent Times Tabloid’s opinion. Readers are advised to conduct thorough research before making any investment decisions. Any action taken by the reader is strictly at their own risk. Times Tabloid is not responsible for any financial losses. The post Volume Bot Solana: Enhancing Liquidity Efficiency and Token Visibility appeared first on Times Tabloid .",Finance,EN,0,0,MARKET|MINING|SOL|TRADING|CRYPTOCURRENCY,"{'name': 'TimesTabloid', 'img': 'https://resources.cryptocompare.com/news/67/default.png', 'lang': 'EN'}",timestabloid,2025-11-03 09:17:46
53977645,https://en.coinotag.com/balancer-may-face-70-million-defi-exploit-with-staked-ether-transfers/,1762161563,https://resources.cryptocompare.com/news/77/53977645.jpeg,Balancer May Face $70 Million DeFi Exploit with Staked Ether Transfers,https://en.coinotag.com/balancer-may-face-70-million-defi-exploit-with-staked-ether-transfers/,"Balancer, a leading DeFi protocol, appears to have faced a $70 million exploit involving staked Ether transfers to a new wallet, raising alarms about security in automated market makers. Onchain",Analysis|Ethereum|News|ETH|MKR|WETH,EN,0,0,BAL|ETH|MARKET|CRYPTOCURRENCY|SECURITY INCIDENTS,"{'name': 'CoinOtag', 'img': 'https://resources.cryptocompare.com/news/77/default.png', 'lang': 'EN'}",coinotag,2025-11-03 09:19:23
53977697,https://bitcoinworld.co.in/?p=214388,1762161610,https://resources.cryptocompare.com/news/82/53977697.jpeg,"Urgent: Bitcoin Price Drop Below $109,000 Shakes Market Confidence",https://bitcoinworld.co.in/bitcoin-price-drop-market-9/,"BitcoinWorld Urgent: Bitcoin Price Drop Below $109,000 Shakes Market Confidence The cryptocurrency market is buzzing with activity, and not always for the reasons investors hope. Recently, a significant Bitcoin price drop has captured headlines, sending ripples across the digital asset landscape. According to real-time market monitoring from Bitcoin World, BTC has dipped below the crucial $109,000 mark, with current trading figures on the Binance USDT market showing it at $108,990.47. This unexpected move has left many wondering about the immediate future of the world’s leading cryptocurrency. What Triggered This Bitcoin Price Drop? Understanding the forces behind a sudden market shift like this Bitcoin price drop is crucial for any investor. While no single factor is ever solely responsible, several elements often contribute to such movements. These can range from macroeconomic indicators to specific industry news. Market Sentiment: Investor confidence plays a massive role. Any negative news, whether about regulations, security breaches, or broader economic concerns, can quickly turn sentiment bearish. Whale Activity: Large sell-offs by significant holders (often called “whales”) can exert considerable downward pressure on prices, especially in less liquid markets. Technical Indicators: Breaking key support levels can trigger automated sell orders, accelerating a downward trend. The $109,000 level may have been a psychological or technical support point for many traders. Global Economic Factors: Broader economic concerns, such as inflation worries, interest rate hikes, or geopolitical tensions, often lead investors to de-risk, pulling capital from more volatile assets like cryptocurrencies. This latest dip serves as a reminder of the inherent volatility within the crypto space. It underscores the importance of staying informed and understanding the various influences that can impact asset values. How Does a Bitcoin Price Drop Impact the Broader Market? When Bitcoin, the market leader, experiences a significant shift, it rarely happens in isolation. The ripple effect of a Bitcoin price drop can be felt across the entire altcoin market. Many altcoins are often correlated with BTC’s performance, meaning they tend to follow its general trajectory. For instance, if Bitcoin sees a downturn: Altcoins often follow suit: Many digital assets are paired against BTC, so a drop in Bitcoin’s value can directly impact their price in USD terms. Investor confidence wanes: A bearish Bitcoin market can lead to a broader loss of confidence, causing investors to withdraw from other crypto assets as well. Liquidation events: Traders using leverage might face liquidations, further exacerbating selling pressure across the board. However, it’s also worth noting that some altcoins occasionally decouple from Bitcoin’s movement, especially those with strong fundamental news or unique developments. Still, for the most part, Bitcoin remains the bellwether for the entire cryptocurrency ecosystem. What Should Investors Do During a Bitcoin Price Drop? Periods of volatility, like the current Bitcoin price drop , can be unsettling. However, they also present opportunities for those who approach the market with a clear strategy. Here are some actionable insights: Stay Calm and Avoid Panic Selling: Emotional decisions often lead to losses. Take a step back and evaluate the situation rationally. Re-evaluate Your Portfolio: This is a good time to review your initial investment thesis. Are your assets still aligned with your long-term goals? Consider Dollar-Cost Averaging (DCA): If you believe in Bitcoin’s long-term potential, a dip can be an opportunity to buy more at a lower price, spreading your investment over time. Research and Learn: Use this time to deepen your understanding of market dynamics, technical analysis, and fundamental factors influencing crypto prices. Manage Risk: Never invest more than you can afford to lose. Set stop-loss orders if you’re actively trading. Remember, the crypto market is known for its cycles of boom and bust. Patience and a well-thought-out strategy are often key to navigating these fluctuations successfully. In conclusion, the recent Bitcoin price drop below $109,000 serves as a powerful reminder of the dynamic and often unpredictable nature of the cryptocurrency market. While such dips can be concerning, they are also a natural part of any evolving asset class. By understanding the potential triggers, observing the broader market impact, and adopting a disciplined investment approach, individuals can better navigate these volatile periods. Staying informed through reliable sources like Bitcoin World is paramount for making well-considered decisions in this exciting yet challenging space. Frequently Asked Questions (FAQs) 1. What does it mean when BTC falls below $109,000? When BTC falls below a significant price point like $109,000, it often indicates a breach of a key support level. This can trigger further selling pressure and signal a bearish trend to traders, impacting market sentiment. 2. Is a Bitcoin price drop a good time to buy? For long-term investors who believe in Bitcoin’s future, a price drop can present an opportunity to buy at a lower cost, a strategy known as “buying the dip” or dollar-cost averaging. However, it’s crucial to conduct your own research and assess your risk tolerance. 3. What factors usually cause Bitcoin’s price to drop? Several factors can contribute to a Bitcoin price drop, including negative market sentiment, large sell-offs by institutional investors or “whales,” regulatory concerns, macroeconomic uncertainties (like inflation or interest rate hikes), and technical breakdowns of key support levels. 4. How long do Bitcoin price drops typically last? The duration of a Bitcoin price drop can vary significantly. Some dips are short-lived corrections, while others can evolve into longer bear markets lasting weeks or months. It depends on the underlying causes and overall market conditions. 5. Should I panic sell my Bitcoin if the price drops? Panic selling is generally not recommended during a Bitcoin price drop. Emotional decisions often lead to losses. It’s advisable to stay calm, review your investment strategy, and consider your long-term goals before making any rash decisions. Consult with a financial advisor if unsure. Did you find this analysis helpful? Share this article with your network on social media to help others understand the recent Bitcoin price drop and navigate the volatile crypto market. Your insights can make a difference! To learn more about the latest explore our article on key developments shaping Bitcoin price action. This post Urgent: Bitcoin Price Drop Below $109,000 Shakes Market Confidence first appeared on BitcoinWorld .",Crypto News|BITCOIN|btc price|Crypto news|CRYPTOCURRENCY|Market Analysis,EN,0,0,BTC|BUSINESS|MARKET|TRADING|CRYPTOCURRENCY,"{'name': 'Bitcoin World', 'img': 'https://resources.cryptocompare.com/news/82/default.png', 'lang': 'EN'}",bitcoinworld,2025-11-03 09:20:10
53977905,https://www.cryptopolitan.com/?p=851576,1762161653,https://resources.cryptocompare.com/news/43/53977905.jpeg,AI official rejects notion of AI consciousness debate,https://www.cryptopolitan.com/top-official-ai-consciousness-wrong-question/,"The head of artificial intelligence at Microsoft is pushing back against efforts to create seemingly conscious machines, saying only living creatures can truly experience awareness. Mustafa Suleyman told CNBC during an interview at the AfroTech Conference in Houston this week that researchers should abandon work aimed at building AI systems that appear conscious. He called it the wrong approach entirely. “I don’t think that is work that people should be doing,” Suleyman said at the conference where he gave a keynote speech. “If you ask the wrong question, you end up with the wrong answer. I think it’s totally the wrong question.” As Microsoft’s leading figure in artificial intelligence, Suleyman has become a prominent critic of efforts to develop AI services that could make people believe the technology can suffer or feel emotions. Last year, he wrote “The Coming Wave,” a book examining dangers posed by AI and similar emerging technologies. In August, he published an essay arguing for building AI to help people rather than imitate them. Growing market for AI companions sparks debate This conversation unfolds amid a competitive race among tech companies to create AI companions, including offerings from Meta and Elon Musk’s xAI. The matter becomes increasingly intricate as the generative AI sector, spearheaded by Sam Altman’s OpenAI, pursues artificial general intelligence, systems capable of human-level cognitive performance. Altman said in August that artificial general intelligence isn’t a particularly helpful term anymore. He said models are simply improving rapidly, and people will depend on them for increasingly more tasks. For Suleyman, separating growing AI capabilities from any possibility of human feelings matters deeply. “Our physical experience of pain is something that makes us very sad and feel terrible, but the AI doesn’t feel sad when it experiences ‘pain,'” Suleyman explained . “It’s a very, very important distinction. It’s really just creating the perception, the seeming narrative of experience and of itself and of consciousness, but that is not what it’s actually experiencing. Technically you know that because we can see what the model is doing.” He pointed to biological naturalism, a theory from philosopher John Searle stating that consciousness requires a living brain’s biological processes. “The reason we give people rights today is because we don’t want to harm them, because they suffer. They have a pain network, and they have preferences which involve avoiding pain,” Suleyman said. “These models don’t have that. It’s just a simulation.” Suleyman acknowledged that studying consciousness remains a developing science. He didn’t call for blocking others from researching the topic, recognizing that different organizations have different goals. However, he stressed his strong opposition to the concept. “They’re not conscious,” he said. “So it would be absurd to pursue research that investigates that question, because they’re not and they can’t be.” Microsoft takes different path than competitors Suleyman is traveling to speak publicly about risks involved in pursuing AI consciousness. Before Houston, he appeared at the Paley International Council Summit in Silicon Valley last week. There, he announced Microsoft won’t create chatbots for sexual content, contrasting with competitors. As reported by Cryptopolitan , Altman revealed in October that ChatGPT now lets adult users have sexual conversations, while xAI offers a provocative anime companion. “You can basically buy those services from other companies, so we’re making decisions about what places that we won’t go,” Suleyman said again at AfroTech. Speaking at AfroTech, Suleyman said he chose Microsoft partly because of its history, stability, and wide technological reach. CEO Satya Nadella personally recruited him. “The other thing to say is that Microsoft needed to be self-sufficient in AI,” he said. Nadella started a mission 18 months ago to ensure the company could train its own models completely in-house using its own data. Sharpen your strategy with mentorship + daily ideas - 30 days free access to our trading program",Tech|Meta|Microsoft|OpenAI|xAI,EN,0,0,BUSINESS|EXCHANGE|MARKET|TECHNOLOGY|TRADING|RESEARCH|CRYPTOCURRENCY,"{'name': 'Cryptopolitan', 'img': 'https://images.cryptocompare.com/news/default/cryptopolitan.png', 'lang': 'EN'}",cryptopolitan,2025-11-03 09:20:53
53977701,https://en.coinotag.com/bitcoins-pnl-signal-echoes-past-cycles-hinting-at-possible-75-drop/,1762161670,https://resources.cryptocompare.com/news/77/53977701.jpeg,"Bitcoin’s PnL Signal Echoes Past Cycles, Hinting at Possible 75% Drop",https://en.coinotag.com/bitcoins-pnl-signal-echoes-past-cycles-hinting-at-possible-75-drop/,"The Bitcoin PnL Index signal indicates a potential major sell-off, mirroring patterns from 2013, 2017, and 2021 that led to 75-80% price drops. Currently trading near $110,000, Bitcoin shows profit-taking",Analysis|News|BTC|Core,EN,0,0,BTC|MARKET|TRADING|CRYPTOCURRENCY,"{'name': 'CoinOtag', 'img': 'https://resources.cryptocompare.com/news/77/default.png', 'lang': 'EN'}",coinotag,2025-11-03 09:21:10
53977795,https://bitcoinworld.co.in/?p=214411,1762161910,https://resources.cryptocompare.com/news/82/53977795.jpeg,Balancer BAL Investment Warning: Urgent Security Concerns Emerge,https://bitcoinworld.co.in/balancer-bal-investment-warning/,"BitcoinWorld Balancer BAL Investment Warning: Urgent Security Concerns Emerge A significant development has emerged from South Korea’s crypto landscape, as leading exchanges Bithumb and Coinone have issued a critical Balancer BAL investment warning . This move comes as a direct response to what they describe as ‘suspected security issues’ related to the Balancer protocol. For anyone involved in the decentralized finance (DeFi) space, this announcement signals a crucial moment to re-evaluate investment strategies and stay informed. What’s Behind the Balancer BAL Investment Warning? Both Bithumb and Coinone, prominent South Korean cryptocurrency exchanges, made independent announcements regarding Balancer (BAL). They specifically cited concerns about the protocol’s security. While the exact nature of these ‘suspected security issues’ has not been fully detailed by the exchanges, their decision to issue a public warning underscores the seriousness of their findings. Balancer is a decentralized automated market maker (AMM) protocol built on Ethereum, allowing users to create or add liquidity to customizable pools. Its native token, BAL, is used for governance. However, even well-established protocols can face vulnerabilities, and this Balancer BAL investment warning highlights the proactive stance exchanges are taking to protect their users. Understanding DeFi Risks: Why Are Exchanges Issuing Warnings? The DeFi ecosystem, while innovative, carries inherent risks, primarily due to its reliance on smart contracts. These contracts, if not meticulously audited and secured, can be susceptible to bugs, exploits, or even malicious attacks. History has shown numerous instances of DeFi protocols experiencing significant losses due to such vulnerabilities. Cryptocurrency exchanges like Bithumb and Coinone play a vital role in maintaining market integrity and user trust. When they identify potential threats, issuing an investment warning becomes a necessary step. This action serves to alert traders to potential dangers, preventing financial losses and safeguarding the broader crypto community. It reflects a commitment to user protection and responsible market oversight. What Does This Balancer BAL Warning Mean for Investors? For investors holding or considering Balancer (BAL) tokens, this warning carries significant implications. Firstly, it often leads to increased market volatility for the affected asset. Traders might react by selling their holdings, potentially causing a price drop. Secondly, it can erode investor confidence, impacting the token’s long-term perception and adoption. If you currently hold Balancer BAL tokens, it is crucial to remain calm but vigilant. Here are some actionable insights: Monitor Official Channels: Keep a close watch on announcements from Balancer’s official team and the exchanges (Bithumb, Coinone). Review Your Portfolio: Assess your exposure to BAL and consider your personal risk tolerance. Avoid Impulse Decisions: While warnings are serious, panic selling might not always be the best strategy without full information. Navigating the Volatile Crypto Landscape: Your Next Steps The crypto market is known for its dynamism and occasional turbulence. The Balancer BAL investment warning is a potent reminder that thorough due diligence is non-negotiable. Before investing in any cryptocurrency, especially in the DeFi sector, it is essential to: Conduct Thorough Research: Understand the project’s fundamentals, team, technology, and security audits. Diversify Your Investments: Spreading your capital across various assets can mitigate risks associated with any single protocol. Stay Informed: Regularly follow crypto news, security alerts, and regulatory developments. Ultimately, personal responsibility in investment decisions cannot be overstated. While exchanges provide valuable warnings, the final choice rests with the individual investor. The Balancer BAL investment warning from Bithumb and Coinone serves as an urgent reminder of the inherent risks within the fast-evolving decentralized finance space. It underscores the critical importance of robust security measures and the need for investors to exercise extreme caution and conduct their own thorough research. As the crypto market continues to mature, vigilance and informed decision-making will be your most valuable assets. Stay alert, stay informed, and always prioritize the security of your investments. Frequently Asked Questions (FAQs) What is Balancer (BAL)? Balancer (BAL) is the native governance token of the Balancer Protocol, a decentralized automated market maker (AMM) built on the Ethereum blockchain. It allows users to create and manage liquidity pools with custom weights and trading fees. Why did Bithumb and Coinone issue a warning for Balancer (BAL)? Both South Korean exchanges, Bithumb and Coinone, issued an investment warning for Balancer (BAL) due to ‘suspected security issues’ identified within the protocol. They have not disclosed specific details but deemed the concerns significant enough to alert investors. What should I do if I hold Balancer (BAL) tokens? If you hold BAL tokens, it is advised to monitor official announcements from the Balancer team and the issuing exchanges (Bithumb, Coinone). Review your portfolio’s risk exposure and avoid making impulsive decisions. Consider the information carefully before taking any action. Are all DeFi protocols risky? While DeFi offers innovative financial services, it inherently carries risks, primarily due to the complexity of smart contracts and their potential vulnerabilities. Not all protocols are equally risky, but investors should always conduct thorough due diligence and understand the specific risks associated with each project. How can I stay updated on the Balancer BAL situation? To stay updated, regularly check the official websites and social media channels of Balancer, Bithumb, and Coinone. Follow reputable cryptocurrency news sources and consider subscribing to their newsletters for timely alerts. Did you find this article helpful? Share this crucial information with your network on social media to help other investors stay informed and make wise decisions in the dynamic crypto market! To learn more about the latest crypto market trends, explore our article on key developments shaping DeFi security and investment strategies. This post Balancer BAL Investment Warning: Urgent Security Concerns Emerge first appeared on BitcoinWorld .",Crypto News|#Decentralized finance|Balancer BAL|BITHUMB|CoinOne|crypto warning,EN,0,0,BAL|BLOCKCHAIN|BUSINESS|MARKET|CRYPTOCURRENCY,"{'name': 'Bitcoin World', 'img': 'https://resources.cryptocompare.com/news/82/default.png', 'lang': 'EN'}",bitcoinworld,2025-11-03 09:25:10
