id,guid,published_on,imageurl,title,url,body,tags,lang,upvotes,downvotes,categories,source_info,source,date
55156754,https://www.cryptopolitan.com/?p=870010,1764518400,https://resources.cryptocompare.com/news/43/55156754.jpeg,The Next Big Altcoin Under $0.075? Investors Rush Into MUTM Ahead of the $0.06 Launch,https://www.cryptopolitan.com/the-next-big-altcoin-under-0-075-investors-rush-into-mutm-ahead-of-the-0-06-launch/,"More investors are now shifting their gaze to a new altcoin that trades at a rate much lower than $0.075 and the growth is accumulating at a rapid pace. As the official launch price will be $0.06, and the demand could be gaining momentum every other day, Mutuum Finance (MUTM) may become one of the most prominent competitors in the crypto sphere in Q4 2025. Most traders are convinced that this could be one of the last opportunities to enter, before the next great pricing level comes. Mutuum Finance Presale Development Mutuum Finance (MUTM) has demonstrated a good trend in the year 2025. The project was opened at a price of $0.01 in the beginning of this year and is already reaching the price of $0.035, which is 250% more in the offering cycle. The investor confidence has increased consistently pushing the presale into deep allocations. It has already raised $19M, and it has over 18,200 holders within its community. The total 4B MUTM supply consists of 1.82B tokens going to the presale. More than 800M tokens are already bought at the earlier stages. Phase 6 is already crowded and there is a little bit of supply left before the next crypto price change. The heightened popularity is nothing more than a trend: market participants are willing to have a first hand grasp at a new cryptocurrency that is characterized by sound development gains, open audits and substantial application. The urgency has also been developed through the launch price of $0.06, buyers are well aware that the present stage of entry is at $0.035, which could not last very long. What Mutuum Finance Is Forging Mutuum Finance is developing a lending and borrowing platform based on decentralization. The protocol assists in structured lending by way of collateralized borrowing, yield models and dynamic interest modeling. The system uses the use of the m tokens which is a yield bearing receipts. As users post assets they get mtTokens which gain value as borrowers pay interest. This bond yields to actual lending rather than token artificial inflation. The buy-and-distribute mechanism is one of the most powerful options of the platform. Part of protocol money is spent purchasing MUTM in the open market. The open market of MUTM is repurchased and issued to users staking the mtTokens to the safety module. This will provide steady purchasing influence and reinforce demand for the token in the long run. Security has also been prioritized. Mutuum Finance is under review by Halborn Security , has passed a CertiK audit with a score of 90/100 on the Token Scan, and the lending and borrowing agreements are going through a review. These audits allow splitting MUTM among a wide range of early-stage tokens which enter the market without being verified. Having solid fundamentals and application in the real world of DeFi, Mutuum Finance is rising to become a remarkable project among new altcoins, with prices lower than $0.075. Stablecoin Growth The lending ecosystem will also be boosted with Mutuum Finance creating its own stablecoin. The stable coin will be minted and burned when required and will be pegged to USD. Stablecoins are also critically important in the lending of DeFi due to the ability to borrow and to go into a deeper liquidity mindset or mode. Another such significant section of the platform is accurate pricing. To provide the accuracy of liquidation and safer borrowing, Mutuum Finance will incorporate Chainlink oracles, fallback oracles and on-chain data feeds support. Such systems will assist in maintaining the platform stable even when the market is volatile. Owing to the solid design and quick presale action of the project, some analysts are confident that MUTM may upsurge upon reaching its launch price of $0.06 with potential targets of between $0.25 and $0.35 based on the consumption by the platforms and the increase in users. Although predictions cannot be certain, the reasons are encouraging with regards to optimism of Mutuum Finance. V1 Launch and Increased Urgency As it is known, the V1 will launch on the Sepolia Testnet in Q4 2025 according to the official X account , which will mark a significant step that Mutuum Finance makes. This edition will consist of the liquidity pool, mtTokens, a debt-tracking token and the liquidation bot, so that soon users will have tools to act upon. In the meantime, Phase 6 is about to become fully allocated. And just a little percentage of tokens are still on the $0.035 mark and new whale entries, such as a purchase of over 100K, have put larger demands on it. The presence of whales at the end of an offering is usually an indication of great confidence and usually hastens with which the final supply is depleted. As the investors seek the most favorable cryptocurrency under $0.075, they are moving rapidly since upon the closure of the Phase 6, the token moves nearer to the launch value of $0.06. The early entry window is shrinking at a very high pace. Mutuum Finance could become one of the hottest new altcoins by Q4 2025. Between powerful DeFi dynamics, obvious audits, growing investments, a price that has grown by 250%, a nearly complete Phase 6 allotment and a forthcoming V1 discharge, the dynamic is gaining traction at a swift rate. For more information about Mutuum Finance (MUTM) visit the links below: Website: https://www.mutuum.com Linktree: https://linktr.ee/mutuumfinance",Press Release,EN,0,0,ALTCOIN|BUSINESS|MARKET|TRADING|CRYPTOCURRENCY,"{'name': 'Cryptopolitan', 'img': 'https://images.cryptocompare.com/news/default/cryptopolitan.png', 'lang': 'EN'}",cryptopolitan,2025-11-30 16:00:00
55156219,https://u.today/shiba-inu-exec-on-shib-bone-leash-darkest-periods-eventually-turn,1764518400,https://resources.cryptocompare.com/news/64/55156219.jpeg,"Shiba Inu Exec on SHIB, BONE, LEASH: 'Darkest Periods Eventually Turn'",https://u.today/shiba-inu-exec-on-shib-bone-leash-darkest-periods-eventually-turn,"A Shiba Inu team member has broken silence on the relative calm in the Shiba Inu ecosystem, making a prediction as to what comes next.",Shiba Inu (SHIB) News,EN,0,0,SHIB|CRYPTOCURRENCY,"{'name': 'U.Today', 'img': 'https://images.cryptocompare.com/news/default/utoday.png', 'lang': 'EN'}",utoday,2025-11-30 16:00:00
55156198,https://ambcrypto.com/?p=550148,1764518436,https://images.cryptocompare.com/news/default/ambcrypto.png,HyperLiquid team moves 2.6 mln HYPE – Panic buying or strategic play?,https://ambcrypto.com/hyperliquid-team-moves-2-6-mln-hype-panic-buying-or-strategic-play/,"HyperLiquid’s $89.2M HYPE unstake sparks debate, but whale accumulation hints at strategic liquidity management.",Altcoin|News|News 1|Social|Trading View,EN,0,0,ALTCOIN|CRYPTOCURRENCY,"{'name': 'AMB Crypto', 'img': 'https://images.cryptocompare.com/news/default/ambcrypto.png', 'lang': 'EN'}",ambcrypto,2025-11-30 16:00:36
55157534,https://en.coinotag.com/hyperliquids-hype-unstaking-may-signal-strategic-liquidity-shift-as-whales-accumulate,1764518599,https://resources.cryptocompare.com/news/77/55157534.jpeg,HyperLiquid’s HYPE Unstaking May Signal Strategic Liquidity Shift as Whales Accumulate,https://en.coinotag.com/hyperliquids-hype-unstaking-may-signal-strategic-liquidity-shift-as-whales-accumulate,"The HyperLiquid team recently unstaked 2.6 million HYPE tokens valued at $89.2 million, redistributing them across multiple wallets while retaining $37.4 million in staking and $30.9 million in reserves. This move enhances liquidity without fully exiting positions, signaling strategic management amid ongoing whale accumulation. HyperLiquid unstaking HYPE: Team unstakes $89.2M in tokens for redistribution, maintaining [...]",News,EN,0,0,CRYPTOCURRENCY,"{'name': 'CoinOtag', 'img': 'https://resources.cryptocompare.com/news/77/default.png', 'lang': 'EN'}",coinotag,2025-11-30 16:03:19
55156414,86a2b5c5-3236-497b-8370-5d43c984a246,1764518826,https://resources.cryptocompare.com/news/5/55156414.jpeg,Michael Saylor Sunday Change-Up Suggests New Announcement Coming Monday,https://www.coindesk.com/markets/2025/11/30/michael-saylor-sunday-change-up-suggests-new-announcement-coming-monday,The executive chairman of bitcoin treasury firm Strategy teased a switch from orange dots to green dots in what's become his routine cheeky Sunday X post.,Markets|MicroStrategy|Bitcoin News|News,EN,0,0,BTC|MARKET|DIGITAL ASSET TREASURY|MACROECONOMICS|CRYPTOCURRENCY,"{'name': 'CoinDesk', 'img': 'https://resources.cryptocompare.com/news/5/default.png', 'lang': 'EN'}",coindesk,2025-11-30 16:07:06
55156760,https://news.bitcoin.com/?p=768781&preview=true&preview_id=768781,1764519329,https://resources.cryptocompare.com/news/14/55156760.jpeg,"Bitget Launches “Affiliates Boost Month” With Fast-Track Approvals and Up to 5,000 USDT in Rewards",https://news.bitcoin.com/bitget-launches-affiliates-boost-month-with-fast-track-approvals-and-up-to-5000-usdt-in-rewards-2/,"This content is provided by a sponsor. Victoria, Seychelles, 25 November 2025—Bitget, the world’s leading Universal Exchange (UEX), is kicking off Affiliates Boost Month, a creator-first earnings season designed to help KOLs, community builders, and Web3 storytellers turn their influence into real, measurable income. Instead of Black Friday discounts, Bitget is introducing something more aligned",Branded Spotlight,EN,0,0,EXCHANGE|USDT|CRYPTOCURRENCY,"{'name': 'Bitcoin.com', 'img': 'https://images.cryptocompare.com/news/default/bitcoincom.png', 'lang': 'EN'}",bitcoin.com,2025-11-30 16:15:29
55156967,https://en.coinotag.com/breakingnews/ethereum-net-supply-rises-by-77380-eth-in-30-days-reaching-121253101-eth-total-with-0-777-annual-growth,1764519389,https://resources.cryptocompare.com/news/77/55156967.jpeg,"Ethereum Net Supply Rises by 77,380 ETH in 30 Days, Reaching 121,253,101 ETH Total with 0.777% Annual Growth",https://en.coinotag.com/breakingnews/ethereum-net-supply-rises-by-77380-eth-in-30-days-reaching-121253101-eth-total-with-0-777-annual-growth,"Ethereum Net Supply Rises by 77,380 ETH in 30 Days, Reaching 121,253,101 ETH Total with 0.777% Annual Growth",Breaking News,EN,0,0,ETH|CRYPTOCURRENCY,"{'name': 'CoinOtag', 'img': 'https://resources.cryptocompare.com/news/77/default.png', 'lang': 'EN'}",coinotag,2025-11-30 16:16:29
55157507,https://www.cryptopolitan.com/?p=870387,1764520032,https://resources.cryptocompare.com/news/43/55157507.jpeg,Public bitcoin miners gain as AI spending fuels momentum,https://www.cryptopolitan.com/public-bitcoin-miners-rally-ai-boosts-market/,"Last week, bitcoin mining companies saw positive numbers in the stock market. All of the ten biggest bitcoin mining companies were in the green zone, defying market expectations. After Bitcoin jumped over the $90,000 mark, mining companies felt the positive effects immediately. The crypto king was trading at $86k midweek and reached a top above $92k on Friday. BTC is up by 7.3% in the past seven days and is currently exchanging hands at $90.8k. Bitcoin mining stocks rise 5% Public bitcoin miners closed the week at a total market cap of $69.1 billion, up by 5.04% in 24 hours. Data collected from bitcoinminingstock.io shows that CleanSpark (ticker: CLK) and Bitfarms (ticker: BITF) gained 12.26% and 12.25% in a single day. Canaan (ticker: CAN) and Soluna Holdings (ticker: SLNH) were among the biggest gainers too, posting gains of 9.78% and 9.61% on the day. IREN Limited (ticker: IREN) ranks number one among other bitcoin mining companies in terms of market capitalization. The company had a strong year-over-year (y-o-y) revenue based on its released fiscal year report. IREN signed a $9.7 billion contract with Microsoft to power GPU-based AI cloud computing services at its Texas data centers. At the time of writing, IREN has a market cap of over $13 billion, but its stock dropped by 1.32%. It closed trading at $47.81. Cipher Mining (ticker: CIFR) ranks second with a market cap of more than $8 billion. CIFR went up by 6.26% in 24 hours and by 43.81% in five days. It closed trading at $20.35. Cipher inked a 10-year high-performance computing (HPC) deal with Fluidstack. The company will provide an additional 39 megawatts (MW) of critical IT load at its Barber Lake site in Texas by early 2027. The deal with Fluidstack was the main driver of CIFR in the past week. Applied Digital Corporation (ticker: APLD) ranks third with 8.66% daily gains and a 28.49% weekly jump. The company completed Phase II of its “Polaris Forge 1” AI-data-center campus in Ellendale, North Dakota. Applied Digital’s 100 megawatt (MW) building is now operational at full load. The APLD stock closed trading at $27.10. Market cap heatmap. Source: BitcoinMiningStock . TeraWulf jumped by 37.37% in one week TeraWulf (ticker: WULF) is in the fourth position with a market cap of over $6 billion. The company released its earnings for Q3 of 2025 and reported an 87% jump in year-over-year earnings of $50.6 million. TeraWulf earned $7.2 million from high-performance computing (HPC) leases. It ended the quarter strong with $712.8 million of cash, cash equivalents, and restricted cash. WULF rose by 4.51% on Friday and closed the week with a 37.37% jump. Riot Platforms (ticker: RIOT) has a market cap of $5.9 billion, placing it fifth by market cap. RIOT climbed by 7.67% in a day and finished the week with gains of 26.90%. At the end of October, Riot reported $180.2 million in Q3 revenue, with $104.5 million in net income. The company mined 437 bitcoins in October and currently holds 19,324 BTC. RIOT closed last week at $16.13. Core Scientific (ticker: CORZ) and Hut 8 (ticker: HUT) rank sixth and seventh by market cap. CORZ jumped 4.38% in 24 hours and 14.66% in five days. HUT, on the other hand, saw a positive 6.20% in one day and 31.04% in the whole week. Core Scientific disclosed the rejection of CoreWeave’s merger bid. Back in August, Hut 8 said it would work on four new U.S. sites to deliver 1,530 megawatts (MW). Those sites are located in Texas, Louisiana, and Illinois. The capacity at each site will vary from 50 megawatts (MW) for small sites up to 1,000 megawatts (MW) for major sites. CORZ closed the week at $16.89, while HUT finished trading at $45.0. Public bitcoin miners continue to expand because investors are valuing them for their HPC/AI opportunities. The focus isn’t on hashrate anymore but rather on their energy utilization. “The AI battle for dominance is a battle being had by the biggest and best capitalized companies in the world and they care like their lives depend on it that they win,” said Greg Beard, former CEO of Stronghold Digital Mining. If you're reading this, you’re already ahead. Stay there with our newsletter .",News|APLD|BITF|BTC|CIFR|CLK|CORZ|HUT|iren|Riot,EN,0,0,BTC|BUSINESS|MARKET|MINING|CRYPTOCURRENCY,"{'name': 'Cryptopolitan', 'img': 'https://images.cryptocompare.com/news/default/cryptopolitan.png', 'lang': 'EN'}",cryptopolitan,2025-11-30 16:27:12
55157330,https://u.today/shib-price-analysis-for-november-30,1764520140,https://resources.cryptocompare.com/news/64/55157330.jpeg,SHIB Price Analysis for November 30,https://u.today/shib-price-analysis-for-november-30,Can the price of SHIB return above $0.0000090 by the end of the week?.,Shiba Inu (SHIB) Price Prediction,EN,0,0,MARKET|SHIB|TRADING|CRYPTOCURRENCY,"{'name': 'U.Today', 'img': 'https://images.cryptocompare.com/news/default/utoday.png', 'lang': 'EN'}",utoday,2025-11-30 16:29:00
55157285,https://en.bitcoinsistemi.com/a-country-announces-a-300-million-cryptocurrency-investment-directly-from-its-foreign-exchange-reserves/,1764520148,https://resources.cryptocompare.com/news/81/55157285.jpeg,A Country Announces a $300 Million Cryptocurrency Investment Directly from Its Foreign Exchange Reserves,https://en.bitcoinsistemi.com/a-country-announces-a-300-million-cryptocurrency-investment-directly-from-its-foreign-exchange-reserves/,"The National Bank of Kazakhstan (NBK) is considering an investment in crypto assets that could range from $50 million to $300 million. According to RBC, NBK Chairman Timur Sülümenov said the institution would wait for “the dust to settle a bit” following the sharp market correction. Sülümenov stated that the investment would be financed directly from the Central Bank's foreign exchange reserves, not from the National Wealth Fund. In his statement, Sülümenov stated that the planned investment amount was not certain and used the following expressions: “This doesn't mean we've taken $300 million and are investing it right away. Maybe we'll limit it to 50 million, maybe 100 million, maybe 250 million. After the sharp decline in the entire crypto market, returns, monetization, and risks need to be reassessed.” The crypto market has lost $500 billion in total value since the beginning of November. Bitcoin's price has fallen 17%, from $110,000 to $81,000, its lowest point in seven months. Related News: Renowned Macroeconomist Issues “Final Warning” to Bitcoin Holders The NBK Chairman said that an investment portfolio linked to high-tech stocks and digital financial instruments has already been created within the Central Bank reserves, but there will be no rush to make new crypto investments: “After this decline in digital and crypto assets, we need to let the dust settle in the market. We will not make any hasty decisions.” In early November, Sülümenov told Bloomberg that the country would establish a national crypto fund of up to $1 billion. The fund would reportedly invest in more traditional, auditable structures like exchange-traded funds (ETFs) and shares of crypto companies. *This is not investment advice. Continue Reading: A Country Announces a $300 Million Cryptocurrency Investment Directly from Its Foreign Exchange Reserves",News,EN,0,0,EXCHANGE|FIAT|MARKET|MACROECONOMICS|CRYPTOCURRENCY,"{'name': 'BitcoinSistemi', 'img': 'https://resources.cryptocompare.com/news/81/default.png', 'lang': 'EN'}",bitcoinsistemi,2025-11-30 16:29:08
55157319,https://www.newsbtc.com/?p=860259,1764520227,https://resources.cryptocompare.com/news/21/55157319.jpeg,Monad Price To Crash 99%? BitMEX Co-Founder Calls Protocol Another Berachain,https://www.newsbtc.com/news/monad-price-to-crash-99-another-berachain/,"The Layer 1 blockchain Monad has grabbed the headlines in the past few days following its successful launch earlier last week. MON, its native token, enjoyed a significant 80% surge on the back of the launch, hitting an all-time high of 0.048 on Wednesday, November 26. While the Monad protocol has enjoyed significant attention since going live, it appears that not everyone is confident in its potential adoption. Most notably, BitMEX co-founder Arthur Hayes has put forward a pessimistic outlook for the project, saying its token value could fall as much as 99%. Monad Has No Real Use Case: Hayes In a YouTube interview with Altcoin Daily, Hayes stated that any other Layer 1 blockchain besides Ethereum and Solana is “zero” and is not going to do very well. Using Monad as an example, the former BitMEX CEO described the protocol’s coin as another “high FDV, low-float” token. Related Reading: Solana Braces For A Dual-Test Setup – Here’s What Could Happen Next Hayes said that Monad is going to be the new “Berachain” and expects its native token’s value to fall by 99% after the initial jump. Berachain, which launched in February 2025, has its native token BERA trading beneath $1, nearly 94% beneath its all-time high of $14.83. As of this writing, the Monad token is valued at around $0.0285, reflecting an over 40% decline since hitting its all-time high on Wednesday. Hayes highlighted that every new project’s token often enjoys an early price spike before facing a deep correction, as there is usually no real use case to back up the initial growth. The crypto founder noted that it is a classic case of FOMO (fear of missing out), especially after the massive success of Ethereum. Hayes said in the interview: Every coin gets their first pump and people want to believe in the new L1. Everybody wants to invest in the new Ethereum like they would have in 2014 when everyone missed it. Me included. But again, that doesn’t mean it [Monad] is going to actually have any real use case. Moving forward, Hayes went on to pick a “magnificent five” of protocols currently in the cryptocurrency space, including Bitcoin, Ethereum, Solana, ZCash, and Ethena. If Not Layer 1s, What Next? It is little surprise that ZCash made it to the BitMEX co-founder’s list of top blockchain protocols. According to Hayes, ZCash and other privacy-focused coins—like Monero—will dominate the crypto narrative even more in the coming year. Related Reading: Ethereum Fusaka Will Be ‘The Most Bullish Upgrade’ Ever, Pundit Claims Additionally, Hayes mentioned that Zero Knowledge (ZK) proofs and quantum resistance are other crypto narratives to watch out for in 2026. Specifically, the crypto founder noted that the next winner in the crypto market over the next one to two years would come from the ZK space. Featured image from iStock, chart from TradingView",Cryptocurrency Market News|Arthur Hayes|Berachain|MON|Monad|Monad price,EN,0,0,BLOCKCHAIN|ETH|SOL|TRADING|CRYPTOCURRENCY,"{'name': 'NewsBTC', 'img': 'https://images.cryptocompare.com/news/default/newsbtc.png', 'lang': 'EN'}",newsbtc,2025-11-30 16:30:27
55157318,https://news.bitcoin.com/?p=774256,1764520227,https://resources.cryptocompare.com/news/14/55157318.jpeg,Goldman Sachs Sees 20% Upside for Gold in 2026 as Silver Hits Its Latest Peak,https://news.bitcoin.com/goldman-sachs-sees-20-upside-for-gold-in-2026-as-silver-hits-its-latest-peak/,"While crypto assets have bounced back and mended the dents left between Nov. 12 and 25, gold and silver have quietly strutted into the spotlight, with silver even tagging a fresh all-time high over the past week. Analysts and banks are still eyeing higher ground for precious metals, and Goldman Sachs researcher Daan Struyven even",Markets and Prices|gold|Goldman Sachs|markets and prices|silver,EN,0,0,FIAT|CRYPTOCURRENCY,"{'name': 'Bitcoin.com', 'img': 'https://images.cryptocompare.com/news/default/bitcoincom.png', 'lang': 'EN'}",bitcoin.com,2025-11-30 16:30:27
55157335,636878,1764520235,https://resources.cryptocompare.com/news/13/55157335.jpeg,Bitcoin Price Approaching ‘Low-Risk’ Zone — Time To Buy?,https://bitcoinist.com/bitcoin-price-approaching-low-risk-zone-time-to-buy/,"The Bitcoin price has somewhat slowed down in its recovery since reclaiming the $91,000 level over the past week. According to the latest on-chain data, the flagship cryptocurrency seems to be entering a critical zone, which could see its price rebound with more momentum in the near future. On-Chain Data Suggests Bitcoin Price Could See Rebound Soon In a November 29 post on the social media platform X, crypto analyst Ali Martinez revealed that the Bitcoin price might be entering a “low-risk” zone. According to the market pundit, this low-risk area has often offered solid potential buying opportunities for investors. This evaluation revolves around the Sharpe Ratio, an on-chain indicator that assesses the risk-adjusted returns of a specific crypto asset (Bitcoin, in this case). This metric basically evaluates the amount of profit an investment offers per unit of risk (considering risk is measured by volatility). Typically, a rising Sharpe Ratio indicates a higher risk-adjusted performance, meaning the asset generates greater returns compared to the risk undertaken. On the other hand, when this metric is in a downward trend, it implies that the coin is in a “lower-risk zone” and the returns are becoming less significant. As shown in the chart above, the Bitcoin Sharpe Ratio has been on a sharp downturn , approaching the low-risk region (the green area). Within this area, the market leader tends to offer lower returns and is often less susceptible to unexpected volatility-driven price movements. Historically, the low-risk zone has been where long-term investors “buy the dip,” as they look to make less risky decisions in the market. Moreover, as observed in the highlighted chart, the Bitcoin price bottomed out (as seen in late 2022) when the Sharpe Ratio entered the low-risk zone. In essence, the Bitcoin price could be preparing for a market rebound as the Sharpe Ratio hovers around and below the zero threshold. Bitcoin Coinbase Premium Gap Flashes Green Again Another on-chain metric that adds further credence to the Bitcoin price rebound hypothesis is the Coinbase Premium Gap . This indicator measures the difference between the BTC price on the US-based Coinbase exchange (USD pair) and the global Binance exchange (USDT pair). When the Coinbase Premium Gap is positive, like it currently is, the metric implies that US-based investors are buying Bitcoin aggressively. Ultimately, this demand pressure from American investors could provide the buoy that the Bitcoin price currently needs. As of this writing, the price of BTC stands at around $90,940, reflecting a mere 0.4% jump in the past 24 hours.",Bitcoin|bitcoin|bitcoin news|bitcoin price|Bitcoin Sharpe Ratio|btc|btc price|BTCUSDT,EN,0,0,BTC|BUSINESS|EXCHANGE|TRADING|CRYPTOCURRENCY,"{'name': 'Bitcoinist', 'img': 'https://images.cryptocompare.com/news/default/bitcoinist.png', 'lang': 'EN'}",bitcoinist,2025-11-30 16:30:35
