id,guid,published_on,imageurl,title,url,body,tags,lang,upvotes,downvotes,categories,source_info,source,date
53429167,https://ambcrypto.com/?p=538602,1760997630,https://images.cryptocompare.com/news/default/ambcrypto.png,XRP holds steady as bearish pressure fades – A breakout to $2.8 ahead?,https://ambcrypto.com/xrp-holds-steady-as-bearish-pressure-fades-a-breakout-to-2-8-ahead/,Sellers are losing power too!,Altcoin|News|News 1|Ripple|Social|Trading View,EN,0,0,CRYPTOCURRENCY|TRADING|XRP|ALTCOIN,"{'name': 'AMB Crypto', 'img': 'https://images.cryptocompare.com/news/default/ambcrypto.png', 'lang': 'EN'}",ambcrypto,2025-10-20 22:00:30
53429235,https://cointelegraph.com/news/ethereum-paradigm-vcs-value-extraction-joseph-lubin?utm_source=rss_feed&utm_medium=rss&utm_campaign=rss_partner_inbound,1760997638,https://images.cryptocompare.com/news/default/cointelegraph.png,"Ethereum needs Paradigm, VCs, despite value extraction concerns: Joseph Lubin",https://cointelegraph.com/news/ethereum-paradigm-vcs-value-extraction-joseph-lubin?utm_source=rss_feed&utm_medium=rss&utm_campaign=rss_partner_inbound,"The main goal of VCs is to ""suck as much value as possible” from Ethereum, but they remain necessary bridges for global capital entering the crypto industry, according to Lubin.",,EN,0,0,CRYPTOCURRENCY|ETH,"{'name': 'Cointelegraph', 'img': 'https://images.cryptocompare.com/news/default/cointelegraph.png', 'lang': 'EN'}",cointelegraph,2025-10-20 22:00:38
53429165,https://en.bitcoinsistemi.com/?p=180706,1760997645,https://resources.cryptocompare.com/news/81/53429165.jpeg,MAGACOIN FINANCE Leads Early-Stage Presale Surge — Analysts Compare It to Ethereum’s 2017 Growth Wave,https://en.bitcoinsistemi.com/magacoin-finance-leads-early-stage-presale-surge-analysts-compare-it-to-ethereums-2017-growth-wave/,"The crypto market is once more creating a buzz as MAGACOIN FINANCE draws investor attention in its booming presale. Its upswing is being compared by market observers to that of Ethereum in 2017, which experienced a legendary period in terms of life-altering returns. As new capital comes into new blockchain projects, analysts say that MAGACOIN FINANCE is a reflection of initial Ethereum momentum, where community engagement has grown to spark one of the largest aspects of crypto growth. Should history repeat itself, MAGACOIN FINANCE may be the next project to mark a new age of blockchain use and a new investment opportunity. MAGACOIN FINANCE Presale Hits $17 Million MAGACOIN FINANCE has already passed the mark of $17 million total presale funds, which is among the fastest-growing token sales of 2025. The milestone marks rising investor confidence in an anxious recovery in digital asset markets. Early adopters attribute the verified audits of the project and growing social presence as significant drivers of the explosion. Most retail investors and strategic participants have participated in the presale according to on-chain data because they want to gain early exposure before it is listed on the exchange. Analysts observe that the multi-stage presale of MAGACOIN FINANCE with tiered pricing and allocation is similar to the disciplined fundraise model of early blue-chip protocols such as Ethereum and Avalanche. The roadmap of the project has a comprehensive ecosystem that combines the interoperability of metaverses and decentralized finance (DeFi). This long-term plan will make MAGACOIN FINANCE a pillar in the new generation of financial products run by blockchain. With the rising belief that MAGACOIN FINANCE might dominate the next altseason, the $17 million mark suggests a resurgence in market optimism to buy into the investment. MAGACOIN FINANCE Compares to Ethereum’s Bull Cycle Investment critics are making comparisons between the presale performance of MAGACOIN FINANCE and the 2017 breakout of Ethereum. The initial world of Ethereum was founded on programmable money and decentralized programs that transformed the use of blockchain. More so, MAGACOIN FINANCE embraces a utility-based design and concept that is scalable and integrates into the real world, as well as user involvement. In 2017, the demand for Ethereum tokens was mostly speculative. Nowadays, projects such as MAGACOIN FINANCE are constructed using institutional-grade compliance, are audited, and have sustainable economics. This progress marks the development of presales since the ICO hype, and more investors are now looking at long-term fundamentals instead of short-term hype. Analysts indicate that MAGACOIN FINANCE is on the verge of an upsurge as it presents a combination of decentralization and transparent economics with verifiable integrity. With a presale that has already exceeded expectations, MAGACOIN FINANCE has become one of the best cryptos to buy now as market liquidity shifts back to the emerging assets. Its initial popularity reflects the basis that helped Ethereum enter the mainstream. Ethereum Price Prediction: Elliott Wave Setup Targets $7,000–$8,000 Ethereum stays in the bullish predictions, as analysts signal an end to an Elliott Wave correction. Technical analysts said that ETH is in its fifth impulsive wave, which is usually the last and strongest rally wave, with end cost targets of between $7,000 and $8,000. Similarly, analyst Ted Pillows pointed out that the top altcoin is making a very important move towards the $4,100 mark. He said that breaking through this level would signal the end of the recent downtrend of Ethereum. ETHUSD Chart | Source: X Institutional involvement confirms this attitude. The amount of ETH held by BitMine Immersion Technologies exceeds 3 million, worth more than $12 billion, demonstrating that Ethereum is trusted by numerous people in the long-term prospects of the cryptocurrency. Tom Lee expects it to reach $10,000-$12,000 in late 2025, whereas Arthur Hayes believes it will go all the way up to $20,000 in a general rally. Provided that Fusaka upgrade by Ethereum is completed as scheduled in December, analysts think that market sentiment, especially throughput and scalability, will be further improved. This could establish an upward trend that will help propel the entire sector of altcoins, including new tokens such as MAGACOIN FINANCE. Conclusion With Ethereum preparing for a rally, the focus of investors has shifted to credible early-stage initiatives that can replicate that momentum. MAGACOIN FINANCE $17 million presale, strong community development, and proven transparency make it one of the best altcoins to buy in this market cycle. When Ethereum’s fifth wave happens as expected, the effect of this wave throughout the altcoin space could make MAGACOIN FINANCE the most successful coin in 2025. To learn more about MAGACOIN FINANCE, visit: Website: https://magacoinfinance.com Access: https://magacoinfinance.com/access Twitter/X: https://x.com/magacoinfinance Telegram: https://t.me/magacoinfinance Continue Reading: MAGACOIN FINANCE Leads Early-Stage Presale Surge — Analysts Compare It to Ethereum’s 2017 Growth Wave",News,EN,0,0,CRYPTOCURRENCY|ETH|TRADING|MARKET|BUSINESS,"{'name': 'BitcoinSistemi', 'img': 'https://resources.cryptocompare.com/news/81/default.png', 'lang': 'EN'}",bitcoinsistemi,2025-10-20 22:00:45
53429336,https://en.coinotag.com/openai-explores-steps-with-sag-aftra-and-major-agencies-to-curb-sora-deepfakes-and-enhance-identity-protections/,1760998085,https://resources.cryptocompare.com/news/77/53429336.jpeg,OpenAI Explores Steps With SAG-AFTRA and Major Agencies to Curb Sora Deepfakes and Enhance Identity Protections,https://en.coinotag.com/openai-explores-steps-with-sag-aftra-and-major-agencies-to-curb-sora-deepfakes-and-enhance-identity-protections/,"OpenAI Sora policy on deepfakes defines when and how AI-generated voices and likenesses may be used, prioritizing consent, takedown processes, and clear rights-management rules from the outset. Open policy framework",News,EN,0,0,OTHER,"{'name': 'CoinOtag', 'img': 'https://resources.cryptocompare.com/news/77/default.png', 'lang': 'EN'}",coinotag,2025-10-20 22:08:05
53429337,https://en.coinotag.com/xrp-signals-cautious-rebound-as-selling-pressure-weakens/,1760998099,https://resources.cryptocompare.com/news/77/default.png,XRP Signals Cautious Rebound as Selling Pressure Weakens,https://en.coinotag.com/xrp-signals-cautious-rebound-as-selling-pressure-weakens/,"XRP shows early signs of a rebound in late 2025, trading near $2.46 after forming a higher low amid weakening selling pressure and steady open interest. Bearish funding rates persist,",News|Ripple,EN,0,0,CRYPTOCURRENCY|XRP|TRADING,"{'name': 'CoinOtag', 'img': 'https://resources.cryptocompare.com/news/77/default.png', 'lang': 'EN'}",coinotag,2025-10-20 22:08:19
53429391,https://en.coinotag.com/ethereum-co-founder-lubin-views-vcs-as-vital-bridge-for-capital-inflow-amid-influence-concerns/,1760998207,https://resources.cryptocompare.com/news/77/53429391.jpeg,Ethereum Co-Founder Lubin Views VCs as Vital Bridge for Capital Inflow Amid Influence Concerns,https://en.coinotag.com/ethereum-co-founder-lubin-views-vcs-as-vital-bridge-for-capital-inflow-amid-influence-concerns/,"Joseph Lubin views venture capital as essential for Ethereum’s growth, acting as a bridge for global capital despite efforts to extract value from the ecosystem. He emphasizes the need for",News|ETH|FLOW,EN,0,0,CRYPTOCURRENCY|ETH|FLOW,"{'name': 'CoinOtag', 'img': 'https://resources.cryptocompare.com/news/77/default.png', 'lang': 'EN'}",coinotag,2025-10-20 22:10:07
53429554,https://en.coinotag.com/dogecoin-holds-uptrend-above-0-20-as-rsi-signals-potential-0-21-target-amid-etf-filings/,1760998514,https://resources.cryptocompare.com/news/77/53429554.jpeg,Dogecoin Holds Uptrend Above $0.20 as RSI Signals Potential $0.21 Target Amid ETF Filings,https://en.coinotag.com/dogecoin-holds-uptrend-above-0-20-as-rsi-signals-potential-0-21-target-amid-etf-filings/,"Dogecoin sustains its uptrend above $0.20 as an RSI breakout signals potential targets at $0.21, supported by increasing trading volume and institutional interest from ETF filings, indicating strong momentum in",Analysis|News|BTC|DOGE|FLOW,EN,0,0,CRYPTOCURRENCY|DOGE|BTC|FLOW|MARKET,"{'name': 'CoinOtag', 'img': 'https://resources.cryptocompare.com/news/77/default.png', 'lang': 'EN'}",coinotag,2025-10-20 22:15:14
53429683,https://cryptopotato.com/?p=1416890,1760998534,https://resources.cryptocompare.com/news/27/53429683.jpeg,This is the Critical Level to Watch for Bitcoin’s Price This Week,https://cryptopotato.com/this-is-the-critical-level-to-watch-for-bitcoins-price-this-next-week/,"Amidst recovery attempts, Bitcoin (BTC) has made a modest surge of 4% over the past 24 hours as it trades just around $111,000. Despite last week’s market volatility and the subsequent devastating losses, long-term holders are relaxed and profitable. The same cannot be said for short-term traders who are eyeing Bitcoin’s rebound above $113K to breathe again. Bitcoin’s Profit Divide Widens According to Alphractal founder Joao Wedson, Bitcoin’s current market mood is split between two distinct tribes. The calm veterans and the nervous newcomers. Long-Term Holders (LTHs) remain unfazed, their unrealized profits still comfortably in the green. They have seen it all before, and for them, the real concern does not even begin unless BTC slips below $37,000. That threshold remains comfortably distant from current levels. Short-Term Holders (STHs), on the other hand, are nursing losses and praying for a revival above the $113,200 mark. Ironically, that same level could become a battleground as a breakout would return many STHs to profit, but it could also trigger waves of profit-taking, thereby muting further upside momentum. Structurally, Bitcoin’s NUPL metric validates the idea of this divide. This is because long-term conviction remains intact, while the LTH/STH SOPR Ratio paints a picture of changing behavior. LTHs appear to be easing off their selling pressure and are letting the market breathe, while STHs are still clawing for short-term gains. This setup is reminiscent of late 2021, when fresh all-time highs were forged. The latest market condition suggests that while the old guard is coasting on earlier wins, the restless crowd still has something to prove. “LTHs have already locked in a good share of their profits – in March 2024, December 2024, and more recently, near the last ATH. Now, they’re relaxed, probably enjoying some time on a yacht with their families. Meanwhile, STHs are anxiously watching the charts, hoping for Bitcoin to break above $113K so they can finally smile again.” Impact of Easing US-China Tensions Now that Bitcoin has successfully reclaimed the key $109,000-$110,000 support zone, a level that had previously acted as a crucial pivot in recent market structure, crypto analyst Ted Pillows believes that the next major hurdle lies at $112,000, a breakout above which could open the path for renewed bullish momentum. Pillows believes that the current macro backdrop adds further tailwinds to BTC’s potential upside, especially as US–China trade tensions appear to be easing. The reduction in geopolitical strain could boost investor confidence across risk assets, including crypto, by softening the global risk-off sentiment that had previously dampened speculative appetite. The post This is the Critical Level to Watch for Bitcoin’s Price This Week appeared first on CryptoPotato .",AA News|Crypto News|Bitcoin (BTC) Price,EN,0,0,CRYPTOCURRENCY|BTC|TRADING|MARKET|BUSINESS,"{'name': 'Crypto Potato', 'img': 'https://images.cryptocompare.com/news/default/cryptopotato.png', 'lang': 'EN'}",cryptopotato,2025-10-20 22:15:34
53429573,https://news.bitcoin.com/?p=764774,1760998536,https://resources.cryptocompare.com/news/14/53429573.jpeg,"Bitmine Acquires Over 203,000 ETH, Now Holds 2.7% of ETH Supply",https://news.bitcoin.com/bitmine-acquires-over-203000-eth-now-holds-2-7-of-eth-supply/,"The acquisition of 203,000 ETH by Bitmine Immersion in the past week has grown its total holdings to $13.4 billion, securing 2.7% of ether’s total supply. Bitmine Crosses $13.4 Billion in Crypto and Cash Holdings Bitmine Immersion Technologies (NYSE: BMNR) has revealed a new purchase of 203,826 ETH over the past week. This latest buy",Crypto News|Altcoin Treasuries|Ethereum (ETH),EN,0,0,CRYPTOCURRENCY|ETH,"{'name': 'Bitcoin.com', 'img': 'https://images.cryptocompare.com/news/default/bitcoincom.png', 'lang': 'EN'}",bitcoin.com,2025-10-20 22:15:36
53429825,https://en.coinotag.com/xs-handles-marketplace-may-value-rare-usernames-up-to-1m-aligning-with-ethereum-web3-identity-trends/,1760999121,https://resources.cryptocompare.com/news/77/53429825.jpeg,"X’s Handles Marketplace May Value Rare Usernames Up to $1M, Aligning with Ethereum Web3 Identity Trends",https://en.coinotag.com/xs-handles-marketplace-may-value-rare-usernames-up-to-1m-aligning-with-ethereum-web3-identity-trends/,"X’s new Handles Marketplace allows Premium users to bid on inactive usernames, potentially valuing rare handles at up to $1 million, blending social media branding with Web3-inspired digital identity ownership.",Analysis|Blockchain|News|ENS|ETH|MATIC,EN,0,0,CRYPTOCURRENCY|ETH|BLOCKCHAIN|ENS|MARKET,"{'name': 'CoinOtag', 'img': 'https://resources.cryptocompare.com/news/77/default.png', 'lang': 'EN'}",coinotag,2025-10-20 22:25:21
53429935,https://en.coin-turk.com/?p=204835,1760999362,https://resources.cryptocompare.com/news/79/53429935.jpeg,"Explore Cryptocurrency Trends: Analyzing BTC, ADA, and SOL Coin Charts",https://en.coin-turk.com/explore-cryptocurrency-trends-analyzing-btc-ada-and-sol-coin-charts/,"BTC struggles to hold the critical $110,500 support level. Poppe predicts a bull market, citing valuable market cycle insights. Continue Reading: Explore Cryptocurrency Trends: Analyzing BTC, ADA, and SOL Coin Charts The post Explore Cryptocurrency Trends: Analyzing BTC, ADA, and SOL Coin Charts appeared first on COINTURK NEWS .",Technical Analysis,EN,0,0,CRYPTOCURRENCY|BTC|ADA|SOL|MARKET,"{'name': 'CoinTurk News', 'img': 'https://resources.cryptocompare.com/news/79/default.png', 'lang': 'EN'}",cointurken,2025-10-20 22:29:22
53429955,609817,1760999410,https://resources.cryptocompare.com/news/13/53429955.jpeg,Bitcoin Short-Term Holders Capitulate: Realized Loss Ratio Hits 6-Month Low,https://bitcoinist.com/bitcoin-short-term-holders-capitulate-realized-loss/,"Bitcoin is showing signs of recovery after several days marked by selling pressure, volatility, and fear across the crypto market. Following the sharp flash crash on October 10, when BTC briefly plunged to around $103,000, the price has since rebounded and is now testing supply near the $111,000 level. This move has brought a temporary sense of relief to traders, but on-chain data suggests that the market is still under stress. According to CryptoQuant, Short-Term Holders (STHs) — investors who typically hold Bitcoin for less than 155 days — are now selling below their cost basis, a clear sign of capitulation. Historically, such capitulation events have often marked late stages of a correction, as weak hands exit the market while stronger players accumulate. While this could signal that Bitcoin is nearing a local bottom, uncertainty remains high. The coming days will determine whether this rebound has the strength to sustain — or if the market will face renewed downside pressure as global risk sentiment remains fragile. Short-Term Holders Signal Capitulation According to CryptoQuant analyst Maartunn, the Short-Term Holder (STH) Spent Output Profit Ratio (SOPR) has dropped to 0.98, marking its lowest level since April 2025. This reading supports the trend that STHs are now selling at a loss, a sign of capitulation within the most reactive segment of the market. Historically, such declines in STH SOPR have aligned with late-stage corrections or market bottoms, as weaker hands are flushed out and coins transfer to stronger holders. During similar phases in 2023, 2024, and early 2025, this metric has acted as a contrarian signal, often preceding major rebounds. However, Maartunn cautions that while capitulation is unfolding, confirmation of a recovery still depends on whether Bitcoin can hold above its realized price levels and key moving averages. The market now finds itself at a critical juncture. Bitcoin has rebounded from the $103,000 flash crash low to hover around $111,000, but momentum remains fragile. A sustained close above the $111,500–$113,000 zone could reinforce short-term bullish structure, while failure to hold current support may open the door to deeper corrections toward $100,000 or below. If the SOPR stabilizes and begins to rise again, it could confirm a shift from capitulation to re-accumulation — the early stage of a new upward trend. But if selling pressure persists and sentiment weakens further, the market risks entering a prolonged consolidation phase before the next bullish leg begins. For now, Bitcoin remains on edge, caught between recovery hopes and macro-driven uncertainty. Bitcoin Attempts Short-Term Recovery, But Resistance Looms Ahead Bitcoin is showing early signs of a short-term rebound, recovering from the October 10 crash that sent prices below $104,000. On the 4-hour chart, BTC is currently trading near $111,200, attempting to reclaim short-term moving averages (50 and 100 SMA) after several days of bearish momentum. This bounce reflects a shift in intraday sentiment, but the market remains cautious. The next key resistance lies around $113,000–$114,000, where the 200 SMA aligns with previous support turned resistance. A breakout above this zone could open the door to a test of $117,500, a major liquidity area that capped rallies earlier this month. However, if Bitcoin fails to clear this level, it risks falling back toward $107,000–$106,000, where strong demand previously emerged. Momentum indicators are improving but not yet convincing. Volume remains subdued, and funding rates continue to hover in negative territory — suggesting traders still lean bearish. This setup often precedes larger short squeezes, but confirmation is still lacking. Bitcoin’s short-term structure favors cautious optimism. Holding above $110,000 would support the recovery narrative, while rejection at higher levels could quickly trigger another retest of the recent lows. The next few sessions will be decisive for confirming trend direction. Featured image from ChatGPT, chart from TradingView.com",Bitcoin News|bitcoin|Bitcoin analysis|bitcoin news|bitcoin price|Bitcoin Realized Losses|Bitcoin Short-Term Holder|Bitcoin STH|btc|BTCUSDT,EN,0,0,CRYPTOCURRENCY|BTC|MARKET|TRADING|BUSINESS,"{'name': 'Bitcoinist', 'img': 'https://images.cryptocompare.com/news/default/bitcoinist.png', 'lang': 'EN'}",bitcoinist,2025-10-20 22:30:10
53430432,https://news.bitcoin.com/?p=764674,1761000324,https://resources.cryptocompare.com/news/14/53430432.jpeg,Jack Dorsey Doubles Down on Satoshi’s Original Vision: Bitcoin Is Money,https://news.bitcoin.com/jack-dorsey-doubles-down-on-satoshis-original-vision-bitcoin-is-money/,"Block founder Jack Dorsey has recently highlighted the relevance of bitcoin as a transactional element, allowing peer-to-peer settlements between two parties away from centralized organizations. “ Bitcoin is money,” he stressed, commenting on Square’s zero-fee processing for BTC payments. Jack Dorsey Pushes Satoshi’s Original Medium of Exchange Thesis: ‘ Bitcoin Is Money’ The Facts: Jack",Crypto News|adoption|Bitcoin (BTC),EN,0,0,BTC|CRYPTOCURRENCY|EXCHANGE,"{'name': 'Bitcoin.com', 'img': 'https://images.cryptocompare.com/news/default/bitcoincom.png', 'lang': 'EN'}",bitcoin.com,2025-10-20 22:45:24
53430790,https://ambcrypto.com/?p=538665,1761001228,https://images.cryptocompare.com/news/default/ambcrypto.png,Bitcoin faces a high-stakes November – CPI shock collides with FOMC,https://ambcrypto.com/bitcoin-faces-a-high-stakes-november-cpi-shock-collides-with-fomc/,BTC faces a high-stake setup ahead of the FOMC.,Bitcoin|BTC Trading View|News|News 1|Social|Trading View,EN,0,0,MACROECONOMICS|BTC|CRYPTOCURRENCY,"{'name': 'AMB Crypto', 'img': 'https://images.cryptocompare.com/news/default/ambcrypto.png', 'lang': 'EN'}",ambcrypto,2025-10-20 23:00:28
