id,guid,published_on,imageurl,title,url,body,tags,lang,upvotes,downvotes,categories,source_info,source,date
53956420,https://en.bitcoinsistemi.com/according-to-binance-data-6-altcoins-showing-bullish-signals-and-4-altcoins-showing-bearish-signals-have-been-identified/,1762115472,https://resources.cryptocompare.com/news/81/53956420.jpeg,"According to Binance Data, 6 Altcoins Showing Bullish Signals and 4 Altcoins Showing Bearish Signals Have Been Identified",https://en.bitcoinsistemi.com/according-to-binance-data-6-altcoins-showing-bullish-signals-and-4-altcoins-showing-bearish-signals-have-been-identified/,"Cryptocurrency analysis firm CryptoQuant has published a new analysis examining the entry and exit movements of altcoins on the Binance exchange. The company stated that data showed that investors in some altcoins are exiting exchanges, while in others, selling pressure is increasing by depositing tokens into the exchange. According to the analysis, the altcoins with the most outflows on Binance were Axie Infinity (AXS), Chainlink (LINK), Fetch.ai (FET), Aavegotchi (GHST), Amp (AMP) and Synthetix (SNX). In contrast, the assets experiencing the most inflows were recorded as Mines of Dalarnia (DAR), Polygon (MATIC), Bitcoin (BTC), JasmyCoin (JASMY), and Chiliz (CHZ). Related News: Watch Out: New Week Brings Massive Token Unlocks for 8 Altcoins - Here's the Day-by-Day, Hour-by-Hour List CryptoQuant noted that token outflows from exchanges typically indicate investors are moving their assets to cold storage or reducing selling pressure. This, combined with a reduced circulating supply, could potentially have a positive impact on prices. On the other hand, high inflows into stock markets could indicate that investors are moving their assets to stock exchanges in preparation for selling. This is a signal that could put downward pressure on prices in the short term. *This is not investment advice. Continue Reading: According to Binance Data, 6 Altcoins Showing Bullish Signals and 4 Altcoins Showing Bearish Signals Have Been Identified",Altcoin|News,EN,0,0,ALTCOIN|EXCHANGE|TRADING|BNB|CRYPTOCURRENCY,"{'name': 'BitcoinSistemi', 'img': 'https://resources.cryptocompare.com/news/81/default.png', 'lang': 'EN'}",bitcoinsistemi,2025-11-02 20:31:12
53956510,https://coinpaper.com/12062/fed-pumps-29-4-billion-into-markets-overnight,1762115643,https://resources.cryptocompare.com/news/93/default.png,Fed Pumps $29.4 Billion into Markets Overnight,https://coinpaper.com/12062/fed-pumps-29-4-billion-into-markets-overnight,"The Federal Reserve (Fed) has injected $50.35 billion into the system via its Standing Repo Facility on Friday. This move comes amidst significant month-end collateral needs. The incident raises concerns about liquidity conditions. The Fed still insists that market conditions remain robust with ”ample reserves.” The Surge in Repo Activity The $50.35 billion infusion marks a historical high for the Standing Repo Facility.The reverse repo facility simultaneously took in $51.8 billion. This indicates that the Fed's intervention was not isolated. This coordinated effort is aimed at addressing short-term liquidity needs that occur at the end of each month. This is generally when financial institutions face heightened collateral requirements. The Standing Repo Facility, designed to provide overnight loans to primary dealers in exchange for Treasury securities, acts as a crucial tool in managing short-term liquidity shortages. Analysts Warn of Looming Liquidity Crisis Despite the Fed's stance that these operations are part of routine market management, analysts are beginning to question whether these measures are indicative of deeper liquidity issues. One key analyst suggests that these maneuvers are not just minor adjustments but could signal an emerging liquidity crisis that the central bank is working to contain before it becomes more widespread. The analyst's commentary highlights an important pattern. He pointsout stress building up in the system. This was also evident during the 2019 repo crisis. when the Fed intervened in similar fashion to plug the gaps before the pressures spread further across the financial system. The analyst believes the Fed stepping in s o aggressively, even while facing record deficits and elevated interest rates, signals a tightening of conditions beneath the surface. Fast forward to today, and the current repo injections, though presented as part of ”ample reserves,” are drawing attention to possible cracks in the system. This is especially with the backdrop of rising deficits and an overall tightening of monetary policy. The chart of overnight repurchase agreements (repo) clearly illustrates this pattern of sudden spikes. Although often downplayed at first, the spikes eventually led to broader market repercussions. FED Repurchase Agreements | Source: Fred The intervention on Friday is not an isolated incident but a continuation of the Fed's ongoing efforts to manage short-term liquidity. This is while navigating an increasingly fragile economic environment. Comparing Repo Activity to Fed Funds Rate Looking at a long-term comparison of the Powell’s Fed funds rate versus the S&P 500 index, we see that the drastic swings in the Fed Funds Rate, especially during times of economic crisis or market stress, correlate strongly with downturns in the S&P 500 index. The period following the 2008 financial crisis, the 2020 pandemic-induced recession, and the current inflationary environment, all show how aggressive Fed policy can affect broader market performance. FUND Rata/S&P 500 | Source: X What stands out from the chart is the inverse relationship between the Fed's rate hikes and the performance of the S&P 500, which has been struggling against Bitcoin over the years. Historically, when the Fed raises rates or injects large amounts of liquidity into the system, it often signals economic stress. In some cases, such as during the 1974 and 1981-82 bear markets, aggressive rate hikes and liquidity injections preceded major market downturns. The same could be said for the current environment, where the rising repo activity may be a precursor to further market volatility.",News|Crypto,EN,0,0,BTC|FIAT|MARKET|MACROECONOMICS|CRYPTOCURRENCY,"{'name': 'Coinpaper', 'img': 'https://resources.cryptocompare.com/news/93/default.png', 'lang': 'EN'}",coinpaper,2025-11-02 20:34:03
53956728,https://zycrypto.com/?p=112226,1762115910,https://images.cryptocompare.com/news/default/zycrypto.png,x402 is Coming to Cardano and Charles Hoskinson Believes it’s a Big Deal for the Network,https://zycrypto.com/x402-is-coming-to-cardano-and-charles-hoskinson-believes-its-a-big-deal-for-the-network/,"Cardano’s co-founder, Charles Hoskinson, has described the upcoming integration of x402 as “very big for Cardano,” marking one of the network’s most promising technological shifts in years.",Cryptocurrency|News|ADA|ADAUSD|Cardano|Charles Hoskinson|Cryptocurrency News,EN,0,0,ADA|CRYPTOCURRENCY,"{'name': 'ZyCrypto', 'img': 'https://images.cryptocompare.com/news/default/zycrypto.png', 'lang': 'EN'}",zycrypto,2025-11-02 20:38:30
53956773,https://en.bitcoinsistemi.com/cz-provided-more-details-about-the-altcoin-he-purchased-today-i-wanted-to-buy-more-at-a-lower-price/,1762116187,https://resources.cryptocompare.com/news/81/53956773.jpeg,CZ Provided More Details About the Altcoin He Purchased Today: “I Wanted to Buy More at a Lower Price”,https://en.bitcoinsistemi.com/cz-provided-more-details-about-the-altcoin-he-purchased-today-i-wanted-to-buy-more-at-a-lower-price/,"Changpeng Zhao (CZ), founder of the cryptocurrency exchange Binance, announced in his post on the X platform today that he purchased the Aster (ASTER) token with his personal funds. CZ had stated, “I bought some ASTER on Binance today with my own money. I'm not a trader; I bought it and I'll hold it.” Following CZ's post, the price of ASTER quickly surged significantly. Social media users noted that the token's price had skyrocketed following the news, with CZ responding, “I actually wanted to buy more when the price was low.” Related News: Creditors Respond to Claims That “FTX Didn't Actually Go Bankrupt” CZ revealed that he holds 2,090,598.14 ASTER tokens in his account, and that the purchase was made at an average price of $0.913. However, when asked whether he actually purchased ASTER at an average price of around $0.90, he replied, “I'm not entirely sure.” The Binance founder also stated that he purchased BNB early on and that he didn't sell anything except for personal expenses. CZ's statement was interpreted as him also purchasing ASTER tokens for long-term holding. *This is not investment advice. Continue Reading: CZ Provided More Details About the Altcoin He Purchased Today: “I Wanted to Buy More at a Lower Price”",Altcoin|News,EN,0,0,ALTCOIN|EXCHANGE|TRADING|BNB|CRYPTOCURRENCY,"{'name': 'BitcoinSistemi', 'img': 'https://resources.cryptocompare.com/news/81/default.png', 'lang': 'EN'}",bitcoinsistemi,2025-11-02 20:43:07
53957132,https://en.bitcoinsistemi.com/attention-lots-of-economic-developments-and-altcoin-events-in-the-new-week-heres-the-day-by-day-hour-by-hour-list/,1762116970,https://resources.cryptocompare.com/news/81/53957132.jpeg,"Attention: Lots of Economic Developments and Altcoin Events in the New Week – Here’s the Day-by-Day, Hour-by-Hour List",https://en.bitcoinsistemi.com/attention-lots-of-economic-developments-and-altcoin-events-in-the-new-week-heres-the-day-by-day-hour-by-hour-list/,"The cryptocurrency market has had a big week, which included the Fed's interest rate decision and US President Donald Trump's discussions with China on tariffs. In the shadow of these developments, Bitcoin's price has lost approximately 3% of its value in the last week. Altcoins, on the other hand, suffered even deeper losses. However, numerous altcoin events and economic developments are expected this week. Here's the cryptocurrency calendar we've prepared for you at Bitcoinsistemi.com. Monday, November 3rd VIRTUAL – There will be a Q&A with Tom Lee. KITE – Will be listed by Binance. ZKP – Deadline for staking Kaito tokens. MON – Deadline to request the MON airdrop. UXLINK – Will be delisted by Upbit. Hong Kong Fintech week begins. Related News: List of the 15 Most Searched Altcoins in Recent Hours Has Been Revealed Tuesday, November 4th The XRP – Ripple Swell event will be held. LINK – Smartcon 2025 event will be held. FTT – FTX founder Sam Bankman-Fried's appeal hearing will take place. ETHFI – Voting on the 50 million token buyback proposal is ending. Wednesday, November 5th ZEC – One year anniversary of ZEC's second halving. LINEA – LINEA Exponent is starting. The Blockchain Futures conference is starting. 4:15 PM – US ADP Nonfarm Payrolls (Expected: 28k, Previous: -32k) Thursday, November 6th Tesla will hold its annual shareholder meeting. *This is not investment advice. Continue Reading: Attention: Lots of Economic Developments and Altcoin Events in the New Week – Here’s the Day-by-Day, Hour-by-Hour List",Altcoin|News,EN,0,0,ALTCOIN|ASIA|EXCHANGE|ZEC|CRYPTOCURRENCY,"{'name': 'BitcoinSistemi', 'img': 'https://resources.cryptocompare.com/news/81/default.png', 'lang': 'EN'}",bitcoinsistemi,2025-11-02 20:56:10
53957292,https://ambcrypto.com/?p=542487,1762117202,https://images.cryptocompare.com/news/default/ambcrypto.png,Dash soars 49% in a day – Privacy coin mania captures the market,https://ambcrypto.com/dash-soars-49-in-a-day-privacy-coin-mania-captures-the-market/,The swift rally of ZCash past a key resistance at $372 was accompanied by skyrocketing prices.,Altcoin|Analysis|HideCryptopanic|News|News 1|No Homepage|Social|Trading View|ambcrypto,EN,0,0,ALTCOIN|MARKET|TRADING,"{'name': 'AMB Crypto', 'img': 'https://images.cryptocompare.com/news/default/ambcrypto.png', 'lang': 'EN'}",ambcrypto,2025-11-02 21:00:02
53957248,https://www.newsbtc.com/?p=847380,1762117223,https://resources.cryptocompare.com/news/21/53957248.jpeg,Bitcoin Long-Term Holders Show Signs Of Selling — Is A Reversal Imminent?,https://www.newsbtc.com/news/bitcoin/bitcoin-long-term-holders-are-leaning-towards-the-sell-direction/,"Recent on-chain data shows that a relevant class of Bitcoin investors known as long-term holders has continued to move out of their market positions. LTHs Actively Switching To Distribution In a November 1st post on social media platform X, popular on-chain analyst Burak Kesmeci shared an insight into the prevalent structural bias among Bitcoin’s long-term holders. Kesmeci’s analysis hinges on the Long-Term Holder Net Position Change metric, which tracks the net buying or selling behavior of Bitcoin’s long-term investors over a period of 30 days. Related Reading: Bitcoin At A ‘Do-Or-Die’ Level As Cycle Faces First Real Test: Analyst A positive reading is usually interpreted as a sign that the LTHs are in a net accumulation phase, as there are more market participants within this investor class buying Bitcoin than those who are selling. On the flipside, when the Long-Term Holder Net Position Change metric is negative, it means that the LTHs are in a distribution phase. Kesmeci explained in his post that there has been an increasing amount of momentum towards the sell side of the metric. In the highlighted chart, around 400,000 BTC appears to have been sold off in the past 30 days. Interestingly, the LTHs don’t seem to be easing off on their sales — a behavior which stands equally as a source of concern. In a case where Bitcoin’s long-term investors do desist from selling their holdings, Bitcoin could put in a local price bottom, as this typically indicates renewed interest and ‘smart money’ positioning for the next cycle. However, if this distribution momentum continues to grow, the premier cryptocurrency could continue towards the downside, as its long-term holders continue to inject more bearish pressure. LTH 2.2% Supply Drop Relatively Modest — Analyst In another X post, crypto pundit Darkfost shed light on the implications of Bitcoin’s LTH behavior shift. According to the analyst, the 2.2% “modest reduction” of Bitcoin LTH supply in October is not much to worry about, especially when compared to the levels seen in 2024. As of March 2024, Bitcoin’s LTH supply dropped by approximately 5.05%. In December, there was an even higher decline of about 5.2%. Darkfost implied that the present distribution the market is seeing could therefore be a result of early profit taking, where the market could soon see a rebound of the Bitcoin price. Nonetheless, the long-term holder net position’s trend is one that should be monitored, as a move back towards neutral readings could signal the start of an accumulation phase and subsequent price reversal to the upside. As of this writing, BTC is valued at approximately $110,750, with no significant movement in the past 24 hours. Related Reading: Bitcoin Hidden Setup — Triangle Support, Inverse H&S Signal A Powerful Reversal Featured image from iStock, chart from TradingView",Bitcoin|bitcoin|Bitcoin long-term holders|Bitcoin news|bitcoin price|btc price|BTCUSDT,EN,0,0,BTC|BUSINESS|MARKET|TRADING|CRYPTOCURRENCY,"{'name': 'NewsBTC', 'img': 'https://images.cryptocompare.com/news/default/newsbtc.png', 'lang': 'EN'}",newsbtc,2025-11-02 21:00:23
53957258,619042,1762117228,https://resources.cryptocompare.com/news/13/53957258.jpeg,"Bitcoin Market Strength Could Be More Than It Appears, Research Shows",https://bitcoinist.com/bitcoin-market-strength-more-than-appears-analyst/,"Over the past two weeks, the world’s leading cryptocurrency has struggled to break definitively above the $116,000 price mark while also testing the $106,000 support. As Bitcoin consolidates around $110,000, the latest on-chain analysis suggests an exciting outlook despite the recent price struggles. Why Bitcoin Price Might Soon See Expansion In a QuickTake post on the CryptoQuant platform, XWIN Research Japan, a crypto research institution, explores the possibility of a price reversal in the Bitcoin market, saying the current consolidation might be representative of asset-building momentum. The institution’s optimistic conjecture relies on readings obtained from three important on-chain metrics. Firstly, XWIN Research Japan highlights that there has been a sharp drop in Open Interest across futures exchanges since its peak established in September. For context, the open interest is the total number of outstanding futures or options contracts that have not been settled or closed. A sharp decline in open interest is usually indicative of events referred to as “leverage wipeouts,” where speculative positions are forced out of the market. Historically, a simultaneous decline in open interest alongside the cryptocurrency’s price has often led to market resets, which typically precede sustainable price rallies as a result of growing spot demand. Furthermore, the education and research institution references the Spent Output Profit Ratio (SOPR) metric, which tracks whether investors are predominantly selling at a profit or loss. The SOPR has reportedly found stability around 1.0, meaning that the majority of Bitcoin traders are trading around their cost basis. By extension, this points out that traders are neither in significant profits nor deep in losses. According to XWIN Research, this is a good sign that points to the end of the previous capitulation phase, and reflects the absorption of short-term holder supply by long-term holder demand. As all of these unfold underneath the surface, XWIN Research also postulates that liquidity might also be accumulating for the benefit of the flagship cryptocurrency. As reported by the institution, the total amount of the stablecoin ERC-20 in supply has reached an all-time high of approximately $158.8 billion. The crypto research institution speculates that if the market sentiment sees an improvement, as much as $158 billion in ERC-20 might be waiting on the sidelines to contribute upward pressure to Bitcoin’s price. Related Reading: Bitcoin Options Data Shows Rising Caution Beneath Supposedly Calm Market – Details Bitcoin Price Overview At the time of writing, Bitcoin is worth about $109,918, with data from CoinMarketCap revealing a slight growth of 0.22% over the past day.",Bitcoin|bitcoin|bitcoin open interest|Bitcoin Spent Output Profit Ratio|btcusd|BTCUSDT|Stablecoins|XWIN Research Japan,EN,0,0,BTC|MARKET|TRADING|RESEARCH|CRYPTOCURRENCY,"{'name': 'Bitcoinist', 'img': 'https://images.cryptocompare.com/news/default/bitcoinist.png', 'lang': 'EN'}",bitcoinist,2025-11-02 21:00:28
53957329,https://decrypt.co/?p=347123,1762117263,https://resources.cryptocompare.com/news/44/53957329.jpeg,The Biggest Games Releasing in November 2025,https://decrypt.co/347123/biggest-games-releasing-november-2025,"It's a big month for gaming, thanks to the impending release of Call of Duty: Black Ops 7, Kirby Air Riders, and a new Zelda game on Switch 2.",Gaming,EN,0,0,OTHER,"{'name': 'Decrypt', 'img': 'https://images.cryptocompare.com/news/default/decrypt.png', 'lang': 'EN'}",decrypt,2025-11-02 21:01:03
53957396,https://timestabloid.com/?p=88427,1762117504,https://resources.cryptocompare.com/news/67/default.png,Analyst to XRP Holders: FIB Extension Price Targets Are as Follows,https://timestabloid.com/analyst-to-xrp-holders-fib-extension-price-targets-are-as-follows/,"The XRP market is approaching a decisive phase after more than a year of vertical accumulation. Technical and fundamental indicators now align to suggest a potential long-term breakout. ChartNerd’s latest Fibonacci analysis gives a detailed roadmap of where XRP could move next. ChartNerd’s Fibonacci Extension Targets Renowned market analyst ChartNerd shared a clear Fibonacci extension model on X, defining three crucial upside targets for XRP. According to his projection, the 1.272 extension aligns with $8, the 1.414 level targets $13, and the 1.618 extension points to $27. These price levels represent measured expansions from XRP’s long-term accumulation base. Each target reflects a calculated stage of momentum continuation. The Fibonacci model, a trusted tool in technical analysis, helps identify natural zones where trends extend or reverse. ChartNerd’s setup combines multi-year swing data and consistent structure, showing that XRP may be completing a long re-accumulation phase. $XRP holders.. FIB extension targets are as follows: 1) 1.272 = $8 2) 1.414 = $13 3) 1.618 = $27 Tieing up with recent developments and acquisitions, alongside vertical accumulation for 12months, FA and TA point to all of them being possibilities. #NFA — ChartNerd (@ChartNerdTA) October 31, 2025 Current Price and Market Structure As of report time, XRP trades around $2.50. Daily trading volume stays robust above $2 billion, indicating sustained investor interest despite low volatility. The RSI sits near 45, a neutral region that indicates room for a potential upside swing. If XRP breaks above its local resistance, a larger impulse wave could begin to form. The $8 level, based on Fibonacci analysis, could serve as a key confirmation zone for a breakout. Further strength could push the asset to $13, while a full momentum expansion could test $27 over a longer horizon . Fundamental Catalysts Supporting the Bullish Setup Ripple’s ecosystem developments align strongly with ChartNerd’s bullish technical structure. The company launched RLUSD, its institutional stablecoin, in December 2024 to deepen liquidity within the XRP Ledger. Ripple’s acquisition of custody and payment infrastructure firms strengthens its institutional on-ramp strategy. Additionally, the XRPL EVM sidechain enables Ethereum-compatible smart contracts, opening new DeFi and liquidity opportunities. These advancements support long-term transactional demand for XRP and reinforce its position as a cross-border bridge asset. We are on X, follow us to connect with us :- @TimesTabloid1 — TimesTabloid (@TimesTabloid1) June 15, 2025 On-Chain and Investor Sentiment Trends On-chain data shows steady accumulation by large holders over the past twelve months. Whale wallets continue to grow their positions, signaling confidence in the asset’s long-term value. However, daily active address counts have fluctuated, showing inconsistent network usage. A sustained increase in network activity would provide fundamental validation for a move toward higher Fibonacci targets. Risk Considerations and Market Caution While the setup is promising, risks remain significant. Any sharp decline in global liquidity could weaken momentum before confirmation. Regulatory pressure or reduced institutional inflows could also delay bullish projections. If XRP fails to hold key supports, the technical structure may lose credibility. A Conditional Yet Powerful Bull Case ChartNerd’s Fibonacci roadmap—$8, $13, and $27—offers a disciplined framework for tracking XRP’s next expansion phase. Ripple’s growing ecosystem, institutional focus, and stable liquidity base provide a credible foundation for this outlook. Still, these targets represent possibilities, not guarantees. Sustained volume, positive on-chain signals, and continued product adoption will decide whether XRP meets ChartNerd’s projections. Disclaimer: This content is meant to inform and should not be considered financial advice. The views expressed in this article may include the author’s personal opinions and do not represent Times Tabloid’s opinion. Readers are advised to conduct thorough research before making any investment decisions. Any action taken by the reader is strictly at their own risk. Times Tabloid is not responsible for any financial losses. Follow us on Twitter , Facebook , Telegram , and Google News The post Analyst to XRP Holders: FIB Extension Price Targets Are as Follows appeared first on Times Tabloid .",Cryptocurrency|News|XRP|XRP Price|XRP Price Prediction,EN,0,0,BUSINESS|MARKET|TRADING|XRP|CRYPTOCURRENCY,"{'name': 'TimesTabloid', 'img': 'https://resources.cryptocompare.com/news/67/default.png', 'lang': 'EN'}",timestabloid,2025-11-02 21:05:04
53957406,https://news.bitcoin.com/?p=767981,1762117519,https://resources.cryptocompare.com/news/14/53957406.jpeg,Cryptoquant Report Shows US Bitcoin and Ethereum Appetite Taking a Breather,https://news.bitcoin.com/cryptoquant-report-shows-us-bitcoin-and-ethereum-appetite-taking-a-breather/,"According to researchers at Cryptoquant, demand for bitcoin and ethereum in the U.S. has cooled significantly across spot and derivatives markets after the September rally. Cryptoquant: Coinbase Premium Drop Signals Fading U.S. Buying Pressure A new Cryptoquant report shows that U.S. investors are easing off bitcoin and ethereum exposure, signaling a cooling phase rather than",Markets and Prices|Bitcoin (BTC)|Bitcoin Price|Cryptoquant|Ethereum (ETH)|markets and prices,EN,0,0,BTC|BUSINESS|ETH|EXCHANGE|CRYPTOCURRENCY,"{'name': 'Bitcoin.com', 'img': 'https://images.cryptocompare.com/news/default/bitcoincom.png', 'lang': 'EN'}",bitcoin.com,2025-11-02 21:05:19
53957689,https://zycrypto.com/?p=112228,1762118046,https://images.cryptocompare.com/news/default/zycrypto.png,"Michael Saylor Eyes $150,000 Bitcoin Price By End Of 2025, Targets $1 Million In 2029",https://zycrypto.com/michael-saylor-eyes-150000-bitcoin-price-by-end-of-2025-targets-1-million-in-2029/,"As bulls scan the horizon for signs of Bitcoin price direction, Strategy founder Michael Saylor has predicted that the asset will end the year on a high note.",Bitcoin|Markets|News|Bitcoin News|BTCUSD|BTCUSDC|BTCUSDT|Cryptocurrency News|XBTUSD,EN,0,0,BTC|MARKET|TRADING|CRYPTOCURRENCY,"{'name': 'ZyCrypto', 'img': 'https://images.cryptocompare.com/news/default/zycrypto.png', 'lang': 'EN'}",zycrypto,2025-11-02 21:14:06
