id,guid,published_on,imageurl,title,url,body,tags,lang,upvotes,downvotes,categories,source_info,source,date
55147742,https://cryptonews.com/?p=457967,1764504913,https://resources.cryptocompare.com/news/52/55147742.jpeg,XRP Price Prediction: $5.50 Target By Year-End 2026 Realistic?,https://cryptonews.com/news/xrp-price-prediction-5-50-target-by-year-end-2026-realistic/,"The XRP price today is $2.19, with $2.02 billion in trading volume over the past 24 hours. XRP slipped 1% on the day but continues to hold its position as the world’s fourth-largest cryptocurrency, backed by a market cap of nearly $132 billion. With 60.3 billion tokens circulating, investors are now debating whether XRP has the momentum to climb toward the much-discussed $5.50 target by late 2026. Market Structure Shows Signs of Stabilization XRP’s recent price behavior reflects a market trying to stabilize after months of pressure. The daily chart shows XRP repeatedly defending the $2.1458 zone, a level where long wick candles indicate steady buyer commitment. For a market that’s been trapped under a descending trendline since early October, this defense matters. It signals that sellers are losing their grip. The 20-day EMA flattening near $2.2026 adds another layer of support. It’s the first time in weeks that this trend filter isn’t pointing sharply downward, hinting that XRP may be preparing for a structural shift. Momentum remains soft, but the groundwork for a reversal is slowly forming. XRP/USD Triangle Compression Sets Up a December Breakout XRP price prediction is neutral as XRP is now coiling inside a tightening triangle pattern, a structure that typically precedes a notable breakout. Several Doji-style candles over the last week show hesitation, not weakness. Traders are waiting for a catalyst. XRP/USD Price Chart – Source: Tradingview The RSI sits near 47, a neutral position that leaves room for expansion in either direction. If XRP manages a clean daily close above the descending trendline, the first major test arrives at $2.3847. Clearing this level could unlock a move toward $2.5783, followed by a more ambitious push toward $2.78. Technical analysis points to a minor pullback toward $2.20–$2.23 first, allowing XRP to form a healthier higher low before charging at resistance. What It Means for Traders Heading Into 2026 The most attractive setup forms once XRP breaks, retests, and holds above the trendline. That structure provides a clearer runway toward higher levels, and opens the door to more aggressive targets in early 2026. If momentum strengthens alongside renewed liquidity across the crypto market, a march toward $5.50 becomes less far-fetched. With presale activity heating up and capital rotating back into high-beta assets, XRP’s next breakout may not only lift existing holders, it could also pull new investors into the broader market cycle. Maxi Doge: The Meme Coin Built for Maximum Hype Maxi Doge is exploding in popularity as traders rush toward its high-energy meme identity and fast-growing presale. With over $4.20 million raised, it’s quickly becoming one of the standout meme tokens of the year. The project mixes bold branding with real engagement features, from ROI contests to nonstop community events, giving it more personality and momentum than typical dog coins. Its shredded, leverage-obsessed mascot has already turned Maxi Doge into a recognizable culture coin. Holders can also stake $MAXI for daily smart-contract rewards and unlock access to exclusive competitions and partner events. The staking utility adds a passive-earning layer that keeps users active and invested in the ecosystem. With $MAXI priced at $0.00027 and the next increase approaching, the presale continues to gain speed. If you’re looking for a meme coin built on hype, personality, and real community energy, Maxi Doge is shaping up to be one worth watching. Click Here to Participate in the Presale The post XRP Price Prediction: $5.50 Target By Year-End 2026 Realistic? appeared first on Cryptonews .",Price Analysis|Cryptocurrency|XRP,EN,0,0,BUSINESS|MARKET|TRADING|XRP|CRYPTOCURRENCY,"{'name': 'cryptonews', 'img': 'https://images.cryptocompare.com/news/default/cryptonews.png', 'lang': 'EN'}",cryptonews,2025-11-30 12:15:13
55148482,https://en.coinotag.com/north-koreas-banned-nvidia-gpus-may-boost-ai-for-crypto-theft-and-cyber-activities,1764504919,https://resources.cryptocompare.com/news/77/55148482.jpeg,North Korea’s Banned Nvidia GPUs May Boost AI for Crypto Theft and Cyber Activities,https://en.coinotag.com/north-koreas-banned-nvidia-gpus-may-boost-ai-for-crypto-theft-and-cyber-activities,"North Korea has been accused of using banned Nvidia GPUs, such as the GeForce RTX 2700, to advance its AI research and bolster cyber activities, including cryptocurrency theft. This development raises concerns about enhanced efficiency in illicit digital asset operations despite international export restrictions. North Korea's AI focus spans nearly 30 years, emphasizing pattern recognition [...]",Analysis|News,EN,0,0,ASIA|MARKET|RESEARCH|CRYPTOCURRENCY,"{'name': 'CoinOtag', 'img': 'https://resources.cryptocompare.com/news/77/default.png', 'lang': 'EN'}",coinotag,2025-11-30 12:15:19
55148484,https://en.coinotag.com/breakingnews/bitcoin-btc-poised-to-resume-uptrend-as-on-chain-trader-loss-indicator-stands-at-20-below-37-threshold,1764505573,https://resources.cryptocompare.com/news/77/55148484.jpeg,Bitcoin (BTC) Poised to Resume Uptrend as On-Chain Trader Loss Indicator Stands at 20% (Below 37% Threshold),https://en.coinotag.com/breakingnews/bitcoin-btc-poised-to-resume-uptrend-as-on-chain-trader-loss-indicator-stands-at-20-below-37-threshold,Bitcoin (BTC) Poised to Resume Uptrend as On-Chain Trader Loss Indicator Stands at 20% (Below 37% Threshold),Breaking News,EN,0,0,BTC|CRYPTOCURRENCY,"{'name': 'CoinOtag', 'img': 'https://resources.cryptocompare.com/news/77/default.png', 'lang': 'EN'}",coinotag,2025-11-30 12:26:13
55148915,https://www.cryptopolitan.com/?p=870400,1764505823,https://resources.cryptocompare.com/news/43/55148915.jpeg,Jim Chanos says Nvidia funding its own customers to inflate sales could crash stock market,https://www.cryptopolitan.com/chanos-says-nvidia-will-crash-the-market/,"Wall Street is staring at Nvidia again after a fresh fight broke out between the chip giant and two of the most feared short sellers alive. Over the weekend, Nvidia sent a seven-page memo to analysts denying that it uses vendor financing, a method where suppliers loan money to their own buyers. The Substack post that triggered the memo compared Nvidia to Enron and Lucent. Enron broke after hiding debt off its balance sheet during the internet boom. Lucent broke after loaning money to customers that later failed. The writer said Nvidia now fits that same pattern through what was described as circular financing . Jim Chanos, the investor known for calling the collapse of Enron, said the comparison between Nvidia and Lucent makes sense. When the dot-com crash hit and the payments stopped, Lucent wrote off billions. Chanos calls out Nvidia’s customer cash loop In an interview with Yahoo Finance, Jim said Nvidia is sending money into firms that are losing cash just so those firms can keep ordering its chips.“They’re putting money into money-losing companies in order for those companies to order their chips,” Jim said. Nvidia has made direct investments into OpenAI, xAI, CoreWeave, and Nebius, all of which depend heavily on Nvidia’s hardware and are still burning cash. Nvidia denied any link to accounting abuse. In its memo, the company said it does not look like historical fraud cases and said its business is sound and its books are clean. It also said its customers pay within 53 days of buying chips, not over several years like traditional vendor loan deals. The company said it does not use vendor financing to grow revenue and said its sales system is simple. That denial did not change the tone of the short sellers. Michael Burry , the investor who predicted the 2008 housing crash, went further in a post on X last week. Michael said Nvidia is one of several AI companies showing “suspicious revenue recognition” because of how deeply it invests in its own buyers. His warning landed just days after Nvidia’s memo hit inboxes. Debt loads and data center rush raise fresh risks Jim also warned that debt inside the AI sector is turning into another stress point. He said some of Nvidia’s biggest buyers now use off-balance-sheet debt to pay for chips. He named Meta and xAI as firms using those structures. Others like Anthropic are using standard loans. Jim said the mix of heavy borrowing and money-losing business models creates a weak base under the entire market. “Putting lots of credit and really arcane financial structures on top of these money-losing entities is the real Achilles heel to the AI tech market,” Jim said during the same interview. Both Jim and Michael Burry said the bigger danger may not be billing methods at all. They said the real risk is scale. The largest tech firms on Earth are spending billions on AI data centers before users show up. In his Substack called Cassandra Unchained , Michael wrote that the market now has “catastrophically overbuilt supply and nowhere near enough demand.” He said the world is filling with too many chips, too many servers, and too many empty buildings waiting for real users. Nvidia told investors the opposite in its latest earnings report. The company said demand for its chips is “off the charts” and said it is still a full generation ahead of rivals. It also responded to growing pressure from Google, whose rising chip efforts pushed Nvidia’s stock lower before a rebound on Wednesday. Jim said the speed of the build-out itself is the core danger. If demand falls short of what buyers expect in 2027 or 2028, he said orders could start disappearing. “If it turns out that we don’t quite need all the data center or chip capacity we thought we will in ’27 or ’28, you could see orders begin to be canceled,” Jim said. “That’s a big risk that not a lot of people are talking about.” Want your project in front of crypto’s top minds? Feature it in our next industry report, where data meets impact.",Business|Meta|Nvidia|xAI,EN,0,0,BUSINESS|EXCHANGE|MARKET|TRADING|RESEARCH|CRYPTOCURRENCY,"{'name': 'Cryptopolitan', 'img': 'https://images.cryptocompare.com/news/default/cryptopolitan.png', 'lang': 'EN'}",cryptopolitan,2025-11-30 12:30:23
55148360,https://news.bitcoin.com/?p=774238&preview=true&preview_id=774238,1764505824,https://resources.cryptocompare.com/news/14/55148360.jpeg,"G20 Crypto Standards, DATs’ Future, and More — Week in Review",https://news.bitcoin.com/g20-crypto-standards-dats-future-and-more-week-in-review/,"G20 Crypto Standards, DATs’ Future, BNB ETF Advance, China Mining Resurgence, and more in this Week in Review. Week in Review The G20 pushed unified crypto oversight with new stablecoin and DeFi standards, experts debated whether DATs (crypto-holding firms) are fading amid the market downturn, Vaneck advanced a BNB ETF toward a Nasdaq listing with",The Weekly|bnb|ETF,EN,0,0,ASIA|MARKET|MINING|BNB|CRYPTOCURRENCY,"{'name': 'Bitcoin.com', 'img': 'https://images.cryptocompare.com/news/default/bitcoincom.png', 'lang': 'EN'}",bitcoin.com,2025-11-30 12:30:24
55148315,https://en.coin-turk.com/?p=207863,1764505826,https://resources.cryptocompare.com/news/79/55148315.jpeg,Zcash Faces Vitalik Buterin’s Challenge: What Lies Ahead?,https://en.coin-turk.com/zcash-faces-vitalik-buterins-challenge-what-lies-ahead/,Vitalik Buterin warns Zcash against token-based governance. Zcash community is divided over future governance approach. Continue Reading: Zcash Faces Vitalik Buterin’s Challenge: What Lies Ahead? The post Zcash Faces Vitalik Buterin’s Challenge: What Lies Ahead? appeared first on COINTURK NEWS .,Altcoin News,EN,0,0,ETH|ZEC,"{'name': 'CoinTurk News', 'img': 'https://resources.cryptocompare.com/news/79/default.png', 'lang': 'EN'}",cointurken,2025-11-30 12:30:26
55149328,https://www.cryptopolitan.com/?p=870453,1764506447,https://resources.cryptocompare.com/news/43/55149328.jpeg,Hyderabad police pick up suspected masterminds of fake crypto investment scheme,https://www.cryptopolitan.com/hyderabad-police-arrest-suspects-scheme/,"Hyderabad cybercrime police have arrested suspects linked to a bogus investment scheme. According to the Cyber Crime Police of Hyderabad, two men from Vash, Navi Mumbai, were arrested for their alleged roles in an investment fraud, targeting a Hyderabad resident who lost Rs. 12.3 lakh to the fraudulent scheme. According to an official from the unit, the arrest followed a complaint from the 53-year-old victim, who was deceived by the scammers who posed as investment advisers. The Hyderabad officer mentioned that the suspects were running their illegal operations under Flames Alliance and Munoth Capital Investment Limited. The accused were identified as Ravi Kumar Lal and Shivendra Ashok Singh. Hyderabad police apprehend suspects in fake investment scheme Investigators attached to the Hyderabad police mentioned that they started looking into the facts of the case after the complainant submitted his petition. They claimed that Ravi Kumar Lal operated a bank account by passing on OTPs through an APK file to an associate who resides in Pune. The police claimed that the associate, after getting wind of their arrests, left his residence and is still on the run, making retrieval challenging. On the other hand, Shivendra Ashok Singh was in charge of supplying mule bank accounts that were used to move funds stolen from victims. The officers claimed that the suspects approached the victim on WhatsApp, sending unsolicited messages before he agreed to listen to what they had to say. The suspects, posing as stock market experts, promised him exceptional returns if he would invest in a platform that they would introduce to him. With the profit enticing, he agreed to invest. Between August 13 and 28, the suspect transferred money into several accounts after being shown fabricated profits and reassured through small withdrawals when he started investing. However, problems started when he deposited larger funds. He claimed that the suspects first blocked his access to the platform before vanishing. Investigators with the Hyderabad police claimed that the suspects used a modus operandi that they had come across multiple times. Police urge residents to be watchful According to the investor, while one of the accused handled the bank accounts, the other one was in charge of the operation and the mobile numbers linked to the bank accounts. The officers claimed the victim was shown manipulated profits to create a sense of urgency. They knew that once he saw he had started making huge profits, he was going to go all in on his investments, which he did without fail. The officers noted that aside from this scam, the pair had also been linked to other kinds of fraud across India . In a similar case, the police arrested a suspect for stealing Rs. 26 lakh through a fake stock market investment. Police claimed that the suspect promoted it on social media, targeting unsuspecting elderly people to pitch mouth-watering profits. The criminal misled the victim, showing him a manipulated platform and taking money from him at intervals. However, when he tried to withdraw his funds, he discovered that it was a fake platform. Meanwhile, the Hyderabad police added that about four mobile phones and three cheque books were seized from the accused. Police claimed that this kind of scam has been rampant across the country since the start of the year, noting that the lax regulations concerning the crypto industry and digital assets have given the scammers enough room to operate. They have urged residents to be alert before they enter into any investment. In addition, people who want to make investments should seek advice from the right experts. Get seen where it counts. Advertise in Cryptopolitan Research and reach crypto’s sharpest investors and builders.",News|BTC|ETH|INR|USDT,EN,0,0,BTC|BUSINESS|FIAT|CRYPTOCURRENCY|SECURITY INCIDENTS,"{'name': 'Cryptopolitan', 'img': 'https://images.cryptocompare.com/news/default/cryptopolitan.png', 'lang': 'EN'}",cryptopolitan,2025-11-30 12:40:47
55149040,https://en.coinotag.com/breakingnews/pump-fun-hits-1-1m-in-24h-revenue-ranks-third-behind-tether-and-circle-after-surpassing-hyperliquid-defillama-data,1764506657,https://resources.cryptocompare.com/news/77/55149040.jpeg,"Pump.fun Hits $1.1M in 24h Revenue, Ranks Third Behind Tether and Circle After Surpassing Hyperliquid (Defillama Data)",https://en.coinotag.com/breakingnews/pump-fun-hits-1-1m-in-24h-revenue-ranks-third-behind-tether-and-circle-after-surpassing-hyperliquid-defillama-data,"Pump.fun Hits $1.1M in 24h Revenue, Ranks Third Behind Tether and Circle After Surpassing Hyperliquid (Defillama Data)",Breaking News,EN,0,0,BUSINESS|USDT|CRYPTOCURRENCY,"{'name': 'CoinOtag', 'img': 'https://resources.cryptocompare.com/news/77/default.png', 'lang': 'EN'}",coinotag,2025-11-30 12:44:17
55149651,https://en.coinotag.com/hyderabad-police-arrest-suspects-in-alleged-investment-fraud-tied-to-crypto-sector,1764506777,https://resources.cryptocompare.com/news/77/55149651.jpeg,Hyderabad Police Arrest Suspects in Alleged Investment Fraud Tied to Crypto Sector,https://en.coinotag.com/hyderabad-police-arrest-suspects-in-alleged-investment-fraud-tied-to-crypto-sector,"Hyderabad cybercrime police arrested two suspects in a crypto investment scam that defrauded a resident of Rs. 12.3 lakh. The fraudsters posed as investment advisors under fake firms like Flames Alliance, using manipulated platforms to lure victims with promises of high returns. Arrests in Navi Mumbai: Two men from Vash, Navi Mumbai, identified as Ravi [...]",News,EN,0,0,CRYPTOCURRENCY,"{'name': 'CoinOtag', 'img': 'https://resources.cryptocompare.com/news/77/default.png', 'lang': 'EN'}",coinotag,2025-11-30 12:46:17
55149739,https://www.cryptopolitan.com/?p=870450,1764507033,https://resources.cryptocompare.com/news/43/55149739.jpeg,Bitcoin remains under macro pressure after enduring worst monthly drop since June 2022,https://www.cryptopolitan.com/bitcoin-stuck-28-off-all-time-high/,"Bitcoin is still stuck. The OG crypto token is down 28% from its October all-time high of $126,000, now sitting around $91,000. This is now its worst monthly drop since June 2022. The sell-off hasn’t let up, and everything from ETF exits to miner losses is piling on. There’s no single reason why it’s falling. It’s a mix of institutional selling, cash draining out, and old holders calling it quits. And now, as traders get ready for the December 9 FOMC meeting, there’s little reason to expect a turnaround. Here’s where it all starts falling apart. ETFs dump Bitcoin, stablecoin capital dries up Over $3.5 billion has been pulled from Bitcoin ETFs just in November, the biggest monthly outflow since February, according to 10X Research. “That indicates that institutional investors have stopped allocating into bitcoin,” said Markus Thielen, founder of the firm. “These ETFs have turned into sellers, and as long as they keep selling, I think the markets will struggle to stay up, or rebound.” On top of that, fewer stablecoins are being minted. That’s usually a sign that new capital isn’t entering the market. Last week alone, around $800 million left crypto entirely and moved back into fiat, based on 10X’s data. Meanwhile, stablecoin market cap dropped $4.6 billion through November 1, according to DeFiLlama. “Money is not just failing to come in, it’s actually leaving the crypto market,” said Thielen. “That’s why bitcoin dominance is failing to pick up.” Earlier this week, Bitcoin briefly bounced after the Federal Reserve hinted at a possible rate cut in December. But Thielen doesn’t buy the rally. He expects that to fade before or during the December 9 Fed meeting, calling it just a “short-term, oversold reaction.” He says even if the Fed cuts rates, it’ll be a hawkish cut, not the kind of policy shift that kicks off a major bull run. Back on October 10, Bitcoin got hit hard during a leveraged liquidation event . That single day wiped out $19 billion in market value. The damage from that day is still being felt, with no clear sign of recovery since. Long-term holders cash out, miners and altcoins collapse Old-school Bitcoin holders are also selling. Some are reacting to the cycle. Others just want to spend their money. “There has been OG people selling every single cycle,” said Nicolai Søndergaard, research analyst at Nansen. “I think they just reach that point where they decide, okay, maybe I’ve gotten old enough, and I want to use this money now for something else.” This round of selling has smashed the rest of the digital asset market. Total crypto market cap is now at $2.99 trillion, down more than 30% from $4.28 trillion on October 6. It’s not just Bitcoin. Ethereum has dropped 38% since early October. Solana? Down over 40%. Søndergaard says if there’s any hope of a rebound , it’s going to come from either ETF demand returning or more companies stepping in to buy. But that’s not happening yet. Look at Strategy (MSTR), they didn’t announce a token purchase on Monday, even though they’d been doing that for six weeks in a row before now. Their model of loading Bitcoin onto balance sheets had sparked imitators. Now that wave’s dried up. Strategy’s still in profit. But other digital asset treasuries (DATs)? Most are now underwater on their positions. No one’s buying. Everyone’s waiting. Mind you, miners have tanked too. Names like IREN, Riot, and Mara Holdings have all dropped over 30%. Doesn’t matter that they’ve been shifting toward AI services, the market’s not giving them a break either. Get $50 free to trade crypto when you sign up to Bybit now",News|BTC|ETH|USD,EN,0,0,BTC|MARKET|ZRX|MACROECONOMICS|CRYPTOCURRENCY,"{'name': 'Cryptopolitan', 'img': 'https://images.cryptocompare.com/news/default/cryptopolitan.png', 'lang': 'EN'}",cryptopolitan,2025-11-30 12:50:33
55149495,https://ambcrypto.com/?p=550042,1764507623,https://images.cryptocompare.com/news/default/ambcrypto.png,"Ethereum stalls at $3,063 – Bounce or bull trap ahead?",https://ambcrypto.com/ethereum-stalls-at-3063-bounce-or-bull-trap-ahead/,"Ethereum bulls have done well to push prices back above $3k, but the two-month downtrend remains unbroken.",Altcoin|Analysis|Ethereum|HideCryptopanic|News|News 1|No Homepage|Social|Trading View,EN,0,0,ALTCOIN|ETH|MARKET|TRADING|CRYPTOCURRENCY,"{'name': 'AMB Crypto', 'img': 'https://images.cryptocompare.com/news/default/ambcrypto.png', 'lang': 'EN'}",ambcrypto,2025-11-30 13:00:23
