id,guid,published_on,imageurl,title,url,body,tags,lang,upvotes,downvotes,categories,source_info,source,date
54634250,https://bitcoinworld.co.in/?p=220906,1763604611,https://resources.cryptocompare.com/news/82/default.png,Shocking Bitcoin Investor Move: $228 Million BTC Deposit to Kraken Sparks Market Speculation,https://bitcoinworld.co.in/bitcoin-investor-kraken-deposit-4/,"BitcoinWorld Shocking Bitcoin Investor Move: $228 Million BTC Deposit to Kraken Sparks Market Speculation In a stunning development that’s shaking the cryptocurrency world, early Bitcoin investor Owen Gunden has made a monumental move that’s capturing global attention. Just hours ago, this pioneering Bitcoin investor transferred his entire remaining holdings of 2,499 BTC to the Kraken exchange, a transaction valued at an astonishing $228 million. This massive transfer from a long-term Bitcoin investor immediately sparked intense speculation across financial markets. Why Would a Bitcoin Investor Make Such a Massive Move? When a seasoned Bitcoin investor moves this amount of cryptocurrency to an exchange, the crypto community takes immediate notice. Large-scale deposits typically signal one thing: potential selling activity. However, experienced Bitcoin investors sometimes have multiple strategies beyond simple liquidation. This particular Bitcoin investor might be considering various options including: Portfolio rebalancing strategies Taking profits after substantial gains Preparing for other investment opportunities Estate planning or wealth management moves The timing of this Bitcoin investor’s decision comes during a period of relative market stability, making the move even more noteworthy for market analysts. What Does This Mean for Bitcoin Markets? Market reactions to large transfers from early Bitcoin investors often create immediate ripple effects. When a prominent Bitcoin investor moves hundreds of millions in cryptocurrency, it typically triggers several market responses. Trading volumes often spike as other investors react to the news. Price volatility can increase significantly as market participants interpret the Bitcoin investor’s intentions. However, it’s crucial to remember that not every exchange deposit leads to immediate selling. Some Bitcoin investors use exchanges for other purposes like: Securing assets in exchange wallets Preparing for staking or lending activities Facilitating institutional transactions Diversifying across multiple platforms Understanding Early Bitcoin Investor Psychology Early Bitcoin investors like Owen Gunden possess unique market perspectives having witnessed Bitcoin’s journey from obscurity to mainstream adoption. Their moves often carry significant weight because these Bitcoin investors have demonstrated remarkable patience and conviction through multiple market cycles. When such a Bitcoin investor makes a substantial move, it’s worth examining potential motivations beyond surface-level interpretations. These seasoned Bitcoin investors typically consider factors that newer market participants might overlook. Their decisions often reflect deep understanding of market cycles, regulatory developments, and technological advancements affecting cryptocurrency valuations. Key Takeaways for Crypto Enthusiasts This development offers valuable lessons for anyone interested in cryptocurrency markets. The move by this early Bitcoin investor demonstrates several important principles about cryptocurrency investing. Market movements by established Bitcoin investors provide learning opportunities for understanding market dynamics. Large transactions remind us about the importance of having clear investment strategies regardless of market conditions. Moreover, this situation highlights why monitoring blockchain activity through services like Lookonchain has become essential for serious market participants tracking significant Bitcoin investor behavior. Frequently Asked Questions Why do large Bitcoin deposits to exchanges often indicate selling? Exchanges provide the liquidity needed for large sales. When Bitcoin investors move significant amounts to exchanges, they’re typically preparing to convert cryptocurrency to fiat currency or other assets. How early is Owen Gunden as a Bitcoin investor? While specific details about his initial acquisition aren’t public, holding 2,499 BTC suggests very early involvement, potentially dating back to Bitcoin’s earlier years when prices were substantially lower. Could this Bitcoin deposit have other purposes besides selling? Absolutely. While selling is the most common interpretation, Bitcoin investors sometimes use exchanges for staking, lending, or transferring between accounts. Some institutional transactions also require exchange intermediation. How might this affect Bitcoin’s price? Large potential sell pressure can create short-term volatility, but Bitcoin’s market depth has grown significantly. Single transactions, while large, rarely dictate long-term price trends in today’s mature market. Should retail investors follow early Bitcoin investors’ moves? While educational, retail investors should make decisions based on personal research and risk tolerance rather than blindly following any single Bitcoin investor’s actions. How can I track large cryptocurrency movements? Blockchain analytics platforms like Lookonchain, Chainalysis, and various on-chain analysis tools allow monitoring of significant cryptocurrency transactions in real-time. Found this analysis insightful? Share this breaking news about major Bitcoin investor activity with fellow crypto enthusiasts on your social media channels! Help others stay informed about significant market movements that could impact their investment decisions. To learn more about the latest Bitcoin trends, explore our article on key developments shaping Bitcoin price action and institutional adoption. This post Shocking Bitcoin Investor Move: $228 Million BTC Deposit to Kraken Sparks Market Speculation first appeared on BitcoinWorld .",Crypto News|BITCOIN|BLOCKCHAIN|Crypto news|CRYPTOCURRENCY|KRAKEN,EN,0,0,BTC|BUSINESS|EXCHANGE|MARKET|CRYPTOCURRENCY,"{'name': 'Bitcoin World', 'img': 'https://resources.cryptocompare.com/news/82/default.png', 'lang': 'EN'}",bitcoinworld,2025-11-20 02:10:11
54634452,c412d744-10c5-48c6-b8cc-d00c0d9615f8,1763604907,https://resources.cryptocompare.com/news/5/54634452.jpeg,Asia Morning Briefing: Market Turns Defensive as Bitcoin Loses Its Bid,https://www.coindesk.com/markets/2025/11/20/asia-morning-briefing-market-turns-defensive-as-bitcoin-loses-its-bid,"With CryptoQuant flagging an exhausted demand wave and Polymarket traders clustering around an 85,000 retest, the market is trading without the catalysts that drove last year’s gains.",Markets|btc|ETH|bear|News,EN,0,0,ASIA|BTC|MARKET|TRADING|CRYPTOCURRENCY,"{'name': 'CoinDesk', 'img': 'https://resources.cryptocompare.com/news/5/default.png', 'lang': 'EN'}",coindesk,2025-11-20 02:15:07
54634451,https://en.coinotag.com/breakingnews/ethfi-investor-address-0x44e6-unlocks-3-909m-ethfi-monthly-transfers-to-binance-31-27m-ethfi-in-6-months,1763604917,https://resources.cryptocompare.com/news/77/default.png,"🚨 ETHFI: Investor Address 0x44e6 Unlocks 3.909M ETHFI Monthly, Transfers to Binance (31.27M ETHFI in 6 Months)",https://en.coinotag.com/breakingnews/ethfi-investor-address-0x44e6-unlocks-3-909m-ethfi-monthly-transfers-to-binance-31-27m-ethfi-in-6-months,"ETHFI: Investor Address 0x44e6 Unlocks 3.909M ETHFI Monthly, Transfers to Binance (31.27M ETHFI in 6 Months)",Breaking News,EN,0,0,BUSINESS|ZRX|BNB|ETHFI|CRYPTOCURRENCY,"{'name': 'CoinOtag', 'img': 'https://resources.cryptocompare.com/news/77/default.png', 'lang': 'EN'}",coinotag,2025-11-20 02:15:17
54634771,https://en.coinotag.com/trump-administration-to-launch-genesis-mission-for-enhanced-us-ai-leadership,1763605169,https://resources.cryptocompare.com/news/77/default.png,Trump Administration to Launch Genesis Mission for Enhanced US AI Leadership,https://en.coinotag.com/trump-administration-to-launch-genesis-mission-for-enhanced-us-ai-leadership,"The Trump Genesis Mission is a comprehensive U.S. government initiative launched by President Donald Trump to establish American leadership in artificial intelligence (AI). Modeled after historic efforts like the Manhattan Project, it mobilizes national laboratories, fosters public-private partnerships, and centralizes federal regulation to drive innovation across data science, computing, and neuroscience, ensuring AI bolsters national",News,EN,0,0,REGULATION,"{'name': 'CoinOtag', 'img': 'https://resources.cryptocompare.com/news/77/default.png', 'lang': 'EN'}",coinotag,2025-11-20 02:19:29
54634768,https://bitcoinworld.co.in/?p=220909,1763605511,https://resources.cryptocompare.com/news/82/default.png,Revolutionary Web3 Infrastructure Partnership: UXLINK and Zcash Transform Digital Privacy,https://bitcoinworld.co.in/uxlink-zcash-web3-infrastructure-partnership/,"BitcoinWorld Revolutionary Web3 Infrastructure Partnership: UXLINK and Zcash Transform Digital Privacy The cryptocurrency landscape just witnessed a groundbreaking development as UXLINK announces its strategic partnership with Zcash to build next-generation Web3 infrastructure. This collaboration marks a significant step forward in addressing two critical challenges in the digital space: privacy and reliability. For anyone invested in the future of decentralized technologies, this partnership represents a major leap toward creating more secure and accessible digital ecosystems. Why Is This Web3 Infrastructure Partnership So Important? UXLINK’s collaboration with Zcash brings together specialized expertise to create robust Web3 infrastructure that serves diverse user needs. Privacy has become non-negotiable for governments and institutional investors entering the blockchain space. Meanwhile, reliability remains essential for bringing global users into the Web3 ecosystem. This partnership directly addresses both requirements through innovative technological solutions. The enhanced Web3 infrastructure will enable several key applications: Privacy-preserving decentralized identity systems Secure social payment networks Zero-knowledge based governance models Privacy-focused social agents How Will This Web3 Infrastructure Benefit Users? This upgraded Web3 infrastructure promises tangible benefits for everyday users and institutions alike. Regular internet users will enjoy enhanced privacy protections while participating in social platforms and financial transactions. The integration of Zcash’s privacy technology ensures that personal data remains secure without compromising functionality. For developers and businesses, this Web3 infrastructure provides building blocks for creating applications that respect user privacy while maintaining transparency where needed. The partnership enables new business models that weren’t previously possible due to privacy concerns or technical limitations. What Challenges Does This Web3 Infrastructure Solve? Current blockchain networks often force users to choose between privacy and functionality. This new Web3 infrastructure eliminates that compromise by integrating privacy features directly into the platform’s core architecture. The collaboration addresses regulatory concerns while maintaining the decentralized principles that make Web3 valuable. Moreover, the reliability aspect of this Web3 infrastructure ensures that applications built on it can scale to accommodate millions of users without performance degradation. This solves one of the most persistent problems in blockchain adoption – the ability to handle real-world usage levels. What’s Next for This Web3 Infrastructure Development? UXLINK has confirmed that the partnership will significantly expand their development roadmap. The enhanced Web3 infrastructure will support more sophisticated applications over time, including advanced governance systems and enterprise-grade solutions. The collaboration represents a long-term commitment to building infrastructure that can evolve with user needs and technological advancements. The teams plan to roll out features gradually, ensuring stability and security at each development stage. This careful approach demonstrates their commitment to creating Web3 infrastructure that users can trust with their most sensitive digital interactions. Conclusion: A New Era for Web3 Infrastructure The UXLINK-Zcash partnership represents a milestone in Web3 development. By combining strengths in social platforms and privacy technology, they’re creating Web3 infrastructure that could become the standard for future decentralized applications. This collaboration shows that the industry is maturing, focusing on practical solutions rather than theoretical possibilities. Frequently Asked Questions What makes this Web3 infrastructure different from existing solutions? This Web3 infrastructure uniquely combines social platform functionality with advanced privacy protection, creating a more comprehensive solution than previous offerings. How will ordinary users benefit from this partnership? Users will enjoy enhanced privacy in their social interactions and financial transactions while accessing more reliable services across the platform. When will these new features become available? The teams are implementing features gradually, with initial enhancements expected within the coming months and more advanced capabilities following throughout the year. Will existing UXLINK users need to migrate to new systems? No, the upgrades will integrate seamlessly with existing systems, ensuring a smooth transition for current users. How does Zcash’s technology enhance the Web3 infrastructure? Zcash brings proven privacy technology that protects user data while maintaining necessary transparency for regulatory compliance. Can developers build on this new infrastructure? Yes, the partnership includes developer tools and documentation to help creators build privacy-focused applications. Found this insight into the future of Web3 infrastructure valuable? Share this article with your network to spread awareness about these important developments in digital privacy and reliability. To learn more about the latest Web3 infrastructure trends, explore our article on key developments shaping blockchain technology and institutional adoption. This post Revolutionary Web3 Infrastructure Partnership: UXLINK and Zcash Transform Digital Privacy first appeared on BitcoinWorld .",Crypto News|BLOCKCHAIN|CRYPTOCURRENCY|UXLINK|Web3|Zcash,EN,0,0,BLOCKCHAIN|BUSINESS|TECHNOLOGY|ZEC|CRYPTOCURRENCY,"{'name': 'Bitcoin World', 'img': 'https://resources.cryptocompare.com/news/82/default.png', 'lang': 'EN'}",bitcoinworld,2025-11-20 02:25:11
