id,guid,published_on,imageurl,title,url,body,tags,lang,upvotes,downvotes,categories,source_info,source,date
55137508,https://timestabloid.com/?p=90997,1764489731,https://resources.cryptocompare.com/news/67/default.png,Analyst: XRP Is Still Not Bearish in the Slightest. Here’s why,https://timestabloid.com/analyst-xrp-is-still-not-bearish-in-the-slightest-heres-why/,"XRP continues to trade in a narrow range as it moves through the final stretch of 2025. The price has stayed steady on the weekly chart while many indicators have cooled off. This has created an unusual mix of stability and low momentum. Charting Guy (@ChartingGuy), a technical analyst on X, shared his view of this setup and explained why he still sees strength in the current structure. His post focused on support, the behavior of the RSI, and what the pattern signals for XRP. $XRP is still NOT bearish in the slightest building support on prior cycle high as well as top of golden pocket the chart where people show you monthly RSI losing steam.. why didn’t they show you all that in January 2025 when RSI topped? RSI lost momentum ALL 2025 while… https://t.co/EZ2Oz1cpCV pic.twitter.com/ETtrwt1CLx — Charting Guy (@ChartingGuy) November 27, 2025 Support at Key Levels Charting Guy said XRP is “still NOT bearish in the slightest,” reaffirming his conviction in the asset’s trajectory . He pointed to price action on the weekly chart and said XRP is building support on a prior cycle high. He added that it also sits on the top of the golden pocket. These levels often act as strong support zones in trending markets. Also, they help show whether buyers remain active. The chart he shared places XRP above the 0.786 Fibonacci level. Its price has tapped this region several times without breaking below it. This zone used to be a major resistance . Now it serves as support. That shift can play a key role in market structure. Charting Guy’s view is that XRP still respects this structure and continues to move in a stable range. RSI Slide Through 2025 Charting Guy questioned why some users now point to the monthly RSI. He asked why analysts did not do this in early 2025 when it peaked. He said the indicator lost momentum throughout 2025, even as XRP stayed in the same price band. While some experts believe the RSI indicates a bullish resurgence , the analyst’s pattern shows a long momentum reset without a price drop. We are on X, follow us to connect with us :- @TimesTabloid1 — TimesTabloid (@TimesTabloid1) June 15, 2025 This pattern often shows up when a market slows down to reset. The RSI can fall for months while the price remains stable. This is a signal of easing selling pressure. It also shows that buyers still control the range. Reaccumulation Structure and Outlook Charting Guy called the setup a “very textbook reaccumulation signal.” Momentum cooled, but the price held its range and stayed above key Fibonacci levels. XRP defends support. This shows that buyers continue to step in at these levels. XRP remains stable despite weak momentum readings through 2025. Charting Guy noted that the structure has not broken, and buyers continue to support the range. If XRP holds these levels, the pattern may create room for a stronger move when momentum returns . Disclaimer : This content is meant to inform and should not be considered financial advice. The views expressed in this article may include the author’s personal opinions and do not represent Times Tabloid’s opinion. Readers are advised to conduct thorough research before making any investment decisions. Any action taken by the reader is strictly at their own risk. Times Tabloid is not responsible for any financial losses. Follow us on X , Facebook , Telegram , and Google News The post Analyst: XRP Is Still Not Bearish in the Slightest. Here’s why appeared first on Times Tabloid .",Cryptocurrency|News|XRP|XRP Price|XRP Price Analysis,EN,0,0,MARKET|TRADING|XRP|RESEARCH|CRYPTOCURRENCY,"{'name': 'TimesTabloid', 'img': 'https://resources.cryptocompare.com/news/67/default.png', 'lang': 'EN'}",timestabloid,2025-11-30 08:02:11
55137707,https://u.today/banned-gpus-help-north-korea-expand-crypto-heists,1764489797,https://resources.cryptocompare.com/news/64/55137707.jpeg,Banned GPUs Help North Korea Expand Crypto Heists,https://u.today/banned-gpus-help-north-korea-expand-crypto-heists,"North Korea is relying on stolen graphics cards for advancing its crypto theft efforts, according to a recent report.",North Korea,EN,0,0,ASIA|CRYPTOCURRENCY,"{'name': 'U.Today', 'img': 'https://images.cryptocompare.com/news/default/utoday.png', 'lang': 'EN'}",utoday,2025-11-30 08:03:17
55138074,https://en.coinotag.com/breakingnews/monad-debate-heats-up-as-arthur-hayes-urges-100-token-unlock-to-spark-real-usage-and-challenge-ethereum,1764490418,https://resources.cryptocompare.com/news/77/55138074.jpeg,Monad Debate Heats Up as Arthur Hayes Urges 100% Token Unlock to Spark Real Usage and Challenge Ethereum,https://en.coinotag.com/breakingnews/monad-debate-heats-up-as-arthur-hayes-urges-100-token-unlock-to-spark-real-usage-and-challenge-ethereum,Monad Debate Heats Up as Arthur Hayes Urges 100% Token Unlock to Spark Real Usage and Challenge Ethereum,Breaking News,EN,0,0,ETH|CRYPTOCURRENCY,"{'name': 'CoinOtag', 'img': 'https://resources.cryptocompare.com/news/77/default.png', 'lang': 'EN'}",coinotag,2025-11-30 08:13:38
55138735,https://en.coinotag.com/asters-potential-30-rally-in-december-faces-on-chain-challenges,1764490521,https://resources.cryptocompare.com/news/77/55138735.jpeg,ASTER’s Potential 30% Rally in December Faces On-Chain Challenges,https://en.coinotag.com/asters-potential-30-rally-in-december-faces-on-chain-challenges,"Aster DEX's ASTER token has declined over 5% amid bullish community sentiment above 75%, based on CoinMarketCap data from over 60,000 participants. Trading sideways at around $1, it shows potential for a 30% rally in December if technical patterns hold, despite on-chain challenges and upcoming unlocks. Aster DEX faces a 5% price drop despite strong [...]",News,EN,0,0,TRADING,"{'name': 'CoinOtag', 'img': 'https://resources.cryptocompare.com/news/77/default.png', 'lang': 'EN'}",coinotag,2025-11-30 08:15:21
55138486,https://cryptodaily.co.uk/2025/11/lbank-boosthub-features-new-project-berabtc-vault-token-bvtberabtc-with-153846-tokens-in-rewards,1764491130,https://resources.cryptocompare.com/news/75/55138486.jpeg,"LBank Boosthub Features New Project BeraBTC Vault Token (BVTBERABTC) with 153,846 Tokens in Rewards",https://cryptodaily.co.uk/2025/11/lbank-boosthub-features-new-project-berabtc-vault-token-bvtberabtc-with-153846-tokens-in-rewards,"Singapore, Singapore, November 30th, 2025, Chainwire LBank, the leading crypto exchange, today announced the launch of Boosthub’s latest project, BVTBERABTC (BeraBTC Vault Token) , enabling global users to claim a free share of 153,846 BVTBERABTC tokens. Users can now register for the BVTBERABTC allocation via Boosthub, with two participation pools designed to fit different user profiles. Building on the momentum of its first project, Boosthub is now expanding into its second phase with BVTBERABTC. The program will continue introducing early-stage, high-potential assets and providing users with sustained token rewards as part of LBank’s long-term commitment to early-value discovery across Web3. Participation for the BVTBERABTC token allocation is now open on Boosthub. Two pools are available for users meeting the eligibility requirements: Smart Pool — Hard Cap: 1,600 BVTBERABTC Requirements: Minimum holding of 1,000 USDT & at least one completed spot or futures trade. Futures Pool — Hard Cap: 1,600 BVTBERABTC Requirements: Average net asset value between 1,000 and 50,000 USDT. Now all users can register and the BVTBERABTC will be distributed on December 5, 18:00 SGT. With Boosthub, LBank aims to empower more users to access high-potential early projects through a fair, transparent, and zero-cost participation mechanism, reinforcing its commitment to early-value discovery across Web3. BeraBTC Vault Token (BVTBERABTC) is the next-generation BTC-Fi project launched by the Batoshi Foundation, aimed at migrating MicroStrategy's Bitcoin reserve strategy to an on-chain environment. Through smart contracts, it builds a transparent ""on-chain micro-strategy"" system. This system uses beraBTC as its core asset (1:1 pegged to Bitcoin), enabling users to inject BTC (such as wBTC or cbBTC) into the Berachain ecosystem, transforming ""idle assets"" into ""composable assets"" that support DeFi applications like liquidity pools, lending, and PoL reward generation. Looking forward, Boosthub will continue to introduce more high-potential early-stage assets, ensuring accessible and transparent opportunities for global users seeking emerging value in Web3. About LBank Founded in 2015, LBank is a leading global cryptocurrency exchange serving over 20 million registered users in 160 countries and regions. With a daily trading volume exceeding $10.5 billion and 10 years of safety with zero security incidents, LBank is dedicated to providing a comprehensive and user-friendly trading experience. Through innovative trading solutions, the platform has enabled users to achieve average returns of over 130% on newly listed assets. As the ultimate 100x Gems Hub, LBank has listed over 300 mainstream coins and more than 50 high-potential gems. Ranked No. 1 in 100x Gems, Highest Gains, and Meme Share, LBank leads the market with the fastest altcoin listings, unmatched liquidity, and industry-first trading guarantees, making it the go-to platform for crypto investors worldwide. Follow LBank for Updates Website: https://www.lbank.com/ Twitter: https://twitter.com/LBank_Exchange Telegram: https://t.me/LBank_en Instagram: https://www.instagram.com/lbank_exchange LinkedIn: https://www.linkedin.com/company/lbank ContactPR & CommunicationsLBankpress@lbank.com Disclaimer: This is a sponsored press release and is for informational purposes only. It does not reflect the views of Crypto Daily, nor is it intended to be used as legal, tax, investment, or financial advice.",More News,EN,0,0,MINING|SPONSORED|TRADING|ZRX|CRYPTOCURRENCY,"{'name': 'Crypto Daily', 'img': 'https://resources.cryptocompare.com/news/75/default.png', 'lang': 'EN'}",cryptodaily,2025-11-30 08:25:30
55138702,https://news.bitcoin.com/?p=774030,1764491443,https://resources.cryptocompare.com/news/14/55138702.jpeg,Stablecoin Taxation Measures Spark Heated Debate in Brazil,https://news.bitcoin.com/stablecoin-taxation-measures-spark-heated-debate-in-brazil/,"Rumors of taxing stablecoin flows in Brazil have sparked a debate between some lawmakers and the Ministry of Finance. While the ministry is preparing a normative act on the subject, lawmakers say they will oppose any such proposal. Faceoff: Stablecoin Taxation Stirs Discussion In Brazil The Facts An upcoming proposal that aims to tax stablecoin",Regulation|Brazil|Tax,EN,0,0,REGULATION,"{'name': 'Bitcoin.com', 'img': 'https://images.cryptocompare.com/news/default/bitcoincom.png', 'lang': 'EN'}",bitcoin.com,2025-11-30 08:30:43
55138950,https://cryptopotato.com/?p=1421780,1764491620,https://resources.cryptocompare.com/news/27/55138950.jpeg,We Asked 3 AIs if Ripple (XRP) Will Have a Bullish December: Their Answers May Shock You,https://cryptopotato.com/we-asked-3-ais-if-ripple-xrp-will-have-a-bullish-december-their-answers-may-shock-you/,"It has been a wild period in the cryptocurrency markets, with BTC and many larger-cap alts posting double-digit price increases on a weekly scale, but similar or even more painful declines monthly. With the last month of the year just around the corner, we decided to focus on the third-largest non-stablecoin cryptocurrency and asked some of the most popular AIs about their take on what December holds for XRP. What’s Next (ChatGPT Edition)? ChatGPT outlined XRP’s difficult past few months, especially since its all-time high marked in mid-July. By October, the asset had lost all of its yearly momentum and dumped below $2 during the first market-wide crash. The second, which took place in the middle of November, drove it south hard once again to roughly $1.80. Although the cross-border token has rebounded to around $2.20 as of now, it’s still slightly in the red on a YTD scale, which is quite interesting and perhaps unexpected given the overall bullish year. Aside from the ATH, Ripple saw the conclusion of the prolonged battle against the US SEC, and several spot XRP ETFs were launched in the country. OpenAI’s solution noted that the first positive sign for the token is the fact that it quickly reclaimed the $2.00 level after its latest correction. It remains “the most important line to protect heading into December” as a monthly close above it “keeps the long-term trend intact.” ChatGPT highlighted the following factors that can reignite XRP’s rally in the next month: strong ETF inflows, overall market stabilization or more profound recovery, and renewed whale accumulation – something that has been lacking for weeks. Its bull case envisions a price surge to $2.85, while its bear scenario predicts another slip below $2.00 and a December bottom of around $1.80. “December has the potential to be better than October and November, but XRP remains in a fragile position. If the broader market stabilizes, XRP could see a gradual rebound toward the mid-$2 range. However, without a strong catalyst, a full trend reversal seems unlikely before 2026,” – the AI chatbot concluded. XRP Through the Eyes of Perplexity and Grok Perplexity was slightly more bullish. Although it mentioned essentially the same calalysts that can drive another XRP rally, its best-case scenario forecasts a price surge beyond $3.00 and up to $3.40, which would be just inches below the July peak. Even its bearish prediction was higher than ChatGPT’s, as it doesn’t see a drop below $2.00 in December. Grok, on the other hand, believes such a decline might take place if the US Federal Reserve fails to lower the key interest rates or some other geopolitical tension caps XRP’s recent progress. Declining volume and whales realizing profits or capitulating could also contribute to another possible correction that can drive the asset toward the November low of $1.80. Nevertheless, both AIs said they don’t expect fireworks in the last month of the year, predicting moves of up somewhere between 5% and 20% tops. The post We Asked 3 AIs if Ripple (XRP) Will Have a Bullish December: Their Answers May Shock You appeared first on CryptoPotato .",Crypto Bits|Crypto News|Ripple (XRP) ETF|Ripple (XRP) Price,EN,0,0,MARKET|TRADING|XRP|MACROECONOMICS|CRYPTOCURRENCY,"{'name': 'Crypto Potato', 'img': 'https://images.cryptocompare.com/news/default/cryptopotato.png', 'lang': 'EN'}",cryptopotato,2025-11-30 08:33:40
55139182,https://cryptonews.com/?p=457920,1764492054,https://resources.cryptocompare.com/news/52/55139182.jpeg,Housing Crisis Pushes Young Americans Into Crypto Gambles: Study,https://cryptonews.com/news/housing-crisis-pushes-young-americans-into-crypto-gambles-study/,"A new study warns that a growing share of young Americans is turning to cryptocurrency not as an ideological choice, but as a financial gamble driven by despair over housing costs. Key Takeaways: Young Americans are turning to crypto out of financial desperation as housing becomes increasingly unaffordable. Researchers say “discouraged renters” replace saving with high-risk investing once homeownership feels impossible. Over time, this shift traps many in near-zero wealth while hopeful homeowners continue to build assets. The report argues that soaring home prices have reshaped how an entire generation thinks about money, risk and opportunity. US Homeownership Slips Out of Reach, Pushing Youth Toward Risky Bets Researchers found that the median US house price-to-income ratio has risen so sharply since the 1980s that today’s young adults would need nearly two extra years of income to afford the same home their parents could. As the possibility of owning a home fades, financial behavior shifts just as dramatically. Instead of saving for a down payment, many turn to volatile assets that offer a chance at a sudden leap in wealth. “Crypto becomes a substitute for the American Dream,” the authors write, describing digital assets as vehicles for high-risk, high-reward betting when conventional goals feel unreachable. Rather than reflecting faith in decentralization or distrust of banks, crypto participation is increasingly a coping strategy for a broken path to stability. The research identifies a tipping point the authors call “discouraged renters.” Once people conclude homeownership is no longer realistic, their financial habits change in lasting ways. Compared with homeowners of similar net worth, discouraged renters rack up about 10% more in credit card spending and are far more likely to disengage from long-term career ambition. The US housing bubble popped in 2007-08, causing a massive financial crisis. So what did the US do after? It inflated another housing bubble, which is even bigger now. Because the US economy is a financialized house of cards built on asset price bubbles. https://t.co/Fr54cJmTk9 pic.twitter.com/JLHPzPozTE — Ben Norton (@BenjaminNorton) November 30, 2025 The study links this mindset to the rising phenomenon of “quiet quitting,” where workers remain employed but emotionally checked out. Wealth levels also change how people interact with crypto. Renters holding between $50,000 and $300,000 in assets show the highest participation, falling into what the report describes as a no-man’s-land: too creditworthy to give up, yet too poor to buy property. Below $50,000, investment almost disappears, not for lack of interest, but for lack of cash. Crypto, the report notes, becomes a “last-chance lever,” a way to try to beat a system that no longer feels fair. Welfare programs soften the blow of failure, encouraging moonshot risk-taking with limited downside. However, the long-term effects are bleak. Over time, discouraged renters sink into what the study calls a near-zero wealth trap, while those who hold onto the hope of homeownership continue building capital. Global Housing Crisis Pushes Youth From Saving Into Crypto Speculation Young people in South Korea and Japan express similar disengagement under the weight of housing inflation, and both countries have fast-growing crypto communities. The pattern, researchers conclude, is global. When shelter becomes unattainable, speculation replaces saving. In March, the US Department of Housing and Urban Development (HUD) revealed that it is exploring the potential use of blockchain and stablecoins to improve certain operational functions. Officials also debated a pilot program where a HUD grantee would receive payments via stablecoin, with the initiative first being tested in a single department before broader implementation. The post Housing Crisis Pushes Young Americans Into Crypto Gambles: Study appeared first on Cryptonews .",Altcoin News|Adoption|Bitcoin|Cryptocurrency,EN,0,0,ASIA|BLOCKCHAIN|BTC|MACROECONOMICS|CRYPTOCURRENCY,"{'name': 'cryptonews', 'img': 'https://images.cryptocompare.com/news/default/cryptonews.png', 'lang': 'EN'}",cryptonews,2025-11-30 08:40:54
55140318,https://www.newsbtc.com/?p=860253,1764493256,https://resources.cryptocompare.com/news/21/55140318.jpeg,Ethereum Leverage Reset Complete – Time For Market Re-Accumulation?,https://www.newsbtc.com/news/ethereum/ethereum-leverage-reset-complete-time-for-market-re-accumulation/,"Ethereum presently trades around $3,000 following a broader crypto market rebound in the last week. During this time, the market’s largest altcoin gained by 7.22%, providing a much-needed relief after an extended correction that dominated the majority of the last two months. As price stabilizes, crypto analytics platform XWIN Research Japan shares a forward-looking assessment of Ethereum’s outlook, especially considering developments in the futures market. Related Reading: 320 Ether On The Move: Bhutan Ramps Up Its Staking Game Ethereum Bulls Buy The Dip After Weak Position Exits Amid the widespread correction of the crypto market in Q4 2025, Ethereum’s prices crashed from $4,700 to as low as $2,900, representing a 38% price decline. XWIN Research Japan reports this price fall coincided with certain relevant developments in the futures market. In particular, Ethereum’s open interest across all exchanges dropped from $21 billion to around $17 billion in late November, as overleveraged long positions were closed down, forcing traders to open new positions with moderate leverage size. Meanwhile, funding rates stayed positive but declined to around 0.002, meaning that the dominant bullish sentiment from mid-2025 greatly reduced. Looking at on-chain data, the Market Value to Realized Value (MVRV) is at 1.27, while Binance data shows it to be around 1.0, both values indicating Ethereum is in a neutral to fair value zone, suggesting a period of stability before the next major trend emerges. Meanwhile, the recent market recovery kick-started after ETH retested the realized price of whale addresses, indicating that large market players are bolstering their holdings. XWIN Research Japan supports this theory, noting that Ethereum Treasury BitMine has boosted its market holdings to 3.63 million ETH. Additionally, a BlackRock client recently acquired tens of millions of dollars’ worth of ETH, further reinforcing the strength of current market demand. However, despite this robust market demand, ETH Spot ETF net outflows for November hit $1.42 billion, indicating there is significant selling pressure in the market. Related Reading: Ethereum Fusaka Will Be ‘The Most Bullish Upgrade’ Ever, Pundit Claims Ethereum Market Outlook At the time of writing, Ethereum trades at $3,003, reflecting a 0.22% loss in the past day. Despite its gains in the last week, the altcoin is still down by 22.34% over the last month, suggesting the majority of short-term holders are in losses. XWIN Research Japan explains that although the overleveraged position has been cleared out with market whales now ramping up their holding, Ethereum remains in a “bottom-building phase”. Therefore, investors should still anticipate a “choppy, sell-on-rally” price action in the short term. The analysts predict a major trend reversal with time as the current price area becomes increasingly attractive to investors for massive accumulation opportunities. Featured image from Freepik, chart from Tradingview",Ethereum|ethereum|Ethereum Futures Market|Ethereum open interest|ethusd|ETHUSDT|funding rates,EN,0,0,ASIA|ETH|MARKET|TRADING|CRYPTOCURRENCY,"{'name': 'NewsBTC', 'img': 'https://images.cryptocompare.com/news/default/newsbtc.png', 'lang': 'EN'}",newsbtc,2025-11-30 09:00:56
