id,guid,published_on,imageurl,title,url,body,tags,lang,upvotes,downvotes,categories,source_info,source,date
56568812,https://www.cryptopolitan.com/?p=885460,1767056400,https://resources.cryptocompare.com/news/43/56568812.jpeg,Ripple (XRP) Could Stay Stuck As This Top Cheap Crypto Shows Huge Growth,https://www.cryptopolitan.com/ripple-xrp-could-stay-stuck-as-this-top-cheap-crypto-shows-huge-growth/,"The price of Ripple (XRP) is currently around $1.85, down by 11% for the year, with its two-year streak of growth coming to an end. It can be seen that a significant number of XRP investors have been forced to sell their holdings at a loss rather than waiting for it to recover. Transaction volumes on the XRP network are also down. The cryptocurrency must break above $2.10 to avoid having a negative year, but there is currently an underlying trend against it. At the same time, money is flowing out from larger, inactive assets to Mutuum Finance (MUTM) . This is a project that is considered to be the cheap cryptocurrency currently available, with expected growth of around 55x from its presale price. Weakness of XRP The actions of the participants in the Ripple community have changed. Typically, serious investors have held on to their investments even in the face of falling prices, but now they have started selling, but at a loss, and this is a sign of a higher degree of risk aversion. Although XRP had positive periods in 2023 and another positive period in 2024, the year 2025 seems to present a very different scenario. There is a definite decrease in the community activity, which shows a lack of interaction in the network. Moreover, the current price needs to stay above $1.85 to prevent a possible movement to the level of $1.70. A breakout above the levels of $1.94 and then above $2.00 is a condition for the start of a recovery. Mutuum Finance Presale: Final Chance at a Low Price Outflow from slower assets has been beneficial in DeFi projects with concrete roadmaps. Mutuum Finance (MUTM) has become one of the best options by involving an open and multi-phased presales process. It has already raised $19.5 million with over 18,600 participants. MUTM currently find ourselves in Phase 6, with tokens retailing at $0.035 every one. This particular phase is 99% sold out. This marks the final chance to invest at this rate before increasing tokens to $0.040 in Phase 7. At $0.06 as the initial offering price, the initial investors will be able to make approximately 420% profit. Two Way Lending Framework Mutuum Finance stands out for its dual approach to lending. The first aspect uses common pools for top cryptocurrencies like Ethereum, while the second aspect allows peer-to-peer trading for meme coins. It gives users as much flexibility as possible. Users are issued distinct tokens that gather interest as time goes by. The system also uses its own fees to buy back the MUTM tokens, ensuring a stable market for them. This kind of system makes it a very safe investment option for individuals looking for growth based on real usage rather than hyped benefits. Strong Security Measures in Place to Encourage Confidence However, security does not take a back seat. Mutuum Finance is in the process of having its codes audited by leading security auditors Halborn. To add to that, they have a bug bounty program worth $50,000. These factors are essential as Mutuum Finance wishes to attract genuine investors, who have to see robust safety measures in place before opting to invest in any new venture. It is yet another factor that makes Mutuum Finance an attractive venture for risk-averse investors to invest in the Defi crypto world. Increased Institutional Investment As XRP is performing poorly and activity is dwindling, smart investors are diversifying their portfolios to other projects that have strong bases. Mutuum Finance presents a clear and defined growth prospect with their presale phase ongoing. The time frame to invest at a price of $0.035 is quickly closing down. For more information about Mutuum Finance (MUTM) visit the links below: Website: https://mutuum.com/ Linktree: https://linktr.ee/mutuumfinance",Press Release,EN,0,0,BUSINESS|MARKET|TRADING|XRP|CRYPTOCURRENCY,"{'name': 'Cryptopolitan', 'img': 'https://images.cryptocompare.com/news/default/cryptopolitan.png', 'lang': 'EN'}",cryptopolitan,2025-12-30 01:00:00
56568618,https://timestabloid.com/?p=93619,1767056438,https://resources.cryptocompare.com/news/67/default.png,Crypto Founder: You Need This Number of XRP if You’re Serious About Your Finance,https://timestabloid.com/crypto-founder-you-need-this-number-of-xrp-if-youre-serious-about-your-finance/,"Edoardo Farina, founder of Alpha Lions Academy, has emphasized that investors who are committed to building long-term wealth should consider holding a minimum of 1,000 XRP. In a post on X, Farina described this threshold as essential for meaningful exposure to potential future price growth. Establishing a Meaningful Position Farina’s recommendation focuses on scale and flexibility. At current prices just below $2 per XRP , holding 1,000 tokens represents an investment of roughly $2,000. While modest in absolute terms, Farina argues that this position provides enough leverage to take partial profits while maintaining exposure to additional gains as XRP’s market value rises. He maintains that smaller holdings may limit the investor’s capacity to benefit significantly from price appreciation. Community Trends Reinforce the Benchmark Data on wallet distribution lends weight to Farina’s argument. Among the 7.44 million XRP wallets in existence, only a small fraction hold more than 1,000 tokens. For reference, wallets holding between 500 and 1,000 XRP number 256,435, while those with 500 or fewer XRP exceed six million. This disparity highlights a concentration of larger positions within a limited group of holders. As XRP’s price increases, the cost of acquiring 1,000 tokens rises correspondingly. In October 2024, an investor could accumulate 1,000 XRP for under $500, whereas today the same holding approaches $2,000. The combination of rising prices and concentrated holdings has contributed to the perception of 1,000 XRP as a strategic milestone. Future Price Projections Support the Recommendation Farina’s guidance is tied to expectations for XRP’s long-term price trajectory. Advocates suggest that if XRP reaches $10 to $20, a 1,000-XRP position could be valued at $10,000 to $20,000. We are on X, follow us to connect with us :- @TimesTabloid1 — TimesTabloid (@TimesTabloid1) June 15, 2025 More aggressive projections, extending to triple-digit valuations, would substantially increase the financial impact, with a 1,000-XRP holding reaching hundreds of thousands of dollars at $100 per coin. Farina views early accumulation as a way to position for potential high-growth scenarios, including speculative multi-digit price targets over an extended period. Despite this bullish outlook, some analysts caution that reaching higher XRP price targets depends on adoption and market dynamics that may take years to materialize. Critics also highlight the potential for investors to take profits at lower levels rather than waiting for extreme valuations. Farina acknowledges these risks but frames his recommendation as a strategic approach for those willing to hold and wait for the potential expansion of XRP’s role in financial systems. Ultimately, Farina positions holding at least 1,000 XRP as a deliberate strategy to gain meaningful exposure while maintaining flexibility in managing positions over time. His advice underscores a conviction in XRP’s long-term potential, suggesting that investors who can commit to this threshold may be better positioned to capture future gains in the evolving crypto landscape. Disclaimer : This content is meant to inform and should not be considered financial advice. The views expressed in this article may include the author’s personal opinions and do not represent Times Tabloid’s opinion. Readers are urged to do in-depth research before making any investment decisions. Any action taken by the reader is strictly at their own risk. Times Tabloid is not responsible for any financial losses. Follow us on Twitter , Facebook , Telegram , and Google News The post Crypto Founder: You Need This Number of XRP if You’re Serious About Your Finance appeared first on Times Tabloid .",Cryptocurrency|News|XRP|XRP Holders|XRP Price,EN,0,0,BUSINESS|MARKET|TRADING|XRP|CRYPTOCURRENCY,"{'name': 'TimesTabloid', 'img': 'https://resources.cryptocompare.com/news/67/default.png', 'lang': 'EN'}",timestabloid,2025-12-30 01:00:38
56568633,https://ambcrypto.com/?p=557417,1767056440,https://images.cryptocompare.com/news/default/ambcrypto.png,"RARI crypto price doubles, trading volume up 20x: Trend reversal incoming?",https://ambcrypto.com/rari-crypto-price-doubles-trading-volume-up-20x-trend-reversal-incoming/,"Due to Bitcoin's bounce nack to $90k, many altcoins saw a noticeable uptick in prices after steady losses in recent weeks.",Altcoin|Analysis|HideCryptopanic|News|News 1|No Homepage|Social|Trading View,EN,0,0,ALTCOIN|MARKET|TRADING|ZRX|CRYPTOCURRENCY,"{'name': 'AMB Crypto', 'img': 'https://images.cryptocompare.com/news/default/ambcrypto.png', 'lang': 'EN'}",ambcrypto,2025-12-30 01:00:40
56568589,649383,1767056445,https://resources.cryptocompare.com/news/13/56568589.jpeg,Times Square Goes Crypto: XRP “589” Catches Ex-CFTC Chair’s Eye,https://bitcoinist.com/times-square-goes-crypto-xrp-589-catches-ex-cftc-chairs-eye/,"Times Square’s giant “2026” numerals were built with exactly 589 LED bulbs, and that small detail set off a wave of reactions in the XRP community — including a brief response from a one-time US regulator now working in crypto. Times Square Display Reveals 589 Bulbs According to behind-the-scenes footage and local broadcast clips, the four numerals installed above One Times Square were outfitted with a total of 589 energy-efficient LED bulbs. The figures were highlighted in video posts shared by local outlets and social feeds covering New Year preparations. The numerals stand about seven feet tall and were shown being tested in place ahead of midnight. XRP Community Notes The Coincidence Reports have disclosed that XRP holders quickly spotted the 589 count and began sharing screenshots, short clips, and commentary across social platforms. One widely viewed post asked, “589 lights for 2026 in NYC. What are the chances,” and that message was amplified by several XRP-focused accounts. The number 589 is a recurring motif in XRP social circles, and that background fed the fast spread of the content. https://t.co/b1n6aCX5Od — Caroline D. Pham (@CarolineDPham) December 28, 2025 A High-Profile Social Reaction Based on posts tracked by crypto outlets, Caroline Pham — who served as Acting Chair of the US Commodity Futures Trading Commission and is now MoonPay’s chief legal officer — reacted to the Times Square footage with rocket emojis on social media. She did not make a public statement linking the display to XRP, but her reaction was noted by community members and reported by crypto news sites. Guess how many LED bulbs the 2026 New Year’s Eve sign has in Times Square this year… pic.twitter.com/dVqpoJPM5n — NotFinancialAdvice.Crypto (@NFAdotcrypto) December 27, 2025 What This Means For Markets And Messaging This moment appears to be driven by community interest rather than by any formal marketing tie between Times Square organizers and crypto firms. Major news coverage of the New Year setup focused on the event logistics and lighting; mainstream outlets did not report any official endorsement or link to XRP. The social attention did, however, generate a spike in shares and comments within crypto circles, as users posted memes, videos, and theories. How Observers Are Framing It Many posts framed the coincidence as playful symbolism rather than a signal with financial meaning. Analysts and journalists who follow crypto culture warn readers that such coincidences should not be treated as financial guidance. Based on the coverage so far, the item is best read as social media noise that reflects how online communities find patterns and share them rapidly. No Official Endorsement From Organizers Reports have made clear that Times Square event teams and broadcast partners did not announce any connection to XRP or other tokens. The 589 LED total was presented as a production detail for viewers and photographers, not as a coded message. That separation between event facts and online interpretation is central to how this story has played out. Featured image from NYCTourism, chart from TradingView",Crypto News|Altcoin|crypto|new year|new york|NYC|One Times Square|XRP,EN,0,0,ALTCOIN|COMMODITY|MARKET|XRP|CRYPTOCURRENCY,"{'name': 'Bitcoinist', 'img': 'https://images.cryptocompare.com/news/default/bitcoinist.png', 'lang': 'EN'}",bitcoinist,2025-12-30 01:00:45
56568578,https://www.newsbtc.com/?p=870725,1767056454,https://resources.cryptocompare.com/news/21/56568578.jpeg,Chainlink Shows Strong Accumulation Signal: LINK Exchange Liquidity Dries Up,https://www.newsbtc.com/chainlink-news/chainlink-shows-strong-accumulation-signal-link-exchange-liquidity-dries-up/,"Chainlink is trading under sustained pressure as the price continues to struggle below the $13 level, failing to regain the bullish momentum that defined earlier phases of the market cycle. Repeated attempts to reclaim higher ground have been rejected, reinforcing a cautious outlook among traders. As broader market sentiment remains fragile, a growing number of analysts are warning that LINK could face additional downside before a meaningful recovery takes shape. Related Reading: Trust Wallet Exploit Drains $7M: Hundreds Of Users Affected Despite the weak price action, on-chain data tells a more nuanced story. Analyst at CryptoQuant, known as CryptoOnchain, reports that recent market data reveals a compelling convergence between on-chain metrics and technical structure, pointing to growing accumulation activity at current levels. While price remains compressed, underlying behavior suggests that larger market participants may be positioning quietly rather than exiting. This divergence between declining price and improving on-chain signals is often observed during transitional phases of the market, when selling pressure begins to fade, but confidence has not yet returned. According to CryptoOnchain, indicators tracking exchange flows and holder behavior show signs of significant buying interest emerging beneath the surface, even as LINK struggles to attract speculative demand. Exchange Outflows and Long-Term Support Point to Accumulation The analysis highlights a notable shift in Chainlink’s on-chain and technical dynamics, starting with exchange netflows. According to the Binance Altcoins Token Netflow 7-day chart, Chainlink has seen a substantial withdrawal from Binance over the past week, with total outflows approaching $50 million. This magnitude stands out when compared with other large-cap altcoins such as Uniswap (UNI) or The Sandbox (SAND), which have not experienced similar capital movements over the same period. In on-chain analysis, large and sustained exchange outflows are commonly interpreted as a reduction in immediate selling pressure. Rather than preparing to sell, holders appear to be moving LINK into self-custody or long-term storage, signaling a shift toward holding behavior. This type of activity is often associated with accumulation phases, particularly when it occurs during periods of weak price action. At the same time, the technical structure reinforces the on-chain signal. The LINK/USDT daily chart shows price resting directly on a long-term bullish trendline that has acted as dynamic support since 2020. Historically, this level has consistently attracted demand and limited deeper drawdowns during corrective phases. The convergence of heavy exchange outflows and a retest of major historical support sends a strong signal of smart money accumulation. It suggests that larger investors view current levels as a strategic entry zone. Defending this support remains critical, as holding it would preserve Chainlink’s long-term bullish structure and increase the probability of a future trend reversal. Related Reading: Why $100,000 Is Bitcoin’s Most Important Resistance Level LINK Testing Structural Demand Chainlink (LINK) continues to trade under pressure, with price hovering around the $12.50 level on the 3-day chart after an extended corrective phase. The structure shows a clear loss of bullish momentum following repeated rejections from the $20–$25 region earlier in the cycle. Since that peak, LINK has established a sequence of lower highs, confirming a medium-term downtrend that remains intact. From a technical perspective, LINK is currently trading below its short- and medium-term moving averages, which have rolled over and are now acting as dynamic resistance. The 50-period moving average sits well above the current price, reinforcing the idea that recent rebounds have been corrective rather than impulsive. The longer-term moving average, however, is flattening near current levels, suggesting that selling pressure may be slowing as price approaches a historically important zone. Related Reading: Ethereum Bearish Structure Meets Bullish Supply Signal – What Happens Next The $12–$13 range stands out as a key support area. This level has acted as a pivot multiple times over the past two years, repeatedly attracting demand during periods of broader market weakness. The fact that LINK is consolidating rather than breaking down aggressively suggests that sellers are losing momentum. Volume behavior supports this view. While sell-offs earlier in the year were accompanied by sharp volume spikes, recent price action shows reduced participation, indicating distribution may be giving way to stabilization. For LINK to signal a meaningful trend reversal, bulls must reclaim the $15–$16 zone. Featured image from ChatGPT, chart from TradingView.com",Chainlink News|chainlink|Chainlink accumulation|Chainlink analysis|Chainlink Exchange Supply|Chainlink news|Chainlink Whale Transactions|Link|linkusdt,EN,0,0,EXCHANGE|LINK|MARKET|TRADING|CRYPTOCURRENCY,"{'name': 'NewsBTC', 'img': 'https://images.cryptocompare.com/news/default/newsbtc.png', 'lang': 'EN'}",newsbtc,2025-12-30 01:00:54
56569152,https://en.coinotag.com/breakingnews/bitcoin-driven-crypto-market-in-extreme-fear-as-fear-and-greed-index-drops-to-23-on-december-30,1767056608,https://resources.cryptocompare.com/news/77/56569152.jpeg,Bitcoin-Driven Crypto Market in Extreme Fear as Fear and Greed Index Drops to 23 on December 30,https://en.coinotag.com/breakingnews/bitcoin-driven-crypto-market-in-extreme-fear-as-fear-and-greed-index-drops-to-23-on-december-30,Bitcoin-Driven Crypto Market in Extreme Fear as Fear and Greed Index Drops to 23 on December 30,Breaking News,EN,0,0,MARKET,"{'name': 'CoinOtag', 'img': 'https://resources.cryptocompare.com/news/77/default.png', 'lang': 'EN'}",coinotag,2025-12-30 01:03:28
56569156,https://www.cryptopolitan.com/?p=885863,1767057164,https://resources.cryptocompare.com/news/43/56569156.jpeg,SEC Corporation Finance deputy director set to retire after shaping crypto policy,https://www.cryptopolitan.com/sec-finance-deputy-director-set-to-retire/,"Cicely LaMothe, the deputy director of the Division of Corporation Finance at the Securities and Exchange Commission (SEC), who has greatly contributed to shaping the agency’s approach towards the crypto industry, is set to retire soon. News regarding LaMothe’s retirement was initially revealed by the agency, which cited her statement dated Monday, December 29, in which she noted, “The work has been very challenging yet rewarding, and I have learned a lot from the dedicated people who work hard every day for this important mission.” The development marks the end of a 24‑year tenure during which she held multiple senior roles, most recently serving as Deputy Director for Disclosure Operations. She also acted as the division’s leader until James Moloney was appointed Director on September 30, 2025. LaMothe presents herself as a strong supporter of crypto Over the past year, LaMothe has been responsible for several key staff statements , particularly regarding the crypto industry. An example of these statements includes one that declared meme coins are not categorized as securities, and another that presented the commission’s perspective on staking . Moreover, apart from her role in the crypto industry, sources acknowledged that LaMothe took the initiative to guide policy recommendations for firms submitting draft registration statements, in addition to other responsibilities. Her work helped crystallize regulatory views on whether certain digital assets should be treated as securities and clarified the SEC’s stance on hot‑button issues like memecoins and staking activities Notably, SEC officials joined the agency’s Division of Corporation Finance in 2002. At this time, LaMothe assumed several senior roles. Before joining this team, she worked in the private sector, is a licensed certified public accountant, and secured her bachelor’s degree in accounting from Hampton University. With these exemplary achievements, the regulatory watchdog counts LaMothe’s retirement as a significant loss to the commission. It is worth noting that her retirement news comes at a time when the agency starts its second year of embracing a new focus centered on a more supportive approach towards the crypto ecosystem. Meanwhile, reports alleged that since the start of US President Donald Trump’s tenure in office and later under the leadership of a new chair, the SEC has given a green light to listing standards for several crypto exchange-traded funds (ETFs). This approval marked a significant milestone in the cryptocurrency industry, as it enabled several firms to introduce ETFs that can track assets such as DOGE , SOL, and XRP. Another key achievement the industry witnessed was the SEC’s decision to withdraw various enforcement cases raised against prominent crypto companies. The agency also initiated “Project Crypto” to revise the commission’s regulations concerning digital assets. The SEC encounters several retirements this year The SEC publicly stated that Nekia Hackworth Jones, who assumed two crucial roles in the SEC’s Division of Enforcement, namely Deputy Director of the Division of Enforcement (Southeast) and, before that, Regional Director of the Atlanta Regional Office, completed her tenure in December of this year. In a statement, Jones noted that, “As both Atlanta Regional Director and Deputy Director overseeing the Home Office along with the Atlanta and Miami regional offices, I have witnessed my colleagues at this agency show an unwavering dedication to protecting investors, excellent judgment in fulfilling our mission, and impressive knowledge in all areas of the securities industry.” Interestingly, the agency had signaled a major staff cut earlier this year. At this particular moment, several workers had decided to accept voluntary buyouts and resignations after the Trump administration instructed a significant restructuring of the federal workforce. Sources familiar with the situation indicated that approximately 500 to 700 workers on the SEC’s team were expected to be laid off. A large percentage of the impacted employees came from the agency’s enforcement, examination, and legal divisions. Get seen where it counts. Advertise in Cryptopolitan Research and reach crypto’s sharpest investors and builders.",News|U.S. SEC,EN,0,0,BUSINESS|DOGE|EXCHANGE|REGULATION|CRYPTOCURRENCY,"{'name': 'Cryptopolitan', 'img': 'https://images.cryptocompare.com/news/default/cryptopolitan.png', 'lang': 'EN'}",cryptopolitan,2025-12-30 01:12:44
56569644,https://en.coinotag.com/secs-cicely-lamothe-retires-amid-doge-etf-approvals-and-meme-coin-guidance,1767057691,https://resources.cryptocompare.com/news/77/56569644.jpeg,SEC’s Cicely LaMothe Retires Amid DOGE ETF Approvals and Meme Coin Guidance,https://en.coinotag.com/secs-cicely-lamothe-retires-amid-doge-etf-approvals-and-meme-coin-guidance,"Cicely LaMothe, SEC Deputy Director of Corporation Finance, retires after 24 years shaping crypto policies, including statements clarifying meme coins as non-securities and staking rules. Her exit aligns with the agency's shift to a supportive crypto stance amid ETF approvals and enforcement changes. LaMothe oversaw key crypto guidance on meme coins and staking. Her 24-year [...]",News|Regulation,EN,0,0,DOGE|REGULATION|CRYPTOCURRENCY,"{'name': 'CoinOtag', 'img': 'https://resources.cryptocompare.com/news/77/default.png', 'lang': 'EN'}",coinotag,2025-12-30 01:21:31
