id,guid,published_on,imageurl,title,url,body,tags,lang,upvotes,downvotes,categories,source_info,source,date
57683696,https://bitcoinworld.co.in/?p=268110,1770084311,https://resources.cryptocompare.com/news/82/default.png,Binance SEI Suspension: Strategic Pause for Sei Network’s Crucial Upgrade,https://bitcoinworld.co.in/binance-sei-suspension-network-upgrade/,"BitcoinWorld Binance SEI Suspension: Strategic Pause for Sei Network’s Crucial Upgrade Global cryptocurrency exchange Binance announced a temporary suspension of Sei (SEI) deposits and withdrawals on February 3, 2025, implementing strategic maintenance to support the blockchain’s upcoming network upgrade. This procedural pause affects millions of users worldwide and demonstrates standard exchange protocol during significant blockchain developments. The suspension begins precisely at 4:30 p.m. UTC, allowing the Sei development team to implement critical protocol improvements without compromising network security. Understanding Binance’s SEI Suspension Protocol Binance routinely implements temporary suspensions during blockchain upgrades to ensure transaction integrity and user asset protection. The exchange’s announcement follows established industry standards for handling network transitions. Consequently, users cannot process SEI deposits or withdrawals during the maintenance window. However, trading SEI against other cryptocurrencies continues uninterrupted on most Binance spot trading pairs. This approach maintains market liquidity while preventing potential transaction failures during the network transition. Network upgrades represent essential blockchain evolution moments. The Sei development team coordinates these events meticulously with major exchanges. Binance’s technical team typically requires several hours to validate the upgraded network’s stability before resuming services. Historical data from previous blockchain upgrades shows that exchanges usually complete validation within 2-6 hours after network stabilization. Users should monitor official Binance announcements for specific resumption timing. Sei Network Upgrade Technical Specifications The Sei blockchain undergoes its third major protocol upgrade since launching in August 2023. This upgrade focuses on three primary technical improvements. First, the update enhances transaction processing speed through optimized consensus mechanisms. Second, it implements improved smart contract execution efficiency. Third, the upgrade introduces enhanced cross-chain communication protocols. These technical advancements position Sei competitively within the specialized trading-focused blockchain sector. Sei’s unique architecture specifically targets decentralized exchange applications. The blockchain utilizes Twin-Turbo consensus and parallel order processing. These features theoretically enable sub-second transaction finality. The current upgrade potentially reduces this latency further. Network validators must install new software versions before the upgrade activation height. Successful implementation requires approximately 67% validator participation for seamless transition. Comparative Analysis of Exchange Handling Procedures Different cryptocurrency exchanges implement varying protocols during blockchain upgrades. The following table illustrates standard industry approaches: Exchange Deposit/Withdrawal Handling Trading Continuity Average Resumption Time Binance Suspended during upgrade Usually continues 2-6 hours post-upgrade Coinbase Suspended during upgrade Often paused 4-8 hours post-upgrade Kraken Suspended during upgrade Sometimes continues 3-7 hours post-upgrade Binance typically maintains trading continuity during upgrades when technically feasible. This approach provides market participants continued access while preventing deposit/withdrawal complications. The exchange’s infrastructure handles multiple blockchain upgrades simultaneously across different networks. Technical teams monitor each upgrade’s progress through dedicated communication channels with development teams. User Impact and Recommended Actions SEI holders on Binance should complete several precautionary steps before the suspension window. First, users must finalize any pending SEI deposits before 4:30 p.m. UTC on February 3. Second, withdrawal requests require submission several hours before the deadline to ensure processing. Third, users should verify their SEI wallet addresses remain accurate for post-upgrade transactions. Fourth, monitoring official Binance announcements provides resumption timing updates. The suspension affects only deposit and withdrawal functions. Key user activities remain available during the maintenance period: SEI trading continues on most spot markets Portfolio viewing functions normally Account management features remain accessible Other cryptocurrency transactions proceed unaffected Users planning time-sensitive SEI transactions should consider completing them before the suspension begins. Historical upgrade patterns suggest normal operations resume within hours after network stabilization. However, unexpected technical complications occasionally extend maintenance periods. Binance’s customer support team typically provides regular updates through official channels during extended incidents. Blockchain Upgrade Industry Context Network upgrades represent fundamental blockchain maintenance procedures. Major protocols like Ethereum, Cardano, and Solana undergo regular scheduled upgrades. These events implement security improvements, feature enhancements, and performance optimizations. The cryptocurrency industry developed standardized upgrade procedures over the past decade. Exchanges now coordinate closely with development teams to minimize user disruption. Sei’s upgrade follows established blockchain governance patterns. The development team published upgrade specifications weeks before implementation. Network validators received detailed technical documentation. Exchange integration teams prepared necessary infrastructure adjustments. This coordinated approach minimizes potential network fragmentation or consensus issues. Successful upgrades typically demonstrate blockchain project maturity and technical competence. Security Considerations During Network Transitions Blockchain upgrades introduce temporary security considerations that exchanges must address. First, network validators transition to new software versions at specific block heights. Second, transaction formats sometimes change between protocol versions. Third, smart contract execution parameters may require adjustment. Binance’s suspension prevents users from sending transactions to outdated addresses or using deprecated transaction formats. The exchange’s security protocols during upgrades include multiple verification layers. Technical teams monitor network health indicators throughout the transition. Automated systems detect abnormal transaction patterns. Manual verification confirms upgrade completion before resuming services. These comprehensive measures protect user assets during technically complex blockchain transitions. Historical data shows minimal security incidents during properly coordinated upgrades. Market Implications and Historical Precedents Temporary deposit/withdrawal suspensions typically cause minimal market impact when properly communicated. SEI’s trading volume may experience moderate fluctuations around the upgrade period. However, fundamental network improvements often generate positive long-term valuation effects. Previous blockchain upgrades demonstrate this pattern consistently. For instance, Ethereum’s London upgrade in August 2021 preceded significant network adoption increases despite temporary exchange suspensions. The cryptocurrency market developed sophisticated understanding of upgrade procedures over recent years. Experienced traders typically anticipate temporary liquidity variations around upgrade events. Arbitrage opportunities sometimes emerge between exchanges with different suspension policies. However, these opportunities generally involve minimal profit margins due to efficient market mechanisms. Most market participants view properly executed upgrades as positive network development indicators. Conclusion Binance’s temporary SEI suspension represents standard industry practice during essential blockchain infrastructure improvements. The Sei network upgrade enhances transaction processing capabilities and network security features. Users should complete time-sensitive transactions before the February 3 deadline while recognizing that trading continues during most of the maintenance period. This Binance SEI suspension demonstrates the cryptocurrency industry’s maturation in handling complex technical transitions with minimal user disruption. Successful upgrades typically strengthen blockchain networks and improve long-term ecosystem viability. FAQs Q1: Can I still trade SEI on Binance during the suspension? A1: Yes, SEI trading continues on most Binance spot markets during the suspension. Only deposit and withdrawal functions temporarily pause to ensure transaction integrity during the network upgrade. Q2: How long will the SEI suspension last on Binance? A2: Binance hasn’t specified an exact duration, but similar blockchain upgrades typically require 2-6 hours for exchange validation after network stabilization. Monitor official Binance announcements for resumption timing. Q3: Will my SEI tokens be safe during the suspension? A3: Yes, SEI tokens remain securely stored in Binance wallets during the suspension. The temporary pause prevents transaction issues during the network transition but doesn’t affect token security. Q4: What happens if I have a SEI transaction in progress when suspension begins? A4: Transactions initiated before the suspension typically complete normally. However, transactions still processing when suspension begins may experience delays until services resume. Submit transactions well before the deadline. Q5: Do other exchanges also suspend SEI during the upgrade? A5: Most major exchanges implement similar temporary suspensions during blockchain upgrades, though timing and duration may vary. Check each exchange’s official announcements for specific SEI handling procedures. This post Binance SEI Suspension: Strategic Pause for Sei Network’s Crucial Upgrade first appeared on BitcoinWorld .",Crypto News|BINANCE|BLOCKCHAIN|CRYPTOCURRENCY|Exchange|SEI,EN,0,0,BLOCKCHAIN|EXCHANGE|BNB|SEI|CRYPTOCURRENCY,"{'name': 'Bitcoin World', 'img': 'https://resources.cryptocompare.com/news/82/default.png', 'lang': 'EN'}",bitcoinworld,2026-02-03 02:05:11
57683872,https://en.coinotag.com/analysis/bnb-technical-analysis-february-3-2026-weekly-strategy,1770084428,https://resources.cryptocompare.com/news/77/57683872.jpeg,"BNB Technical Analysis February 3, 2026: Weekly Strategy",https://en.coinotag.com/analysis/bnb-technical-analysis-february-3-2026-weekly-strategy,"BNB maintains downtrend despite limited weekly rise, $728 support test critical. BTC correlation and multi-TF confluence require level-focused approach for strategic positions.",Analysis,EN,0,0,BTC|MARKET|TRADING|BNB|CRYPTOCURRENCY,"{'name': 'CoinOtag', 'img': 'https://resources.cryptocompare.com/news/77/default.png', 'lang': 'EN'}",coinotag,2026-02-03 02:07:08
57683899,https://decrypt.co/?p=356736,1770084625,https://resources.cryptocompare.com/news/44/57683899.jpeg,"Musk Folds xAI Into SpaceX, Cites Limits on Earth-Based AI Infrastructure",https://decrypt.co/356736/musk-xai-spacex-limits-earth-based-ai-infrastructure,"Elon Musk says power and cooling constraints on Earth are pushing AI compute into orbit, with Starship central to the plan.",Artificial Intelligence,EN,0,0,OTHER,"{'name': 'Decrypt', 'img': 'https://images.cryptocompare.com/news/default/decrypt.png', 'lang': 'EN'}",decrypt,2026-02-03 02:10:25
57684105,https://en.coinotag.com/sbf-praises-trump-btc-below-80k,1770085124,https://resources.cryptocompare.com/news/77/57684105.jpeg,SBF Praises Trump: BTC Below 80K,https://en.coinotag.com/sbf-praises-trump-btc-below-80k,"Sam Bankman-Fried praised Trump and criticized Biden. BTC fell below MicroStrategy's cost basis to $78,764. RSI oversold, strong supports in the 74K-78K band. Trump pardon probability 17%.",Crypto News,EN,0,0,BTC|CRYPTOCURRENCY,"{'name': 'CoinOtag', 'img': 'https://resources.cryptocompare.com/news/77/default.png', 'lang': 'EN'}",coinotag,2026-02-03 02:18:44
57684191,63e4e2a7-4650-4f4b-9db7-a19563015423,1770085493,https://resources.cryptocompare.com/news/5/57684191.jpeg,Here is why Ethereum's ‘brutal stumble’ looks exactly like the start of the last bull run: Asia Morning Briefing,https://www.coindesk.com/markets/2026/02/03/here-is-why-ethereum-s-brutal-stumble-looks-exactly-like-the-start-of-the-last-bull-run-asia-morning-briefing,"Crypto could be getting ready to gallop as the year of the horse sets up a fresh run higher across ETH, BTC, and other digital assets.",Markets|btc|btc price|News,EN,0,0,ASIA|ETH|MARKET|TRADING|CRYPTOCURRENCY,"{'name': 'CoinDesk', 'img': 'https://resources.cryptocompare.com/news/5/default.png', 'lang': 'EN'}",coindesk,2026-02-03 02:24:53
57684200,https://cryptonews.com/?p=482252,1770085502,https://resources.cryptocompare.com/news/52/57684200.jpeg,Asia Market Open: Bitcoin Steadies Around $78K As Calm Returns To Asian Markets,https://cryptonews.com/news/bitcoin-price-calm-returns-to-asian-markets-asia-market-open/,"Bitcoin traded near $78,000 early Tuesday as Asian markets regained their footing after a bruising stretch of volatility in precious metals, with traders taking some comfort from a sharp pickup in US factory activity overnight. Equities across the region pushed higher. Japan’s Nikkei jumped 2.5% to claw back Monday’s losses, South Korea’s KOSPI rose 4%, and futures pointed to a rebound in Hong Kong, as investors stepped back into risk after last week’s whipsaw. US markets also looked steadier at the open, with S&P 500 futures up 0.3% as traders lined up for a busy run of earnings in the next few sessions. Market snapshot Bitcoin : $78,719, up 2% Ether : $2,334, up 1.8% XRP : $1.61, up 0.5% Total crypto market cap: $2.72 trillion, up 2.6% Liquidations Mount As Sentiment Turns Against Leverage Crypto, though, still carried the scars of the recent sell-off. Bitcoin investors liquidated $2.56B in recent days, CoinGlass data showed, after digital assets slid alongside equities and metals in a broader risk retreat. The wipeouts in both short and long Bitcoin positions remained well below the record $19B in crypto liquidations that followed President Donald Trump’s tariff announcement on China, even so the latest wave underscored how quickly leverage can unravel when sentiment turns. Traders also kept a close eye on metals after violent swings tied to Trump’s decision to nominate Kevin Warsh as his pick to lead the Federal Reserve. Kevin Warsh has described Bitcoin as an ""important asset,"" and he could soon lead the world's most influential central bank #FederalReserve #BTC https://t.co/zjD4vw3Wto — Cryptonews.com (@cryptonews) January 30, 2026 Investors see Warsh as more inclined to shrink the Fed’s balance sheet, a stance that can push bond yields higher and sap the appeal of assets that offer no yield. By Tuesday morning in Asia, the selling pressure eased and prices snapped back. Gold rose 3% to $4,800 an ounce, nearly 9% above Monday’s lows, while silver climbed 5% to $83.34. The latest moves followed a forced unwind in crowded positions that spilled across markets, as traders sold other holdings to meet losses elsewhere. “The broader flow picture suggests a clear risk-off rotation, with investors reallocating toward cash and gold amid rising macroeconomic and political uncertainty,” Bitfinex analysts said. Earnings Optimism Offsets Rate And Yield Concerns Macro data helped set the tone. US factory activity expanded for the first time in a year in January, PMI figures showed, nudging yields higher without materially shifting expectations for rate cuts later on. Treasury markets held steady in Asia, with benchmark 10-year yields around 4.275% in Tokyo and two-year yields near 3.57%, after the front end ticked higher in New York. Wall Street closed higher on Monday, lifted by chipmakers and other AI-linked names, while Alphabet shares hit a record high ahead of results later this week. Disney sank 7.4% after warning about a drop in international visitors to its US theme parks and weaker performance in its TV and film division, with AMD and Super Micro Computer due to report after the bell on Tuesday. In Australia, markets looked ahead to a central bank decision later Tuesday. A resilient jobs market and a hotter-than-expected fourth-quarter inflation print left traders pricing in a 25 basis point rate hike, Australian shares rose 1.3% early, and the Australian dollar held firm at $0.6958 after its strongest monthly rise in three years in January. Currencies also settled after last week’s sharp dollar swing. The euro traded around $1.18, while the yen hovered near 155.54 per dollar, giving back about half the gains it made during a burst of speculation about possible joint US-Japan action to support the Japanese currency. The post Asia Market Open: Bitcoin Steadies Around $78K As Calm Returns To Asian Markets appeared first on Cryptonews .",Blockchain News|Asia|Bitcoin,EN,0,0,ASIA|BTC|MARKET|MACROECONOMICS|CRYPTOCURRENCY,"{'name': 'cryptonews', 'img': 'https://images.cryptocompare.com/news/default/cryptonews.png', 'lang': 'EN'}",cryptonews,2026-02-03 02:25:02
