id,guid,published_on,imageurl,title,url,body,tags,lang,upvotes,downvotes,categories,source_info,source,date
59028465,https://bitcoinworld.co.in/?p=284773,1773009311,https://resources.cryptocompare.com/news/82/default.png,Historic Transition: Iran Elects Mojtaba Khamenei as New Supreme Leader,https://bitcoinworld.co.in/iran-elects-mojtaba-khamenei-supreme-leader/,"BitcoinWorld Historic Transition: Iran Elects Mojtaba Khamenei as New Supreme Leader TEHRAN, Iran – In a landmark decision with profound implications for the Middle East, Iran’s Assembly of Experts has elected Mojtaba Khamenei as the nation’s new Supreme Leader. This pivotal transition follows the passing of his father, Ayatollah Seyyed Ali Khamenei, and marks only the third leadership change in the history of the Islamic Republic. The 56-year-old cleric, long considered a powerful behind-the-scenes operator, now assumes ultimate authority over Iran’s political, military, and religious institutions. Mojtaba Khamenei Assumes Supreme Leadership The Assembly of Experts announced the appointment after a decisive vote during a special closed-door session. Consequently, the 88-member body of senior clerics concluded an extensive review process. The assembly’s statement emphasized the constitutional mandate guiding their selection. Furthermore, the transition represents a critical moment for Iran’s political stability. Mojtaba Khamenei’s elevation confirms years of speculation about the succession. Previously, he maintained a notably low public profile despite his significant influence. Historically, the Supreme Leader holds ultimate authority in Iran’s complex political system. This position oversees the executive, legislative, and judicial branches. Moreover, the leader commands the armed forces and sets foreign policy direction. The role combines religious authority with political power uniquely. Therefore, this appointment will shape Iran’s domestic and international trajectory for decades. The Assembly of Experts’ Deliberate Process The constitutional body responsible for this appointment follows strict procedures. The Assembly of Experts must select a leader possessing both deep religious knowledge and political wisdom. Accordingly, members conducted thorough evaluations of all potential candidates. The assembly’s deliberations remained confidential throughout the process. However, analysts note the decisive nature of the final vote indicates strong consensus. Constitutional Framework and Succession Criteria Iran’s constitution outlines specific qualifications for the Supreme Leader position. Key requirements include: Religious Scholarship: Recognized expertise in Islamic jurisprudence (Ijtihad) Political Acumen: Proven understanding of contemporary issues Moral Character: Exemplary piety and justice Public Acceptance: Broad support among the population The assembly reportedly verified Mojtaba Khamenei’s credentials against each criterion meticulously. Additionally, his decades of experience within Iran’s power structures provided practical preparation. Meanwhile, international observers monitored the process for signs of internal division. Ultimately, the smooth transition suggests institutional cohesion. Mojtaba Khamenei’s Background and Influence The new leader has operated within Iran’s power centers for over three decades. He developed particularly strong connections with several key institutions: Institution Reported Connection Significance Islamic Revolutionary Guard Corps (IRGC) Advisor and liaison role Military and security influence Intelligence Agencies Oversight and coordination functions Domestic and foreign intelligence Religious Seminaries (Hawzas) Teaching and scholarly networks Religious authority foundation Economic Foundations (Bonyads) Administrative experience Control over significant resources These relationships provide him with substantial operational knowledge. However, his relative youth compared to previous leaders introduces new dynamics. At 56, he represents a generational shift within the leadership. Consequently, his approach may blend traditional values with contemporary methods. Regional and International Implications The leadership change occurs during a period of regional tension and diplomatic challenges. Several immediate areas will test the new Supreme Leader’s approach: Nuclear Negotiations: Iran’s stance on reviving the JCPOA agreement Regional Proxy Networks: Support for groups across the Middle East Economic Sanctions: Strategies for mitigating international pressure Domestic Unrest: Addressing periodic public protests and discontent Regional powers are analyzing the transition carefully. Similarly, global powers await policy signals. Meanwhile, international markets monitor energy supply implications. Therefore, initial statements and appointments will receive intense scrutiny. Historical Context of Iranian Leadership Transitions Iran has experienced only two previous successions since the 1979 Revolution. Firstly, Ayatollah Ruhollah Khomeini established the Islamic Republic. Subsequently, Ayatollah Ali Khamenei succeeded him in 1989. Each transition shaped Iran’s development profoundly. Now, the third transition introduces both continuity and potential change. The late Ayatollah Khamenei led Iran for 35 years through multiple challenges. His tenure witnessed the Iran-Iraq War, nuclear development, and shifting international relations. Meanwhile, he consolidated the Supreme Leader’s institutional authority significantly. Consequently, his successor inherits a powerful but complex system. Conclusion The election of Mojtaba Khamenei as Iran’s new Supreme Leader represents a historic moment for the nation and the wider region. The Assembly of Experts has navigated a critical constitutional process during a challenging period. While the new leader brings substantial experience within Iran’s power structures, his public leadership approach remains untested. The international community now observes how he will address Iran’s domestic pressures and foreign policy dilemmas. Ultimately, this leadership transition will influence Middle Eastern geopolitics and global energy markets for years to come. FAQs Q1: What is the Assembly of Experts? The Assembly of Experts is an 88-member body of senior Islamic clerics in Iran. They are responsible for appointing, supervising, and potentially dismissing the Supreme Leader according to the country’s constitution. Q2: How does Mojtaba Khamenei’s leadership differ from his father’s? While maintaining ideological continuity, Mojtaba Khamenei is significantly younger (56 versus 85 at his father’s passing) and has operated more within military and intelligence circles. His leadership style and policy priorities will become clearer through initial appointments and statements. Q3: What immediate challenges does the new Supreme Leader face? Key challenges include reviving the nuclear deal negotiations, addressing economic sanctions, managing regional proxy relationships, and responding to periodic domestic unrest over economic conditions and social restrictions. Q4: How does this transition affect Iran’s foreign policy? While dramatic shifts are unlikely initially, the new leader may recalibrate approaches to negotiations, regional conflicts, and relationships with global powers based on his security background and assessment of current geopolitical realities. Q5: What is the significance of the Supreme Leader’s role in Iran’s government? The Supreme Leader is the highest-ranking political and religious authority in Iran. He controls the armed forces, intelligence agencies, judiciary, and media while setting overarching policy directions, making the position more powerful than the presidency. This post Historic Transition: Iran Elects Mojtaba Khamenei as New Supreme Leader first appeared on BitcoinWorld .",Crypto News|#Iran|Geopolitics|Leadership|Middle East|Politics,EN,0,0,MARKET|MACROECONOMICS,"{'name': 'Bitcoin World', 'img': 'https://resources.cryptocompare.com/news/82/default.png', 'lang': 'EN'}",bitcoinworld,2026-03-08 22:35:11
59028667,https://en.coinotag.com/analysis/eth-technical-analysis-march-8-2026-will-it-rise-or-fall,1773009584,https://resources.cryptocompare.com/news/77/59028667.jpeg,"ETH Technical Analysis March 8, 2026: Will it Rise or Fall?",https://en.coinotag.com/analysis/eth-technical-analysis-march-8-2026-will-it-rise-or-fall,"While ETH is stuck around $1,930, if $1,941 resistance breaks, the upside could extend to $2,000; otherwise, there's a risk of dropping to $1,747 support. Volume and Bitcoin correlation will be key...",Analysis,EN,0,0,BTC|ETH|MARKET|TRADING|CRYPTOCURRENCY,"{'name': 'CoinOtag', 'img': 'https://resources.cryptocompare.com/news/77/default.png', 'lang': 'EN'}",coinotag,2026-03-08 22:39:44
59028671,https://bitcoinworld.co.in/?p=284780,1773009612,https://resources.cryptocompare.com/news/82/default.png,Brent Crude Shatters $110 Barrier as Oil Prices Skyrocket to Multi-Year High,https://bitcoinworld.co.in/brent-crude-oil-prices-surge/,"BitcoinWorld Brent Crude Shatters $110 Barrier as Oil Prices Skyrocket to Multi-Year High Global energy markets experienced a seismic shift on Tuesday, March 18, 2025, as Brent crude futures, the international oil benchmark, decisively breached the $110 per barrel mark for the first time in nearly three years. This dramatic surge in oil prices signals renewed volatility and has immediate ramifications for global inflation, transportation costs, and economic policy worldwide. Brent Crude Surge: Analyzing the $110 Breakthrough Brent crude oil prices climbed steadily throughout the trading session before finally surpassing the critical $110 threshold. Consequently, this milestone represents the highest price point since July 2022. Market analysts immediately scrutinized the move, comparing current fundamentals to those of the previous price peak. The rapid ascent follows weeks of mounting pressure on global supplies. Furthermore, trading volumes spiked significantly as institutional investors repositioned their portfolios. Several interconnected factors are driving this price action. Geopolitical tensions in key oil-producing regions have escalated recently. Simultaneously, OPEC+ has maintained its production discipline, keeping output below pre-pandemic levels. Global inventory data, published by the International Energy Agency (IEA), also shows a consistent drawdown. These elements collectively create a tight physical market. Global Energy Market Context and Historical Parallels Understanding this surge requires examining the broader energy landscape. The global economy continues its post-pandemic recovery, increasing aggregate demand for transportation and industrial fuels. Meanwhile, the energy transition has progressed unevenly, with renewable capacity additions failing to offset growing fossil fuel consumption in developing nations. This creates a persistent supply-demand imbalance. Historically, prices above $110 have triggered significant economic responses. For instance, the 2008 and 2011-2014 periods saw similar price levels, which contributed to subsequent economic slowdowns. A comparison of key metrics illustrates the current market’s intensity: Metric July 2022 Peak Current Level (March 2025) Brent Crude Price $114.50 $110.20+ Global Oil Demand 99.5 million bpd 102.8 million bpd OPEC+ Spare Capacity ~3.0 million bpd ~2.2 million bpd Strategic Petroleum Reserves (IEA) Higher levels Depleted after coordinated releases This table highlights a critical reality: demand is higher today, while buffer stocks and spare production capacity are notably lower. This fundamental tightness underpins the bullish price structure. Expert Analysis on Market Mechanics and Future Trajectory Energy market specialists emphasize the role of financial flows alongside physical fundamentals. “The breach of $110 is psychologically and technically significant,” notes Dr. Anya Sharma, Lead Commodities Strategist at the Global Markets Institute. “It confirms the breakout from a multi-month consolidation pattern and invites further momentum buying from algorithmic and speculative traders. The market is pricing in a sustained period of scarcity.” Sharma’s analysis points to several key indicators: Backwardation Strength: The futures curve shows a steep backwardation, where near-term contracts trade at a premium to later dates. This signals immediate physical tightness. Volatility Index: The OVX, or Oil Volatility Index, has jumped 25% in the past week, reflecting heightened trader uncertainty. Refinery Margins: Crack spreads, the profit margin for refining crude into products like gasoline, have widened considerably, indicating strong downstream demand. Immediate Economic Impacts and Sectoral Effects The surge in oil prices transmits rapidly through the global economy. Transportation costs rise immediately, affecting: Consumer Fuel Prices: Gasoline and diesel prices at the pump are projected to increase by 10-15 cents per gallon within weeks. Airline Operations: Aviation fuel constitutes a major cost for airlines, potentially leading to higher ticket prices and reduced profit margins. Shipping and Logistics: Freight rates for global container and bulk shipping will face upward pressure, impacting the cost of imported goods. Moreover, energy-intensive industries like manufacturing, chemicals, and agriculture face rising input costs. Central banks worldwide, already grappling with core inflation, now confront a renewed supply-side shock. This complicates monetary policy, potentially delaying interest rate cuts and prolonging tight financial conditions. Conclusion The breakthrough of Brent crude oil prices above $110 per barrel marks a pivotal moment for global markets. This surge reflects a potent combination of constrained supply, robust demand, and heightened geopolitical risk. The move will reverberate through every layer of the economy, from household budgets to corporate earnings and central bank policies. Market participants and policymakers must now navigate an environment where elevated energy costs are a persistent reality, shaping economic outcomes for the foreseeable future. FAQs Q1: What is Brent crude oil? Brent crude is a major trading classification of sweet light crude oil that serves as a primary benchmark for oil prices globally, particularly for waterborne crude from the North Sea. It is used to price approximately two-thirds of the world’s internationally traded crude oil supplies. Q2: Why is the $110 price level significant? The $110 per barrel level is significant because it represents a multi-year high not seen since July 2022. It acts as a key technical and psychological resistance level. Breaching it often triggers automated buying and signals a potential continuation of the bullish trend to market participants. Q3: How do high oil prices affect everyday consumers? High oil prices directly increase the cost of gasoline, diesel, and home heating oil. They also indirectly raise the price of almost all goods and services by increasing transportation, manufacturing, and production costs, which contributes to broader inflationary pressures. Q4: What typically causes oil prices to surge? Prices surge due to a combination of factors including geopolitical tensions in producing regions, supply disruptions, decisions by OPEC+ to limit production, stronger-than-expected global demand, declines in global inventories, and financial speculation based on these fundamentals. Q5: Could this price surge impact the transition to renewable energy? Potentially, yes. Persistently high fossil fuel prices improve the economic competitiveness of renewable alternatives like solar and wind power. However, they can also incentivize increased short-term investment in oil and gas production, potentially locking in longer-term fossil fuel dependency depending on policy responses. This post Brent Crude Shatters $110 Barrier as Oil Prices Skyrocket to Multi-Year High first appeared on BitcoinWorld .",Crypto News|#Markets|commodities|Economy|Energy|Oil,EN,0,0,BUSINESS|COMMODITY|MARKET|TRADING|MACROECONOMICS,"{'name': 'Bitcoin World', 'img': 'https://resources.cryptocompare.com/news/82/default.png', 'lang': 'EN'}",bitcoinworld,2026-03-08 22:40:12
59028738,5f2a28a1-f599-4398-bf84-97485e4c1b46,1773009816,https://resources.cryptocompare.com/news/5/59028738.jpeg,"Bitcoin tumbles below $66,000 as oil prices explode nearly 20% higher",https://www.coindesk.com/markets/2026/03/08/bitcoin-tumbles-below-usd66-000-as-oil-prices-explode-higher,There was little sign over the weekend of any de-escalation in the war against Iran.,Markets|Bitcoin News|Breaking News|top news|Crude Oil|Iran|News,EN,0,0,BTC|COMMODITY|MARKET|CRYPTOCURRENCY,"{'name': 'CoinDesk', 'img': 'https://resources.cryptocompare.com/news/5/default.png', 'lang': 'EN'}",coindesk,2026-03-08 22:43:36
59028825,https://bitcoinworld.co.in/?p=284772,1773009911,https://resources.cryptocompare.com/news/82/default.png,Cryptocurrency Futures Liquidated: Staggering $122 Million Hourly Wipeout Shakes Markets,https://bitcoinworld.co.in/cryptocurrency-futures-liquidated-122-million/,"BitcoinWorld Cryptocurrency Futures Liquidated: Staggering $122 Million Hourly Wipeout Shakes Markets A sudden and severe wave of forced position closures rocked cryptocurrency derivatives markets globally, with exchanges reporting a staggering $122 million worth of futures contracts liquidated within a single hour, signaling intense volatility and shifting trader sentiment. Cryptocurrency Futures Liquidated in Unprecedented Hourly Volume Major trading platforms, including Binance, Bybit, and OKX, recorded the massive $122 million liquidation event. This activity primarily involved long positions, where traders bet on price increases. Consequently, the rapid sell-off exacerbated downward price pressure on underlying assets like Bitcoin and Ethereum. Market data aggregators like Coinglass confirmed the figures, highlighting the scale of the event. Furthermore, the past 24-hour total reached $297 million, indicating sustained pressure. Liquidations occur automatically when a trader’s leveraged position suffers sufficient losses. Exchanges then close the position to prevent negative balances. This mechanism protects the exchange but can create cascading sell-offs. High leverage, often exceeding 20x or even 100x, magnifies both gains and losses dramatically. Long Liquidations: The majority of the $122 million stemmed from long contracts. Leverage Ratio: Excessive leverage was a key contributor to the swift wipeout. Market Catalyst: A sharp, unexpected price drop triggered the initial margin calls. Analyzing the Causes Behind the Futures Market Volatility Several interconnected factors typically converge to create such a liquidation cascade. Firstly, a sudden price movement of 3-5% in a major asset like Bitcoin can be enough to trigger margin calls on highly leveraged positions. Secondly, market sentiment often shifts rapidly based on macroeconomic news, regulatory announcements, or large wallet movements. Thirdly, the structure of the derivatives market itself, with its reliance on automated systems, can accelerate a downturn. Historical data shows similar patterns during past market corrections. For instance, the May 2021 sell-off saw over $10 billion liquidated in 24 hours. While the current event is smaller, its concentration within one hour makes it notable. Analysts often review funding rates—the fee paid between long and short position holders—for signs of excessive bullishness that precede a flush. Expert Perspective on Market Structure and Risk Market analysts emphasize that such events are inherent to leveraged trading. “Liquidations are a feature, not a bug, of futures markets,” notes a veteran derivatives trader from a Singapore-based fund. “They act as a pressure release valve but also highlight the extreme risk retail traders take with high leverage. The $122 million figure, while large, represents a controlled deleveraging within a robust system.” This perspective underscores the importance of risk management protocols for all participants. The event also impacted spot market prices temporarily. However, the broader market often absorbs these shocks, especially when driven by derivatives rather than fundamental shifts. Data from on-chain analytics firms showed no corresponding massive exodus of Bitcoin from exchange wallets, suggesting holders remained relatively calm. The Ripple Effect and Broader Market Implications The immediate effect was a noticeable spike in market volatility indices. Subsequently, trading volumes spiked across both spot and derivatives venues. Moreover, the fear and greed index, a common sentiment gauge, typically swings toward ‘extreme fear’ following such events. This can create buying opportunities for contrarian investors. For the average investor, these events illustrate the critical difference between spot trading and derivatives. Spot trading involves direct asset ownership without forced liquidation risk from leverage. Regulatory bodies in jurisdictions like the United States and the European Union continue to scrutinize leverage offerings to retail customers, citing consumer protection concerns. Recent Major Liquidation Events Comparison Date 1-Hour Liquidation 24-Hour Liquidation Primary Trigger Current Event $122 Million $297 Million Sharp BTC price drop June 2022 $280 Million $1.1 Billion Celsius network crisis January 2024 $95 Million $250 Million ETF approval sell-the-news Conclusion The $122 million cryptocurrency futures liquidated in one hour serves as a potent reminder of market volatility and leverage risks. While disruptive, these events are part of the market’s natural liquidity and risk clearance process. Understanding the mechanics of futures, leverage, and liquidation helps traders navigate the complex derivatives landscape. Ultimately, this episode reinforces the need for disciplined risk management in cryptocurrency investing. FAQs Q1: What does ‘futures liquidated’ mean? A futures liquidation is the forced closure of a leveraged derivatives position by an exchange because the trader’s collateral has fallen below the required maintenance margin, preventing further losses. Q2: Why did $122 million get liquidated in one hour? A rapid price drop triggered margin calls on many highly leveraged long positions simultaneously. Automated systems then sold the positions, creating a cascading effect that amplified the selling pressure. Q3: Does this mean the cryptocurrency market is crashing? Not necessarily. A liquidation flush often removes excessive leverage and can stabilize prices. It indicates a volatile correction within a derivatives market, not always a fundamental shift in the asset’s value. Q4: Who loses the money during a liquidation? The traders whose positions are liquidated lose their initial margin (collateral). The exchange uses these funds to close the position at the market price. The money does not vanish but is transferred to the profitable counterparties in the trades. Q5: How can traders avoid being liquidated? Traders can use lower leverage ratios, maintain higher margin balances above requirements, employ stop-loss orders, and actively monitor positions, especially during periods of high volatility and important news events. This post Cryptocurrency Futures Liquidated: Staggering $122 Million Hourly Wipeout Shakes Markets first appeared on BitcoinWorld .",Crypto News|#Derivatives|CRYPTOCURRENCY|futures|Liquidation.|market volatility,EN,0,0,EXCHANGE|MARKET|TRADING|ZRX|CRYPTOCURRENCY,"{'name': 'Bitcoin World', 'img': 'https://resources.cryptocompare.com/news/82/default.png', 'lang': 'EN'}",bitcoinworld,2026-03-08 22:45:11
59029263,https://en.coinotag.com/analysis/bnb-technical-analysis-march-8-2026-support-resistance-and-market-commentary,1773010741,https://resources.cryptocompare.com/news/77/59029263.jpeg,"BNB Technical Analysis March 8, 2026: Support, Resistance, and Market Commentary",https://en.coinotag.com/analysis/bnb-technical-analysis-march-8-2026-support-resistance-and-market-commentary,BNB is being tested at the $614 support level; MACD bull signal questions the downtrend. BTC correlation and MTF levels dominate a cautious outlook.,Analysis,EN,0,0,BTC|MARKET|TRADING|BNB|CRYPTOCURRENCY,"{'name': 'CoinOtag', 'img': 'https://resources.cryptocompare.com/news/77/default.png', 'lang': 'EN'}",coinotag,2026-03-08 22:59:01
59029388,https://ambcrypto.com/?p=576991,1773010805,https://images.cryptocompare.com/news/default/ambcrypto.png,Why U.S. lawmakers signing against CBDC could be bullish signal for XRP?,https://ambcrypto.com/why-u-s-lawmakers-signing-against-cbdc-could-be-bullish-signal-for-xrp/,U.S. lawmakers move to block a Federal Reserve CBDC as XRP Ledger activity rises and RLUSD stablecoin liquidity expands.,Altcoin|Global News|News|News 1|Ripple|Social|Trading View|ambcrypto,EN,0,0,ALTCOIN|TRADING|XRP|MACROECONOMICS|CRYPTOCURRENCY,"{'name': 'AMB Crypto', 'img': 'https://images.cryptocompare.com/news/default/ambcrypto.png', 'lang': 'EN'}",ambcrypto,2026-03-08 23:00:05
