id,guid,published_on,imageurl,title,url,body,tags,lang,upvotes,downvotes,categories,source_info,source,date
58738974,https://bitcoinworld.co.in/?p=281767,1772495711,https://resources.cryptocompare.com/news/82/default.png,Japanese Yen Plunges Below 157.50: Robust US Data Overshadows BoJ’s Cautious Stance,https://bitcoinworld.co.in/japanese-yen-weakens-usd-jpy-rate/,"BitcoinWorld Japanese Yen Plunges Below 157.50: Robust US Data Overshadows BoJ’s Cautious Stance TOKYO, May 2025 – The Japanese Yen has breached the critical 157.50 level against the US Dollar, marking its weakest position in over three decades. This significant depreciation follows the release of unexpectedly strong US economic indicators, which have starkly contrasted with the persistently dovish signals from the Bank of Japan. Consequently, market participants are now intensely focused on an upcoming speech by BoJ Governor Kazuo Ueda for any hints of a policy shift. Japanese Yen Weakens Amid Diverging Economic Fortunes The USD/JPY currency pair surged past 157.50 in early Asian trading, a move primarily fueled by robust US economic data. Specifically, recent reports showed US retail sales and industrial production exceeding forecasts. Meanwhile, inflation metrics remained stubbornly above the Federal Reserve’s target. This data reinforces the market’s expectation that the Fed will maintain higher interest rates for an extended period. In contrast, Japan’s latest Consumer Price Index (CPI) figures, while positive, have not provided the decisive momentum needed for the BoJ to signal aggressive tightening. This growing policy divergence creates a powerful tailwind for the US Dollar against the Yen. Analyzing the Upbeat US Economic Data The US economy continues to demonstrate remarkable resilience. Key data points from April 2025 include: Retail Sales Growth: Month-over-month increase of 0.8%, significantly above the 0.3% consensus estimate. Industrial Production: Rose by 0.5%, indicating sustained manufacturing strength. Core PCE Inflation: Held steady at an annual rate of 2.8%, underscoring persistent price pressures. These figures collectively suggest the Federal Reserve’s battle against inflation is not yet complete. As a result, traders have pushed back expectations for the timing of the first US rate cut. Higher US interest rates increase the yield advantage of holding Dollar-denominated assets, making the USD more attractive than the low-yielding Yen. This fundamental dynamic is the core driver behind the Yen’s current weakness. The Bank of Japan’s Delicate Balancing Act Governor Kazuo Ueda faces a complex challenge. The BoJ ended its negative interest rate policy in March 2024, but subsequent moves have been exceedingly gradual. The central bank’s primary concern remains fostering a sustainable, demand-driven inflation cycle. Japan’s wage growth, a critical component for such a cycle, has shown improvement but remains fragile. Furthermore, the government has expressed concern that a rapidly strengthening Yen could hurt the export sector. Therefore, the BoJ is carefully navigating between normalizing policy and avoiding a shock to the economy. Ueda’s upcoming speech is anticipated to reiterate this patient, data-dependent approach, offering little immediate support for the currency. Historical Context and Market Impact of a Weaker Yen The Yen’s descent below 157.50 is not an isolated event but part of a prolonged trend. The table below illustrates key milestones in the USD/JPY pair over the past two years: Date USD/JPY Level Catalyst March 2024 ~150.00 BoJ exits Negative Rates October 2024 ~155.00 Fed ‘Higher for Longer’ Rhetoric April 2025 >157.50 Strong US Data vs. BoJ Caution The impacts of this depreciation are multifaceted. For Japanese exporters like Toyota and Sony, a weaker Yen boosts the Yen-value of overseas profits, potentially enhancing corporate earnings. Conversely, it increases the cost of imported energy and raw materials, squeezing household budgets and contributing to domestic inflation. For global forex markets, the move increases volatility and forces asset managers to reassess their currency hedge ratios for Japanese investments. Expert Analysis on Future Trajectory Market strategists point to yield differentials as the dominant force. “The interest rate gap between US 10-year Treasuries and Japanese Government Bonds remains near its widest point in years,” explains a senior currency analyst at a major Tokyo bank. “Until this gap narrows meaningfully, perhaps through a definitive shift in BoJ rhetoric or softer US data, the path of least resistance for USD/JPY is higher.” Technical analysts also note that a sustained break above 158.00 could open the path toward the 160.00 psychological level, a point that might trigger verbal intervention from Japanese finance ministry officials. Conclusion The Japanese Yen weakens below the 157.50 threshold primarily due to a stark divergence in monetary policy outlooks between the US and Japan. Upbeat US economic data fortifies the case for sustained Fed hawkishness, while the Bank of Japan, under Governor Ueda, maintains a cautious normalization path focused on domestic wage and price dynamics. All eyes are now on Ueda’s forthcoming remarks, though most analysts expect continuity rather than a game-changing shift. The trajectory of the USD/JPY pair will likely hinge on the next major data prints from both economies, keeping forex markets on high alert. FAQs Q1: Why is the Japanese Yen weakening against the US Dollar? The Yen is weakening due to a significant interest rate differential. Strong US economic data suggests the Federal Reserve will keep rates high, while the Bank of Japan is moving very slowly in raising its own rates, making Dollar assets more attractive. Q2: What does USD/JPY above 157.50 mean historically? A USD/JPY rate above 157.50 represents the Yen’s weakest level against the Dollar since 1990, highlighting a profound and prolonged period of depreciation for the Japanese currency. Q3: How does a weak Yen affect the Japanese economy? It has mixed effects: it benefits major exporters by increasing the value of their overseas profits but hurts consumers and import-reliant businesses by raising the cost of imported goods, fuel, and food. Q4: What could cause the Yen to strengthen? A sudden shift in BoJ policy signaling faster rate hikes, a sharp downturn in US economic data prompting Fed rate cut expectations, or direct currency intervention by Japanese authorities could all potentially strengthen the Yen. Q5: What is the market watching in Governor Ueda’s speech? Markets will scrutinize his tone for any change in the assessment of wage-inflation dynamics. Any hint of concern over excessive Yen weakness or a faster timeline for policy normalization could trigger a short-term rally in the currency. This post Japanese Yen Plunges Below 157.50: Robust US Data Overshadows BoJ’s Cautious Stance first appeared on BitcoinWorld .",Forex News|#Bank of Japan|Forex|Japanese yen|monetary policy|US Dollar,EN,0,0,ASIA|FIAT|MARKET|TRADING|MACROECONOMICS,"{'name': 'Bitcoin World', 'img': 'https://resources.cryptocompare.com/news/82/default.png', 'lang': 'EN'}",bitcoinworld,2026-03-02 23:55:11
58739135,https://bitcoinworld.co.in/?p=281768,1772496013,https://resources.cryptocompare.com/news/82/default.png,US Military Attack on Iran: Imminent Large-Scale Assault Targets Critical Defense Infrastructure,https://bitcoinworld.co.in/us-military-attack-iran-imminent/,"BitcoinWorld US Military Attack on Iran: Imminent Large-Scale Assault Targets Critical Defense Infrastructure WASHINGTON, D.C. – March 15, 2025 – The United States military has entered preparatory phases for a substantial additional assault on Iranian military targets within the next 24 hours, according to exclusive CNN reporting citing senior defense officials. This planned US military attack on Iran represents a significant escalation following initial strikes that reportedly weakened Iranian air defense networks. Consequently, the operation now focuses on destroying critical infrastructure including missile production facilities, drone manufacturing sites, and naval capabilities. President Donald Trump previously indicated that the “real attack” had not yet commenced, suggesting this development aligns with earlier warnings. US Military Attack on Iran: Strategic Objectives and Timeline Military analysts confirm the United States possesses capability for rapid escalation. The reported 24-hour window indicates advanced planning and intelligence preparation. Furthermore, the specific targeting of missile production facilities suggests a strategic priority. These facilities represent Iran’s asymmetric warfare capabilities. The Islamic Revolutionary Guard Corps (IRGC) oversees these critical assets. Therefore, their destruction would significantly degrade Iran’s regional power projection. Historical context provides important perspective. The United States and Iran have engaged in prolonged tensions since the 1979 revolution. Recent years witnessed escalating incidents including tanker attacks, drone shootdowns, and proxy conflicts. The current situation follows months of diplomatic stalemates. International observers note concerning patterns of military posturing. Target Analysis: Missile Facilities and Naval Capabilities The reported targeting priorities reveal specific military calculations. Iran maintains extensive missile inventories across multiple categories: Short-range ballistic missiles: Primarily targeting regional neighbors Medium-range systems: Capable of reaching strategic locations Cruise missiles: Used for precision strikes against naval assets Drone manufacturing: Expanding unmanned aerial vehicle capabilities Iranian naval power centers around asymmetric warfare tactics. The Islamic Republic Navy operates numerous fast attack craft. Additionally, they maintain submarine capabilities and coastal defense systems. These assets threaten vital shipping lanes including the Strait of Hormuz. Consequently, their neutralization represents a key strategic objective for regional stability. Military Expert Analysis: Tactical Implications Former Pentagon officials emphasize operational complexities. “Targeting hardened facilities requires precise intelligence and specialized munitions,” explains Dr. Elena Rodriguez, senior fellow at the Center for Strategic Studies. “The timeline suggests pre-positioned assets and ready forces.” Rodriguez further notes potential secondary effects including civilian infrastructure damage and environmental concerns. International law requires distinction between military and civilian targets. Observers will monitor compliance with these protocols. Regional military bases provide operational platforms. The United States maintains significant presence in neighboring countries. These include facilities in Qatar, Bahrain, and the United Arab Emirates. Aircraft carriers and strategic bombers offer additional strike capabilities. Satellite imagery recently showed increased activity at several bases. This correlates with the reported preparation timeline. Regional Security Implications and Diplomatic Context Neighboring countries face immediate security concerns. Gulf Cooperation Council (GCC) members maintain complex relationships with Iran. Some nations host US military facilities while pursuing diplomatic engagement with Tehran. This creates delicate balancing acts for regional governments. Oil markets typically react strongly to Middle Eastern tensions. Energy analysts predict price volatility following military developments. The international community expresses varied responses. United Nations Secretary-General António Guterres recently called for restraint. European Union foreign policy chief Josep Borrell emphasized diplomatic solutions. Meanwhile, regional powers including Israel and Saudi Arabia monitor developments closely. Their security calculations directly connect to Iranian capabilities. Historical Precedents and Conflict Patterns Recent Middle Eastern conflicts provide relevant comparisons. The 2020 assassination of Qasem Soleimani triggered Iranian missile strikes. Those attacks caused significant damage but avoided major escalation. The 2019 attacks on Saudi oil facilities demonstrated Iranian proxy capabilities. Current tensions exceed previous incidents in scale and potential consequences. Nuclear negotiations remain stalled since 2022. The Joint Comprehensive Plan of Action (JCPOA) collapsed despite multiple revival attempts. Non-proliferation experts warn about regional arms races. Some analysts suggest military action could further destabilize non-proliferation efforts. Others argue it addresses immediate security threats. Technological Considerations and Warfare Evolution Modern conflict incorporates advanced technologies. Cyber warfare capabilities represent significant components. Both nations possess sophisticated digital attack resources. Electronic warfare systems disrupt communications and guidance systems. Space-based assets provide critical intelligence and targeting data. Drone warfare has transformed regional conflicts. Iran supplies unmanned systems to multiple proxy groups. These include Houthi forces in Yemen and militia groups in Iraq. The reported targeting of drone manufacturing addresses this proliferation. However, dispersed production facilities present targeting challenges. Conclusion The reported US military attack on Iran represents a critical development in Middle Eastern security dynamics. CNN’s reporting indicates advanced preparations for substantial strikes within 24 hours. Strategic targeting focuses on missile production, drone manufacturing, and naval capabilities. These actions follow initial operations that reportedly weakened Iranian air defenses. Regional stability faces significant tests as military preparations advance. The international community monitors developments with profound concern for broader implications. Ultimately, this US military attack on Iran could reshape regional power balances for years ahead. FAQs Q1: What specific targets does the US military plan to attack in Iran? The reported targets include missile production facilities, drone manufacturing sites, and naval capabilities. These represent critical components of Iran’s asymmetric warfare strategy and regional power projection. Q2: How reliable is the CNN reporting about the 24-hour timeline? CNN cites a high-ranking official familiar with military planning. While operational timelines can change, such reporting typically reflects actual contingency planning and preparation stages within defense establishments. Q3: What are the potential regional consequences of such an attack? Regional consequences could include retaliatory strikes against US assets, escalation through proxy groups, oil market volatility, and heightened tensions across the Middle East affecting multiple international relationships. Q4: How does this relate to previous US-Iran military engagements? This represents escalation beyond previous incidents like the 2020 Soleimani strike or 2019 Saudi facility attacks. The reported scale and targeting suggest more comprehensive military objectives against Iranian defense infrastructure. Q5: What diplomatic efforts preceded this military preparation? Diplomatic efforts included stalled nuclear negotiations, European mediation attempts, and UN calls for restraint. The military preparation suggests these diplomatic channels failed to address core security concerns to the satisfaction of military planners. This post US Military Attack on Iran: Imminent Large-Scale Assault Targets Critical Defense Infrastructure first appeared on BitcoinWorld .",Crypto News|defense|Geopolitics|Middle East|Military|Security,EN,0,0,COMMODITY|MARKET|REGULATION|TRADING,"{'name': 'Bitcoin World', 'img': 'https://resources.cryptocompare.com/news/82/default.png', 'lang': 'EN'}",bitcoinworld,2026-03-03 00:00:13
58739143,https://www.newsbtc.com/?p=884700,1772496016,https://resources.cryptocompare.com/news/21/58739143.jpeg,Bloodbath Or Buy-Zone? Bitcoin’s $66K Stagnation Hits The 25% Loss Threshold Historically Tied To Market Bottoms,https://www.newsbtc.com/bitcoin-news/bloodbath-or-buy-zone-bitcoins-66k-stagnation-hits-the-25-loss-threshold-historically-tied-to-market-bottoms/,"Bitcoin has remained in a consolidation phase since its early February breakdown below the $70,000 threshold, oscillating around the mid-$60K region without establishing a clear directional bias. The loss of $70K marked a structural shift in short-term momentum, transitioning the market from trend continuation to range-bound stabilization. While volatility has moderated, underlying stress signals suggest that the correction may not be fully resolved. Related Reading: The Distribution Trap: Why Bitcoin’s Reserve Growth Proves Sellers Still Hold The Tape According to a recent report by CryptoQuant analyst Darkfost, Short-Term Holders (STH) are still carrying substantial unrealized losses. With Bitcoin trading near $66,000, this cohort’s average unrealized loss stands at approximately 26.3%. Historically, periods in which STH losses exceed 25% tend to coincide with advanced phases of bear markets rather than early corrective pullbacks. In previous cycles, these losses have occasionally expanded toward 40% during capitulation events before a durable bottom formed. The current reading, therefore, places the market in a zone of elevated psychological pressure. Short-term participants, who are typically more reactive to price fluctuations, remain underwater, increasing the probability of volatility spikes if key levels fail. Short-Term Holder Losses Signal Late-Stage Stress and Strategic Accumulation Zones The current configuration of Short-Term Holder positioning reflects a classic late-correction dynamic. When STH cohorts begin to carry meaningful unrealized losses — particularly above the 25% threshold — market psychology shifts from optimism to stress. Historically, these zones have coincided with attractive long-term accumulation windows, not because downside risk disappears, but because forced selling pressure gradually exhausts itself. Long-term investors deploying systematic DCA strategies have often benefited from entering during these compressed conditions. The relationship between STH profitability and trend development is equally instructive. Sustained bullish expansions typically begin once the average unrealized profit of STH reclaims positive territory. That shift signals renewed structural demand strong enough to lift recent buyers back into profit. However, excessive profitability can also destabilize trends. In this cycle, readings near 20% average profit have coincided with overheated conditions and subsequent pullbacks, as profit-taking accelerates. At present, with STH deeply underwater, the broader structure remains bearish from a cyclical standpoint. Momentum has not yet transitioned into expansion. Yet paradoxically, these stress phases often represent asymmetric positioning opportunities. The key distinction lies in timeframe: tactically fragile in the short term, but strategically constructive for disciplined capital deployment. Related Reading: Ethereum’s Market Order Imbalance Hits Record Negatives: $1,850 Is Now The Line In The Sand Bitcoin Compresses Below Moving Averages as $62K–$69K Range Tightens On the 4-hour timeframe, Bitcoin remains locked in a tight consolidation band around the $66,000 level after the sharp early-February breakdown. The structure is clearly corrective: price is trading below the 50, 100, and 200-period moving averages, all of which are sloping downward. This alignment confirms short-term bearish momentum, even as volatility compresses. Repeated attempts to reclaim the 100-period moving average (green) have failed, reinforcing it as dynamic resistance near the $68,000–$69,000 zone. Meanwhile, the 200-period average (red), positioned higher around the low-$70Ks, marks a broader trend ceiling. As long as price remains beneath these levels, upside attempts are likely to encounter supply. Related Reading: Engine Stalled: How The $8 Billion ‘October Shock’ Left Bitcoin’s Spot Market In A Liquidity Trap On the downside, the $62,000–$63,000 region continues to act as horizontal support. The sharp wick earlier in February suggests aggressive liquidation-driven selling into that area, followed by a reflex bounce. However, subsequent rebounds have printed lower highs, indicating that buyers lack follow-through. Volume has tapered off compared to the breakdown phase, suggesting temporary equilibrium rather than accumulation. The current compression reflects indecision, not strength. A decisive 4-hour close above $69K would challenge the bearish structure, while a loss of $62K would likely trigger renewed downside expansion. Featured image from ChatGPT, chart from TradingView.com",Bitcoin News|bitcoin|bitcoin analysis|bitcoin bear market|Bitcoin Buy Signal|Bitcoin Cycle|Bitcoin demand|Bitcoin news|btc|BTCUSDT,EN,0,0,BTC|BUSINESS|MARKET|TRADING|CRYPTOCURRENCY,"{'name': 'NewsBTC', 'img': 'https://images.cryptocompare.com/news/default/newsbtc.png', 'lang': 'EN'}",newsbtc,2026-03-03 00:00:16
