id,guid,published_on,imageurl,title,url,body,tags,lang,upvotes,downvotes,categories,source_info,source,date
59042753,https://bitcoinworld.co.in/?p=284946,1773033312,https://resources.cryptocompare.com/news/82/default.png,Pound Sterling Plummets: US Dollar Soars on Intensifying Global Risk Aversion,https://bitcoinworld.co.in/pound-sterling-declines-us-dollar-gains/,"BitcoinWorld Pound Sterling Plummets: US Dollar Soars on Intensifying Global Risk Aversion LONDON, April 2025 – The Pound Sterling has experienced a pronounced decline against a resurgent US Dollar, as financial markets worldwide pivot toward safe-haven assets amid a sharp spike in global risk aversion. This significant currency movement reflects deep-seated investor concerns over geopolitical tensions and shifting macroeconomic expectations, placing the GBP/USD pair under intense scrutiny. Pound Sterling Decline Amidst Dollar Dominance Currency traders witnessed a substantial sell-off in the British Pound throughout the trading session. Consequently, the GBP/USD pair breached several key technical support levels. Market analysts immediately pointed to a classic flight to safety as the primary catalyst. Furthermore, the US Dollar Index (DXY), which measures the greenback against a basket of six major currencies, rallied strongly. This inverse relationship between the Pound and the Dollar highlights the latter’s enduring status as the world’s premier reserve currency during periods of uncertainty. Several interconnected factors are driving this dynamic. Firstly, renewed geopolitical friction in Eastern Europe has unsettled European markets. Secondly, disappointing economic data from China has raised fears of a global growth slowdown. Thirdly, investors are reassessing the interest rate trajectory of major central banks. The Bank of England faces a complex balancing act between controlling inflation and supporting growth, while the Federal Reserve maintains a comparatively hawkish stance. Analyzing the Drivers of Heightened Risk Aversion The surge in risk aversion is not an isolated event but the result of a confluence of global pressures. Equity markets in Asia and Europe registered broad-based losses, triggering a cascade into currency and bond markets. Investors rapidly moved capital out of perceived riskier assets and currencies, like the Pound, and into traditional havens. The US Treasury market saw significant inflows, pushing yields lower and reinforcing the Dollar’s appeal. Expert Perspective on Market Sentiment Dr. Anya Sharma, Chief Currency Strategist at Global Macro Advisors, provided context. “When volatility spikes, historical patterns reassert themselves,” she explained. “The US Dollar’s liquidity and the depth of its bond market make it the default destination for capital in a storm. The Pound, while a major currency, is more exposed to regional European risks and domestic economic headwinds, making it vulnerable to this kind of repricing.” This analysis underscores the structural reasons behind the currency pair’s movement. The price action can be summarized by key technical and fundamental shifts: Technical Breakdown: GBP/USD fell below the critical 1.2500 psychological level and its 200-day moving average. Yield Differential: The gap between US and UK government bond yields widened in favor of the Dollar. Commodity Pressure: A retreat in global oil prices negatively impacted energy-linked currencies, adding indirect pressure. Options Market: There was a notable increase in demand for puts (bearish bets) on the Pound, indicating institutional hedging. Comparative Impact on Major Currency Pairs The Dollar’s strength was broad-based but exhibited variance. While the Pound faced heavy selling, the Euro also softened, though to a lesser extent due to its own haven characteristics. In contrast, commodity-sensitive and emerging market currencies experienced even steeper declines. The following table illustrates the relative performance of major pairs during the risk-off session: Currency Pair Change (%) Key Driver GBP/USD -1.8% High UK risk exposure, broad USD demand EUR/USD -0.9% Regional geopolitical risk, USD strength USD/JPY +0.5% Classic safe-haven JPY flows vs. broad USD strength AUD/USD -2.2% China growth concerns, commodity weakness Economic Implications and Forward Outlook A weaker Pound carries immediate consequences for the UK economy. Firstly, it increases the cost of imported goods, potentially complicating the Bank of England’s inflation management. Secondly, it makes UK exports more competitive, which could benefit certain manufacturing sectors. However, the net effect during a risk-off period is often negative, as capital outflows and reduced investment outweigh export advantages. Market participants are now closely monitoring several upcoming data points. Key releases include UK inflation figures, US retail sales data, and commentary from central bank officials. The trajectory of the GBP/USD pair will likely depend on whether the current risk-averse sentiment proves transient or marks the beginning of a more sustained phase of market caution. Analysts suggest that a stabilization in geopolitical headlines could prompt a technical rebound for the Pound, but the underlying bias may remain cautious until macroeconomic clarity improves. Conclusion The Pound Sterling decline against the US Dollar serves as a clear barometer of shifting global investor sentiment. Driven by intensified risk aversion, this move highlights the currency market’s sensitivity to geopolitical and economic crosscurrents. While the immediate pressure on the GBP/USD pair is significant, its future path will be dictated by the evolution of central bank policy, incoming economic data, and the durability of the current safe-haven demand for the US Dollar. Traders and economists alike will watch for signs of stabilization or further momentum in this classic risk-off dynamic. FAQs Q1: What does ‘risk aversion’ mean in forex markets? A1: Risk aversion describes a market environment where investors prioritize the safety of their capital over potential returns. They sell assets perceived as risky (like certain currencies, stocks) and buy safe-haven assets (like the US Dollar, Japanese Yen, or government bonds). Q2: Why does the US Dollar strengthen when markets are fearful? A2: The US Dollar is considered the world’s primary reserve currency, backed by the deep and liquid US Treasury market. In times of crisis, global investors flock to US government debt for its perceived safety, which requires buying Dollars, thereby increasing its value. Q3: How does a weaker Pound affect UK consumers? A3: A weaker Pound makes imported goods and services more expensive, which can increase the cost of living (inflation). This includes everything from fuel and food to electronics and foreign holidays. It can also lead to higher interest rates if the Bank of England acts to curb inflation. Q4: Could the Pound recover quickly from this drop? A4: Sharp moves driven by sentiment can reverse quickly if the news flow improves (a ‘relief rally’). However, if the drivers are fundamental, like a worsening economic outlook or a sustained shift in interest rate expectations, the weakness could persist for a longer period. Q5: What other assets typically perform well during risk aversion besides the US Dollar? A5: Alongside the US Dollar, other traditional safe havens include gold, the Japanese Yen, the Swiss Franc, and high-grade government bonds from countries like the United States and Germany. These assets often appreciate when riskier assets like stocks and commodity currencies fall. This post Pound Sterling Plummets: US Dollar Soars on Intensifying Global Risk Aversion first appeared on BitcoinWorld .",Forex News|Currency Markets|financial news|Forex|Pound Sterling|US Dollar,EN,0,0,BUSINESS|FIAT|MARKET|TRADING|MACROECONOMICS,"{'name': 'Bitcoin World', 'img': 'https://resources.cryptocompare.com/news/82/default.png', 'lang': 'EN'}",bitcoinworld,2026-03-09 05:15:12
59042891,https://www.newsbtc.com/?p=886277,1773033506,https://resources.cryptocompare.com/news/21/59042891.jpeg,"Solana (SOL) Tumbles to $80, Traders Watch Critical Support Defense",https://www.newsbtc.com/analysis/solana-sol-tumbles-to-80/,"Solana failed to settle above $90 and extended losses. SOL price is now consolidating losses below $85 and might struggle to start a recovery wave. SOL price started a fresh decline below $85 and $82 against the US Dollar. The price is now trading below $85 and the 100-hourly simple moving average. There is a key bearish trend line forming with resistance at $85.50 on the hourly chart of the SOL/USD pair (data source from Kraken). The price could start a recovery wave if the bulls defend $82 or $80. Solana Price Revisits $80 Solana price failed to remain stable above $90 and started a fresh decline, like Bitcoin and Ethereum . SOL declined below the $88 and $85 support levels. The price gained bearish momentum below $83.50. A low was formed at $80.29, and the price is now consolidating losses below the 23.6% Fib retracement level of the downward move from the $94.10 swing high to the $80.29 low. Solana is now trading below $85 and the 100-hourly simple moving average. On the upside, immediate resistance is near the $85 level. There is also a key bearish trend line forming with resistance at $85.50 on the hourly chart of the SOL/USD pair. The next major resistance is near the $87.20 level or the 50% Fib retracement level of the downward move from the $94.10 swing high to the $80.29 low. The main resistance could be $88.80. A successful close above the $88.80 resistance zone could set the pace for another steady increase. The next key resistance is $95. Any more gains might send the price toward the $102 level. More Losses In SOL? If SOL fails to rise above the $85 resistance, it could continue to move down. Initial support on the downside is near the $82 zone. The first major support is near the $80 level. A break below the $80 level might send the price toward the $72 support zone. If there is a close below the $72 support, the price could decline toward the $65 support in the near term. Technical Indicators Hourly MACD – The MACD for SOL/USD is losing pace in the bearish zone. Hourly Hours RSI (Relative Strength Index) – The RSI for SOL/USD is above the 50 level. Major Support Levels – $82 and $80. Major Resistance Levels – $85 and $88.",Technical analysis|Sol|Solana|solbtc|SOLUSD|SOLUSDT,EN,0,0,BTC|ETH|SOL|TRADING|CRYPTOCURRENCY,"{'name': 'NewsBTC', 'img': 'https://images.cryptocompare.com/news/default/newsbtc.png', 'lang': 'EN'}",newsbtc,2026-03-09 05:18:26
59042994,https://bitcoinworld.co.in/?p=284950,1773033611,https://resources.cryptocompare.com/news/82/default.png,Spot Bitcoin ETF Inflows Soar: $568 Million Weekly Surge Signals Robust Institutional Confidence,https://bitcoinworld.co.in/bitcoin-etf-inflows-surge-568-million/,"BitcoinWorld Spot Bitcoin ETF Inflows Soar: $568 Million Weekly Surge Signals Robust Institutional Confidence In a significant display of sustained institutional interest, U.S.-listed spot Bitcoin exchange-traded funds (ETFs) attracted a substantial $568 million in net new capital last week, according to definitive data from financial analytics firm SoSoValue. This notable influx, recorded in the United States during the week ending May 23, 2025, underscores the growing integration of digital assets into mainstream investment portfolios. Furthermore, the nascent spot Ethereum (ETH) ETF market concurrently witnessed a net inflow of $23.56 million, highlighting a broadening appetite for regulated cryptocurrency investment vehicles. Spot Bitcoin ETF Inflows Reflect Deepening Market Maturity The consistent net inflows into spot Bitcoin ETFs represent a pivotal trend for the digital asset ecosystem. These investment products, which directly hold Bitcoin, provide traditional investors with a familiar and regulated conduit for exposure. Consequently, the weekly inflow figure serves as a critical barometer for institutional sentiment. Analysts frequently interpret sustained positive flows as a signal of confidence in Bitcoin’s long-term value proposition and the stability of its underlying market infrastructure. Moreover, this activity starkly contrasts with the outflows often seen from older, less efficient products like the Grayscale Bitcoin Trust (GBTC) in its early conversion phase, which now typically sees minimal weekly movement. Several key factors contribute to this robust demand. First, increasing clarity from U.S. regulatory bodies has reduced uncertainty for large asset managers. Second, major wirehouses and registered investment advisors (RIAs) have progressively approved these ETFs for client platforms. Finally, the compelling performance of Bitcoin relative to traditional asset classes in certain economic conditions continues to draw comparative analysis from portfolio managers. This confluence of factors creates a powerful tailwind for adoption. Comparative Analysis with Ethereum and Broader Crypto ETFs While the Bitcoin ETF narrative dominates headlines, the parallel inflows into spot Ethereum ETFs provide crucial context for the broader digital asset market. The $23.56 million net inflow into ETH products, though smaller, confirms investor interest extends beyond Bitcoin. This diversification is essential for a mature asset class. It suggests a nuanced strategy where investors may allocate between a perceived digital gold (Bitcoin) and a foundational platform for decentralized applications (Ethereum). The following table illustrates a simplified weekly flow comparison, highlighting the dominant position of Bitcoin-focused products: ETF Type Net Inflow (Week Ending May 23, 2025) Primary Driver Spot Bitcoin ETFs $568 Million Institutional portfolio allocation, macro hedge Spot Ethereum ETFs $23.56 Million Strategic diversification, tech platform exposure It is important to note that flow data represents net new capital. It aggregates creations and redemptions across all approved fund issuers, including giants like BlackRock’s iShares Bitcoin Trust (IBIT) and Fidelity’s Wise Origin Bitcoin Fund (FBTC). Daily trading volume for these products regularly exceeds several billion dollars, providing deep liquidity that further attracts institutional participants. Expert Perspectives on Sustained Capital Flows Market analysts point to the structural significance of consistent inflows. “Weekly data is a pulse check, but the trend is the diagnosis,” notes a report from Bloomberg Intelligence. The firm’s senior ETF analyst, Eric Balchunas, has previously emphasized that the true test for these products is their ability to gather assets through various market cycles, not just during bullish rallies. The persistence of positive weekly inflows, even during periods of price consolidation or mild correction, indicates a foundational shift. Investors are seemingly using dips as accumulation opportunities within a regulated framework, a behavior more characteristic of traditional equity investing than speculative crypto trading. Furthermore, these flows have tangible impacts on the underlying Bitcoin market. Authorized Participants (APs) creating new ETF shares must purchase equivalent amounts of Bitcoin from the spot market, creating direct buy-side pressure. This mechanism physically links ETF demand to the cryptocurrency’s supply dynamics, a factor absent from futures-based ETFs. This direct linkage is a core reason why spot ETFs are considered a more impactful product for the asset class. The Regulatory Landscape and Future Trajectory The current inflow environment exists within a specific regulatory framework established by the U.S. Securities and Exchange Commission (SEC) in early 2024. The approval of multiple spot Bitcoin ETFs marked a watershed moment. Since then, the operational focus has shifted to compliance, custody security, and market surveillance. Trust in these areas is paramount for continued institutional adoption. Custodians like Coinbase Custody, which secures assets for several major ETFs, undergo rigorous audits to ensure safety, directly addressing the historical security concerns associated with cryptocurrency. Looking ahead, several developments could influence future flow patterns: Interest Rate Environment: Shifts in Federal Reserve policy can alter the attractiveness of non-yielding assets like Bitcoin versus bonds. New Product Launches: Potential approvals for spot ETFs tied to other cryptocurrencies could fragment or expand total inflows. Global Adoption: Regulatory progress in other major economies may create competing or complementary investment products. Tax and Retirement Account Integration: Broader inclusion in 401(k) and IRA platforms would unlock a massive new pool of capital. Each of these factors will play a role in determining whether the current pace of investment is sustainable or subject to cyclical variation. Conclusion The $568 million net inflow into U.S. spot Bitcoin ETFs last week is more than a weekly statistic; it is a robust indicator of entrenched institutional demand. This activity, coupled with positive flows into Ethereum products, validates the spot ETF structure as a successful bridge between traditional finance and digital assets. The data from SoSoValue provides clear evidence that regulated cryptocurrency exposure is becoming a standardized component of modern investment strategy. As the market evolves, monitoring these spot Bitcoin ETF inflows will remain essential for understanding the maturation and direction of the entire digital asset sector. FAQs Q1: What are spot Bitcoin ETFs? Spot Bitcoin ETFs are exchange-traded funds that hold physical Bitcoin. They allow investors to gain exposure to Bitcoin’s price movements through a traditional brokerage account without needing to directly buy, store, or secure the cryptocurrency themselves. Q2: How do net inflows affect the Bitcoin market? Net inflows require the ETF’s Authorized Participants to purchase actual Bitcoin from the spot market to back new shares. This creates direct buying pressure, which can influence the cryptocurrency’s supply and demand balance and potentially its price. Q3: Why is the inflow into Ethereum ETFs smaller than Bitcoin’s? Ethereum ETFs are newer, and the market for them is less established. Bitcoin is widely viewed as a digital store of value and often the first point of entry for institutional investors, leading to larger and more consistent capital allocations compared to other digital assets. Q4: What is the source of the $568 million inflow data? The data is sourced from SoSoValue, a financial analytics platform that aggregates and publishes daily and weekly flow data for cryptocurrency exchange-traded products, providing transparency for investors and analysts. Q5: Can these weekly inflows turn negative? Yes. Net inflows represent the balance of new investments versus redemptions. During periods of market stress, profit-taking, or shifting sentiment, weekly flows can turn negative, indicating net capital leaving the ETF products. This post Spot Bitcoin ETF Inflows Soar: $568 Million Weekly Surge Signals Robust Institutional Confidence first appeared on BitcoinWorld .",Crypto News|BITCOIN|CRYPTOCURRENCY|ETF|Finance|Investment,EN,0,0,BTC|BUSINESS|ETH|MARKET|CRYPTOCURRENCY,"{'name': 'Bitcoin World', 'img': 'https://resources.cryptocompare.com/news/82/default.png', 'lang': 'EN'}",bitcoinworld,2026-03-09 05:20:11
59043027,https://decrypt.co/?p=360391,1773033669,https://resources.cryptocompare.com/news/44/59043027.jpeg,Aave Users Reach Record as Traders Quietly Shift Capital Toward DeFi Lending,https://decrypt.co/360391/aave-monthly-active-users-record-defi-lending,"With fewer low-risk yield strategies in crypto, investors are turning to DeFi lending, sending Aave usage to record levels.",|Markets,EN,0,0,BUSINESS|MARKET|CRYPTOCURRENCY,"{'name': 'Decrypt', 'img': 'https://images.cryptocompare.com/news/default/decrypt.png', 'lang': 'EN'}",decrypt,2026-03-09 05:21:09
