id,guid,published_on,imageurl,title,url,body,tags,lang,upvotes,downvotes,categories,source_info,source,date
58392021,https://ambcrypto.com/?p=573221,1771887630,https://images.cryptocompare.com/news/default/ambcrypto.png,$1.7B in RWAs: Mapping Solana’s treasury‑led institutional breakout,https://ambcrypto.com/1-7b-in-rwas-mapping-solanas-treasury-led-institutional-breakout/,Solana’s RWA value hits $1.7B as treasury issuance and institutional yield demand drive share capture.,Altcoin|News|News 1|Social|Solana|Trading View,EN,0,0,ALTCOIN|SOL|DIGITAL ASSET TREASURY|MACROECONOMICS|CRYPTOCURRENCY,"{'name': 'AMB Crypto', 'img': 'https://images.cryptocompare.com/news/default/ambcrypto.png', 'lang': 'EN'}",ambcrypto,2026-02-23 23:00:30
58391978,https://www.newsbtc.com/?p=883313,1771887651,https://resources.cryptocompare.com/news/21/58391978.jpeg,"Bitcoin Wipes Out Gains, Sentiment Sinks To Historic Fear: Analysts",https://www.newsbtc.com/news/bitcoin/bitcoin-wipes-out-gains-sentiment-sinks-to-historic-fear-analysts/,"Bitcoin’s recent wobble has traders on edge, but the picture is not all one-way. Reports note heavy losses for late buyers, and on-chain figures show real money changing hands as positions are forced closed. Markets moved fast; the mood did too. Related Reading: XRP Flashes Rare On-Chain Signal That Once Preceded 114% Gains Fear And Greed Plunges To Single Digits According to CoinGlass, more than 144,839 traders were liquidated in the last 24 hours, with total liquidations of over $508 million and about 92% tied to long bets. Reports from Alternative.me put the Crypto Fear and Greed Index at 5 out of 100 — a reading that has turned up only three times since 2018. That level screams panic. Yet panic often clears out the most fragile holders and leaves room for steadier hands to step in. Realized Losses And Capitulation Signals Based on reports from Glassnode, recent investors are still booking losses at a high rate — the seven-day moving average for net realized losses was close to $500 million per day. That kind of selling pressure looks brutal on a chart. At the same time, selling at scale can mark an end to a sharp phase of decline, because it reduces the number of people left to sell when prices fall further. Bitcoin Price Action In the middle of all this, price moves matter. Bitcoin rose to roughly $68,600 on Saturday, but it slid back and touched the mid-$64,000s after a wave of exits. Traders are watching a range that formed after the early-February drop to about $60,000. The coin remains roughly 48% below an October high of $126,000 and about 5.5% under the 2021 peak near $69,000. News tied to US-Iran tension and general risk-off trading pushed some traders toward safer assets, which added fuel to the pullback. Sharpe Ratio Hits Unusual Low Analyst Michaël van de Poppe shared a chart showing Bitcoin’s Sharpe Ratio at -38.4. That metric measures returns relative to risk; a number this low is rare. This is a phenomenal chart. It shows the Sharpe Ratio for #Bitcoin in the short term. The key takeaway: the Sharpe Ratio has dropped to -38.38, which historically has marked “Low Risk” accumulation zones. The red circles highlight every time the Sharpe Ratio dipped to similar… pic.twitter.com/Nwp7SkfVP4 — Michaël van de Poppe (@CryptoMichNL) February 21, 2026 Historically, extreme negative readings have sometimes lined up with moments when buying risk felt lower, because potential downside had been squeezed out by big selloffs. That does not guarantee a rebound, but it changes how investors view the trade-off between reward and risk. Related Reading: Political Meme Coins Implode: TRUMP Down 92%, MELANIA Nearly Wiped Out Where This Could Lead Some technical watchers warn that more tests of support could happen if uncertainty continues. Others point to the combination of heavy liquidations, deep fear readings, and large realized losses as signals that a base might be forming. Pasts on-chain figures show that panic and steep losses often precede quieter periods where buyers return slowly. Featured image from Unsplash, chart from TradingView",Bitcoin|bitcoin|btc|btcusd|crypto fear and greed index|tariffs|us iran,EN,0,0,BTC|BUSINESS|MARKET|TRADING|CRYPTOCURRENCY,"{'name': 'NewsBTC', 'img': 'https://images.cryptocompare.com/news/default/newsbtc.png', 'lang': 'EN'}",newsbtc,2026-02-23 23:00:51
58391991,https://en.coinotag.com/saylor-denied-the-quantum-threat-btc-is-safe,1771887682,https://resources.cryptocompare.com/news/77/58391991.jpeg,Saylor Denied the Quantum Threat: BTC is Safe,https://en.coinotag.com/saylor-denied-the-quantum-threat-btc-is-safe,"Michael Saylor debunked quantum computing threats, emphasized BTC's upgradable structure. MicroStrategy bought 592 BTC, reached a total of 717K BTC. Vitalik Buterin is preparing for ETH. Net Holdin...",Crypto News,EN,0,0,BTC|ETH|CRYPTOCURRENCY,"{'name': 'CoinOtag', 'img': 'https://resources.cryptocompare.com/news/77/default.png', 'lang': 'EN'}",coinotag,2026-02-23 23:01:22
58392182,https://en.coinotag.com/analysis/kas-technical-analysis-february-23-2026-volume-and-accumulation,1771887829,https://resources.cryptocompare.com/news/77/58392182.jpeg,"KAS Technical Analysis February 23, 2026: Volume and Accumulation",https://en.coinotag.com/analysis/kas-technical-analysis-february-23-2026-volume-and-accumulation,"KAS volume remains low at 14M$, weakening the downtrend and giving accumulation signals. Price-volume divergence carries reversal potential, BTC correlation critical.",Analysis,EN,0,0,BTC|MARKET|TRADING|CRYPTOCURRENCY,"{'name': 'CoinOtag', 'img': 'https://resources.cryptocompare.com/news/77/default.png', 'lang': 'EN'}",coinotag,2026-02-23 23:03:49
58392145,https://bitcoinworld.co.in/?p=278089,1771887912,https://resources.cryptocompare.com/news/82/default.png,Vietnam US Tariffs: The Stunning ASEAN Winner Emerges as Manufacturing Shifts Accelerate,https://bitcoinworld.co.in/vietnam-biggest-asean-winner-us-tariffs/,"BitcoinWorld Vietnam US Tariffs: The Stunning ASEAN Winner Emerges as Manufacturing Shifts Accelerate HANOI, VIETNAM – March 2025: Vietnam stands poised as the biggest ASEAN winner from recent US tariff policies, according to comprehensive analysis from ING Bank. The Southeast Asian nation’s strategic positioning and manufacturing capabilities create significant advantages amid shifting global trade patterns. This development reflects broader economic realignments affecting supply chains across the Asia-Pacific region. Vietnam US Tariffs Analysis Reveals Clear ASEAN Advantage ING’s detailed research demonstrates Vietnam’s exceptional position within the Association of Southeast Asian Nations. The country’s export-oriented economy benefits substantially from redirected manufacturing investment. Consequently, Vietnam captures market share previously held by other regional competitors. The analysis examines multiple economic indicators, including foreign direct investment flows and export growth rates. Several key factors contribute to Vietnam’s advantageous position. First, the country maintains competitive labor costs compared to regional peers. Second, Vietnam has established numerous free trade agreements with major economies. Third, infrastructure development continues at a rapid pace across industrial zones. Finally, political stability provides confidence for long-term investment decisions. ASEAN Export Growth Comparison (2023-2025 Projection) Country 2023 Growth 2024 Growth 2025 Projection Vietnam 8.2% 9.1% 10.3% Thailand 5.7% 6.2% 6.8% Malaysia 6.1% 6.5% 7.2% Indonesia 4.9% 5.3% 5.9% Philippines 5.2% 5.8% 6.4% Manufacturing Shift Accelerates Across Key Industries The manufacturing transition toward Vietnam accelerates across multiple sectors. Electronics production leads this transformation, followed closely by textile manufacturing and furniture production. Additionally, automotive component manufacturing shows remarkable growth. This diversification strengthens Vietnam’s economic resilience against potential market fluctuations. Major corporations continue relocating production facilities to Vietnam. For instance, Samsung operates its largest smartphone factory globally in Vietnam. Similarly, Apple suppliers expand operations throughout the country. These developments create substantial employment opportunities for Vietnamese workers. Furthermore, they stimulate secondary industries supporting manufacturing operations. Expert Analysis from ING Economists ING economists highlight Vietnam’s strategic advantages in their latest regional assessment. The research team notes Vietnam’s comprehensive trade agreements provide preferential access to major markets. Moreover, Vietnam’s geographical position offers logistical benefits for regional supply chains. The analysis also emphasizes Vietnam’s improving regulatory environment for foreign investors. According to ING’s regional head of research, “Vietnam demonstrates remarkable adaptability to changing global trade conditions. The country’s policy framework actively supports manufacturing diversification. Consequently, Vietnam captures disproportionate benefits from current trade realignments.” This expert perspective aligns with observable economic data trends across the region. US-China Trade Dynamics Reshape Regional Economics Ongoing trade tensions between the United States and China fundamentally reshape Asian economic relationships. The implementation of additional US tariffs affects global supply chain configurations. Many multinational corporations seek alternative production locations outside China. Vietnam emerges as a primary beneficiary of this corporate strategy shift. The United States remains Vietnam’s largest export market, accounting for approximately 30% of total exports. This trading relationship strengthens as Vietnamese products gain competitive advantages. Meanwhile, Vietnam maintains robust trade relationships with China for intermediate goods. This balanced approach maximizes economic opportunities across multiple markets. Foreign Direct Investment: Vietnam attracted $36.6 billion in FDI during 2024, representing 15% year-over-year growth Export Composition: Electronics account for 42% of Vietnamese exports, followed by textiles (15%) and machinery (12%) Infrastructure Development: Vietnam plans $120 billion in infrastructure investment through 2030 Labor Force: Vietnam’s workforce exceeds 57 million people with growing technical skills Comparative ASEAN Economic Performance Analysis Other ASEAN nations experience varied impacts from changing trade policies. Thailand benefits from automotive manufacturing but faces challenges in electronics. Malaysia maintains strength in semiconductor production but shows slower growth in consumer goods. Indonesia leverages natural resources but struggles with manufacturing competitiveness. The Philippines shows improvement in business process outsourcing but limited gains in physical exports. Vietnam’s comprehensive advantages become apparent through comparative analysis. The country demonstrates superior performance across multiple economic indicators. This consistent outperformance suggests sustainable competitive advantages rather than temporary benefits. Regional economists increasingly recognize Vietnam’s structural economic strengths. Long-Term Implications for Regional Development The current economic shifts carry significant long-term implications for ASEAN development. Vietnam’s rising prominence may alter regional economic leadership dynamics. Other ASEAN members potentially face increased competitive pressure. However, regional cooperation frameworks might mitigate negative impacts through coordinated policies. Infrastructure connectivity improvements across ASEAN could distribute economic benefits more broadly. The Regional Comprehensive Economic Partnership facilitates greater regional integration. Additionally, ASEAN’s collective bargaining power increases with unified trade policies. These factors suggest complex, evolving regional economic relationships ahead. Conclusion Vietnam clearly emerges as the biggest ASEAN winner from US tariff policies according to ING analysis. The country’s manufacturing capabilities, trade agreements, and strategic positioning create substantial economic advantages. This development reflects broader shifts in global supply chains and trade relationships. Vietnam’s economic trajectory suggests continued growth and regional influence expansion. The Vietnam US tariffs situation demonstrates how targeted policies can reshape regional economic landscapes significantly. FAQs Q1: Why does ING consider Vietnam the biggest ASEAN winner from US tariffs? ING’s analysis identifies Vietnam’s combination of competitive manufacturing costs, extensive trade agreements, strategic location, and political stability as creating exceptional advantages for capturing redirected investment and export opportunities resulting from US tariff policies. Q2: Which industries benefit most from Vietnam’s advantageous position? Electronics manufacturing experiences the most significant growth, particularly smartphones and components, followed by textiles and apparel, furniture production, and increasingly automotive parts and machinery manufacturing. Q3: How do US-China trade tensions affect Vietnam’s economic position? Ongoing trade tensions accelerate corporate diversification of manufacturing away from China, with Vietnam emerging as a primary alternative destination due to its proximity, infrastructure, and favorable trade terms with both the US and China. Q4: What challenges might Vietnam face despite its advantageous position? Potential challenges include infrastructure strain from rapid growth, increasing labor costs over time, regulatory complexities, environmental concerns, and potential trade policy changes from partner countries. Q5: How do other ASEAN countries compare to Vietnam in benefiting from trade shifts? While other ASEAN nations experience some benefits, Vietnam demonstrates superior performance across multiple indicators including FDI growth, export expansion, manufacturing diversification, and infrastructure development, creating a more comprehensive competitive advantage. This post Vietnam US Tariffs: The Stunning ASEAN Winner Emerges as Manufacturing Shifts Accelerate first appeared on BitcoinWorld .",Forex News|ASEAN|Economic Analysis|trade policy|US Tariffs|VIETNAM,EN,0,0,ASIA|BUSINESS|MARKET|RESEARCH|MACROECONOMICS,"{'name': 'Bitcoin World', 'img': 'https://resources.cryptocompare.com/news/82/default.png', 'lang': 'EN'}",bitcoinworld,2026-02-23 23:05:12
