id,guid,published_on,imageurl,title,url,body,tags,lang,upvotes,downvotes,categories,source_info,source,date
58736123,667331,1772490620,https://resources.cryptocompare.com/news/13/58736123.jpeg,X Opens The Door To Crypto Promotions — With Strings Attached,https://bitcoinist.com/x-opens-the-door-to-crypto-promotions-with-strings-attached/,"Crypto influencers just got a new way to make money on X. The social media platform owned by Elon Musk quietly reversed its long-standing ban on sponsored crypto content over the weekend, rolling out a paid partnership labeling system that now lets creators openly monetize their crypto posts. It’s a notable shift for a platform that has always been the unofficial home of crypto culture — but the new rules come with significant limitations that not everyone will be happy about. Influencers Must Police Their Own Reach Under the updated policy, any post that involves a brand paying or rewarding a user to promote a product or service must be tagged with a visible paid partnership label. According to X, the label is meant to keep things honest between creators and their followers. Nikita Bier, X’s head of product, said the move is designed to help people grow their businesses on the platform without sacrificing transparency. But here’s where it gets complicated. The ban on crypto promotions has not been lifted everywhere. Reports say that influencers are personally responsible for making sure their paid crypto posts are not visible to audiences in the European Union, the UK, and Australia — three markets with tough financial promotion regulations. Today we’re announcing Paid Partnership labels on posts. X’s core value is providing on authentic pulse on humanity. While we want to encourage people to build their businesses on X, undisclosed promotions hurt the integrity of the product and lead people to distrust the content… pic.twitter.com/CmrRDx5tU1 — Nikita Bier (@nikitabier) March 1, 2026 X is not doing that filtering for them. The burden of compliance sits squarely on the creator, which raises real questions about how consistently those geographic restrictions will actually be enforced. The updated framework also keeps a number of content categories off the paid promotions table entirely. According to X’s revised guidelines, sponsored posts tied to alcohol, weapons, tobacco, recreational drugs, prescription medications, dating services, adult content, and health supplements remain prohibited. Political and social issue content is also banned from commercial use. What The New Labels Mean For Crypto Culture X has long been a central gathering point for crypto projects, communities, and traders. Announcements, token launches, market commentary — much of it has played out on this platform for years. The ability to now attach paid labels to crypto promotional content formalizes what has already been happening informally, giving brands and creators a structured, above-board way to work together. Whether this opens a floodgate of crypto promotion remains to be seen. The geographic restrictions are broad enough to exclude a substantial portion of global crypto activity. The EU and UK together represent a massive base of crypto users and investors, and any influencer with a significant European following will need to tread carefully. X Money And In-App Trading On The Horizon The crypto policy update arrives as X continues building toward a broader financial services offering. Reports indicate that Musk announced in February that X Money — the platform’s planned payments feature — is expected to launch in a limited beta within two months, ahead of a wider global rollout. Featured image from Pexels, chart from TradingView",Crypto News|content creators|crypto|Elon Musk|paid partnership|social media platform|X,EN,0,0,BUSINESS|MARKET|SPONSORED|TRADING|CRYPTOCURRENCY,"{'name': 'Bitcoinist', 'img': 'https://images.cryptocompare.com/news/default/bitcoinist.png', 'lang': 'EN'}",bitcoinist,2026-03-02 22:30:20
58736337,https://cryptonews.com/?p=488277,1772490900,https://resources.cryptocompare.com/news/52/58736337.jpeg,"Crypto Price Prediction Today 2 March – XRP, Bitcoin, Ethereum",https://cryptonews.com/news/crypto-price-prediction-today-2-march-xrp-bitcoin-ethereum/,"Bitcoin is holding steady above $66,000 despite escalating U.S.–Iran tensions, a sign that traders may already be looking past the geopolitical noise. At the same time, anticipation around the nearing CLARITY Act is building, with many investors expecting regulatory clarity to set the tone for crypto’s next major move. With momentum quietly building, analysts are now watching XRP, Bitcoin, and Ethereum closely, and the latest price predictions suggest big moves could be coming next. Discover: The best meme coins in the world right now. XRP (XRP): Stablecoin and Tokenization Crypto Infrastructure Could Drive Price Toward $5 XRP ($XRP) currently commands a market capitalization of $82 billion, making it the leading cryptocurrency for cross-border payments. Ripple built the XRP Ledger (XRPL) to streamline international money transfers, offering near-instant settlement times and extremely low fees, making the costly and timely SWIFT theoretically obsolete. Ripple recently reiterated its strategy to expand XRPL as core infrastructure for stablecoins and tokenized real-world assets, while keeping XRP at the center as the primary liquidity token. Publications from the United Nations Capital Development Fund and the White House, have highlighted Ripple’s potential role in upgrading global payment rails. Adding to the bullish case, the recent approval of spot XRP exchange-traded funds (ETFs) in the U.S. opens the door to broader participation from institutional and retail investors alike. XRP appears to be forming a bullish flag pattern, which could preempt a breakout to $5 level in Q2 in a good news cycle. Bitcoin (BTC): Can the First Cryptocurrency Reach a New ATH by Summer? Bitcoin ($BTC) , the largest cryptocurrency by market capitalization, previously rallied to an all-time high (ATH) of $126,080 on October 6. A sharp reversal followed the surge, driven by geopolitical tensions and uncertainty surrounding potential U.S. military actions involving Iran and Greenland. These concerns sparked a correction of nearly 50%, briefly pushing BTC below $63,000 last Tuesday. Even so, Bitcoin’s reputation as “digital gold” remains intact, attracting investors seeking a hedge against inflation, currency debasement, and wider macroeconomic risk. Rising institutional adoption, reduced selling pressure following the most recent halving, and expectations for clearer U.S. regulatory frameworks could help reignite bullish momentum and push prices to new highs later this year. Furthermore, if Trump delivers on his executive order to establish a U.S. Strategic Bitcoin Reserve, it could make Bitcoin the dominant player for years to come. Ethereum (ETH): DeFi’s Cornerstone Targets Fresh Highs Ethereum ($ETH) is the foundation of decentralized finance, with a market capitalization approaching $234 billion. The network currently secures around $53 billion TVL , making it the most active hub for on-chain financial activity. Should broader market conditions turn positive, ETH could challenge the $5,000 resistance area as early as June, potentially surpassing its ATH of $4,946 set last August. Over the longer term, Ethereum’s path toward five-figure valuations depends heavily on clearer U.S. regulations and supportive macroeconomic trends. Passage of CLARITY could accelerate institutional deployment of stablecoins and tokenized real world assets on Ethereum. From a technical perspective, ETH is currently resisting a bearish pennant sign that formed throughout February. For long investors, current levels may present an attractive accumulation opportunity. Bitcoin Hyper: This Low Price Crypto Presale Brings Solana ‘s Speed and Utility to Bitcoin While Bitcoin, XRP, and Ethereum offer compelling narratives and strong upside potential, past bull cycles show that the largest returns often come from early exposure to innovative new projects. Bitcoin Hyper ($HYPER) expands Bitcoin’s capabilities by introducing Solana’s speed and efficiency through a Layer 2 scaling solution. The protocol lowers transaction costs while preserving Bitcoin’s core security model. With Bitcoin Hyper, users can stake assets, earn yield, trade tokens, and interact with smart contracts, all without transferring funds off the Bitcoin network. Having already raised $31.7 million in its ongoing presale with growing attention from major investors and exchange platforms, $HYPER is one of the most watched launches this year. Investors interested in securing $HYPER at its fixed presale price can visit the official Bitcoin Hyper website and connect a supported wallet such as Best Wallet . Purchases can also be made with a bank card. Visit the Official Website Here The post Crypto Price Prediction Today 2 March – XRP, Bitcoin, Ethereum appeared first on Cryptonews .",Industry Talk|Market Analysis,EN,0,0,BTC|ETH|TRADING|XRP|CRYPTOCURRENCY,"{'name': 'cryptonews', 'img': 'https://images.cryptocompare.com/news/default/cryptonews.png', 'lang': 'EN'}",cryptonews,2026-03-02 22:35:00
58736445,https://decrypt.co/?p=359691,1772491108,https://resources.cryptocompare.com/news/44/58736445.jpeg,"Tether, Anchorage Tap Deloitte for First USAT Stablecoin Reserve Report",https://decrypt.co/359691/tether-anchorage-deloitte-usat-stablecoin-reserve-report,"Deloitte performed USAT’s first attestation, linking the Big Four accounting firm with Tether’s U.S.-regulated stablecoin.",Business,EN,0,0,BUSINESS|FIAT|USDT|CRYPTOCURRENCY,"{'name': 'Decrypt', 'img': 'https://images.cryptocompare.com/news/default/decrypt.png', 'lang': 'EN'}",decrypt,2026-03-02 22:38:28
58736444,https://bitcoinworld.co.in/?p=281733,1772491212,https://resources.cryptocompare.com/news/82/default.png,Bitcoin Rebound: Decoding the Crucial Coinbase Premium Recovery and Spot ETF Surge,https://bitcoinworld.co.in/bitcoin-rebound-coinbase-premium-spot-etf/,"BitcoinWorld Bitcoin Rebound: Decoding the Crucial Coinbase Premium Recovery and Spot ETF Surge In a significant development for cryptocurrency markets, Bitcoin has staged a powerful rebound above the $68,000 threshold. This recovery, observed in late April 2025, appears fundamentally driven by a critical shift in U.S. institutional demand rather than external geopolitical shocks, according to a detailed on-chain analysis from CryptoQuant. Bitcoin Rebound: A Data-Driven Narrative Market analysts closely monitor various metrics to understand price movements. Consequently, the recent Bitcoin rebound provides a clear case study in separating narrative from data. While Middle East tensions caused a brief market dip, the subsequent and rapid recovery aligned precisely with technical indicators of buying pressure. Specifically, the Coinbase Premium Index turned positive for the first time in approximately 40 days. This index measures the price difference between Coinbase, a U.S.-centric exchange, and the global average. Therefore, a positive value strongly indicates heightened buying activity from U.S.-based investors and institutions. The Mechanics of the Coinbase Premium The Coinbase Premium serves as a vital barometer for institutional sentiment. Analysts from XWIN Research Japan, contributing to CryptoQuant, highlighted its recent recovery as the primary catalyst. Essentially, when the premium rises, it signals that buyers on Coinbase are willing to pay more than the global average to acquire Bitcoin. This phenomenon often correlates with inflows into U.S.-listed spot Bitcoin Exchange-Traded Funds (ETFs). The recent data suggests a resurgence in spot ETF demand after a prolonged period of neutral or negative flows. This spot-driven buying creates organic price support, unlike rallies fueled by excessive leverage in derivatives markets. Derivatives Data Confirms a Healthy Rally Supporting the spot-driven thesis, derivatives metrics remain stable. Funding rates across major exchanges are neutral, indicating a balanced market between longs and shorts. Furthermore, leverage ratios are not elevated, which typically rules out a speculative, bubble-like rally. This combination of a recovering Coinbase Premium and calm derivatives data paints a picture of a sustainable Bitcoin rebound built on genuine asset accumulation. Contextualizing Geopolitical Market Noise Financial markets often react to geopolitical headlines. However, seasoned analysts distinguish between temporary volatility and fundamental trend shifts. The recent tension in the Middle East initially triggered a risk-off sentiment across assets, including Bitcoin and equities. Notably, both asset classes recovered their losses in tandem. This parallel recovery suggests the dip was a broad, temporary risk reassessment rather than a cryptocurrency-specific event. The rapid BTC price recovery, therefore, underscores the market’s underlying strength and its decoupling from isolated geopolitical narratives as a primary price driver. The timeline of events is instructive: Early April 2025: Coinbase Premium remains negative or neutral, indicating subdued U.S. demand. Mid-April 2025: Geopolitical event triggers a brief, cross-asset sell-off. Late April 2025: Coinbase Premium turns positive concurrently with spot ETF inflow data improving. Bitcoin price rebounds decisively above $68,000. This sequence strongly prioritizes on-chain data over headlines as the core explanation. The Impact of Spot ETF Flows on Market Structure The approval of spot Bitcoin ETFs in early 2024 fundamentally altered market dynamics. These financial products provide a regulated conduit for traditional capital. Their daily flow data is now a critical leading indicator. Sustained inflows directly translate to spot market purchases by the ETF issuers, applying constant upward pressure on the underlying asset. The analyst’s report directly links the premium recovery to this mechanism. When ETF inflows resume after a pause, the premium often leads the price, making it a valuable predictive tool for traders and long-term investors alike. Expert Analysis and E-E-A-T The findings originate from a CryptoQuant contributor at XWIN Research Japan, a firm specializing in blockchain data analytics. CryptoQuant is a leading provider of on-chain data and intelligence, used by institutions globally. This sourcing establishes the article’s expertise and authoritativeness. The analysis relies on verifiable, public on-chain metrics—the Coinbase Premium Index and derivatives funding rates—which any user can audit, ensuring trustworthiness. The interpretation provides experience-driven insight into how professionals read these data streams to forecast market movements. Conclusion The recent Bitcoin rebound to levels above $68,000 demonstrates the growing sophistication of cryptocurrency market analysis. While external events can cause volatility, core price drivers are increasingly identifiable through on-chain data. The recovery of the Coinbase Premium, signaling renewed U.S. institutional demand via spot ETFs, provided the fundamental thrust for this rally. Concurrently, neutral derivatives data confirms the move’s health. For market participants, this episode reinforces the importance of monitoring spot market indicators and ETF flows over short-term news narratives to understand the true direction of the BTC price . FAQs Q1: What is the Coinbase Premium Index? The Coinbase Premium Index is a metric that calculates the percentage difference between the Bitcoin price on Coinbase Pro and the global average price across multiple exchanges. A positive premium indicates stronger buying pressure, particularly from U.S. investors. Q2: How do spot Bitcoin ETFs affect the Coinbase Premium? When U.S. spot Bitcoin ETFs experience net inflows, their authorized participants must purchase actual Bitcoin (spot) to create new shares. These purchases often occur on Coinbase, which is a custodian for many ETFs, driving up the price on that exchange relative to others and creating a positive premium. Q3: Why are neutral funding rates important for a rally? Funding rates are periodic payments between long and short traders in perpetual futures markets. Neutral rates suggest a balanced market without excessive speculation. A rally with neutral funding is more likely to be sustained by spot buying rather than leveraged, unstable futures positions. Q4: Did geopolitical tensions have no effect on Bitcoin’s price? Geopolitical tensions did cause a temporary dip as part of a broad risk-off move. However, the analysis concludes they were not the main driver of the subsequent, stronger rebound. The recovery was more closely tied to specific on-chain demand metrics. Q5: What does this analysis suggest for future Bitcoin price movements? It suggests that monitoring U.S. institutional demand signals, like the Coinbase Premium and ETF flow data, may be more reliable for identifying trend changes than reacting to general news headlines. Sustained positive premiums often precede or accompany bullish trends. This post Bitcoin Rebound: Decoding the Crucial Coinbase Premium Recovery and Spot ETF Surge first appeared on BitcoinWorld .",Crypto News|BITCOIN|CRYPTOCURRENCY|ETFs|Market Analysis|trading.,EN,0,0,BTC|EXCHANGE|MARKET|TRADING|CRYPTOCURRENCY,"{'name': 'Bitcoin World', 'img': 'https://resources.cryptocompare.com/news/82/default.png', 'lang': 'EN'}",bitcoinworld,2026-03-02 22:40:12
58736493,https://www.newsbtc.com/?p=884868,1772491270,https://resources.cryptocompare.com/news/21/58736493.jpeg,"CME Capitalizes On ADA, XLM, LINK In Crypto Strategy: Key Figures Exposed",https://www.newsbtc.com/breaking-news-ticker/cme-capitalizes-on-ada-xlm-link-in-crypto-strategy-key-figures-exposed/,"CME Group, the world’s largest derivatives marketplace, is expanding its footprint in crypto with the launch of new futures contracts tied to Cardano (ADA), Chainlink (LINK), and Stellar (XLM). In a blog post published Monday, the exchange confirmed that the crypto contracts went live on February 9, marking another step in the steady buildout of its regulated cryptocurrency product suite. New Futures And Index Launch Plan With the addition of ADA, LINK and XLM, CME now offers futures products covering seven major crypto assets. According to the company’s own estimates, the expanded lineup represents exposure to more than 75% of the total cryptocurrency market capitalization. Related Reading: Bitcoin And Ethereum Prices Are Recovering Again, But Will The US-Israel War Derail It? The new crypto contracts are cash-settled and reference the CME CF Reference Rates. Each token is available in both standard and micro-sized contracts, allowing for participation from a broad range of institutional and smaller market participants. The first LINK and XLM futures trades were executed between FalconX and Marex, while the inaugural ADA transactions took place between Cumberland DRW and Wintermute. In addition to the new token-specific contracts, CME revealed plans to roll out a Nasdaq CME Crypto Index futures product, targeted for launch on March 16, pending regulatory approval. Crypto Derivatives Hit Record Volumes In 2025 In its blog post, the company also highlighted the rapid growth of its crypto derivatives business. In 2025, CME recorded a milestone year for its digital asset product suite, reporting an average daily volume of 278,300 contracts. Related Reading: Wall Street Giant JPMorgan Sees Clarity Act Driving Second-Half Upside That figure translates to roughly $12 billion in notional value traded each day. Growth has also been reflected in rising average daily open interest, underscoring sustained institutional engagement since the product line’s inception. Featured image from OpenArt, chart from TradingView.com",Breaking News Ticker|ADA|Cardano|Cardano CME futures|chainlink|Chainlink CME futures|CME Crypto|CME Crypto news|CME futures|CME Group|crypto market|crypto news|Link|stellar|XLM,EN,0,0,ADA|LINK|MARKET|XLM|CRYPTOCURRENCY,"{'name': 'NewsBTC', 'img': 'https://images.cryptocompare.com/news/default/newsbtc.png', 'lang': 'EN'}",newsbtc,2026-03-02 22:41:10
58736613,https://cryptonews.com/?p=488239,1772491500,https://resources.cryptocompare.com/news/52/58736613.jpeg,XRP Price Prediction: $650 Million Floods Exchanges — Are Investors Preparing to Dump XRP?,https://cryptonews.com/news/xrp-price-prediction-650-million-floods-exchanges-are-investors-preparing-to-dump-xrp/,"Something just changed with XRP holder behaviour and this fueling bearish price prediction. In the past week alone, about 472 million XRP, roughly $650 million worth, moved onto Binance. That is one of the biggest exchange inflow spikes this month. Big transfers to exchanges usually mean one thing. Tokens are getting closer to the sell button. On-chain analyst Darkfost points out that these spikes often show a defensive mindset. When uncertainty rises, traders want liquidity ready. Source: XRP Inflows To Binance / CryptoQuant The timing is not random. Escalating tensions involving the United States, Israel, and Iran sparked a broad risk-off move. Crypto dropped with other risk assets, while money rotated into gold. Now, inflows do not guarantee dumping. Some of this could be hedging or short-term positioning. But this move breaks a months-long trend of XRP leaving Binance. That alone signals a shift in tone. XRP Price Prediction: Are Investors Preparing to Dump XRP? If uncertainty continues and more tokens move onto exchanges, short term downside pressure could build as sellers test market depth. On the other hand, if tensions ease and the inflows stabilize, the market may absorb the added supply without a sustained breakdown. Source: XRPUSD / TradingView XRP is still stuck in a descending channel, and $1.30 is the line everyone is staring at. Price has hit that zone multiple times and bounced every time. Buyers are clearly defending it. This is decision time. If $1.30 breaks, the move likely speeds up toward $1.12. That is the next real demand area. On the other hand, bulls need $1.50 back. That level keeps rejecting price. Clear $1.50 and momentum shifts short term. Then $1.61 becomes the real breakout trigger. Take that out, and the channel structure breaks. That opens the door to $1.90, maybe even $2.20 if continuation kicks in. So yes, it is still a downtrend. But as long as $1.30 holds, the base is alive. $SUBBD: Can This Presale Become the Next Big Crypto Play of 2026? SUBBD ($SUBBD) is building a creator economy that actually makes sense. It brings AI and blockchain together in one clean setup. No jumping between apps. No messy workflows. Create, edit, publish. All inside one ecosystem. The $SUBBD token is the engine. It powers subscriptions, unlocks gated content, and gives holders governance access, staking rewards, and premium AI features. Over 2,000 influencers are already in. That is a combined reach of 250 million. The network effect is not theoretical. It is forming. If adoption keeps scaling, $SUBBD stops looking like a tiny experiment and starts looking like a real bet on the future of AI-driven creator platforms. You can buy $SUBBD at its discounted presale price of $0.057520 by visiting the official SUBBD website . Link up your wallet (e.g., Best Wallet ) and either swap USDT or ETH for this token or use a bank card to invest. Visit the Official SUBBD Website Here The post XRP Price Prediction: $650 Million Floods Exchanges — Are Investors Preparing to Dump XRP? appeared first on Cryptonews .",Industry Talk|Altcoin News,EN,0,0,BUSINESS|EXCHANGE|TRADING|XRP|CRYPTOCURRENCY,"{'name': 'cryptonews', 'img': 'https://images.cryptocompare.com/news/default/cryptonews.png', 'lang': 'EN'}",cryptonews,2026-03-02 22:45:00
