id,guid,published_on,imageurl,title,url,body,tags,lang,upvotes,downvotes,categories,source_info,source,date
58741089,https://bitcoinworld.co.in/?p=281786,1772499612,https://resources.cryptocompare.com/news/82/default.png,SANAE TOKEN Denial: Japanese PM Sanae Takaichi Categorically Rejects Controversial Cryptocurrency Link,https://bitcoinworld.co.in/sanae-token-denial-japanese-pm/,"BitcoinWorld SANAE TOKEN Denial: Japanese PM Sanae Takaichi Categorically Rejects Controversial Cryptocurrency Link In a definitive statement that has rippled through both political and cryptocurrency circles, Japanese Prime Minister Sanae Takaichi has publicly and firmly denied any association with a digital asset trading under her name. The Prime Minister’s office in Tokyo, Japan, issued this clarification on February 15, 2025, directly addressing the existence and trading of ‘SANAE TOKEN,’ a cryptocurrency launched on the Solana blockchain. This incident highlights the growing, and often problematic, intersection of global politics and the volatile memecoin market. SANAE TOKEN Sparks Political and Financial Scrutiny Prime Minister Takaichi utilized the social media platform X to issue her denial. She stated clearly that while she had become aware of the token’s issuance and subsequent trading activity, she possessed no prior knowledge of its creation. Furthermore, she emphasized that neither she personally nor the Prime Minister’s Office had granted any form of approval for the token. This swift response aimed to quell potential speculation and preempt any perception of endorsement. The token, according to on-chain data from wallets like Phantom, currently holds a price of approximately $0.0087 and commands a market capitalization nearing $9 million. This valuation, while modest in the broader crypto sphere, is significant for an asset with such controversial origins. The Rising Phenomenon of Political Memecoins This event is not an isolated incident but part of a broader, global trend. The cryptocurrency landscape has repeatedly seen the emergence of tokens capitalizing on the names and likenesses of public figures without their consent. These assets, often categorized as ‘political memecoins,’ leverage fame for rapid, speculative trading. For instance, similar tokens referencing U.S. presidential candidates have seen volatile swings based on debate performances or poll numbers. The creation of such tokens raises immediate questions about intellectual property, misrepresentation, and market manipulation. Regulatory bodies worldwide are grappling with how to classify and oversee these assets, which often operate in legal gray areas. Expert Analysis on Legal and Market Implications Financial legal experts point to the significant risks involved. “The unauthorized use of a sitting head of government’s name for a financial instrument is fraught with legal peril,” notes Dr. Kenji Sato, a professor of Fintech Law at the University of Tokyo. “It potentially touches on laws concerning fraud, misrepresentation, and securities regulation. A key question for regulators is whether the creators implied an official endorsement to drive demand.” Market analysts also observe distinct trading patterns. Data shows these tokens often experience massive, pump-and-dump style volatility, disproportionately benefiting early creators and holders while exposing retail investors to high risk. The table below contrasts typical memecoin traits with more traditional assets: Feature Political Memecoin (e.g., SANAE TOKEN) Traditional Cryptocurrency (e.g., Bitcoin) Primary Driver Social & political sentiment, celebrity name Technology, adoption, store-of-value thesis Development Team Often anonymous or pseudonymous Typically public or foundation-led Utility/Function Primarily speculative trading Medium of exchange, smart contract platform Regulatory Clarity Very low, high legal risk Evolving but clearer frameworks emerging Price Volatility Extremely high, event-driven High, but influenced by macro factors Japan’s Evolving Stance on Cryptocurrency Regulation Japan has long been a pioneer in establishing formal regulatory frameworks for digital assets. The country’s Payment Services Act (PSA) and Financial Instruments and Exchange Act (FIEA) provide clear guidelines for cryptocurrency exchanges. However, these laws primarily govern trading platforms and token issuers who seek official registration. Decentralized, anonymous creations like SANAE TOKEN present a enforcement challenge. The Financial Services Agency (FSA) has historically focused on consumer protection and anti-money laundering measures. This incident may prompt renewed scrutiny of how decentralized finance (DeFi) protocols and token-creation tools are accessed and used within Japan’s jurisdiction. Other nations are watching closely, as many face similar dilemmas in balancing innovation with investor safety. The Technical Anatomy of the SANAE TOKEN Launch From a technical perspective, the token’s launch on Solana is significant. The Solana blockchain is renowned for its high throughput and low transaction costs, making it a preferred network for experimental and meme-based tokens. Creating a standard token on Solana is a process accessible to anyone with basic technical knowledge, using tools like the Solana Program Library (SPL). The process typically involves: Token Generation: Minting a new SPL token with a defined supply. Liquidity Provision: Adding initial trading pairs on a decentralized exchange (DEX) like Raydium or Orca. Market Making: The creator often provides the initial liquidity, setting the starting price. Community Promotion: Marketing via social media channels to attract traders. This accessibility democratizes creation but also lowers the barrier for potentially misleading or fraudulent projects. The anonymity afforded by blockchain technology makes it difficult to hold creators accountable after they withdraw liquidity. Potential Consequences and Market Reaction The immediate market reaction to PM Takaichi’s denial was a sharp, double-digit percentage drop in the token’s price. This is a common pattern where official disavowals erase the perceived ‘endorsement’ premium. Looking forward, several outcomes are possible. The Japanese FSA could initiate an investigation if evidence suggests Japanese citizens were defrauded. The Prime Minister’s legal team might explore civil actions for misuse of name and likeness, although jurisdictional issues with anonymous developers are complex. For investors, the episode serves as a stark reminder of the inherent risks in unvetted, celebrity-themed cryptocurrencies. These assets lack fundamental value drivers and are subject to extreme sentiment shifts based on news events. Conclusion The SANAE TOKEN controversy underscores a critical juncture in digital asset evolution. As cryptocurrency permeates mainstream culture, the unauthorized appropriation of public figures’ identities for financial gain presents novel legal and ethical challenges. Prime Minister Sanae Takaichi’s prompt denial was a necessary step to maintain institutional integrity and protect the public from potential misunderstanding. This event will likely fuel ongoing debates about regulatory boundaries in decentralized finance, the responsibilities of blockchain platforms, and the need for greater investor education in the high-risk world of memecoins. The saga of SANAE TOKEN is a cautionary tale for both politicians and market participants navigating this new frontier. FAQs Q1: What is SANAE TOKEN? A1: SANAE TOKEN is a cryptocurrency created on the Solana blockchain whose name references Japanese Prime Minister Sanae Takaichi. It is a type of ‘memecoin’ driven primarily by social sentiment rather than technological utility. Q2: Did Prime Minister Takaichi approve or create the token? A2: No. Prime Minister Takaichi has explicitly denied any knowledge, involvement, or approval of SANAE TOKEN. She stated neither she nor her office authorized its creation or promotion. Q3: What are the legal implications of creating a token named after a politician? A3: Legal implications can include potential violations of laws against fraud, misrepresentation, and securities offering without a license. It may also involve civil claims for misuse of name and likeness, though enforcement is difficult against anonymous creators. Q4: How does Japan regulate cryptocurrencies like this? A4: Japan regulates cryptocurrency exchanges and registered token issuers strictly under the Payment Services Act and Financial Instruments Act. However, anonymous tokens launched on decentralized platforms pose a significant regulatory challenge, as they fall outside traditional oversight frameworks. Q5: What should investors consider about political memecoins? A5: Investors should be aware these tokens are highly speculative, extremely volatile, and often created by anonymous parties. They carry a high risk of loss, especially if the referenced public figure disavows them. They lack the fundamental development or utility that underpins more established digital assets. This post SANAE TOKEN Denial: Japanese PM Sanae Takaichi Categorically Rejects Controversial Cryptocurrency Link first appeared on BitcoinWorld .",Crypto News|CRYPTOCURRENCY|JAPAN|Memecoin|Politics|REGULATION,EN,0,0,ASIA|MARKET|REGULATION|TRADING|CRYPTOCURRENCY,"{'name': 'Bitcoin World', 'img': 'https://resources.cryptocompare.com/news/82/default.png', 'lang': 'EN'}",bitcoinworld,2026-03-03 01:00:12
58741119,667356,1772499618,https://resources.cryptocompare.com/news/13/58741119.jpeg,Beyond Capitulation: Why Bitcoin’s Short-Term Holders Refuse To Blink Amid Iran Escalation,https://bitcoinist.com/bitcoins-short-term-holders-refuse-blink-iran/,"Bitcoin is facing renewed pressure as geopolitical tensions in the Middle East reshape the macro backdrop and weigh on risk assets. Rather than responding to isolated headlines, the market is reacting to a broader shift in uncertainty, liquidity expectations, and cross-asset positioning. Price remains fragile, with rallies struggling to gain traction as participants reassess exposure in an increasingly volatile environment. A recent CryptoQuant report sheds light on a critical behavioral shift through the Short-Term Holder (STH) P&L to Exchanges metric — a tool designed to track how the most reactive cohort is positioning. These investors, often responsible for amplifying short-term volatility, tend to transfer coins to exchanges when under stress, particularly during loss realization events. During the February 5–6 capitulation episode, STHs sent approximately 89,000 BTC to exchanges at a loss within a single 24-hour window — a clear signal of panic-driven distribution. However, the dynamics have since evolved. Following that event, loss-driven inflows have steadily declined. This suggests that immediate sell-side pressure from recent buyers is diminishing. The data indicate that acute panic has subsided. What remains is not aggressive accumulation, but a gradual transition from forced liquidation to relative exhaustion — a subtle yet important structural development. Short-Term Holders Show Restraint As Geopolitical Stress Fails To Trigger New Capitulation The granular view of the Short-Term Holder P&L to Exchanges metric adds nuance to the broader picture. Even amid the recent geopolitical escalation involving Iran — an event class that has historically triggered reactive risk-off flows — exchange inflows from short-term holders did not materially expand. As Bitcoin probed the $63,000–$64,000 zone, there was no corresponding spike in realized-loss transfers. For a cohort typically hypersensitive to volatility, this restraint is notable. This behavior suggests a shift from reflexive panic to conditional holding. In prior stress episodes, similar price shocks produced visible surges in exchange-bound coins as weak hands rushed to de-risk. The absence of that pattern now implies that a meaningful portion of forced selling may already have occurred during the early-February capitulation phase. Markets tend to stabilize only after marginal sellers are exhausted. The progressive decline in loss-driven transfers supports the thesis that liquidation pressure is being absorbed rather than re-accelerating. Going forward, the signal to monitor is persistence. If short-term holder inflows remain muted, it would reinforce the case for seller fatigue and base-building conditions. Conversely, a renewed spike in realized-loss transfers would indicate that capitulation is incomplete, reopening the path for further downside volatility. Bitcoin Hovers Near Long-Term Support As Weekly Structure Remains Fragile On the weekly timeframe, Bitcoin is attempting to stabilize near the $66,000 region after a decisive rejection from the $90,000–$100,000 zone. The broader structure shows a transition from expansion to correction: following the late-2025 highs, price printed lower highs and eventually lost the 50-week moving average (blue), which had acted as dynamic support throughout much of the prior uptrend. The breakdown accelerated once Bitcoin slipped below the 100-week moving average (green), triggering a fast move toward the mid-$60Ks. That area now represents a critical inflection point. While the 200-week moving average (red), rising near the low-$60Ks, remains intact, price is hovering uncomfortably close to this long-term trend baseline. Historically, sustained closes below the 200-week average have signaled deeper macro weakness. Volume expanded notably during the sharp weekly selloffs, suggesting forced unwinds and liquidation-driven pressure rather than gradual distribution. However, recent candles show smaller bodies and reduced downside momentum, indicating short-term equilibrium. Technically, $69,000–$70,000 now acts as immediate resistance, aligning with prior support turned overhead supply. A weekly reclaim of that zone would be the first signal of structural recovery. Conversely, failure to defend the $62,000–$64,000 region could open the path toward a broader macro retracement. Featured image from ChatGPT, chart from TradingView.com",Bitcoin News|bitcoin|Bitcoin analysis|Bitcoin Capitulation|bitcoin news|Bitcoin Short-Term Holder|Bitcoin STHs|btc|BTCUSDT,EN,0,0,BTC|BUSINESS|MARKET|TRADING|CRYPTOCURRENCY,"{'name': 'Bitcoinist', 'img': 'https://images.cryptocompare.com/news/default/bitcoinist.png', 'lang': 'EN'}",bitcoinist,2026-03-03 01:00:18
58741103,https://ambcrypto.com/?p=575289,1772499622,https://images.cryptocompare.com/news/default/ambcrypto.png,PEPE becomes weakest among memes – Why THIS trend is warning to bulls,https://ambcrypto.com/pepe-becomes-weakest-among-memes-why-this-trend-is-warning-to-bulls/,Expecting a bullish reaction here could be asking for trouble.,Analysis|HideCryptopanic|Memecoins|News|News 1|No Homepage|Pepe|Social|Trading View|ambcrypto,EN,0,0,MARKET|TRADING|PEPE|CRYPTOCURRENCY,"{'name': 'AMB Crypto', 'img': 'https://images.cryptocompare.com/news/default/ambcrypto.png', 'lang': 'EN'}",ambcrypto,2026-03-03 01:00:22
58741163,https://timestabloid.com/?p=98720,1772499639,https://resources.cryptocompare.com/news/67/default.png,Shiba Inu (SHIB) Price Analysis: Binance Whales Split on Next Move,https://timestabloid.com/shiba-inu-shib-price-analysis-binance-whales-split-on-next-move/,"The largest derivative accounts on Binance are displaying uncertainty regarding Shiba Inu (SHIB), with bullish and bearish positions nearly evenly divided. This indecision comes as the cryptocurrency continues a prolonged period of price correction, and open interest in derivatives contracts declines. Market Positions Indicate Balanced Outlook Current data from Binance highlights that traders with substantial accounts are closely split on SHIB’s potential direction. Approximately 50.3% of positions favor an upward movement, while 49.7% lean toward a decline. When assessed by the size of positions, the balance remains consistent; long contracts represent 49.2% of total exposure, and short positions account for 50.8%. This distribution shows that prominent traders are approaching the market cautiously and are refraining from committing to a strong directional bias. The level of indecision is particularly significant considering the coin’s recent performance. February concluded with SHIB posting a 15% decline, marking its seventh consecutive month of negative returns. Over this period, the cryptocurrency has lost more than half of its value, which would typically encourage a dominant bearish sentiment among experienced market participants. Instead, the data indicates that traders are carefully evaluating risk before making decisive moves. Historical Trends Influence Current Strategy Traders’ reluctance may also reflect awareness of seasonal trends in Shiba Inu trading. March has historically seen pronounced price movements for the token, including a 145% increase recorded in 2024. This previous performance may be encouraging traders to hedge their positions, avoiding premature shorts while maintaining the potential to benefit from a sharp recovery if similar patterns repeat. Beyond position distribution, derivative market metrics indicate a general pullback in speculative activity. Open interest in Shiba Inu futures has fallen by 3% over the past 24 hours, reaching $52.8 million. We are on X, follow us to connect with us :- @TimesTabloid1 — TimesTabloid (@TimesTabloid1) June 15, 2025 This reduction aligns with a 2.7% decrease in SHIB’s spot price, which currently trades near $0.000005534 . The decline in open interest reflects a broader reduction in market participants’ willingness to take on leverage in the current environment. The broader derivatives market has also experienced increased volatility. Liquidations across crypto contracts reached $319.7 million within the last day, including approximately $166,000 tied to Shiba Inu positions. Simultaneously, 24-hour trading volume for SHIB declined by 5%, totaling just over $121 million. Spot inflows to exchanges exceeded outflows, suggesting that holders are distributing assets rather than accumulating them. Current data suggests that Shiba Inu is in a critical stage in its price cycle. If buying pressure fails to increase, market conditions may continue to favor bearish trends. However, the evenly balanced position among leading traders suggests that any significant move could shift market sentiment quickly, depending on new developments or shifts in demand. For now, investors are monitoring SHIB carefully, reflecting both the extended downtrend and the potential for quick market shifts. Disclaimer : This content is meant to inform and should not be considered financial advice. The views expressed in this article may include the author’s personal opinions and do not represent Times Tabloid’s opinion. Readers are urged to do in-depth research before making any investment decisions. Any action taken by the reader is strictly at their own risk. Times Tabloid is not responsible for any financial losses. Follow us on Twitter , Facebook , Telegram , and Google News The post Shiba Inu (SHIB) Price Analysis: Binance Whales Split on Next Move appeared first on Times Tabloid .",Cryptocurrency|News|SHIB|SHIB Price|Shiba Inu,EN,0,0,MARKET|SHIB|TRADING|BNB|CRYPTOCURRENCY,"{'name': 'TimesTabloid', 'img': 'https://resources.cryptocompare.com/news/67/default.png', 'lang': 'EN'}",timestabloid,2026-03-03 01:00:39
58741110,https://www.newsbtc.com/?p=884691,1772499643,https://resources.cryptocompare.com/news/21/58741110.jpeg,"US-Iran War Sparks Crypto Fear, But XRP Stands Out",https://www.newsbtc.com/xrp-news/us-iran-war-crypto-fear-xrp-stands-out/,"US-Israeli strikes on Iran over the weekend have pushed geopolitical risk back to the center of crypto markets, but in CryptoInsightUK’s latest weekly note, the immediate takeaway for XRP is not simple downside. Founder Will Taylor argues that the first shock may be arriving at a moment when bearish positioning is already crowded, creating conditions where XRP could hold up better than Bitcoin and Ethereum if the market absorbs the news without fresh breakdowns. Writing in the Week 184 edition of The Weekly Insight, Taylor framed the conflict first as a volatility event. “There could be extreme volatility in the near term,” he wrote, adding that this was also the kind of backdrop where bottoms can form “on the onset of bad news.” He pushed the point further in a longer passage that gets to the core of his market view: “I am not saying number three is the definite outcome here. But I am saying, and I have said this for a while, that when people are overly invested emotionally in an event and are deeply worried about it, that is often where markets form bottoms. Especially if you do not see strong follow through to the downside.” Related Reading: XRP Faces $650 Million Sell Risk As US-Iran Conflict Sparks Risk-Off Move That distinction matters for XRP because Taylor is not arguing that war is bullish for crypto in itself. He is arguing that the market’s reaction function matters more than the headline. In his read, Bitcoin initially sold off on the news, but the move lacked the kind of follow-through that would usually confirm a deeper washout. He noted that liquidity still sat lower on Bitcoin, around $60,000, and said he would still prefer to see that level swept before calling for a more durable move higher. Ethereum, in his telling, looked similar. Taylor said there was still downside liquidity near $1,720, but stressed that the larger pools of low-timeframe liquidity were sitting above price rather than below it. That left room for another dip, but not necessarily for a structurally bearish reset. Why XRP Looks Different XRP is where his framework becomes more interesting. Taylor argued that XRP had already done some of the work Bitcoin and Ethereum were still waiting to do. “XRP had a spike to the upside about ten days ago that Bitcoin and Ethereum did not have. It showed relative strength there,” he wrote. “And now XRP has already moved down into the liquidity pools that Bitcoin and Ethereum are still waiting to touch. So in a way, XRP has already done what the others have not.” Related Reading: XRP Triangle Could Point To Support Between $0.60 And $0.90 He stopped well short of calling that confirmation, but the implication was clear. If the market was entering a fear-driven macro event and XRP had already traded into nearby liquidity while its larger peers had not, then XRP could be better positioned if the selling pressure fades instead of accelerating. Taylor said he had been discussing the possibility of XRP leading altcoins and “potentially leading the market generally,” with this low-timeframe setup offering at least a hint in that direction. Taylor’s broader thesis rests less on the war itself than on market structure. He continues to argue that Bitcoin still has significant daily liquidity above current levels and can make new all-time highs, while altcoins outperform on the way there. He tied that view to Bitcoin dominance, where he said Bollinger Bands were as tight as they had ever been on the weekly and extremely compressed on the monthly. If that volatility resolves lower, altcoins would be positioned to take share. That is also why he ended the note on XRP against Ethereum. Taylor said the XRP/ETH chart “has started a new trend to the upside” and may be the beginning of a larger impulsive move. His closing framework was blunt: if Bitcoin pushes to new highs, if dominance weakens, and if XRP continues to hold momentum against Ethereum, then “XRP could be setting up for an explosive move.” At press time, XRP traded at $1.3437. Featured image created with DALL.E, chart from TradingView.com",XRP News|crypto|crypto news|xrp|xrp news|XRP Price,EN,0,0,BTC|ETH|MARKET|XRP|CRYPTOCURRENCY,"{'name': 'NewsBTC', 'img': 'https://images.cryptocompare.com/news/default/newsbtc.png', 'lang': 'EN'}",newsbtc,2026-03-03 01:00:43
58741236,https://en.coin-turk.com/?p=215627,1772499748,https://resources.cryptocompare.com/news/79/58741236.jpeg,Atomic Transactions Drive Security and Efficiency in EVM-Based Blockchains,https://en.coin-turk.com/atomic-transactions-drive-security-and-efficiency-in-evm-based-blockchains/,Atomic transactions ensure integrity and security across EVM-based blockchains like Ethereum and Base. Protocols such as Stabull facilitate stable conversions and reduce price risk using real-world data. Continue Reading: Atomic Transactions Drive Security and Efficiency in EVM-Based Blockchains The post Atomic Transactions Drive Security and Efficiency in EVM-Based Blockchains appeared first on COINTURK NEWS .,DeFi News,EN,0,0,ETH|TRADING|CRYPTOCURRENCY,"{'name': 'CoinTurk News', 'img': 'https://resources.cryptocompare.com/news/79/default.png', 'lang': 'EN'}",cointurken,2026-03-03 01:02:28
