id,guid,published_on,imageurl,title,url,body,tags,lang,upvotes,downvotes,categories,source_info,source,date
58393923,https://www.newsbtc.com/?p=883309,1771891223,https://resources.cryptocompare.com/news/21/58393923.jpeg,"XRP Records Worst Weekly Drop Since 2022, Analysts Signal Possible Shakeout Before Q2 Move",https://www.newsbtc.com/news/xrp-records-worst-weekly-drop-since-2022-analysts-signal-possible-shakeout-before-q2-move/,"XRP is facing one of its most difficult stretches in years, with price action, on-chain data, and derivatives activity pointing to a market under pressure. Related Reading: Ready For A 443% Dogecoin Move? The Meme Coin Just Touched A Historically Explosive Level After weeks of steady declines, the token has now recorded its sharpest weekly downturn since 2022, triggering renewed debate among analysts over whether the sell-off marks the start of a deeper correction or the late stages of a broader market shakeout. Currently, XRP is trading near the $1.33–$1.36 range, down roughly 30% over the past month and more than 60% below its July 2025 peak of $3.65. The decline mirrors weakness across the wider digital asset market, where risk appetite has remained subdued amid macroeconomic uncertainty. XRP's price trends to the downside on the daily chart. Source: XRPUSD on Tradingview Capitulation Signals Emerge as Losses Spike One of the most closely watched developments is the surge in realized losses across the network. On-chain data shows investors locked in nearly $1.93 billion in losses over the past week, the largest spike in about 39 months. Realized losses occur when holders sell below their purchase price, often during panic-driven sell-offs. Historically, similar events have coincided with market capitulation phases, where short-term holders exit positions and tokens shift toward longer-term investors. A comparable spike in 2022 was followed by a significant recovery months later, though analysts caution that past performance does not guarantee a repeat. Despite falling prices, trading activity has increased. Spot trading volume jumped above $2.3 billion in 24 hours, while futures volume and open interest also climbed, suggesting traders are actively positioning rather than leaving the market. Key Levels and the “Shakeout” Narrative Technically, the $1.30 level has become a critical support zone. XRP briefly slipped below it before recovering, indicating buying interest remains present. However, analysts warn that a confirmed breakdown could open the path toward $1.20 or even the psychological $1.00 level. Some market watchers argue that the current structure resembles previous consolidation phases that preceded strong rallies. According to this view, another decline toward the $1.10 area remains possible as markets get rid of weaker participants before any sustained move higher. Momentum indicators also reflect pressure. XRP continues trading below key moving averages, and while the relative strength index suggests oversold conditions, no confirmed bullish reversal has formed yet. Structural Factors Shift Focus Toward Q2 Beyond short-term price action, attention is increasingly turning to structural developments that could influence performance later in 2026. Analysts point to improving regulatory clarity, institutional positioning, and planned upgrades to the XRP Ledger aimed at supporting tokenized assets, lending functions, and compliant trading environments. Related Reading: Political Meme Coins Implode: TRUMP Down 92%, MELANIA Nearly Wiped Out Derivatives data adds another layer to the outlook. Open interest remains elevated despite declining prices, a pattern that has historically preceded expansion phases when new capital enters the market. Cover image from ChatGPT, XRPUSD chart from Tradingview",Cryptocurrency Market News|crypto|Ripple|xrp|XRP Price,EN,0,0,BUSINESS|MARKET|TRADING|XRP|CRYPTOCURRENCY,"{'name': 'NewsBTC', 'img': 'https://images.cryptocompare.com/news/default/newsbtc.png', 'lang': 'EN'}",newsbtc,2026-02-24 00:00:23
58393942,https://timestabloid.com/?p=98051,1771891245,https://resources.cryptocompare.com/news/67/default.png,XRP Price Faces Critical Make-or-Break Test. Here’s The Latest,https://timestabloid.com/xrp-price-faces-critical-make-or-break-test-heres-the-latest/,"XRP remains under pressure as weakness across the broader cryptocurrency market continues to suppress buying interest. Currently, the token is trading around $1.37, representing a decline of roughly 60% from its July 2025 peak near $3.60. Since October 2025, price action has followed a persistent downward trajectory, leaving market participants divided on whether XRP is forming a base or preparing for further losses. The current market structure suggests two competing scenarios. One perspective points to a potential recovery phase that could carry prices significantly higher, while the other warns that a breakdown below key support levels may open the door to a much deeper correction. Market Structure and Long-Term Scenarios According to technical analysis shared by market analyst More Crypto Online (MCO) , XRP’s higher-timeframe structure presents both bullish and bearish interpretations. Reviewing the four-day chart, MCO pointed out that recent price action could represent either the early stages of a corrective recovery or it could be the beginning of a final impulsive move toward a broader uptrend. In the first scenario, XRP may be forming a B-wave recovery within a larger ABC corrective structure. Under this framework, upside movement would likely be limited, with a potential move toward the $2.86 region before renewed weakness emerges. On the other hand, a more constructive interpretation views the recent decline as a completed Wave 4 correction, which could set the stage for a fifth-wave rally capable of pushing prices toward the $6 level. While both outcomes remain technically valid, MCO emphasized that his near-term focus is on whether XRP can sustain higher prices during a corrective recovery rather than immediately assuming a full trend reversal. Importance of the $1.21 Support Level An important element in both scenarios is the price reaction around $1.21. This level, reached in early February, aligns with the 50% Fibonacci retracement of the prior impulsive rally that peaked at $3.40 in January 2025. Historically, this retracement zone has acted as a key area of support during trending markets. Despite several attempts to recover, MCO warned that XRP has not yet provided sufficient confirmation that this area represents a lasting bottom. From a structural perspective, XRP entered a broad corrective phase earlier in 2025 after topping above $3. Subsequent rallies failed to establish sustained momentum, even as price revisited the $3 region in both February and July before setting a final high. We are on X, follow us to connect with us :- @TimesTabloid1 — TimesTabloid (@TimesTabloid1) June 15, 2025 If the market decisively breaks below $1.20, particularly beneath the February swing lows, MCO warned that the correction could accelerate. In that case, downside targets may extend into a broader support zone between $0.489 and $0.989, based on an alternative wave count previously outlined in his analysis. Short-Term Price Action Still Uncertain Lower-timeframe analysis further supports the view that XRP has yet to establish directional strength. On the 30-minute chart, price movements have consistently formed three-wave patterns, a structure typically associated with corrective or range-bound behavior rather than impulsive advances. Since the February low, XRP has recorded several modest rallies followed by equally shallow pullbacks, with price oscillating between roughly $1.21 and $1.54. This repeated pattern suggests that buyers have struggled to maintain control. MCO identified the $1.51 to $1.52 area as an early technical threshold. A sustained move above this zone would improve confidence that a short-term base has formed. Beyond that, $1.67 represents the next resistance level traders may monitor. Conversely, failure to hold current levels could result in another test of the $1.36 to $1.31 support range, with a less likely scenario involving a brief dip toward $1.19 before stabilization. XRP is in a critical position. If the token experiences a sustained recovery, it could eventually lead to targets between $2.86 and $6, depending on how the broader structure resolves. However, the lack of clear confirmation around key support means downside risk cannot be dismissed. Disclaimer : This content is meant to inform and should not be considered financial advice. The views expressed in this article may include the author’s personal opinions and do not represent Times Tabloid’s opinion. Readers are urged to do in-depth research before making any investment decisions. Any action taken by the reader is strictly at their own risk. Times Tabloid is not responsible for any financial losses. Follow us on Twitter , Facebook , Telegram , and Google News The post XRP Price Faces Critical Make-or-Break Test. Here’s The Latest appeared first on Times Tabloid .",Cryptocurrency|News|XRP|XRP Price,EN,0,0,MARKET|TRADING|XRP|RESEARCH|CRYPTOCURRENCY,"{'name': 'TimesTabloid', 'img': 'https://resources.cryptocompare.com/news/67/default.png', 'lang': 'EN'}",timestabloid,2026-02-24 00:00:45
58393924,https://u.today/crypto-market-review-ethereum-eth-must-protect-1885-is-xrp-close-to-losing-1-shiba-inu-why-outlook,1771891260,https://resources.cryptocompare.com/news/64/58393924.jpeg,"Crypto Market Review: Ethereum (ETH) Must Protect $1,885, Is XRP Close to Losing $1? Shiba Inu: Why the Outlook is Shifting",https://u.today/crypto-market-review-ethereum-eth-must-protect-1885-is-xrp-close-to-losing-1-shiba-inu-why-outlook,Challenging times on the market are back as most assets tumble back to guarding themselves from bearish attacks.,Shiba Inu,EN,0,0,ETH|MARKET|SHIB|XRP|CRYPTOCURRENCY,"{'name': 'U.Today', 'img': 'https://images.cryptocompare.com/news/default/utoday.png', 'lang': 'EN'}",utoday,2026-02-24 00:01:00
58394106,https://en.coinotag.com/analysis/algo-technical-analysis-february-23-2026-volume-and-accumulation,1771891348,https://resources.cryptocompare.com/news/77/58394106.jpeg,"ALGO Technical Analysis February 23, 2026: Volume and Accumulation",https://en.coinotag.com/analysis/algo-technical-analysis-february-23-2026-volume-and-accumulation,"ALGO's volume remains below average, failing to confirm the decline and instead signaling accumulation. Low participation indicates weak selling pressure and base formation.",Analysis,EN,0,0,ALGO|MARKET|TRADING|CRYPTOCURRENCY,"{'name': 'CoinOtag', 'img': 'https://resources.cryptocompare.com/news/77/default.png', 'lang': 'EN'}",coinotag,2026-02-24 00:02:28
58394067,https://bitcoinworld.co.in/?p=278108,1771891511,https://resources.cryptocompare.com/news/82/default.png,WTI Crude Oil Gripped at $67.00 as Iran Tensions Defy Tariff Pressure,https://bitcoinworld.co.in/wti-crude-oil-iran-tariffs-stall/,"BitcoinWorld WTI Crude Oil Gripped at $67.00 as Iran Tensions Defy Tariff Pressure Global energy markets witnessed a tense equilibrium on Thursday, March 13, 2025, as West Texas Intermediate (WTI) Crude Oil futures struggled to break decisively from the $67.00 per barrel level. This hesitation reflects a direct clash between two powerful market forces: escalating geopolitical risks in the Middle East and the implementation of new, broad-based import tariffs. Consequently, traders and analysts are parsing a complex web of supply concerns and demand anxieties to forecast the commodity’s next major move. WTI Crude Oil Faces a Critical Price Junction The $67.00 mark represents a significant technical and psychological barrier for WTI. Market data from the New York Mercantile Exchange shows repeated tests of this level throughout the trading session, with neither bulls nor bears establishing clear dominance. This stalemate stems from competing narratives. On one hand, renewed friction involving Iran and regional actors injects a traditional geopolitical risk premium into prices. Conversely, the confirmed rollout of additional tariffs by major economies threatens to dampen global industrial activity and, by extension, oil demand. The resulting price action is a textbook example of market indecision, where opposing fundamentals create a narrow trading range. The Geopolitical Counterweight: Iran and Regional Stability Recent developments in the Strait of Hormuz, a chokepoint for roughly 20% of global oil shipments, have reintroduced supply fears. Verified reports from maritime security firms indicate increased naval patrols and diplomatic posturing. “Any incident that threatens the free flow of traffic through the Strait immediately translates into upward pressure on crude benchmarks,” explains Dr. Anya Sharma, a senior fellow at the Global Energy Security Institute. “The market is pricing in a low-probability, high-impact event scenario.” Historical data supports this; similar tensions have previously added $3 to $8 per barrel to oil prices, depending on the severity of the rhetoric and military movements. The Tariff Drag on Global Demand Prospects Offsetting the geopolitical lift is the concrete economic impact of new tariffs. A comparative analysis of the current policy landscape reveals a shift towards protectionism. Recent Tariff Impacts on Oil Demand Forecasts Region Tariff Focus Estimated Demand Impact (2025) North America Manufactured Goods, Steel -150,000 barrels per day European Union Renewable Tech, Batteries -75,000 barrels per day Asia-Pacific Electronics, Semiconductors -200,000 barrels per day These measures, according to the International Energy Agency’s latest monthly report, could shave 0.2% off global GDP growth projections. Slower economic growth directly correlates with reduced fuel consumption for transportation and manufacturing. “The tariff environment creates a palpable headwind,” notes commodity strategist Marcus Chen. “It introduces uncertainty into corporate investment and supply chains, which cools energy consumption. This fundamental pressure is why rallies are being sold at resistance levels like $67.” Inventory Data and the Underlying Market Balance Beyond headlines, physical market indicators provide crucial context. The U.S. Energy Information Administration’s weekly report showed a smaller-than-expected draw in crude stocks, suggesting supply remains adequate. However, refined product inventories, particularly gasoline, tightened. This mixed signal adds another layer to the price stalemate. Key factors currently monitored by traders include: OPEC+ Production Discipline: Compliance levels with agreed output cuts. U.S. Shale Rig Count: A leading indicator of future domestic production. Global Freight Rates: Costs for shipping oil, which spike during disruptions. U.S. Strategic Petroleum Reserve: Government sales or purchases can influence supply. Expert Analysis on the Path Forward for Energy Markets The current impasse is unlikely to last indefinitely. Market technicians point to a narrowing price channel on daily charts, suggesting a volatility contraction that often precedes a significant breakout. The direction of that breakout hinges on which narrative gains supremacy. “If diplomatic channels succeed in de-escalating Middle Eastern tensions, the market’s focus will swiftly return to the deteriorating demand outlook from tariffs,” predicts Sharma. “Conversely, a single tangible disruption to supply would overwhelm the tariff concerns and likely propel WTI toward the $70-$72 range.” Historical precedent shows that supply shocks typically have a more immediate and violent impact on oil prices than gradual demand erosion. Conclusion The hesitation of WTI Crude Oil at the $67.00 threshold perfectly encapsulates the dual forces shaping the 2025 energy landscape. Geopolitical instability in Iran provides a floor for prices, while the broad application of global tariffs creates a formidable ceiling. For investors and policymakers, this moment underscores the fragile balance between physical supply security and economic demand health. The resolution of this standoff will depend on whether the next major headline originates from a diplomatic office or a shipping lane. Until then, the market for WTI Crude Oil remains in a state of anxious equilibrium, with every price tick scrutinized for clues to the future. FAQs Q1: Why is the $67.00 level specifically important for WTI Crude Oil? The $67.00 price represents a key technical resistance level based on recent trading history. It also aligns with the breakeven cost for many U.S. shale producers, making it a zone where increased selling or production can emerge. Q2: How do tariffs specifically lower oil demand? Tariffs increase the cost of traded goods, which can slow down manufacturing and economic growth. Reduced industrial activity and lower consumer spending on goods that require shipping lead to decreased consumption of diesel, jet fuel, and other petroleum products. Q3: What is a ‘geopolitical risk premium’ in oil pricing? This is an additional amount factored into the oil price due to the potential for supply disruptions from political unrest, conflict, or sanctions in major oil-producing regions. It reflects the market’s collective anxiety about future supply. Q4: Could rising oil prices themselves worsen inflation and justify more tariffs? Yes, this is a risk known as a feedback loop. Higher oil prices raise transportation and production costs broadly, fueling inflation. Central banks may respond with tighter policy, which can slow the economy, while governments might consider tariffs to protect domestic industries, further complicating the demand picture. Q5: What other factors, besides Iran and tariffs, could influence WTI prices next? Key factors include decisions by the OPEC+ alliance on production quotas, the rate of adoption of electric vehicles, the severity of the Atlantic hurricane season (which affects Gulf of Mexico production), and changes in the value of the U.S. dollar, as oil is globally priced in dollars. This post WTI Crude Oil Gripped at $67.00 as Iran Tensions Defy Tariff Pressure first appeared on BitcoinWorld .",Forex News|commodities|Crude Oil|Energy markets|Geopolitics|trade,EN,0,0,BUSINESS|COMMODITY|MARKET|TRADING|MACROECONOMICS,"{'name': 'Bitcoin World', 'img': 'https://resources.cryptocompare.com/news/82/default.png', 'lang': 'EN'}",bitcoinworld,2026-02-24 00:05:11
