id,guid,published_on,imageurl,title,url,body,tags,lang,upvotes,downvotes,categories,source_info,source,date
57682267,https://bitcoinworld.co.in/?p=268088,1770080412,https://resources.cryptocompare.com/news/82/default.png,Trump UAE Investment Denial Sparks Intense Scrutiny Over $500M DeFi Deal and Nvidia Chip Approvals,https://bitcoinworld.co.in/trump-denies-uae-investment-family-defi/,"BitcoinWorld Trump UAE Investment Denial Sparks Intense Scrutiny Over $500M DeFi Deal and Nvidia Chip Approvals WASHINGTON, D.C. – In a development that has ignited significant political and ethical debate, former President Donald Trump has publicly stated he possesses no knowledge of a substantial $500 million investment by a United Arab Emirates royal entity into World Liberty Financial (WLFI), a decentralized finance project with leadership ties to his family. This denial, however, arrives amidst a complex backdrop of concurrent U.S. government approvals for advanced technology exports to the same Middle Eastern nation, prompting members of Congress to voice serious concerns about potential conflicts of interest and national security implications that demand thorough investigation. Trump UAE Investment Denial and the WLFI Project Details President Trump’s recent comments directly address reports first published by major financial outlets. According to those reports, Aryam Investment, a firm backed by UAE royal and influential National Security Advisor Sheikh Tahnoon bin Zayed Al Nahyan, acquired a 49% stake in World Liberty Financial last year. The transaction’s value was reportedly $500 million. Consequently, Trump clarified that his adult sons, who are reportedly involved with WLFI, are handling the matter. This structure of family business operations separate from political office has been a recurring theme, yet it consistently attracts scrutiny regarding the separation of personal financial interests from public policy. World Liberty Financial positions itself as a next-generation DeFi platform. The decentralized finance sector aims to recreate traditional financial systems—like lending and borrowing—using blockchain technology, thereby operating without central intermediaries like banks. The involvement of a high-profile political family in such a technologically and financially complex venture is unusual. Furthermore, the scale of foreign investment from a nation with deep geopolitical ties to the U.S. introduces multiple layers of analysis for observers. Parallel Approval of Nvidia AI Chips to the UAE Simultaneously, and adding considerable weight to congressional concerns, the U.S. Department of Commerce approved the sale of hundreds of thousands of advanced Nvidia artificial intelligence (AI) chips to the United Arab Emirates. These chips, notably the H100 and A100 models, are critical for training sophisticated AI systems and are subject to export controls due to their potential dual-use applications in military and surveillance technology. Notably, some of these chips are reportedly destined for G42, an Abu Dhabi-based artificial intelligence firm. Sheikh Tahnoon, the same royal figure linked to the WLFI investment, chairs G42. This confluence of events—a major private investment in a Trump-family-linked project followed by a favorable U.S. government decision benefiting the investor’s other commercial interests—forms the core of the ethical debate. While no evidence suggests a direct quid pro quo, the timing and parties involved create an appearance that ethics experts find problematic. The table below outlines the key sequence and relationships: Timeline Event Key Entities 2024 Aryam Investment (UAE) acquires 49% of WLFI for $500M Sheikh Tahnoon, Trump Family, WLFI Early 2025 U.S. approves massive Nvidia AI chip sale to UAE U.S. Dept. of Commerce, UAE Tech Firms Early 2025 Reports link chips to G42, chaired by Sheikh Tahnoon G42, Nvidia, Sheikh Tahnoon Recent Trump denies knowledge of WLFI investment Former President Trump Expert Analysis on Political Ethics and National Security Governance and ethics specialists highlight that the situation underscores persistent challenges in U.S. conflict-of-interest laws, particularly regarding family members of public officials. “The modern financial and technological landscape creates new vectors for potential influence,” notes Dr. Evelyn Reed, a professor of political ethics at Georgetown University. “When a foreign government-linked entity makes a substantial investment in a company tied to a political figure’s family, and that same foreign entity subsequently receives sensitive technology approvals, it necessitates transparent and independent review. The principle at stake is the integrity of policy decisions, ensuring they are made solely for the national interest.” From a national security perspective, the dual threads of advanced AI and cryptocurrency intersect. DeFi projects can pose challenges for financial monitoring and sanctions enforcement. Meanwhile, advanced AI chips have clear strategic and military applications. The involvement of a UAE royal, who also serves as a top national security advisor, in both sectors simultaneously with the U.S. raises legitimate questions about long-term strategic alignment and technology transfer risks. Congressional Response and Legal Frameworks In response to these reports, bipartisan members of Congress have called for inquiries. Letters have been sent to the Departments of Justice, Commerce, and Treasury requesting reviews of the WLFI investment under the Committee on Foreign Investment in the United States (CFIUS) framework and of the chip approvals under export control regulations. Key concerns cited include: Potential Emoluments Clause Violations: Constitutional provisions preventing presidents from receiving gifts or benefits from foreign states. Conflict of Interest: The apparent overlap between family business dealings and foreign policy outcomes. National Security: Whether the investment could influence or provide leverage over policy decisions regarding technology exports and Middle Eastern relations. Legal experts point out that proving a legal violation is complex and requires evidence of a specific exchange. However, the court of public opinion and historical precedent often judges such matters on the perception of propriety. The situation also tests the robustness of financial disclosure requirements for family members of political leaders, which many advocates argue need strengthening in an era of globalized digital finance. Broader Implications for Cryptocurrency and Foreign Policy This incident places the cryptocurrency industry under a different kind of spotlight. Typically, regulatory discussions focus on investor protection, market stability, and illicit finance. This case, however, introduces geopolitics and political ethics into the DeFi conversation. It demonstrates how blockchain-based projects can become entangled in high-stakes international relations, potentially attracting investment from entities with political motivations beyond pure profit. For U.S.-UAE relations, the matter is delicate. The UAE is a critical strategic partner in the Middle East, collaborating on security, intelligence, and economic initiatives. Balancing this partnership with rigorous enforcement of domestic ethical and legal standards presents an ongoing challenge for the administration. How Congress and relevant agencies handle this situation will signal the U.S.’s commitment to its own governance principles while managing vital international alliances. Conclusion The denial of knowledge by former President Trump regarding the $500 million Trump UAE investment in the family-linked World Liberty Financial DeFi project is merely the starting point of a multifaceted issue. The concurrent approval of advanced Nvidia AI chips to the UAE, benefiting firms connected to the same investor, has rightly triggered congressional scrutiny and public debate over conflicts of interest. This case sits at the intersection of political ethics, national security, and emerging technology, highlighting the urgent need for clear, modernized standards to govern the financial activities of public officials’ families in a globalized digital economy. The ongoing investigations will be crucial in determining the facts and restoring public confidence in the integrity of foreign policy and technology export decisions. FAQs Q1: What is World Liberty Financial (WLFI)? World Liberty Financial is a decentralized finance (DeFi) project that utilizes blockchain technology to offer financial services like lending outside of traditional banking systems. Reports indicate leadership ties to the Trump family. Q2: Who is Sheikh Tahnoon and why is he significant? Sheikh Tahnoon bin Zayed Al Nahyan is a senior royal in the United Arab Emirates, serving as the country’s National Security Advisor. He also chairs G42, a major AI company, and is linked to the investment firm Aryam, which invested in WLFI. Q3: What are the main concerns raised by Congress? Members of Congress are concerned about potential conflicts of interest, violations of the Emoluments Clause, and national security risks stemming from the combination of a large UAE investment in a Trump-family project and subsequent U.S. approval of sensitive AI technology exports to the UAE. Q4: Has any illegal activity been proven? No. As of now, these are allegations and concerns based on reported events and their timing. Several government agencies have been asked to investigate to determine if any laws or regulations were violated. Q5: How does this affect U.S.-UAE relations? The situation creates diplomatic sensitivity. The UAE is a key strategic partner, but this incident tests the relationship by forcing a U.S. internal review of ethical standards and technology export controls related to a close ally’s influential figures. This post Trump UAE Investment Denial Sparks Intense Scrutiny Over $500M DeFi Deal and Nvidia Chip Approvals first appeared on BitcoinWorld .",Crypto News|CRYPTOCURRENCY|Ethics|foreign investment|national security|Politics,EN,0,0,BUSINESS|MARKET|REGULATION|TECHNOLOGY|CRYPTOCURRENCY,"{'name': 'Bitcoin World', 'img': 'https://resources.cryptocompare.com/news/82/default.png', 'lang': 'EN'}",bitcoinworld,2026-02-03 01:00:12
57682220,https://timestabloid.com/?p=96300,1770080424,https://resources.cryptocompare.com/news/67/default.png,Dogecoin (DOGE) Blasts Off: Here’s the Latest,https://timestabloid.com/dogecoin-doge-blasts-off-heres-the-latest/,"Dogecoin has recorded a significant surge in futures trading activity despite broader market weakness. This event has drawn attention from investors, prompting questions about the token’s short-term outlook. Dogecoin initially began last week on a high note, with gains that extended into Tuesday. However, the rally went off course mid-week after reaching a high of $0.127. This was due to increased selling pressure from traders scrambling to lock in profit. The token experienced further decline , which corresponded with the broader market downturn. Traders Opt For Low-Risk Investment Dogecoin’s recent trading activity reflects a reduced appetite for risk among traders across the global financial market. Investors have been seen shifting from higher-risk assets and investment vehicles, including cryptocurrencies. This new attitude of playing it safe has ultimately contributed to increased losses in the crypto market. According to the derivatives market, more than $509 million in crypto futures positions were liquidated during last week’s session. These liquidations represented a 57% increase compared to the previous trading day. A large portion of the liquidation involved long positions, indicating that many traders had been positioned for continued price appreciation before the market turned downwards. Although the U.S Federal Reserve’s decision to hold the interest rate steady was widely expected, investors were still eager to play it safe by moving away from riskier assets, resulting in increased selling pressure across the crypto market. According to data from CoinMarketCap , Dogecoin is currently trading at $0.1059, reflecting a slight daily gain of 0.24% and a 12.56% decline in the past week. Monthly performance also remains negative, with no evidence of the recent upward momentum. We are on X, follow us to connect with us :- @TimesTabloid1 — TimesTabloid (@TimesTabloid1) June 15, 2025 Reduced Whale Activity Signals Loss of Confidence CoinGlass data shows Dogecoin open interest at $1.27 billion, signaling a 4.86% increase from its initial 1.38% loss on the 28th of January. Before this week’s increase, Dogecoin’s whale activity dropped by 94.6%, showing large transactions of over $1 million dropping from 109 to 6 in the last month. Similarly, Dogecoin’s spot trading volume fell by 13% during last week’s session, and it remains down by roughly 12% at the time of writing. Despite negative trends across most Dogecoin metrics , futures activity showed a significant exception. CoinGlass reported that futures volume on BitMEX surged over 10,000% in a 24-hour window during last week’s trading session, reaching approximately $200.98 million. From a technical perspective, immediate support levels are at $0.11 and $0.10 if prices continue to decline, while a potential rebound could face resistance near $0.133, aligned with the 50-day moving average. Dogecoin is currently showing mixed signals. When the negative on-chain metrics and spot trading are compared to increasing futures volume, it signals uncertainty in the token’s short-term outlook. This uncertainty reinforces the need for careful observation and risk management. Disclaimer : This content is meant to inform and should not be considered financial advice. The views expressed in this article may include the author’s personal opinions and do not represent Times Tabloid’s opinion. Readers are urged to do in-depth research before making any investment decisions. Any action taken by the reader is strictly at their own risk. Times Tabloid is not responsible for any financial losses. Follow us on Twitter , Facebook , Telegram , and Google News The post Dogecoin (DOGE) Blasts Off: Here’s the Latest appeared first on Times Tabloid .",Cryptocurrency|News|DOGE|Dogecoin,EN,0,0,BUSINESS|DOGE|MARKET|TRADING|CRYPTOCURRENCY,"{'name': 'TimesTabloid', 'img': 'https://resources.cryptocompare.com/news/67/default.png', 'lang': 'EN'}",timestabloid,2026-02-03 01:00:24
57682258,https://ambcrypto.com/?p=566903,1770080445,https://images.cryptocompare.com/news/default/ambcrypto.png,XRP price prediction: What the loss of the $1.77 swing low means for you,https://ambcrypto.com/xrp-price-prediction-what-the-loss-of-the-1-77-swing-low-means-for-you/,The H4 chart showed that a bounce toward the $1.90 area would represent a selling opportunity.,Altcoin|Analysis|HideCryptopanic|News|News 1|No Homepage|Ripple|Social|Trading View|ambcrypto,EN,0,0,ALTCOIN|MARKET|TRADING|XRP|CRYPTOCURRENCY,"{'name': 'AMB Crypto', 'img': 'https://images.cryptocompare.com/news/default/ambcrypto.png', 'lang': 'EN'}",ambcrypto,2026-02-03 01:00:45
57682346,https://bitcoinworld.co.in/?p=268086,1770080711,https://resources.cryptocompare.com/news/82/default.png,Altcoin Season Index Plummets to 30: A Stark Signal of Bitcoin’s Dominant Resurgence,https://bitcoinworld.co.in/altcoin-season-index-drops-bitcoin-dominance-2/,"BitcoinWorld Altcoin Season Index Plummets to 30: A Stark Signal of Bitcoin’s Dominant Resurgence Global cryptocurrency markets witnessed a significant shift this week as the widely monitored Altcoin Season Index from CoinMarketCap fell to a reading of 30, a clear indicator of Bitcoin’s strengthening dominance over the broader digital asset landscape. This two-point drop from the previous day’s reading underscores a persistent trend that has defined the first quarter of 2025, moving the market further from the threshold of an official ‘altcoin season.’ Analysts scrutinize this data point as a crucial barometer for investor sentiment and capital rotation within the volatile crypto ecosystem. Decoding the Altcoin Season Index Drop to 30 The Altcoin Season Index serves as a quantitative measure for market cycles. CoinMarketCap calculates this metric by comparing the 90-day performance of the top 100 cryptocurrencies by market capitalization against Bitcoin’s performance over the same period. The platform excludes stablecoins and wrapped tokens from this analysis to focus purely on speculative assets. A reading above 75 signals an ‘altcoin season,’ where a majority of major altcoins outperform Bitcoin. Conversely, a reading of 30 firmly indicates a ‘Bitcoin season.’ This current reading suggests that only a small fraction of the top altcoins have managed to outpace Bitcoin’s price action over the last three months. Historically, periods of Bitcoin dominance often correlate with macroeconomic uncertainty or moments when investors seek the perceived safety and established network effects of the largest cryptocurrency. The index’s decline is not an isolated event but part of a broader narrative involving regulatory developments, institutional investment flows, and shifting risk appetites. The Mechanics Behind the Metric Understanding the index requires a look at its components. The calculation is straightforward yet powerful: Benchmark: Bitcoin’s 90-day price percentage change. Comparison Group: The 90-day price change of each of the top 100 non-stablecoin assets. Output: The percentage of assets in the comparison group that outperformed the benchmark. Therefore, an index of 30 means approximately 30 out of 100 leading altcoins have beaten Bitcoin’s returns since early December 2024. This data provides a more nuanced view than simply observing Bitcoin’s dominance percentage, which measures market cap share rather than relative performance. Historical Context and Market Cycle Implications Bitcoin seasons and altcoin seasons typically alternate in multi-year market cycles. For instance, the bull run of late 2020 into early 2021 saw the Altcoin Season Index reach and sustain readings above 75 for extended periods, characterized by explosive growth in decentralized finance (DeFi) and non-fungible token (NFT) projects. Conversely, the bear market of 2022 was predominantly a Bitcoin season, where BTC often demonstrated relative resilience during sharp downturns. The transition between seasons is rarely abrupt. It usually involves a period where Bitcoin leads a market recovery, attracting initial capital and confidence. Subsequently, as investor confidence grows and narratives around specific blockchain use cases gain traction, capital begins to ‘rotate’ from Bitcoin into altcoins, pushing the index higher. The current low reading suggests this rotation has either stalled or reversed. Several factors contribute to this environment: Institutional Focus: Recent approvals and inflows into U.S. spot Bitcoin ETFs have directed massive institutional attention and capital almost exclusively toward Bitcoin. Macroeconomic Pressure: In times of economic tightening or geopolitical tension, crypto investors often exhibit a ‘flight to quality’ within the asset class, favoring Bitcoin. Regulatory Clarity (or Lack Thereof): While Bitcoin has achieved certain regulatory milestones, the landscape for many altcoins, particularly those deemed securities, remains uncertain, dampening enthusiasm. Expert Analysis on the Current Reading Market analysts interpret the Index at 30 as a sign of consolidation and selectivity. ‘This isn’t necessarily a negative signal for altcoins universally,’ notes a report from blockchain analytics firm IntoTheBlock. ‘It indicates a market that is rewarding specific, proven narratives and punishing speculative excess. Bitcoin is acting as the bedrock.’ The performance gap is not uniform across all altcoin sectors. For example, while many meme coins and smaller-cap projects have struggled, certain segments like blockchain infrastructure or real-world asset (RWA) tokenization have shown more resilience relative to Bitcoin, though not enough to shift the aggregate index. Data from other platforms corroborates this trend. The ‘Bitcoin Dominance’ chart, which tracks BTC’s share of the total crypto market capitalization, has risen steadily alongside the falling Altcoin Season Index. This parallel movement confirms that capital is not only performing better in Bitcoin but is also allocating a larger portion of the total market value to it. Comparative Performance: A Snapshot The table below illustrates a hypothetical snapshot of performance comparisons driving the index, based on common market observations when the index is low: Asset Type 90-Day Performance vs. Bitcoin Typical Impact on Index Bitcoin (BTC) Benchmark (e.g., +15%) N/A Major Large-Cap Altcoins (ETH, BNB) Slightly Underperforming Contributes to lower reading Mid-Cap DeFi/Smart Contract Tokens Moderately Underperforming Significantly lowers reading Small-Cap & Meme Coins Sharply Underperforming Drains index reading down Niche Outperformers (e.g., specific L1s, RWA) Outperforming Provides the ~30% positive reading What a Low Altcoin Season Index Means for Investors For traders and long-term holders alike, this metric offers actionable intelligence. Firstly, it highlights the current risk-reward profile. Investing in altcoins during a strong Bitcoin season generally carries higher relative risk, as the broader trend does not support blanket altcoin appreciation. Secondly, it emphasizes the importance of fundamental research. In such an environment, altcoin projects with strong utility, clear revenue models, and robust ecosystems are more likely to be among the 30% that outperform, separating them from purely speculative assets. Furthermore, a low index can present accumulation opportunities for patient investors. Historical data shows that periods of extreme Bitcoin dominance often precede eventual altcoin rallies. Savvy investors may use this time to research and strategically build positions in fundamentally sound projects at lower relative valuations, anticipating a future cycle shift. However, this strategy requires a long time horizon and tolerance for volatility. The Path Forward: Monitoring for a Shift Market participants will watch for catalysts that could reverse the trend. Key indicators include a stabilization or decline in Bitcoin dominance, a surge in positive altcoin-specific news flow (such as major protocol upgrades or regulatory green lights), and increased trading volume in altcoin pairs independent of Bitcoin’s movements. The Altcoin Season Index itself will be the primary gauge. A sustained climb above 50 would signal weakening Bitcoin dominance, while a move above 75 would officially declare a new altcoin season. Conclusion The Altcoin Season Index reading of 30 provides a clear, data-driven snapshot of the current cryptocurrency market structure, unequivocally signaling a Bitcoin season. This phase underscores Bitcoin’s role as the market leader and a relative safe haven during uncertain times. While challenging for broad altcoin portfolios, this environment encourages disciplined investment strategies and highlights the performance of individual projects with substantive fundamentals. As the market evolves, this index will remain a critical tool for gauging the delicate balance of power and performance between Bitcoin and the diverse universe of altcoins. FAQs Q1: What does an Altcoin Season Index of 30 mean? An index reading of 30 means that only about 30% of the top 100 cryptocurrencies have outperformed Bitcoin over the past 90 days. This firmly classifies the current period as a ‘Bitcoin season,’ where BTC is the dominant performer. Q2: How is the Altcoin Season Index calculated? CoinMarketCap calculates the index by comparing the 90-day price performance of each of the top 100 coins (excluding stablecoins and wrapped tokens) against Bitcoin’s performance over the same period. The percentage that outperforms BTC becomes the index reading. Q3: Is a low Altcoin Season Index bad for the crypto market? Not necessarily. It indicates a phase in the market cycle. Bitcoin seasons often involve consolidation, establish a stronger price floor, and can precede periods where capital rotates into altcoins. It reflects current investor preference for the largest, most established asset. Q4: Can some altcoins still do well when the index is low? Yes. An index of 30 explicitly indicates that roughly 30 out of 100 major altcoins are outperforming Bitcoin. This highlights a selective market where projects with strong fundamentals, specific catalysts, or niche utility can still thrive even in a dominant Bitcoin trend. Q5: What typically causes the index to rise again into an altcoin season? A shift usually requires a combination of factors: Bitcoin’s price stabilizing or consolidating after a rally, increased investor risk appetite, the emergence of compelling new narratives or technologies in the altcoin space, and broader capital inflows into the crypto market that begin to seek higher beta opportunities beyond Bitcoin. This post Altcoin Season Index Plummets to 30: A Stark Signal of Bitcoin’s Dominant Resurgence first appeared on BitcoinWorld .",Crypto News|ALTCOINS|BITCOIN|BLOCKCHAIN|CRYPTOCURRENCY|Market Analysis,EN,0,0,ALTCOIN|BTC|MARKET|TRADING|CRYPTOCURRENCY,"{'name': 'Bitcoin World', 'img': 'https://resources.cryptocompare.com/news/82/default.png', 'lang': 'EN'}",bitcoinworld,2026-02-03 01:05:11
