id,guid,published_on,imageurl,title,url,body,tags,lang,upvotes,downvotes,categories,source_info,source,date
59038222,https://bitcoinworld.co.in/?p=284890,1773025512,https://resources.cryptocompare.com/news/82/default.png,"Gold Price Plummets Below $5,100 as Oil Rally Sparks Inflation Panic, Fed Rate Cut Hopes Dim",https://bitcoinworld.co.in/gold-price-plunge-oil-inflation-fed/,"BitcoinWorld Gold Price Plummets Below $5,100 as Oil Rally Sparks Inflation Panic, Fed Rate Cut Hopes Dim Global financial markets faced significant pressure on Tuesday, March 18, 2025, as the spot price of gold tumbled decisively below the critical $5,100 per ounce threshold. This sharp decline, one of the most pronounced single-day drops of the year, directly correlates with a powerful rally in crude oil prices that has reignited persistent inflation fears. Consequently, market expectations for imminent monetary policy easing by the U.S. Federal Reserve have rapidly faded, reshaping the investment landscape for precious metals and other inflation-sensitive assets. Gold Price Collapse Triggers Market Alarm The precious metal’s dramatic fall represents a stark reversal from its recent role as a safe-haven asset. Market data from major exchanges shows gold shedding over 4% in value during the London and New York trading sessions. This move breached several key technical support levels that analysts had been monitoring closely. The sell-off was broad-based, impacting gold futures, ETFs like the SPDR Gold Shares (GLD), and physical bullion markets simultaneously. Trading volumes spiked to levels not seen since the previous quarter, indicating widespread institutional repositioning. Several interconnected factors drove this rapid devaluation. Primarily, the surging opportunity cost of holding non-yielding assets like gold became untenable for many investors. As expectations for Federal Reserve rate cuts diminished, Treasury yields climbed, making government bonds more attractive. Furthermore, the U.S. dollar index (DXY) strengthened by 0.8%, applying additional downward pressure on dollar-denominated commodities. The following table illustrates the key price movements across related assets: Asset Price Change (March 18, 2025) Key Level Spot Gold (XAU/USD) -4.2% Broke below $5,100 Brent Crude Oil +5.7% Surpassed $112 per barrel U.S. 10-Year Treasury Yield +14 basis points Rose to 4.45% U.S. Dollar Index (DXY) +0.8% Reached 106.5 Oil Rally Reignites Stubborn Inflation Concerns Concurrently, global crude oil benchmarks experienced a powerful rally, with Brent crude surging past $112 per barrel. This surge, driven by a combination of geopolitical supply risks and stronger-than-anticipated global demand data, acted as the primary catalyst for shifting market sentiment. Energy analysts point to renewed tensions in key production regions and a report from the International Energy Agency (IEA) revising 2025 demand growth upward as immediate triggers. The correlation between oil prices and inflation expectations is well-established in economic theory. Higher energy costs permeate throughout the economy, increasing production and transportation expenses for virtually all goods and services. Consequently, market-based measures of inflation expectations, such as the 5-year, 5-year forward inflation swap rate, jumped significantly. This development directly challenges the narrative of sustainably returning to the Federal Reserve’s 2% inflation target, a cornerstone of the argument for impending rate cuts. Expert Analysis on the Macroeconomic Shift Dr. Anya Sharma, Chief Economist at the Global Markets Institute, provided context on the sudden shift. “The market is undergoing a fundamental repricing,” she stated. “The gold sell-off is not an isolated event but a symptom of a broader reassessment. Investors are confronting the reality that the ‘last mile’ of inflation control may be far more difficult than anticipated. The oil price shock serves as a painful reminder that global supply chains remain vulnerable, and the Fed’s path will be dictated by data, not calendar-based expectations.” Her analysis aligns with recent comments from several Federal Reserve officials, who have emphasized a cautious, data-dependent approach. The rally in oil, and its subsequent impact on consumer and producer price indices, provides the central bank with a compelling reason to maintain a restrictive policy stance for longer. Futures markets now price in a drastically reduced probability of a rate cut at the Fed’s June meeting, with the first full cut not fully priced until the fourth quarter of 2025. Federal Reserve Policy Expectations Fade Rapidly The dramatic shift in interest rate expectations forms the core of the current market turmoil. At the beginning of March, the CME FedWatch Tool indicated a nearly 70% probability of at least a 25-basis-point cut by July. Following the oil rally and subsequent inflation fears, that probability has collapsed below 30%. This repricing has profound implications across asset classes: Equities: High-growth technology stocks, sensitive to discount rates, faced selling pressure. Currencies: The U.S. dollar gained strength as higher-for-longer rates increase its yield appeal. Real Estate: Mortgage rates ticked higher, cooling sentiment in housing markets. Commodities: Industrial metals like copper also declined on fears of slower economic growth. This environment creates a classic headwind for gold. The metal pays no interest, so its attractiveness diminishes when rising real yields increase the opportunity cost of holding it. Historical analysis shows that periods of aggressive Fed tightening or paused easing cycles typically correlate with stagnant or declining gold prices, as seen in the 2013 taper tantrum and the 2018 rate hike cycle. Historical Context and Market Impact The current price action echoes previous episodes where commodity-driven inflation surprised markets. For instance, the oil price spikes of 2008 and 2011 led to similar sell-offs in gold after initial inflation-hedge rallies, as central banks signaled a commitment to fighting price pressures through tighter policy. The key difference in 2025 is the starting point of elevated interest rates, leaving less room for aggressive hikes but ample justification for a prolonged pause. The immediate impact on related markets has been significant. Mining stocks, represented by indexes like the NYSE Arca Gold BUGS Index (HUI), fell even more sharply than the underlying metal due to operational leverage. Meanwhile, traditional hedges like long-duration Treasuries also lost value as yields rose. This has left investors searching for effective portfolio diversifiers in an environment where both bonds and gold are declining simultaneously—a historically rare occurrence. The Path Forward for Precious Metals Looking ahead, the trajectory for gold hinges on the evolving inflation narrative. If oil prices stabilize or retreat, and subsequent CPI and PCE reports show core inflation continuing to moderate, expectations for Fed easing could resurface, potentially supporting gold. However, if energy-led inflation proves persistent, the Fed’s hawkish stance may solidify, extending the pressure on non-yielding assets. Physical demand from central banks and key consumer markets like China and India will provide a crucial floor, but may not be sufficient to drive prices higher in the face of strong monetary headwinds. Conclusion The gold price plunge below $5,100 serves as a powerful signal of shifting macroeconomic tides. It underscores the market’s acute sensitivity to inflation data and central bank policy signals. The concurrent oil rally has successfully stoked inflation fears , forcing a rapid recalibration of bets on Federal Reserve easing. For investors, this episode highlights the complex interplay between commodities, monetary policy, and asset prices. The immediate future for gold will likely be dictated by the persistence of energy price pressures and the resulting data that guides the Fed’s hand, reminding all market participants that the battle against inflation remains the dominant theme of 2025. FAQs Q1: Why did the price of gold fall so sharply? The price of gold fell primarily because a sharp rally in oil prices increased fears of persistent inflation. This caused investors to reduce their expectations for near-term interest rate cuts by the Federal Reserve. Higher interest rates (or the expectation that rates will stay high) make non-yielding assets like gold less attractive compared to bonds that pay interest. Q2: What is the connection between oil prices and gold prices? Oil prices are a major input for global inflation. When oil prices rise sharply, it increases costs throughout the economy, leading to higher overall inflation. Central banks, like the Federal Reserve, often respond to rising inflation by keeping interest rates higher for longer. Since gold does not pay interest, it becomes less desirable in a high-rate environment, leading to selling pressure. Q3: How have expectations for Federal Reserve rate cuts changed? Market expectations have shifted dramatically. Prior to the oil rally, investors were pricing in a high probability of rate cuts starting in mid-2025. Following the inflation scare, the first full rate cut is now not expected until late 2025, with the possibility of further delays if inflation data remains elevated. Q4: Could this be a buying opportunity for gold? Some long-term investors and central banks may view significant price drops as accumulation opportunities, especially if physical demand remains strong. However, the short-term trend will depend on upcoming inflation data and Federal Reserve communications. The current environment of high real interest rates presents a clear headwind. Q5: What other assets were affected by this market move? The sell-off extended beyond gold. Treasury bond prices fell (yields rose), the U.S. dollar strengthened, and growth-oriented stock sectors declined. Other commodities, like industrial metals, also faced pressure due to concerns that higher rates could slow economic growth and demand. This post Gold Price Plummets Below $5,100 as Oil Rally Sparks Inflation Panic, Fed Rate Cut Hopes Dim first appeared on BitcoinWorld .",Forex News|#Markets|Federal Reserve|Gold|Inflation|Oil,EN,0,0,COMMODITY|FIAT|MARKET|TRADING|MACROECONOMICS,"{'name': 'Bitcoin World', 'img': 'https://resources.cryptocompare.com/news/82/default.png', 'lang': 'EN'}",bitcoinworld,2026-03-09 03:05:12
59038449,https://en.coinotag.com/analysis/avax-technical-analysis-march-9-2026-volume-and-accumulation,1773025771,https://resources.cryptocompare.com/news/77/59038449.jpeg,"AVAX Technical Analysis March 9, 2026: Volume and Accumulation",https://en.coinotag.com/analysis/avax-technical-analysis-march-9-2026-volume-and-accumulation,"AVAX volume remains below recent averages, indicating low market participation; the price recovery is without volume and weak. The risk of downtrend continuation is high; a volume increase is essen...",Analysis,EN,0,0,AVAX|MARKET|TRADING|CRYPTOCURRENCY,"{'name': 'CoinOtag', 'img': 'https://resources.cryptocompare.com/news/77/default.png', 'lang': 'EN'}",coinotag,2026-03-09 03:09:31
59038334,https://bitcoinworld.co.in/?p=284889,1773025812,https://resources.cryptocompare.com/news/82/default.png,"China CPI Inflation Soars: February Rate Hits 1.3% YoY, Defying Gloomy Forecasts",https://bitcoinworld.co.in/china-cpi-inflation-february-2025/,"BitcoinWorld China CPI Inflation Soars: February Rate Hits 1.3% YoY, Defying Gloomy Forecasts BEIJING, March 2025 – China’s Consumer Price Index (CPI) delivered a significant surprise in February, climbing to a year-on-year rate of 1.3%. This figure substantially exceeded the 0.8% consensus forecast from economists, signaling a potential shift in the country’s persistent low-inflation environment. The data, released by the National Bureau of Statistics (NBS), immediately sparked analysis regarding its drivers and its implications for monetary policy and global markets. China CPI Inflation Data Exceeds Expectations The reported 1.3% China CPI inflation rate for February represents a notable acceleration from previous months. Consequently, analysts are scrutinizing the component breakdown. Food prices, a critical segment in the Chinese CPI basket, showed particular strength. For instance, prices for fresh vegetables and pork, a staple protein, contributed significantly to the uptick. Meanwhile, non-food inflation also exhibited moderate firming. This broad-based increase suggests the figure is not merely a seasonal anomaly. Furthermore, the month-on-month change provides additional context. The sequential increase points to building price pressures as the Lunar New Year holiday period concluded. Historically, February data can be volatile due to this holiday. However, the magnitude of the beat against expectations indicates underlying momentum. The core CPI measure, which excludes volatile food and energy prices, will be a key metric for the People’s Bank of China (PBOC) to monitor in coming months. Analyzing the Drivers Behind the Surge Several interconnected factors likely propelled the higher-than-expected China inflation rate. First, robust domestic consumption during the extended holiday period provided a strong demand-side push. Second, logistical bottlenecks and increased transportation costs may have fed through to consumer prices. Third, targeted fiscal support measures in late 2024 aimed at stimulating household spending appear to be gaining traction. Key contributing sectors included: Food & Beverage: The largest contributor, driven by supply chain adjustments and holiday demand. Transportation & Communication: Fuel price adjustments and post-holiday travel costs played a role. Household Goods & Services: Reflected gradual pass-through of earlier industrial price increases. Simultaneously, global commodity price trends provided a mixed backdrop. While international oil prices have stabilized, agricultural commodity markets experienced some volatility. These global inputs filtered into the domestic consumer price index calculation. Expert Perspective on Policy Implications Financial market participants and policy watchers are now reassessing the trajectory for Chinese monetary policy. “The February CPI print introduces a new variable into the PBOC’s policy calculus,” noted Dr. Li Wei, a senior economist at the China Finance Research Institute. “While 1.3% remains within a comfortable band, the clear overshoot relative to forecasts warrants close observation. The central bank will likely maintain its supportive stance but may become more cautious about additional aggressive easing in the short term.” This analysis aligns with the PBOC’s recent communications emphasizing policy flexibility and data dependency. The central bank’s primary goals include supporting economic growth, maintaining price stability, and managing financial risks. Therefore, a sustained move above its implicit inflation target could prompt a subtle shift in rhetoric or liquidity management operations. Historical Context and Economic Trajectory To appreciate the significance of the 1.3% reading, one must consider recent history. China’s inflation has remained subdued for several years, often hovering near zero or in mild deflationary territory in certain producer segments. This low inflation environment has provided the PBOC with ample room to implement stimulative measures. The February data, therefore, marks a potential inflection point. The table below shows recent China CPI inflation trends for context: Period CPI YoY % Notes Q4 2024 Average 0.5% Persistently low, below target January 2025 0.7% Slight uptick pre-holiday February 2025 1.3% Reported, exceeded forecasts This trajectory suggests a possible end to the prolonged disinflationary cycle. If sustained, a return to moderate inflation could support corporate pricing power and nominal GDP growth. However, it also reduces the real value of debt, a factor with complex implications for China’s highly leveraged corporate and local government sectors. Global Market Reactions and Ramifications International markets reacted promptly to the data release. Asian equity markets showed mixed responses, with sectors sensitive to Chinese consumption rallying. Conversely, global bond markets experienced slight upward pressure on yields, reflecting expectations of marginally less accommodative policy. The Chinese yuan also firmed slightly against the US dollar in offshore trading. For global investors, the data is a double-edged sword. On one hand, stronger inflation suggests a more resilient Chinese consumer and diminishing deflationary risks exported to the world. On the other hand, it implies a potential headwind for further aggressive monetary stimulus, which has been a key support for asset prices. Commodity-exporting nations will watch closely for signs of sustained demand from the world’s second-largest economy. Moreover, the data influences the global inflation outlook. Major central banks, including the Federal Reserve and the European Central Bank, consider Chinese economic conditions in their models. A firming of prices in China can affect global supply chains and import costs for other nations, creating second-round effects. Conclusion The February China CPI inflation report of 1.3% year-on-year marks a meaningful deviation from expectations and recent trends. While a single data point does not constitute a trend, the strength and composition of the increase warrant close monitoring. The figure reflects a combination of seasonal factors, recovering domestic demand, and lingering cost pressures. Consequently, the People’s Bank of China faces a slightly more complex environment as it balances growth support with price stability. For the global economy, the data suggests a potential stabilization of demand from a critical growth engine, with nuanced implications for trade, commodities, and capital flows in the months ahead. FAQs Q1: What is the CPI and why is China’s CPI inflation rate important? The Consumer Price Index (CPI) measures the average change over time in prices paid by urban consumers for a market basket of goods and services. China’s CPI inflation rate is a critical gauge of domestic price stability, consumer purchasing power, and overall economic health, influencing monetary policy and global market sentiment. Q2: How does the February 2025 CPI figure compare to the Chinese government’s target? While China often sets an annual inflation target around 3%, the recent trend has been well below that level. The February 2025 reading of 1.3% moves closer to, but still remains comfortably below, the typical target range, giving policymakers flexibility. Q3: What are the main factors that caused the February inflation surprise? Key drivers include strong holiday-season consumer demand during the Lunar New Year, elevated food prices (especially for pork and vegetables), and the gradual pass-through of earlier increases in production and logistics costs into final consumer prices. Q4: Will this higher inflation reading change China’s monetary policy? It is unlikely to cause an immediate, sharp policy shift. However, the People’s Bank of China (PBOC) may become more cautious about deploying additional aggressive stimulus measures. Policy will remain data-dependent, focusing on sustaining growth while guarding against sustained price pressures. Q5: What does this mean for global markets and investors? The data suggests resilient Chinese domestic demand, which is positive for global trade and commodity exporters. However, it may also temper expectations for further significant interest rate cuts in China, potentially affecting bond yields and currency valuations globally. Investors will watch for sustainability in the coming months. This post China CPI Inflation Soars: February Rate Hits 1.3% YoY, Defying Gloomy Forecasts first appeared on BitcoinWorld .",Forex News|#Markets|CHINA|Economy|Inflation|monetary policy,EN,0,0,ASIA|FIAT|MARKET|TRADING|MACROECONOMICS,"{'name': 'Bitcoin World', 'img': 'https://resources.cryptocompare.com/news/82/default.png', 'lang': 'EN'}",bitcoinworld,2026-03-09 03:10:12
