id,guid,published_on,imageurl,title,url,body,tags,lang,upvotes,downvotes,categories,source_info,source,date
58394862,https://bitcoinworld.co.in/?p=278105,1771893012,https://resources.cryptocompare.com/news/82/default.png,AUD/USD Plummets from 0.7100 as Critical CPI and Tariff Reset Loom,https://bitcoinworld.co.in/aud-usd-slips-cpi-tariff-forecast/,"BitcoinWorld AUD/USD Plummets from 0.7100 as Critical CPI and Tariff Reset Loom The AUD/USD currency pair experienced a sharp retreat from the psychologically significant 0.7100 level in early Asian trading on March 11, 2025, as global forex markets braced for a high-stakes week dominated by impending US inflation data and swirling rumors of a major tariff policy reset. This downward movement reflects heightened risk aversion and a recalibration of expectations for both the Australian and US economies. Consequently, traders are now closely monitoring these dual catalysts, which could dictate the pair’s trajectory for the coming quarter. AUD/USD Technical Breakdown and Immediate Catalysts Market data from major trading platforms shows the AUD/USD pair falling approximately 0.8% to trade around 0.7045. This decline follows a failed attempt to consolidate above the 0.7100 resistance zone last week. The immediate technical structure now suggests a test of the 50-day simple moving average, currently situated near 0.7020. A breach below this level could open the path toward the 0.6950 support area. Furthermore, the Relative Strength Index (RSI) has dipped from overbought territory into neutral ground, indicating a shift in momentum. This technical deterioration aligns perfectly with the fundamental unease gripping traders. The primary driver of this sell-off is the imminent release of the US Consumer Price Index (CPI) report for February, scheduled for March 12. Economists surveyed by major financial institutions project a month-over-month increase of 0.4% and a year-over-year rise of 3.1% for the headline figure. More importantly, core CPI, which excludes volatile food and energy prices, is forecast to hold stubbornly at 3.7% annually. Persistently high core inflation would likely reinforce the Federal Reserve’s patient stance on interest rate cuts, thereby boosting the US Dollar’s yield appeal. The market has already priced out several 2024 rate cut expectations, and a hot print could trigger further USD strength. The Looming Shadow of Tariff Policy Resets Simultaneously, geopolitical and trade tensions are resurfacing as a key market theme. Reports from Washington suggest the current US administration is conducting a comprehensive review of tariffs imposed on Chinese goods during previous administrations. While the outcome remains uncertain, any significant escalation or even a failure to roll back certain duties could disrupt global trade flows. Australia, as a major commodity exporter with deep economic ties to China, finds its currency particularly vulnerable to Sino-US trade friction. A deterioration in trade relations typically boosts demand for the US Dollar as a safe-haven asset while pressuring commodity-linked currencies like the Australian Dollar. The potential impact is twofold. First, higher US tariffs on Chinese imports could dampen Chinese economic activity, reducing demand for Australian iron ore, coal, and liquefied natural gas. Second, it could spur volatility and risk aversion across financial markets. Historical data from the 2018-2019 trade war period shows the AUD/USD pair often exhibited inverse correlation with trade policy headlines. Analysts at Westpac Banking Corporation noted in a recent client briefing, “The AUD acts as a liquid proxy for Asian growth and global risk sentiment. Any policy shift that threatens supply chains or growth prospects will weigh on the currency.” Diverging Central Bank Policies and Economic Backdrops The fundamental divergence between the Reserve Bank of Australia (RBA) and the US Federal Reserve forms the broader context for this move. The RBA has maintained a data-dependent but cautiously hawkish tone, with the market pricing in a potential final rate hike in 2025 if domestic inflation proves sticky. However, recent Australian economic indicators have been mixed. Retail sales growth has moderated, and business confidence surveys show some softening, though the labor market remains tight. In contrast, the US economy continues to demonstrate remarkable resilience, with strong job creation and robust consumer spending, giving the Fed more room to maintain a “higher for longer” interest rate policy if needed. This policy divergence is clearly reflected in government bond yield spreads. The yield differential between US 2-year Treasury notes and Australian 2-year government bonds has widened by 15 basis points over the past month, favoring the US Dollar. The following table illustrates key comparative economic metrics as of Q4 2024: Metric Australia United States Central Bank Policy Rate 4.35% 5.50% Latest CPI (YoY) 3.4% 3.1% (Jan) Unemployment Rate 4.0% 3.7% Q4 GDP Growth (QoQ) 0.2% 0.8% These figures highlight the relative strength of the US economy, providing a fundamental underpinning for USD strength. Additionally, commodity price dynamics offer limited support for the Aussie dollar currently. While iron ore prices have stabilized, they remain below their 2023 peaks, and copper has faced headwinds from concerns about global manufacturing demand. Market Sentiment and Trader Positioning Analysis According to the latest Commitments of Traders (COT) report from the Commodity Futures Trading Commission (CFTC), leveraged funds have reduced their net long positions in the Australian Dollar for two consecutive weeks. This shift suggests professional traders are beginning to hedge against or position for further AUD weakness. The overall market sentiment, as measured by various fear and greed indices, has shifted from “greed” to “neutral” in the forex sector, indicating a more cautious approach. Risk reversals, which measure the premium for options protecting against AUD/USD declines versus rises, have also moved in favor of puts, signaling increased demand for downside protection. Several key levels are now in focus for technical traders. On the downside, immediate support is seen at: 0.7020: The 50-day moving average and a previous consolidation zone. 0.6950: A strong support level from late January 2025. 0.6875: The 200-day moving average, representing the long-term trend. Conversely, any recovery would need to reconquer: 0.7100: The recent high and psychological barrier. 0.7150: The December 2024 peak. 0.7200: A major resistance level not tested since mid-2023. The path of least resistance appears lower in the short term, barring a significant downside surprise in the US CPI data or a de-escalation in trade rhetoric. Market participants are advised to monitor these releases closely, as they will provide critical direction. The interplay between stubborn US inflation and shifting global trade policies creates a complex environment for the AUD/USD pair, likely leading to elevated volatility in the coming sessions. Conclusion The AUD/USD pair’s retreat from the 0.7100 handle underscores the market’s acute sensitivity to upcoming US inflation data and potential shifts in global tariff policy. The confluence of a resilient US economy, a cautious Federal Reserve, and geopolitical trade uncertainties presents significant headwinds for the Australian Dollar. While domestic Australian fundamentals remain relatively solid, the currency’s fate in the near term is heavily tied to external factors. Traders should prepare for heightened volatility around the CPI release and any official announcements regarding trade policy. The technical breakdown suggests further downside risk unless the fundamental landscape shifts unexpectedly, making prudent risk management essential for all market participants watching the AUD/USD. FAQs Q1: Why is the US CPI data so important for the AUD/USD exchange rate? The US Consumer Price Index (CPI) is a primary gauge of inflation. A higher-than-expected reading suggests persistent inflation, which could lead the US Federal Reserve to delay interest rate cuts or even consider further hikes. Higher US interest rates increase the yield advantage of holding US Dollars, making the USD more attractive relative to currencies like the Australian Dollar, thereby putting downward pressure on the AUD/USD pair. Q2: How could changes in US tariff policy affect the Australian Dollar? Australia is a major exporter of raw materials to China. If the US increases tariffs on Chinese goods, it could slow China’s economic growth, reducing its demand for Australian commodities like iron ore and coal. Since the Australian Dollar is often viewed as a proxy for Chinese economic health and global commodity demand, such a slowdown would likely weaken the AUD. Additionally, trade tensions often boost demand for the US Dollar as a safe-haven currency. Q3: What are the key technical levels to watch for AUD/USD now? Following the slip from 0.7100, key support levels to monitor are the 50-day moving average near 0.7020, the January low around 0.6950, and the 200-day moving average near 0.6875. On the upside, resistance is now seen at the 0.7100 level, followed by the December 2024 high near 0.7150. Q4: What is the current interest rate differential between Australia and the US? As of March 2025, the US Federal Reserve’s target policy rate is 5.50%, while the Reserve Bank of Australia’s cash rate is 4.35%. This 115-basis-point differential in favor of the US Dollar provides a fundamental carry advantage that supports the USD, all else being equal. Q5: Besides CPI and tariffs, what other data should I watch that impacts AUD/USD? Important data points include Australian employment figures, Chinese PMI (Purchasing Managers’ Index) data (as a gauge of demand for Australian exports), US retail sales and employment reports, and statements from both the US Federal Reserve and the Reserve Bank of Australia regarding future monetary policy direction. Commodity price movements, especially for iron ore and copper, are also crucial for the Australian Dollar. This post AUD/USD Plummets from 0.7100 as Critical CPI and Tariff Reset Loom first appeared on BitcoinWorld .",Forex News|Australian Dollar|Economic data|Forex|monetary policy|US Dollar,EN,0,0,ASIA|FIAT|MARKET|TRADING|MACROECONOMICS,"{'name': 'Bitcoin World', 'img': 'https://resources.cryptocompare.com/news/82/default.png', 'lang': 'EN'}",bitcoinworld,2026-02-24 00:30:12
58394908,666061,1771893049,https://resources.cryptocompare.com/news/13/58394908.jpeg,Mapping The Bitcoin Bottom: Here’s How Low Price Could Go Before It Recovers,https://bitcoinist.com/bitcoin-bottom-how-low-price/,"Bitcoin (BTC) could be gearing up for further losses, as a crypto analyst has issued a severely foreboding forecast. According to his analysis, Bitcoin’s current structure shows a predominantly bearish trend , with price expected to reach a bottom below $30,000 before any potential reversal to the upside. Bitcoin Repeats 2022 Style Bear Market Crypto market analyst Jussy has published a new Bitcoin chart analysis on X, warning that the market may not have reached its final bottom yet. The chart compares the current weekly structure to Bitcoin’s 2022 cycle , showing nearly identical price behaviour following a double top formation and a bear flag that led to a major breakdown. In 2022, Bitcoin first printed a double top near the upper resistance zone above $60,000. It was then rejected from the rounded top structure, reversing into a sustained downside trend. After this, the price experienced a sharp breakdown, followed by a three-week consolidation phase that developed into a bear flag pattern . That consolidation acted as a brief pause before a bearish continuation, with BTC ultimately collapsing by another 38.96% from the bear flag range. Consequently, the final leg down erased roughly $11,095, carrying the price into a long-term support zone where the market finally hit a bottom and began to stabilize ahead of a recovery. Interestingly, Jussy argues that the current Bitcoin cycle is now reproducing the same bear market structure seen in 2022 almost perfectly. The right side of the chart shows that BTC formed a similar double-top pattern above the $120,000 region in 2025, only to roll over and break down sharply. This correction pushed the price below the key horizontal level near $74,321, which previously acted as support. Following this drop, Bitcoin entered a consolidation phase that closely resembled the 2022 bear flag . The structure slopes downward, reflecting a major price compression following the first large wick to the downside. According to Jussy, Bitcoin is now in the third week of this consolidation window, the same point in time where the 2022 market transitioned into its final price crash. The Bottom Target Using the same percentage decline from the 2022 breakdown, Jussy has predicted how low the Bitcoin price could fall before it attempts a notable recovery. His chart suggests that BTC has already begun its descent from the bear flag pattern, initially crashing below the $100,000 region and now trading near $65,000. Now, the analyst projects another corrective move of approximately 38% from the former support level around $74,320, potentially driving Bitcoin’s price down to roughly $46,199. The blue line below this zone in the price chart represents Bitcoin’s final downside target. Jussy predicts an even deeper decline to $28,301, marking BTC’s price bottom before any meaningful recovery takes hold.",Bitcoin|bitcoin|bitcoin news|bitcoin price|btc|BTC news|btc price|btcusd|BTCUSDT,EN,0,0,BTC|MARKET|TRADING|CRYPTOCURRENCY,"{'name': 'Bitcoinist', 'img': 'https://images.cryptocompare.com/news/default/bitcoinist.png', 'lang': 'EN'}",bitcoinist,2026-02-24 00:30:49
58395092,https://bitcoinworld.co.in/?p=278103,1771893311,https://resources.cryptocompare.com/news/82/default.png,"Gold Price Surge Soars Above $5,200 as Geopolitical Storm and Trade Fears Grip Markets",https://bitcoinworld.co.in/gold-price-surge-geopolitical-tensions-trade/,"BitcoinWorld Gold Price Surge Soars Above $5,200 as Geopolitical Storm and Trade Fears Grip Markets Global financial markets witnessed a historic milestone this week as the spot price of gold surged decisively above the $5,200 per ounce threshold. This remarkable gold price surge, recorded in London and New York trading sessions, represents one of the most significant rallies in the precious metal’s modern history. Consequently, analysts immediately attributed the dramatic move to a potent combination of escalating geopolitical tensions and deepening uncertainty in global trade relations. Investors, seeking stability amid the turmoil, are therefore flocking to traditional safe-haven assets. Gold Price Surge Driven by Dual Market Forces The breach of the $5,200 level is not an isolated event but rather the culmination of sustained pressure. Market data reveals a steady upward trajectory over the preceding quarter. For instance, the World Gold Council’s latest report indicates a 22% increase in institutional holdings. Furthermore, central banks in Asia and the Middle East have significantly accelerated their gold purchasing programs. This institutional demand creates a powerful floor under prices. Meanwhile, retail investment through bullion and exchange-traded funds has also seen a notable uptick. The collective movement underscores a broad-based loss of confidence in more volatile asset classes. Several key technical indicators aligned to facilitate this breakout. Trading volume spiked by over 40% compared to the monthly average. Additionally, the gold-to-S&P 500 ratio reached a decade high, signaling a major portfolio reallocation. Market technicians point to the clear breach of the previous resistance level at $5,050 as a critical trigger for algorithmic and momentum buying. This technical breakout then fueled further fundamental interest, creating a self-reinforcing cycle. Expert Analysis on Market Psychology Dr. Anya Sharma, Chief Commodities Strategist at Global Markets Insight, provided context. “The move above $5,200 is psychologically significant,” she stated. “It confirms that we are in a new paradigm for asset valuation under geopolitical stress. Historically, gold performs a specific function during such periods. It acts as a non-correlated asset and a store of value when faith in fiat currencies and political stability wanes.” Sharma’s team has tracked a direct correlation between news sentiment on conflict and trade disputes with gold futures buying patterns over the last six months. Geopolitical Tensions as a Primary Catalyst Recent escalations in multiple global flashpoints have injected severe risk into the market. Firstly, renewed conflict in Eastern Europe has disrupted energy and commodity supply chains. Secondly, territorial disputes in the South China Sea have heightened concerns over maritime trade routes. These events directly threaten global economic stability. Governments are responding with increased military spending and sanctions, which often lead to currency debasement fears. Gold, with its millennia-long history as a monetary asset, traditionally benefits from such an environment. The impact is quantifiable. A study by the International Institute of Finance shows that for every 10-point increase in its Geopolitical Risk Index, gold demand rises by an estimated 1.5%. The current index level is at a 15-year peak. Regional analysis reveals particularly strong physical gold buying in Europe and Southeast Asia, areas most proximate to the current tensions. This regional demand supports the global price floor. Safe-Haven Demand: Investors shift capital from equities and bonds into gold during crises. Currency Hedge: Gold protects against potential devaluation of major fiat currencies. Portfolio Insurance: Institutions allocate 5-10% to gold to reduce overall portfolio volatility. Trade Uncertainty Compounds Market Volatility Parallel to geopolitical strife, the landscape of international trade faces significant headwinds. Key negotiations between major economic blocs have stalled. Moreover, the potential for new tariffs on critical goods looms large. This uncertainty discourages long-term corporate investment and weighs on global growth forecasts. Slower growth often prompts central banks to consider more accommodative monetary policy, which can weaken currencies and boost gold’s appeal. The direct link between trade policy and gold is evident in recent history. During the peak of the US-China trade disputes in the previous decade, gold prices rallied over 25% in a corresponding 18-month period. Current rhetoric and policy directions suggest a similar, if not more pronounced, pattern may be emerging. Disruptions to trade directly increase the cost of goods, contributing to inflationary pressures. Gold is widely held as a long-term hedge against inflation, further bolstering its current demand. Gold Price Drivers and Historical Impact Driver Current Intensity Typical Gold Impact Geopolitical Conflict High Strong Positive Trade Policy Uncertainty High Moderate to Strong Positive Global Growth Forecasts Declining Moderate Positive Central Bank Policy Dovish Shift Positive The Role of Central Banks and Institutions Beyond retail and fund flows, official sector activity provides crucial support. According to IMF data, central banks added a net 800 tonnes to reserves in the last year alone. This represents the eighth consecutive year of net purchases. “Central banks are diversifying away from traditional reserve currencies,” explains Michael Chen, a former central bank advisor. “Gold offers sovereignty and has no counterparty risk. In a fragmented world, its role in national reserves is being re-evaluated and strengthened.” This consistent, price-insensitive buying creates a durable base of demand that underpins the market. Market Outlook and Future Trajectory The immediate future for gold prices hinges on the evolution of its primary drivers. Should geopolitical tensions de-escalate, some speculative froth may leave the market. However, most analysts believe the underlying structural demand will remain firm. The fundamental case includes persistent inflation above central bank targets, a peak in the global interest rate cycle, and continued geopolitical fragmentation. Technical analysis suggests the next major resistance level sits near $5,500, with support now firmly established at $5,000. Investors should monitor several key indicators. Firstly, watch the US Dollar Index (DXY), as a weaker dollar typically supports dollar-denominated gold. Secondly, observe real yields on inflation-protected securities (TIPS), as lower real yields reduce the opportunity cost of holding non-yielding gold. Finally, track commitments of traders reports to gauge speculative positioning. Current data shows large speculators are net long, but not at extreme historical levels, suggesting room for additional buying. Conclusion The historic gold price surge above $5,200 serves as a stark barometer of current global anxiety. This movement is fundamentally driven by intertwined geopolitical tensions and profound trade uncertainty. Consequently, the precious metal has reaffirmed its core role as the ultimate safe-haven asset. While short-term volatility is inevitable, the structural factors supporting gold—including institutional demand, currency hedging needs, and its inflation-resistant properties—appear robust. Therefore, the breach of this key psychological level may well mark the beginning of a new chapter for gold in the global financial system, rather than merely a temporary spike. FAQs Q1: What exactly caused gold to break above $5,200? The breakout was caused by a confluence of factors: escalating geopolitical conflicts in multiple regions, heightened uncertainty regarding future global trade policies, and sustained buying from both institutional investors and central banks seeking a reliable store of value. Q2: Is gold a good investment during geopolitical tensions? Historically, gold has performed the function of a safe-haven asset during periods of geopolitical stress. It tends to have a low or negative correlation with risk assets like stocks, which can help stabilize a portfolio. However, past performance does not guarantee future results. Q3: How does trade uncertainty specifically affect the gold price? Trade uncertainty can slow global economic growth, potentially leading to looser monetary policy (lower interest rates) and currency weakness. It can also disrupt supply chains, contributing to inflation. Gold is often sought as a hedge against both currency devaluation and inflation, increasing its demand. Q4: Are central banks still buying gold, and why? Yes, central banks have been consistent net buyers of gold for nearly a decade. They purchase gold to diversify their foreign exchange reserves away from traditional currencies, to add an asset with no counterparty risk, and to bolster financial sovereignty in an uncertain geopolitical landscape. Q5: What are the main risks to the current high gold price? The primary risks include a rapid and peaceful resolution to major geopolitical conflicts, a significant strengthening of the US dollar, a sharp and sustained rise in real interest rates which increases the opportunity cost of holding gold, or a major wave of coordinated selling by large holders or ETFs. This post Gold Price Surge Soars Above $5,200 as Geopolitical Storm and Trade Fears Grip Markets first appeared on BitcoinWorld .",Forex News|#Markets|commodities|Finance|Geopolitics|Gold,EN,0,0,BUSINESS|FIAT|MARKET|TRADING|MACROECONOMICS,"{'name': 'Bitcoin World', 'img': 'https://resources.cryptocompare.com/news/82/default.png', 'lang': 'EN'}",bitcoinworld,2026-02-24 00:35:11
