id,guid,published_on,imageurl,title,url,body,tags,lang,upvotes,downvotes,categories,source_info,source,date
57685012,https://bitcoinworld.co.in/?p=268127,1770087612,https://resources.cryptocompare.com/news/82/default.png,Crypto ETP Trading: ING Germany’s Bold Move Opens Digital Asset Floodgates for Retail Investors,https://bitcoinworld.co.in/ing-germany-crypto-etp-trading/,"BitcoinWorld Crypto ETP Trading: ING Germany’s Bold Move Opens Digital Asset Floodgates for Retail Investors In a landmark development for European finance, ING Germany announced on March 15, 2025, that it will launch cryptocurrency exchange-traded product (ETP) trading for its retail investment clients. This strategic initiative fundamentally transforms how German investors access digital assets through traditional banking infrastructure. Consequently, ING customers can now purchase ETPs tracking major cryptocurrencies directly within their existing securities accounts. This move represents a significant validation of cryptocurrency’s maturation within regulated financial markets. Crypto ETP Trading: Understanding ING Germany’s Strategic Pivot ING Germany’s decision to offer crypto ETP trading marks a calculated expansion of its digital asset services. The financial institution, which serves millions of German customers, will provide access to ETPs tracking Bitcoin (BTC), Ethereum (ETH), and Solana (SOL) indices. These products function similarly to traditional exchange-traded funds but specifically track cryptocurrency performance. Therefore, investors gain exposure to crypto price movements without directly holding the underlying digital assets. The bank’s implementation follows extensive regulatory consultation and technological preparation. German financial regulator BaFin has established clear frameworks for crypto securities, creating a compliant pathway for traditional banks. ING’s platform integrates these ETPs seamlessly alongside stocks, bonds, and conventional ETFs. This integration normalizes cryptocurrency investment within familiar banking interfaces. Several European banks have cautiously explored digital asset services in recent years. However, ING Germany represents one of the largest traditional institutions to offer direct crypto ETP trading to retail clients. This development signals growing institutional confidence in cryptocurrency market infrastructure. Market analysts immediately noted increased trading volumes in European-listed crypto ETPs following the announcement. The Evolving Landscape of German Cryptocurrency Regulation Germany has emerged as a European leader in establishing clear cryptocurrency regulations. BaFin’s progressive stance has created a structured environment for digital asset adoption. The regulator classifies cryptocurrencies as financial instruments under existing securities laws. This classification provides legal certainty for financial institutions seeking to offer crypto-related products. BaFin approved the country’s first Bitcoin-focused institutional fund in 2020. Since then, regulatory clarity has steadily improved. The German government implemented the European Union’s Markets in Crypto-Assets (MiCA) regulations ahead of schedule in 2024. These comprehensive rules establish uniform standards across EU member states. Consequently, German banks now operate within a well-defined regulatory framework for digital assets. Other German financial institutions have previously entered the cryptocurrency space. For instance, Deutsche Bank launched cryptocurrency custody services for institutional clients in 2023. Commerzbank received a cryptocurrency custody license the same year. However, ING Germany’s retail-focused ETP trading service represents a broader accessibility milestone. The table below illustrates Germany’s progressive regulatory timeline: Year Regulatory Development Impact 2020 BaFin approves first Bitcoin fund Opened institutional investment pathways 2022 Cryptocurrency classified as financial instrument Provided legal clarity for banks 2024 Early MiCA implementation Created EU-wide regulatory harmony 2025 ING launches retail crypto ETP trading Democratized digital asset access This regulatory evolution has directly enabled ING Germany’s current offering. The bank’s compliance team worked extensively with regulators to ensure full adherence to all requirements. German investors consequently benefit from robust consumer protections when trading crypto ETPs through traditional banks. Expert Analysis: Institutional Adoption Accelerates Financial analysts universally recognize ING Germany’s move as significant for cryptocurrency mainstream adoption. Dr. Elena Schmidt, Frankfurt School of Finance professor, notes the psychological impact on retail investors. “Traditional bank validation reduces perceived risk for cautious investors,” Schmidt explains. “When established institutions like ING offer cryptocurrency products, it signals market maturity.” Market data supports this institutional confidence trend. European crypto ETP assets under management surpassed €15 billion in late 2024. German-listed products represent approximately 40% of this total. The Deutsche Börse Xetra exchange has become Europe’s primary venue for cryptocurrency ETP trading. Daily volumes frequently exceed €500 million across various digital asset products. ING Germany’s implementation follows careful observation of early adopters. Swiss banks have offered cryptocurrency services since 2021. Austrian banks introduced similar products in 2023. German institutions initially moved more cautiously but now appear ready for broader implementation. This measured approach reflects Germany’s characteristically prudent financial culture. Practical Implications for German Retail Investors ING Germany’s crypto ETP trading service provides several distinct advantages for retail investors. Customers access digital assets through familiar banking interfaces they already trust. The integration with existing securities accounts simplifies portfolio management. Investors can monitor traditional and cryptocurrency investments within a single platform. The bank’s offering includes three primary benefits: Regulatory Protection: BaFin-regulated products with clear investor safeguards Tax Simplification: Integrated reporting within existing banking documentation Security Infrastructure: Bank-grade custody and transaction security protocols These advantages address common retail investor concerns about cryptocurrency investment. Security remains a paramount consideration for new digital asset participants. ING Germany utilizes institutional-grade custody solutions for underlying ETP assets. This approach minimizes counterparty risk compared to direct cryptocurrency exchange usage. Tax reporting complexity has previously deterred some German investors from cryptocurrency markets. ING’s integrated reporting automatically includes crypto ETP transactions within annual tax documentation. This automation significantly reduces administrative burdens for retail participants. The bank also provides educational resources explaining cryptocurrency investment fundamentals. Comparative Analysis: ETPs Versus Direct Cryptocurrency Ownership ING Germany’s ETP approach differs fundamentally from direct cryptocurrency ownership. Understanding these distinctions helps investors make informed decisions. Crypto ETPs represent securitized instruments tracking digital asset prices. Investors own shares in a regulated financial product rather than the underlying cryptocurrencies themselves. Key differences include: Custody Responsibility: ETP providers manage technical storage and security Regulatory Framework: ETPs operate under traditional securities regulations Access Method: ETPs trade on conventional exchanges during market hours Liquidity Profile: ETPs may demonstrate different liquidity characteristics This structure appeals particularly to investors prioritizing regulatory protection and convenience. However, direct cryptocurrency ownership remains preferable for certain use cases. Technical enthusiasts and decentralized application users typically prefer direct blockchain interaction. ING Germany’s service primarily targets traditional investors seeking regulated cryptocurrency exposure. The bank’s selected ETPs track established indices with transparent methodologies. Bitcoin and Ethereum products dominate current offerings due to their market capitalization and liquidity. Solana’s inclusion reflects growing institutional interest in alternative layer-1 blockchain networks. ING may expand its product range based on customer demand and regulatory developments. Broader Impact on European Financial Markets ING Germany’s initiative will likely influence other European financial institutions. Competitive pressure may accelerate similar offerings across the continent. French and Dutch banks have reportedly monitored German cryptocurrency adoption closely. ING’s parent company operates extensively across Europe, potentially facilitating regional expansion. The European cryptocurrency ETP market has demonstrated remarkable growth since 2023. Trading volumes increased approximately 300% between 2023 and 2024. German investors represent the largest national participant group. ING’s entry could further accelerate this growth trajectory. Market analysts project European crypto ETP assets could reach €50 billion by 2026. This institutional adoption coincides with technological infrastructure improvements. European securities settlement system TARGET2-Securities now supports cryptocurrency-related instruments. This integration facilitates efficient transaction processing for financial institutions. Banking system compatibility reduces operational friction for traditional banks entering digital asset markets. Conclusion ING Germany’s launch of crypto ETP trading for retail investors represents a pivotal moment in digital asset adoption. The service bridges traditional banking and emerging cryptocurrency markets through regulated financial products. German investors now access Bitcoin, Ethereum, and Solana exposure within familiar banking infrastructure. This development reflects broader institutional acceptance of cryptocurrency as a legitimate asset class. Consequently, crypto ETP trading through traditional banks will likely become increasingly commonplace across European markets. The convergence of regulatory clarity, institutional confidence, and technological readiness has created optimal conditions for this financial innovation. FAQs Q1: What exactly are crypto ETPs that ING Germany is offering? Cryptocurrency Exchange-Traded Products (ETPs) are regulated financial instruments that track the price of digital assets like Bitcoin and Ethereum. They trade on traditional stock exchanges during market hours, allowing investors to gain exposure to cryptocurrency price movements without directly owning or storing digital assets. Q2: How does ING Germany’s crypto ETP service differ from using a cryptocurrency exchange? ING’s service integrates crypto ETPs within existing securities accounts, providing regulatory protections, integrated tax reporting, and bank-grade security. Cryptocurrency exchanges typically require separate accounts, direct digital asset ownership, and different regulatory frameworks with potentially less investor protection. Q3: What cryptocurrencies are available through ING Germany’s ETP trading service? Initially, ING Germany offers ETPs tracking Bitcoin (BTC), Ethereum (ETH), and Solana (SOL) indices. The bank may expand this selection based on customer demand, regulatory approvals, and market developments. Q4: Are there any special risks associated with investing in crypto ETPs compared to traditional ETFs? Crypto ETPs carry additional volatility risks inherent to cryptocurrency markets, potential tracking errors between the ETP and underlying assets, and specific regulatory considerations. However, they eliminate technical risks associated with direct cryptocurrency ownership like private key management. Q5: How does German regulation protect investors using ING’s crypto ETP trading service? BaFin regulates all crypto ETPs offered in Germany under existing securities laws. These regulations mandate transparency requirements, regular reporting, consumer protection measures, and institutional oversight that doesn’t necessarily apply to unregulated cryptocurrency exchanges. This post Crypto ETP Trading: ING Germany’s Bold Move Opens Digital Asset Floodgates for Retail Investors first appeared on BitcoinWorld .",Crypto News|banking|CRYPTOCURRENCY|FinTech|Investment|REGULATION,EN,0,0,BTC|BUSINESS|MARKET|TRADING|CRYPTOCURRENCY,"{'name': 'Bitcoin World', 'img': 'https://resources.cryptocompare.com/news/82/default.png', 'lang': 'EN'}",bitcoinworld,2026-02-03 03:00:12
57685017,https://ambcrypto.com/?p=566849,1770087625,https://images.cryptocompare.com/news/default/ambcrypto.png,Bitcoin: Leverage unwinds as BTC slips 10% monthly -Stabilization ahead?,https://ambcrypto.com/bitcoin-leverage-unwinds-as-btc-slips-10-monthly-stabilization-ahead/,Bitcoin’s correction deepens as leverage unwinds and Open Interest drops sharply.,Bitcoin|BTC Trading View|News|News 1|Social|Trading View|ambcrypto,EN,0,0,BTC|CRYPTOCURRENCY,"{'name': 'AMB Crypto', 'img': 'https://images.cryptocompare.com/news/default/ambcrypto.png', 'lang': 'EN'}",ambcrypto,2026-02-03 03:00:25
57685040,https://www.newsbtc.com/?p=878744,1770087640,https://resources.cryptocompare.com/news/21/57685040.jpeg,"Bitcoin ETF Investors Pull Nearly $3 Billion, Pushing Average Buy Below Water",https://www.newsbtc.com/news/bitcoin/bitcoin-etf-investors-pull-2-8b-in-2-weeks-pushing-average-buy-below-water/,"Bitcoin slid hard over the weekend and stayed low into Monday, leaving traders on edge and pushing many to reduce risk. Prices slipped from roughly $84,000 to about $74,600 in a matter of days, a drop that erased a chunk of recent gains and forced quick reassessments across markets. Nervousness around Federal Reserve leadership, rising job worries, and fresh geopolitical flashpoints all piled up at once. Related Reading: Gold Vs. XRP: One Asset Just Added 20x The Other’s Market Value Average ETF Price Above Market According to Coinglass, the combined assets of US spot Bitcoin ETFs sit near $113 billion, while reports note they hold around 1.28 million BTC. Based on those figures, the typical ETF buying price works out to an average of roughly $87,830 per coin — well above current trading levels. That gap means many ETF positions are showing losses on paper right now. Some funds kept buying earlier and are holding positions that are underwater. BTC is trading below the U.S. ETFs avg cost basis after the 2nd & 3rd biggest outflow weeks ever (last week and week before) (and last week’s outflow will increase after IBIT reports friday’s numbers tomorrow) this means the average bitcoin ETF purchase is underwater pic.twitter.com/XowzrnBaSM — Alex Thorn (@intangiblecoins) February 2, 2026 Outflows Pick Up Over the last two weeks, investors pulled close to $3 billion from the 11 spot ETFs, with one week seeing $1.50 billion leave and the prior week $1.30 billion, according to CoinGlass. Those moves suggest some market participants are locking in gains or cutting exposure after the recent run-up. At the same time, cumulative ETF inflows remain materially lower than earlier peaks; buying has not fully come back even as some holders remain steady. Technical Signals And Bear Fears Reports note that spot BTC is down roughly 40% from its October peak while ETF AUM has fallen by about 31%. That divergence has analysts warning that sustained weak demand could push Bitcoin into a deeper downtrend. Technical charts show longer-term sell pressure building in certain measures. If demand fails to reappear, momentum could carry prices lower and extend selling across crypto markets. Policy, Politics, And Market Mood Market watchers point to extra uncertainty around monetary policy and geopolitics as fuel for the recent moves. Reports have disclosed that the proposed US Clarity Act stalled in Washington. At the same time, headlines about tensions in the Middle East and trade friction added to a rush for traditional safe havens like gold and the dollar. Even a hint of policy change matters: US President Donald Trump’s choice for the next Fed chair was discussed by investors as another factor shaping expectations. Related Reading: Crypto Funds Bleed $1.80 Billion As Metals Rally Heats Up Liquidity And The Road Ahead Institutional holders have not all capitulated. Many have been described as holding on, which can cushion sharp drops. But when the average cost basis for major ETF holders is above the current market price, confidence can be fragile. Liquidity has thinned in certain windows, and that makes price swings larger. A recovery requires renewed buying from both retail and big investors, otherwise sellers may dictate direction for longer. Featured image from Unsplash, chart from TradingView",Bitcoin|bitcoin|btc|btcusd|CLARITY Act|crypto|digital currency|ETFs|fed,EN,0,0,BTC|BUSINESS|MARKET|TRADING|CRYPTOCURRENCY,"{'name': 'NewsBTC', 'img': 'https://images.cryptocompare.com/news/default/newsbtc.png', 'lang': 'EN'}",newsbtc,2026-02-03 03:00:40
57685083,https://www.cryptopolitan.com/?p=906958,1770087640,https://resources.cryptocompare.com/news/43/57685083.jpeg,Wrench attacks on crypto users surge in 2025 with $40 million in losses,https://www.cryptopolitan.com/wrench-attacks-on-crypto-users-surge-in-2025/,"Wrench attacks, in which criminals physically assault or threaten crypto users or their families to try to gain access to their digital assets, surged in 2025, with about $40 million in losses, transforming what was previously considered a relatively rare risk into a significant security concern. New data shows that violence is now among the fastest-growing threats to people who own or maintain cryptocurrencies, with millions of dollars lost and growing fear across the industry. Blockchain security auditor CertiK announced on Sunday that 72 verified wrench attacks occurred globally in 2025. These attacks include beatings, kidnappings, and threats made targeting crypto users or relatives to extract private keys, passwords, or ransom payments. The number of physical attacks and kidnappings rose about 75% year over year from 2024, indicating that criminals are shifting from online hacks to real-world violence, CertiK said. The firm cautioned that such attacks were no longer “edge cases” and should be treated as a core security issue for the crypto ecosystem. Actual losses may exceed $40 million as Europe records most attacks According to CertiK, confirmed losses from wrench attacks totaled $40.9 million in 2025. But the precise number is a lot higher. Many victims never report attacks, the firm said, because they are afraid, or the attackers have given them private settlements, or ransom amounts don’t appear on public blockchains. On a geographical scale, France recorded the highest number of attacks, with 19 confirmed cases in 2025. Last year, around 40% of all reported wrench attacks worldwide occurred in Europe, making Europe the most affected region. However, CertiK didn’t specify all locations, but it did say the attacks originated from different continents. Not only individual investors but also people linked to companies in crypto markets were attacked. Several prominent cases have put global attention on the matter. In January, Ledger co-founder David Balland and his wife Amandine were kidnapped in France and held for ransom. Shortly later in May, an Italian crypto owner was reportedly seized and tortured in New York City, making a point that even small trips may carry great grave penalties for experienced crypto investors. Large amounts of money are not the only issue here. SatoshiLabs’ founder, Alena Vranova, said in August that attacks are commonplace and often result in surprisingly little crypto. “Every week, there is a Bitcoiner, at least one in the world, who gets kidnapped, tortured, extorted, and sometimes even worse,” she said. There have also been people kidnapped for amounts not much more than $6,000 worth of crypto, and also killed over amounts closer to $50,000, Vranova added. Can panic wallets and privacy reduce the danger? As wrench attacks escalate, developers and security professionals seek tips to mitigate the danger. One of those new ideas is introducing “panic wallets.” These wallets are meant to help consumers respond when a physical attack comes knocking. And if it has a very smart design, a panic wallet could secretly alert trusted contacts, wipe funds, delay transactions, or send the attacker to a decoy wallet containing a small amount of crypto. This may be useful in some cases, experts warn, but technology alone can’t cure the problem. Once an adversary takes complete physical possession of a victim, sophisticated security features won’t fully shield the victim. So many security professionals emphasize the necessity of personal privacy and discretion. CertiK and members of other crypto communities recommend that crypto owners never announce to the public how much crypto they own, to avoid displaying wealth online and to restrict information that links their actual identity to blockchain addresses. Some people are also told to distinguish between public business, holding private crypto, and personal security, particularly when traveling. As crypto becomes mainstream, CertiK says the criminals will only follow the money, online and off. Join a premium crypto trading community free for 30 days - normally $100/mo.",News|CertiK|Crypto,EN,0,0,BLOCKCHAIN|BUSINESS|MARKET|TECHNOLOGY|CRYPTOCURRENCY,"{'name': 'Cryptopolitan', 'img': 'https://images.cryptocompare.com/news/default/cryptopolitan.png', 'lang': 'EN'}",cryptopolitan,2026-02-03 03:00:40
