id,guid,published_on,imageurl,title,url,body,tags,lang,upvotes,downvotes,categories,source_info,source,date
39192496,https://www.cryptointelligence.co.uk/?p=28567,1737322048,https://resources.cryptocompare.com/news/95/default.png,"Solana Memecoin Trump the Solana King (TRUMPKIN) to Skyrocket Over 16,000% Before Exchange Listings",https://www.cryptointelligence.co.uk/solana-memecoin-trump-the-solana-king-trumpkin-to-skyrocket-over-16000-before-exchange-listings/,"Trump the Solana King could turn early investors into multi-millionaires, like other memecoins, such as Shiba Inu (SHIB) and Dogecoin (DOGE), did. Trump the Solana King (TRUMPKIN), a Solana memecoin launched today, is set to explode over 16,000% in price in the coming days. This is because TRUMPKIN is set to soon be listed on numerous crypto exchanges, according to reports. This will give the Solana memecoin exposure to millions of additional investors, who will pour funds into the coin and cause its price to rally, which will benefit investors who buy before these new exchange listings. Currently, Trump the Solana King can only be purchased via Solana decentralized exchanges, like Jup.ag and Raydium.io, and early investors stand to make huge returns in the coming days. Early investors in SHIB and DOGE made astronomical returns, and Trump the Solana King could become the next viral memecoin. Trump the Solana King launched with over $8,000 of liquidity, giving it a unique advantage over the majority of other new memecoins, and early investors could make huge gains. How to Buy To buy Trump the Solana King on Raydium.io or Jup.ag ahead of the CEX listings, users need to connect their Solflare, MetaMask or Phantom wallet, and swap Solana for Trump the Solana King by entering its contract address – 6oubDpkm3XF2x3r5vPZAhw2TABZgNrjmgwEqxUxLAYa – in the receiving field. If you don’t have one of these wallets already, you can create a new wallet in a few minutes and transfer some Solana to it (which will then be used to buy the memecoin), from an exchange like Coinbase, Binance and many others. Early investors could make returns similar to those who invested in Shiba Inu (SHIB) and Dogecoin (DOGE) before these memecoins went viral and exploded in price. If this happens, a new wave of memecoin millionaires could be created in a matter of weeks – or potentially even sooner. The Solana memecoin craze continues amid larger memecoins, like Shiba Inu (SHIB), Dogecoin (DOGE) and DogWifHat (WIF) trading sideways in recent weeks and losing momentum. This is why many SHIB, DOGE and WIF investors are instead investing in new Solana memecoins, like TRUMPKIN. Such memecoins have no utility and no inherent value, but investors looking for high gains have been investing in them due to their potential to rapidly rise in price.",Blockchain News|Crypto News Today|Press Releases,EN,0,0,SOL|SHIB|BUSINESS|DOGE|EXCHANGE,"{'name': 'CryptoIntelligence', 'img': 'https://resources.cryptocompare.com/news/95/default.png', 'lang': 'EN'}",cryptointelligence,2025-01-19 21:27:28
31794,https://www.cryptopolitan.com/?p=115359,1737322889,https://resources.cryptocompare.com/news/43/31794.jpeg,Shiba Inu coin price prediction 2025-2031: Is SHIB skyrocketing soon?,https://www.cryptopolitan.com/shiba-inu-coin-price-prediction/,"Key takeaways In 2025, the Shiba Inu coin price prediction suggests a maximum value of $0.00005274. In 2028, SHIB can reach a maximum value of $0.000114. The price of Shiba Inu is predicted to reach a minimum value of $0.000185 in 2031. The Shiba Inu (SHIB) cryptocurrency, originally a meme coin, has evolved into a comprehensive ecosystem with significant growth and utility. Key components include ShibaSwap, a decentralized exchange, and Shibarium, a Layer 2 solution to enhance scalability. These developments have boosted SHIB’s adoption and functionality. As SHIB’s ecosystem grows, questions arise about its future price trajectory. Will the advancements in ShibaSwap and Shibarium drive SHIB to new highs? Can SHIB sustain its current price momentum and solidify its position in the crypto market? Will SHIB ever reach $1? Overview Cryptocurrency Shiba Inu Token SHIB Price $0.00002154 Market Cap $12,446,025,030.34 Trading Volume $1,089,967,424.25 Circulating Supply 589,255,174,736,505 SHIB All-time High $0.00008845 (Oct 27, 2021) All-time Low $0.00000000008165 (Aug 31, 2020) 24-hour high $0.00002321 24-hour low $0.00002041 Shiba Inu coin price prediction: Technical Analysis Metric Value Volatility 4.28% 50-Day SMA $0.00002481 14-Day RSI 50.72 Sentiment Bearish Fear & Greed Index 77 (Extreme Greed) Green Days 15/30 (50%) 200-Day SMA $0.00001914 Shiba Inu price analysis: SHIB is closing in on support at $0.00002078; bullish reversal next? TL;DR Breakdown SHIB is currently trading below its 20-day SMA. SHIB’s key support level is at $0.00002078. If SHIB breaks above $0.00002277, it may target higher resistance levels. Shiba Inu’s (SHIB) price action on January 19 highlights a bearish market with slight recovery. SHIB has declined 6.58% in the last 24 hours, lost 2.49% over the last 7 days and dropped 2.37% of its price in the last 30 days. Will SHIB break out to the upside or consolidate? Shiba Inu 1-day price chart: SHIB sees slight recovery amid market downturn The Shiba Inu daily chart indicates bearish momentum, with the price trading below the 20-day SMA at $0.00002241. The MACD shows a slight bullish recovery, with the histogram in positive territory, signaling growing buying pressure. Shiba Inu sees slight recovery amid market downturn Additionally, the Volume Oscillator at 25.99% suggests a rise in market interest or volatility. If SHIB fails to reclaim the 20-day SMA, further decline toward $0.00002093 or lower is likely. A breakout above the SMA could shift sentiment in support of the bulls. Shiba Inu 4-hour price chart: Buying pressure remains weak in the short term The SHIB/USD 4-hour chart highlights bearish momentum, with the price trading below the middle Bollinger Band at $0.00002277 but above the lower band at $0.00002078, indicating selling pressure. Buying pressure remains weak in the short term The Money Flow Index (MFI) at 34.28 suggests that SHIB is close to the oversold region with mild selling pressure. The Chaikin Money Flow (CMF) at -0.09 also reflects weak buying activity and a slight dominance of selling pressure in the market. Shiba Inu technical indicators: Levels and action Daily simple moving average (SMA) Period Value Action SMA 3 $0.00002298 SELL SMA 5 $0.00002244 SELL SMA 10 $0.00002251 SELL SMA 21 $0.00002242 SELL SMA 50 $0.00002481 SELL SMA 100 $0.00002282 SELL SMA 200 $0.00001914 BUY Daily exponential moving average (EMA) Period Value Action EMA 3 $0.00002164 BUY EMA 5 $0.00002173 SELL EMA 10 $0.00002201 SELL EMA 21 $0.00002260 SELL EMA 50 $0.00002333 SELL EMA 100 $0.00002245 SELL EMA 200 $0.00002084 BUY What to expect from Shiba Inu price analysis? Shiba Inu’s price is nearing key support at $0.00002078. If it breaks below, further declines are likely. A move above $0.00002277 could signal signs of improvement. Is Shiba Inu a good investment? Shiba Inu (SHIB) has made strides with the launch of Shibarium, its Layer-2 blockchain, and a partnership with Chainlink, boosting cross-chain functionality and utility. The upcoming TREAT token – expected to play a significant role in Shiba Inu’s reward system and governance mechanisms – further expands its ecosystem. While promising, SHIB remains highly speculative and subject to market swings, so proceed cautiously as a trader or investor. Will Shiba Inu recover? Shiba Inu is experiencing fluctuations with a recent upward trend; there are signs of potential recovery. Will SHIB reach $1? Reaching $1 for Shiba Inu (SHIB) is highly unlikely due to its massive circulating supply and the unrealistic market cap. Significant demand increases and supply reductions would be necessary to approach such a price. Will SHIB reach $10 It is unlikely that SHIB will reach $10 due to its enormous circulating supply and the unrealistic market capitalization required to achieve this feat. Will SHIB reach $100? Reaching $100 for SHIB is virtually impossible due to its vast circulating supply and the astronomically high market capitalization it would necessitate. Does SHIB have an excellent long-term future? SHIB shows some positive movement, suggesting the ecosystem may have a promising long-term future. However, its success will depend on continued adoption, broader market adoption trends, and other cryptocurrency market space developments. Recent news/opinion on Shiba Inu MEXC to list TREAT/USDT in the Innovation Zone on January 14th (11:00 UTC) 💥🐾🐾 Nice 🚀 https://t.co/7L5kF8TYSm — Shiba Inu (@ShibainuCoin) January 13, 2025 Shiba Inu price prediction for January 2025 Shiba Inu (SHIB) is expected to show a variety of price fluctuations through January 2025. The potential low is $0.00001895, while the average price might be around $0.00002122. SHIB could reach up to $0.00002743, which is the highest expected price. Month Potential low Potential average Potential high January 2025 $0.00001895 $0.00002122 $0.00002743 Shiba Inu price prediction 2025 In 2025, the minimum price of Shiba Inu will be around $0.00002849. The maximum expected price for SHIB may be around $0.00005274, and the average price is $0.00004262. Year Potential low Potential average Potential high 2025 $0.00002849 $0.00004262 $0.00005274 Shiba Inu price predictions 2026-2031 Year Minimum price Average price Maximum price 2026 $0.00005224 $0.00005936 $0.00006648 2027 $0.00007598 $0.00008311 $0.00009023 2028 $0.00009973 $0.000107 $0.000114 2029 $0.000123 $0.000131 $0.000138 2030 $0.000147 $0.000154 $0.000161 2031 $0.000171 $0.000178 $0.000185 Shiba Inu price prediction 2026 According to predictions for 2026, Shiba Inu is expected to reach a minimum value of $0.00005224, a maximum value of $0.00006648, and an average trading price of $0.00005936. Shiba Inu price prediction 2027 By 2027, Shiba Inu (SHIB) is forecasted to reach a minimum price of $0.00007598, with a maximum of $0.00009023 and an average price of $0.00008311. Shiba Inu price prediction 2028 In 2028, the price of Shiba Inu is predicted to reach a minimum value of $0.00009973. Investors can expect a maximum value of $0.000114 and an average trading price of $0.000107. Shiba Inu Coin price prediction 2029 The SHIB price prediction suggests that by 2029, Shiba Inu could reach a minimum price of $0.000123, a potential maximum price of $0.000138, and an average trading price of $0.000131. Shiba Inu price prediction 2030 In 2030, the SHIB coin prediction suggests the price of Shiba Inu will trade at a minimum value of $0.000147, a maximum value of $0.000161, and an average trading value of $0.000154. Shiba Inu price prediction 2031 In 2031, Shiba Inu is expected to reach a minimum price of $0.000171, a maximum price of $0.000185, and an average price of $0.000178. Shiba Inu price prediction 2025 – 2031 Shiba Inu market price prediction: Analysts’ SHIB price forecast Firm Name 2025 2026 DigitalCoinPrice $0.0000519 $0.0000582 CoinCodex $0.00007384 $0.00004708 Cryptopolitan’s Shiba Inu price prediction According to Cryptopolitan’s Shiba Inu price forecast, SHIB could reach a maximum price of $0.0000405 by the end of 2025. By 2026, the price of the Shiba Inu token is predicted to reach a minimum value of $0.000022. Shiba Inu’s rise in price could take it to a maximum price level of $0.000132 with an expected average trading price of $0.0000118 by 2031. Shiba Inu historic price sentiment SHIB price history | Coinmarketcap Memecoin Shiba Inu’s price surged by over 300% within the month of its launch, sparking a trading frenzy similar to Dogecoin’s rise in early 2021. In 2022, Shiba Inu traded around $0.000025 at the start of the year but sharply declined to approximately $0.000008 by May 2022. For the remainder of the year, it stabilized, fluctuating between $0.000007 and $0.000010. In early 2023, Shiba Inu briefly spiked to $0.000015 in February but declined gradually, stabilizing around $0.000010 by June 2023 and closing the year at $0.00001033. In March 2024, Shiba Inu surged to a high of $0.000045 but consolidated between $0.0000173 and $0.00002933 by June 2024. By August 2024, the price ranged from $0.000015 to $0.000017. By October 2024, Shiba Inu traded between $0.000015 and $0.000017. In December 2024, the token traded between $0.00001853 and $0.00003343. SHIB opened trading at $0.00002118 in 2025 and currently trades between $0.00002041 and $0.00002321.",Crypto Price Predictions,EN,0,0,SHIB|TRADING|EXCHANGE|MARKET|BUSINESS|BLOCKCHAIN|MINING,"{'name': 'Cryptopolitan', 'img': 'https://images.cryptocompare.com/news/default/cryptopolitan.png', 'lang': 'EN'}",cryptopolitan,2025-01-19 21:41:29
39191476,https://thecoinrise.com/coinbases-l2-base-sees-impressive-growth-in-nft-and-defi/,1737322975,https://resources.cryptocompare.com/news/60/39191476.jpeg,Coinbase’s L2 Base Sees Impressive Growth in NFT and DeFi,https://thecoinrise.com/coinbases-l2-base-sees-impressive-growth-in-nft-and-defi/,"Base, Coinbase’s Layer-2 blockchain network, is rapidly solidifying its position as a dominant force in decentralized finance (DeFi) and non-fungible tokens (NFTs). The network’s robust growth and expanding ecosystem make it a noteworthy player in the blockchain space. DeFi Llama ’s recent report shows that the L2 network has made significant achievements across multiple sectors. Base, A Rising Star in DeFi Space The DeFi space is growing fast, and Base has become the largest layer-2 network in the crypto world. It now hosts over 410 decentralized apps (dApps), revolutionizing how people use financial systems without relying on traditional banks. Key players in this thriving ecosystem include Aerodrome, Uniswap, Morpho Blue, and Moonwell. One of the standout protocols in the Base DeFi space is Morpho, a competitor to AAVE, which shows promise in decentralized lending and borrowing. Base’s activity is impressive, handling over $264 billion in transactions since its inception. More recently, transaction volume reached $12.2 billion in just one week, showcasing the high demand and utility of the network’s offerings. Speculatively, introducing Bitcoin-backed loans on Coinbase could further boost Base’s growth, pushing Morpho and other DeFi projects to new heights. Memecoins and NFTs Fuel Base’s Continued Success Base’s growth is not just about DeFi; its booming memecoin ecosystem also drives it . The memecoins are now worth over $2.6 billion, with tokens like Brett and Akuma Inu leading. NFTs are another highlight, with sales up 45% last week to $8.3 million and over 15,000 unique buyers. Cumulative NFT sales have exceeded $62 million, and the network handles over 40 million monthly transactions. These numbers place Base ahead of rivals like Arbitrum and Polygon. Base Expands Into AI and Gaming Sector In addition to its success in DeFi and NFTs, Base is expanding into emerging sectors such as artificial intelligence (AI) and gaming. This expansion is expected to open up new opportunities for developers and users, making Base an even more attractive platform for growth and innovation. Due to Base’s impressive expansion and strong user engagement, the network will likely achieve a substantial valuation. This is especially true if Coinbase rolls out the much-anticipated airdrop as part of its roadmap for 2025. The L2 scaling solution is set to become a major player in the layer-2 crypto space with an estimated fully diluted valuation (FDV) of $7 billion. This would place it ahead of competitors like Arbitrum, valued at $3.2 billion, and Optimism, at $2.47 billion. Such a valuation highlights its rapid growth and increasing importance in the DeFi ecosystem. If the trend continues, Base could solidify its position as a leader among layer-2 networks. The post Coinbase’s L2 Base Sees Impressive Growth in NFT and DeFi appeared first on TheCoinrise.com .",Blockchain News|Base,EN,0,0,EXCHANGE|BLOCKCHAIN|ARB|AAVE|AIRDROP,"{'name': 'The Coin Rise', 'img': 'https://images.cryptocompare.com/news/default/thecoinrise.png', 'lang': 'EN'}",thecoinrise,2025-01-19 21:42:55
39192519,https://timestabloid.com/?p=54975,1737323115,https://resources.cryptocompare.com/news/67/default.png,Top New Meme Coins to Buy Today: BTFD’s P2E Game Draws Attention as MEME Innovates and ACT Expands Its Reach,https://timestabloid.com/top-new-meme-coins-to-buy-today-btfds-p2e-game-draws-attention/,"What makes meme coins such a hit in the crypto world? Memecoin (MEME), powered by 9GAG’s globally popular platform, has carved a niche by blending humor and Web3 innovation. Meanwhile, Act I: The AI Prophecy (ACT) is redefining decentralized AI development with its community-driven ecosystem. These projects have captivated diverse audiences, driving massive adoption and excitement. Now comes BTFD Coin, a new contender in the meme coin arena that’s creating waves with its groundbreaking Play-to-Earn (P2E) game. Launched on January 1, 2025, this game has set a new standard for utility in meme coins. Add in its jaw-dropping 90% APY staking rewards, and it’s no surprise that BTFD is recognized as one of the top new meme coins to buy today . Meme coins thrive on relatability, humor, and massive return potential. While MEME and ACT are driving innovation in their niches, BTFD Coin is poised to elevate the meme coin landscape with its unique approach to blending entertainment, staking, and community engagement. BTFD Coin: Revolutionizing Meme Coins with a P2E Game Have you ever imagined earning while you play? BTFD Coin brings this dream to life with its innovative P2E game, fully launched on January 1, 2025. Players earn BTFD tokens as they immerse themselves in an engaging virtual experience that has taken the crypto world by storm. This utility alone makes it stand out as one of the top new meme coins to buy today. Currently, in Stage 13 of its presale, BTFD Coin is priced at $0.000142. With over 64 billion coins sold, $5.2 million raised, and a bullish community of 8,600+ holders, it’s clear this project is gaining serious traction. Investing $3,000 at this stage would get you 21,126,761 BTFD tokens. When the presale ends, and the coin lists at $0.0006, your investment could jump to $12,676. At its projected moon price of $0.006, that’s a whopping $126,761—an ROI of over 4,000%. Getting started is simple. Set up your MetaMask or Trust Wallet, load it with BNB or ETH, and purchase BTFD tokens directly from the presale page . Stage 13 is over 97% complete, so the current price won’t last long. This is your chance to own the dip and secure life-changing returns. Beyond staking and the P2E game, BTFD is driven by a passionate community of “bulls” who are actively shaping its future. The coin’s ecosystem is designed to reward early adopters, making it a standout choice for anyone looking to invest in the top new meme coins to buy today. Memecoin (MEME): Bridging Memes and Web3 Innovation Memecoin (MEME) is the native token of Memeland, the Web3 venture studio powered by 9GAG. With its roots in one of the internet’s most iconic meme platforms, MEME has an undeniable edge in connecting with a global audience. Memeland combines humor, blockchain innovation, and community-driven initiatives to create an ecosystem that appeals to both seasoned investors and casual users. What sets MEME apart is its integration with the 9GAG brand, giving it instant credibility and a massive fan base. The token is central to Memeland’s expanding ecosystem, which includes NFT collections, exclusive content, and community rewards. This unique blend of Web3 utility and meme culture makes MEME a strong contender in the crypto market. As the MEME ecosystem grows, so does its potential for long-term success. By leveraging the massive reach of 9GAG, MEME continues to attract attention from investors worldwide, solidifying its place among the top new meme coins to buy today. Act I: The AI Prophecy (ACT): Decentralizing AI Innovation Act I: The AI Prophecy (ACT) is on a mission to democratize artificial intelligence development through its decentralized platform. The ACT token powers interactions and growth within its community-driven ecosystem, enabling developers and enthusiasts to collaborate on AI projects without the constraints of traditional systems. ACT’s focus on decentralization gives it a unique edge in the market. By creating a space where innovation can thrive, ACT is attracting a wide range of users, from AI experts to blockchain enthusiasts. The token serves as the backbone of this ecosystem, facilitating transactions, rewards, and governance. With AI being one of the most transformative technologies of our time, ACT is well-positioned to capitalize on its growing importance. Its commitment to community and innovation makes it a standout project, and its potential for growth ensures it remains one of the top new meme coins to buy today. Conclusion Based on our research and market trends, BTFD Coin stands out as a top choice for investors seeking the perfect combination of entertainment, rewards, and community. Its fully launched P2E game and 90% APY staking rewards set it apart, making it a must-have for anyone looking to capitalize on the booming meme coin market. While MEME and ACT bring unique value with their innovative ecosystems, BTFD’s presale performance and forward-thinking approach make it a leader among the top new meme coins to buy today. Don’t miss this opportunity— join the BTFD Coin presale now and be part of the next big crypto success story. Find Out More: Website: https://www.btfd.io/ X/Twitter: https://x.com/BTFD_COIN Telegram: https://t.me/btfd_coin Disclaimer: This is a sponsored press release for informational purposes only. It does not reflect the views of Times Tabloid, nor is it intended to be used as legal, tax, investment, or financial advice. Times Tabloid is not responsible for any financial losses. The post Top New Meme Coins to Buy Today: BTFD’s P2E Game Draws Attention as MEME Innovates and ACT Expands Its Reach appeared first on Times Tabloid .",Finance|News,EN,0,0,MEME|MARKET|SPONSORED|BUSINESS|TRADING,"{'name': 'TimesTabloid', 'img': 'https://resources.cryptocompare.com/news/67/default.png', 'lang': 'EN'}",timestabloid,2025-01-19 21:45:15
