id,guid,published_on,imageurl,title,url,body,tags,lang,upvotes,downvotes,categories,source_info,source,date
39201792,https://seekingalpha.com/article/4750522-the-official-trump-coin-lives-on-solana?utm_source=cryptocompare.com&utm_medium=referral&feed_item_type=article,1737343437,https://resources.cryptocompare.com/news/50/39201792.jpeg,The 'Official' TRUMP Coin Lives On Solana,https://seekingalpha.com/article/4750522-the-official-trump-coin-lives-on-solana?utm_source=cryptocompare.com&utm_medium=referral&feed_item_type=article,"Summary President Donald Trump has launched a crypto-coin, providing reassurance for US-based digital asset companies about crypto-friendly regulatory policies under his administration. OFFICIAL TRUMP has quickly achieved a top ten fully diluted market capitalization in less than three days of trading. While the coin's valuation is high, the Tokenomics of TRUMP are dubious, with no observable utility and a high level of dilution over just 3 years. The big winner here is Solana, which is the blockchain chosen by the President (and/or his team) for his official memecoin launch. President Donald Trump is back. If there have been any doubts about '47' overseeing crypto industry-friendly regulatory policy, US-based digital asset companies may have just been given the biggest reassurance an incoming President can possibly give before being inaugurated; the Trump team has officially launched a crypto coin. In less than three full days of trading, OFFICIAL TRUMP ($TRUMP) briefly achieved a top ten fully diluted market capitalization: $TRUMP (CoinMarketCap) At one point on January 19th, $TRUMP had a $72 billion fully diluted market cap. This made $TRUMP briefly the most valuable memecoin in the market and give the coin the 7th largest valuation of any coin. We're going to get into all of the reasons why you probably shouldn't buy this coin in a moment. But before we get to that, please remember that the barrier to entry for meme-coin creation is virtually nothing. Because of this, there are literally dozens of ""TRUMP"" coins that could be purchased rather than the 'official' coin if prospective buyers aren't careful: Other 'TRUMP' Coins (CoinMarketCap) One certainly wouldn't want to accidentally purchase 'trumpwifhat' - a derivative of dogwifhat ( WIF-USD ) - instead of OFFICIAL TRUMP; each of which uses TRUMP as the symbol. So if you're actually interested in plowing into a meme coin at a $72 billion fully diluted valuation, make sure you know the correct contract address before you incinerate your capital. TRUMP is Not An Investment Anyone looking at TRUMP as an investment opportunity should consider that President Trump's own disclosure overtly says that the coin should not be viewed as such: Trump Memes are intended to function as an expression of support for, and engagement with, the ideals and beliefs embodied by the symbol ""$TRUMP"" and the associated artwork, and are not intended to be, or to be the subject of, an investment opportunity, investment contract, or security of any type. So, now that we know TRUMP should not be viewed as an investment, we can dive into the supply dynamics and holder data. Tokenomics and Distribution As far as I can tell, there is no utility for TRUMP whatsoever. In the past, NFTs released by Trump have offered token holders potential perks or privileges when purchased at a certain scale; for instance, meet and greet opportunities. However, no such perks appear to exist for TRUMP holders. Thus, the inflation of TRUMP supply and its distribution will likely play a large role in how this coin performs over time: TRUMP Token Distribution (GetTrumpMemes.com) There are a total of 1 billion TRUMP coins, 800 million of which are owned by ""creators and CIC Digital."" President Trump has an ownership stake in CIC Digital, though it is unclear how much TRUMP he owns through that entity. Regardless, at an 80% token allocation to the creators and CIC Digital, TRUMP has one of the more dilutive coin distributions that I can recall seeing in this market. TRUMP Emission Schedule (GetTrumpMemes.com) To be sure, there have been other coins that have launched with 80% of supply in lockup, but I don't know if I can remember seeing one where the total supply is unlocked within 3 years. Furthermore, the lockup periods begin in just 3 months and the emission schedule appears to show circulating supply doubling within 12 months. Meaning, TRUMP dilution is going to be quite quick compared to some of the other coins that I've covered for Seeking Alpha in the past. Early Trading Data Through less than three full days of trading, interest in TRUMP has been robust. There has been over $52 billion in total transfer value of the TRUMP coin and $32.2 billion in DEX trading value. The coin has quickly scaled to over three quarters of a million total token holders. However, most of those holders have very small allocations based on the Top 20 holder data: TRUMP Holders (SolScan) Again, 80% of supply is locked for creators and CIC Digital. Another 4% or so is held cumulatively by various centralized exchanges like OKX and Kraken. We can see an absolutely enormous percentage of TRUMP is held by the top 20 addresses. 88.5% of the total coin supply is held by just 20 wallets. If it hasn't been deduced by the reader at this point already, I'll be overt; I wouldn't buy this coin with free money. Like TRUMP? Buy Solana The biggest winner here is perhaps Solana USD ( SOL-USD ). While there is certainly an argument to be made that $TRUMP is simply cannibalizing liquidity from all of the other memecoins on the Solana Blockchain, there is no question the coin launch is bringing fresh liquidity to Solana through the President's non-crypto native supports. The price of SOL has been a large out-performer on the launch of TRUMP. Rallying over 40% from the January 16th close in just 3 days, SOL has made a new all-time high at $295 as of January 19th. L1 P/F Ratios (Token Terminal) And at just 82x circulating fees, SOL is the second cheapest L1 blockchain gas token when viewed through the price to annualized fee ratio. So if all of this activity isn't totally off-putting, I think the right way to play President Trump's memecoin on Solana is simply buying Solana. Closing Thoughts I don't think that I've made it any real secret on Seeking Alpha or on my Substack newsletter that I'm generally not a fan of memecoins. In my opinion, there is an element of financial nihilism that is pervasive through most of the memecoin segment that I don't think has been helpful to broader sentiment about digital assets or public blockchains as a legitimately useful innovation. But I do think the broader implications of TRUMP are compelling. On one hand, we could look back at this moment 5 to 10 years from now and see a memecoin launch from a US President - and subsequently his wife as well - as a clear sign of a market top. On the other hand, we could look back at this moment 5 to 10 years from now and see it as the certification of progress in financial technology. Readers can place their own chips on that one. For me, TRUMP is untouchable and SOL is worth some long term speculative capital.",SOL-USD,EN,0,0,SOL|REGULATION|TRADING|MARKET|BLOCKCHAIN,"{'name': 'Seeking Alpha', 'img': 'https://images.cryptocompare.com/news/default/seekingalpha.png', 'lang': 'EN'}",seekingalpha,2025-01-20 03:23:57
39201722,https://en.coinotag.com/world-liberty-financial-acquires-48-million-in-ethereum-amid-increased-trump-family-crypto-activity/,1737343453,https://resources.cryptocompare.com/news/77/39201722.jpeg,World Liberty Financial Acquires $48 Million in Ethereum Amid Increased Trump Family Crypto Activity,https://en.coinotag.com/world-liberty-financial-acquires-48-million-in-ethereum-amid-increased-trump-family-crypto-activity/,"World Liberty Financial (WLF) has made headlines with its recent acquisition of 14,403 ETH, a move that significantly boosts its total Ethereum assets to approximately $109 million. This rapid accumulation",News|ETH,EN,0,0,ETH,"{'name': 'CoinOtag', 'img': 'https://resources.cryptocompare.com/news/77/default.png', 'lang': 'EN'}",coinotag,2025-01-20 03:24:13
39201973,https://news.bitcoin.com/?p=699299&preview=true&preview_id=699299,1737343828,https://resources.cryptocompare.com/news/14/39201973.jpeg,Arthur Hayes Predicts Memecoin Explosion as Trump Paves the Way for Taylor Swift and Beyoncé,https://news.bitcoin.com/arthur-hayes-predicts-memecoin-explosion-as-trump-paves-the-way-for-taylor-swift-and-beyonce/,"Arthur Hayes predicts a “memecoin explosion” as stars like Taylor Swift and Beyoncé could follow TRUMP and MELANIA coins, sparking debates on ethics and cryptocurrency’s future. If Trump Can Do It, so Can Taylor Swift and Beyoncé—Arthur Hayes Predicts Memecoin Explosion In a significant move within the cryptocurrency landscape, President-elect Donald Trump and his wife,",Featured|Arthur Hayes|memecoins,EN,0,0,SPONSORED,"{'name': 'Bitcoin.com', 'img': 'https://images.cryptocompare.com/news/default/bitcoincom.png', 'lang': 'EN'}",bitcoin.com,2025-01-20 03:30:28
39201949,https://www.cryptonewsz.com/cardanos-ada-correction-complete-next-stop-6/,1737343855,https://images.cryptocompare.com/news/default/cryptonewsz.png,"Cardano’s ADA Correction Complete, Next Stop: $6?",https://www.cryptonewsz.com/cardanos-ada-correction-complete-next-stop-6/,"Cardano’s ADA is showing signs of another price rally, following a sharp 43% correction in recent weeks. Analyst…",Price Analysis,EN,0,0,ADA|TRADING,"{'name': 'CryptoNewsZ', 'img': 'https://images.cryptocompare.com/news/default/cryptonewsz.png', 'lang': 'EN'}",cryptonewsz,2025-01-20 03:30:55
39201952,https://www.cryptopolitan.com/?p=646844,1737343867,https://resources.cryptocompare.com/news/43/39201952.jpeg,TRUMP coin epitomizes the ‘sh*ttiness of the industry’ says Diamond Hands CEO Koji Higashi,https://www.cryptopolitan.com/trump-coin-diamond-hands-ceo-koji-higashi/,"CEO of Japanese bitcoin company Diamond Hands, Koji Higashi, posted on X Sunday that “The fact that we have to take TrumpCoin seriously seems to epitomize the sh*ttiness of this industry.” He was referring to the incumbent figurehead leader Trump’s new massively premined meme coin, and said it was actually turning former bitcoin supporters away from BTC. Koji Higashi’s company Diamond Hands is also facing issues, recently announcing a pivot away from their Lightning Network community node. The broken protocol that’s just 2 years away from being ready doesn’t seem to be doing them any favors. Still, the Japanese entrepreneur lamented and mentioned “despair” in an X post about the latest meme coin, Official Trump . Is TRUMP just another meme coin or ‘The sh*ttiness of the industry’? Indeed, the massive political capture of crypto — that was once supposed to be about separation of money and state —is nauseating to anyone, like Higashi , who’s been in the game more than five years. But there is no rationality to manipulated markets. Trump, who has promised to free Silk Road darknet marketplace founder Ross Ulbricht “ on day one ” (amongst a plethora of other assurances) has now launched a website for his own premined, crypto just before being stepping into his White House role once again, tomorrow. The website for Trump’s stunt amusingly reads that the coin has nothing to do with politics. It further lays out the premined nature of the coin in small print at the bottom of the page: “CIC Digital LLC, an affiliate of The Trump Organization, and Fight Fight Fight LLC collectively own 80% of the Trump Cards, subject to a 3-year unlocking schedule.” Tokenomics show the asset’s heavily premined and centrally captured nature (Source: gettrumpmemes.com) Higashi noted in another X post that some people who used to support bitcoin are now turning away due to this meme coin. He also stated that “the people who originally got interested in Bitcoin got into it because they didn’t like this kind of thing, so it’s like a polar opposite world.” However, the coin’s team says on his self-congratulatory site, “… President Trump showed the world what a LEADER is made of. His strength and courage ignited a movement becoming the most memorable meme of the century.” A Step-By-Step System To Launching Your Web3 Career and Landing High-Paying Crypto Jobs in 90 Days.",News|BTC|TRUMP,EN,0,0,BTC|BLOCKCHAIN|MARKET|REGULATION,"{'name': 'Cryptopolitan', 'img': 'https://images.cryptocompare.com/news/default/cryptopolitan.png', 'lang': 'EN'}",cryptopolitan,2025-01-20 03:31:07
39202116,https://en.coinotag.com/breakingnews/messari-founder-ryan-selkis-urges-trump-to-reevaluate-melania-project-amid-concerns-of-expertise-and-economic-risks/,1737344151,https://resources.cryptocompare.com/news/77/39202116.jpeg,Messari Founder Ryan Selkis Urges Trump to Reevaluate Melania Project Amid Concerns of Expertise and Economic Risks,https://en.coinotag.com/breakingnews/messari-founder-ryan-selkis-urges-trump-to-reevaluate-melania-project-amid-concerns-of-expertise-and-economic-risks/,"In a recent tweet, Ryan Selkis, the founder of Messari, called on former President Donald Trump to reconsider his association with the controversial Melania project. Selkis highlighted critical concerns regarding",,EN,0,0,REGULATION,"{'name': 'CoinOtag', 'img': 'https://resources.cryptocompare.com/news/77/default.png', 'lang': 'EN'}",coinotag,2025-01-20 03:35:51
39202192,https://www.newsbtc.com/?p=678702,1737344325,https://images.cryptocompare.com/news/default/newsbtc.png,Ethereum Price Faces Another Rejection: Will Momentum Return?,https://www.newsbtc.com/analysis/eth/ethereum-price-rejection-3500/,"Ethereum price started a downside correction from the $3,500 resistance. ETH is consolidating above $3,120 and facing many hurdles. Ethereum failed to gain pace for a close above $3,500 and corrected gains. The price is trading below $3,320 and the 100-hourly Simple Moving Average. There is a short-term connecting bearish trend line forming with resistance at $3,380 on the hourly chart of ETH/USD (data feed via Kraken). The pair could start another increase if it clears the $3,300 resistance level. Ethereum Price Dips To Support Ethereum price started a decent upward move above the $3,320 level but upsides were limited compared to Bitcoin . ETH failed to gain pace for a close above $3,500 and corrected gains. There was a move below the $3,320 and $3,300 support levels. A low was formed at $3,141 and the price is now consolidating losses. There was a minor increase above the $3,200 level. The price climbed above the 23.6% Fib retracement level of the recent decline from the $3,445 swing high to the $3,141 low. Ethereum price is now trading below $3,280 and the 100-hourly Simple Moving Average . On the upside, the price seems to be facing hurdles near the $3,240 level. The first major resistance is near the $3,300 level or the 50% Fib retracement level of the recent decline from the $3,445 swing high to the $3,141 low. The main resistance is now forming near $3,380. There is also a short-term connecting bearish trend line forming with resistance at $3,380 on the hourly chart of ETH/USD. A clear move above the $3,380 resistance might send the price toward the $3,450 resistance. An upside break above the $3,450 resistance might call for more gains in the coming sessions. In the stated case, Ether could rise toward the $3,500 resistance zone or even $3,550 in the near term. More Losses In ETH? If Ethereum fails to clear the $3,300 resistance, it could start another decline. Initial support on the downside is near the $3,150 level. The first major support sits near the $3,120. A clear move below the $3,120 support might push the price toward the $3,050 support. Any more losses might send the price toward the $3,020 support level in the near term. The next key support sits at $3,000. Technical Indicators Hourly MACD – The MACD for ETH/USD is losing momentum in the bullish zone. Hourly RSI – The RSI for ETH/USD is now below the 50 zone. Major Support Level – $3,120 Major Resistance Level – $3,300",ETH|ethbtc|ethereum|ethusd|ETHUSDT,EN,0,0,TRADING|ETH|BTC|EXCHANGE,"{'name': 'NewsBTC', 'img': 'https://images.cryptocompare.com/news/default/newsbtc.png', 'lang': 'EN'}",newsbtc,2025-01-20 03:38:45
39202561,https://en.coinotag.com/breakingnews/whale-invests-9-5-million-in-trump-tokens-amidst-2-47-million-loss/,1737345020,https://resources.cryptocompare.com/news/77/39202561.jpeg,Whale Invests $9.5 Million in TRUMP Tokens Amidst $2.47 Million Loss,https://en.coinotag.com/breakingnews/whale-invests-9-5-million-in-trump-tokens-amidst-2-47-million-loss/,"On January 20th, COINOTAG News reported notable activity in the cryptocurrency market, highlighting a significant transaction by a whale who acquired 187,360 TRUMP tokens for an impressive $9.5 million, resulting",,EN,0,0,MARKET,"{'name': 'CoinOtag', 'img': 'https://resources.cryptocompare.com/news/77/default.png', 'lang': 'EN'}",coinotag,2025-01-20 03:50:20
39202703,https://coinpedia.org/?p=407539,1737345317,https://images.cryptocompare.com/news/default/coinpedia.png,Melania Trump Memecoin Takes Over: How to Buy $MELANIA Crypto?,https://coinpedia.org/news/melania-trump-memecoin-takes-over-how-to-buy-melania-crypto/,"The post Melania Trump Memecoin Takes Over: How to Buy $MELANIA Crypto? appeared first on Coinpedia Fintech News Trump has given a ray of hope to the downmarket with its new crypto policies and market cheered his crypto centric election campaign wholeheartedly. The crypto turned to a Trillion dollar industry with Trump’s win. However, the market got more interested with the debut of Donald Trump’s TRUMP meme coin, which initially jumped to a whopping $14 billion market cap. This made it one of the top 20 cryptocurrencies by value, but the excitement was short-lived. With rumors of Trump gearing for many executive orders the market is in a mixed state. Meanwhile, Trump’s wife, the first US lady, has announced that the MELANIA coin, via her social media, caused a dramatic 40% crash in TRUMP’s value. In a matter of minutes, $7.5 billion was wiped from its market cap as traders shifted their focus to Melania’s coin. The Official Melania Meme is live! You can buy $MELANIA now. https://t.co/8FXvlMBhVf FUAfBo2jgks6gB4Z4LfZkqSZgzNucisEHqnNebaRxM1P pic.twitter.com/t2vYiahRn6 — MELANIA TRUMP (@MELANIATRUMP) January 19, 2025 With Trump’s win Memecoins craze is getting much higher while other assets are surging at their own pace memecoins are getting wider and bigger with Trump’s new meme launch just one day before his official inauguration today. Meme Mania Continues Melania’s MELANIA token, launched on January 20, quickly gained traction, with its value surging to over $5 and a market cap exceeding $5 billion. Her announcement encouraged traders to buy the coin, and the market responded with a frenzy of activity. Analysts observed massive sell-offs in TRUMP as investors rushed to capitalize on the buzz surrounding MELANIA. The Kobeissi Letter described the scenario as “beyond insane,” reflecting the unpredictable nature of these meme coins. Despite the chaos, both coins reflect the growing influence of meme culture in the cryptocurrency space. While TRUMP briefly dominated headlines with its meteoric rise, Melania’s MELANIA quickly stole the spotlight, showcasing how quickly market sentiment can shift. How to Buy MELANIA Crypto? For those interested in purchasing MELANIA, the process involves setting up a crypto wallet, acquiring base cryptocurrencies like Ethereum or Solana, and using decentralized exchanges to swap for MELANIA. The coin is minted on the Solana blockchain, and buyers are encouraged to verify contract addresses to avoid scams. As TRUMP and MELANIA continue to make waves, the crypto community is left wondering what’s next in this unpredictable crypto space. The clash is real and so is the politics and this choes will stay all through the January with predictions of ups and downs to crashes the world of crypto is stepping to a new era where there will be financial freedom and less dependency on traditional assets. We are excited to see what unfolds next!",News|Altcoins|Meme Coins,EN,0,0,MARKET|ALTCOIN|SOL|BLOCKCHAIN|BUSINESS,"{'name': 'coinpedia', 'img': 'https://images.cryptocompare.com/news/default/coinpedia.png', 'lang': 'EN'}",coinpedia,2025-01-20 03:55:17
39202746,https://coingape.com/?p=234282,1737345377,https://images.cryptocompare.com/news/default/coingape.png,"Crypto Prices Today Jan 20: BTC Holds $101K, TRUMP & MELANIA Meme Coins Skyrocket",https://coingape.com/crypto-prices-today-jan-20-btc-holds-101k-trump-melania-meme-coins-skyrocket/,"The crypto prices today exhibited mixed reactions, with Bitcoin (BTC) rebounding to $101K after reaching a high of $106K earlier. The global spotlight is on former U.S. President Donald Trump, who will officially begin his presidential campaign today. Adding intrigue, Trump launched a meme coin two days before the event, with “TRUMP Coin” surging by 55% in the last 24 hours. Melania Trump also joined the trend, unveiling her meme coin (MELANIA) today, which skyrocketed by an astounding 2000% after launch. Despite these developments, the global crypto market cap fell by approximately 4%, standing at $3.48 trillion. Trading volume, however, saw exponential growth, rising by 74% to $336 billion. Here’s a closer look at some of the top cryptocurrencies and their prices today, January 20. Crypto Prices Today: BTC, ETH, SOL, and XRP Decline Amid Market Volatility The cryptocurrency market today saw major assets facing downward pressure. Bitcoin (BTC) dropped by 2.6%, now trading at $101K, while Ethereum (ETH) fell by 3%. XRP faced a sharper decline, down by 4%, and Solana (SOL) led the losses with a 7% dip. Cardano co-founder Charles Hoskinson recently highlighted that 78.5% of President-elect Donald Trump’s $29.6 billion net worth is linked to cryptocurrency. This revelation adds a unique twist to the ongoing market developments. Bitcoin Price Today: BTC Holds Above $101K Amid Market Turbulence Bitcoin price today was trading at $101,944, with a 24-hour low of $99,591 and a high of $106,428. The market cap stood at $2.02 trillion, reflecting Bitcoin’s continued dominance in the crypto market. According to SoSo Value data , Bitcoin ETFs recorded a significant weekly inflow of $887 million last week, showcasing sustained institutional interest despite recent market fluctuations. Ethereum Price Today: ETH Drops 3% as Market Volatility Continues Ethereum price today was trading at $3,266, reflecting a 3% decline over the last 24 hours. Its 24-hour low and high were $3,131 and $3,448, respectively. ETH ETFs experienced a weekly inflow of $188 million, indicating investor confidence in Ethereum’s long-term potential despite short-term price corrections. XRP Price Today: XRP Down 4%, Still Up 25% Over the Week XRP price today was trading at $3.10, marking a 4% drop in the last 24 hours. Its 24-hour low and high were $2.90 and $3.255, respectively. Despite this dip, XRP remains up by an impressive 25% over the past week, showcasing strong market performance. In a notable development, an XRP whale transferred $95 million worth of tokens ahead of President-elect Donald Trump’s inauguration. This significant move has sparked curiosity among investors, further highlighting XRP’s active trading dynamics. Solana Price Today Solana price today was trading at $239, reflecting a 7% decline in the last 24 hours. Its 24-hour low and high were $231 and $294, respectively, highlighting significant volatility in recent trading sessions. Top Cryptocurrency Gainer Prices Today As per crypto prices today, here are the top 5 crypto gainers over the last 24 hours: OFFICIAL TRUMP (TRUMP) Price: $44.17 24-hour Gain: +61% Melania Meme (MELANIA) Price: $8.70 24-hour Gain: +19% Fartcoin (FARTCOIN) Price: $1.98 24-hour Gain: +13.69% DeXe (DEXE) Price: $17.93 24-hour Gain: +3% UNUS SED LEO (LEO) Price: $9.74 24-hour Gain: +2.15% Top Cryptocurrency Loser Prices Today As per crypto prices today, here are the top 5 crypto losers over the last 24 hours: ai16z (AI16Z) Price: $0.83 24-hour Loss: -26% Sonic (prev. FTM) (S) Price: $0.53 24-hour Loss: -21% dogwifhat (WIF) Price: $1.43 24-hour Loss: -19% Pudgy Penguins (PENGU) Price: $0.024 24-hour Loss: -17% Floki (FLOKI) Price: $0.0001398 24-hour Loss: -17% Meme Crypto Prices Today Top meme coins have shown bearish momentum following the launch of Trump and Melania’s meme coins. Dogecoin (DOGE) dropped by 10% and is trading at $0.3626, while Shiba Inu (SHIB) fell by 9% to $0.00002055. Other notable meme coins like PEPE, BONK, and WIF are down by 15% to 18% in the last 24 hours, with liquidity flowing toward the newly launched Trump Coin and Melania Meme Coin, which surged in price. The hourly chart also indicates a consolidation phase, as Bitcoin fell from $106K to $101K. Major altcoins are following a similar trend, and it remains to be seen how the market will react after Donald Trump’s presidential inauguration. Crypto prices today continue to reflect this uncertainty. The post Crypto Prices Today Jan 20: BTC Holds $101K, TRUMP & MELANIA Meme Coins Skyrocket appeared first on CoinGape .",24/7 Cryptocurrency News|Altcoin News|Bitcoin News|Bitcoin (BTC) Price|crypto market news|Crypto price today|Dogecoin (DOGE)|Ethereum (ETH) price|Fartcoin Price|Shiba Inu (SHIB)|Solana (SOL),EN,0,0,TRADING|MARKET|BTC|XRP|ETH,"{'name': 'CoinGape', 'img': 'https://images.cryptocompare.com/news/default/coingape.png', 'lang': 'EN'}",coingape,2025-01-20 03:56:17
