id,guid,published_on,imageurl,title,url,body,tags,lang,upvotes,downvotes,categories,source_info,source,date
39209190,https://coinpaper.com/7018/trump-s-coin-prediction-growth-emission-and-industry-impact,1737357758,https://resources.cryptocompare.com/news/93/default.png,"Trump's Coin Prediction: Growth, Emission, and Industry Impact",https://coinpaper.com/7018/trump-s-coin-prediction-growth-emission-and-industry-impact,"On January 18, US President-elect Donald Trump announced the launch of the “official” meme token TRUMP on the Solana blockchain. Over the day, the coin gained 220% with an FDV of $62 billion. Donald Trump's Coin Price and Growth At the time of writing, the asset is trading at $61,9 with a market capitalization of $12.1 billion. TRUMP has already climbed to the 16th position in the ranking of the largest cryptocurrencies, ahead of TON and SHIB. The daily trading volume has reached almost $1 billion. The excitement around TRUMP occurs against the background of relative stagnation in the rest of the market of digital assets. However, a surge of activity in the Solana network ensured SOL's growth to new historical highs - the coin is now trading at peak values around $286. Centralized exchanges including Binance, Bybit, HTX, Gate and Bitget have all floated the token. DEX on Solana are also recording record highs. Daily trading volume on the network holds at $21 billion for the second day in a row. TRUMP's Coin Tokenomics: Emission and Allocation The available supply on launch day was 200 million TRUMP for a total issuance of 1 billion coins. According to the project's website, the tokens are planned to be unlocked gradually over three years. A total of 100 million TRUMP is earmarked for public distribution, with another 100 million coins to provide liquidity. The remaining 800 million TRUMP are earmarked for “creators” and CIC Digital, a company associated with Trump's NFT project. The first unlock is scheduled to take place in three months. Crypto investor and host of The Wolf Of All Streets podcast Scott Melker said Trump's meme coin is a “significant benefit” for cryptocurrency but a “detriment to humanity.” $TRUMP First take. My opinion could change.Good for crypto, bad for humanity. It’s a gratuitous cash grab, not sure how anyone can argue against that. The future and past President of the United States launched a token at 10 pm on a Friday night and insiders sniped the… — The Wolf Of All Streets (@scottmelker) January 18, 2025 Since the launch of TRUMP, more than 200,000 new users have registered on the Moonshot platform through which Trump proposed to buy the asset. Today marks 6 months since launch. In the last 12 hours, we were featured on $TRUMP’s website as THE way to buy, processed nearly $400m in volume, crushed fiat onramp records by orders of magnitude, and brought 200k+ new people onchain. We have an extremely high load right now… — Moonshot (@moonshot) January 18, 2025 Official Trump's Coin Price Prediction The future of $TRUMP and similar “politicized” tokens depends on news and social networks. If the interest in the figure of Donald Trump remains high, the volatility of the projects will be significant. Positive news background raises the price, while any negative event can sharply collapse the rates. It is recommended not to “buy on highs” and not follow the global trends of the crypto market. Professional traders advise using risk management and diversification, because a sudden “dump” can completely nullify the deposit of an unprepared investor. The future of Trump's coin Arkham Intelligence suggested that if the firms CIC Digital and Fight Fight Fight, which together own 80% of the TRUMP issue, are actually owned by the president-elect, then his fortune has multiplied several times over. TRUMP'S NET WORTH QUINTUPLES OVERNIGHT TO $28 BILLION Donald Trump's net worth is up $22 billion overnight, assuming CIC Digital LLC and Fight Fight Fight LLC, which collectively own 80% of the $TRUMP supply, effectively belong to him. At the current price of ~$28, that stake… pic.twitter.com/N7hH9QUSt9 — Arkham (@arkham) January 18, 2025 At the coin's current price of $70, Trump's net worth could be valued at around $56 billion. Forbes estimates that in November 2024, the president-elect's net worth was around $5.6 billion - an increase of more than 10 times. In response to criticism and concerns from the community, crypto-enthusiast Eric Scott stated that 80% of the supply in the hands of a politician makes TRUMP one of the “safest coins” to hold. Are Americans really OK with this? $Trump Coin means that foreign governments can essentially make themselves anonymous and then buy the coin in order to provide Trump with trading fees, and increase the value of his holdings in order to curry favors. There will be no way to… — Ed Krassenstein (@EdKrassen) January 18, 2025 TradeZella founder Umar Ashraf believes that Trump, given his position, should not have his own meme token or attempt to promote such an asset. “This is the wrong direction for cryptocurrency,” he added. Moonwell Finance co-founder Luke Youngblood also said that the situation represents a “bad long-term outlook” for the crypto industry. According to Bloomberg, Trump intends to make cryptocurrency a national priority.",News|Altcoins,EN,0,0,TRADING|SOL|EXCHANGE|MARKET|ALTCOIN,"{'name': 'Coinpaper', 'img': 'https://resources.cryptocompare.com/news/93/default.png', 'lang': 'EN'}",coinpaper,2025-01-20 07:22:38
39209216,https://coingape.com/?p=234287,1737357845,https://images.cryptocompare.com/news/default/coingape.png,"Bitcoin Price Hits New ATH of $110,000, As Odds of BTC Reserve Skyrocket",https://coingape.com/bitcoin-price-today-hits-new-ath-of-110000-why-is-btc-suddenly-up-8/,"After a swift recovery on January 19, Bitcoin created a bearish swing failure pattern on the daily chart, leading to a 6.33% crash. Regardless of the short-term correction, Bitcoin price today is up No data found for bitcoin on 49 minutes ago% and hit a new all-time high (ATH) of $110,000. This development comes ahead of Trump’s inauguration as the odds of a Bitcoin reserve spike to 59% in just a few mins. Polymarket data shows that the odds of a strategic Bitcoin reserve approval have shot up from 37% to 59% in just a few minutes. Will Trump create Bitcoin reserve in first 100 days? Why Bitcoin Price Today Is Up 8% as BTC Hits New ATH? Bitcoin price today set up a new ATH of $110,000 and trades at No data found for bitcoin on 49 minutes ago after shooting up No data found for bitcoin on 49 minutes ago%. This spike in buying pressure could be attributed to investors pulling out of the TRUMP coin and reinvesting profits into a more risk-averse asset like Bitcoin. Moreover, the long-term outlook of BTC remains bullish, with higher highs and higher lows on the daily and weekly charts, adding credence to the recent spike in buying pressure and a new ATH. The second reason for this uptrend could be the Presideent-elect Donald Trump’s inauguration, which is scheduled to take place today. Investors may have considered the recent launch of a meme coin on Solana as a show of Trump’s support for the crypto space. Additionally, it wouldn’t be surprising that capital is rotating back into BTC in anticipation of a strategic Bitcoin reserve. As a result of the recent uptrend, Ethereum (ETH) and Ripple (XRP) also registered No data found for ethereum on 49 minutes ago% and 9.66% gains, respectively. *bitcoin price updated as of No data found for bitcoin on 49 minutes ago What’s Next For Bitcoin Price? Strategic Levels to Watch Next After New ATH The weekend correction knocked Bitcoin price down to the value area high of $100K, where BTC found support and resulted in an 8% rally in the early Asian session. This sudden uptrend has caused Bitcoin to hit a new ATH of $110,000. The next levels where investors can consider booking profits include the $161.8% Fibonacci extension at $120,362 and the 261.8% Fibonacci extension level at $139,683. BTC/USDT 4-hour chart After the recent uptick, Bitcoin price prediction looks as optimistic as ever, with the expectations of new all-time highs forming around $120K and $130K, respectively, in the coming days. However, if BTC breaks below $100K, it could invalidate this bullish outlook and trigger a potential crash down to $90K. The post Bitcoin Price Hits New ATH of $110,000, As Odds of BTC Reserve Skyrocket appeared first on CoinGape .",24/7 Cryptocurrency News|bitcoin price|Bitcoin Price Analysis|BTC price,EN,0,0,BTC|TRADING|BUSINESS|ETH|FIAT,"{'name': 'CoinGape', 'img': 'https://images.cryptocompare.com/news/default/coingape.png', 'lang': 'EN'}",coingape,2025-01-20 07:24:05
39209335,https://coingape.com/?p=234289,1737358027,https://images.cryptocompare.com/news/default/coingape.png,"XRP Lawyer Calls To Prioritize Memecoin Regulation Over SAB 121, Here’s Why",https://coingape.com/xrp-lawyer-new-priority-memecoin-regulation-takes-precedence-over-sab-121/,"US President-elect Donald Trump’s launch of the TRUMP memecoin has sent shockwaves through the crypto market, sparking debates on memecoin regulation. Crypto experts and industry leaders raise concerns over politicians’ unfair market advantage, highlighting the lack of regulatory clarity. Pro-XRP lawyer John Deaton underscored the priority of memecoin regulation over other concerns, including SAB 121 legislation. Trump’s surprise launch of the memecoin ahead of his presidential inauguration has ignited a heated discussion about the pressing need for clearer regulations in the crypto space. XRP Lawyer John Deaton Pushes for Urgent Memecoin Regulation In a recent X post , John Deaton stressed the urgency in implementing memecoin regulations prompted by the frenzy surrounding Trump’s memecoin launch. Deaton stated that he previously believed SAB 121 stablecoin legislation , CFTC oversight, and tax reform were the immediate areas requiring attention from the Trump administration and Congress. Correcting his earlier stance, he wrote, “I stand corrected: it’s Meme Coin Regulation.” Backlash Grows Over Memecoin Frenzy Notably, Nic Carter, who calls himself a devoted Trump supporter, expressed his disagreement with Trump’s memecoin launch. Calling the move unreasonable, Nic Carter stated, “They’re plumbing new depths of idiocy with the memecoin launch.” Another significant personality who urged action for memecoin regulation is the US representative Ro Khanna. He recommended banning elected officials from owning highly speculative memecoins. Reflecting on the TRUMP memecoin launch , Khanna wrote: Elected officials must be barred from having meme coins by law. Meme coins are highly speculative and like gambling must be regulated by the SEC. They are neither neutral money (not controlled by insiders) nor platforms for innovation. Trump’s Memecoin Promotion Impacts XRP Lawsuit Deaton’s push for memecoin regulations follows concerns raised by XRP advocate Bill Morgan about the potential TRUMP’s impact on XRP lawsuit . According to Morgan, the incoming President’s unprecedented launch of the token emphasizes the need for clear crypto guidelines. With XRP lawyer like Deaton and Morgan expressing concerns over the TRUMP token launch, its impact extends beyond the crypto market. As the situation unfolds, it is clear that the urge for clear regulations has never been more pressing. The post XRP Lawyer Calls To Prioritize Memecoin Regulation Over SAB 121, Here’s Why appeared first on CoinGape .",24/7 Cryptocurrency News|Meme Coins|Donald Trump Crypto|John Deaton|Memecoins|Trump Memecoins|Xrp Lawsuit,EN,0,0,REGULATION|XRP|MARKET,"{'name': 'CoinGape', 'img': 'https://images.cryptocompare.com/news/default/coingape.png', 'lang': 'EN'}",coingape,2025-01-20 07:27:07
39209508,https://cointelegraph.com/news/bitcoin-all-time-high-109000-trump-inauguration-day,1737358127,https://images.cryptocompare.com/news/default/cointelegraph.png,Bitcoin hits new all-time high above $109K ahead of Trump’s inauguration,https://cointelegraph.com/news/bitcoin-all-time-high-109000-trump-inauguration-day?utm_source=rss_feed&utm_medium=rss&utm_campaign=rss_partner_inbound,"Bitcoin briefly surged above $109,000 on Jan. 20, breaking its previous high above $108,000 recorded in mid-December 2024.",Bitcoin|Donald Trump|Bitcoin price|Trump’s inauguration|Cryptocurrency|Markets|Office|United States|President|All-time high|ATH,EN,0,0,BTC|MARKET|REGULATION,"{'name': 'CoinTelegraph', 'img': 'https://images.cryptocompare.com/news/default/cointelegraph.png', 'lang': 'EN'}",cointelegraph,2025-01-20 07:28:47
39209749,https://www.bloomberg.com/news/articles/2025-01-20/bitcoin-rises-to-fresh-record-ahead-of-trump-inauguration-in-us-m64q8dma,1737358229,https://resources.cryptocompare.com/news/103/39209749.jpeg,Bitcoin Rises to Fresh Record Ahead of Trump Inauguration in US,https://www.bloomberg.com/news/articles/2025-01-20/bitcoin-rises-to-fresh-record-ahead-of-trump-inauguration-in-us-m64q8dma,"Bitcoin reached an all-time high of $109,241 as the US prepares to inaugurate pro-crypto President-elect Donald Trump.",,EN,0,0,BTC,"{'name': 'Bloomberg (Crypto)', 'img': 'https://resources.cryptocompare.com/news/103/default.png', 'lang': 'EN'}",bloomberg_crypto_,2025-01-20 07:30:29
39209625,https://en.coinotag.com/bitcoin-surges-above-109000-tentatively-as-trump-prepares-for-presidential-inauguration/,1737358435,https://resources.cryptocompare.com/news/77/39209625.jpeg,"Bitcoin Surges Above $109,000 Tentatively as Trump Prepares for Presidential Inauguration",https://en.coinotag.com/bitcoin-surges-above-109000-tentatively-as-trump-prepares-for-presidential-inauguration/,"Bitcoin has reached new heights, surpassing the $109,000 mark, fueled by anticipation surrounding President-elect Donald Trump’s upcoming inauguration. This surge marks a significant moment in the cryptocurrency landscape, with Bitcoin",Bitcoin|News|BTC,EN,0,0,BTC,"{'name': 'CoinOtag', 'img': 'https://resources.cryptocompare.com/news/77/default.png', 'lang': 'EN'}",coinotag,2025-01-20 07:33:55
39209612,https://en.coin-turk.com/?p=180050,1737358515,https://resources.cryptocompare.com/news/79/39209612.jpeg,Trump’s Memecoin Ignites Solana’s Market Surge,https://en.coin-turk.com/trumps-memecoin-ignites-solanas-market-surge/,Trump's memecoin project significantly boosted Solana's total value locked. The launch sparked a notable increase in SOL's price and trading activity. Continue Reading: Trump’s Memecoin Ignites Solana’s Market Surge The post Trump’s Memecoin Ignites Solana’s Market Surge appeared first on COINTURK NEWS .,Solana (SOL),EN,0,0,SOL|MARKET|TRADING,"{'name': 'CoinTurk News', 'img': 'https://resources.cryptocompare.com/news/79/default.png', 'lang': 'EN'}",cointurken,2025-01-20 07:35:15
39209660,https://coinpedia.org/?p=407694,1737358547,https://images.cryptocompare.com/news/default/coinpedia.png,"TRUMP Meme Coin Price Prediction 2025, 2026 – 2030: Will $TRUMP Price Hit $100?",https://coinpedia.org/price-prediction/official-trump-price-prediction/,"The post TRUMP Meme Coin Price Prediction 2025, 2026 – 2030: Will $TRUMP Price Hit $100? appeared first on Coinpedia Fintech News Story Highlights The live price of the TRUMP crypto is $ 58.34177547 . TRUMP price could reach a high of $100 in 2025. With a potential surge, the TRUMP memecoin price may reach $378 by 2030. Built on the Solana ecosystem, the TRUMP Coin has caused havoc in the crypto space. Reportedly, this meme coin takes its inspiration from Donald Trump’s first assassination attempt where President Trump faced death and came up fighting. Reportedly, he came up with his fist in the air and the iconic battle cry “FIGHT FIGHT FIGHT!” right after the failed attempt. His strength and courage revolutionized a movement that further became the most memorable meme of the century. Are you one of many planning to stack the TRUMP meme coin before the Donald Trump oath-taking ceremony ? We at CoinPedia have covered the market trends, sentiments, and possible OFFICIAL TRUMP (TRUMP) Price Prediction 2025, 2026 – 2030, and the years in between. Table of contents Overview Trump Coin Price Prediction 2025 Trump Coin Price Chart 2026 – 2030 Trump Meme Coin Price Prediction 2026 Trump Coin Prediction 2027 Trump Crypto Price Target 2028 Trump Coin Price Analysis 2029 Trump Price Prediction 2030 CoinPedia’s Trump Price Projection FAQs Overview Cryptocurrency OFFICIAL TRUMP Token TRUMP Price $ 58.34177547 23.21% Market cap $ 11,668,355,094.1807 Circulating Supply 200,000,000.00 Trading Volume $ 52,215,973,957.6826 All-time high $75.35 on 19th January 2025 All-time low $6.25 on 18th January 2025 Trump Coin Price Prediction 2025 The latest Donald Trump-themed memecoin is projected to experience major price volatility during the oath-taking ceremony today. Reportedly, this memecoin has witnessed a 10x run over since its inception 3 days ago. With an ATH of over $75, this altcoin could be the next 100X Gem this year. Notably, with more fundamentally strong updates and increasing adoption of the crypto ecosystem in the real world, the TRUMP coin price could achieve a new annual high of $100 . On the flip side, rising uncertainty, increased liquidation , or a bearish pullback could result in it concluding 2025 with a low of $35 . Considering the present market sentiments, the TRUMP coin could conclude 2025 with an average trading value of $67 . Year Potential Low Potential Average Potential High 2025 $35 $67 $100 Are you wondering if the SOL coin price will hit $500 with the launch of Solana ETF? Read CoinPedia’s Solana Price Prediction ! Trump Coin Price Chart 2026 – 2030 Year Potential Low ($) Potential Average ($) Potential High ($) 2026 46 92 139 2027 59 125 192 2028 72 163 254 2029 88 197 306 2030 109 243 378 Trump Meme Coin Price Prediction 2026 By 2026, the value of a single OFFICIALTRUMP coin price could reach a maximum of $139 with a potential low of $46 . With this, the average price could land at around the $92 mark. Trump Coin Prediction 2027 Looking forward to 2027, the TRUMP coin Price may range between $59 and $192 , and a potential average value of around $125 . Trump Crypto Price Target 2028 The Trump price price could achieve the $250 milestone with a high of $254 by the year 2028. However, the viral memecoin could record a low of $72 and an average price of $163 if the crypto market turns bearish. Trump Coin Price Analysis 2029 During 2029, the TRUMP crypto could reach a maximum trading value of $306 with a potential low of $88 . Evaluating the market sentiments, the average price of this altcoin could settle at around $197 . Trump Price Prediction 2030 The TRUMP memecoin crypto prediction for the year 2030 could range between $109 to $378 . Considering the buying and selling pressure, the average price could be around $243 for that year. Concerned about the future price prospects of Shiba Inu memecoin? Read SHIB Price Prediction to unfold the possible mysteries until 2030! CoinPedia’s Trump Price Projection With more fundamental updates and a potential roadmap, the Trump crypto token could dominate the memecoin segment this year. Notably, this could push its value toward a new all-time high (ATH) during the upcoming AltSeason. If the bullish sentiment intensifies, the TRUMP price could reach a high of $100 in 2025. On the contrary, if the market turns extremely bearish or this project experiences a pump-and-dump situation, this could result in this meme coin plunging toward its annual low of $35 . Year Potential Low Potential Average Potential High 2025 $35 $67 $100 Are you curious to explore the long-term price possibilities of the RAY coin? Read our Raydium Price Prediction to uncover the potential action until 2030! FAQs Should I buy Trump meme coin? The OFFICIAL TRUMP memecoin has gained significant attention from the crypto space with its impressive 10x price rally in 48 hours. How to buy Trump meme coin? This memecoin is available to trade on top cryptocurrency exchanges like Coinbase, Binance, Bitget, and major Solana pairs. Is Trump Coin a good investment? If the bullish sentiment sustains, the TRUMP meme coin could reach a high of $100 this year. Where to buy Trump memecoin? The Trump token is currently in high demand and is tradable on top Sol-based pairs such as Ocra, Raydium, and Jupiter. Moreover, one can also purchase this viral meme coin on Bitget and Binance. How high will Trump memecoin go in 2025? The Trump crypto could range between $35 and $100 in 2025. Is it too late to buy the Trump memecoin? Considering the present market sentiments, it is too early to jump to a conclusion and the core fundamentals of this project are yet to roll out. How much will TRUMP memecoin be worth by 2030? With increased adoption and bullish sentiment, the Trump price could reach a maximum value of $378 by 2030. How much is Trump coin worth? At the time of writing, the value of one TRUMP memecoin was $59.37 .",Cryptocurrency Price Prediction|Price Prediction,EN,0,0,TRADING|MARKET|ZRX|EXCHANGE|SOL,"{'name': 'coinpedia', 'img': 'https://images.cryptocompare.com/news/default/coinpedia.png', 'lang': 'EN'}",coinpedia,2025-01-20 07:35:47
39209674,https://www.cryptoknowmics.com/news/?p=257422,1737358626,https://images.cryptocompare.com/news/default/cryptoknowmics.png,XRP Hits $3.4 Before Dropping 14% – Market Sentiment Turns Bearish,https://www.cryptoknowmics.com/news/xrp-hits-3-4-before-dropping-14-market-sentiment-turns-bearish/?utm_source=rss&utm_medium=rss&utm_campaign=xrp-hits-3-4-before-dropping-14-market-sentiment-turns-bearish,"The Ripple-affiliated XRP token has achieved a significant milestone, hitting a new weekly high of $3.4 on the Bitstamp exchange. This marks its highest price in nearly seven years. However, the bullish momentum was short-lived, as XRP plunged by 14% on Sunday, hitting an intraday low of $2.8. XRP Faces Market Pressure Despite the pullback, … Continue reading ""XRP Hits $3.4 Before Dropping 14% – Market Sentiment Turns Bearish"" The post XRP Hits $3.4 Before Dropping 14% – Market Sentiment Turns Bearish appeared first on Cryptoknowmics-Crypto News and Media Platform .",Altcoin News|Breaking News|Latest Blockchain News|Latest News on Ripple|Live Crypto News|News|XRP Hits $3.4,EN,0,0,XRP|TRADING|MARKET|EXCHANGE,"{'name': 'Cryptoknowmics', 'img': 'https://images.cryptocompare.com/news/default/cryptoknowmics.png', 'lang': 'EN'}",cryptoknowmics,2025-01-20 07:37:06
