id,guid,published_on,imageurl,title,url,body,tags,lang,upvotes,downvotes,categories,source_info,source,date
33767162,[object Object],1737373917,https://resources.cryptocompare.com/news/13/33767162.jpeg,Solana TVL Skyrockets Back Up Past $10B – Is Solaxy the Next Presale to Boom in 2025?,https://bitcoinist.com/solana-tvl-skyrockets-back-up-past-10b-is-solaxy-the-next-presale-to-boom-in-2025/,"After the $TRUMP and $MELANIA coins launched on the Solana blockchain this weekend, SOL is up 45.57 %, surpassing $10B TVL (Total Value Locked) for the first time since the FTX collapse two years ago. However, this success has not come without its challenges. As Solana struggles to deal with the congestion caused by an unprecedented (no pun intended) surge in transactions, this Solana Layer-2 solution, Solaxy ($SOLX) , couldn’t come up at a better time. On 19 January, the $SOL price soared to a new all-time high above $290 and a market cap above $128B in direct relationship to the mania around the Trump-family meme coins. Can $TRUMP & $MELANIA Get Along? First came $TRUMP after incoming US president Trump announced his official meme coin on X late on Friday, 17 January. The $TRUMP meme coin attracted massive trading volumes of some $3B over the weekend, reaching its peak at $6B in market cap and $30B in fully diluted value within 24 hours. Trump’s coin went on to become the third-largest cryptocurrency across all blockchains in terms of market capitalization by Sunday, before suddenly falling back, just as the MELANIA coin launched and started gaining traction. A Tough Act to Follow Like her husband’s coin before her, $MELANIA shot the lights out, surging over 21,000% and reaching $12B in less than three hours from launch on Sunday, 19 January. Indeed, the two Trump family meme coins sent traffic on Solana ($SOL) through the roof over the weekend. While this helped $SOL generate over $35 million in fees and at least $14 million in revenue, the pre-inauguration surge also led to some of Solana’s ecosystem applications, like Jito and Phantom reporting technical difficulties and delays . As the pressure on Solana’s blockchain mounts, a project like Solaxy ( $SOLX ) is in a great position to make its debut. What Is Solaxy? Solaxy is the token powering the first-ever Layer-2 (L2) blockchain built on Solana. The L2 Solana network will tackle the network congestion, scalability issues, and failed transactions we’ve seen during this recent peak trading activity. While the Layer 2 won’t be ready to take the pressure off during this current TRUMP surge, it will lay the foundation for Solana’s future expansion. $SOLX is based on Ethereum and aims to tap into the liquidity of Ethereum to enhance Solana, enabling faster, cheaper, and more reliable transactions at a scale previously unseen. The $SOLX token presale launched on December 12, 2024, and has already raised close to $12M ($11.93M). To date, the token price has gone from $0.001 to over $0.0016 — a 60% increase, reflecting significant investor interest. With demand for Solana’s infrastructure only rising, analysts believe Solaxy could reach $0.025 by the end of 2025, offering potential returns of 1,462.5% for presale investors, with even higher gains for the early adopters. Early $SOLX investors also benefit from dynamic staking rewards, currently offering 306% annual returns. The Solaxy network is still under development and is only slated for release later this year, but its promise to address Solana’s pain points has already attracted marked interest, as its growing community on Telegram and 61K follower count on X testify. Solaxy to Rise 100x? As Solana’s galaxy of meme coins continues to expand, Solaxy’s positioning as an L2 project for the meme coin market, along with its attractive early investor rewards, could set it up to become Solana’s next 100x coin by the year’s end. However, as with any new cryptocurrency, the risks remain, and you should always do your own research and never invest more than you can afford to lose. This is not financial advice, and while some make billions, others can lose great portions of their savings by betting on meme coins making it big.",Altcoins|Solana,EN,0,0,INJ|ETH|ASIA|ALTCOIN|HNT|MARKET|SHIB|BNB|EXCHANGE|BTC|REGULATION|TRADING|OTHER|DOGE|SOL|BLOCKCHAIN|XRP|TON|BUSINESS|FIAT|BONK|PYUSD|COMMODITY|ADA|ZRX|MINING|FTT|DOT|USDT|RESEARCH|FORKS|IMX|ICP|TRX|TECHNOLOGY|ARB|WLD|SPONSORED|RAY|SUI|PEPE|WALLET|UNI|XMR|LINK|NEAR|SEI|MATIC|ARKM|USDC|LTC|LUNA|AIRDROP|BTG|MX|TOKEN SALE|BSV|FLOKI|TOKEN LISTING AND DELISTING|BITTENSOR|HBAR|CRO|WIF|ZEC|MEME|MOG|APE|JUP|AAVE|ONDO|XTZ|BGB|LUNC|XLM|APT|ZK|MANA|AR|AGX|FET|AXS|ADMINISTRATIVE EVENTS|XDC|BCH|MNT|FIL|AVAX,"{'name': 'Bitcoinist', 'img': 'https://images.cryptocompare.com/news/default/bitcoinist.png', 'lang': 'EN'}",bitcoinist,2025-01-20 11:51:57
39217498,https://coingape.com/?p=234392,1737374001,https://images.cryptocompare.com/news/default/coingape.png,Dogecoin Whale Accumulation Sparks Buzz As Analyst Flags $15 Target,https://coingape.com/dogecoin-whale-accumulation-sparks-buzz-as-analyst-flags-15-target/,"Dogecoin whale’s bullish trade continues on Monday, nabbing substantial attention from crypto investors. Notably, as nearly 80 million DOGE was accumulated by a whale, market sentiments of a looming price rally for the token have surfaced globally. Moreover, a top crypto analyst has further revealed a $15 price target for the dog-themed meme token, the accumulation has gained additional traction. Dogecoin Whale Bags 80M Tokens Igniting Optimism According to the latest data by Whale Alert , a Dogecoin whale purchased 78.57M coins from Binance. As per the data, the address D5nuZhL.. made the purchase worth $29.86 million. Primarily, the accumulation right ahead of Donald Trump’s inauguration ceremony underscores market sentiments of bolstered prices ahead, attributable to the pro-crypto Republican’s win. Further, it’s also worth mentioning that Dogecoin-backer and American billionaire Elon Musk is set to begin his D.O.G.E. role under Trump’s presidency. Overall, the whale’s accumulation in light of these events has supported investor sentiments of price gains ahead. It’s also noteworthy that CoinGape previously reported DOGE whale activity is rising , adding to optimism surrounding future movements. DOGE Price Shot Up 20% In a Week At the time of reporting, DOGE price illustrated a highly turbulent action, ultimately soaring by 2% to $0.3772. The coin’s intraday low and high were $0.3472 and $0.3983, respectively. Further, the weekly chart for the asset showcased gains worth 20%. Altogether, the broader rising movement, supported by whale buying, has solidified investors’ bullishness on future movements. The top meme coin is expected to hit a new all-time high soon. Analyst Points Out $15 Price Target Ahead Simultaneously, renowned crypto market analyst Ali Martinez has recently predicted a $15 target price for Dogecoin, sparking market discussions as the even whale data aligned with bullish projections. Ali revealed that DOGE appears to trade inside a multi-year ascending parallel channel that indicates a bullish price target of $15. As a result, traders and investors are eagerly awaiting phenomenal gains in one of the leading dog-themed meme coins in terms of market cap, with bullish sentiments further supported by rising Dogecoin whale accumulations. While everyone focuses on $TRUMP , whales bought 1.83 billion #Dogecoin $DOGE in the last 48 hours! pic.twitter.com/ozznJzflg2 — Ali (@ali_charts) January 19, 2025 The post Dogecoin Whale Accumulation Sparks Buzz As Analyst Flags $15 Target appeared first on CoinGape .",24/7 Cryptocurrency News|Altcoin News|Dogecoin (DOGE)|Dogecoin whales,EN,0,0,DOGE|TRADING|MARKET|BUSINESS|BNB,"{'name': 'CoinGape', 'img': 'https://images.cryptocompare.com/news/default/coingape.png', 'lang': 'EN'}",coingape,2025-01-20 11:53:21
39217500,https://coingape.com/?post_type=markets&p=234375,1737374046,https://images.cryptocompare.com/news/default/coingape.png,Why is Chainlink Price Up 15%? Is a $30 Breakout Next?,https://coingape.com/markets/why-is-chainlink-price-up-15-is-a-30-breakout-next/,"Chainlink price has surged 15% in the last 24 hours, reflecting growing market optimism ahead of Trump’s inauguration today. The overall investor sentiment has been lifted by the crypto market rally particularly from Bitcoin hitting an all-time high. Analysts now anticipate further gains, with Chainlink eyeing a potential breakout to $30. Market participants remain closely focused on this bullish momentum. The LINK price soared today, outperforming most top altcoins amid optimism sparked by U.S. President-Elect Donald Trump’s inauguration. His administration, widely regarded as pro-crypto, has fueled a positive sentiment across the market. Bitcoin price reacted strongly, hitting a new all-time high of $109,11 4. This crypto market rally reflects renewed confidence in digital assets under the incoming administration’s potential crypto-friendly policie s. Investors are shifting focus to prominent cryptocurrencies, including LINK, TRUM, MANIA, and BTC. LINK remains among today’s top gainers, highlighting growing interest in its utility and potential. Chainlink Price Jumps 10%; Could $30 Be the Next Target? In its recent uptrend, Chainlink has been noted by a crypto analyst , who believes that $30 is possible. The cryptocurrency that is well grounded and has practical applications in the real world has been on the rise in the past few days. LINK has seen a 15% price surge in recent days – a clear sign that investors are starting to regain their confidence. Analysts say $30 is attainable, especially if the broader market remains supportive of this surge. LINK Price Breaks Out, Targets 40% Surge Chainlink’s price rallied above $26, breaking a prolonged descending wedge pattern. The breakout suggests a potential 40% gain, targeting $30. Crypto experts highlight bullish momentum amid increasing buying pressure. Traders are still hopeful as they trade waiting to break the resistance levels while keeping an eye on other markets that affect the price of LINK. Source: X Chainlink Price Analysis As of Monday, the LINK price hovered at $25.59, recording a notable 40% surge over the past week. This bullish momentum has placed Chainlink among the top-performing altcoins in the market, showcasing strong recovery signals after recent consolidations. The Awesome Oscillator (AO) has turned positive at 1.75, indicating strengthening bullish momentum. Additionally, the Chaikin Money Flow (CMF) at 0.13 signals steady capital inflows, highlighting growing investor confidence. The next key target for Chainlink price prediction lies at $30, a psychological resistance level. A decisive breakout above $30 could propel the price toward $52, which aligns with the previous highs observed in late 2021. The $23 level serves as immediate support, followed by stronger support at $20. A break below these levels could challenge the current bullish structure. Chainlink Price Chart: TradingView Chainlink’s 15% surge signals bullish potential amid broader market strength. With supportive fundamentals and growing interest, $30 is achievable. The post Why is Chainlink Price Up 15%? Is a $30 Breakout Next? appeared first on CoinGape .",Price Analysis|Chainlink|Chainlink (LINK)|Chainlink Price|Chainlink price analysis,EN,0,0,TRADING|LINK|MARKET|BUSINESS|BTC,"{'name': 'CoinGape', 'img': 'https://images.cryptocompare.com/news/default/coingape.png', 'lang': 'EN'}",coingape,2025-01-20 11:54:06
39217779,https://www.cryptoglobe.com/latest/2025/01/gamegpt-launches-the-revolutionary-genesis-ai-nft-collection-combining-ai-and-blockchain-for-the-future-of-gaming/,1737374220,https://resources.cryptocompare.com/news/2/39217779.jpeg,"GameGPT Launches The Revolutionary Genesis AI NFT Collection, Combining AI and Blockchain for the Future of Gaming",https://www.cryptoglobe.com/latest/2025/01/gamegpt-launches-the-revolutionary-genesis-ai-nft-collection-combining-ai-and-blockchain-for-the-future-of-gaming/,"Austin, United States / Texas, January 20th, 2025, Chainwire Bringing cutting-edge AI technology to the forefront of gaming and blockchain, GameGPT announces the official launch of their Genesis AI NFT Collection—an innovative blend of digital NFT ownership and advanced AI Agent capability. With this launch, GameGPT aims to redefine how video games are created: providing gamers, creators,",Press Releases,EN,0,0,BLOCKCHAIN|TECHNOLOGY,"{'name': 'CryptoGlobe', 'img': 'https://images.cryptocompare.com/news/default/cryptoglobe.png', 'lang': 'EN'}",cryptoglobe,2025-01-20 11:57:00
39217593,https://en.bitcoinsistemi.com/trump-enthusiasm-also-influenced-institutional-investors-they-flocked-to-five-altcoins-apart-from-bitcoin-btc/,1737374230,https://resources.cryptocompare.com/news/81/39217593.jpeg,Trump Enthusiasm Also Influenced Institutional Investors! They Flocked to Five Altcoins Apart from Bitcoin (BTC)!,https://en.bitcoinsistemi.com/trump-enthusiasm-also-influenced-institutional-investors-they-flocked-to-five-altcoins-apart-from-bitcoin-btc/,"Bitcoin (BTC) broke a new record today, thanks to the excitement created by Donald Trump's inauguration, and renewed its ATH by passing $ 109,000. While Bitcoin is expected to rise further around Trump enthusiasm, Coinshares released its weekly cryptocurrency report and said that there was an inflow of $2.2 billion last week. “Last week, during the excitement of Trump's inauguration, $2.2 billion in inflows were recorded into cryptocurrency investment products. This was the biggest inflow week of the year so far.” Bitcoin is the Leader Again! When looking at individual crypto funds, it was seen that the majority of inflows were in Bitcoin. BTC saw an inflow of $1.9 billion, while Ethereum (ETH) saw an inflow of $246.2 million. When we look at other altcoins, XRP saw an inflow of $30.8 million, Chainlink (LINK) $2.8 million, Stellar (XLM) $2.1 million, and Solana (SOL) $2.5 million. “Bitcoin saw $1.9 billion inflows, taking YTD inflows to $2.7 billion. Ethereum saw a total of $246 million in inflows last week, matching the outflows it has seen so far this year, but remains the weakest performer from a flow perspective this year. Still, it dwarfs Solana’s $2.5 million in inflows last week. XRP saw another $31 million inflows last week, bringing its total inflows since mid-November 2024 to a staggering $484 million. “There are small inflows in Stellar of $2.1 million but very little other altcoin activity.” When looking at regional fund inflows and outflows, it was seen that the USA ranked first with an inflow of 2.099 billion dollars. After the US, Switzerland and Canada also saw notable inflows with $88.9 million and $13.4 million respectively. In the face of these inflows, Sweden experienced a small outflow of $14.5 million. *This is not investment advice. Continue Reading: Trump Enthusiasm Also Influenced Institutional Investors! They Flocked to Five Altcoins Apart from Bitcoin (BTC)!",Altcoin|Analysis|Bitcoin|Ethereum|News|Solana|XRP,EN,0,0,BTC|ALTCOIN|BUSINESS|ETH|SOL,"{'name': 'BitcoinSistemi', 'img': 'https://resources.cryptocompare.com/news/81/default.png', 'lang': 'EN'}",bitcoinsistemi,2025-01-20 11:57:10
39217771,https://www.cryptopolitan.com/?p=647092,1737374346,https://resources.cryptocompare.com/news/43/39217771.jpeg,Bitcoin soars past new $108K all-time high following news of World Liberty Fi purchases,https://www.cryptopolitan.com/bitcoin-hit-a-new-all-time-high/,"Bitcoin hit a new all-time high of $108K on Monday as the U.S. awaits the inauguration of pro-crypto President-elect Donald Trump later today. The price of Ethereum also surged following news of World Liberty Financial’s recent purchases of 14,403 ETH. The rise in Bitcoin price coincides with the Trump family’s latest foray into the crypto market with the launch of the TRUMP and MELANIA tokens. Although the memecoins sucked liquidity from crypto markets, Bitcoin and Ethereum prices continue to rise ahead of Trump’s inauguration. Bitcoin soars toward $110K ahead of Trump’s inauguration 📈Market Overview $BTC hit a new all-time high, soaring past $108K. $ETH also surged following news of World Liberty Fi purchases. The spotlight is on $MELANIA, launched by Melania Trump, with a market cap of $1.8B. $TRUMP memecoin plunged 50% following this news. Market Cap:… pic.twitter.com/gHsKbUh6KP — CryptoRank.io (@CryptoRank_io) January 20, 2025 The United States and the world are waiting for the inauguration of the pro-crypto Donald Trump as the 47th President of the United States on January 20. The event will take place inside the rotunda of the U.S. Capitol building at 12:00 pm ET. The crypto-friendly president promised during his campaign to use his executive powers to resolve the regulatory hurdles holding crypto back. He also plans to promote digital asset adoption in his first days in office. Data from CoinMarketCap revealed that Bitcoin’s price reached a new all-time high of $108K on Monday, hovering around $107K at publication time. The newly elected president launched a $TRUMP memecoin on Friday. As of the time of publication, the coin has a market cap of $11.62B. The pro-crypto president revealed that the cryptocurrency was celebrating “WINNING” the presidential election and his upcoming inauguration. Data from CoinMarketCap shows that the coin is currently trading at $57, with a 783% rise in the past seven days. Incoming first lady Melania Trump also launched the $MELANIA memecoin yesterday. The Kobeissi Letter revealed that the launch of the MELANIA token caused a 40% drop in Donald Trump’s memecoin. Data from CoinMarketCap showed that the MELANIA coin is currently trading at $10 at the time of publication. After MELANIA launched, Donald Trump Jr. the president’s son, highlighted that his family was “extremely proud” of what they and World Liberty Financial continue to accomplish in crypto. ETH price surges with World Liberty Financial purchases World Liberty Financial (WLFI) is a Donald Trump-backed decentralized platform that launched in September with 100 billion tokens created. The crypto project announced today that it sold 20% of its token supply. WLFI also revealed that it will open up an additional block of 5% of token supply due to massive demand and overwhelming interest. The project disclosed that the tokens can’t be sold. Instead, they will be used as the governance token for the project’s yet-to-be-launched decentralized crypto trading platform. Lookonchain also revealed that World Liberty Financial recently made a major purchase of 14,403 ETH worth a total of $48M USDC. The crypto project’s holdings in ETH reached 42K ETH, worth approximately $141 million at current prices. Although the crypto project has not disclosed the specific reasons for ETH acquisition, the price of ETH has soared in the meantime. Data from CoinMarketCap showed that Ethereum was trading at $3,356 which is a 4% increase from the previous day. Eric Trump, Donald Trump’s son and advisor to World Liberty, suggested further developments to the crypto project. He reposted the news about WLF’s ETH purchases and wrote, “Wait until you see what they do tomorrow.” Tron founder Justin Sun is the project’s advisor and largest investor with a $30 million token purchase in November. Sun revealed yesterday that he will invest “an additional $45 million” into World Liberty, bringing his total investment to $75 million. The crypto entrepreneur just purchased $15M USDT to acquire $1B WLFI. The crypto project also purchased four Ethereum Name Service domains on January 19 just before Trum’s inauguration. The ENS domains were worldliberty.eth, trumpcoin.eth, erictrump.eth, and barrontrump.eth. From Zero to Web3 Pro: Your 90-Day Career Launch Plan",News|BTC|ETH|Melania|TRUMP|WLFI,EN,0,0,ETH|BTC|TRADING|MARKET|REGULATION,"{'name': 'Cryptopolitan', 'img': 'https://images.cryptocompare.com/news/default/cryptopolitan.png', 'lang': 'EN'}",cryptopolitan,2025-01-20 11:59:06
39217713,https://ambcrypto.com/?p=460791,1737374402,https://images.cryptocompare.com/news/default/ambcrypto.png,Ethereum’s supply nears pre-merge levels – Is PoS failing?,https://ambcrypto.com/ethereums-supply-nears-pre-merge-levels-signs-of-pos-failing/,"In the last three months, the validator count on the network has dropped by around 2% to 1,057,356.",Altcoin|Ethereum|News|News 1|Social|Trading View,EN,0,0,ETH|ALTCOIN,"{'name': 'AMB Crypto', 'img': 'https://images.cryptocompare.com/news/default/ambcrypto.png', 'lang': 'EN'}",ambcrypto,2025-01-20 12:00:02
39217662,https://news.bitcoin.com/?p=699377&preview=true&preview_id=699377,1737374404,https://resources.cryptocompare.com/news/14/39217662.jpeg,"RWA Titan Rexas Finance (RXS) Achieves $41,000,000 Raised as Presale Stage 11 Sells Out in a Jiffy",https://news.bitcoin.com/rwa-titan-rexas-finance-rxs-achieves-41000000-raised-as-presale-stage-11-sells-out-in-a-jiffy/,"PRESS RELEASE. Rexas Finance (RXS) continues to dominate the crypto market by achieving a remarkable milestone. The project has raised $41,000,000 in its presale, with Stage 11 selling out in record time. This success highlights the growing demand for RXS, currently in Stage 12 and priced at $0.20 per token. Since its debut at $0.03",Press release,EN,0,0,SPONSORED|MARKET,"{'name': 'Bitcoin.com', 'img': 'https://images.cryptocompare.com/news/default/bitcoincom.png', 'lang': 'EN'}",bitcoin.com,2025-01-20 12:00:04
