id,guid,published_on,imageurl,title,url,body,tags,lang,upvotes,downvotes,categories,source_info,source,date
40610697,https://en.bitcoinsistemi.com/?p=150577,1740093316,https://resources.cryptocompare.com/news/81/40610697.jpeg,Could MAGACOINOFFICIAL Be the Next Big XRP Alternative? Here’s the Latest!,https://en.bitcoinsistemi.com/could-magacoinofficial-be-the-next-big-xrp-alternative-heres-the-latest/,"For years, XRP has been a top choice for crypto investors, offering fast transactions and global adoption. However, with the market evolving, new contenders are emerging, and one crypto is making serious waves—MAGACOINOFFICIAL. With its presale surpassing $2 million, experts believe it could become a major alternative to XRP in the years ahead. ACT FAST! ENTER MAGA50X NOW AND CLAIM YOUR 50% EXTRA BONUS! MAGACOINOFFICIAL Is a Game-Changer MAGACOINOFFICIAL is quickly becoming one of the most sought-after early-stage cryptos, attracting both retail and whale investors. Unlike XRP and Ethereum, which have already experienced massive growth, this project is still in its early phase, meaning the biggest profits are still up for grabs. With a fixed supply of 100B tokens, and a growing community, MAGACOINOFFICIAL is set to become one of the hottest cryptos of 2025. And for a limited time, investors can use promo code MAGA50X to receive a 50% extra bonus on their purchase! LIMITED TIME ONLY – USE PROMO CODE MAGA50X AND GET 50% EXTRA BONUS TODAY! XRP continues to be a leader in cross-border finance, but with increasing competition, newer cryptos like MAGACOINOFFICIAL offer more upside. Ethereum (ETH) ETH is the foundation of the smart contract ecosystem, but its high transaction fees have opened the door for faster, lower-cost alternatives. Tron (TRX) – TRX has built a strong payments and DeFi ecosystem, yet its growth potential remains limited compared to emerging projects. Sei (SEI) – SEI is gaining attention for its high-speed blockchain, but it has yet to prove itself against larger networks. DON’T MISS OUT! APPLY MAGA50X TODAY FOR A 50% EXTRA BONUS! MAGACOINOFFICIAL: The Crypto to Watch Before 2026? With its presale running out fast, huge demand, and exchange listings on the way, MAGACOINOFFICIAL is quickly becoming the best early-stage investment in crypto. Unlike established assets, this project is just getting started, making it the perfect time to get in before mainstream adoption drives prices up. DON’T WAIT—USE MAGA50X TODAY FOR A 50% EXTRA BONUS! Buy now at MAGACOINOFFICIAL.COM Follow updates on Twitter/X: https://x.com/officialMAGAx Continue Reading: Could MAGACOINOFFICIAL Be the Next Big XRP Alternative? Here’s the Latest!",Sponsored,EN,0,0,ZRX|XRP|ETH|BUSINESS|MARKET,"{'name': 'BitcoinSistemi', 'img': 'https://resources.cryptocompare.com/news/81/default.png', 'lang': 'EN'}",bitcoinsistemi,2025-02-20 23:15:16
40610094,https://timestabloid.com/?p=57963,1740093330,https://resources.cryptocompare.com/news/67/default.png,"Qubetics’ $13.4M Presale Triumph, Polkadot Poised for Growth, and Astra’s Next Big Leap – Top Cryptos to Invest in Today For Exponential Return Potential",https://timestabloid.com/qubetics-13-4m-presale-triumph-polkadot-poised-for-growth/,"As the cryptocurrency space continues to boom, savvy investors are on the lookout for the best cryptos to invest in today for exponential return potential. Among the heavy hitters, three projects stand out: Qubetics, Polkadot, and Astra. Each one brings its own unique value proposition to the table, from blockchain interoperability and high scalability to seamless cross-chain transactions. With digital finance gaining rapid traction, these projects have the potential to disrupt traditional financial systems while offering massive growth opportunities for early adopters. While Polkadot has established itself as a formidable force in the blockchain interoperability arena, Astra is catching the attention of investors with its focus on decentralized finance (DeFi) and decentralized applications (dApps). However, it’s Qubetics that seems poised to take the industry by storm. With an innovative non-custodial multi-chain wallet and a groundbreaking partnership with 1inch, Qubetics is making waves in the decentralized finance ecosystem. This article will dive deep into each of these projects, exploring how they work and why they may just be the best cryptos to invest in today for exponential returns. Qubetics, in particular, offers real-world solutions that its predecessors—such as Polkadot and Astra—have yet to fully address. By combining the best features of blockchain technology with cutting-edge wallet solutions, Qubetics has positioned itself as a leader in the DeFi space. Whether you’re a business, professional, or individual, Qubetics is creating a platform where the barriers to seamless blockchain transactions are broken down, and users can unlock the full potential of their digital assets. Qubetics: Leading the Charge in Blockchain Innovation When it comes to the best cryptos to invest in today for exponential return potential, Qubetics ($TICS) should be at the top of your list. The project is revolutionizing the blockchain and digital finance landscape with its non-custodial multi-chain wallet , strategic partnerships, and advanced transaction capabilities. Currently in its 22nd presale stage, Qubetics has already raised over $13.4 million and sold more than 481 million tokens to over 20,600 holders. The ongoing presale offers tokens at $0.08073 each, with projections indicating massive returns—up to 18,480% after the mainnet launch. One of the standout features of Qubetics is its non-custodial multi-chain wallet. This wallet offers users an unmatched level of security and flexibility, allowing them to manage multiple cryptocurrencies across different blockchains in a single, easy-to-use interface. By integrating cross-chain functionality, the Qubetics wallet ensures that users can seamlessly swap assets without the need for intermediaries. This opens up a world of possibilities for businesses and individuals alike, making it a valuable tool for anyone involved in the rapidly evolving world of decentralized finance. Qubetics’ partnership with SWFT Blockchain is also a game-changer. Together, they are introducing next-gen wallet innovation that brings lightning-fast transactions across multiple blockchains. This collaboration ensures that users can perform transactions in real-time, whether they are swapping assets or managing a diverse portfolio. With enhanced security features powered by SWFT Blockchain’s cutting-edge encryption protocols, Qubetics is setting the bar high for blockchain transactions in 2025 and beyond. In addition to the SWFT Blockchain partnership, Qubetics has teamed up with the 1inch Network, a top DeFi aggregator that connects users to hundreds of decentralized exchanges (DEXs). By integrating 1inch’s technology, Qubetics offers optimized pricing and liquidity, ensuring users get the best possible trade rates. This partnership places Qubetics at the forefront of decentralized trading, transforming its wallet into a powerful tool for DeFi enthusiasts. As the Qubetics presale continues, there’s a palpable sense of excitement surrounding this project. With massive growth potential and real-world applications, it’s hard to ignore the appeal of $TICS. Whether you’re looking for a safe investment or aiming for astronomical returns, Qubetics is certainly one to watch. Polkadot: The Future of Blockchain Interoperability Polkadot has long been considered one of the best cryptos to invest in today for exponential return potential, thanks to its innovative approach to blockchain interoperability. The project aims to solve one of the biggest challenges in the crypto world: the inability for different blockchains to communicate with each other seamlessly. Polkadot’s multi-chain framework enables multiple blockchains to interoperate, allowing data and value to be transferred across different networks without friction. This scalability and interoperability make Polkadot an appealing investment for those looking for long-term growth. The project’s ability to link disparate blockchains and enable cross-chain communication positions it as a key player in the evolving Web3 ecosystem. As more industries adopt blockchain technology, Polkadot’s potential to integrate various platforms and provide a unified infrastructure could unlock exponential growth. Polkadot’s native token, DOT, plays a crucial role in the network’s governance and consensus mechanism. It allows holders to vote on network upgrades and ensures that the ecosystem remains decentralized and secure. With strong developer support and a growing ecosystem of parachains (independent blockchains that connect to the Polkadot relay chain), Polkadot is well-positioned to capture a significant share of the market in the coming years. For those seeking a secure, scalable solution in the blockchain space, Polkadot offers an attractive investment opportunity. It may not have the same immediate hype as newer projects like Qubetics, but its long-term potential is undeniable. Astra: Powering the DeFi Revolution Astra is another exciting project that stands out when considering the best cryptos to invest in today for exponential return potential. Astra’s focus is on decentralized finance (DeFi) and decentralized applications (dApps), offering solutions that are both scalable and secure. The project aims to provide a platform for building and deploying DeFi applications, empowering users to take control of their financial futures. With the rise of decentralized exchanges, lending platforms, and yield farming protocols, Astra is positioning itself as a key player in the rapidly expanding DeFi space. The platform’s tokenomics are designed to reward users for participating in the ecosystem, providing incentives for staking, liquidity provision, and governance. Astra’s use of cutting-edge blockchain technology ensures that it remains competitive in the DeFi market, with a focus on low fees, high scalability, and robust security. As the demand for DeFi services continues to grow, Astra’s innovative platform is primed to meet the needs of the next wave of decentralized finance users. For investors looking to diversify their portfolios and tap into the DeFi trend, Astra represents a solid option. Its focus on utility and long-term growth makes it a promising project in the crypto space. Qubetics x 1inch: A Powerful Collaboration for Seamless Trading Qubetics’ integration with the 1inch Network takes decentralized trading to a whole new level. With this partnership, users can trade across hundreds of DEXs, accessing optimized prices and liquidity without the need for intermediaries. The integration of 1inch’s aggregation technology ensures that users can make efficient trades, maximizing their potential returns. This collaboration is another example of how Qubetics is staying ahead of the curve in the DeFi space. By combining the capabilities of the Qubetics wallet with the 1inch Network, Qubetics is creating an ecosystem where users can trade seamlessly, safely, and efficiently across multiple blockchains. The integration also provides users with access to a vast network of liquidity providers, ensuring that trades are executed at the best available rates. Whether you’re a novice trader or a seasoned DeFi enthusiast, this partnership enhances the trading experience and positions Qubetics as a go-to platform for decentralized finance. Conclusion: Why Qubetics is the Best Crypto to Invest in Today When it comes to the best cryptos to invest in today for exponential return potential , Qubetics ($TICS) is an opportunity that can’t be ignored. With its innovative wallet, powerful partnerships with SWFT Blockchain and 1inch, and its ongoing presale success, Qubetics is positioned to become a leading player in the blockchain and DeFi space. Whether you’re looking for a new way to manage your digital assets or seeking massive ROI on your investments, Qubetics is the project to watch. Don’t miss out on the opportunity to join the Qubetics ecosystem. With a growing user base and a roadmap that promises continued innovation, $TICS is ready to take the world of decentralized finance by storm. Get in now, while the presale stage offers some of the most attractive prices available! For More Information: Qubetics: https://qubetics.com Telegram: https://t.me/qubetics Twitter: https://x.com/qubetics FAQs What makes Qubetics stand out in the crypto market? Qubetics offers a unique non-custodial multi-chain wallet with partnerships like 1inch and SWFT Blockchain, making it a leader in DeFi. How does Polkadot’s interoperability benefit the blockchain ecosystem? Polkadot enables seamless communication between different blockchains, creating a more connected and scalable ecosystem. Why is Astra a top contender for DeFi investors? Astra focuses on decentralized finance and applications, offering scalable and secure solutions for the growing DeFi market. What are the potential returns from investing in Qubetics ($TICS)? Qubetics offers up to 18,480% ROI after the mainnet launch, with its presale currently in stage 22 raising over $13.4 million. How does Qubetics’ partnership with 1inch improve trading for users? The 1inch integration offers optimized trade rates and liquidity, enhancing the trading experience across hundreds of decentralized exchanges. Disclaimer: This is a sponsored press release for informational purposes only. It does not reflect the views of Times Tabloid, nor is it intended to be used as legal, tax, investment, or financial advice. Times Tabloid is not responsible for any financial losses. The post Qubetics’ $13.4M Presale Triumph, Polkadot Poised for Growth, and Astra’s Next Big Leap – Top Cryptos to Invest in Today For Exponential Return Potential appeared first on Times Tabloid .",Finance|News,EN,0,0,DOT|BLOCKCHAIN|1INCH|MARKET|TRADING,"{'name': 'TimesTabloid', 'img': 'https://resources.cryptocompare.com/news/67/default.png', 'lang': 'EN'}",timestabloid,2025-02-20 23:15:30
40609952,http://bitcoinworld.co.in/?p=132182,1740093380,https://resources.cryptocompare.com/news/82/default.png,Exclusive: Kraken’s Ambitious $5 Billion Play to Dominate Crypto Options Market with Deribit Acquisition?,https://bitcoinworld.co.in/kraken-deribit-acquisition-talks/,"Hold onto your hats, crypto enthusiasts! The rumor mill is buzzing, and it’s a big one. Whispers of a potential mega-deal are circulating, suggesting that crypto giant Kraken Exchange might be in serious talks to acquire Deribit, a leading cryptocurrency options exchange. Despite some reports suggesting the deal was off the table, CoinDesk has reported that discussions are still ongoing. Could this be a game-changer for the crypto options market ? Let’s dive into what we know. Is a Kraken – Deribit Deal Really on the Cards? Unveiling the Crypto Exchange Acquisition Buzz The crypto world is no stranger to acquisitions, but a potential merger of this magnitude is noteworthy. According to reports from CoinDesk and Bloomberg, Kraken is indeed engaging with Deribit for a possible acquisition. Deribit, known for its robust crypto options trading platform, is also reportedly working with FT Partners to evaluate bids, with a staggering valuation of $4 billion to $5 billion, or even higher, being floated. Adding fuel to the fire, a second source has indicated that Coinbase Exchange, another major player in the crypto space, has also expressed interest in acquiring Deribit. Imagine the implications! While Kraken and Deribit have remained tight-lipped, declining to comment, and Coinbase has yet to respond, the silence itself speaks volumes. Why is Deribit a Prize Catch in the Crypto Options Market? Deribit has carved a niche for itself as a premier platform for crypto options trading . But what makes it so attractive to giants like Kraken and Coinbase? Here’s a quick rundown: Market Leader in Options: Deribit is arguably the leading exchange for crypto options, commanding a significant share of the market. Acquiring Deribit instantly grants a dominant position in this lucrative segment. Sophisticated Platform: Deribit boasts a sophisticated trading platform with advanced features and a wide array of options contracts, appealing to professional traders and institutions. Institutional Appeal: As institutional interest in crypto derivatives grows, Deribit’s established platform and reputation make it a highly desirable asset for exchanges looking to cater to this burgeoning market segment. High Trading Volume: Deribit consistently demonstrates high trading volumes, indicating strong user engagement and platform utility. Kraken Exchange Eyeing Expansion: What’s the Strategic Rationale Behind a Deribit Acquisition? For Kraken, acquiring Deribit would be a strategic masterstroke, significantly bolstering its position in the competitive crypto exchange landscape. Let’s consider the potential benefits for Kraken Exchange : Benefit Description Instant Options Market Dominance Acquiring Deribit would catapult Kraken into a leading position in the crypto options market overnight, a segment where it currently has a less prominent presence. Diversification of Revenue Streams Options trading generates significant revenue through trading fees. Adding Deribit’s platform would diversify Kraken’s revenue streams beyond spot trading and futures. Attracting Institutional Investors Deribit’s institutional-grade platform would enhance Kraken’s appeal to institutional investors seeking sophisticated crypto derivatives products. Competitive Edge Against Rivals In a fiercely competitive market, acquiring Deribit would give Kraken a significant competitive advantage against rivals like Coinbase and Binance, particularly in the derivatives space. Coinbase Exchange’s Interest: A Battle for Crypto Options Supremacy? The reported interest from Coinbase Exchange adds another layer of intrigue to this potential acquisition saga. Coinbase, known for its user-friendly platform and strong retail base, is also clearly eyeing the lucrative crypto options market. If Coinbase were to enter the bidding, it could trigger a competitive battle, potentially driving up Deribit’s valuation even further. Coinbase’s motivation might stem from a desire to expand its product offerings and capture a larger share of the derivatives market. Acquiring Deribit would provide Coinbase with a ready-made, highly respected options platform, accelerating its entry into this complex but profitable market segment. Challenges and Considerations in a Crypto Exchange Acquisition of This Scale While the potential benefits are substantial, a Deribit acquisition , particularly at a valuation of $4-5 billion, is not without its challenges and considerations: Regulatory Hurdles: Crypto acquisitions are increasingly subject to regulatory scrutiny. Both Kraken and Deribit would need to navigate complex regulatory landscapes to secure approvals for such a deal. Integration Complexities: Integrating two large and complex platforms like Kraken and Deribit would be a significant undertaking, requiring careful planning and execution to ensure a smooth transition and avoid disruptions. Valuation Justification: A $4-5 billion valuation is hefty, even in the crypto world. The acquiring exchange would need to justify this valuation based on projected revenue growth and synergies. Market Volatility: The crypto market is known for its volatility. Market downturns could impact the perceived value of the acquisition and the performance of the combined entity. Actionable Insights: What Does This Mean for Crypto Traders and Investors? For crypto traders and investors, the potential acquisition of Deribit by Kraken (or Coinbase) could have several implications: Expanded Options Trading Access: If Kraken acquires Deribit, users of Kraken may gain access to Deribit’s extensive suite of crypto options products directly through the Kraken platform. Platform Enhancements: Integration of Deribit’s technology could lead to enhanced options trading features and functionalities on the acquiring exchange’s platform. Increased Market Liquidity: A combined entity could potentially lead to increased liquidity in the crypto options market, benefiting traders with tighter spreads and better execution. Potential for New Products: The acquisition could pave the way for the development of innovative new crypto derivatives products and services. The Future of Crypto Options Trading: A Bold Move or a Risky Bet? The potential crypto exchange acquisition of Deribit by Kraken, or the interest from Coinbase, signals a significant maturation of the crypto market and a growing focus on derivatives, particularly options. Whether this deal materializes remains to be seen, but the very fact that these discussions are taking place underscores the immense value and potential of the crypto options market. A successful acquisition could reshape the competitive landscape and further propel the growth of crypto derivatives trading. Keep a close watch on this developing story – it could be a pivotal moment for the future of crypto trading. To learn more about the latest crypto market trends, explore our article on key developments shaping Bitcoin price action.",Crypto News|Acquisition|COINBASE|Crypto exchange|Deribit|KRAKEN,EN,0,0,EXCHANGE|MARKET|TRADING|BUSINESS|BNB,"{'name': 'Bitcoin World', 'img': 'https://resources.cryptocompare.com/news/82/default.png', 'lang': 'EN'}",bitcoinworld,2025-02-20 23:16:20
40610007,https://coinpedia.org/?p=422639,1740093400,https://images.cryptocompare.com/news/default/coinpedia.png,"FET Bullish Divergence Hints at 45% Surge, Buy Signal?",https://coinpedia.org/news/fet-bullish-divergence-hints-at-45-surge-buy-signal/,"The post FET Bullish Divergence Hints at 45% Surge, Buy Signal? appeared first on Coinpedia Fintech News After witnessing a 65% price drop over the past two months, the Artificial Superintelligence Alliance (FET) appears ready for takeoff, supported by bullish price action on both weekly and daily time frames. With an ongoing price recovery, FET tokens are gaining significant attention from traders and investors, which could help the asset rebound soon. Current Price Momentum Today, February 21, 2025, FET is trading near $0.778 after surging over 9.50% in the past 24 hours. During the same period, its trading volume increased by 17%, indicating growing interest from investors and traders compared to the previous day. FET Technical Analysis and Upcoming Levels According to CoinPedia’s technical analysis, FET appears bullish and is poised for significant upside momentum, as its technical indicators are flashing a bullish divergence on the weekly time frame. Additionally, FET seems to be forming a bullish double-bottom price action pattern and is currently on the verge of completing its second upward leg. Source: Trading View Based on historical patterns, if the asset holds above the $0.70 level, there is a strong possibility it could surge by 45% to reach $1.10 in the coming days and by 165% overall to reclaim the $2.05 level, which FET lost in December 2024. Investors Bearish Outlook Despite bullish momentum, some investors are offloading FET, as reported by the on-chain analytics firm Coinglass . Data reveals that exchanges have witnessed an outflow of approximately $1.50 million worth of FET tokens, suggesting that some holders have sold off their positions. Source; Coinglass Major Liquidation Levels Meanwhile, traders betting on the long side are currently dominating the asset. At press time, the over-leveraged levels are $0.731 on the lower side and $0.785 on the upper side, where traders have built millions worth of long and short positions. Data shows that traders hold $1.03 million worth of long positions at the $0.731 level and $270,000 at the $0.785 level. When combining these on-chain metrics, it appears that some traders are taking advantage of the current market sentiment, while others, driven by fear, are dumping the asset.",News|Crypto news|Price Analysis,EN,0,0,TRADING|FET|BUSINESS|MARKET,"{'name': 'coinpedia', 'img': 'https://images.cryptocompare.com/news/default/coinpedia.png', 'lang': 'EN'}",coinpedia,2025-02-20 23:16:40
40610031,https://en.coinotag.com/potential-signals-for-spot-solana-etf-approval-under-regulatory-review/,1740093457,https://resources.cryptocompare.com/news/77/default.png,Potential Signals for Spot Solana ETF Approval Under Regulatory Review,https://en.coinotag.com/potential-signals-for-spot-solana-etf-approval-under-regulatory-review/,"The potential approval of spot Solana ETFs is creating ripples in the cryptocurrency market, as industry leaders keep a close watch on regulatory developments. Current forecasts indicate a promising trajectory",News,EN,0,0,SOL|MARKET,"{'name': 'CoinOtag', 'img': 'https://resources.cryptocompare.com/news/77/default.png', 'lang': 'EN'}",coinotag,2025-02-20 23:17:37
