id,guid,published_on,imageurl,title,url,body,tags,lang,upvotes,downvotes,categories,source_info,source,date
40611423,http://bitcoinworld.co.in/?p=132349,1740094588,https://resources.cryptocompare.com/news/82/default.png,SEC Fights Crypto Fraud: Launches Cyber Unit to Safeguard Digital Assets,https://bitcoinworld.co.in/sec-fights-crypto-fraud/,"Are you concerned about the rising tide of scams and illicit activities in the crypto world? You’re not alone. As the digital asset landscape expands, so do the opportunities for fraudsters. But there’s good news! The U.S. Securities and Exchange Commission (SEC) is taking decisive action to protect investors like you. Let’s dive into how the SEC is stepping up its game to combat crypto fraud and secure the future of digital finance. Why is the SEC Focusing on Cybersecurity and Crypto Fraud Now? The world of cryptocurrencies and digital assets is exciting and innovative, but it’s also a relatively new frontier. This newness, combined with the rapid pace of technological advancements, creates an environment ripe for exploitation. Think about it – millions are pouring into digital assets , yet the regulatory frameworks are still catching up. This gap is where bad actors thrive, leading to a surge in various forms of crypto fraud , from Ponzi schemes disguised as DeFi platforms to sophisticated hacks draining millions from unsuspecting investors. Recognizing this escalating threat, the SEC has proactively established the Cyber and Emerging Technologies Unit (CETU). This isn’t just a name change or a reshuffling of desks; it’s a clear signal that the SEC is prioritizing the fight against cybersecurity threats and illicit activities in the digital realm. This dedicated unit signifies a ramped-up effort to ensure that as the crypto market evolves, investor protection remains paramount. What Exactly is the Cyber and Emerging Technologies Unit (CETU)? Imagine CETU as the SEC’s specialized force, equipped with the expertise and resources to tackle the unique challenges of the digital age. According to the SEC’s official announcement, CETU’s mission is crystal clear: to strengthen enforcement against cyber-related misconduct and protect investors in rapidly evolving digital markets. Here’s a breakdown of what CETU will be focusing on: Combating Crypto Fraud: At the forefront of CETU’s agenda is tackling the growing menace of crypto fraud . This includes investigating and prosecuting fraudulent schemes involving cryptocurrencies, NFTs, and other digital assets. Enhancing Cybersecurity: Protecting market participants from cybersecurity threats is crucial. CETU will focus on enforcing regulations related to data breaches, hacking, and other cyber-related misconduct that can harm investors. Addressing Emerging Tech Risks: Beyond crypto, CETU will also monitor and address risks associated with other emerging technologies that fall under the SEC’s purview. This forward-looking approach ensures the SEC remains agile in the face of technological innovation. Investor Protection in Digital Markets: Ultimately, CETU’s core objective is to safeguard investor protection . This means creating a safer and more transparent environment for individuals and institutions participating in digital asset markets. How Will CETU Enhance Investor Protection in the Digital Asset Space? The establishment of CETU is more than just a symbolic gesture. It represents a strategic shift towards proactive and specialized enforcement in the digital asset sector. But how exactly will this translate into better investor protection ? Let’s consider the tangible benefits: Benefit Description Specialized Expertise CETU comprises experts with deep knowledge of cybersecurity, blockchain technology, and digital assets. This specialized skill set allows for more effective investigation and prosecution of complex crypto fraud cases. Proactive Enforcement CETU’s proactive approach means the SEC isn’t just reacting to incidents but actively seeking out and disrupting potential fraudulent activities before they cause widespread harm. This includes monitoring market trends and identifying emerging threats. Deterrent Effect A dedicated unit sends a strong message to would-be fraudsters: the SEC is serious about cracking down on crypto fraud . This deterrent effect can help reduce the overall incidence of illicit activities in the digital asset space. Faster Response Times With a focused unit in place, the SEC can respond more quickly and efficiently to reported incidents of cybersecurity breaches and fraudulent schemes, minimizing potential losses for investors. Examples of Crypto Fraud CETU Might Target To understand the scope of CETU’s mission, let’s look at some examples of crypto fraud that the unit is likely to target: Pump-and-Dump Schemes: These schemes involve artificially inflating the price of a digital asset through misleading positive statements, then selling off holdings at the inflated price, leaving other investors with losses. Rug Pulls: Common in the DeFi space, rug pulls involve developers abandoning a project after raising significant funds, often taking investor money with them. Phishing and Hacking Attacks: Cybercriminals use sophisticated phishing techniques and hacking methods to steal cryptocurrency and personal information from investors. Unregistered Securities Offerings: Many crypto projects involve the offering of digital tokens that may be classified as securities. CETU will target unregistered offerings and sales, ensuring compliance with securities laws. Fraudulent Investment Schemes: Ponzi and pyramid schemes disguised as high-yield crypto investment opportunities are a persistent threat. CETU will work to dismantle these fraudulent operations and hold perpetrators accountable. Challenges CETU Might Face in Combating Digital Asset Fraud While the establishment of CETU is a positive step, it’s important to acknowledge the challenges the unit will face in its mission to combat cybersecurity threats and crypto fraud : Rapidly Evolving Technology: The crypto and digital asset space is constantly evolving. New technologies and platforms emerge quickly, requiring CETU to stay ahead of the curve and adapt its strategies continuously. Global and Decentralized Nature of Crypto: Cryptocurrencies operate globally and often in a decentralized manner, making it challenging to track illicit activities and enforce regulations across borders. Complexity of Digital Asset Transactions: Understanding the intricacies of blockchain technology and digital asset transactions requires specialized expertise, which CETU will need to continually develop and maintain. Resource Constraints: Effectively policing the vast and rapidly growing digital asset market requires significant resources. CETU will need adequate funding and personnel to fulfill its mandate effectively. Balancing Innovation and Regulation: The SEC must strike a delicate balance between fostering innovation in the digital asset space and implementing regulations to protect investors. Overly stringent regulations could stifle innovation, while lax oversight could expose investors to undue risks. Actionable Insights for Crypto Investors in Light of CETU So, what does the launch of CETU mean for you as a crypto investor? Here are some actionable insights to keep in mind: Increased Scrutiny: Expect increased scrutiny and enforcement actions from the SEC in the digital asset space. This is a positive development for investor protection , as it signals a commitment to cleaning up the market. Due Diligence is Key: Even with enhanced SEC oversight, thorough due diligence remains crucial. Always research crypto projects and platforms before investing. Understand the risks involved and never invest more than you can afford to lose. Be Wary of Unrealistic Promises: If an investment opportunity sounds too good to be true, it probably is. Be skeptical of projects promising guaranteed high returns, especially in the volatile crypto market. Stay Informed: Keep yourself updated on regulatory developments and enforcement actions in the crypto space. Follow reputable news sources and the SEC’s official announcements to stay informed about cybersecurity and crypto fraud trends. Report Suspicious Activity: If you encounter suspicious activity or potential crypto fraud , report it to the SEC or other relevant authorities. Your vigilance can help protect yourself and other investors. Conclusion: A Stronger Shield for Digital Assets The establishment of the SEC’s Cyber and Emerging Technologies Unit is a significant and welcome development for the cryptocurrency and digital assets industry. It demonstrates a clear commitment to tackling crypto fraud and enhancing cybersecurity in this rapidly evolving space. While challenges remain, CETU represents a powerful step forward in ensuring greater investor protection and fostering a more secure and trustworthy environment for the future of digital finance. This proactive approach by the SEC provides a stronger shield, offering hope and confidence to those navigating the exciting yet sometimes treacherous waters of the crypto world. To learn more about the latest crypto market trends, explore our article on key developments shaping Bitcoin price action.",Crypto News|#Cybersecurity|CRYPTOCURRENCY|fraud|Regulation|SEC,EN,0,0,REGULATION|BUSINESS|MARKET|TECHNOLOGY|TRADING,"{'name': 'Bitcoin World', 'img': 'https://resources.cryptocompare.com/news/82/default.png', 'lang': 'EN'}",bitcoinworld,2025-02-20 23:36:28
40611483,http://bitcoinworld.co.in/?p=132351,1740094662,https://resources.cryptocompare.com/news/82/default.png,Revolutionary AR.IO Mainnet Launch: Ushering in a New Era of Decentralized Storage,https://bitcoinworld.co.in/ario-mainnet-launch-decentralized-storage/,"The decentralized web is constantly evolving, and a significant milestone has just been achieved. AR.IO, a groundbreaking network built on the Arweave blockchain, has officially launched its mainnet alongside its highly anticipated Token Generation Event (TGE). This launch marks a pivotal moment for the project, which has been diligently working towards providing permanent and censorship-resistant cloud storage solutions. Are you ready to witness a potential game-changer in the world of data management and Web3 infrastructure? Let’s dive into the details of this exciting development and explore what it means for the future of decentralized technology. What is AR.IO and Why is the Mainnet Launch Significant? At its core, AR.IO is designed to be a decentralized network built on top of the Arweave protocol. Arweave itself is known for its ‘permaweb’ capabilities, offering permanent and immutable data storage. AR.IO leverages this foundation to build a comprehensive ecosystem focused on decentralized web hosting and storage solutions. Think of it as a decentralized alternative to centralized giants like Google Cloud and Amazon Web Services (AWS), but with the added benefits of blockchain technology – security, transparency, and censorship resistance. The mainnet launch is a critical step for any blockchain project. It signifies the transition from a development phase to a fully operational network, open for public use. For AR.IO, this mainnet launch means that its core functionalities are now live and accessible, paving the way for broader adoption and real-world applications. This also coincides with their Token Generation Event (TGE), introducing the ARIO token into the ecosystem, which we will explore further. Key Highlights of AR.IO’s Mainnet Launch: Official Mainnet Go-Live: AR.IO’s network is now live and operational, ready for users and developers. Token Generation Event (TGE): The ARIO token has been launched, marking the start of its utility within the AR.IO ecosystem. ArDrive Integration: AR.IO’s flagship application, ArDrive, a decentralized storage solution, is a core component of the launched mainnet. Alternative to Centralized Cloud: AR.IO positions itself as a viable decentralized alternative to traditional cloud storage providers. Delving into Decentralized Storage: How Does AR.IO on Arweave Stand Out? The concept of decentralized storage is gaining traction as users and businesses seek greater control and security over their data. Traditional cloud storage solutions, while convenient, are centralized, making them vulnerable to single points of failure, censorship, and data breaches. Decentralized storage networks, like AR.IO built on Arweave, address these concerns by distributing data across a network of nodes, ensuring redundancy and resilience. Arweave ‘s unique ‘blockweave’ technology plays a crucial role here. Unlike traditional blockchains, Arweave focuses on permanent data storage, offering a ‘pay-once, store-forever’ model. This is achieved through a novel economic model and data structure that incentivizes nodes to permanently store data. AR.IO builds upon this foundation, creating a user-friendly and application-rich ecosystem for leveraging Arweave’s capabilities. Benefits of AR.IO’s Decentralized Storage Solution: Permanence: Data stored on AR.IO, leveraging Arweave, is designed to be permanently stored, ensuring long-term accessibility. Censorship Resistance: Decentralization makes it significantly harder for any single entity to censor or remove data. Enhanced Security: Distributed data storage reduces the risk of data breaches associated with centralized servers. Data Ownership: Users retain greater control and ownership over their data compared to centralized services. Transparency: Blockchain technology provides transparency and auditability to the storage process. The ARIO Token: Powering the AR.IO Ecosystem The launch of the ARIO token is integral to the AR.IO ecosystem. Tokens are the lifeblood of many decentralized networks, serving various functions such as governance, utility, and incentivization. Understanding the ARIO token and its distribution is key to grasping the long-term vision of the project. According to reports, the ARIO token has a fixed total supply of 1 billion tokens. The distribution is strategically planned to support various aspects of the network’s growth and sustainability. Let’s break down the allocation: ARIO Token Allocation Breakdown: Allocation Category Percentage Core Team and Advisors 17.08% Early Development and Infrastructure 20.29% Community and Developers 17.5% Partnerships 28.63% Other (Unspecified) Balance This token distribution strategy highlights AR.IO’s commitment to long-term development, community growth, and strategic partnerships. Allocating a significant portion to the community and developers suggests a focus on fostering a vibrant and engaged ecosystem. The partnerships allocation indicates a proactive approach to expanding the reach and utility of AR.IO across different sectors. ArDrive: Your Gateway to Decentralized Permanent Storage ArDrive is presented as AR.IO’s core application, designed to make decentralized permanent storage accessible and user-friendly. It acts as a practical interface for interacting with the Arweave network and benefiting from its permanent storage capabilities. Think of ArDrive as a decentralized file storage and sharing platform, similar to Dropbox or Google Drive, but built on the principles of decentralization and permanence. By using ArDrive, users can store their files, documents, and other data on the Arweave network, ensuring that it remains accessible and tamper-proof for the long term. This is particularly valuable for individuals and organizations that require reliable, censorship-resistant, and permanent data storage solutions. ArDrive Key Features: User-Friendly Interface: Designed for ease of use, making decentralized storage accessible to a wider audience. Permanent Storage: Leverages Arweave’s technology to provide permanent and immutable data storage. Decentralized Control: Users maintain control over their data, without reliance on centralized intermediaries. Secure and Private: Benefits from the security and privacy features inherent in blockchain technology. Potential Use Cases: Ideal for archiving important documents, storing creative content, preserving historical records, and more. Challenges and the Road Ahead for AR.IO While the mainnet launch and TGE are significant achievements, AR.IO, like any emerging technology, faces challenges. The challenges in the decentralized storage space include competition from established centralized providers, user adoption hurdles, and the need for continuous technological development and innovation. Scaling decentralized networks to handle the demands of mainstream adoption is also a crucial area of focus. AR.IO will need to demonstrate its ability to scale effectively and efficiently to compete with existing cloud storage solutions. Furthermore, educating users about the benefits of decentralized storage and overcoming the learning curve associated with new technologies will be essential for broader adoption. Potential Challenges for AR.IO: Competition: Facing established centralized cloud storage giants like AWS and Google Cloud. User Adoption: Overcoming the learning curve and encouraging mainstream adoption of decentralized storage. Scalability: Ensuring the network can scale to handle increasing user demand and data volume. Regulatory Landscape: Navigating the evolving regulatory environment for cryptocurrencies and decentralized technologies. Ecosystem Growth: Building a thriving ecosystem of applications and services around AR.IO. Actionable Insights: What Does AR.IO’s Launch Mean for You? For individuals and businesses seeking alternative storage solutions, AR.IO’s mainnet launch presents a compelling option. The promise of permanent and censorship-resistant storage, powered by Arweave and made accessible through ArDrive, is attractive for various use cases. Here are some actionable insights to consider: Actionable Steps and Considerations: Explore ArDrive: Test out ArDrive to experience decentralized permanent storage firsthand. Research ARIO Token: Understand the utility and potential of the ARIO token within the ecosystem. Consider Use Cases: Identify potential applications of AR.IO for your personal or business data storage needs. Stay Updated: Follow AR.IO’s development and community updates to stay informed about future developments. Evaluate Decentralization: Assess the benefits of decentralized storage in relation to your data security and control requirements. Conclusion: A Bold Step Towards a Decentralized Future AR.IO’s mainnet launch and TGE are more than just another crypto project milestone; they represent a significant stride towards a more decentralized and resilient internet infrastructure. By leveraging the power of Arweave and offering user-friendly applications like ArDrive, AR.IO is poised to make decentralized storage a viable and compelling alternative to centralized solutions. The journey ahead will undoubtedly have its challenges, but the potential for AR.IO to reshape how we store and manage data in the digital age is undeniable. This launch ignites hope for a future where data is more secure, censorship-resistant, and permanently accessible, truly putting the power back into the hands of users. To learn more about the latest decentralized storage trends, explore our article on key developments shaping decentralized storage solutions and their impact on Web3 innovation.",Crypto News|Arweave|BLOCKCHAIN|Crypto news|Decentralized Cloud|Web3,EN,0,0,AR|BLOCKCHAIN|TECHNOLOGY|BUSINESS|RESEARCH,"{'name': 'Bitcoin World', 'img': 'https://resources.cryptocompare.com/news/82/default.png', 'lang': 'EN'}",bitcoinworld,2025-02-20 23:37:42
40611853,https://decrypt.co/?p=307115,1740094862,https://resources.cryptocompare.com/news/44/40611853.jpeg,'Illuvium' Ethereum Game Studio Undergoes Restructuring Amid 'Rebuild',https://decrypt.co/307115/illuvium-ethereum-game-studio-restructuring,"After releasing three titles last year, the studio behind the Illuvium game franchise has restructured to extend its runway.",|Gaming,EN,0,0,ETH,"{'name': 'Decrypt', 'img': 'https://images.cryptocompare.com/news/default/decrypt.png', 'lang': 'EN'}",decrypt,2025-02-20 23:41:02
40612255,https://en.coinotag.com/breakingnews/canary-litecoin-spot-etf-listed-on-dtcc-what-this-means-for-investors/,1740095306,https://resources.cryptocompare.com/news/77/40612255.jpeg,Canary Litecoin Spot ETF Listed on DTCC: What This Means for Investors,https://en.coinotag.com/breakingnews/canary-litecoin-spot-etf-listed-on-dtcc-what-this-means-for-investors/,"According to COINOTAG News on February 21st, the Canary Litecoin Spot ETF has been officially listed on the DTCC website under the code LTCC. The entry in the Creation/Redemption column",LTC,EN,0,0,LTC|BUSINESS,"{'name': 'CoinOtag', 'img': 'https://resources.cryptocompare.com/news/77/default.png', 'lang': 'EN'}",coinotag,2025-02-20 23:48:26
40612319,https://en.coinotag.com/breakingnews/elon-musk-adds-doge-father-to-his-x-profile-photo-caption/,1740095373,https://resources.cryptocompare.com/news/77/40612319.jpeg,Elon Musk Adds “DOGE FATHER” to His X Profile Photo Caption,https://en.coinotag.com/breakingnews/elon-musk-adds-doge-father-to-his-x-profile-photo-caption/,Elon Musk Adds “DOGE FATHER” to His X Profile Photo Caption,,EN,0,0,DOGE,"{'name': 'CoinOtag', 'img': 'https://resources.cryptocompare.com/news/77/default.png', 'lang': 'EN'}",coinotag,2025-02-20 23:49:33
