id,guid,published_on,imageurl,title,url,body,tags,lang,upvotes,downvotes,categories,source_info,source,date
40620065,https://www.cryptopolitan.com/?p=678164,1740103200,https://resources.cryptocompare.com/news/43/40620065.jpeg,Cardano’s ADA Grows Stronger as $0.01 Token Prepares to Flip Solana (SOL),https://www.cryptopolitan.com/cardanos-ada-grows-stronger-as-0-01-token-prepares-to-flip-solana-sol/,"As Cardano (ADA) edges closer to a potential bullish breakout fueled by its partnership with tech giant Globant, a new player is capturing attention in the crypto market. Mutuum Finance (MUTM), currently priced at $0.01 during the opening phase of its presale, is rapidly gaining momentum as investors shift focus toward high-growth opportunities. With over 75% of its initial presale stage already sold and $831,568.80 raised in a matter of days, Mutuum Finance (MUTM) is positioning itself not just as a competitor but as a potential disruptor aiming to outpace established tokens like Solana (SOL). Mutuum Finance Presale Rises Mutuum Finance (MUTM) has sparked intense interest since launching the first phase of its presale, attracting 1,500 holders in days. Priced at $0.01, the token offers a rare entry point for investors seeking exponential gains. Early participants stand to realize a guaranteed 600% return once MUTM hits its launch price of $0.06, a figure already locked in by the project’s structured presale model. Beyond this immediate upside, analysts tracking the project’s roadmap are forecasting a surge to $1 in 2025, translating to a 100x gain from current levels. The presale’s rapid progress, driven by Mutuum Finance (MUTM)’s unique value proposition, highlights a growing appetite for decentralized finance (DeFi) platforms that merge utility with investor incentives. As Cardano (ADA) and Solana (SOL) grapple with incremental growth, Mutuum Finance (MUTM) is carving a niche as a low-cost, high-reward alternative. To fuel presale participation, Mutuum Finance (MUTM) is running a $100,000 giveaway, distributing prizes across 10 lucky holders. The campaign, detailed on the project’s official channels, underscores its community-driven ethos. A Dual-Market Lending Ecosystem Central to Mutuum Finance (MUTM)’s appeal is its decentralized lending protocol, which enables peer-to-contract (P2C) and peer-to-peer (P2P) transactions. The P2C model allows users to deposit assets like USDT into liquidity pools, earning passive income through adjustable interest rates tied to market demand. Borrowers, meanwhile, can leverage crypto holdings such as Ethereum (ETH) as collateral to secure loans without liquidating their positions, a feature that maintains portfolio exposure while unlocking liquidity. The P2P marketplace further diversifies opportunities by enabling direct negotiations between users, bypassing traditional liquidity pools. Every transaction operates under audited smart contracts, ensuring security and transparency. This dual approach not only broadens accessibility but also drives consistent platform engagement, a critical factor for sustaining MUTM’s long-term value. Price Stability Through Strategic Mechanisms Mutuum Finance (MUTM) is tackling one of DeFi’s persistent challenges, volatility, through an innovative buy-and-distribute system. A portion of platform fees will automatically purchase MUTM tokens from the open market, redistributing them to stakers. This mechanism creates recurring demand for the token, effectively cushioning against price dips and fostering gradual appreciation. Combined with plans to launch an overcollateralized stablecoin, Mutuum Finance (MUTM) is building an ecosystem designed for both stability and growth. Adding to the momentum, Mutuum Finance (MUTM) has announced a beta version of its platform will go live alongside its exchange debut. This strategic move ensures immediate utility upon launch, a contrast to projects that delay product rollouts. Users can start lending, borrowing, and staking from day one, accelerating adoption and liquidity. Such operational readiness is resonating with investors who prioritize tangible use cases over speculative hype. As Cardano (ADA) eyes $1 on the back of institutional interest and Solana (SOL) battles network congestion, Mutuum Finance (MUTM) offers a fresh narrative: a DeFi project built for rapid scaling, backed by mechanisms that prioritize investor returns. Early movers today could secure not just short-term gains but a stake in a platform poised to redefine decentralized lending. The crypto market is no stranger to breakout stars, but few combine Mutuum Finance (MUTM)’s affordability, utility, and growth potential. With Phase 1 selling out faster than anticipated and analysts aligning around a $1 target, now’s the best time to get involved. For more information about Mutuum Finance (MUTM) visit the links below: Website: https://www.mutuum.finance/ Linktree: https://linktr.ee/mutuumfinance",Press Release,EN,0,0,ADA|SOL|BUSINESS|MARKET|TRADING,"{'name': 'Cryptopolitan', 'img': 'https://images.cryptocompare.com/news/default/cryptopolitan.png', 'lang': 'EN'}",cryptopolitan,2025-02-21 02:00:00
40619983,https://thecoinrise.com/web3bays-zero-fee-marketplace-vs-amazon-is-this-the-next-big-thing-in-e-commerce/,1740103213,https://resources.cryptocompare.com/news/60/40619983.jpeg,Web3Bay’s Zero-Fee Marketplace vs. Amazon: Is This the Next Big Thing in E-Commerce?,https://thecoinrise.com/web3bays-zero-fee-marketplace-vs-amazon-is-this-the-next-big-thing-in-e-commerce/,"Web3Bay is quickly becoming a major player in blockchain-based online shopping. Its presale success has shown strong interest from buyers, raising over $1.4 million as of February 14, 2025, with 360 million 3BAY tokens already sold. The presale is in Stage 4, with each token priced at $0.004562625. Analysts expect a strong rise in value, with the launch price projected at $0.1959, potentially giving early buyers a 4,000% increase. Unlike traditional e-commerce platforms that charge high fees and rely on middlemen, Web3Bay offers a different approach. It allows direct buying and selling through smart contracts, making transactions safer and more transparent. This system reduces fraud risks and attracts both crypto users and businesses looking for a fairer online marketplace. The global online shopping industry is expected to go beyond $8 trillion by 2027, and blockchain technology is improving transaction security and efficiency. While platforms like Amazon and eBay dominate, they lack decentralization, making Web3Bay’s model stand out. More businesses are now looking for lower fees and easier global payments through digital currencies, boosting demand for decentralized marketplaces. Web3Bay’s 2025 Plans for Growth As Web3Bay’s presale continues, the team is preparing for key updates that will help the platform expand and gain more users. Below are the major steps planned for 2025. Q1 2025 – Adding DeFi Features & Smart Contracts Web3Bay will introduce DeFi features, enabling users to lend, borrow, and stake assets on the platform. Automated smart contracts will improve payment security, ensuring transactions go through without middlemen. New partnerships with online businesses and blockchain firms will help Web3Bay grow faster. Q2 2025 – Staking Rewards & Market Expansion Users holding 3BAY tokens will be able to earn rewards by staking them. More uses for the 3BAY token will be introduced within the marketplace, leading to higher demand and price steadiness. Collaboration with blockchain companies to improve cross-chain support. Q3 2025 – Moving to Community Governance Web3Bay will introduce a Decentralized Autonomous Organization (DAO), allowing the community to take part in decision-making. Token holders will have voting rights on key platform changes, security updates, and future features. This shift ensures long-term decentralization and user-driven growth. Q4 2025 – NFT Marketplace & Full Launch Web3Bay will launch its NFT marketplace, where users can buy, sell, and trade digital collectibles. Final security checks and the full launch of the online marketplace. Expansion into cross-border trade, making global transactions smooth and efficient. What’s Ahead for Web3Bay Users? With a clear strategy and strong presale backing, Web3Bay is in a good position to bring blockchain and online shopping together. Here’s why buyers and users should follow Web3Bay’s journey: Strong Growth Possibility: Early 3BAY holders could see major returns as demand increases after launch. Useful Features: Unlike projects based only on speculation, Web3Bay’s platform is designed for real-world use, making it more sustainable. Secure & Transparent Transactions: Removing middlemen leads to lower costs, better privacy, and safer payments. Community-Driven Future: With DAO governance, users can directly influence platform updates and policies. Summing Up! Web3Bay’s 2025 plan provides a clear path toward becoming a fully decentralized shopping platform . With DeFi features, staking rewards, community governance, and NFT trading on the way, Web3Bay is setting the stage for broad adoption. Those interested in a new way of online shopping powered by blockchain should keep an eye on Web3Bay in the months ahead. Join Web3Bay Presale Now: Presale: https://web3bay.io/buy Website: https://web3bay.io/ Twitter: https://x.com/web3bayofficial Instagram: https://www.instagram.com/web3bayofficial/ The post Web3Bay’s Zero-Fee Marketplace vs. Amazon: Is This the Next Big Thing in E-Commerce? appeared first on TheCoinrise.com .",Token Presale and ICO Insights|Web3Bay,EN,0,0,BLOCKCHAIN|TRADING|MARKET|TECHNOLOGY,"{'name': 'The Coin Rise', 'img': 'https://images.cryptocompare.com/news/default/thecoinrise.png', 'lang': 'EN'}",thecoinrise,2025-02-21 02:00:13
40619923,https://bitcoinworld.co.in/?p=132384,1740103231,https://resources.cryptocompare.com/news/82/default.png,Why RCO Finance’s Token Presale Stands as the Best Altcoin to Buy in 2025,https://bitcoinworld.co.in/why-rco-finances-token-presale-stands-as-the-best-altcoin-to-buy-in-2025/,"RCO Finance is making waves with its token presale. Many investors now call it the best altcoin to buy in 2025. Its advanced trading tools and AI-driven platform give traders a major advantage. As demand rises, early buyers could see huge gains. The crypto world is watching closely. Could this be the biggest opportunity of the year? RCO Finance’s Robo Advisor Is Changing the Paradigm in Crypto Trading with Smart, Personalized Features Unlike generic tools, it acts like a personal assistant, adapting to individual goals. This approach creates a unique bond between traders and their AI-powered guide. The robo advisor focuses on significant cryptocurrencies, providing suggestions that align with a trader’s habits. It studies their patterns and goals, recommending the best times to buy or sell. This level of personalization helps users make better decisions without second-guessing. Risk management is another standout feature. The robo advisor analyzes past data and real-time trends to identify potential losses. Flagging risks early helps traders avoid costly mistakes and stay calm under pressure. The system doesn’t just give advice; it provides data-driven insights to guide each move. Whether it’s a time to act or hold steady, the robo advisor simplifies tough calls for traders of all experience levels. Learning from user behavior and market changes, the tool continuously evolves. This keeps its recommendations relevant, even as conditions shift. Traders gain confidence knowing they have an adaptable ally on their side. As markets fluctuate, the robo advisor offers real-time updates, helping traders stay ahead. Its combination of intelligence and reliability makes it an essential companion in today’s trading world. RCO Finance’s Platform Goes Beyond the Robo Advisor, Here’s More RCO Finance has created an AI-powered robo advisor to help crypto traders make smarter, data-driven choices. This tool is just part of the platform’s user-friendly features, attracting beginners and seasoned investors looking for a better trading experience. One standout feature of RCO Finance is its “non-KYC” policy, allowing users to trade without identity verification. By prioritizing privacy, the platform reflects DeFi’s core values, even as others lean toward stricter verification. RCO Finance also breaks down barriers for traders worldwide. Users in England, China, and other countries can trade in major markets, including the U.S. This global accessibility highlights the platform’s commitment to inclusivity. Beyond crypto, RCO Finance offers a range of over 120,000 assets. From stocks to Forex pairs, traders can diversify their portfolios and explore opportunities outside of the crypto market. Liquidity providers also benefit. They earn rewards by staking altcoins to support smooth token swaps while helping traders enjoy efficient transactions. RCO Finance blends privacy, variety, and innovation for a smooth trading experience. The platform also ensures security of users’ funds through its SolidProof-audited smart contracts . With these audits, users can use the platform without being bothered about any vulnerabilities or hacks. You can now test RCO Finance’s Beta Platform and explore its tools. With its cutting-edge AI and user-focused design, RCO Finance empowers traders to succeed in decentralized finance. Don’t miss the chance to take control of your financial journey. Join Crypto Experts And Make 30,000% in the Best Altcoin to buy! RCO Finance is currently conducting a token presale for its native token, RCOF, which is regarded as the best altcoin to buy. In this token presale, RCOF is priced at $0.1 . This price is set to rise to $0.13 in the next Stage. Eventually, the token presale will be a precursor to what experts say will be a 30,000% rally for the best altcoin to buy in the coming weeks. Token presale analysts say this analysis and forecast are due to the project’s appealing crypto AI offerings. Additionally, the presale includes tier-based rewards, allowing investors to earn higher dividends based on their holdings. This structure incentivizes early participants to accumulate more RCOF tokens and enjoy more significant returns. If you’re a crypto trader, join the RCOF token presale to earn up to 300x returns in the best altcoin to buy today! Go to the RCO Finance website and connect your wallet to set yourself on the journey to riches. For more information about the RCO Finance Presale: Visit RCO Finance Presale Join The RCO Finance Community",Crypto News|Press Release|best altcoin to buy|RCO Finance|Token presale,EN,0,0,ALTCOIN|TRADING|MARKET|BUSINESS|ZRX,"{'name': 'Bitcoin World', 'img': 'https://resources.cryptocompare.com/news/82/default.png', 'lang': 'EN'}",bitcoinworld,2025-02-21 02:00:31
40619883,https://ambcrypto.com/?p=468985,1740103238,https://images.cryptocompare.com/news/default/ambcrypto.png,Ethereum: Can bulls help ETH break THIS price for a 23% rally,https://ambcrypto.com/ethereum-can-buyers-help-eth-break-this-price-for-a-23-rally/,Ethereum shows clear signs of a potential market move to the upside.,Ethereum|News|News 1|Social|Trading View,EN,0,0,ETH|TRADING|MARKET,"{'name': 'AMB Crypto', 'img': 'https://images.cryptocompare.com/news/default/ambcrypto.png', 'lang': 'EN'}",ambcrypto,2025-02-21 02:00:38
40619929,https://www.newsbtc.com/?p=700234,1740103250,https://resources.cryptocompare.com/news/21/40619929.jpeg,"Bitcoin Price To $150,000: Why The USDT Dominance Plays An Important Role",https://www.newsbtc.com/news/bitcoin/bitcoin-price-to-150000/,"Bitcoin has extended its consolidation below $100,000 since the beginning of February. This price lag has been compounded by a slowdown in bullish sentiment among investors and a slowing euphoria regarding the crypto-positive influences of Trump’s new administration in the US. Despite this rally slowdown, technical analysis continues to support a bullish long-term outlook for Bitcoin. The current stagnation appears to be a re-accumulation phase for bullish investors; a pattern observed multiple times before major upward moves this cycle. Furthermore, analysis shows that the USDT dominance is going to play a crucial role in triggering the next Bitcoin rally toward $150,000. Bitcoin’s Re-Accumulation Phase And The Role Of USDT Dominance According to a technical analyst (TradingShot) on the TradingView platform, Bitcoin is currently exhibiting an interesting accumulation trend alongside the USDT dominance. The USDT dominance reflects the percentage of the total crypto market capitalization in USDT, indicating whether traders favor stablecoins over riskier crypto assets. A high USDT dominance typically signals low buying pressure in cryptocurrencies. Conversely, a declining USDT dominance often suggests that traders are rotating funds back into Bitcoin and other cryptocurrencies. Related Reading: Bitcoin Weekly PPO Turns Red At $102,000, What It Means For The Bull Market Interestingly, the USDT dominance has had a crucial simultaneous occurrence with Bitcoin’s preparations for rallies this cycle. Two notable re-accumulation periods have occurred after Bitcoin bottomed in November 2022, with each leading to significant price rallies. The first accumulation period spanned from January 2023 to March 2023, while the second occurred between November 2023 and February 2024. Both of these re-accumulation phases took place at the 0.5 Fibonacci extension level from an earlier accumulation phase. Additionally, these phases shared common characteristics, including a peaking 1-day RSI structure in the USDT dominance chart and a pullback in the Dollar Index (DXY). Now, Bitcoin appears to be mirroring the same conditions again, with USDT dominance and the DXY pulling back with the current re-accumulation phase, which has been playing out since December 2024. If the pattern continues to unfold as expected, this could indicate that Bitcoin is on the verge of its next major rally. USDT To Send BTC To $150,000 If Bitcoin follows the pattern observed in previous rallies this cycle with the USDT dominance to the core, the re-accumulation phase could end within the next one or two weeks and eventually cause another rally to new all-time highs. Related Reading: Bitcoin Price Unravels 157-Day Fractal Similar To Last Cycle, Why A Surge To $169,000 Is Possible In terms of a target, the analyst noted a potential $150,000 target for the Bitcoin price, at least before another major correction and a subsequent accumulation phase. However, Bitcoin must overcome key resistance levels, particularly the psychological $100,000 mark, which has served as a major hurdle in recent weeks. At the time of writing, Bitcoin is trading at $97,175, up by 1.6% in the past 24 hours. A move to $150,000 will represent a 54% increase from the current price. Featured image from Pexels, chart from Tradingview.com",Bitcoin|Accumulation Phase|bitcoin|Bitcoin news|bitcoin price|btc|BTC news|btc price|btcusd|BTCUSDT|Dollar Index|dxy|Fibonacci Extension|Stablecoins|TradingShot|USDT|USDT dominance,EN,0,0,BTC|TRADING|USDT|MARKET|BUSINESS,"{'name': 'NewsBTC', 'img': 'https://images.cryptocompare.com/news/default/newsbtc.png', 'lang': 'EN'}",newsbtc,2025-02-21 02:00:50
40620173,https://en.coinotag.com/ethereum-shows-signs-of-possible-upside-with-surge-in-buying-volume-and-liquidity/,1740103677,https://resources.cryptocompare.com/news/77/40620173.jpeg,Ethereum Shows Signs of Possible Upside with Surge in Buying Volume and Liquidity,https://en.coinotag.com/ethereum-shows-signs-of-possible-upside-with-surge-in-buying-volume-and-liquidity/,"Ethereum (ETH) is showing promising signs of a potential market upturn, as buying momentum builds in the derivatives arena. The recent surge in buying volume suggests that bullish sentiment among",Ethereum|News|ETH|FLOW,EN,0,0,ETH|FLOW|MARKET|TRADING,"{'name': 'CoinOtag', 'img': 'https://resources.cryptocompare.com/news/77/default.png', 'lang': 'EN'}",coinotag,2025-02-21 02:07:57
40620381,https://en.coinotag.com/canary-capitals-litecoin-etf-listed-by-dtcc-awaiting-sec-approval-for-potential-launch/,1740104048,https://resources.cryptocompare.com/news/77/40620381.jpeg,"Canary Capital’s Litecoin ETF Listed by DTCC, Awaiting SEC Approval for Potential Launch",https://en.coinotag.com/canary-capitals-litecoin-etf-listed-by-dtcc-awaiting-sec-approval-for-potential-launch/,"Canary Capital has taken a significant step toward launching a spot Litecoin exchange-traded fund (ETF), marking a pivotal moment in crypto finance. The listing of the Litecoin ETF on the",News|LTC,EN,0,0,LTC|REGULATION,"{'name': 'CoinOtag', 'img': 'https://resources.cryptocompare.com/news/77/default.png', 'lang': 'EN'}",coinotag,2025-02-21 02:14:08
40620387,https://nulltx.com/?p=145434,1740104051,https://images.cryptocompare.com/news/default/nulltx.png,The PEPE Price Is Predicted To Crash In Next 30 Days Says Top Analyst Amid The 100x Tipped Panshibi (SHIBI) Presale Take-Off,https://nulltx.com/the-pepe-price-is-predicted-to-crash-in-next-30-days-says-top-analyst-amid-the-100x-tipped-panshibi-shibi-presale-take-off/,"Recent whispers from the cryptoverse suggest that PEPE coin’s value might take a nosedive in the coming month. Analysts are pointing to some red flags like big holders dumping their stash and charts looking more like a rollercoaster than a steady climb. PEPE price prediction is now a hot topic, with many expecting a dip, given the coin’s known wild price swings. The worry is that if the big fish start selling off their PEPE, the smaller players might follow, pushing the price down even further . Tech indicators aren’t painting a rosy picture either, showing signs of a weakening grip on support levels. While PEPE has had its moments of glory, the current consensus leans towards a correction phase. Investors are advised to keep an eye out and weigh the risks before diving in. Panshibi (SHIBI): The Underdog Crypto Poised for a Financial Leap While PEPE is wrestling with its ups and downs, along comes the fresh face, Panshibi (SHIBI), catching everyone’s eye with talks of huge potential. This panda-themed token isn’t just adorable; it’s clever too, leveraging awesome branding and meme magic to make its mark. Analysts are whispering about a potential 100x surge after launch, positioning it as one of the best crypto to invest in for those looking for the next big thing. Here’s the deal: Panshibi (SHIBI), a meme coin leveraging panda-themed branding and viral trends, has been making waves in the cryptocurrency market. As of today, Panshibi is currently in its presale phase, with the token priced at $0.005 and set to increase to $0.006 soon. The listing price is projected to be $0.026. The presale has already raised over $1M, which is 20.63% of the target. The project aims to attract investors excited about niche cryptocurrency projects and meme-driven trends. Panshibi focuses on transparent pricing, future exchange listings, and community engagement. This shift towards newer tokens like Panshibi suggests that investors are looking for fresh opportunities rather than sticking with established names like PEPE. Meme coins live off hype, and those that can get ahead of the wave of community interest often come out on top. Investor Strategies Amidst Market Fluctuations The PEPE price prediction gurus start sounding the alarm, you know it’s time to get your head in the game. Folks aren’t just sitting on their hands; they’re moving their cash from PEPE to greener pastures like Panshibi, looking for those gems before they hit the jackpot. In the world of crypto, especially with meme coins like PEPE, timing is everything – you need to jump on opportunities before they are known all over social media. Panshibi’s presale? It’s like stumbling upon a goldmine. They’ve got this whole roadmap laid out, not just about making a bank but about building something real with the community. Shifting Trends: From Old Meme Coins to New Opportunities If you’re on the hunt for the top crypto to invest in, keeping tabs on Panshibi’s journey is just smart money. The trend’s clear as day: with PEPE price prediction signaling uncertainty, the cash is flowing from the old meme coins to the ones with new stories and strong backing. Diversifying and nailing the timing, that’s secret sauce, helping us navigate this wild crypto ride, balancing the thrill of possible gains with the rollercoaster of risks. As we witness this paradigm shift in the crypto market, it’s essential to stay informed and agile, ready to grab emerging opportunities that could define the next generation of digital wealth. Remember, in the ever-evolving landscape of cryptocurrency, being adaptable and knowledgeable can turn the tables in your favor. You can participate in the Panshibi presale here Telegram: https://t.me/panshibi Twitter: https://x.com/panshibi_ Website: https://panshibi.com Disclosure: This is a sponsored press release. Please do your research before buying any cryptocurrency or investing in any projects. Read the full disclosure here .",Press Releases,EN,0,0,PEPE|TRADING|ZRX|BUSINESS|SPONSORED,"{'name': 'NullTx', 'img': 'https://images.cryptocompare.com/news/default/nulltx.png', 'lang': 'EN'}",themerkle,2025-02-21 02:14:11
