id,guid,published_on,imageurl,title,url,body,tags,lang,upvotes,downvotes,categories,source_info,source,date
40613374,http://bitcoinworld.co.in/?p=132399,1740096236,https://resources.cryptocompare.com/news/82/default.png,Effortless Crypto Exposure: Franklin Templeton Unveils Groundbreaking EZPZ ETP,https://bitcoinworld.co.in/franklin-templeton-ezpz-etp/,"Exciting news for crypto enthusiasts and investors! Global asset management giant Franklin Templeton has just dropped a game-changer in the digital asset investment space. Announced via X, the financial powerhouse is launching EZPZ ETP , a new Exchange Traded Product designed to offer exposure to the leading cryptocurrencies, Bitcoin and Ethereum, without the complexities of direct ownership. Ready to dive into the details of this innovative financial product? What is the Franklin Templeton EZPZ ETP? The Franklin Templeton EZPZ ETP is designed as a straightforward and accessible way for investors to gain exposure to the cryptocurrency market. Instead of directly purchasing and managing Bitcoin and Ethereum, investors can now invest in an ETP that tracks the performance of these digital assets. The initial composition of the EZPZ ETP reflects the current dominance of Bitcoin and Ethereum in the crypto market, allocating approximately 87% to Bitcoin and 13% to Ethereum based on their respective market capitalizations. This allocation strategy aims to mirror the prevailing trends and investor interest within the cryptocurrency landscape. Here’s a quick breakdown of the key features: Effortless Exposure: Gain exposure to Bitcoin and Ethereum without the need for crypto wallets, private keys, or direct exchange interactions. Market-Reflective Composition: Initially weighted 87% Bitcoin and 13% Ethereum, mirroring market capitalization. Potential for Expansion: Future inclusion of other digital assets is anticipated, pending regulatory approvals, suggesting dynamic portfolio evolution. Institutional Backing: Launched by Franklin Templeton, a globally recognized and trusted asset manager, adding credibility and security. Why Choose a Bitcoin Ethereum ETP like EZPZ? Investing in cryptocurrencies can seem daunting for newcomers. The technicalities of wallets, exchanges, and security concerns can be significant hurdles. This is where a Bitcoin Ethereum ETP like EZPZ shines. It simplifies the process, offering a regulated and familiar investment vehicle. But what are the specific advantages? Let’s explore the benefits of investing in a Crypto ETP through a table: Benefit Description Simplified Access ETPs are traded on traditional stock exchanges, making them easily accessible through brokerage accounts, eliminating the need for specialized crypto exchange accounts. Reduced Complexity Investors avoid the complexities of managing crypto wallets, private keys, and security protocols associated with direct cryptocurrency ownership. Regulatory Compliance ETPs are typically regulated financial products, offering a layer of investor protection and transparency compared to unregulated direct crypto investments. Diversification Potential Provides diversification within a traditional investment portfolio by adding exposure to the digital asset class. Liquidity ETPs offer liquidity as they can be bought and sold easily during exchange trading hours, similar to stocks. The Allure of Digital Asset Exposure: What’s the Big Deal? The buzz around Digital Asset Exposure is undeniable. Cryptocurrencies like Bitcoin and Ethereum have captured global attention due to their potential for high growth and disruptive innovation. But why are institutional investors like Franklin Templeton increasingly interested in providing access to this asset class? Here’s why Digital Asset Exposure is becoming increasingly crucial for modern investment portfolios: Growth Potential: Cryptocurrencies, despite volatility, have shown significant growth potential over the long term, attracting investors seeking high returns. Innovation and Disruption: The underlying blockchain technology is revolutionizing various industries, and cryptocurrencies are at the forefront of this technological shift. Inflation Hedge: Some investors view Bitcoin and other cryptocurrencies as potential hedges against inflation, diversifying away from traditional assets. Institutional Adoption: Increasing institutional adoption signals growing confidence and maturity in the cryptocurrency market, further legitimizing the asset class. Portfolio Diversification: Adding digital assets can enhance portfolio diversification, potentially reducing overall risk and improving risk-adjusted returns. Looking Ahead: The Future of EZPZ and Crypto ETPs Franklin Templeton’s launch of EZPZ ETP signals a significant step forward in the mainstream adoption of cryptocurrency investments. The potential inclusion of additional digital assets in the future highlights the dynamic nature of this product and its adaptability to the evolving crypto landscape. As regulatory frameworks become clearer and the digital asset market matures, we can expect to see more innovative and accessible investment products like EZPZ emerging. What could the future hold for Crypto ETPs like EZPZ? Expansion of Asset Coverage: We might see EZPZ and similar ETPs expanding to include a wider range of cryptocurrencies beyond Bitcoin and Ethereum, offering more diversified exposure. Thematic ETPs: Future ETPs could focus on specific themes within the crypto space, such as DeFi (Decentralized Finance), NFTs (Non-Fungible Tokens), or Metaverse-related assets. Increased Competition: The success of EZPZ is likely to attract more traditional financial institutions to launch similar products, fostering competition and innovation in the ETP market. Lower Fees: Increased competition could also drive down management fees associated with ETPs, making them even more attractive to investors. Global Availability: As regulatory landscapes evolve globally, we can expect to see wider availability of crypto ETPs across different regions, increasing accessibility for investors worldwide. Actionable Insights: Is EZPZ ETP Right for You? The Franklin Templeton EZPZ ETP presents an intriguing option for investors seeking exposure to Bitcoin and Ethereum in a simplified and regulated manner. However, like any investment, it’s crucial to consider whether it aligns with your individual financial goals and risk tolerance. Here are some actionable insights to help you decide: Assess Your Risk Tolerance: Cryptocurrencies are inherently volatile. Ensure you understand the risks involved and that your risk tolerance aligns with investing in digital assets, even through an ETP. Consider Your Investment Goals: Determine if crypto exposure fits into your overall investment strategy and goals. Are you looking for long-term growth, diversification, or speculative opportunities? Research ETP Details: Thoroughly review the prospectus and details of the EZPZ ETP, including fees, tracking methodology, and any specific risks associated with the product. Compare with Alternatives: Explore other options for crypto exposure, such as direct cryptocurrency ownership or other crypto investment products, to make an informed decision. Consult a Financial Advisor: If you are unsure whether EZPZ ETP is suitable for you, seek advice from a qualified financial advisor who can assess your individual circumstances and provide personalized recommendations. Conclusion: A Simplified Gateway to Crypto? Franklin Templeton’s EZPZ ETP marks an exciting development, potentially simplifying the entry point for investors interested in the dynamic world of cryptocurrencies. By offering a regulated, accessible, and market-representative product, EZPZ could pave the way for broader adoption of digital assets within mainstream investment portfolios. As the crypto landscape continues to evolve, innovative products like EZPZ ETP will undoubtedly play a crucial role in shaping the future of finance and investment. To learn more about the latest crypto market trends, explore our article on key developments shaping Bitcoin institutional adoption.",Crypto News|BITCOIN|ETHEREUM|ETP|EZPZ|Franklin Templeton,EN,0,0,BUSINESS|BTC|ETH|MARKET|EXCHANGE,"{'name': 'Bitcoin World', 'img': 'https://resources.cryptocompare.com/news/82/default.png', 'lang': 'EN'}",bitcoinworld,2025-02-21 00:03:56
40613379,https://en.coinotag.com/breakingnews/grayscale-experiences-major-btc-outflows-61-1-million-withdrawn-from-mini-btc/,1740096242,https://resources.cryptocompare.com/news/77/default.png,Grayscale Experiences Major BTC Outflows: $61.1 Million Withdrawn from Mini BTC,https://en.coinotag.com/breakingnews/grayscale-experiences-major-btc-outflows-61-1-million-withdrawn-from-mini-btc/,"On February 21st, COINOTAG News reported significant shifts in the cryptocurrency investment landscape, as per Farside Investors’ analysis. The Grayscale Bitcoin Trust (GBTC) experienced a notable net outflow of $33.5",,EN,0,0,BTC|BUSINESS|MARKET,"{'name': 'CoinOtag', 'img': 'https://resources.cryptocompare.com/news/77/default.png', 'lang': 'EN'}",coinotag,2025-02-21 00:04:02
40613591,https://decrypt.co/?p=307149,1740096326,https://resources.cryptocompare.com/news/44/40613591.jpeg,"Franklin Templeton Launches EZPZ ETF for Weighted Bitcoin, Ethereum Exposure",https://decrypt.co/307149/franklin-templeton-expz-etf-bitcoin-ethereum,"Franklin Templeton’s newest crypto product, listed on the Cboe BZX exchange, offers investors both Bitcoin and Ethereum exposure.",||Markets,EN,0,0,BTC|ETH|MARKET|BUSINESS|EXCHANGE,"{'name': 'Decrypt', 'img': 'https://images.cryptocompare.com/news/default/decrypt.png', 'lang': 'EN'}",decrypt,2025-02-21 00:05:26
40613558,https://en.coinotag.com/franklin-templeton-launches-ezpz-crypto-index-etf-offering-bitcoin-and-ethereum-exposure-on-cboe-bzx-exchange/,1740096386,https://resources.cryptocompare.com/news/77/40613558.jpeg,Franklin Templeton Launches EZPZ Crypto Index ETF Offering Bitcoin and Ethereum Exposure on Cboe BZX Exchange,https://en.coinotag.com/franklin-templeton-launches-ezpz-crypto-index-etf-offering-bitcoin-and-ethereum-exposure-on-cboe-bzx-exchange/,"Franklin Templeton has unveiled its latest crypto investment vehicle, the EZPZ Crypto Index ETF, offering significant exposure to Bitcoin and Ethereum. This innovative fund, launched on the Cboe BZX exchange,",News|BTC|ETH,EN,0,0,BTC|ETH|EXCHANGE|MARKET,"{'name': 'CoinOtag', 'img': 'https://resources.cryptocompare.com/news/77/default.png', 'lang': 'EN'}",coinotag,2025-02-21 00:06:26
40613617,https://en.coin-turk.com/?p=183339,1740096406,https://resources.cryptocompare.com/news/79/40613617.jpeg,Jamie Coutts Predicts Continued Growth in Crypto Markets,https://en.coin-turk.com/jamie-coutts-predicts-continued-growth-in-crypto-markets/,"Jamie Coutts, the lead digital asset analyst at Real Vision, asserts that the current upswing in the cryptocurrency market is far from over. According to him, the historical correlation between global money supply (M2) and the number of active addresses on the blockchain indicates further growth signals in the market. Continue Reading: Jamie Coutts Predicts Continued Growth in Crypto Markets The post Jamie Coutts Predicts Continued Growth in Crypto Markets appeared first on COINTURK NEWS .",Cryptocurrency News,EN,0,0,MARKET|BLOCKCHAIN,"{'name': 'CoinTurk News', 'img': 'https://resources.cryptocompare.com/news/79/default.png', 'lang': 'EN'}",cointurken,2025-02-21 00:06:46
40613896,https://coingape.com/?p=240128,1740096713,https://images.cryptocompare.com/news/default/coingape.png,Can Shiba Inu Price Surge 422%? This Pattern Signal SHIB New All-Time High,https://coingape.com/can-shiba-inu-price-surge-422-this-pattern-signal-shib-new-all-time-high/,"Shiba Inu price has recently broken out of a Falling Wedge pattern, a formation commonly recognized as a bullish reversal signal in technical analysis. The pattern is characterized by a downward consolidation with lower highs and lower lows, which eventually leads to a meme coin rally breakout. Shiba Inu Price Breaks Out of Falling Wedge Formation According to analyst Bezos Crypto , Shiba Inu price has completed a breakout from a Falling Wedge, a pattern associated with strong upward movements. This formation often indicates a trend reversal, with SHIB price action shifting from a downtrend to an uptrend. In previous instances, similar setups have led to substantial gains for SHIB, fueling optimism among traders and investors. The breakout is accompanied by a noticeable increase in trading volume, suggesting strong participation from investors. Volume confirmation is a crucial aspect of validating the meme coin rally, as it indicates growing buying interest. If Shiba Inu price maintains its momentum, it could reach the projected price target of $0.00008841, reflecting a 422% increase. Meanwhile, most recently, SHIB whales have triggered volatility by offloading 2.1 trillion tokens, adding uncertainty to price action. The sudden transaction, valued at $32.55 million, has raised concerns over potential selling pressure. Bitcoin’s Influence on SHIB and Technical Analysis More so, Bitcoin price trend, plays a crucial role in determining the trajectory of Shiba Inu price. Historically, altcoins such as SHIB have exhibited strong price movements during Bitcoin’s bullish phases. When Bitcoin consolidates or trends higher, altcoins often benefit from increased market liquidity and positive sentiment. On the same note, other technical aspects also align with the bullish narrative, as various technicals suggest upcoming meme coin rally. AO is shifting the momentum from the red bars, to green bars which depict a bullish reversal. AO, which measures market momentum, suggests that selling pressure is fading, and buyers are beginning to gain control. In addition, Moving Average Convergence Divergence (MACD) indicator gives buying signal, because the MACD line has crossed the signal line. This crossover is an indication that the trend is moving towards the buyers end hence conforming a bullish trend. Source: TradingView More so, the histogram bars, which represent the difference between the MACD and signal lines, have turned green, reinforcing the strengthening bullish sentiment. If this trend continues, it could indicate a strong upward movement in SHIB price to a new all-time high. Risk Considerations Ahead of The Meme Coin Rally While the bullish scenario for Shiba Inu price remains strong, traders remain cautious about potential volatility. Price movements in the cryptocurrency market can be influenced by external factors, including regulatory news, and shifts in investor sentiment. A retracement or a retest of the breakout zone is possible before further upside continuation. Key resistance levels to monitor include $0.000030, $0.000050, and the previous all-time high near $0.00008841. On the downside, support levels at $0.000020 and $0.000015 could act as critical zones if a pullback occurs. Also, a recent report revealed that top meme coins such as Dogecoin, Shiba Inu, Pepe Coin and Floki Inu, are at risk to declining futures open interest. The data also indicates that SHIB’s futures Open Interest has dropped by 74.41% and DOGE by 58.45% which shows a decreased trader interest. The post Can Shiba Inu Price Surge 422%? This Pattern Signal SHIB New All-Time High appeared first on CoinGape .",24/7 Cryptocurrency News|Altcoin News|Meme coins rally|Shiba Inu (SHIB) PRICE,EN,0,0,SHIB|TRADING|MARKET|BTC|BUSINESS,"{'name': 'CoinGape', 'img': 'https://images.cryptocompare.com/news/default/coingape.png', 'lang': 'EN'}",coingape,2025-02-21 00:11:53
40614001,https://en.coinotag.com/whale-activity-increases-as-uni-approaches-critical-support-level-potential-rally-to-10-awaits/,1740096797,https://resources.cryptocompare.com/news/77/default.png,"Whale Activity Increases as UNI Approaches Critical Support Level, Potential Rally to $10 Awaits",https://en.coinotag.com/whale-activity-increases-as-uni-approaches-critical-support-level-potential-rally-to-10-awaits/,"Uniswap (UNI) approaches a crucial trendline support level, with whale transactions surging as investors anticipate a price reversal towards $10. Large transactions for UNI have increased by 44% in the",News,EN,0,0,UNI|TRADING|BUSINESS,"{'name': 'CoinOtag', 'img': 'https://resources.cryptocompare.com/news/77/default.png', 'lang': 'EN'}",coinotag,2025-02-21 00:13:17
40615173,https://en.coinotag.com/breakingnews/opensea-enjoys-trading-volume-surge-to-71-5-in-ethereum-nft-market-after-sea-token-launch/,1740097795,https://resources.cryptocompare.com/news/77/default.png,Opensea Enjoys Trading Volume Surge to 71.5% in Ethereum NFT Market After SEA Token Launch,https://en.coinotag.com/breakingnews/opensea-enjoys-trading-volume-surge-to-71-5-in-ethereum-nft-market-after-sea-token-launch/,"As reported by COINOTAG on February 21st, the NFT marketplace OpenSea has recently experienced a remarkable resurgence in trading activity, largely attributed to the launch of the SEA token. In",,EN,0,0,TRADING|ETH|MARKET,"{'name': 'CoinOtag', 'img': 'https://resources.cryptocompare.com/news/77/default.png', 'lang': 'EN'}",coinotag,2025-02-21 00:29:55
40615235,https://news.bitcoin.com/?p=706569&preview=true&preview_id=706569,1740097814,https://resources.cryptocompare.com/news/14/40615235.jpeg,SEC Backs Down: Crypto Industry Scores Landmark Victory,https://news.bitcoin.com/sec-backs-down-crypto-industry-scores-landmark-victory/,"The SEC’s decision to drop its dealer rule lawsuit appeal marks a major victory for the crypto industry, ending a legal battle over regulatory overreach and signaling change. A Win for the Crypto Industry The U.S. Securities and Exchange Commission (SEC) has voluntarily dropped its appeal in the lawsuit challenging the dealer rule, securing a",Regulation|SEC|United States US,EN,0,0,REGULATION|EXCHANGE,"{'name': 'Bitcoin.com', 'img': 'https://images.cryptocompare.com/news/default/bitcoincom.png', 'lang': 'EN'}",bitcoin.com,2025-02-21 00:30:14
40615239,https://www.newsbtc.com/?p=700387,1740097844,https://images.cryptocompare.com/news/default/newsbtc.png,Gamestop CEO Fuels Bitcoin Speculation: $4.6 Billion Buy Incoming?,https://www.newsbtc.com/news/bitcoin/gamestop-ceo-fuels-bitcoin-speculation/,"In a development that has reignited speculation within the Bitcoin community, GameStop CEO Ryan Cohen has, for the first time in nearly four years, followed a second account on X. Until now, Cohen exclusively followed the official GameStop handle, but as of today, he has added Bitcoin Magazine to his follow list. This comes on the heels of a much-discussed photograph that surfaced two weeks ago showing Cohen with Michael Saylor, Executive Chairman of Strategy (formerly MicroStrategy). 👀 Go on king 👑 https://t.co/ApTV3WwTaj — David Bailey🇵🇷 $0.85mm/btc is the floor (@DavidFBailey) February 20, 2025 Will Gamestop Buy Bitcoin? GameStop has periodically found itself at the center of Bitcoin-related conjecture, particularly since the pandemic era “meme stock” phenomenon. At that time, a theory posted on Wall Street Bets—a popular Reddit forum—proposed that the gaming retailer, viewed by many as a relic of brick-and-mortar retail, was primed for a turnaround. Widespread retail buying propelled the share price upward, challenging major hedge funds that had shorted the stock. The resulting clash was widely likened to a “David vs. Goliath” scenario. The Bitcoin connection emerged as the pandemic-driven mania intersected with discourse on decentralized finance. Some observers drew parallels between the grassroots support for GameStop and the way Bitcoin was embraced as a hedge against systemic corruption in traditional finance. Since then, theories have circulated that GameStop could adopt a corporate Bitcoin strategy, potentially mirroring MicroStrategy’s aggressive move into BTC. Two weeks ago, Cohen posted a photo on X in which he appeared alongside Michael Saylor, as reported by Bitcoinist. Given Saylor’s reputation as a high-profile advocate for corporate BTC treasury strategies—he spearheads the acquisition of nearly 500,000 BTC at Strategy—many in the Bitcoin sphere speculated that Cohen might be seeking Saylor’s counsel. However, caution soon followed. According to two unnamed sources cited by CNBC, Saylor has no direct involvement in any potential GameStop plan to buy Bitcoin. The rumors remain just that: speculation that has yet to be confirmed by either Cohen or GameStop. Fueling these rumors is the fact that GameStop reported having around $4.616 billion in cash, cash equivalents, and marketable securities as of October 31, 2024. Tim Kotzman, host of “The Bitcoin Treasuries Podcast,” recently highlighted GameStop’s investment policy that grants Cohen “the authority to invest in cryptocurrencies without requiring shareholder or board approval.” “If GameStop $GME were to invest its $4.6 billion cash reserves into BTC, it would acquire approximately 48,000 BTC,” wrote analyst Han Akamatsu on X, noting that such a position would make GameStop the second-largest corporate holder of Bitcoin, surpassing MARA Holdings but still behind Strategy. However, such predictions are heavily speculative. GameStop has dabbled in NFTs and blockchain projects in the past, but there is no official indication that the company is imminently acquiring Bitcoin. At press time, BTC traded at $97,708. Featured image created with DALL.E, chart from TradingView.com",Bitcoin|bitcoin|Bitcoin news|bitcoin price|btc|BTC news|btc price|gamestop|Ryan Cohen,EN,0,0,BTC|BUSINESS|BLOCKCHAIN|REGULATION|SPONSORED,"{'name': 'NewsBTC', 'img': 'https://images.cryptocompare.com/news/default/newsbtc.png', 'lang': 'EN'}",newsbtc,2025-02-21 00:30:44
40615535,https://en.coinotag.com/crypto-wallet-growth-potential-trust-wallet-explores-integration-security-and-user-experience-enhancements/,1740098107,https://resources.cryptocompare.com/news/77/default.png,"Crypto Wallet Growth Potential: Trust Wallet Explores Integration, Security, and User Experience Enhancements",https://en.coinotag.com/crypto-wallet-growth-potential-trust-wallet-explores-integration-security-and-user-experience-enhancements/,"The crypto wallet market is set for transformative growth, driven by rising demand for digital assets and a focus on enhanced user experience. Developers are prioritizing advancements in wallet functionality",Blockchain|News,EN,0,0,BLOCKCHAIN|MARKET,"{'name': 'CoinOtag', 'img': 'https://resources.cryptocompare.com/news/77/default.png', 'lang': 'EN'}",coinotag,2025-02-21 00:35:07
40616347,https://thecoinrise.com/from-xrp-to-solana-could-magacoinofficial-com-be-the-next-50000-crypto/,1740098151,https://resources.cryptocompare.com/news/60/40616347.jpeg,"From XRP to Solana: Could MAGACOINOFFICIAL.COM Be the Next 50,000% Crypto?",https://thecoinrise.com/from-xrp-to-solana-could-magacoinofficial-com-be-the-next-50000-crypto/,"The smartest investors aren’t just holding Bitcoin (BTC), Solana (SOL), or XRP —they’re looking for the next 1000x crypto before it explodes . Right now, all eyes are on MAGACOINOFFICIAL.COM , an exclusive opportunity positioned for massive growth in 2025. To celebrate MAGACOINOFFICIAL.COM ’s record-breaking success , early buyers can claim a 50% EXTRA BONUS with MAGA50X . This deal won’t last long—serious investors are getting in before the price soars! ACT FAST! ENTER MAGA50X NOW AND CLAIM YOUR 50% EXTRA BONUS! Why MAGACOINOFFICIAL.COM Is the Best Investment Right Now 🔹 Ultra-Low Presale Entry – Maximize gains before it lists. 🔹 Exclusive Early Access – Available only at MAGACOINOFFICIAL.COM . 🔹 Explosive Growth Potential – Analysts project 100x+ returns . DON’T MISS OUT! APPLY MAGA50X TODAY FOR A 50% EXTRA BONUS! How Do XRP, SOL, INJ, and KAS Compare? XRP ($2.69): Established but unlikely to deliver 100x growth . Solana (SOL) ($174.55): Strong but already heavily adopted. Injective (INJ) ($15.66): A growing DeFi player, but not positioned for massive gains. Kaspa (KAS) ($0.107088): Innovative, yet lacks the mainstream adoption needed for a parabolic rise . These cryptos are solid, but early stage projects like MAGACOINOFFICIAL.COM offer the biggest opportunities for exponential gains . > DON’T MISS THE NEXT 1000X CRYPTO – CLICK HERE TO JOIN NOW! Conclusion XRP, SOL, INJ, and KAS have growth potential , but real wealth is in early-stage investments . MAGACOINOFFICIAL.COM is where smart money is moving, and those who act fast could secure life-changing returns . Opportunities like this don’t wait, secure your stake today at MAGACOINOFFICIAL.COM . 🔹 Website: MAGACOINOFFICIAL.COM 🔹 X/Twitter: https://x.com/officialMAGAx The post From XRP to Solana: Could MAGACOINOFFICIAL.COM Be the Next 50,000% Crypto? appeared first on TheCoinrise.com .",Token Presale and ICO Insights|MAGACOINOFFICIAL,EN,0,0,ZRX|SOL|XRP|INJ|BTC,"{'name': 'The Coin Rise', 'img': 'https://images.cryptocompare.com/news/default/thecoinrise.png', 'lang': 'EN'}",thecoinrise,2025-02-21 00:35:51
40616587,https://cointelegraph.com/news/ethereum-foundation-hiring-social-media-manager,1740098810,https://images.cryptocompare.com/news/default/cointelegraph.png,Ethereum Foundation wants a social media guru to help it ‘yap better’,https://cointelegraph.com/news/ethereum-foundation-hiring-social-media-manager?utm_source=rss_feed&utm_medium=rss&utm_campaign=rss_partner_inbound,The Ethereum Foundation is seeking a social media manager to share the most pressing Ethereum ecosystem developments and stories on social media platforms like X.,,EN,0,0,ETH,"{'name': 'CoinTelegraph', 'img': 'https://images.cryptocompare.com/news/default/cointelegraph.png', 'lang': 'EN'}",cointelegraph,2025-02-21 00:46:50
