id,guid,published_on,imageurl,title,url,body,tags,lang,upvotes,downvotes,categories,source_info,source,date
46716526,https://bitcoinworld.co.in/?p=171860,1750807832,https://resources.cryptocompare.com/news/82/46716526.jpeg,Strategic ProCapBTC Bitcoin Acquisition: Unlocking a New Era of Institutional Bitcoin Adoption,https://bitcoinworld.co.in/procapbtc-bitcoin-acquisition/,"BitcoinWorld Strategic ProCapBTC Bitcoin Acquisition: Unlocking a New Era of Institutional Bitcoin Adoption In the ever-evolving landscape of digital assets, a significant move by a prominent player often sends ripples through the market. This week, the cryptocurrency world is abuzz with news surrounding ProCapBTC Bitcoin , the publicly traded firm spearheaded by well-known crypto advocate Anthony Pompliano. The company has made a substantial acquisition, purchasing 3,724 Bitcoin, valued at an impressive $386.5 million. This bold move isn’t just a one-off transaction; it’s a pivotal step in ProCapBTC’s ambitious goal to accumulate up to $1 billion in Bitcoin, signaling a profound shift in corporate treasury strategies and further cementing the trend of Institutional Bitcoin Adoption . Let’s dive deep into what this means for the future of finance and why this strategic play is capturing the attention of investors worldwide. Who is Anthony Pompliano and Why Does His Bitcoin Vision Matter? To truly understand the significance of ProCapBTC’s recent actions, one must first appreciate the mind behind it: Anthony Pompliano. Often referred to simply as ‘Pomp,’ he is a figure synonymous with Bitcoin advocacy and innovation within the crypto space. A former Facebook and Snapchat product manager, Pompliano transitioned into the world of digital assets with an unwavering conviction in Bitcoin’s long-term potential. His influence extends far beyond his ventures; he’s a prolific writer, podcaster, and investor, known for his ability to articulate complex financial concepts in an accessible manner. Pomp’s early and consistent championing of Bitcoin as ‘digital gold’ and a hedge against inflation has resonated with a vast audience, from retail investors to institutional heavyweights. His vision for Bitcoin is not merely speculative; it’s rooted in fundamental economic principles and a belief in decentralized, censorship-resistant money. Pompliano has consistently argued that Bitcoin represents a generational opportunity, a paradigm shift in how value is stored and transferred. His public persona and educational efforts have played a crucial role in demystifying Bitcoin for traditional investors, paving the way for greater acceptance and, crucially, greater institutional participation. When a figure of Pompliano’s stature makes such a significant move through a publicly traded entity like ProCapBTC, it sends a clear signal: the future of finance is increasingly intertwined with Bitcoin. ProCapBTC Bitcoin: A New Era of Corporate Treasury Strategy? ProCapBTC, founded by Anthony Pompliano, isn’t just another crypto fund. Its status as a publicly traded firm adds a layer of transparency and accessibility that distinguishes it from many private investment vehicles in the crypto sphere. This structure allows traditional investors to gain exposure to Bitcoin through a regulated entity, bridging the gap between conventional finance and the burgeoning digital asset market. The recent acquisition of 3,724 Bitcoin, reportedly at an average price of $103,780 per coin, underscores ProCapBTC’s aggressive yet calculated approach to its treasury management. This single purchase, valued at $386.5 million, represents a substantial commitment and a strong vote of confidence in Bitcoin’s current valuation and future trajectory. What makes this particular ProCapBTC Bitcoin purchase noteworthy is not just its size, but its context. It’s part of a larger, pre-announced strategy to accumulate up to $1 billion in Bitcoin. This isn’t a speculative gamble; it’s a deliberate, long-term Bitcoin Investment Strategy . For publicly traded companies, allocating such a significant portion of their capital to a volatile asset like Bitcoin is a bold move that speaks volumes about their conviction. It reflects a growing trend among forward-thinking corporations to consider Bitcoin as a primary treasury reserve asset, similar to how cash or gold might have been viewed in the past. This shift is driven by several factors: Inflationary Pressures: As central banks continue quantitative easing, companies are seeking assets that can preserve purchasing power. Diversification: Adding Bitcoin provides a non-correlated asset to traditional portfolios. Future-Proofing: Recognizing the inevitable shift towards a more digitized global economy. Shareholder Value: A belief that holding Bitcoin will ultimately enhance long-term shareholder value. This move by ProCapBTC could serve as a blueprint for other publicly traded companies considering a similar allocation, potentially sparking a domino effect across corporate America and beyond. The Ambitious $1 Billion Bitcoin Accumulation Plan Unpacked The announcement that ProCapBTC is targeting a total of $1 billion in Bitcoin Accumulation is a significant statement of intent. This isn’t just about buying a few coins; it’s about establishing a substantial, strategic reserve. To put this into perspective, a $1 billion Bitcoin holding would place ProCapBTC among the top corporate holders of Bitcoin globally, alongside giants like MicroStrategy and Tesla. This long-term accumulation strategy suggests a belief that Bitcoin’s value will continue to appreciate significantly over time, making it a superior store of value compared to traditional assets. What does a billion-dollar Bitcoin Accumulation plan entail? Phased Purchases: It’s likely that ProCapBTC will continue to make periodic purchases, potentially employing a dollar-cost averaging strategy to mitigate volatility risks. Strategic Funding: The plan relies on ‘strategic funding,’ which could involve a mix of equity raises, debt financing, or cash flow generation specifically earmarked for Bitcoin acquisitions. Long-Term Horizon: This isn’t a short-term trading play. The $1 billion target indicates a multi-year commitment to holding Bitcoin as a core asset. Market Impact: Consistent, large-scale buying by a publicly visible entity like ProCapBTC could create sustained buying pressure, potentially influencing Bitcoin’s price trajectory. The commitment to such a large-scale Bitcoin accumulation plan by a firm led by Anthony Pompliano further validates Bitcoin’s role as a legitimate asset class for institutional portfolios. It signals confidence not just in Bitcoin’s technology, but in its monetary policy and its potential to become a global reserve asset in the digital age. Driving Forces Behind Growing Institutional Bitcoin Adoption ProCapBTC’s move is not an isolated incident but rather a powerful example of a broader trend: the accelerating pace of Institutional Bitcoin Adoption . For years, Bitcoin was primarily the domain of individual investors and tech enthusiasts. However, over the last few years, a confluence of factors has led traditional financial institutions, corporations, and even sovereign wealth funds to seriously consider, and in many cases, actively invest in Bitcoin. What’s driving this seismic shift? Macroeconomic Environment: Unprecedented levels of global debt, quantitative easing, and inflation concerns have pushed institutions to seek alternative assets that can act as a hedge against currency debasement. Bitcoin, with its fixed supply and decentralized nature, fits this narrative perfectly. Regulatory Clarity: While still evolving, regulatory frameworks around cryptocurrencies are becoming clearer in many jurisdictions. The approval of Bitcoin Spot ETFs in various regions, for example, has provided a regulated and accessible pathway for institutional investors to gain exposure without directly holding the asset. Improved Infrastructure: The maturation of the crypto ecosystem, including robust custodial solutions, institutional-grade trading platforms, and sophisticated financial products, has made it easier and safer for large entities to engage with Bitcoin. Performance and Track Record: Despite its volatility, Bitcoin’s long-term performance has been exceptional, outperforming most traditional asset classes over various timeframes. This undeniable track record makes it increasingly difficult for fiduciaries to ignore. Growing Public Acceptance: As more companies, payment processors, and even governments explore blockchain technology and digital currencies, public perception of Bitcoin is shifting from a niche technology to a legitimate financial innovation. This wave of Institutional Bitcoin Adoption is fundamentally transforming the market. It brings greater liquidity, reduces volatility (over the long term), and lends significant credibility to Bitcoin as a legitimate and essential component of a diversified investment portfolio. ProCapBTC, under Pompliano’s leadership, is not just participating in this trend; it’s actively driving it forward. Decoding ProCapBTC’s Bitcoin Investment Strategy: What Can We Learn? ProCapBTC’s approach to its Bitcoin Investment Strategy offers valuable insights for both institutional and retail investors. It’s clear that their strategy is built on a strong conviction in Bitcoin’s fundamental value proposition and its potential for long-term appreciation. Here are some key takeaways: Benefits of Their Approach: Long-Term Horizon: By committing to a $1 billion accumulation, ProCapBTC demonstrates a belief in Bitcoin’s multi-year growth trajectory, signaling that short-term price fluctuations are less relevant than the long-term vision. Strategic Accumulation: Instead of a single, massive buy, a phased accumulation plan allows for dollar-cost averaging, potentially reducing the average purchase price and mitigating risk from market volatility. Transparency for Investors: As a publicly traded company, ProCapBTC provides a regulated avenue for traditional investors to gain exposure to Bitcoin, which can be particularly appealing to those who prefer not to directly manage crypto assets. Leading by Example: ProCapBTC’s actions serve as a powerful example for other corporations and institutions considering Bitcoin as a treasury asset, accelerating the broader trend of institutional adoption. Challenges and Considerations: Volatility: Bitcoin remains a highly volatile asset. While long-term holders aim to ride out the swings, short-to-medium term fluctuations can impact financial reporting and investor sentiment. Regulatory Landscape: Despite improvements, the regulatory environment for cryptocurrencies is still evolving and varies significantly across jurisdictions, posing potential challenges for large-scale operations. Security Risks: Managing large quantities of Bitcoin requires sophisticated security protocols to protect against hacks and theft, a constant concern in the digital asset space. Public Scrutiny: As a publicly traded company, ProCapBTC’s Bitcoin strategy will be under constant scrutiny from shareholders, analysts, and the media, requiring clear communication and justification. Actionable Insights for Retail Investors: While most retail investors don’t have billions to deploy, ProCapBTC’s strategy offers valuable lessons: Conviction is Key: Invest in assets you truly understand and believe in for the long term. Pomp’s unwavering conviction in Bitcoin is a testament to this. Dollar-Cost Averaging (DCA): Regularly investing a fixed amount, regardless of price, can be an effective way to accumulate assets over time and reduce the impact of volatility. Research and Education: Follow thought leaders like Anthony Pompliano, read whitepapers, and stay informed about market trends. Knowledge is your best defense against market FUD (Fear, Uncertainty, Doubt). Diversification (within reason): While ProCapBTC is heavily concentrated in Bitcoin, the broader lesson is to consider how alternative assets can complement your existing portfolio. ProCapBTC’s strategic move is more than just a large purchase; it’s a meticulously planned Bitcoin Investment Strategy that aims to capitalize on what its founder believes is the most significant financial innovation of our time. Conclusion: Paving the Way for Bitcoin’s Future ProCapBTC’s substantial acquisition of 3,724 Bitcoin, as part of its ambitious $1 billion accumulation plan, is a powerful indicator of the growing confidence in digital assets among institutional players. Led by the visionary Anthony Pompliano, this move not only strengthens ProCapBTC’s position but also reinforces the broader trend of Institutional Bitcoin Adoption . It highlights Bitcoin’s increasing acceptance as a legitimate store of value and a strategic treasury asset for corporations navigating an uncertain economic future. As more firms follow suit, these large-scale investments are poised to profoundly impact Bitcoin’s market dynamics, liquidity, and overall legitimacy. This isn’t just about a company buying Bitcoin; it’s about a fundamental shift in how the world views and integrates this revolutionary digital asset into the global financial fabric. The path ahead for Bitcoin appears increasingly paved by the strategic actions of influential entities like ProCapBTC, cementing its role as a cornerstone of the future financial landscape. To learn more about the latest Bitcoin market trends, explore our article on key developments shaping Bitcoin price action and institutional adoption. This post Strategic ProCapBTC Bitcoin Acquisition: Unlocking a New Era of Institutional Bitcoin Adoption first appeared on BitcoinWorld and is written by Editorial Team",Crypto News|Anthony Pompliano|BITCOIN|CRYPTOCURRENCY|Institutional Investment|ProCapBTC,EN,0,0,BTC|BUSINESS|MARKET|REGULATION|TRADING,"{'name': 'Bitcoin World', 'img': 'https://resources.cryptocompare.com/news/82/default.png', 'lang': 'EN'}",bitcoinworld,2025-06-24 23:30:32
46716578,https://timestabloid.com/?p=72453,1750807848,https://resources.cryptocompare.com/news/67/default.png,"If XRP Hits $8, You’ll Wish You Had 15,000 Tokens. Here’s Why",https://timestabloid.com/heres-what-15000-xrp-investment-could-become-when-xrp-hits-8/,"XRP investors maintaining medium-sized portfolios may stand to gain considerably if the asset price climbs to $8. While cryptocurrency markets have faced instability in recent months, analysts remain divided on the timeline for such a surge, but the potential return remains attractive to many holders. Price Target and Market Capitalization Outlook The token is currently trading at around $2.19 . To reach the projected $8 mark, the token would need to increase by approximately 270%. If the supply stays fixed at 58.93 billion tokens, an $8 valuation would result in a market capitalization near $471 billion, significantly above its current market cap of roughly $127 billion. This potential growth trajectory represents a major shift for XRP, which last peaked at $3.84 in January 2018. A climb to $8 would not only set a new all-time high but also signal a broader recovery for the token. Forecasts from Industry Analysts The possibility of XRP hitting $8 by year-end has been the subject of various expert analyses. George Tung, founder of the cryptocurrency platform CryptosRUs, described $8 as a realistic price target. He attributes this outlook to rising institutional interest, citing the growing number of spot XRP exchange-traded fund (ETF) applications. Similarly, a community analyst known as Xena also supports the $8 projection but argues that it may underestimate the token’s potential. This reflects a sentiment among some XRP supporters that higher price targets are within reach given favourable market conditions. Another analyst, the pseudonymous Bearable Bull, has claimed that XRP is positioned to enter a new growth phase if it reaches the $8 mark. According to him, such a milestone would indicate a turning point in XRP’s long-term trajectory. Not all analysts agree on the timing. For example, crypto exchange platform Changelly projects that XRP might not reach the $8 threshold until 2028, suggesting a more gradual path upward. We are on twitter, follow us to connect with us :- @TimesTabloid1 — TimesTabloid (@TimesTabloid1) July 15, 2023 Returns for Investors Holding 15,000 XRP For those currently holding 15,000 XRP, the financial implications of a price surge to $8 are substantial. At the current market rate of $2.19, 15,000 XRP is valued at $32,850. If the price increases to $8, the holding would be worth $120,000, resulting in a profit of $87,150. This scenario is relevant for many investors. According to XRP Rich List data , over 167,000 wallets currently contain between 10,000 and 25,000 XRP. The projected returns also apply proportionally to other holdings. For instance, an investor with 5,000 XRP, currently valued at $10,800, would see that amount increase to $40,000 if XRP reaches $8. Recent Market Activity XRP’s performance has shown some resilience in the face of broader market volatility. Over the past week, the token temporarily dropped below $2 amid geopolitical concerns, particularly related to tensions in the Middle East. However, it rebounded above $2 following the announcement of a ceasefire agreement between Iran and Israel, reportedly facilitated by U.S. President Donald Trump. This rebound supports short-term optimism, although whether the token can maintain momentum and achieve the $8 target remains uncertain. The potential for XRP to reach $8 has sparked renewed interest among retail and institutional investors. A holder with 15,000 XRP could see their assets grow by over $87,000 if the forecast materializes. Still, investors should recognize that such projections depend on multiple variables, including market stability, regulatory developments, and sustained institutional demand. Disclaimer : This content is meant to inform and should not be considered financial advice. The views expressed in this article may include the author’s personal opinions and do not represent Times Tabloid’s opinion. Readers are urged to do in-depth research before making any investment decisions. Any action taken by the reader is strictly at their own risk. Times Tabloid is not responsible for any financial losses. Follow us on Twitter , Facebook , Telegram , and Google News The post If XRP Hits $8, You’ll Wish You Had 15,000 Tokens. Here’s Why appeared first on Times Tabloid .",Cryptocurrency|News|XRP|XRP Price,EN,0,0,BUSINESS|EXCHANGE|MARKET|TRADING|XRP,"{'name': 'TimesTabloid', 'img': 'https://resources.cryptocompare.com/news/67/default.png', 'lang': 'EN'}",timestabloid,2025-06-24 23:30:48
46716627,https://en.coinotag.com/chainlink-and-mastercard-partnership-could-enable-direct-on-chain-crypto-purchases-for-billions/,1750807924,https://resources.cryptocompare.com/news/77/46716627.jpeg,Chainlink and Mastercard Partnership Could Enable Direct On-Chain Crypto Purchases for Billions,https://en.coinotag.com/chainlink-and-mastercard-partnership-could-enable-direct-on-chain-crypto-purchases-for-billions/,"The groundbreaking Chainlink Mastercard partnership is set to revolutionize cryptocurrency adoption by enabling direct on-chain purchases for 3 billion Mastercard users worldwide. This collaboration bridges traditional finance and Web3, simplifying",Blockchain|News|LINK,EN,0,0,BLOCKCHAIN|LINK,"{'name': 'CoinOtag', 'img': 'https://resources.cryptocompare.com/news/77/default.png', 'lang': 'EN'}",coinotag,2025-06-24 23:32:04
46716768,https://en.coinotag.com/nano-labs-considers-acquiring-up-to-1b-in-bnb-amid-convertible-note-agreement/,1750808041,https://resources.cryptocompare.com/news/77/46716768.jpeg,Nano Labs Considers Acquiring Up to $1B in BNB Amid Convertible Note Agreement,https://en.coinotag.com/nano-labs-considers-acquiring-up-to-1b-in-bnb-amid-convertible-note-agreement/,"Nano Labs announces a strategic move to acquire $1 billion worth of Binance Coin (BNB), starting with an initial $500 million convertible note offering. The company aims to hold between",News|BNB|FLOW,EN,0,0,EXCHANGE|BNB|FLOW,"{'name': 'CoinOtag', 'img': 'https://resources.cryptocompare.com/news/77/default.png', 'lang': 'EN'}",coinotag,2025-06-24 23:34:01
