id,guid,published_on,imageurl,title,url,body,tags,lang,upvotes,downvotes,categories,source_info,source,date
46718238,https://en.bitcoinsistemi.com/?p=169228,1750809612,https://resources.cryptocompare.com/news/81/46718238.jpeg,Is MAGACOIN FINANCE Nearing a Major Milestone? Bitcoin and Solana Traders Follow XRP and Uniswap,https://en.bitcoinsistemi.com/is-magacoin-finance-nearing-a-major-milestone-bitcoin-and-solana-traders-follow-xrp-and-uniswap/,"As capital rotation intensifies across the digital asset market, a growing number of seasoned investors are shifting their focus from large caps to high-potential new entrants. MAGACOIN FINANCE is emerging as one of the most followed early-stage projects , with notable attention from Bitcoin, Solana, XRP, and Uniswap traders as it edges closer to a critical milestone. MAGACOIN FINANCE: The Early-Stage Powerhouse MAGACOIN FINANCE has already raised over $10 million through its structured pre-sale, with each phase consistently oversubscribed. Its capped supply of 170 billion tokens, verified HashEx audit, and fully community-owned governance model highlight a commitment to transparency and scarcity. With no venture capital influence and built-in staking rewards, the project appeals to both individual and institutional investors seeking fundamentals-driven upside. As participants rebalance from established assets like Bitcoin and XRP, MAGACOIN FINANCE is drawing strong momentum ahead of its anticipated public launch. Bitcoin: Profits Fueling Altcoin Rotation Bitcoin’s price continues to consolidate above the $105,000 mark. While it remains the market anchor, profit-taking from BTC’s recent performance is channeling capital into smaller altcoins like MAGACOIN FINANCE, setting the stage for the next wave of breakout candidates. Solana: Strong Ecosystem, Seeking Fresh Catalysts Solana maintains high developer engagement and ecosystem growth. Yet with price action leveling out, some traders are reallocating to emerging opportunities like MAGACOIN FINANCE in search of more dynamic returns. XRP: Diversifying for Early-Stage Upside XRP has seen renewed attention in recent months, but its current consolidation phase is prompting many holders to diversify into newer assets with clear tokenomic advantages—traits reflected strongly in MAGACOIN FINANCE’s structure and rollout. Uniswap: DeFi Traders Seek Value in New Entrants Uniswap continues to dominate decentralized exchange activity. Still, with market growth normalizing, UNI holders are branching out to early-stage projects such as MAGACOIN FINANCE, drawn by its transparent architecture and growing community base. Conclusion With a disciplined structure, transparent governance, and accelerating investor interest from across multiple major communities, MAGACOIN FINANCE is fast becoming a standout in today’s altcoin landscape. As early supporters position ahead of its next milestone, the project is increasingly viewed as one of the most compelling altcoin opportunities currently in focus. To learn more about MAGACOIN FINANCE, visit: Website: https://magacoinfinance.com Exclusive Access Portal: https://magacoinfinance.com/entry Continue Reading: Is MAGACOIN FINANCE Nearing a Major Milestone? Bitcoin and Solana Traders Follow XRP and Uniswap",Sponsored,EN,0,0,ALTCOIN|BTC|SOL|UNI|XRP,"{'name': 'BitcoinSistemi', 'img': 'https://resources.cryptocompare.com/news/81/default.png', 'lang': 'EN'}",bitcoinsistemi,2025-06-25 00:00:12
46718095,https://ambcrypto.com/?p=504787,1750809614,https://images.cryptocompare.com/news/default/ambcrypto.png,"SPX6900 gains 18% – But traders, watch out, THIS risk could ruin it all",https://ambcrypto.com/spx6900-gains-18-but-traders-watch-out-this-risk-could-ruin-it-all/,Is the memecoin facing hidden sell pressure from whales and oversupply?,Memecoins|News|News 1|Social|Trading View,EN,0,0,OTHER,"{'name': 'AMB Crypto', 'img': 'https://images.cryptocompare.com/news/default/ambcrypto.png', 'lang': 'EN'}",ambcrypto,2025-06-25 00:00:14
46718156,https://bitcoinworld.co.in/?p=171879,1750809644,https://resources.cryptocompare.com/news/82/46718156.jpeg,Polkadot ETF Faces Crucial SEC Delay: What This Means for Spot Crypto ETFs,https://bitcoinworld.co.in/polkadot-etf-sec-delay/,"BitcoinWorld Polkadot ETF Faces Crucial SEC Delay: What This Means for Spot Crypto ETFs The crypto world holds its breath once again as the U.S. Securities and Exchange Commission (SEC) has announced an extension to its review deadline for 21Shares’ proposed spot Polkadot ETF . This move, while not unexpected given the SEC’s cautious stance on novel financial products, casts a shadow of uncertainty over the immediate future of Polkadot (DOT) gaining mainstream investment access through an exchange-traded fund. Understanding the Polkadot ETF: A Gateway to Innovation? For many in the digital asset space, a Polkadot ETF represents a significant step towards broader institutional adoption and easier access for retail investors. Unlike directly buying and holding DOT cryptocurrency, an ETF would allow investors to gain exposure to Polkadot’s price movements through traditional brokerage accounts, sidestepping the complexities of crypto exchanges, wallets, and custody. Polkadot, often hailed as a ‘blockchain of blockchains,’ aims to connect various specialized blockchains (parachains) into a single, scalable, and interoperable network. This unique architecture, along with its robust governance model, makes DOT a compelling asset for diversification within the crypto landscape. A spot ETF would directly hold DOT, providing a regulated investment vehicle that mirrors the asset’s real-time price. Decoding the SEC Delay: Why the Caution? The recent SEC Delay on the 21Shares Polkadot ETF application is a familiar pattern for anyone following the crypto market. The regulatory body has consistently cited concerns regarding investor protection, market manipulation, and the nascent nature of crypto markets as reasons for postponing decisions on spot crypto ETFs. While the SEC has approved Bitcoin and Ethereum futures ETFs, and more recently, spot Bitcoin ETFs, their approach to altcoin spot ETFs remains highly conservative. The SEC’s primary mandate is to protect investors and ensure fair and orderly markets. When reviewing an ETF application, they scrutinize several factors, including: Market Surveillance: Can the underlying market (Polkadot spot market) be adequately monitored to prevent fraud and manipulation? Custody Solutions: Are the proposed custody arrangements for the underlying DOT secure and robust? Valuation Methodologies: How will the ETF accurately price its assets, especially in volatile markets? Liquidity: Is there sufficient liquidity in the Polkadot spot market to support an ETF? The delay provides the SEC with more time to deliberate on these complex issues, especially for an asset like Polkadot which, while prominent, does not have the same market depth or regulatory clarity as Bitcoin or Ethereum. The Broader Picture: Navigating the Spot Crypto ETF Landscape The journey for any Spot Crypto ETF in the U.S. has been arduous. Bitcoin’s path to a spot ETF took over a decade, marked by numerous rejections before finally gaining approval in early 2024. Ethereum’s spot ETF applications are currently under review, facing similar scrutiny. The SEC’s hesitation with altcoins like Polkadot is amplified by concerns about their classification (security vs. commodity), liquidity, and potential for market manipulation compared to the more established Bitcoin and Ethereum markets. The approval of spot Bitcoin ETFs has, however, set a precedent and arguably opened the door for other cryptocurrencies. Yet, each altcoin presents its unique set of challenges. The SEC often looks for a regulated market of significant size for the underlying asset. While Polkadot is a top-tier cryptocurrency by market capitalization, it still lacks the extensive regulatory oversight seen in traditional financial markets. 21Shares: A Pioneer in the Crypto ETF Race The firm behind this application, 21Shares , is no stranger to the crypto ETF arena. As one of the leading global issuers of cryptocurrency exchange-traded products (ETPs), 21Shares has a strong track record of bringing innovative crypto investment vehicles to market, particularly in Europe. They were among the first to launch a Bitcoin ETP in Europe and have since expanded their offerings to include various altcoins. Their partnership with Ark Invest has also been instrumental in their U.S. efforts. Their persistent efforts to bring a Polkadot ETF to the U.S. market underscore the growing institutional demand for diversified crypto exposure beyond just Bitcoin and Ethereum. 21Shares’ expertise in structuring and managing crypto ETPs provides a strong foundation for their application, but ultimately, the decision rests with the SEC’s evolving regulatory framework. What This Means for DOT Cryptocurrency and Its Ecosystem? For holders and enthusiasts of DOT Cryptocurrency , the SEC delay is a moment of pause, not necessarily a halt. While an ETF approval would undoubtedly provide a significant price catalyst due to increased institutional demand and liquidity, the Polkadot ecosystem continues to build and innovate regardless of regulatory timelines. Polkadot’s strength lies in its technical advancements, vibrant developer community, and growing number of parachains and decentralized applications. Challenges and Opportunities Ahead: Challenges: Prolonged regulatory uncertainty can deter some institutional investors. The lack of a clear classification for DOT by the SEC adds complexity. Opportunities: The delay allows the Polkadot ecosystem to mature further, addressing any potential SEC concerns regarding market integrity and liquidity. It also provides time for more education and advocacy regarding Polkadot’s unique value proposition. The market’s reaction to such delays is often muted, as they are largely anticipated. However, the long-term trajectory for Polkadot and other altcoins gaining ETF approval remains positive as the regulatory landscape gradually adapts to the digital asset revolution. Looking Ahead: The Path to Broader Adoption The SEC’s decision on the 21Shares Polkadot ETF is more than just about one asset; it’s a barometer for the broader acceptance of altcoin ETFs in the U.S. While the current delay might test patience, it also highlights the thoroughness of the regulatory process. As the crypto market matures and gains more clarity, the prospect of diverse spot crypto ETFs becoming a reality seems increasingly likely, paving the way for easier, regulated access to assets like Polkadot. The journey towards mainstream adoption is often incremental, marked by regulatory milestones and industry innovation. The Polkadot ETF saga is another chapter in this ongoing narrative, underscoring the dynamic interplay between technological advancement and regulatory oversight in the evolving world of digital finance. To learn more about the latest crypto market trends, explore our article on key developments shaping Polkadot institutional adoption. This post Polkadot ETF Faces Crucial SEC Delay: What This Means for Spot Crypto ETFs first appeared on BitcoinWorld and is written by Editorial Team",Crypto News|21Shares|CRYPTOCURRENCY|ETF|Polkadot|SEC,EN,0,0,ALTCOIN|BTC|DOT|MARKET|REGULATION,"{'name': 'Bitcoin World', 'img': 'https://resources.cryptocompare.com/news/82/default.png', 'lang': 'EN'}",bitcoinworld,2025-06-25 00:00:44
46718942,https://thecoinrise.com/pepe-pulls-back-hype-drops-below-40-but-web3-ai-raises-8-5m-as-traders-chase-1747-roi/,1750809648,https://images.cryptocompare.com/news/default/thecoinrise.png,"PEPE Pulls Back, HYPE Drops Below $40, but Web3 ai Raises $8.5M as Traders Chase 1,747% ROI!",https://thecoinrise.com/pepe-pulls-back-hype-drops-below-40-but-web3-ai-raises-8-5m-as-traders-chase-1747-roi/,"Crypto charts are full of contradictions. One moment shows a bullish setup, the next flashes a warning sign. PEPE’s price action is a clear example. A bullish flag is forming, yet a whale just offloaded 2.2 trillion tokens at a $3.5 million loss. HYPE is sending mixed messages too. Eyenovia just announced a $50 million investment, yet the token slipped below $40 as traders took profits. These patterns always seem full of promise until the momentum fades. That is why Web3 ai ($WAI) feels like a shift. It is not just reading charts, it is rewriting how we use them. With $8.5 million raised and 23.4 billion tokens sold, this platform is building substance while others drift in signals. Whale Exit Shakes Confidence as PEPE Eyes Breakout Setup The PEPE price trend is caught in a tug-of-war between bearish sentiment and a bullish chart formation. A major whale recently exited with 2.2 trillion tokens on Binance, taking a $3.5 million loss. Moves like this often suggest fading confidence and increase the odds of near-term weakness. Yet on the technical side, PEPE has formed a bullish flag on the daily chart. If the price pushes above the flag’s upper line, a move toward $0.00002051 is possible. Still, with RSI hovering near oversold and momentum stalling, bulls need confirmation before any breakout claims can hold weight. HYPE Price Slips as Market Shrugs Off $50M News Hyperliquid’s HYPE token has dropped below the $40 mark just days after a high-profile $50 million investment announcement from Eyenovia. Despite reaching a peak near $45.50, HYPE has since pulled back more than 5 percent as profit-taking and market caution take over. Eyenovia’s rebrand to Hyperion DeFi and its validator ambitions on the Hyperliquid network signal strong intent, but price action says otherwise. Open interest has declined, and technical indicators point to a stall. Unless bulls reclaim key levels above $40, this HYPE price drop could shift from a short-term dip to a deeper correction. Web3 ai Is Building the Future of Crypto Trading Before the Crowd Arrives Web3 ai looks like something designed behind closed doors for elite traders. Its AI-powered trading suite combines real-time market insights, automated risk control, smart asset tracking, and built-in scam detection. All of it lives in one unified dashboard, built to keep things efficient without losing depth. The fuel of the project is the native token, $WAI, which is still sitting at $0.000443 in Stage 9 of the AI crypto presale. The confirmed listing price is $0.005242, locking in a potential 1,747% return for early backers. More than 23.4 billion tokens have already been sold, and the project has raised $8.5 million. Momentum is clearly building, but the door is not closed yet. Most projects with this kind of utility arrive too late for early access. By the time they catch attention, the price reflects the value. Web3 ai is still in that rare window between development and mass adoption. That window is closing fast, but it is still open for now. What makes Web3 ai stand out is not just the vision but the level of traction it has secured ahead of launch. When the platform goes live, it will not wait for people to catch up. The opportunity to enter early is right now, before the utility reshapes the price for good. Looking Forward PEPE’s price is caught between warning signs and technical hope, with whale exits dragging sentiment and a bullish flag still unconfirmed. HYPE tells a similar story. Even with $50 million in backing from Eyenovia, the drop below $40 and declining open interest reveal hesitation that charts alone cannot explain. Web3 ai offers a different path. No sudden swings or breakout guessing games. Just clear traction with $8.5 million raised and 23.4 billion tokens sold. With a potential 1747% return baked in, it stands out as one of the best crypto coins for 2025 gains. In this market, clarity wins. Join Web3 ai Now: Website: http://web3ai.com/ Telegram: https://t.me/Web3Ai_Token X: https://x.com/Web3Ai_Token Instagram: https://www.instagram.com/web3ai_token The post PEPE Pulls Back, HYPE Drops Below $40, but Web3 ai Raises $8.5M as Traders Chase 1,747% ROI! appeared first on TheCoinrise.com .",Token Presale and ICO Insights|Web3,EN,0,0,EXCHANGE|MARKET|TRADING|BNB|PEPE,"{'name': 'The Coin Rise', 'img': 'https://images.cryptocompare.com/news/default/thecoinrise.png', 'lang': 'EN'}",thecoinrise,2025-06-25 00:00:48
46718070,https://www.newsbtc.com/?p=776976,1750809654,https://resources.cryptocompare.com/news/21/46718070.jpeg,"XRP Pullback Nearly Complete—Next Stop: $8 To $12, Says Analyst",https://www.newsbtc.com/xrp-news/xrp-pullback-nearly-complete-next-stop-12/,"The cryptocurrency market’s sharp retracement may be approaching its denouement, according to prominent trader and YouTuber CryptoInsightUK, who told his followers on 23 June that XRP is “really flipping close” to completing the final leg of a corrective structure that began in early April. Final Trap Or Final Chance For XRP? In his latest video analysis, the analyst sketched a scenario in which Bitcoin grinds lower toward the $92,000–$95,000 liquidity pocket “to sweep the last standing bids,” dragging major altcoins with it. “We’ve had the extra bit of flush down that we were talking about and looking for,” he said, noting that Bitcoin already wicked to $98,200 but has yet to produce the higher-low/higher-high sequence or the bullish RSI divergence that stamped the April capitulation bottom. “I think we’re close to a bottom. I don’t quite think we’re there.” Related Reading: XRP To $30 Beyond 2026? Analyst Reveals Key BTC Ratio To Watch XRP, he argues, is tracing the same pattern at a different scale. The 4-hour chart shows a conspicuous liquidity shelf at $1.89 and a deeper block stretching to $1.73. “In a world where Bitcoin does get the flush to ninety,” he observed, “could we come and take that? Yes. … Maybe $1.85, potentially on a wick.” Although he concedes a tail-risk dip toward $1.60–$1.55, that move is “not my base case.” What makes the area compelling, in CryptoInsightUK’s view, is the clustering of spot demand on each successive stab lower. He highlighted the “big red bar” of sell-side volume that marked last week’s sweep and the immediate spike in spot bids, calling it evidence of “real accumulation rather than derivative games.” Funding rates across major venues have turned modestly positive, confirming that “people are going long,” a dynamic that could yet trigger one more liquidity vacuum as over-leveraged latecomers are forced out. Related Reading: XRP Price At Risk Of 20% Crash To $1.55 If This Level Fails To Hold Springboard For $11 XRP? Technically, the trader is watching for a textbook bullish divergence: price carves a marginally lower low while the 4-hour RSI prints a higher one, mirroring the set-up that preceded April’s 140% rally. The fixed-range volume profile on Bitcoin—where the point of control sits near $97,000—offers confluence, suggesting the broader market is attempting to base on a major support shelf before rotation into altcoins. If that pattern holds, CryptoInsightUK believes XRP is positioned for a “drastic” expansionary phase that would lift the token first to the oft-cited $8 target and then, in an over-extension, to “realistically $11 to $12.” From an idealised $1.85 entry the projection implies an upside of roughly 475%. “I put my neck on the line,” he said. “Everyone’s thinking eight. I think we over-extend that a little bit.” The analyst’s conviction rests in part on his read of Bitcoin dominance, now hovering in what he calls the “reversal box.” A final push to the upper edge could spark the long-awaited altseason, he argued, with XRP—as a large-cap, high-beta play—capturing disproportionate flows once Bitcoin volatility subsides. At press time, XRP traded at $2.1781. Featured image created with DALL.E, chart from TradingView.com",XRP News|xrp|XRP Price|XRP Price Analysis|XRP price news|XRP Technical Analysis,EN,0,0,ALTCOIN|BTC|MARKET|TRADING|XRP,"{'name': 'NewsBTC', 'img': 'https://images.cryptocompare.com/news/default/newsbtc.png', 'lang': 'EN'}",newsbtc,2025-06-25 00:00:54
46718062,https://dailyhodl.com/?p=335708,1750809655,https://images.cryptocompare.com/news/default/dailyhodl.png,"Crypto Analyst Benjamin Cowen Predicts Multi-Month Correction for Bitcoin, Says Time To Rip Band-Aid Off for Altcoins",https://dailyhodl.com/2025/06/24/crypto-analyst-benjamin-cowen-predicts-multi-month-correction-for-bitcoin-says-time-to-rip-band-aid-off-for-altcoins/,"A trader who continues to build a following with timely calls on Bitcoin ( BTC ) and altcoins is issuing a warning on the broader crypto market. Crypto analyst Benjamin Cowen tells his 1 million followers on the social media platform X that he sees Bitcoin breaking support at $100,000. “Will likely see BTC back at its bull market support band soon, back in the mid-$90,000 range.” Source: Benjamin Cowen/X The bull market support band is formed by the 20-week simple moving average (SMA) and the 21-week exponential moving average (EMA). The analyst says his prediction is based on Bitcoin’s price action in the last two years, when Bitcoin started to roll over and gave up gains in the third quarter. “I’ve mentioned for a while on Youtube that Bitcoin would likely start exhibiting some weakness around mid-June as the Q3 weakness starts to present itself. The same thing happened the last couple of years. I think the next low is around August/September.” Source: Benjamin Cowen/X At time of writing, Bitcoin is trading for $105,092. Looking at the altcoin market, Cowen warns that his expected Bitcoin correction will trigger a brutal capitulation event for alts. “It may be finally time to rip the band-aid off for ALT / BTC pairs. To the range lows!” Source: Benjamin Cowen/X A bearish altcoin versus Bitcoin chart indicates that alts are losing value faster than BTC. Follow us on X , Facebook and Telegram Don't Miss a Beat – Subscribe to get email alerts delivered directly to your inbox Check Price Action Surf The Daily Hodl Mix Disclaimer: Opinions expressed at The Daily Hodl are not investment advice. Investors should do their due diligence before making any high-risk investments in Bitcoin, cryptocurrency or digital assets. Please be advised that your transfers and trades are at your own risk, and any losses you may incur are your responsibility. The Daily Hodl does not recommend the buying or selling of any cryptocurrencies or digital assets, nor is The Daily Hodl an investment advisor. Please note that The Daily Hodl participates in affiliate marketing. Generated Image: Midjourney The post Crypto Analyst Benjamin Cowen Predicts Multi-Month Correction for Bitcoin, Says Time To Rip Band-Aid Off for Altcoins appeared first on The Daily Hodl .",Altcoins|Bitcoin|Trading|altcoins|alts|BTC|News|trading,EN,0,0,ALTCOIN|BTC|BUSINESS|MARKET|TRADING,"{'name': 'The Daily Hodl', 'img': 'https://images.cryptocompare.com/news/default/dailyhodl.png', 'lang': 'EN'}",dailyhodl,2025-06-25 00:00:55
46718352,https://u.today/solana-sol-golden-cross-canceled-xrp-key-breakthrough-incoming-shiba-inu-shib-reveals-key-pattern,1750809660,https://resources.cryptocompare.com/news/64/46718352.jpeg,"Solana (SOL) Golden Cross Cancelled, XRP Key Breakthrough is Incoming, Shiba Inu (SHIB) Reveals Key Pattern",https://u.today/solana-sol-golden-cross-canceled-xrp-key-breakthrough-incoming-shiba-inu-shib-reveals-key-pattern,Potential point of reversal for cryptocurrency market,Shiba Inu,EN,0,0,MARKET|SHIB|SOL|XRP,"{'name': 'U.Today', 'img': 'https://images.cryptocompare.com/news/default/utoday.png', 'lang': 'EN'}",utoday,2025-06-25 00:01:00
46718092,https://decrypt.co/?p=326856,1750809662,https://resources.cryptocompare.com/news/44/46718092.jpeg,Norwegian Mineral Mining Firm Eyes $1.2 Billion Raise for Bitcoin Treasury,https://decrypt.co/326856/norwegian-mineral-mining-firm-1-2-billion-raise-bitcoin-treasury,Green Minerals has adopted the Bitcoin treasury strategy as a step towards broader blockchain implementation.,|Business,EN,0,0,BLOCKCHAIN|BTC|BUSINESS|MINING|REGULATION,"{'name': 'Decrypt', 'img': 'https://images.cryptocompare.com/news/default/decrypt.png', 'lang': 'EN'}",decrypt,2025-06-25 00:01:02
46718279,https://decrypt.co/?p=326858,1750809839,https://resources.cryptocompare.com/news/44/46718279.jpeg,NYSE Files for Rule Change to List Trump Bitcoin Ethereum ETF,https://decrypt.co/326858/nyse-files-rule-change-list-trump-bitcoin-ethereum-etf,NYSE applied for a rule change enabling the listing of a BTC-ETH ETF proposed by President Donald Trump’s media and tech company.,||Business,EN,0,0,BTC|BUSINESS|ETH|REGULATION,"{'name': 'Decrypt', 'img': 'https://images.cryptocompare.com/news/default/decrypt.png', 'lang': 'EN'}",decrypt,2025-06-25 00:03:59
46718432,https://en.coin-turk.com/?p=195651,1750809979,https://resources.cryptocompare.com/news/79/46718432.jpeg,ProCap BTC Bu Büyük Bitcoin Hamlesiyle Dikkatleri Üzerine Çekiyor,https://en.coin-turk.com/procap-btc-bu-buyuk-bitcoin-hamlesiyle-dikkatleri-uzerine-cekiyor/,"ProCap BTC acquired 3,724 Bitcoins, investing approximately $386 million. The company is merging with Columbus Circle Capital Corp. Continue Reading: ProCap BTC Bu Büyük Bitcoin Hamlesiyle Dikkatleri Üzerine Çekiyor The post ProCap BTC Bu Büyük Bitcoin Hamlesiyle Dikkatleri Üzerine Çekiyor appeared first on COINTURK NEWS .",Cryptocurrency News,EN,0,0,BTC,"{'name': 'CoinTurk News', 'img': 'https://resources.cryptocompare.com/news/79/default.png', 'lang': 'EN'}",cointurken,2025-06-25 00:06:19
