id,guid,published_on,imageurl,title,url,body,tags,lang,upvotes,downvotes,categories,source_info,source,date
46715481,https://en.coin-turk.com/?p=195648,1750806380,https://resources.cryptocompare.com/news/79/46715481.jpeg,Cardone Capital Adds Bitcoin to Real Estate Portfolio in Bold Strategic Move,https://en.coin-turk.com/cardone-capital-adds-bitcoin-to-real-estate-portfolio-in-bold-strategic-move/,"Cardone Capital integrates Bitcoin, investing 1,000 BTC worth approximately $105.4 million. The firm plans to add 3,000 more Bitcoins by year's end, targeting diversified growth. Continue Reading: Cardone Capital Adds Bitcoin to Real Estate Portfolio in Bold Strategic Move The post Cardone Capital Adds Bitcoin to Real Estate Portfolio in Bold Strategic Move appeared first on COINTURK NEWS .",Cryptocurrency News,EN,0,0,BTC,"{'name': 'CoinTurk News', 'img': 'https://resources.cryptocompare.com/news/79/default.png', 'lang': 'EN'}",cointurken,2025-06-24 23:06:20
46715644,https://en.coinotag.com/ripple-lawsuit-delays-may-impact-xrp-price-amid-rising-interest-in-little-pepe-meme-coin-presale/,1750806642,https://resources.cryptocompare.com/news/77/46715644.jpeg,Ripple Lawsuit Delays May Impact XRP Price Amid Rising Interest in Little Pepe Meme Coin Presale,https://en.coinotag.com/ripple-lawsuit-delays-may-impact-xrp-price-amid-rising-interest-in-little-pepe-meme-coin-presale/,"The ongoing Ripple-SEC lawsuit sees fresh developments as Ripple faces accusations of delaying proceedings, while the meme coin Little Pepe (LILPEPE) gains momentum with a nearly $4 million presale. Little",News|Ripple|PEPE|XRP,EN,0,0,TRADING|XRP|PEPE,"{'name': 'CoinOtag', 'img': 'https://resources.cryptocompare.com/news/77/default.png', 'lang': 'EN'}",coinotag,2025-06-24 23:10:42
46715610,https://bitcoinworld.co.in/?p=171852,1750806647,https://resources.cryptocompare.com/news/82/46715610.jpeg,Chainlink Mastercard Partnership: Revolutionary Leap for On-Chain Crypto Purchases,https://bitcoinworld.co.in/chainlink-mastercard-crypto-payments/,"BitcoinWorld Chainlink Mastercard Partnership: Revolutionary Leap for On-Chain Crypto Purchases The world of cryptocurrency is constantly evolving, pushing the boundaries of traditional finance. A recent announcement has sent ripples of excitement across the digital asset landscape: a groundbreaking Chainlink Mastercard partnership . This collaboration promises to open up direct on-chain crypto purchases for a staggering 3 billion Mastercard users, according to insights shared by crypto platform Unfolded on X. This isn’t just another integration; it’s a monumental step towards mainstream cryptocurrency adoption , potentially reshaping how billions interact with digital assets. The Chainlink Mastercard Partnership: Bridging Traditional Finance and Web3 Imagine a world where buying cryptocurrency is as straightforward as any online purchase, directly from your bank account or credit card, and instantly on the blockchain. This is the vision the Chainlink Mastercard partnership aims to realize. For too long, the process of acquiring cryptocurrencies has been complex for many, often involving multiple steps, third-party exchanges, and concerns about custody. Chainlink, a leading decentralized oracle network, plays a pivotal role in this integration. Its secure and reliable infrastructure is essential for connecting real-world data and traditional payment systems to blockchain networks. Mastercard, a global payments giant, brings its immense network and user base to the table. This synergy is designed to simplify the user experience dramatically, allowing individuals to acquire digital assets directly on a blockchain without needing to navigate complex exchange interfaces or worry about off-chain custody risks. This partnership signifies a profound shift in Mastercard’s strategy, moving beyond just facilitating crypto transactions through third parties to enabling direct interaction with on-chain assets. It’s a clear signal that traditional financial powerhouses recognize the inevitability and potential of blockchain technology. Revolutionizing On-Chain Crypto Purchases: What Does It Mean for You? The core of this partnership lies in enabling direct on-chain crypto purchases . But what exactly does ‘on-chain’ mean, and why is it significant for the average user? Direct Ownership: When you purchase crypto directly on-chain, the assets are immediately transferred to a blockchain address you control (your wallet). This means you have direct custody of your funds, eliminating the need to trust a third-party exchange with your assets. Enhanced Security: By leveraging Chainlink’s robust oracle services, the process of connecting traditional payment rails to the blockchain is secured and verified, minimizing risks associated with data integrity and transaction execution. Streamlined Experience: The goal is to make the buying process as seamless as possible. Instead of depositing fiat into an exchange, converting it, and then withdrawing to a personal wallet, users could potentially buy crypto and have it delivered directly to their chosen on-chain address. Consider the typical journey of buying crypto today versus the potential future with this partnership: Current Crypto Purchase Method (Typical) Future with Chainlink Mastercard Partnership (Potential) Sign up for a centralized exchange (CEX). Utilize a Mastercard-enabled interface (e.g., dApp, wallet service). Complete KYC/AML verification. Leverage existing Mastercard verification processes. Deposit fiat currency to the CEX. Directly pay with Mastercard. Place a buy order for desired cryptocurrency. Initiate an on-chain purchase transaction. Crypto held by the CEX (custodial). Crypto sent directly to your self-custody wallet (non-custodial). Optional: Withdraw crypto to personal wallet. No withdrawal step needed; it’s already on-chain. This simplification is a game-changer, reducing barriers for new users and providing greater control for existing crypto holders. Accelerating Cryptocurrency Adoption: A Major Milestone? The scale of this collaboration cannot be overstated. With access to nearly 3 billion Mastercard users, this partnership has the potential to dramatically accelerate cryptocurrency adoption on a global scale. What makes this so impactful? Mass Market Accessibility: Mastercard’s reach extends to virtually every corner of the globe, bringing crypto within reach of billions who might otherwise find it inaccessible or intimidating. Trust and Legitimacy: A major financial institution like Mastercard endorsing and integrating direct crypto purchases lends significant credibility to the digital asset space, potentially easing concerns for traditional investors and consumers. Reduced Friction: By simplifying the on-ramp process, the partnership removes a significant hurdle for new users, making it easier for them to experiment with and eventually embrace cryptocurrencies. Institutional Confidence: Such high-profile collaborations signal to other financial institutions that engaging with blockchain and digital assets is not just viable but necessary for future growth. This move positions Mastercard and Chainlink at the forefront of a financial revolution, transforming niche technology into a mainstream utility. It’s a clear indication that the financial world is moving beyond simply acknowledging crypto to actively integrating it into its core services. Web3 Innovation at the Forefront: Shaping the Decentralized Future This partnership is not just about buying crypto; it’s a significant leap forward for Web3 innovation . Web3 envisions a decentralized internet where users have more control over their data and digital assets, powered by blockchain technology. This collaboration perfectly aligns with that vision by enabling direct, user-controlled access to digital assets on a decentralized network. Chainlink’s role as the secure middleware is crucial here. As a decentralized oracle network, it provides the reliable, tamper-proof data feeds and connectivity that smart contracts need to interact with real-world events and traditional systems. This capability is fundamental for bridging the gap between the existing financial infrastructure and the burgeoning decentralized applications (dApps) of Web3. The implications extend beyond simple purchases: Enhanced DeFi Access: Easier on-ramps mean more users can participate in decentralized finance protocols, lending, borrowing, and yield farming. NFT Market Growth: Simplified access to cryptocurrencies could fuel further growth in the NFT market, making it easier for users to acquire the necessary crypto to purchase digital collectibles. New Use Cases: The seamless integration could pave the way for entirely new types of decentralized applications that require real-world payment interactions. This initiative underscores the growing synergy between established corporations and cutting-edge blockchain protocols, demonstrating how Web3 technologies can be integrated into everyday life. Unlocking Seamless Digital Asset Payments for Billions The ultimate goal of this partnership is to unlock seamless digital asset payments for a global audience. While the initial focus is on purchasing crypto, the underlying infrastructure and simplified user experience could pave the way for broader applications. Imagine using your Mastercard to pay for goods and services directly with cryptocurrency, without complex conversions or delays. While not explicitly part of this initial announcement, the foundation being laid for direct on-chain interaction suggests a future where digital assets are as liquid and usable as traditional fiat currency. The partnership could facilitate: Cross-Border Payments: Leveraging blockchain’s efficiency for international transactions, potentially reducing costs and settlement times. Merchant Adoption: If users can easily acquire and hold crypto, merchants might be more inclined to accept it as a form of payment. Financial Inclusion: In regions with less developed traditional banking infrastructure, direct access to digital assets could provide new financial opportunities. By making the entry point to crypto incredibly simple, Chainlink and Mastercard are not just selling a product; they are building a bridge to a more interconnected and digitally native financial future. Challenges and the Road Ahead While the prospects are exciting, implementing such a large-scale integration comes with its own set of challenges: Regulatory Landscape: The global regulatory environment for cryptocurrencies is still evolving. Navigating different jurisdictions’ rules will be crucial for widespread adoption. Scalability: Ensuring that blockchain networks can handle the immense transaction volume from 3 billion potential users will require robust scaling solutions. User Education: Despite simplification, educating a broad user base about self-custody, blockchain security, and the nuances of digital assets remains vital. Technical Integration: Seamlessly integrating complex traditional payment systems with decentralized blockchain protocols is a significant technical undertaking. However, the commitment from both Chainlink and Mastercard suggests a long-term vision and a willingness to overcome these hurdles. Their combined expertise positions them well to address these challenges head-on. The Impact: What This Means for the Crypto Ecosystem This collaboration is a clear win for several key players and the broader crypto ecosystem: For Chainlink: It significantly enhances its utility and validates its position as the industry-standard oracle network, driving demand for its services and potentially its native token. For Mastercard: It solidifies its position as an innovator in the financial sector, ensuring its relevance in the rapidly expanding digital economy and potentially attracting a new generation of users. For Users: Unprecedented ease of access to digital assets, empowering individuals with greater financial autonomy and participation in the decentralized economy. For the Crypto Market: Increased liquidity, stability, and legitimacy, potentially attracting more institutional investment and reducing market volatility over time. Conclusion: A New Horizon for Digital Assets The Chainlink Mastercard partnership marks a truly transformative moment for the cryptocurrency world. By enabling direct on-chain crypto purchases for billions of users, it is not merely simplifying a transaction; it is fundamentally reshaping the landscape of cryptocurrency adoption . This strategic alliance represents a powerful fusion of traditional financial might and cutting-edge Web3 innovation , paving the way for seamless digital asset payments that could soon become commonplace. As the lines between traditional finance and decentralized technology continue to blur, this partnership stands as a beacon, guiding us towards a more accessible, integrated, and decentralized financial future. To learn more about the latest crypto market trends, explore our article on key developments shaping cryptocurrency institutional adoption. This post Chainlink Mastercard Partnership: Revolutionary Leap for On-Chain Crypto Purchases first appeared on BitcoinWorld and is written by Editorial Team",Crypto News|Chainlink|CRYPTOCURRENCY|MASTERCARD|Payments|Web3,EN,0,0,BLOCKCHAIN|EXCHANGE|FIAT|LINK|MARKET,"{'name': 'Bitcoin World', 'img': 'https://resources.cryptocompare.com/news/82/default.png', 'lang': 'EN'}",bitcoinworld,2025-06-24 23:10:47
46716034,https://en.coinotag.com/xrps-missed-potential-highlights-growing-interest-in-qubetics-as-a-popular-crypto-coin-to-buy/,1750807078,https://resources.cryptocompare.com/news/77/46716034.jpeg,XRP’s Missed Potential Highlights Growing Interest in Qubetics as a Popular Crypto Coin to Buy,https://en.coinotag.com/xrps-missed-potential-highlights-growing-interest-in-qubetics-as-a-popular-crypto-coin-to-buy/,"Qubetics ($TICS) is rapidly emerging as the next popular crypto coin to buy, offering innovative solutions that address the limitations faced by XRP in the evolving digital finance landscape. While",News|Core|XRP,EN,0,0,XRP,"{'name': 'CoinOtag', 'img': 'https://resources.cryptocompare.com/news/77/default.png', 'lang': 'EN'}",coinotag,2025-06-24 23:17:58
46716128,https://bitcoinworld.co.in/?p=171859,1750807245,https://resources.cryptocompare.com/news/82/46716128.jpeg,Jerome Powell’s Clear Stance: Banks Can Offer Pivotal Crypto Services Safely,https://bitcoinworld.co.in/powell-bank-crypto-services/,"BitcoinWorld Jerome Powell’s Clear Stance: Banks Can Offer Pivotal Crypto Services Safely The world of finance is constantly evolving, and the integration of cryptocurrencies into traditional banking systems has been a topic of intense debate and cautious optimism. For institutions and individuals alike, a clear signal from top regulators can make all the difference. Recently, a significant statement from Jerome Powell , Chairman of the U.S. Federal Reserve, has sent ripples through both the banking and crypto sectors, offering much-needed clarity on the path forward for crypto services within established financial frameworks. What Did Jerome Powell Say About Bank Crypto Adoption? In a pivotal moment for the industry, U.S. Federal Reserve Chairman Jerome Powell explicitly stated that banks are indeed permitted to offer services to the crypto industry and engage in related activities. This isn’t a blanket endorsement without caveats, however. The crucial condition, as reported by PiQSuite on X, is that these activities must ensure the “safety and soundness of the financial system.” This statement marks a significant step, moving beyond mere acknowledgment to a qualified approval, provided the necessary precautions are in place. For years, traditional banks have approached the burgeoning digital asset space with extreme caution, often due to a lack of clear regulatory guidance. This ambiguity created a challenging environment for both banks wanting to innovate and crypto companies seeking legitimate financial partners. Powell’s recent remarks provide a foundational understanding: Permission Granted: Banks can actively engage with the crypto industry. Conditional Engagement: All activities must uphold the safety and soundness of the financial system. Clearer Path: This offers a more defined regulatory stance compared to previous general warnings. This clarity is vital for fostering responsible innovation while mitigating potential risks, setting a precedent for how traditional finance can embrace digital assets. Unlocking Bank Crypto Adoption: The Green Light for Financial Institutions The Federal Reserve’s stance, articulated by Jerome Powell , essentially gives a green light for bank crypto adoption, provided it’s done responsibly. This isn’t just about banks offering basic services like holding crypto assets; it opens the door for a much broader range of activities. Consider the potential benefits for financial institutions: Benefit for Banks Description New Revenue Streams Offering custody, trading, and lending services for digital assets can tap into a growing market. Client Retention & Acquisition Meeting the evolving demands of tech-savvy clients and attracting new ones interested in crypto. Competitive Edge Staying ahead of fintech companies and other traditional institutions by embracing innovation. Enhanced Product Offerings Integrating digital assets into existing portfolios, potentially creating hybrid financial products. This strategic move allows banks to capture a share of the rapidly expanding digital asset market, which has largely operated outside the traditional banking system. By providing regulated avenues for crypto engagement, banks can enhance trust and security for investors, potentially reducing the risks associated with unregulated platforms. This also means that more mainstream investors might feel comfortable venturing into crypto, knowing their assets are handled by regulated entities. Ensuring Financial Stability: The Fed’s Prudent Approach to Crypto Services The caveat about ensuring “safety and soundness” is paramount and reflects the Federal Reserve’s core mandate: maintaining financial stability . While open to innovation, the Fed remains acutely aware of the potential risks that digital assets, with their inherent volatility and novel technological underpinnings, could pose to the broader financial system. The phrase “safety and soundness” is not new; it’s a bedrock principle of banking regulation, encompassing: Operational Resilience: Ensuring systems are robust against cyberattacks, technical failures, and human error. Risk Management: Implementing stringent controls for market, credit, liquidity, and operational risks associated with crypto. Consumer Protection: Safeguarding customer funds and data, and ensuring transparent disclosures. Anti-Money Laundering (AML) & Counter-Terrorist Financing (CTF): Preventing illicit use of digital assets. This cautious yet progressive stance indicates that the Fed is not looking to stifle innovation but rather to guide it within a secure framework. Banks engaging in crypto services will be expected to demonstrate robust capabilities in these areas, likely requiring significant investment in technology, expertise, and compliance infrastructure. The regulatory bodies, including the Federal Reserve, OCC, and FDIC, are expected to continue collaborating to develop comprehensive guidelines that address these concerns, ensuring a harmonized approach to digital asset oversight. Navigating the Landscape of Crypto Regulation: Challenges and Opportunities While Jerome Powell ‘s statement offers a positive outlook, the path to full-scale crypto regulation and integration for banks is not without its challenges. The fragmented nature of U.S. regulatory oversight, where multiple agencies have jurisdiction over different aspects of digital assets, can create complexity. Banks must navigate a labyrinth of existing and evolving rules, including: Licensing and Approvals: Obtaining necessary permissions from various state and federal regulators. Compliance Costs: Significant investment in technology and personnel to meet AML, KYC, and other regulatory requirements specific to crypto. Technological Integration: Safely integrating blockchain technology and crypto infrastructure with legacy banking systems. Volatility Management: Developing strategies to manage the extreme price fluctuations inherent in crypto assets, which can impact balance sheets and capital requirements. Cybersecurity Risks: Protecting digital assets from hacks, theft, and other cyber threats, which are particularly prevalent in the crypto space. Despite these hurdles, the opportunities are immense. A clear regulatory framework fosters greater institutional participation, leading to increased liquidity, reduced market manipulation, and ultimately, greater legitimacy for the entire crypto ecosystem. Banks that successfully navigate these challenges will be well-positioned to become leaders in the digital finance era, offering secure and compliant access to a new class of assets. The Future of Banking and Digital Assets: A Converging Path The pronouncement from Jerome Powell is more than just a statement; it’s an acknowledgment of the inevitability of digital assets in the financial landscape. It signals a future where traditional banking and the crypto world are not separate entities but rather converging paths. This convergence could lead to: Hybrid Financial Products: Blending traditional securities with tokenized assets, offering new investment opportunities. Improved Payment Systems: Leveraging blockchain for faster, cheaper cross-border payments. Enhanced Financial Inclusion: Providing access to financial services for underserved populations through digital channels. Innovation in Lending and Borrowing: Exploring decentralized finance (DeFi) principles within a regulated environment. This evolving landscape will require ongoing dialogue between regulators, financial institutions, and crypto innovators. The goal is to build a robust, secure, and efficient financial system that leverages the benefits of digital assets while safeguarding against their inherent risks. The emphasis on financial stability means that any integration will be methodical and data-driven, rather than rushed or reckless. Actionable Insights for the Evolving Market For various stakeholders, Jerome Powell ‘s remarks offer important takeaways: For Banks: Begin or accelerate your strategic assessment of crypto opportunities. Focus on building robust compliance frameworks, investing in cybersecurity, and developing in-house expertise. Consider pilot programs or partnerships with established crypto firms. For Crypto Companies: Continue to prioritize regulatory compliance and build strong relationships with traditional financial institutions. Demonstrate your commitment to security, transparency, and consumer protection to attract banking partners. For Regulators: Continue to provide clear, consistent, and adaptable guidance. Foster innovation while upholding the core principles of financial stability and consumer protection. For Investors: Be aware that increased institutional participation could bring more stability and legitimacy to the crypto markets, but also understand that regulatory oversight will shape which assets and services are available through traditional channels. The journey towards full integration will be incremental, but the direction is clear: digital assets are here to stay, and traditional finance is finding its way to responsibly embrace them. Conclusion: A New Era for Bank Crypto Integration The recent statement from U.S. Federal Reserve Chairman Jerome Powell represents a landmark moment in the ongoing convergence of traditional finance and the cryptocurrency world. By affirming that banks can offer crypto services under the crucial condition of ensuring “safety and soundness,” Powell has provided much-needed clarity and a foundational framework for responsible innovation. This guidance is a powerful signal that the Federal Reserve, while cautious, is committed to allowing regulated entities to participate in the digital asset economy, ultimately fostering greater financial stability and consumer protection. While significant challenges remain in terms of crypto regulation , compliance, and technological integration, the path forward is now clearer. Banks are empowered to explore new revenue streams and enhance their offerings, while the crypto industry gains further legitimacy and access to mainstream financial infrastructure. This is not merely an allowance but an invitation for the financial sector to evolve, adapt, and build a more inclusive and technologically advanced future, all while upholding the integrity of the financial system. To learn more about the latest crypto market trends, explore our article on key developments shaping digital asset institutional adoption. This post Jerome Powell’s Clear Stance: Banks Can Offer Pivotal Crypto Services Safely first appeared on BitcoinWorld and is written by Editorial Team",Crypto News|Crypto Banking|Digital Assets|Federal Reserve|Financial Regulation|US crypto policy,EN,0,0,BUSINESS|FIAT|MARKET|REGULATION|TECHNOLOGY,"{'name': 'Bitcoin World', 'img': 'https://resources.cryptocompare.com/news/82/default.png', 'lang': 'EN'}",bitcoinworld,2025-06-24 23:20:45
