id,guid,published_on,imageurl,title,url,body,tags,lang,upvotes,downvotes,categories,source_info,source,date
46720035,https://bitcoinworld.co.in/?p=171894,1750812031,https://resources.cryptocompare.com/news/82/46720035.jpeg,USDC Minted: Unpacking the Staggering $250 Million Treasury Boost,https://bitcoinworld.co.in/usdc-minted-treasury-boost/,"BitcoinWorld USDC Minted: Unpacking the Staggering $250 Million Treasury Boost In the ever-evolving landscape of digital finance, significant movements of capital often signal underlying shifts in market dynamics. A recent report from Whale Alert caught the attention of many, confirming that a substantial USDC minted event has occurred: 250 million USDC was generated at the USDC Treasury. This isn’t just a number; it’s a critical indicator that warrants a deeper dive into what it means for the broader cryptocurrency market . Such a large injection of a leading stablecoin into the ecosystem can have profound implications, from liquidity boosts to potential market rallies. Understanding the Surge: Why is USDC Minted in Such Volumes? When 250 million USDC is minted , it’s a direct response to demand. USDC, or USD Coin, is a stablecoin pegged 1:1 to the US dollar, backed by fully reserved assets. It’s issued by Circle and Coinbase through the Centre consortium. The act of minting new USDC typically signifies a few key things: Increased Demand for Liquidity: As more users and institutions enter the crypto space, there’s a growing need for stable, reliable digital dollars to facilitate trading, lending, and borrowing within decentralized finance (DeFi) protocols. On-Ramp for Fiat: New USDC is often minted when users deposit fiat currency into exchanges or platforms that support USDC, effectively converting traditional money into its digital equivalent. This acts as a crucial bridge between conventional finance and the crypto world. DeFi Growth and Usage: The burgeoning DeFi sector relies heavily on stablecoins. More USDC means more capital available for yield farming, liquidity provision, and collateralization, driving further innovation and activity within the decentralized ecosystem. Institutional Interest: Large-scale institutional investors often prefer stablecoins like USDC for their perceived stability and regulatory compliance compared to more volatile cryptocurrencies. A significant minting event could reflect increased institutional capital flowing into the market. This substantial minting operation suggests a robust appetite for dollar-pegged digital assets, underpinning the continuous expansion and maturation of the digital economy. Decoding Stablecoin Supply Dynamics: What Does This Mean for the Ecosystem? The growth in stablecoin supply is a vital metric for understanding the health and potential trajectory of the crypto market. Stablecoins serve as the lifeblood of the digital asset economy, providing a stable medium of exchange and a safe haven during periods of volatility. An increase in stablecoin supply, particularly of a well-regarded asset like USDC, often indicates a readiness for capital deployment within the market. The Role of Stablecoins in Market Liquidity: Increased stablecoin availability translates directly into enhanced market liquidity. This means: Easier Trading: Traders can move in and out of volatile assets more efficiently, reducing slippage and improving price discovery. Deeper Order Books: More stablecoins on exchanges lead to deeper order books, making it easier to execute large trades without significantly impacting prices. Fueling DeFi Protocols: Lending platforms, decentralized exchanges (DEXs), and other DeFi applications thrive on stablecoin liquidity. More USDC allows these protocols to offer better rates and more robust services. Historically, significant increases in stablecoin market capitalization have often preceded periods of upward price movement in the broader cryptocurrency market , as this capital is eventually deployed into Bitcoin, Ethereum, and altcoins. While not a guaranteed predictor, it’s a strong indicator of potential buying power. Impact on Crypto Market Trends : Will Liquidity Drive New Peaks? The injection of 250 million USDC is a notable event that can influence prevailing crypto market trends . When such a large amount of stablecoin is minted, it signifies that new capital is entering the ecosystem, or existing capital is being repositioned into a stable asset, poised for future deployment. This influx of liquidity often acts as a precursor to increased trading activity and, potentially, price appreciation across various digital assets. Potential Market Implications: Bitcoin and Ethereum: A substantial increase in USDC supply could signal a build-up of buying pressure for major cryptocurrencies. Traders often use stablecoins to accumulate positions before making significant buys into Bitcoin or Ethereum, anticipating future gains. Altcoin Season Potential: Enhanced liquidity from stablecoins can also flow into the altcoin market, potentially fueling an ‘altcoin season’ where smaller cap assets experience significant rallies. Reduced Volatility (in the short term): The availability of stablecoins can sometimes help cushion market downturns, as traders can quickly convert volatile assets into USDC, reducing panic selling pressure. However, it’s crucial to remember that while increased stablecoin supply provides the ammunition for market movements, actual price action depends on a confluence of factors, including macroeconomic conditions, regulatory developments, and overall market sentiment. This USDC minted event is a positive sign of underlying demand, but not a standalone guarantee of immediate bullish trends. The Role of Whale Alert : Enhancing Transparency in a Volatile Market The news of the 250 million USDC minted transaction came to light thanks to Whale Alert, a popular blockchain tracking and analytics service. Whale Alert plays a crucial role in the transparency of the cryptocurrency space by monitoring and reporting large transactions across various blockchains. This service is invaluable for several reasons: Market Insight: By tracking ‘whale’ movements (large transactions), Whale Alert provides real-time insights into significant capital flows, which can inform trading strategies and market analysis. Transparency and Accountability: In a relatively nascent and often opaque market, Whale Alert helps bring transparency by making large, otherwise obscure, transactions visible to the public. This contributes to a more informed and accountable ecosystem. Early Warning System: Unusual or large transfers, whether of stablecoins or volatile assets, can sometimes precede significant market events, serving as an early warning for traders and investors. The fact that Whale Alert promptly reported this USDC minted transaction underscores its importance in providing critical data points that help market participants understand the ongoing dynamics and potential future directions of the cryptocurrency market . Beyond the Numbers: The Broader Implications for the Cryptocurrency Market The consistent demand for stablecoins like USDC, evidenced by significant minting events, highlights their growing integration into the global financial infrastructure. This isn’t just about crypto trading; it’s about the broader implications for digital payments, cross-border transactions, and the future of finance. Challenges and Opportunities: Regulatory Scrutiny: As stablecoins gain prominence, they attract increasing attention from regulators worldwide. The challenge lies in navigating evolving regulations while maintaining decentralization and innovation. The backing and transparency of USDC are key factors in its regulatory appeal. Centralization Concerns: While stablecoins offer stability, their centralized issuance and backing by traditional assets raise questions about censorship resistance and true decentralization, a core tenet of blockchain technology. Competition: The stablecoin market is competitive, with USDT, DAI, and others vying for market share. USDC’s continued growth reflects its strong position, but innovation and adherence to best practices are crucial for long-term success. Despite these challenges, the opportunities presented by a robust stablecoin supply are immense. They facilitate efficient global commerce, enable new financial products, and serve as a reliable entry point for individuals and businesses into the digital economy. Actionable Insights for Investors: Navigating the Enhanced Liquidity For investors looking to make sense of this significant USDC minted event, here are some actionable insights: Monitor On-Chain Data: Keep an eye on stablecoin flows to and from exchanges. Increased stablecoin deposits on exchanges often precede buying activity. Assess Market Sentiment: While liquidity is crucial, market sentiment (fear vs. greed) also plays a significant role. Use sentiment indicators in conjunction with stablecoin data. Diversify Your Portfolio: A surge in stablecoin supply can signal potential upward movement, but the crypto market remains volatile. Maintain a diversified portfolio that aligns with your risk tolerance. Explore DeFi Opportunities: With more USDC in circulation, DeFi protocols may offer more attractive yields for lending or liquidity provision. Research reputable protocols and understand the associated risks. Stay Informed on Regulations: Regulatory developments can significantly impact stablecoins. Keeping abreast of global regulatory frameworks is vital for long-term investment strategies. The 250 million USDC minted transaction serves as a reminder that the cryptocurrency market is dynamic and constantly evolving, with capital flows providing valuable clues about its direction. Conclusion: The recent minting of 250 million USDC, as reported by Whale Alert, is more than just a transaction; it’s a powerful signal. It underscores the growing demand for stable digital assets, the increasing liquidity within the stablecoin supply , and the potential implications for future crypto market trends . While no single event guarantees market movements, such a significant injection of capital into the ecosystem suggests a robust underlying interest and provides ample liquidity for the next phase of growth in the cryptocurrency market . Understanding these fundamental shifts is key to navigating the exciting yet complex world of digital finance. To learn more about the latest crypto market trends, explore our article on key developments shaping the cryptocurrency market’s future price action. This post USDC Minted: Unpacking the Staggering $250 Million Treasury Boost first appeared on BitcoinWorld and is written by Editorial Team",Crypto News|BLOCKCHAIN|CRYPTOCURRENCY|Market Analysis|Stablecoins|USDC,EN,0,0,BUSINESS|MARKET|REGULATION|TRADING|USDC,"{'name': 'Bitcoin World', 'img': 'https://resources.cryptocompare.com/news/82/default.png', 'lang': 'EN'}",bitcoinworld,2025-06-25 00:40:31
46720095,https://en.coinotag.com/breakingnews/ethereum-whale-increases-short-position-to-50000-eth-amid-market-rebound/,1750812033,https://resources.cryptocompare.com/news/77/46720095.jpeg,"Ethereum Whale Increases Short Position to 50,000 ETH Amid Market Rebound",https://en.coinotag.com/breakingnews/ethereum-whale-increases-short-position-to-50000-eth-amid-market-rebound/,"According to data from EmberCN, a prominent Ethereum whale known for a flawless short-selling record has expanded its short position by acquiring an additional 10,000 ETH at approximately $2,452. This",ETH,EN,0,0,ETH|MARKET,"{'name': 'CoinOtag', 'img': 'https://resources.cryptocompare.com/news/77/default.png', 'lang': 'EN'}",coinotag,2025-06-25 00:40:33
46720554,https://bitcoinworld.co.in/?p=171897,1750812627,https://resources.cryptocompare.com/news/82/46720554.jpeg,Dogwifhat Validator: DeFi Development Unveils a Revolutionary Community Staking Initiative,https://bitcoinworld.co.in/dogwifhat-validator-staking-rewards/,"BitcoinWorld Dogwifhat Validator: DeFi Development Unveils a Revolutionary Community Staking Initiative The world of cryptocurrency is always buzzing with innovation, and meme coins, once considered mere jokes, are increasingly finding their place in more serious decentralized finance (DeFi) applications. Among them, dogwifhat (WIF), the Solana-based sensation, has captured significant attention. Now, in a groundbreaking move, DeFi Development, formerly known as Janover, has announced its ambitious plans to establish and operate dogwifhat validator nodes on the robust Solana blockchain. This isn’t just about technical infrastructure; it’s a strategic decision aimed at empowering the WIF community by sharing the generated revenue. This development marks a significant step towards integrating meme coin ecosystems more deeply into the functional fabric of decentralized networks, promising a new era of utility and shared prosperity for WIF holders. DeFi Development’s Vision: Powering Dogwifhat Validator Nodes DeFi Development, a name synonymous with innovation in the decentralized finance space, has made a pivotal announcement that could redefine community engagement for meme coins. In a recent press release, the company revealed its intention to deploy and manage WIF validator nodes directly on the Solana blockchain. This initiative goes beyond merely contributing to network security; it’s designed with the community at its heart. The core of their strategy involves sharing the revenue generated from these validator operations with WIF holders, after accounting for the necessary operational costs. This commitment to distributing rewards directly aligns with the ethos of decentralization and community ownership that underpins the crypto world. Why is this a big deal? Running a validator node requires significant technical expertise, computational power, and a substantial stake in the network’s native cryptocurrency. By undertaking this complex task, DeFi Development is not only bolstering the security and efficiency of the Solana network but also creating a direct value-sharing mechanism for the dogwifhat community. It’s a testament to their belief in the long-term viability and potential of WIF beyond its meme status. How Solana Blockchain Validators Secure Your Crypto To truly appreciate the significance of DeFi Development’s move, it’s essential to understand the role of validators on a blockchain, especially one as high-performance as Solana. The Solana blockchain operates on a unique consensus mechanism that combines Proof-of-History (PoH) with Proof-of-Stake (PoS). Validators are the backbone of this system. They are specialized computers that: Verify Transactions: They check the validity of every transaction submitted to the network, ensuring no double-spending or fraudulent activity. Maintain the Ledger: They group valid transactions into blocks and add them to the blockchain’s distributed ledger, ensuring its integrity and immutability. Participate in Consensus: Validators vote on the state of the network, helping to reach consensus on the order and validity of transactions. This process is crucial for preventing malicious actors from manipulating the blockchain. Secure the Network: By participating in the consensus mechanism, validators contribute to the overall security and decentralization of the Solana network, making it more resilient to attacks. In return for their crucial services, validators receive rewards, typically in the native cryptocurrency of the blockchain (SOL, in Solana’s case). DeFi Development’s plan to run dogwifhat validator nodes means they will be actively participating in these fundamental processes, contributing to Solana’s stability while also generating revenue from their staked WIF tokens, which they plan to share. Unlocking Crypto Staking Rewards: A Win for the WIF Community? The most exciting aspect of DeFi Development’s announcement for the average WIF holder is undoubtedly the promise of crypto staking rewards . Staking is a process where users lock up a certain amount of their cryptocurrency to support the operations of a blockchain network. In return for their contribution, they earn rewards, similar to earning interest in a traditional savings account. Here’s how this initiative aims to benefit the dogwifhat community: Direct Revenue Sharing: DeFi Development explicitly stated its intention to share the revenue generated from the WIF validator nodes with the community. This means WIF holders could potentially earn passive income simply by holding their tokens, without needing to run their own complex validator setup. Increased Utility for WIF: Beyond its meme status, WIF gains tangible utility as it becomes an asset that contributes to network security and generates rewards. This can help stabilize its value and attract more long-term holders. Enhanced Community Engagement: By involving the community in the financial benefits of network operation, DeFi Development fosters a stronger sense of ownership and participation among WIF holders. Lower Barrier to Entry: Running a validator node is technically challenging and capital-intensive. By running the nodes themselves and sharing rewards, DeFi Development lowers the barrier for everyday WIF holders to benefit from staking without the technical overhead. This model could set a precedent for how meme coin projects can evolve, moving beyond speculative trading to offer genuine value and participatory economics to their communities. It’s a strategic move that could significantly enhance the long-term appeal and sustainability of dogwifhat. The Future of WIF: What Does This Mean for Dogwifhat Holders? For current and prospective dogwifhat validator holders, this announcement opens up a new avenue for engagement and potential returns. While the specifics of the reward distribution mechanism (e.g., how often, in what form, and the exact percentage after costs) are yet to be fully detailed, the commitment itself is a powerful signal. It suggests a future where WIF is not just a cultural phenomenon but also a productive asset within the DeFi ecosystem. Actionable Insights for WIF Holders: Stay Informed: Keep a close eye on announcements from DeFi Development regarding the launch of the validator nodes and the specifics of the reward distribution program. Understand the Risks: While promising, staking and validator operations come with inherent risks, such as slashing (penalties for validator downtime or misbehavior) or smart contract vulnerabilities. Ensure you understand these before participating in any reward sharing programs. Community Participation: Engage with the dogwifhat and DeFi Development communities to learn more and provide feedback. Your voice can help shape the future of these initiatives. This move by DeFi Development highlights a growing trend in the crypto space: the maturation of projects and the continuous search for sustainable value propositions. By leveraging the technical capabilities to run crucial infrastructure like WIF validator nodes , they are positioning dogwifhat for a more robust and utility-driven future. Conclusion: A New Horizon for Meme Coins and DeFi DeFi Development’s decision to operate dogwifhat validator nodes on the Solana blockchain and share crypto staking rewards with the community marks a significant milestone. It transcends the typical narrative surrounding meme coins, imbuing WIF with tangible utility and a clear path for community-driven value creation. This strategic initiative not only strengthens the underlying Solana network but also sets a compelling precedent for how meme coin ecosystems can evolve, fostering greater decentralization, community empowerment, and sustainable growth. As the crypto landscape continues to mature, such moves underscore the innovative spirit driving the industry forward, promising a more inclusive and rewarding experience for all participants. To learn more about the latest crypto market trends, explore our article on key developments shaping the Solana ecosystem’s institutional adoption. This post Dogwifhat Validator: DeFi Development Unveils a Revolutionary Community Staking Initiative first appeared on BitcoinWorld and is written by Editorial Team",Crypto News|crypto staking|DeFi Development|Dogwifhat|Solana|WIF,EN,0,0,BLOCKCHAIN|BUSINESS|SOL|TRADING|WIF,"{'name': 'Bitcoin World', 'img': 'https://resources.cryptocompare.com/news/82/default.png', 'lang': 'EN'}",bitcoinworld,2025-06-25 00:50:27
46720643,https://en.coinotag.com/breakingnews/edward-coristine-key-elon-musk-doge-division-member-resigns-from-federal-government/,1750812763,https://resources.cryptocompare.com/news/77/46720643.jpeg,"Edward Coristine, Key Elon Musk DOGE Division Member, Resigns from Federal Government",https://en.coinotag.com/breakingnews/edward-coristine-key-elon-musk-doge-division-member-resigns-from-federal-government/,"Edward Coristine, a pivotal figure in Elon Musk’s DOGE division, has officially stepped down from his role, according to a recent report by The New York Times. Coristine, recognized as",,EN,0,0,DOGE,"{'name': 'CoinOtag', 'img': 'https://resources.cryptocompare.com/news/77/default.png', 'lang': 'EN'}",coinotag,2025-06-25 00:52:43
46721110,https://www.cryptopolitan.com/?p=754725,1750813039,https://resources.cryptocompare.com/news/43/46721110.jpeg,Ripple triggers a surge in XRP Ledger activity with the latest update,https://www.cryptopolitan.com/xrp-ledger-releases-update-2-5-0/,"The XRP Ledger (XRPL) has successfully rolled out Software Update 2.5.0, a major release that brings in a high-powered combination of new features and improvements to the network. This is one of the most ambitious software releases in XRPL history, opening new use cases for the technology and moving it and the token in line with the broader crypto and blockchain community. One interesting new feature in this flavor is the ability to batch your transactions and aggregate as many operations into a single transaction as desired. Such flexibility is even more helpful for companies, enterprises, and fintech projects, which require the ability to perform fast bulk payments or token airdrops. e.g., payroll, airdrop, and dApp token distribution services can now be cheap and have very few on-chain transactions. Integration also includes support for token escrow, a feature enabling assets, including RLUSD and other tokens, to be locked for future release. This is a must-have for financial products (vesting schedules, timed payouts, deposit management systems, etc.). It allows developers to build even more sophisticated and secure DeFi tools on the XRP Ledger. Permissioned DEXs are another major redevelopment of the platform. In contrast to the traditional DEX open to everyone, permissioned DEXs offer more versatility for developers, who can limit access according to their requirements for regulations, thus offering a more managed space for transactions. Ripple triggers a surge in XRP Ledger activity with the latest update Performance metrics of the network have been increasing in the software update quickly than expected. In the two weeks before the update, daily active addresses increased more than 7x, signaling increased user and developer interest. Analysts view this as a demand increase for XRPL’s growing scope. After previously being hyped as the chain of choice for trading with meme coins and NFTs, Solana, whose meme coin activity has since dived, has already lost most of its dominance to competitors such as BNB Chain. Furthermore, according to reports, $2.5 billion worth of capital has fled the Solana network over the past weeks. Ethereum has also been affected by scalability issues. By contrast, the XRP ecosystem is going gangbusters. According to market data, it’s attracting interest from large financial institutions. The CME Group, one of the world’s largest derivatives marketplaces, recently labeled XRP as the most-watched cryptocurrency. In addition, the XRP Ledger continues to make new collaborations with significant financial players such as Uphold and Ondo Finance. These integrations continue to push XRPL’s functionality into trading digital assets, tokenizing real-world assets, and cross-border finance use cases more commonly associated with Ethereum-based protocols. XRP price jumps 6% following Ripple’s update The XRP has also bounced back strongly after the 2.5.0 update. In the first few hours after the update, the coin spiked almost 6%, reversing last Sunday’s crushing of the market cap of heaps of cryptocurrencies. This price action tells us the investor community doesn’t think this software update will be a technical patch upgrade, but rather a fundamental upgrade. Providing features such as the ability to batch transactions and escrow tokens is a real-world utility for the XPR Ledger, so this has the potential to attract further developers, startups, and companies to build their businesses on top of the XRP Ledger. A few months ago, Mayukha Vadari, senior software engineer at RippleX, teased that version 2.5.0 would be a game changer! During her comments at a developer livestream in May, for example, she said the update could make XRPL well-positioned to overcome Ethereum and Solana in terms of scalability and institutional adoption. KEY Difference Wire : the secret tool crypto projects use to get guaranteed media coverage",News|Ripple|XRPL,EN,0,0,TECHNOLOGY|TRADING|WALLET|XRP|AIRDROP,"{'name': 'Cryptopolitan', 'img': 'https://images.cryptocompare.com/news/default/cryptopolitan.png', 'lang': 'EN'}",cryptopolitan,2025-06-25 00:57:19
