id,guid,published_on,imageurl,title,url,body,tags,lang,upvotes,downvotes,categories,source_info,source,date
36851268,https://timestabloid.com/?p=50667,1732590021,https://resources.cryptocompare.com/news/67/default.png,"RCO Finance’s AI Token Presale Crosses $5.5M, Analysts Predict 1000x Gains by 2025",https://timestabloid.com/rco-finances-ai-token-presale-crosses-5-5m-analysts-predict-1000x/,"RCO Finance (RCOF) is breaking barriers in the investment sector with the blend of AI and blockchain. RCOF token presale has already surpassed $5.5 million in funds raised. It is now on the way to reach $6 million before December 2024. Its AI trading and investing platform has attracted users with its automated, no-code design. The post RCO Finance’s AI Token Presale Crosses $5.5M, Analysts Predict 1000x Gains by 2025 appeared first on Times Tabloid .",Finance|News,EN,0,0,ZRX|BLOCKCHAIN|TRADING,"{'name': 'TimesTabloid', 'img': 'https://resources.cryptocompare.com/news/67/default.png', 'lang': 'EN'}",timestabloid,2024-11-26 03:00:21
36850164,https://ambcrypto.com/?p=446073,1732590035,https://images.cryptocompare.com/news/default/ambcrypto.png,Dogecoin rally ahead? Assessing if DOGE can jump 90% to $0.82,https://ambcrypto.com/dogecoin-rally-ahead-assessing-if-doge-can-jump-90-to-0-82/,"Dogecoin rally reignited optimism with a 25% surge, setting sights on a potential $0.82 breakout.",Dogecoin|Memecoins|News|News 1|Social|Trading View|ambcrypto|featured,EN,0,0,DOGE|TRADING|SPONSORED,"{'name': 'AMB Crypto', 'img': 'https://images.cryptocompare.com/news/default/ambcrypto.png', 'lang': 'EN'}",ambcrypto,2024-11-26 03:00:35
36850197,https://en.coinotag.com/dogecoins-25-surge-sparks-speculation-about-potential-move-toward-0-82/,1732590151,https://resources.cryptocompare.com/news/77/36850197.jpeg,Dogecoin’s 25% Surge Sparks Speculation About Potential Move Toward $0.82,https://en.coinotag.com/dogecoins-25-surge-sparks-speculation-about-potential-move-toward-0-82/,"The recent 25% surge in Dogecoin has reignited market optimism, with eyes set on a potential breakout toward $0.82. This renewed investor interest raises hopes for a significant rally, as",News|DOGE|MEME,EN,0,0,DOGE|MEME|BUSINESS|MARKET|TRADING,"{'name': 'CoinOtag', 'img': 'https://resources.cryptocompare.com/news/77/default.png', 'lang': 'EN'}",coinotag,2024-11-26 03:02:31
36850375,https://en.coinotag.com/breakingnews/usda-surges-past-200-million-circulation-the-rise-of-bitcoin-backed-stablecoin/,1732590402,https://resources.cryptocompare.com/news/77/36850375.jpeg,USDa Surges Past 200 Million Circulation: The Rise of Bitcoin-Backed Stablecoin,https://en.coinotag.com/breakingnews/usda-surges-past-200-million-circulation-the-rise-of-bitcoin-backed-stablecoin/,"COINOTAG News reported on November 26th that the recently launched Bitcoin-backed stablecoin USDa, developed by Avalon Labs, has effectively exceeded 200 million coins in circulation within a mere two weeks.",BNB|BTC|DAI,EN,0,0,BNB|BTC|DAI,"{'name': 'CoinOtag', 'img': 'https://resources.cryptocompare.com/news/77/default.png', 'lang': 'EN'}",coinotag,2024-11-26 03:06:42
36850532,https://cointelegraph.com/news/farcaster-founder-dan-romero-teases-frames-v2,1732590708,https://images.cryptocompare.com/news/default/cointelegraph.png,Farcaster founder teases Frames v2 ahead of full launch in 2025,https://cointelegraph.com/news/farcaster-founder-dan-romero-teases-frames-v2?utm_source=rss_feed&utm_medium=rss&utm_campaign=rss_partner_inbound,A new and improved version of Frames will allow users to run full-screen applications inside the social media platform Warpcast.,Farcaster|Frames|Warpcast|Web3|social media|dapps,EN,0,0,OTHER,"{'name': 'CoinTelegraph', 'img': 'https://images.cryptocompare.com/news/default/cointelegraph.png', 'lang': 'EN'}",cointelegraph,2024-11-26 03:11:48
36850585,https://en.coinotag.com/breakingnews/polygons-ceo-addresses-bias-against-indian-developers-impacting-network-adoption/,1732590789,https://resources.cryptocompare.com/news/77/36850585.jpeg,Polygon’s CEO Addresses Bias Against Indian Developers Impacting Network Adoption,https://en.coinotag.com/breakingnews/polygons-ceo-addresses-bias-against-indian-developers-impacting-network-adoption/,"On November 26th, Polygon Labs CEO Marc Boiron addressed the issue of perceived bias against his project due to the Indian heritage of co-founder Sandeep Nailwal. In a post on",MATIC,EN,0,0,MATIC,"{'name': 'CoinOtag', 'img': 'https://resources.cryptocompare.com/news/77/default.png', 'lang': 'EN'}",coinotag,2024-11-26 03:13:09
36850708,https://www.newsbtc.com/?p=654902,1732591088,https://images.cryptocompare.com/news/default/newsbtc.png,Ethereum Price Steadies: Bulls Ready for The Next Move?,https://www.newsbtc.com/analysis/eth/ethereum-price-steadies-3400/,"Ethereum price started a fresh increase above the $3,400 zone. ETH is consolidating and might aim for a move above the $3,500 resistance. Ethereum started a fresh increase above the $3,320 and $3,400 levels. The price is trading above $3,400 and the 100-hourly Simple Moving Average. There is a key bullish trend line forming with support at $3,400 on the hourly chart of ETH/USD (data feed via Kraken). The pair could gain bullish momentum if it clears the $3,485 resistance zone. Ethereum Price Holds Gains Above Support Ethereum price remained supported above $3,220 and started a fresh increase while Bitcoin corrected gains. ETH gained pace for a move above the $3,420 and $3,450 resistance levels. The bulls even pushed the price above the $3,500 resistance. A high was formed at $3,545 and recently the price corrected some gains. There was a move below the $3,500 level. The price dipped below the 50% Fib retracement level of the upward move from the $3,289 swing low to the $3,545 high. However, the bulls are active near the $3,400 level. There is also a key bullish trend line forming with support at $3,400 on the hourly chart of ETH/USD. The trend line is close to the 61.8% Fib retracement level of the upward move from the $3,289 swing low to the $3,545 high. Ethereum price is now trading above $3,420 and the 100-hourly Simple Moving Average. On the upside, the price seems to be facing hurdles near the $3,485 level. The first major resistance is near the $3,500 level. The main resistance is now forming near $3,550. A clear move above the $3,550 resistance might send the price toward the $3,650 resistance. An upside break above the $3,650 resistance might call for more gains in the coming sessions. In the stated case, Ether could rise toward the $3,720 resistance zone or even $3,880. Downsides Supported In ETH? If Ethereum fails to clear the $3,500 resistance, it could start another decline. Initial support on the downside is near the $3,420 level. The first major support sits near the $3,400 zone and the trend line. A clear move below the $3,400 support might push the price toward $3,350. Any more losses might send the price toward the $3,285 support level in the near term. The next key support sits at $3,220. Technical Indicators Hourly MACD – The MACD for ETH/USD is gaining momentum in the bullish zone. Hourly RSI – The RSI for ETH/USD is now above the 50 zone. Major Support Level – $3,400 Major Resistance Level – $3,550",ETH|ethbtc|ethereum|ethusd|ETHUSDT,EN,0,0,TRADING|ETH|BTC|EXCHANGE,"{'name': 'NewsBTC', 'img': 'https://images.cryptocompare.com/news/default/newsbtc.png', 'lang': 'EN'}",newsbtc,2024-11-26 03:18:08
36850799,https://en.coinotag.com/farcaster-frames-v2-update-could-enhance-user-experience-with-full-screen-applications-on-warpcast/,1732591194,https://resources.cryptocompare.com/news/77/36850799.jpeg,Farcaster Frames v2 Update Could Enhance User Experience with Full-Screen Applications on Warpcast,https://en.coinotag.com/farcaster-frames-v2-update-could-enhance-user-experience-with-full-screen-applications-on-warpcast/,"Farcaster has unveiled a significant update to its innovative Frames feature, aiming to enhance the user experience on the decentralized social media platform Warpcast. This update, known as Frames v2,",Blockchain|News,EN,0,0,BLOCKCHAIN,"{'name': 'CoinOtag', 'img': 'https://resources.cryptocompare.com/news/77/default.png', 'lang': 'EN'}",coinotag,2024-11-26 03:19:54
36850906,https://www.cryptointelligence.co.uk/?p=25386,1732591380,https://resources.cryptocompare.com/news/95/default.png,"Chill Trump (CHILTRUM) Solana Memecoin Will Explode 17,000% Before Exchange Listing, As Shiba Inu and DOGE Lag",https://www.cryptointelligence.co.uk/chill-trump-chiltrum-solana-memecoin-will-explode-17000-before-exchange-listing-as-shiba-inu-and-doge-lag/,"Chill Trump could turn early investors into multi-millionaires, like Shiba Inu (SHIB) and Dogecoin (DOGE) did. Chill Trump (CHILTRUM), a new Solana memecoin that was launched today, is set to explode over 17,000% in price in the coming days. This is because CHILTRUM is set to soon be listed on numerous crypto exchanges, according to reports. This will give the Solana memecoin exposure to millions of additional investors, who will pour funds into the coin and drive its price up. Currently, Chill Trump can only be purchased via Solana decentralized exchanges, like Jup.ag and Raydium.io, and early investors stand to",Blockchain News|Crypto News Today|Press Releases,EN,0,0,SHIB|SOL|DOGE|EXCHANGE|BUSINESS,"{'name': 'CryptoIntelligence', 'img': 'https://resources.cryptocompare.com/news/95/default.png', 'lang': 'EN'}",cryptointelligence,2024-11-26 03:23:00
36851079,https://news.bitcoin.com/?p=687449&preview=true&preview_id=687449,1732591806,https://resources.cryptocompare.com/news/14/36851079.jpeg,Asset Managers Weigh in on US Bitcoin Reserve Debate,https://news.bitcoin.com/asset-managers-weigh-in-on-us-bitcoin-reserve-debate/,"Asset managers have weighed in on Trump’s proposed U.S. bitcoin reserve, reflecting divisions over digital assets in national economic strategy. Asset Managers Divided Over Bitcoin Reserve in Nation’s Bold Strategy Discussions about establishing a U.S. strategic bitcoin reserve have intensified following President Donald Trump’s re-election. Several asset management firms and financial analysts have voiced their",Featured|Bitcoin|Reserve,EN,0,0,BTC|FIAT|SPONSORED|REGULATION,"{'name': 'Bitcoin.com', 'img': 'https://images.cryptocompare.com/news/default/bitcoincom.png', 'lang': 'EN'}",bitcoin.com,2024-11-26 03:30:06
36851114,https://coincu.com/293815-world-liberty-financial-investment-justin-sun,1732591854,https://resources.cryptocompare.com/news/96/36851114.jpeg,World Liberty Financial Receives Investment From Justin Sun,https://coincu.com/293815-world-liberty-financial-investment-justin-sun,"TRON founder Justin Sun has become the largest investor in World Liberty Financial, boosting its total sales to $52 million. Read original article on coincu.com",news|News|DeFi|Donald Trump|Justin sun|TRON|WLFI|World Liberty Financial,EN,0,0,BUSINESS,"{'name': 'Coincu', 'img': 'https://resources.cryptocompare.com/news/96/default.png', 'lang': 'EN'}",coincu,2024-11-26 03:30:54
36851202,https://coinpedia.org/?p=385342,1732592014,https://images.cryptocompare.com/news/default/coinpedia.png,SEC 2024 Report: Record Fines & Big Cases Revealed,https://coinpedia.org/news/sec-2024-report-record-fines-big-cases-revealed/,"The post SEC 2024 Report: Record Fines & Big Cases Revealed appeared first on Coinpedia Fintech News The SEC has released its 2024 enforcement enforcement report and it contains so many things to talk about. No doubt, this year had less cases than before but the fines were huge. Billions of lost funds were recovered and whistleblowers received great rewards. Let’s dig in and explore the report. Less Cases – Huge Money …",News|Crypto news|SEC,EN,0,0,REGULATION,"{'name': 'coinpedia', 'img': 'https://images.cryptocompare.com/news/default/coinpedia.png', 'lang': 'EN'}",coinpedia,2024-11-26 03:33:34
36851848,https://www.cryptonewsz.com/bitcoin-dips-to-94k-polymarket-kalshi-oods-btc/,1732593211,https://images.cryptocompare.com/news/default/cryptonewsz.png,Bitcoin Dips to $94K ; Polymarket and Kalshi Odds on BTC Shrink,https://www.cryptonewsz.com/bitcoin-dips-to-94k-polymarket-kalshi-oods-btc/,"After a sustained surge last week, Bitcoin continues to retreat, falling back to $94,706. The current market price…",Bitcoin,EN,0,0,BTC|MARKET,"{'name': 'CryptoNewsZ', 'img': 'https://images.cryptocompare.com/news/default/cryptonewsz.png', 'lang': 'EN'}",cryptonewsz,2024-11-26 03:53:31
36851854,https://coingape.com/?p=226698,1732593320,https://images.cryptocompare.com/news/default/coingape.png,"Cryptocurrency Prices Today Nov 26: BTC Dips Below $95K, LDO Up 15%",https://coingape.com/cryptocurrency-prices-today-nov-26-btc-dips-below-95k-ldo-up-15/,"Following the recent bullish rally, cryptocurrency prices today are facing selling pressure, with market sentiment shifting towards cautiousness. Bitcoin (BTC) has dropped to the $93K level today. Altcoins show a mixed trend, with Ethereum (ETH) and XRP gaining 3% to 4%, while Solana (SOL) is down by 5%. Lido DAO (LDO) and Arbitrum (ARB) have The post Cryptocurrency Prices Today Nov 26: BTC Dips Below $95K, LDO Up 15% appeared first on CoinGape .",24/7 Cryptocurrency News|Altcoin News|Bitcoin News|Bitcoin (BTC) Price|Crypto price today|Dogecoin (DOGE)|Ethereum (ETH)|Solana (SOL)|XRP,EN,0,0,LDO|BTC|MARKET|XRP|ARB,"{'name': 'CoinGape', 'img': 'https://images.cryptocompare.com/news/default/coingape.png', 'lang': 'EN'}",coingape,2024-11-26 03:55:20
36852025,https://www.newsbtc.com/?p=654838,1732593611,https://images.cryptocompare.com/news/default/newsbtc.png,Solana Outpaces Ethereum In DeFi Activity As Monthly DEX Volume Surpasses $100 Billion,https://www.newsbtc.com/news/solana/solana-outpaces-ethereum-in-defi-activity-as-monthly-dex-volume-surpasses-100-billion/,"Solana (SOL) decentralized finance (DeFi) activity has gained significant momentum, with its decentralized exchanges (DEX) surpassing Ethereum (ETH) DEX in monthly trading volume. So far in November, Solana-based DEXes have recorded over $100 billion in trading volume, marking a major milestone for the ecosystem. Solana DeFi Ecosystem Gains Momentum, Outshines Ethereum DeFi Solana, the fourth-largest cryptocurrency with a reported market cap of $118.34 billion has been on a record-breaking price trajectory. Recently, the digital asset established a new all-time-high (ATH) of $263 after having hit as low as $8 at the peak of the FTX fiasco. Related Reading: Solana (SOL) Bulls Stay in Control: Rally Far From Over? Now, the layer-1 blockchain has achieved another milestone as Solana-based DEXes surpassed $100 billion for the first time in monthly trading volume. According to data from DefiLlama, the 30-day cumulative trading volume recorded by Solana DEXes stands at $116.51 billion. In comparison, Ethereum mainnet-based DEXes saw $61.61 billion in trading volume during the same period. This means Solana’s DEX trading volume was more than double that of Ethereum’s. On a month-over-month (MoM) basis, Solana’s DEX volume surged over 100% from October, which stood at $52.5 billion. Meanwhile, the total value locked (TVL) in Solana’s DeFi ecosystem has increased to $9.30 billion, up from $6.23 billion a month ago. The unprecedented rise in Solana-based DEX trading volume can be attributed to several factors. These include the ongoing memecoin frenzy, the blockchain’s low transaction fees, and an intuitive user interface. It is worth highlighting that Solana’s TVL has yet to surpass its ATH TVL of $10.02 billion, which was recorded almost three years ago in November 2021. In January 2023, the blockchain’s TVL hit a low of $210 million, dragged down by the wider crypto bear market exacerbated by the downfall of FTX exchange. At the time of writing, $3.58 billion of Solana’s TVL is tied to the liquid staking protocol Jito, while Jupiter DEX holds $2.4 billion. Another prominent Solana-based DEX, Raydium, accounts for $2.37 billion of TVL. Where Is SOL Headed? Solana’s growing user adoption has played a crucial role in driving the recovery of its native token, SOL. On a year-to-date (YTD) basis, SOL has gained over 157%, rising from $101 on January 1 to $263 on November 23. Related Reading: Solana Records New ATH After 3 Years: Is SOL Ready To Flip USDT? Despite such extraordinary returns, crypto experts remain bullish on SOL, expecting further gains for the digital asset. According to a recent analysis by Titan of Crypto, SOL may hit $400 as it appears to be breaking out from a prolonged cup-and-handle pattern. Additional bullish factors, such as the declining Bitcoin (BTC) dominance and the rising likelihood of a Solana exchange-traded fund (ETF), could further propel SOL to new highs. SOL trades at $248.31 at press time, up 0.5% in the past 24 hours. Featured image from Unsplash, charts from DefiLlama.com and Tradingview.com",Solana|altcoin|bitcoin dominance|DeFi|DEX|ethereum|Jito|jupiter|Raydium|Sol|SOLUSDT|TVL,EN,0,0,SOL|TRADING|ETH|BLOCKCHAIN|MARKET,"{'name': 'NewsBTC', 'img': 'https://images.cryptocompare.com/news/default/newsbtc.png', 'lang': 'EN'}",newsbtc,2024-11-26 04:00:11
36852060,https://ambcrypto.com/?p=446237,1732593646,https://images.cryptocompare.com/news/default/ambcrypto.png,Elon Musk – Bitcoin nexus: How the mogul sparked ‘Inverse Cramer’ talks,https://ambcrypto.com/elon-musk-bitcoin-nexus-how-the-mogul-sparked-inverse-cramer-talks/,Does this mean something bigger is brewing in the crypto world?,Bitcoin|BTC Trading View|News|News 1|Social|Trading View|ambcrypto,EN,0,0,BTC,"{'name': 'AMB Crypto', 'img': 'https://images.cryptocompare.com/news/default/ambcrypto.png', 'lang': 'EN'}",ambcrypto,2024-11-26 04:00:46
36852062,https://www.cryptointelligence.co.uk/?p=25385,1732593720,https://resources.cryptocompare.com/news/95/default.png,"Musk Daddy (MUSKDADD) Memecoin Will Explode Over 12,000% Before Exchange Listing, While Shiba Inu and Dogecoin Lag",https://www.cryptointelligence.co.uk/musk-daddy-muskdadd-will-explode-over-12000-before-exchange-listing-while-shiba-inu-and-dogecoin-lag/,"Musk Daddy could turn early investors into multi-millionaires, like Shiba Inu (SHIB) and Dogecoin (DOGE) did. Musk Daddy (MUSKDADD), a new Solana memecoin that was launched today, is set to explode over 12,000% in price in the coming days. This is because MUSKDADD is set to soon be listed on numerous crypto exchanges, according to reports. This will give the Solana memecoin exposure to millions of additional investors, who will pour funds into the coin and drive its price up. Currently, Musk Daddy can only be purchased via Solana decentralized exchanges, like Jup.ag and Raydium.io, and early investors stand to",Blockchain News|Crypto News Today|Press Releases,EN,0,0,SHIB|DOGE|EXCHANGE|BUSINESS|SOL,"{'name': 'CryptoIntelligence', 'img': 'https://resources.cryptocompare.com/news/95/default.png', 'lang': 'EN'}",cryptointelligence,2024-11-26 04:02:00
36852199,https://coinpedia.org/?p=385349,1732593973,https://images.cryptocompare.com/news/default/coinpedia.png,XRP Price Prediction For November 26,https://coinpedia.org/news/xrp-price-prediction-for-november-26/,"The post XRP Price Prediction For November 26 appeared first on Coinpedia Fintech News Ripple’s XRP is currently trading in green and is up by more than three percent at the time of writing. The price is currently testing levels below $1.50 and is experiencing a slight correction today, but nothing major. In the meanwhile, Bitcoin has also dropped below the crucial $95k mark and is down by more …",News|Altcoins|Crypto news|Cryptocurrency|Price Analysis,EN,0,0,TRADING|XRP|ALTCOIN|BTC,"{'name': 'coinpedia', 'img': 'https://images.cryptocompare.com/news/default/coinpedia.png', 'lang': 'EN'}",coinpedia,2024-11-26 04:06:13
36852249,https://coinpedia.org/?p=385344,1732594065,https://images.cryptocompare.com/news/default/coinpedia.png,Why is Bitcoin Down Today? Will BTC Cross $100k?,https://coinpedia.org/price-analysis/why-is-bitcoin-down-today-will-btc-cross-100k/,"The post Why is Bitcoin Down Today? Will BTC Cross $100k? appeared first on Coinpedia Fintech News Bitcoin sent shockwaves to the market as it fell under $95,000 when it was above $98,000 just yesterday. It peaked at almost $99,500, but now it’s dropped back to around $94,427. That’s quite a drop, but is it the end of the road or just a temporary dip? People are still buzzing about what might …",Price Analysis|Bitcoin,EN,0,0,BTC|MARKET,"{'name': 'coinpedia', 'img': 'https://images.cryptocompare.com/news/default/coinpedia.png', 'lang': 'EN'}",coinpedia,2024-11-26 04:07:45
36852245,https://www.newsbtc.com/?p=654906,1732594086,https://images.cryptocompare.com/news/default/newsbtc.png,XRP Price Eyes Fresh Upside: Can Bulls Deliver?,https://www.newsbtc.com/analysis/xrp/xrp-price-fresh-upside-0-50/,"XRP price is consolidating gains near the $1.450 zone. The price must clear the $1.50 resistance zone to start a fresh increase in the near term. XRP price is attempting a fresh increase from the $1.300 level. The price is now trading near $1.450 and the 100-hourly Simple Moving Average. There is a key contracting triangle forming with resistance at $1.50 on the hourly chart of the XRP/USD pair (data source from Kraken). The pair is showing positive signs and might eye a fresh increase above the $1.50 resistance. XRP Price Holds Gains XRP price formed a base above $1.30 and started a fresh increase. There was a move above the $1.350 and $1.42 resistance levels. It even pumped above the $1.45 level, beating Ethereum and Bitcoin in the past two sessions. The price spiked above the 61.8% Fib retracement level of the downward move from the $1.6340 swing high to the $1.3007 low. However, the bears seem to be active near the $1.50 resistance zone. There is also a key contracting triangle forming with resistance at $1.50 on the hourly chart of the XRP/USD pair. The price is now trading near $1.45 and the 100-hourly Simple Moving Average. On the upside, the price might face resistance near the $1.4680 level. The first major resistance is near the $1.50 level. The next key resistance could be $1.550 or the 76.4% Fib retracement level of the downward move from the $1.6340 swing high to the $1.3007 low. A clear move above the $1.550 resistance might send the price toward the $1.6350 resistance. Any more gains might send the price toward the $1.680 resistance or even $1.6850 in the near term. The next major hurdle for the bulls might be $1.720 or $1.750. Are Dips Supported? If XRP fails to clear the $1.50 resistance zone, it could start a downside correction. Initial support on the downside is near the $1.400 level and the triangle’s lower trend line. The next major support is near the $1.380 level. If there is a downside break and a close below the $1.380 level, the price might continue to decline toward the $1.3200 support. The next major support sits near the $1.2650 zone. Technical Indicators Hourly MACD – The MACD for XRP/USD is now gaining pace in the bullish zone. Hourly RSI (Relative Strength Index) – The RSI for XRP/USD is now above the 50 level. Major Support Levels – $1.4000 and $1.3800. Major Resistance Levels – $1.5000 and $1.5500.",XRP|Ripple|XRPBTC|XRPUSD|xrpusdt,EN,0,0,TRADING|XRP|BTC|ETH|EXCHANGE,"{'name': 'NewsBTC', 'img': 'https://images.cryptocompare.com/news/default/newsbtc.png', 'lang': 'EN'}",newsbtc,2024-11-26 04:08:06
36852309,https://en.coinotag.com/breakingnews/jiva-technologies-approves-1-million-bitcoin-purchase-to-enhance-treasury-management-strategy/,1732594204,https://resources.cryptocompare.com/news/77/default.png,Jiva Technologies Approves $1 Million Bitcoin Purchase to Enhance Treasury Management Strategy,https://en.coinotag.com/breakingnews/jiva-technologies-approves-1-million-bitcoin-purchase-to-enhance-treasury-management-strategy/,"In a significant move underscoring the growing acceptance of cryptocurrency in corporate finance, Jiva Technologies, a publicly traded entity based in Canada, has received approval from its board of directors",,EN,0,0,BTC|REGULATION,"{'name': 'CoinOtag', 'img': 'https://resources.cryptocompare.com/news/77/default.png', 'lang': 'EN'}",coinotag,2024-11-26 04:10:04
