id,guid,published_on,imageurl,title,url,body,tags,lang,upvotes,downvotes,categories,source_info,source,date
36848273,https://en.coinotag.com/base-achieves-106-tps-and-surpasses-10-billion-in-tvl-opportunities-may-arise-for-ethereum-layer-2-solutions/,1732586399,https://resources.cryptocompare.com/news/77/36848273.jpeg,"Base Achieves 106 TPS and Surpasses $10 Billion in TVL, Opportunities May Arise for Ethereum Layer 2 Solutions",https://en.coinotag.com/base-achieves-106-tps-and-surpasses-10-billion-in-tvl-opportunities-may-arise-for-ethereum-layer-2-solutions/,"The Ethereum layer-2 network Base has reached impressive milestones, including a record-breaking transaction speed and a significant total value locked (TVL), marking its rapid ascent within the crypto space. As",News|ARB|ETH|MEME|SOL|STRK,EN,0,0,ETH|ARB|MEME|SOL|STRK,"{'name': 'CoinOtag', 'img': 'https://resources.cryptocompare.com/news/77/default.png', 'lang': 'EN'}",coinotag,2024-11-26 01:59:59
36848323,https://ambcrypto.com/?p=446136,1732586429,https://images.cryptocompare.com/news/default/ambcrypto.png,Is Tezos [XTZ] crypto poised for a correction? Key data says…,https://ambcrypto.com/is-tezos-xtz-crypto-poised-for-a-correction-key-data-says/,Tezos could soar by 40% to reach the $2.10 level if it closes a daily candle above $1.50.,Altcoin|News|News 1|Social|Trading View|ambcrypto,EN,0,0,XTZ|ALTCOIN,"{'name': 'AMB Crypto', 'img': 'https://images.cryptocompare.com/news/default/ambcrypto.png', 'lang': 'EN'}",ambcrypto,2024-11-26 02:00:29
36848317,https://nulltx.com/?p=134795,1732586435,https://images.cryptocompare.com/news/default/nulltx.png,"Shiba Inu and Cardano Traders Diversify with Undervalued Rival Expected to Deliver 38,902% Gains",https://nulltx.com/shiba-inu-and-cardano-traders-diversify-with-undervalued-rival-expected-to-deliver-38902-gains/,"Cardano (ADA) reaches a 2-year high, even crossing the esteemed $1 mark once more. Meanwhile, Shiba Inu (SHIB) recovered from a dreadful Q3 slump, surging 46.23% since last month. However, with only modest gains ahead for both tokens, ADA and SHIB holders can’t help but agree to diversify their portfolios",Press Releases,EN,0,0,SHIB|ADA,"{'name': 'NullTx', 'img': 'https://images.cryptocompare.com/news/default/nulltx.png', 'lang': 'EN'}",themerkle,2024-11-26 02:00:35
36848293,https://www.newsbtc.com/?p=654857,1732586436,https://images.cryptocompare.com/news/default/newsbtc.png,"Chainlink May Reach New ATH If This Barrier Breaks, Analyst Says",https://www.newsbtc.com/chainlink-news/chainlink-new-all-time-high-resistance-breaks/,"An analyst has explained how the path to a new Chainlink all-time high (ATH) could open up if LINK can break past this resistance block. Chainlink Could Find Major Resistance At The $20 Level In a new post on X, analyst Ali Martinez has discussed how the resistance barriers for LINK are currently looking in terms of the on-chain cost basis distribution. Related Reading: Bitcoin To Smash $100,000? Rapid Stablecoin Exchange Inflows Continue Below is the chart from the market intelligence platform IntoTheBlock shared by the analyst. It shows the amount of the asset acquired at each price range that Chainlink has visited in its history. As displayed in the graph, many Chainlink investors purchased their tokens inside the $18.4 to $26.3 range. More specifically, around 100,220 addresses acquired 57.2 million LINK at these price levels. In on-chain analysis, the potential of any price range to act as support or resistance is measured using the number of coins bought inside it. The reason behind this lies in investor psychology. Generally, holders consider their cost basis a special level since a retest of it can flip their profit-loss status. As such, they can be more prone to making panic moves when this retest happens. Investors carrying a loss before the retest may fear that the price would return shortly, so they could be tempted to sell and get their money back. Similarly, holders with their cost basis retested from above could decide to accumulate more, believing that the level will eventually become profitable again. Both of these effects aren’t consequential when the cost basis of a few investors gets retested. Still, in the scenario where many addresses have their cost basis in a tight range, the reaction produced from a retest may be big enough to cause visible fluctuations in the asset. Related Reading: 54% Of Bitcoin Supply Inactive Since 2 Years Despite 500% Price Jump The aforementioned Chainlink price range around the average value of $22 holds the cost basis of many investors, so it’s possible that LINK could find it hard to break through these levels. As Martinez has pointed out, however, if the cryptocurrency can clear this hurdle, it could potentially have an easy run up to a new ATH since not many investors currently have their acquisition level in the price range after the $22 demand zone. Regarding the ranges under the current price, there are a couple of hefty ones nearby, like $13 to $15 and $11 to $13. If the asset goes through a correction, these levels could potentially help cushion a fall. LINK Price Chainlink has witnessed a rally of almost 10% over the last 24 hours, taking its price to the $18.4 mark. Featured image from Dall-E, IntoTheBlock.com, chart from TradingView.com",Chainlink News|chainlink|Chainlink All-Time High|Chainlink ATH|Link|linkusdt,EN,0,0,LINK|TRADING|BUSINESS|BTC|MARKET,"{'name': 'NewsBTC', 'img': 'https://images.cryptocompare.com/news/default/newsbtc.png', 'lang': 'EN'}",newsbtc,2024-11-26 02:00:36
36848682,https://en.coin-turk.com/?p=174959,1732587175,https://resources.cryptocompare.com/news/79/36848682.jpeg,Bloomberg Analyst Reveals Potential Timelines for Crypto ETF Approvals,https://en.coin-turk.com/bloomberg-analyst-reveals-potential-timelines-for-crypto-etf-approvals/,Seyffart predicts crypto ETF approvals may not happen until 2025. Regulatory hurdles hinder the approval of altcoin ETFs. Continue Reading: Bloomberg Analyst Reveals Potential Timelines for Crypto ETF Approvals The post Bloomberg Analyst Reveals Potential Timelines for Crypto ETF Approvals appeared first on COINTURK NEWS .,Cryptocurrency News,EN,0,0,ALTCOIN,"{'name': 'CoinTurk News', 'img': 'https://resources.cryptocompare.com/news/79/default.png', 'lang': 'EN'}",cointurken,2024-11-26 02:12:55
36849041,https://en.coinotag.com/breakingnews/whale-makes-waves-5-15-million-pepe-token-deposit-fuels-impressive-13x-profit-surge/,1732587937,https://resources.cryptocompare.com/news/77/36849041.jpeg,Whale Makes Waves: $5.15 Million PEPE Token Deposit Fuels Impressive 13x Profit Surge,https://en.coinotag.com/breakingnews/whale-makes-waves-5-15-million-pepe-token-deposit-fuels-impressive-13x-profit-surge/,"In a significant development for the crypto market, a prominent whale, known on Twitter as @degentradingLSD, recently executed a transaction involving the transfer of 254.65 billion PEPE tokens valued at",PEPE,EN,0,0,PEPE|BUSINESS|MARKET,"{'name': 'CoinOtag', 'img': 'https://resources.cryptocompare.com/news/77/default.png', 'lang': 'EN'}",coinotag,2024-11-26 02:25:37
36849061,https://coingape.com/?p=226697,1732587945,https://images.cryptocompare.com/news/default/coingape.png,Hashdex Files Second Amendment for Nasdaq Crypto Index US ETF Approval,https://coingape.com/hashdex-files-second-amendment-for-nasdaq-crypto-index-us-etf-approval/,"Asset management firm Hashdex has made further progress toward launching a cryptocurrency-focused exchange-traded fund (ETF) in the United States. According to an announcement on Nov. 25, the company has submitted its second amended S-1 application with the U.S. Securities and Exchange Commission (SEC). Hashdex Second Amendment for Nasdaq Crypto Index US ETF Hashdex’s latest filing The post Hashdex Files Second Amendment for Nasdaq Crypto Index US ETF Approval appeared first on CoinGape .",24/7 Cryptocurrency News|Bitcoin News|crypto index|ETF|Hashdex,EN,0,0,MARKET|EXCHANGE|REGULATION,"{'name': 'CoinGape', 'img': 'https://images.cryptocompare.com/news/default/coingape.png', 'lang': 'EN'}",coingape,2024-11-26 02:25:45
33767162,[object Object],1732588217,https://resources.cryptocompare.com/news/13/33767162.jpeg,Asia’s Largest Digital Bank Launches Retail Crypto Trading In Hong Kong—Details,https://bitcoinist.com/digital-bank-retail-crypto-trading-hong-kong-detail/,"Hong Kong’s largest digital bank, ZA Bank, has announced the launch of a retail cryptocurrency trading service. According to the press release, the service enables users to trade cryptocurrencies directly through the ZA Bank app, “simplifying” the trading process by eliminating the need for third-party platforms. This move makes ZA Bank the first bank in",Crypto News|crypto|crypto adoption|crypto bank|Crypto Trading|hong kong|Hong Kong and Crypto|Retail Crypto Trading|ZA Bank,EN,0,0,ETH|ASIA|ALTCOIN|HNT|MARKET|SHIB|BNB|EXCHANGE|BTC|REGULATION|TRADING|OTHER|DOGE|SOL|BLOCKCHAIN|XRP|TON|BUSINESS|FIAT|BONK|PYUSD|COMMODITY|ADA|ZRX|MINING|FTT|DOT|USDT|RESEARCH|FORKS|IMX|ICP|TRX|TECHNOLOGY|ARB|WLD|SPONSORED|RAY|SUI|PEPE|WALLET|UNI|XMR|LINK|NEAR|SEI|MATIC|ARKM|USDC|LTC|LUNA|AIRDROP|BTG|MX|TOKEN SALE|BSV|FLOKI|TOKEN LISTING AND DELISTING|BITTENSOR|HBAR|CRO|WIF|ZEC,"{'name': 'Bitcoinist', 'img': 'https://images.cryptocompare.com/news/default/bitcoinist.png', 'lang': 'EN'}",bitcoinist,2024-11-26 02:30:17
36849228,https://news.bitcoin.com/?p=687471&preview=true&preview_id=687471,1732588239,https://resources.cryptocompare.com/news/14/36849228.jpeg,$113B Asset Manager Files to Launch XRP ETF in US Amid Shifting Crypto Policies,https://news.bitcoin.com/113b-asset-manager-files-to-launch-xrp-etf-in-us-amid-shifting-crypto-policies/,"Global asset manager Wisdomtree has filed for an XRP ETF in Delaware, marking a potential breakthrough amid regulatory shifts. Regulatory Shifts Loom as XRP ETF Eyes Breakthrough Moment Global investment management firm Wisdomtree, renowned for its extensive range of exchange-traded funds (ETFs), has filed with the state of Delaware to establish an XRP ETF. Fox",Finance|ETF|XRP,EN,0,0,XRP,"{'name': 'Bitcoin.com', 'img': 'https://images.cryptocompare.com/news/default/bitcoincom.png', 'lang': 'EN'}",bitcoin.com,2024-11-26 02:30:39
36849440,https://www.newsbtc.com/?p=654893,1732588656,https://images.cryptocompare.com/news/default/newsbtc.png,Bitcoin Price Slips Below $95K: Is The Rally Losing Steam?,https://www.newsbtc.com/analysis/btc/bitcoin-price-slips-95k/,"Bitcoin price is correcting gains below the $96,500 resistance. BTC is now trading below $95,000 and might face hurdles near the $95,750 resistance. Bitcoin started a downside correction from the $98,880 zone. The price is trading below $96,000 and the 100 hourly Simple moving average. There was a break above a short-term bearish trend line with resistance at $94,200 on the hourly chart of the BTC/USD pair (data feed from Kraken). The pair could start another increase if it clears the $95,750 resistance zone. Bitcoin Price Corrects Gains Bitcoin price struggled to extend gains above the $98,800 and $99,000 levels. BTC started a downside correction below the $97,000 and $96,000 levels. It even dipped below $95,000. A low was formed at $92,550 and the price is now rising. There was a move above the $93,800 resistance level. The price cleared the 23.6% Fib retracement level of the downward move from the $98,880 swing high to the $92,550 low. Besides, there was a break above a short-term bearish trend line with resistance at $94,200 on the hourly chart of the BTC/USD pair. Bitcoin price is now trading below $96,000 and the 100 hourly Simple moving average. On the upside, the price could face resistance near the $95,200 level. The first key resistance is near the $95,750 level. It is close to the 50% Fib retracement level of the downward move from the $98,880 swing high to the $92,550 low. A clear move above the $95,750 resistance might send the price higher. The next key resistance could be $97,350. A close above the $97,350 resistance might initiate more gains. In the stated case, the price could rise and test the $98,880 resistance level. Any more gains might send the price toward the $100,000 level. Another Dip In BTC? If Bitcoin fails to rise above the $95,750 resistance zone, it could start another downside correction. Immediate support on the downside is near the $93,800 level. The first major support is near the $92,500 level. The next support is now near the $90,000 zone. Any more losses might send the price toward the $88,000 support in the near term. Technical indicators: Hourly MACD – The MACD is now gaining pace in the bullish zone. Hourly RSI (Relative Strength Index) – The RSI for BTC/USD is now below the 50 level. Major Support Levels – $93,800, followed by $92,500. Major Resistance Levels – $95,750, and $97,350.",BTC|bitcoin|bitcoin price|btcusd|BTCUSDT|xbtusd,EN,0,0,TRADING|BTC|EXCHANGE|MARKET,"{'name': 'NewsBTC', 'img': 'https://images.cryptocompare.com/news/default/newsbtc.png', 'lang': 'EN'}",newsbtc,2024-11-26 02:37:36
36849525,https://www.cryptointelligence.co.uk/?p=25381,1732588805,https://resources.cryptocompare.com/news/95/default.png,"Trump’s Pet Pepe (TRUMPEPE) Will Rally Over 18,000% Before Exchange Listings, While Shiba Inu and Dogecoin Lag",https://www.cryptointelligence.co.uk/trumps-pet-pepe-trumpepe-will-rally-over-18000-before-exchange-listings-while-shiba-inu-and-dogecoin-lag/,"Trump’s Pet Pepe could turn early investors into multi-millionaires, like Shiba Inu (SHIB) and Dogecoin (DOGE) did. Trump’s Pet Pepe (TRUMPEPE), a new Solana memecoin that was launched today, is set to explode over 18,000% in price in the coming days. This is because TRUMPEPE is set to soon be listed on numerous crypto exchanges, according to reports. This will give the Solana memecoin exposure to millions of additional investors, who will pour funds into the coin and drive its price up. Currently, Trump’s Pet Pepe can only be purchased via Solana decentralized exchanges, like Jup.ag and Raydium.io, and early",Blockchain News|Crypto News Today|Press Releases,EN,0,0,SHIB|DOGE|TRADING|EXCHANGE|SOL,"{'name': 'CryptoIntelligence', 'img': 'https://resources.cryptocompare.com/news/95/default.png', 'lang': 'EN'}",cryptointelligence,2024-11-26 02:40:05
36849562,https://en.coinotag.com/binance-labs-invests-in-kernel-to-enhance-bnb-chains-security-and-utility-through-innovative-restaking-infrastructure/,1732588930,https://resources.cryptocompare.com/news/77/36849562.jpeg,Binance Labs Invests in Kernel to Enhance BNB Chain’s Security and Utility Through Innovative Restaking Infrastructure,https://en.coinotag.com/binance-labs-invests-in-kernel-to-enhance-bnb-chains-security-and-utility-through-innovative-restaking-infrastructure/,"Binance Labs has made a strategic investment in Kernel, aiming to bolster security and utility within the BNB Chain through innovative restaking infrastructure. This integration facilitates the utilization of both",Bitcoin|Blockchain|News|BNB|BTC,EN,0,0,BNB|EXCHANGE|BTC|BLOCKCHAIN,"{'name': 'CoinOtag', 'img': 'https://resources.cryptocompare.com/news/77/default.png', 'lang': 'EN'}",coinotag,2024-11-26 02:42:10
36849671,https://coincu.com/293765-best-crypto-to-buy-in-2025-qubetics-vechain-polkadot-shine,1732589100,https://resources.cryptocompare.com/news/96/36849671.jpeg,Best Crypto to Buy in 2025: Qubetics Is Raising Millions and Breaking Records as VeChain Hits 18% Gains and Polkadot Eyes $45.80,https://coincu.com/293765-best-crypto-to-buy-in-2025-qubetics-vechain-polkadot-shine,"Discover why Qubetics is raising millions, VeChain surges 18%, and Polkadot targets $45.80. Explore the best crypto to buy in 2025 for massive growth potential! Read original article on coincu.com",news|Press Releases|news|CMC|Best Crypto to Buy in 2025|Polkadot Eyes $45.80|Qubetics Raising Millions|Top Cryptocurrency Investments 2025|VeChain 18% Gains,EN,0,0,DOT,"{'name': 'Coincu', 'img': 'https://resources.cryptocompare.com/news/96/default.png', 'lang': 'EN'}",coincu,2024-11-26 02:45:00
36850619,https://thecoinrise.com/qubetics-presale-1k-could-turn-into-600k-the-best-crypto-to-buy-now-amid-bitcoins-470m-liquidation-wave-vs-polkadots-bullish-run/,1732589126,https://resources.cryptocompare.com/news/60/36850619.jpeg,Qubetics Presale: $1K Could Turn Into $600K – The Best Crypto to Buy Now Amid Bitcoin’s $470M Liquidation Wave vs. Polkadot’s Bullish Run,https://thecoinrise.com/qubetics-presale-1k-could-turn-into-600k-the-best-crypto-to-buy-now-amid-bitcoins-470m-liquidation-wave-vs-polkadots-bullish-run/,Qubetics Presale: $1K Could Turn Into $600K – The Best Crypto to Buy Now Amid Bitcoin’s $470M Liquidation Wave vs. Polkadot’s Bullish Run The post Qubetics Presale: $1K Could Turn Into $600K – The Best Crypto to Buy Now Amid Bitcoin’s $470M Liquidation Wave vs. Polkadot’s Bullish Run appeared first on TheCoinrise.com .,Token Presale and ICO Insights|Qubetics,EN,0,0,BTC|DOT|TRADING,"{'name': 'The Coin Rise', 'img': 'https://images.cryptocompare.com/news/default/thecoinrise.png', 'lang': 'EN'}",thecoinrise,2024-11-26 02:45:26
36849943,https://coincu.com/293807-pump-fun-livestream-feature-paused-indefinitely,1732589576,https://resources.cryptocompare.com/news/96/36849943.jpeg,Pump.fun Livestream Feature Has Now Been Paused Indefinitely,https://coincu.com/293807-pump-fun-livestream-feature-paused-indefinitely,Pump.fun livestream feature will be turned off until its moderation infrastructure meets higher standards. Read original article on coincu.com,news|News|meme coin|Pump.fun|Pump.fun Livestream|Solana,EN,0,0,SOL,"{'name': 'Coincu', 'img': 'https://resources.cryptocompare.com/news/96/default.png', 'lang': 'EN'}",coincu,2024-11-26 02:52:56
36850033,https://decrypt.co/?p=293515,1732589698,https://resources.cryptocompare.com/news/44/36850033.jpeg,Dogecoin Foundation Seeks Backing to Fuel 2025 Plans,https://decrypt.co/293515/dogecoin-foundation-seeking-major-donors-to-fuel-2025-plans,"The Dogecoin Foundation is seeking donors to fuel its Dogebox initiative, with the aim of driving mass adoption.",dogecoin|Business,EN,0,0,DOGE|BUSINESS,"{'name': 'Decrypt', 'img': 'https://images.cryptocompare.com/news/default/decrypt.png', 'lang': 'EN'}",decrypt,2024-11-26 02:54:58
36850053,https://en.coinotag.com/dogecoin-foundation-seeks-funding-for-dogebox-initiative-to-support-mass-adoption-and-retail-acceptance/,1732589757,https://resources.cryptocompare.com/news/77/36850053.jpeg,Dogecoin Foundation Seeks Funding for Dogebox Initiative to Support Mass Adoption and Retail Acceptance,https://en.coinotag.com/dogecoin-foundation-seeks-funding-for-dogebox-initiative-to-support-mass-adoption-and-retail-acceptance/,"The Dogecoin Foundation is ramping up its efforts to drive mass adoption through its new Dogebox initiative, while seeking vital funding from major donors. The initiative aims to support small",News|DOGE,EN,0,0,DOGE,"{'name': 'CoinOtag', 'img': 'https://resources.cryptocompare.com/news/77/default.png', 'lang': 'EN'}",coinotag,2024-11-26 02:55:57
36850155,https://coincu.com/293713-xrp-price-prediction-to-10-cardano-to-6-and-pchain-to-3-from-0-004-which-crypto-will-deliver-10000x-returns,1732590000,https://resources.cryptocompare.com/news/96/36850155.jpeg,"XRP Price Prediction to $10, Cardano to $6, and PCHAIN to $3 from $0.004, Which Crypto Will Deliver 10,000x Returns?",https://coincu.com/293713-xrp-price-prediction-to-10-cardano-to-6-and-pchain-to-3-from-0-004-which-crypto-will-deliver-10000x-returns,"XRP price targets $10, Cardano eyes $6, and PCHAIN projects $3 from $0.004. Which crypto offers 10,000x potential as altcoin season approaches? Read original article on coincu.com",news|Press Releases|news|CMC|Cardano|PCHAIN|xrp price,EN,0,0,ADA|ZRX|TRADING|XRP|ALTCOIN,"{'name': 'Coincu', 'img': 'https://resources.cryptocompare.com/news/96/default.png', 'lang': 'EN'}",coincu,2024-11-26 03:00:00
36850147,https://crypto.news/?p=14313656,1732590000,https://resources.cryptocompare.com/news/74/36850147.jpeg,"Influencers get rich, meme coins die: Most bloggers’ advertising is ineffective",https://crypto.news/meme-coins-die-most-bloggers-advertising-ineffective/,The vast majority of meme coins promoted by influencers in X end up “dead” — their value drops by 90% or more within three months. The attention surrounding meme coins has led many famous X personalities to promote these tokens…,Follow-up|Crypto Scam|Influencers|Meme Coin,EN,0,0,OTHER,"{'name': 'nft.news', 'img': 'https://resources.cryptocompare.com/news/74/default.png', 'lang': 'EN'}",nft_news,2024-11-26 03:00:00
36850152,https://crypto.news/?p=14313656,1732590000,https://resources.cryptocompare.com/news/73/36850152.jpeg,"Influencers get rich, meme coins die: Most bloggers’ advertising is ineffective",https://crypto.news/meme-coins-die-most-bloggers-advertising-ineffective/,The vast majority of meme coins promoted by influencers in X end up “dead” — their value drops by 90% or more within three months. The attention surrounding meme coins has led many famous X personalities to promote these tokens…,Follow-up|Crypto Scam|Influencers|Meme Coin,EN,0,0,OTHER,"{'name': 'crypto.news', 'img': 'https://resources.cryptocompare.com/news/73/default.png', 'lang': 'EN'}",crypto_news,2024-11-26 03:00:00
36850121,https://www.newsbtc.com/?p=654897,1732590008,https://resources.cryptocompare.com/news/21/36850121.jpeg,"Inside Trump’s Crypto Holdings: $6.9M Portfolio, With One Altcoin Ready For A Major Rally",https://www.newsbtc.com/news/inside-trumps-crypto-holdings-6-9m-portfolio-with-one-altcoin-ready-for-a-major-rally/,"Recent data from market intelligence firm Arkham Intel reveals that President-elect Donald Trump’s crypto portfolio has seen significant gains, coinciding with a robust uptrend in crypto prices following his election victory on November 5. Despite Bitcoin (BTC) being at the center of Trump’s presidential campaign, one notable asset among his holdings is Ethereum (ETH), of which he owns nearly 496 coins. This altcoin has been the standout performer among his investments, rising 38% over the past thirty days. Trump’s Crypto Holdings Shine Crypto analyst Michael van de Poppe pointed out a bullish divergence on Ethereum’s daily chart, suggesting that the current market dynamics are ripe for further growth. The analyst identified a key driver behind ETH’s recent performance: a significant drop in government bond yields. As these yields decline, van de Poppe suggests that investor interest in riskier assets like Ethereum tends to increase, propelling prices higher. Related Reading: Historic Bitcoin Buy: MicroStrategy Adds 55,500 More BTC To Its Portfolio For $5.4 Billion Van de Poppe elaborated that the ongoing fluctuations in the yield markets could significantly impact Ethereum’s trajectory. With Labor Market Week approaching, he speculated that if economic indicators are weak, the Federal Reserve might implement more rate cuts. Such actions would likely lead to lower yields, further boosting Ethereum’s price. Another analyst, Jesse Olson, echoed this optimistic outlook, noting that Ethereum’s dominance over Bitcoin is showing signs of a bullish divergence. His analysis indicates that positive momentum could soon lead to significant buying opportunities for ETH. As a result of these developments, Trump’s crypto holdings have surged by nearly $1.6 million within the past 24 hours, reflecting the positive market sentiment surrounding Ethereum and other tokens in his portfolio. Major Investment From TRON Founder In a related development, crypto entrepreneur Justin Sun has emerged as a major investor in Trump’s World Liberty Financial, committing $30 million to the decentralized finance (DeFi) project. Sun, the founder of the TRON cryptocurrency, declared his support for Trump’s vision of turning the US into a blockchain hub. He noted, “TRON is committed to making America great again and leading innovation,” highlighting the project’s ambition to democratize financial services by eliminating intermediaries. Related Reading: Ethereum Analyst Predicts $3,700 Once ETH Breaks Through Resistance World Liberty Financial, which was launched shortly after Trump survived a second assassination attempt, aims to raise $300 million at a valuation of $1.5 billion. However, the project has recently revealed that its WLF token offerings are primarily being marketed offshore, with only $30 million set aside for US investors. Once this threshold is met, the US offering will close, despite having a substantial amount of tokens still available for sale. Trump is also reportedly in discussions for the acquisition of the digital asset marketplace Bakkt Holdings Inc. through Trump Media & Technology Group Corp., which he controls. At the time of writing, ETH was trading at $3,435, up 2.4% for the 24-hour period. Featured image from CFR, chart from TradingView.com",Cryptocurrency Market News|crypto|crypto news|cryptocurrency|Donald Trump|ETH|ethereum|ethereum news|ethusd|ETHUSDT|Latest Ethereum News|World Liberty Financial,EN,0,0,ETH|MARKET|TRADING|ALTCOIN|BTC,"{'name': 'NewsBTC', 'img': 'https://images.cryptocompare.com/news/default/newsbtc.png', 'lang': 'EN'}",newsbtc,2024-11-26 03:00:08
