id,guid,published_on,imageurl,title,url,body,tags,lang,upvotes,downvotes,categories,source_info,source,date
35355785,https://en.coin-turk.com/?p=171375,1730325887,https://resources.cryptocompare.com/news/79/35355785.jpeg,"Celestia Unlocks TIA Token, Impacting Market Dynamics",https://en.coin-turk.com/celestia-unlocks-tia-token-impacting-market-dynamics/,"Celestia's token unlock significantly affects TIA's market value. Experts see potential opportunities despite the price drop. Continue Reading: Celestia Unlocks TIA Token, Impacting Market Dynamics The post Celestia Unlocks TIA Token, Impacting Market Dynamics appeared first on COINTURK NEWS .",Altcoin News,EN,0,0,TIA|MARKET|TRADING,"{'name': 'CoinTurk News', 'img': 'https://resources.cryptocompare.com/news/79/default.png', 'lang': 'EN'}",cointurken,2024-10-30 22:04:47
35355926,https://cointelegraph.com/news/coinbase-harris-trump-administration-us-election,1730325942,https://images.cryptocompare.com/news/default/cointelegraph.png,Coinbase is ‘prepared to work’ with either Harris or Trump presidency,https://cointelegraph.com/news/coinbase-harris-trump-administration-us-election?utm_source=rss_feed&utm_medium=rss&utm_campaign=rss_partner_inbound,CEO Brian Armstrong also announced an additional $25 million contribution to the Fairshake PAC for the 2026 midterms “to elect pro-crypto candidates.”,regulation|kamala harris|donald trump|coinbase|cryptocurrency exchange|us elections 2024,EN,0,0,EXCHANGE|REGULATION,"{'name': 'CoinTelegraph', 'img': 'https://images.cryptocompare.com/news/default/cointelegraph.png', 'lang': 'EN'}",cointelegraph,2024-10-30 22:05:42
35356127,https://cointelegraph.com/news/polymarket-presidential-election-odds-rife-wash-trading-report,1730326196,https://images.cryptocompare.com/news/default/cointelegraph.png,Polymarket presidential election odds rife with wash trading — report,https://cointelegraph.com/news/polymarket-presidential-election-odds-rife-wash-trading-report?utm_source=rss_feed&utm_medium=rss&utm_campaign=rss_partner_inbound,"According to the current Polymarket presidential election odds, Donald Trump is favored to win the election at 65.5%.",Polymarket|Trump|Harris|US Presidential Election|2024 US Presidential election,EN,0,0,TRADING,"{'name': 'CoinTelegraph', 'img': 'https://images.cryptocompare.com/news/default/cointelegraph.png', 'lang': 'EN'}",cointelegraph,2024-10-30 22:09:56
35356331,https://cryptopotato.com/?p=368309,1730326543,https://resources.cryptocompare.com/news/27/35356331.jpeg,Visa Partners With Coinbase to Enable Real-Time Cash Outs,https://cryptopotato.com/visa-partners-with-coinbase-to-enable-real-time-cash-outs/,The global credit card giant has teamed up with America’s largest crypto exchange again.,AA News|Crypto News|Coinbase|Visa,EN,0,0,EXCHANGE,"{'name': 'Crypto Potato', 'img': 'https://images.cryptocompare.com/news/default/cryptopotato.png', 'lang': 'EN'}",cryptopotato,2024-10-30 22:15:43
35356555,https://timestabloid.com/?p=48725,1730326546,https://resources.cryptocompare.com/news/67/default.png,Top 5 Cryptocurrencies to Invest in Now: October 2024,https://timestabloid.com/top-5-cryptocurrencies-to-invest-in-now-october-2024/,"The blockchain ecosystem continues to evolve, driven by the need for enhanced security, scalability, and utility across different sectors. Platforms like Quant, Theta, Kaspa, Stacks, and Qubetics are making strides in blockchain innovation. While each has unique capabilities, Qubetics introduces a particularly forward-looking feature: quantum-resistant addressing. This addition aims to safeguard user identities and transactions The post Top 5 Cryptocurrencies to Invest in Now: October 2024 appeared first on Times Tabloid .",Finance|News,EN,0,0,BLOCKCHAIN,"{'name': 'TimesTabloid', 'img': 'https://resources.cryptocompare.com/news/67/default.png', 'lang': 'EN'}",timestabloid,2024-10-30 22:15:46
35358480,https://thecoinrise.com/aptos-steady-wlfi-recovering-meanwhile-qubetics-token-price-rises-10-weekly-your-last-chance-to-buy-early/,1730326547,https://resources.cryptocompare.com/news/60/35358480.jpeg,"Aptos Steady, WLFI Recovering—Meanwhile, Qubetics’ Token Price Rises 10% Weekly—Your Last Chance to Buy Early!",https://thecoinrise.com/aptos-steady-wlfi-recovering-meanwhile-qubetics-token-price-rises-10-weekly-your-last-chance-to-buy-early/,"Aptos stays steady, WLFI shows recovery, and Qubetics gains momentum with $TICS tokens rising 10% weekly. Secure your stake before the final presale surge! The post Aptos Steady, WLFI Recovering—Meanwhile, Qubetics’ Token Price Rises 10% Weekly—Your Last Chance to Buy Early! appeared first on TheCoinrise.com .",Token Presale and ICO Insights|Qubetics,EN,0,0,APT|TRADING,"{'name': 'The Coin Rise', 'img': 'https://images.cryptocompare.com/news/default/thecoinrise.png', 'lang': 'EN'}",thecoinrise,2024-10-30 22:15:47
35356594,https://en.bitcoinsistemi.com/watch-out-one-of-the-largest-decentralized-cryptocurrency-platforms-reportedly-hacked-do-not-interact-with-suspicious-platform/,1730326807,https://resources.cryptocompare.com/news/81/35356594.jpeg,"Watch Out: One of the Largest Decentralized Cryptocurrency Platforms Reportedly Hacked, Do Not Interact with Suspicious Platform",https://en.bitcoinsistemi.com/watch-out-one-of-the-largest-decentralized-cryptocurrency-platforms-reportedly-hacked-do-not-interact-with-suspicious-platform/,"According to breaking news, a decentralized cryptocurrency exchange is said to have been the subject of a third-party hack. Continue Reading: Watch Out: One of the Largest Decentralized Cryptocurrency Platforms Reportedly Hacked, Do Not Interact with Suspicious Platform",News,EN,0,0,EXCHANGE,"{'name': 'BitcoinSistemi', 'img': 'https://resources.cryptocompare.com/news/81/default.png', 'lang': 'EN'}",bitcoinsistemi,2024-10-30 22:20:07
35358483,https://thecoinrise.com/wall-street-expert-reveals-sol-price-targets-for-november-wif-intl-could-soar-if-the-god-candle-forms/,1730327429,https://resources.cryptocompare.com/news/60/35358483.jpeg,Wall Street Expert Reveals SOL Price Targets For November—WIF & INTL Could Soar if the ‘God Candle’ Forms,https://thecoinrise.com/wall-street-expert-reveals-sol-price-targets-for-november-wif-intl-could-soar-if-the-god-candle-forms/,"An expert revealed Solana (SOL) price targets for the upcoming November, giving two more names, WIF and INTL, that can see new heights if all goes well. The post Wall Street Expert Reveals SOL Price Targets For November—WIF & INTL Could Soar if the ‘God Candle’ Forms appeared first on TheCoinrise.com .",Token Presale and ICO Insights|IntelMarkets,EN,0,0,SOL|TRADING|WIF,"{'name': 'The Coin Rise', 'img': 'https://images.cryptocompare.com/news/default/thecoinrise.png', 'lang': 'EN'}",thecoinrise,2024-10-30 22:30:29
35357141,https://news.bitcoin.com/?p=681324&preview=true&preview_id=681324,1730327444,https://resources.cryptocompare.com/news/14/35357141.jpeg,Russia to Ban Crypto Mining in Key Regions as Energy Shortages Intensify,https://news.bitcoin.com/russia-to-ban-crypto-mining-in-key-regions-as-energy-shortages-intensify/,"Russia is moving to ban cryptocurrency mining in energy-restricted regions, citing severe power shortages that could jeopardize long-term stability until 2030. Crypto Miners Face a Major Blow in Russia’s Energy-Restricted Zones Russian Deputy Energy Minister Yevgeny Grabchak has stated that digital currency mining will soon be banned at the state level in several Russian regions",Mining|Bitcoin mining|Russia,EN,0,0,MINING,"{'name': 'Bitcoin.com', 'img': 'https://images.cryptocompare.com/news/default/bitcoincom.png', 'lang': 'EN'}",bitcoin.com,2024-10-30 22:30:44
35357837,https://www.cryptoglobe.com/latest/2024/10/ethereum-eth-poised-for-breakout-analyst-suggests-potential-rally-to-6000/,1730328240,https://resources.cryptocompare.com/news/2/35357837.jpeg,"Ethereum (ETH) Poised for Breakout? Analyst Suggests Potential Rally to $6,000",https://www.cryptoglobe.com/latest/2024/10/ethereum-eth-poised-for-breakout-analyst-suggests-potential-rally-to-6000/,"The second-largest cryptocurrency by market capitalization Ethereum (ETH) has been significantly underperforming Bitcoin (BTC) so far this year, but new analysis suggests ETH could now surge to surpass its previous all-time high and catch up. According to a chart shared by popular cryptocurrency analyst Ali Martinez, Ethereum managed to hold onto its $2,400 support level",Ethereum|ETH|Altcoins|Ethereum ($ETH),EN,0,0,ETH|TRADING|ALTCOIN|BTC|MARKET,"{'name': 'CryptoGlobe', 'img': 'https://images.cryptocompare.com/news/default/cryptoglobe.png', 'lang': 'EN'}",cryptoglobe,2024-10-30 22:44:00
35346749,2Z4HRQJGRVAIDB7FZ6CJGLR3M4,1730328245,https://resources.cryptocompare.com/news/5/35346749.jpeg,"Protocol Village: Coinbase's Base Adds Fault Proofs, Patching Achilles' Heel of Optimistic Setup",https://www.coindesk.com/tech/2024/10/30/protocol-village/?utm_medium=referral&utm_source=rss&utm_campaign=headlines,,Technology|news|Blockchain|Ethereum|Bitcoin|Tech|Blockchain Technology|EVM|Protocol Village,EN,0,0,BLOCKCHAIN|BTC|ETH|TECHNOLOGY|EXCHANGE,"{'name': 'CoinDesk', 'img': 'https://images.cryptocompare.com/news/default/coindesk.png', 'lang': 'EN'}",coindesk,2024-10-30 22:44:05
35358228,https://www.cryptopolitan.com/?p=607436,1730328355,https://resources.cryptocompare.com/news/43/35358228.jpeg,The US government is moving additional funds seized from Alameda Research,https://www.cryptopolitan.com/us-government-is-moving-funds-seized-from-alameda/,"Alameda Research has residual token holdings, which may go toward settling the FTX repayment schedule to creditors.",News|AMPL|ANT|ETH|FTM|FTX|SOL|TEL|WLD,EN,0,0,RESEARCH|ETH|FTM|SOL|WLD,"{'name': 'Cryptopolitan', 'img': 'https://images.cryptocompare.com/news/default/cryptopolitan.png', 'lang': 'EN'}",cryptopolitan,2024-10-30 22:45:55
35358038,https://coingape.com/?post_type=markets&p=222974,1730328567,https://images.cryptocompare.com/news/default/coingape.png,5 Key Metrics Indicate Solana Price Will Hit New All-Time Highs,https://coingape.com/markets/5-key-metrics-indicate-solana-price-will-hit-new-all-time-highs/,"Over the past 7 months, the Solana price has traded sideways, struggling to sustain above the $200 level. However, as the crypto market witnessed a renewed recovery in late October, the SOL coin price is poised to escape this long-coming consolidation. Here, we delve into five key metrics that suggest Solana could soon reach new The post 5 Key Metrics Indicate Solana Price Will Hit New All-Time Highs appeared first on CoinGape .",Price Analysis|SOL|Solana Price Analysis,EN,0,0,SOL|TRADING|MARKET,"{'name': 'CoinGape', 'img': 'https://images.cryptocompare.com/news/default/coingape.png', 'lang': 'EN'}",coingape,2024-10-30 22:49:27
35358645,https://www.newsbtc.com/?p=650730,1730329211,https://images.cryptocompare.com/news/default/newsbtc.png,Celestia (TIA) Set For Major Breakout? Top OTC Exec Warns Of Supply Shock,https://www.newsbtc.com/news/celestia-tia-major-breakout-otc-exec-supply-shock/,"In an analysis shared on X, Taran Sabharwal, CEO of Stix—a leading OTC trading platform specializing in liquidity solutions for private crypto transactions—provided insights into the upcoming unlock dynamics of the Celestia (TIA) token scheduled for October 31, 2024. His assessment suggests that the market may be underestimating the potential impact on TIA’s price action heading into November. Why Celestia (TIA) Could Be A Buy “TIA – an OTC story,” Sabharwal began. “We used on-chain data (via @celenium_io API) to judge exactly how the unlock dynamics may shape TIA’s PA going into Nov. The results are in the table above. We’ve summarized that a total of 92.3M TIA will be liquid post unlock, which would act as the upper bound of overall spot selling pressure.” Interestingly, this figure accounts for less than 50% of the total cliff unlocks, suggesting that the actual sell pressure may be only half of what the market has been anticipating. Sabharwal highlighted that the real increase in circulating supply compared to the current supply indicates a 41.8% dilution. Related Reading: Celestia (TIA) Leads Crypto Market With 16% Surge, Will It Hit $7 This Month? A significant factor in this dynamic is the activity of OTC buyers who acquired large amounts of the initial unlock and hedged on perpetual futures, causing open interest to surge in recent months. “We expect many of these shorts to continue winding down, partially negating the spot-selling pressure,” he explained. This unwinding could serve as a bullish signal for spot buyers due to the potential reset in funding rates. Sabharwal’s analysis included several key assumptions. OTC round buyers possess an 11 million TIA cliff unlock, included in the non-staked token category since these tokens originated from treasury wallets not tagged on the blockchain explorer. His team mapped a total of 292 vesting wallets but acknowledged some gaps, which were also included in the non-staked category. Reflecting on TIA’s OTC history on Stix, Sabharwal observed that Celestia has been one of the most actively traded assets in the OTC market this cycle. Early in the cycle, it offered an attractive opportunity for directional buyers, while sellers were eager to realize large unrealized profits without expecting an imminent bull market in Q3 2023. He continued: “In Q1 2024, the bull had matured and TIA rallied to $20+. OTC activity was minimal here as sellers didn’t want to take larger discounts (40+%) and buyers didn’t want to bid higher than the $8.5 ceiling. We saw almost no activity as sellers were ‘feeling’ rich and wanted to stay risk-on, despite having the opportunity to realize 100-800x on their investments.” Related Reading: Celestia Plans For 1 GB Blocks For Scaling: Why Are TIA Holders Worried? The dynamics shifted when TIA fell below $5. This was around the time when the Celestia Foundation started raising its OTC round of $100M at $3. “The vesting for buyers was the same as those of private investors—33% unlock on Oct 31 2024 (<2 months from the round) and a 12-month linear unlock,” Sabharwal noted. During the third and fourth quarters of 2024, aggressive OTC trading activity resumed, with sellers offloading various positions. Stix alone facilitated approximately $60 million in TIA volume since July, suggesting that total trading volume could exceed $80 million across all liquidity channels, assuming Stix holds a 75% market share in the OTC space. Summing up his analysis, Sabharwal concluded: “TLDR: Shorts will keep unwinding into the unlock and funding rates may reset to 0 or positive. People who missed the 9th October unstaking deadline may also have unstaked during October, causing further spot supply (ready to be sold) going into November. Either way, the supply shock is massive and it’s been the most broadcasted unlock of this cycle. That, coupled with suppressing OTC discounts, may create a lot of action for the coin.” Renowned crypto analyst Will Clemente also weighed in on the developments via X: “Great piece on $TIA OTC activity by Taran from Stix. TLDR: OTC discount to spot in the private market has compressed over the last year, showing growing demand into the unlock. Stix alone has done $60mm in TIA OTC volume since July.” Clemente added his perspective on the potential market impact: “I think this BTC price action has further slid the probability of Thursday’s TIA unlock being bearish towards ‘no’. 6 months of reaccumulation after 80% drawdown, ton of OTC volume, most widely telegraphed unlock in crypto history, 9 figs short, BTC nearing ATHs. Am long rn.” At press time, TIA traded at $5.00. Featured image created with DALL.E, chart from TradingView.com",Cryptocurrency Market News|Celestia|Celestia (TIA)|Celestia news|Celestia price|Celestia TIA News|TIA|TIA news|TIA price,EN,0,0,TIA|MARKET|TRADING|ZRX|BLOCKCHAIN,"{'name': 'NewsBTC', 'img': 'https://images.cryptocompare.com/news/default/newsbtc.png', 'lang': 'EN'}",newsbtc,2024-10-30 23:00:11
35358667,https://ambcrypto.com/?p=438193,1730329233,https://images.cryptocompare.com/news/default/ambcrypto.png,Bitcoin: $48M short liquidations and extreme greed – Is a plunge coming?,https://ambcrypto.com/bitcoin-48m-short-liquidations-and-extreme-greed-is-a-plunge-coming/,"As Bitcoin's price climbs above $72,000, short liquidations have surged, signaling heightened market volatility. .",Bitcoin|BTC Trading View|News|News 1|Social|Trading View,EN,0,0,BTC|MARKET|TRADING,"{'name': 'AMB Crypto', 'img': 'https://images.cryptocompare.com/news/default/ambcrypto.png', 'lang': 'EN'}",ambcrypto,2024-10-30 23:00:33
35358908,https://en.coin-turk.com/?p=171378,1730329489,https://resources.cryptocompare.com/news/79/35358908.jpeg,XRP Ledger Achieves Major Milestone with Decentralized Identifiers,https://en.coin-turk.com/xrp-ledger-achieves-major-milestone-with-decentralized-identifiers/,"XRP Ledger activated decentralized identifiers, enhancing user-controlled digital identities. Decentralized identifiers offer a secure mechanism for digital identity management. Continue Reading: XRP Ledger Achieves Major Milestone with Decentralized Identifiers The post XRP Ledger Achieves Major Milestone with Decentralized Identifiers appeared first on COINTURK NEWS .",Ripple (XRP),EN,0,0,WALLET|XRP,"{'name': 'CoinTurk News', 'img': 'https://resources.cryptocompare.com/news/79/default.png', 'lang': 'EN'}",cointurken,2024-10-30 23:04:49
35359384,https://coincu.com/289780-join-1300tics-holders-before-price-hike-qubetics,1730330100,https://resources.cryptocompare.com/news/96/35359384.jpeg,"Join Over 1,300 $TICS Holders Today Before the Next Price Hike! Qubetics in Phase 6 as Toncoin Adapts and Tokero Innovates",https://coincu.com/289780-join-1300tics-holders-before-price-hike-qubetics,"Cryptocurrencies face various challenges, particularly around the need for seamless cross-border transactions. Toncoin, for example, has shown resilience despite recent market volatility, demonstrating its potential as a reliable digital asset. Similarly, Tokero is making strides as a user-friendly cryptocurrency exchange, bridging the gap between traditional finance and the burgeoning Web3 world. However, the Qubetics ($TICS)",news|Press Releases|news|CMC|Presale|Qubetics|Tokero|toncoin,EN,0,0,TRADING|EXCHANGE|MARKET,"{'name': 'Coincu', 'img': 'https://resources.cryptocompare.com/news/96/default.png', 'lang': 'EN'}",coincu,2024-10-30 23:15:00
35361666,https://thecoinrise.com/qubetics-at-0-017-potential-to-soar-to-170k-roi-85276-6-plus-quant-aims-for-300-and-kryza-gains-momentum/,1730330137,https://resources.cryptocompare.com/news/60/35361666.jpeg,"Qubetics at $0.017—Potential to Soar to $170K (ROI: 85,276.6%)! Plus, Quant Aims for $300 and Kryza Gains Momentum",https://thecoinrise.com/qubetics-at-0-017-potential-to-soar-to-170k-roi-85276-6-plus-quant-aims-for-300-and-kryza-gains-momentum/,"Invest in Qubetics at $0.017 with an ROI of 85,276.6%! Meanwhile, Quant targets $300, and Kryza Network is gaining momentum in the crypto space. The post Qubetics at $0.017—Potential to Soar to $170K (ROI: 85,276.6%)! Plus, Quant Aims for $300 and Kryza Gains Momentum appeared first on TheCoinrise.com .",Token Presale and ICO Insights|Qubetics,EN,0,0,OTHER,"{'name': 'The Coin Rise', 'img': 'https://images.cryptocompare.com/news/default/thecoinrise.png', 'lang': 'EN'}",thecoinrise,2024-10-30 23:15:37
35359634,https://cointelegraph.com/news/canary-capital-files-spot-solana-etf,1730330345,https://images.cryptocompare.com/news/default/cointelegraph.png,Canary Capital files for spot Solana ETF with SEC,https://cointelegraph.com/news/canary-capital-files-spot-solana-etf?utm_source=rss_feed&utm_medium=rss&utm_campaign=rss_partner_inbound,The crypto asset manager has now filed for a spot Solana ETF after getting the ball rolling for a spot for XRP ETF and Litecoin ETF earlier in October.,Canary Capital|Spot Solana ETF|VanEck|21Shares|Franklin Templeton|Spot Bitcoin ETF|Spot Ether ETF|Steven McClurg,EN,0,0,SOL|REGULATION|LTC|XRP,"{'name': 'CoinTelegraph', 'img': 'https://images.cryptocompare.com/news/default/cointelegraph.png', 'lang': 'EN'}",cointelegraph,2024-10-30 23:19:05
35359757,https://decrypt.co/?p=289252,1730330429,https://resources.cryptocompare.com/news/44/35359757.jpeg,Solana ETF Momentum Grows With New Filing After Bitcoin and Ethereum Approvals,https://decrypt.co/289252/solana-etf-momentum-grows-with-new-filing-after-bitcoin-and-ethereum-approvals,"New American asset manager Canary Capital has filed to launch a spot Solana ETF in the United States, making it the third such firm to do so.",|Law and Order,EN,0,0,SOL|BTC|ETH,"{'name': 'Decrypt', 'img': 'https://images.cryptocompare.com/news/default/decrypt.png', 'lang': 'EN'}",decrypt,2024-10-30 23:20:29
35360015,https://www.cryptopolitan.com/?p=607435,1730330433,https://resources.cryptocompare.com/news/43/35360015.jpeg,"Reddit sold off most of its Bitcoin in September, SEC filing shows",https://www.cryptopolitan.com/reddit-disposed-of-a-majority-crypto-holding/,"Reddit sold the majority of its cryptocurrency holding, mainly dominated by Bitcoin, before BTC started pumping up in October, as revealed in its latest Securities and Exchange Commission (SEC) filing. The news comes as Bitcoin has experienced a significant price gain that cryptocurrency traders have coined the term ‘Uptober.’ In its SEC filing the company said:",News|Bitcoin|Ether|Reddit|Securities and Exchange Commission,EN,0,0,BTC|REGULATION|EXCHANGE|TRADING,"{'name': 'Cryptopolitan', 'img': 'https://images.cryptocompare.com/news/default/cryptopolitan.png', 'lang': 'EN'}",cryptopolitan,2024-10-30 23:20:33
35359861,https://www.cryptointelligence.co.uk/?p=23910,1730330640,https://resources.cryptocompare.com/news/95/default.png,"Musk Trillionaire (MUSKTRIL) Solana Memecoin Will Explode 17,000% Before Exchange Listings, As Shiba Inu and Dogecoin Underperform",https://www.cryptointelligence.co.uk/musk-trillionaire-musktril-solana-memecoin-will-explode-17000-before-exchange-listings-as-shiba-inu-and-dogecoin-underperform/,"Musk Trillionaire could turn early investors into multi-millionaires, like Shiba Inu (SHIB) and Dogecoin (DOGE) did. Musk Trillionaire (MUSKTRIL), a new Solana memecoin that was launched today, is set to explode over 17,000% in price in the coming days. This is because MUSKTRIL is set to soon be listed on numerous crypto exchanges, according to reports. This will give the Solana memecoin exposure to millions of additional investors, who will pour funds into the coin and drive its price up. Currently, Musk Trillionaire can only be purchased via Solana decentralized exchanges, like Jup.ag and Raydium.io, and early investors stand to",Blockchain News|Crypto News Today,EN,0,0,SHIB|SOL|DOGE|EXCHANGE|BUSINESS,"{'name': 'CryptoIntelligence', 'img': 'https://resources.cryptocompare.com/news/95/default.png', 'lang': 'EN'}",cryptointelligence,2024-10-30 23:24:00
35360065,https://en.coinotag.com/canary-capital-files-for-spot-solana-etf-following-interest-from-other-asset-managers/,1730330868,https://resources.cryptocompare.com/news/77/default.png,"Canary Capital Files for Spot Solana ETF, Following Interest from Other Asset Managers",https://en.coinotag.com/canary-capital-files-for-spot-solana-etf-following-interest-from-other-asset-managers/,"Canary Capital has intensified its drive in the cryptocurrency space by filing for a spot Solana ETF, adding to its recent applications for XRP and Litecoin ETFs. The asset manager’s",Analysis|Bitcoin|Ethereum|News,EN,0,0,SOL|BTC|ETH|MARKET|LTC,"{'name': 'CoinOtag', 'img': 'https://resources.cryptocompare.com/news/77/default.png', 'lang': 'EN'}",coinotag,2024-10-30 23:27:48
35360224,https://en.coinotag.com/canary-capital-files-for-spot-solana-etf-amid-growing-interest-and-regulatory-challenges-in-the-u-s/,1730330977,https://resources.cryptocompare.com/news/77/default.png,Canary Capital Files for Spot Solana ETF Amid Growing Interest and Regulatory Challenges in the U.S.,https://en.coinotag.com/canary-capital-files-for-spot-solana-etf-amid-growing-interest-and-regulatory-challenges-in-the-u-s/,"Canary Capital has joined the race to launch a spot Solana ETF in the U.S., following the footsteps of prominent players like VanEck and 21Shares. This move underlines the increasing",News,EN,0,0,SOL,"{'name': 'CoinOtag', 'img': 'https://resources.cryptocompare.com/news/77/default.png', 'lang': 'EN'}",coinotag,2024-10-30 23:29:37
35363132,https://cryptonews.com/?p=301095,1730331000,https://resources.cryptocompare.com/news/52/35363132.jpeg,‘Some’ Russian Regions to Ban Crypto Mining as Crackdown Continues,https://cryptonews.com/news/some-russian-regions-to-ban-crypto-mining-as-crackdown-continues/,"Russia’s Energy Ministry says it will ban crypto mining in “some” regions, with crackdowns on “illegal” miners intensifying in Siberia. The post ‘Some’ Russian Regions to Ban Crypto Mining as Crackdown Continues appeared first on Cryptonews .",Blockchain News|News|Crypto Mining|Russia,EN,0,0,MINING,"{'name': 'cryptonews', 'img': 'https://images.cryptocompare.com/news/default/cryptonews.png', 'lang': 'EN'}",cryptonews,2024-10-30 23:30:00
