id,guid,published_on,imageurl,title,url,body,tags,lang,upvotes,downvotes,categories,source_info,source,date
35363132,https://cryptonews.com/?p=301095,1730331000,https://resources.cryptocompare.com/news/52/35363132.jpeg,‘Some’ Russian Regions to Ban Crypto Mining as Crackdown Continues,https://cryptonews.com/news/some-russian-regions-to-ban-crypto-mining-as-crackdown-continues/,"Russia’s Energy Ministry says it will ban crypto mining in “some” regions, with crackdowns on “illegal” miners intensifying in Siberia. The post ‘Some’ Russian Regions to Ban Crypto Mining as Crackdown Continues appeared first on Cryptonews .",Blockchain News|News|Crypto Mining|Russia,EN,0,0,MINING,"{'name': 'cryptonews', 'img': 'https://images.cryptocompare.com/news/default/cryptonews.png', 'lang': 'EN'}",cryptonews,2024-10-30 23:30:00
35360239,https://news.bitcoin.com/?p=681328&preview=true&preview_id=681328,1730331041,https://resources.cryptocompare.com/news/14/35360239.jpeg,US State Official Urges Bitcoin Investment for Retirement Funds to Future-Proof Pensions,https://news.bitcoin.com/us-state-official-urges-bitcoin-investment-for-retirement-funds-to-future-proof-pensions/,"A top financial officer of the U.S. state of Florida is advocating for state retirement funds to consider cryptocurrency investments, calling bitcoin a hedge against market volatility. US State Official Pushes Bitcoin as Hedge for Public Retirement Stability Chief Financial Officer and State Fire Marshal Jimmy Patronis, a statewide elected official and member of Florida’s",Featured|Bitcoin|Florida,EN,0,0,BTC|SPONSORED|MARKET,"{'name': 'Bitcoin.com', 'img': 'https://images.cryptocompare.com/news/default/bitcoincom.png', 'lang': 'EN'}",bitcoin.com,2024-10-30 23:30:41
35363133,https://cryptonews.com/?p=301343,1730332384,https://resources.cryptocompare.com/news/52/35363133.jpeg,"Best Crypto to Buy Now October 30 – Maker, Chainlink, Mantra",https://cryptonews.com/news/best-crypto-to-buy-now-october-30-maker-chainlink-mantra/,"Bitcoin (BTC) is taking a breather and consolidating just below the all-time highs it nearly hit earlier this week, with investors taking the opportunity to assess what might be the best crypto to buy now if a new leg higher in the market is around the corner. The post Best Crypto to Buy Now October 30 – Maker, Chainlink, Mantra appeared first on Cryptonews .",Industry Talk|Altcoins|Bitcoin|Ethereum,EN,0,0,LINK|BTC|ALTCOIN|ETH|BUSINESS,"{'name': 'cryptonews', 'img': 'https://images.cryptocompare.com/news/default/cryptonews.png', 'lang': 'EN'}",cryptonews,2024-10-30 23:53:04
35361506,https://crypto.news/?p=14306976,1730332500,https://resources.cryptocompare.com/news/73/35361506.jpeg,Two firms announce new layoffs: What’s happening and what does the SEC have to do with it,https://crypto.news/two-firms-announce-new-layoffs-whats-happening-sec/,"Two crypto companies, dYdX and ConsenSys, have announced a new round of layoffs. What’s happening, and why are American regulators being blamed for this? Antonio Juliano, the CEO of the decentralized derivatives exchange dYdX, announced a 35% layoff. He thanked…",Follow-up|ConsenSys|dYdX|SEC,EN,0,0,REGULATION|EXCHANGE,"{'name': 'crypto.news', 'img': 'https://resources.cryptocompare.com/news/73/default.png', 'lang': 'EN'}",crypto_news,2024-10-30 23:55:00
35361486,https://crypto.news/?p=14306976,1730332500,https://resources.cryptocompare.com/news/74/35361486.jpeg,Two firms announce new layoffs: What’s happening and what does the SEC have to do with it,https://crypto.news/two-firms-announce-new-layoffs-whats-happening-sec/,"Two crypto companies, dYdX and ConsenSys, have announced a new round of layoffs. What’s happening, and why are American regulators being blamed for this? Antonio Juliano, the CEO of the decentralized derivatives exchange dYdX, announced a 35% layoff. He thanked…",Follow-up|ConsenSys|dYdX|SEC,EN,0,0,REGULATION|EXCHANGE,"{'name': 'nft.news', 'img': 'https://resources.cryptocompare.com/news/74/default.png', 'lang': 'EN'}",nft_news,2024-10-30 23:55:00
35361621,https://en.coinotag.com/breakingnews/microstrategys-btc-holdings-reach-252220-as-company-plans-42-billion-capital-strategy/,1730332658,https://resources.cryptocompare.com/news/77/35361621.jpeg,"MicroStrategy’s BTC Holdings Reach 252,220 as Company Plans $42 Billion Capital Strategy",https://en.coinotag.com/breakingnews/microstrategys-btc-holdings-reach-252220-as-company-plans-42-billion-capital-strategy/,"On October 31, MicroStrategy made headlines by disclosing its third-quarter financial results for 2024 via CoinDesk. By the close of Q3, the firm’s impressive portfolio included a staggering 252,220 BTC,",BTC,EN,0,0,BTC,"{'name': 'CoinOtag', 'img': 'https://resources.cryptocompare.com/news/77/default.png', 'lang': 'EN'}",coinotag,2024-10-30 23:57:38
35361726,https://www.cryptonewsz.com/doge-hits-0-17-hurdle-is-a-reversal-ahead/,1730332781,https://images.cryptocompare.com/news/default/cryptonewsz.png,Dogecoin (DOGE) Faces Resistance at $0.17; Are Technicals Signaling a Reversal?,https://www.cryptonewsz.com/doge-hits-0-17-hurdle-is-a-reversal-ahead/,"The dog-themed meme coin DOGE encountered resistance around $0.1797, a recent peak reached after Elon Musk’s endorsement at…",Price Analysis,EN,0,0,DOGE,"{'name': 'CryptoNewsZ', 'img': 'https://images.cryptocompare.com/news/default/cryptonewsz.png', 'lang': 'EN'}",cryptonewsz,2024-10-30 23:59:41
35361727,https://dailyhodl.com/?p=307321,1730332802,https://images.cryptocompare.com/news/default/dailyhodl.png,"Crypto Analyst Says DeFi Altcoin Gearing Up for Liftoff, Updates Outlook on Solana and Dogecoin",https://dailyhodl.com/2024/10/30/crypto-analyst-says-defi-altcoin-gearing-up-for-liftoff-updates-outlook-on-solana-and-dogecoin/,"A crypto strategist who accurately called the Bitcoin (BTC) correction earlier this year thinks a decentralized finance (DeFi) altcoin is getting ready to erupt. Pseudonymous analyst Rekt Capital tells his 508,200 followers on the social media platform X that the native asset of the yield tokenization protocol Pendle (PENDLE) looks poised to start a new The post Crypto Analyst Says DeFi Altcoin Gearing Up for Liftoff, Updates Outlook on Solana and Dogecoin appeared first on The Daily Hodl .",Altcoins|Trading|doge|dogecoin|News|pendle|SOL|Solana,EN,0,0,SOL|ALTCOIN|DOGE|BTC|TRADING,"{'name': 'The Daily Hodl', 'img': 'https://images.cryptocompare.com/news/default/dailyhodl.png', 'lang': 'EN'}",dailyhodl,2024-10-31 00:00:02
35361806,https://ambcrypto.com/?p=438200,1730332821,https://images.cryptocompare.com/news/default/ambcrypto.png,"BitPoint Japan’s PEPE listing should help memecoin’s price, but did it?",https://ambcrypto.com/bitpoint-japans-pepe-listing-should-help-memecoins-price-but-did-it/,"Listing is good news usually, but is the Japanese market any different?",Memecoins|News|News 1|Pepe|Trading View|ambcrypto,EN,0,0,ASIA|PEPE|TRADING|MARKET,"{'name': 'AMB Crypto', 'img': 'https://images.cryptocompare.com/news/default/ambcrypto.png', 'lang': 'EN'}",ambcrypto,2024-10-31 00:00:21
35362332,https://www.cryptonewsz.com/avax-and-trx-investors-pick-rcof-for-quick-rally/,1730332832,https://images.cryptocompare.com/news/default/cryptonewsz.png,"AVAX and TRX Investors Pick RCOF For Quick 4,300% Rally",https://www.cryptonewsz.com/avax-and-trx-investors-pick-rcof-for-quick-rally/,A surprising trend has emerged in the crypto market. Investors are pivoting from established players like Avalanche (AVAX)…,,EN,0,0,BUSINESS|AVAX|TRADING|TRX|MARKET,"{'name': 'CryptoNewsZ', 'img': 'https://images.cryptocompare.com/news/default/cryptonewsz.png', 'lang': 'EN'}",cryptonewsz,2024-10-31 00:00:32
35361730,https://www.newsbtc.com/?p=650749,1730332843,https://images.cryptocompare.com/news/default/newsbtc.png,"Bitcoin Boom: Is BTC Preparing For Another 6X To $462,000?",https://www.newsbtc.com/bitcoin-news/bitcoin-boom-is-btc-preparing-for-another-6x-to-462000/,"Bitcoin is marching higher, easing past $70,000 and $72,000 in the past two days, sparking a wave of demand. Although prices are moving within a tight range at spot rates, the uptrend remains. While there are pockets of weakness, at least seen earlier today, candlestick formation in the daily and weekly charts point to strength. Is Bitcoin Preparing For A 6X Surge To $462,000? In a post on X, one analyst thinks Bitcoin will not only break above its all-time high at $74,000 but can easily 6X to over $462,000 in the coming sessions. To support this outlook, the analyst said the coin is breaking out above key resistance levels, and Fibonacci extension levels mirror this shift in trend after the Q3 2024 plunge. Related Reading: Bitcoin Needs Daily Close Above $76,000 To Confirm True Breakout: Analyst Based on the analyst’s assessment, historical price action shows that BTC peaks between the 1.618 and 2.272 Fibonacci extension levels. Technical analysts use this tool to project how fast prices will rally or drop based on a given range. If history guides and the Fibonacci extension levels remain valid, applying the same pattern to the current cycle could easily see Bitcoin soar to between $174,000 and $462,000. These two levels mark the extension levels’ lower and upper limits that define past cycles’ peak zone. As bullish as this forecast is, it should be known that the range anchoring any Fibonacci extension is subjective. For this reason, it will change depending on the analyst, meaning potential peaks will shift accordingly. Despite everything, the consensus is that Bitcoin could break and reach new all-time highs in Q4 2024. Taking to X, another analyst said Bitcoin is already within a bullish breakout formation, easing above a descending channel or bull flag. At the same time, prices are breaking above the resistance of a “cup and handle” pattern. Institutions Buying As BTC Recovers If bulls take over, pushing prices higher, the evolution would confirm gains of Q1 2024. Subsequently, it would mark the resumption of bulls, an encouraging development following the 30% drop from March highs. Related Reading: Dogecoin Metrics Reveal Increasing Network Activity – Is DOGE Ready To Break Yearly Highs? Amid this wave of optimism, institutions are also pouring in, getting exposure via spot Bitcoin ETFs. According to SosoValue, there are massive inflows as institutions buy more shares on behalf of their clients. On October 29, spot Bitcoin ETF issuers in the United States bought $870 million worth of shares backed by BTC for their clients. BlackRock’s IBIT received $642 million, pushing their BTC under management to over $24.9 billion. Feature image from DALLE, chart from TradingView",Bitcoin News|bitcoin|bitcoin price|bitcoin trading|BlackRock|btc|BTCUSDT|IBIT|spot Bitcoin ETFs,EN,0,0,BTC|TRADING|MARKET|DOGE,"{'name': 'NewsBTC', 'img': 'https://images.cryptocompare.com/news/default/newsbtc.png', 'lang': 'EN'}",newsbtc,2024-10-31 00:00:43
35362235,https://u.today/dogecoin-doge-price-explosion-whats-happening-xrps-weakness-caused-by-this-factor-is-ethereum-eth,1730332860,https://resources.cryptocompare.com/news/64/35362235.jpeg,"Dogecoin (DOGE) Price Explosion: What's Happening? XRP's Weakness Is Caused by This Factor, Is Ethereum (ETH) Ready to Join Massive Rally?",https://u.today/dogecoin-doge-price-explosion-whats-happening-xrps-weakness-caused-by-this-factor-is-ethereum-eth,Market finally feeling recovery as investors are actively pushing their favorite assets forward,Dogecoin,EN,0,0,DOGE|ETH|TRADING|XRP|BUSINESS,"{'name': 'U.Today', 'img': 'https://images.cryptocompare.com/news/default/utoday.png', 'lang': 'EN'}",utoday,2024-10-31 00:01:00
35361931,https://cointelegraph.com/news/microstrategy-42b-capital-bitcoin-purchase-michael-saylor,1730332936,https://images.cryptocompare.com/news/default/cointelegraph.png,MicroStrategy to raise $42B to buy Bitcoin in ‘21/21 plan’,https://cointelegraph.com/news/microstrategy-42b-capital-bitcoin-purchase-michael-saylor?utm_source=rss_feed&utm_medium=rss&utm_campaign=rss_partner_inbound,"Crypto commentators are “bullish” on MicroStrategy’s plan, predicting it will propel the company ahead of not just other public firms but countries too.",Phong Le,EN,0,0,BTC|TRADING,"{'name': 'CoinTelegraph', 'img': 'https://images.cryptocompare.com/news/default/cointelegraph.png', 'lang': 'EN'}",cointelegraph,2024-10-31 00:02:16
35361957,https://en.coin-turk.com/?p=171381,1730333089,https://resources.cryptocompare.com/news/79/35361957.jpeg,"Shiba Coin Price Rises, Analysts Predict Potential Growth",https://en.coin-turk.com/shiba-coin-price-rises-analysts-predict-potential-growth/,"Shiba Coin's price surge raises expectations of reaching previous highs. Analysts identify key resistance levels for significant price movement. Continue Reading: Shiba Coin Price Rises, Analysts Predict Potential Growth The post Shiba Coin Price Rises, Analysts Predict Potential Growth appeared first on COINTURK NEWS .",Shiba (SHIB),EN,0,0,TRADING,"{'name': 'CoinTurk News', 'img': 'https://resources.cryptocompare.com/news/79/default.png', 'lang': 'EN'}",cointurken,2024-10-31 00:04:49
35362232,https://coingape.com/?p=222978,1730333468,https://images.cryptocompare.com/news/default/coingape.png,"Coinbase CEO Says No Slowdown Post Election, Reveals 2026 Pro-Crypto Efforts",https://coingape.com/coinbase-ceo-says-no-slowdown-post-election-reveals-2026-pro-crypto-efforts/,"Coinbase CEO, Brian Armstrong, announced that Coinbase would not scale back on its crypto advocacy following the U.S. election results, which are expected in six days. Armstrong’s statement emphasized that they are committed to securing a favorable environment for crypto in U.S. legislation post-November US election. Consequently, Coinbase has pledged an additional $25 million to The post Coinbase CEO Says No Slowdown Post Election, Reveals 2026 Pro-Crypto Efforts appeared first on CoinGape .",24/7 Cryptocurrency News|Brian Armstrong|Coinbase CEO|US elections,EN,0,0,EXCHANGE|REGULATION,"{'name': 'CoinGape', 'img': 'https://images.cryptocompare.com/news/default/coingape.png', 'lang': 'EN'}",coingape,2024-10-31 00:11:08
35362233,https://news.bitcoin.com/?p=681464,1730333485,https://resources.cryptocompare.com/news/14/35362233.jpeg,Another Satoshi Nakamoto ‘Unmasking’ Announced—But Bitcoin Community Isn’t Buying It,https://news.bitcoin.com/another-satoshi-nakamoto-unmasking-announced-but-bitcoin-community-isnt-buying-it/,"In a move billed as “historic,” a purported revelation of Satoshi Nakamoto’s identity is scheduled for a live press conference on Oct. 31, sparking debate and skepticism within the bitcoin community. Will the Real Satoshi Nakamoto Please Stand Up? Community Questions Latest Identity Claim Slated for White Paper Anniversary A recently announced press statement, distributed",News|Bitcoin|Satoshi Nakamoto,EN,0,0,BTC,"{'name': 'Bitcoin.com', 'img': 'https://images.cryptocompare.com/news/default/bitcoincom.png', 'lang': 'EN'}",bitcoin.com,2024-10-31 00:11:25
35362434,https://en.coinotag.com/breakingnews/bitcoin-etf-update-btc-sees-8-million-net-inflow-amidst-market-shifts/,1730333624,https://resources.cryptocompare.com/news/77/35362434.jpeg,Bitcoin ETF Update: BTC Sees $8 Million Net Inflow Amidst Market Shifts,https://en.coinotag.com/breakingnews/bitcoin-etf-update-btc-sees-8-million-net-inflow-amidst-market-shifts/,"COINOTAG reports that on October 31, recent data from Farside Investors sheds light on the latest trends in capital flows concerning Bitcoin Exchange-Traded Funds (ETFs). Specifically, the analysis highlighted a",BTC|FLOW,EN,0,0,BTC|MARKET|FLOW|BUSINESS,"{'name': 'CoinOtag', 'img': 'https://resources.cryptocompare.com/news/77/default.png', 'lang': 'EN'}",coinotag,2024-10-31 00:13:44
35362462,https://en.coinotag.com/microstrategys-42-billion-bitcoin-acquisition-plan-sparks-optimism-among-crypto-experts/,1730333759,https://resources.cryptocompare.com/news/77/default.png,MicroStrategy’s $42 Billion Bitcoin Acquisition Plan Sparks Optimism Among Crypto Experts,https://en.coinotag.com/microstrategys-42-billion-bitcoin-acquisition-plan-sparks-optimism-among-crypto-experts/,"MicroStrategy’s ambitious plan to raise $42 billion for Bitcoin acquisition is reshaping the landscape of cryptocurrency investment, setting the firm on a trajectory that could eclipse even some nations. This",Bitcoin|News,EN,0,0,BTC,"{'name': 'CoinOtag', 'img': 'https://resources.cryptocompare.com/news/77/default.png', 'lang': 'EN'}",coinotag,2024-10-31 00:15:59
35363223,https://en.coinotag.com/breakingnews/us-government-sells-seized-ant-tokens-a-historic-move-for-aragons-governance-coin/,1730334582,https://resources.cryptocompare.com/news/77/35363223.jpeg,US Government Sells Seized ANT Tokens: A Historic Move for Aragon’s Governance Coin,https://en.coinotag.com/breakingnews/us-government-sells-seized-ant-tokens-a-historic-move-for-aragons-governance-coin/,"According to recent reports from COINOTAG, the US government has taken a notable step in the cryptocurrency landscape by liquidating seized ANT tokens from Alameda Research, as indicated by Arkham",ARKM,EN,0,0,ARKM|RESEARCH,"{'name': 'CoinOtag', 'img': 'https://resources.cryptocompare.com/news/77/default.png', 'lang': 'EN'}",coinotag,2024-10-31 00:29:42
35363162,https://bitcoinworld.co.in/?p=93565,1730334630,https://resources.cryptocompare.com/news/82/default.png,Whale Moves 1 Trillion Pepe To Binance As DTX Exchange Set To Launch Revolutionary Wallet,https://bitcoinworld.co.in/whale-moves-1-trillion-pepe-to-binance-as-dtx-exchange-set-to-launch-revolutionary-wallet/,"In the world of cryptocurrency, big token transfers are always of interest, and a recent transfer of 1 trillion PEPE tokens to Binance is no exception. This large Pepe (PEPE) transaction has raised the interest of traders and suggests that the price of this memecoin could rise soon. Meanwhile, Binance Coin (BNB) has crossed the",Crypto News|Press Release|DTX|DTX Exchange|DTX Exchange (DTX)|DTX Presale|DTX Token,EN,0,0,EXCHANGE|BNB|PEPE|TRADING,"{'name': 'Bitcoin World', 'img': 'https://resources.cryptocompare.com/news/82/default.png', 'lang': 'EN'}",bitcoinworld,2024-10-31 00:30:30
35363356,https://decrypt.co/?p=289274,1730334735,https://resources.cryptocompare.com/news/44/35363356.jpeg,Megan Thee Stallion Files Suit Against Influencer Over Deepfake Harassment,https://decrypt.co/289274/megan-thee-stallion-accuses-influencer-deepfake-harassment,"The Florida-based lawsuit from Megan Thee Stallion cites targeted bullying, emotional abuse, and AI deepfake pornography.",Law and Order,EN,0,0,OTHER,"{'name': 'Decrypt', 'img': 'https://images.cryptocompare.com/news/default/decrypt.png', 'lang': 'EN'}",decrypt,2024-10-31 00:32:15
35363698,https://coincu.com/289789-qubetics-presale-solanas-300-prediction-zephyrs-unique-approach-key-insights-into-the-top-blockchain-projects,1730335200,https://resources.cryptocompare.com/news/96/35363698.jpeg,Investors Rush for Qubetics’ $TICS with 85K% ROI Potential While Solana & Zephyr Poised for Expansion,https://coincu.com/289789-qubetics-presale-solanas-300-prediction-zephyrs-unique-approach-key-insights-into-the-top-blockchain-projects,"This comprehensive guide explores Qubetics, Solana, and Zephyr. Learn how Qubetics’ presale hits records with insights into Solana’s bullish predictions and Zephyr’s privacy-focused solutions.",news|Press Releases|news|CMC|Presale|Qubetics|Solana|Zephyr,EN,0,0,SOL|BUSINESS|TRADING,"{'name': 'Coincu', 'img': 'https://resources.cryptocompare.com/news/96/default.png', 'lang': 'EN'}",coincu,2024-10-31 00:40:00
35364027,https://www.cryptointelligence.co.uk/?p=23909,1730335505,https://resources.cryptocompare.com/news/95/default.png,"Solana Memecoin Lord MAGA Trump to Rally Over 16,000% Ahead of Exchange Listings, While PEPE and DOGE Fall",https://www.cryptointelligence.co.uk/solana-memecoin-lord-maga-trump-to-rally-over-16000-ahead-of-exchange-listings-while-pepe-and-doge-fall/,"Lord MAGA Trump could turn early investors into multi-millionaires, like other memecoins, such as Shiba Inu (SHIB) and Dogecoin (DOGE), did. Lord MAGA Trump (LORDMAGA), a Solana memecoin launched today, is set to explode over 16,000% in price in the coming days. This is because LORDMAGA is set to soon be listed on numerous crypto exchanges, according to reports. This will give the Solana memecoin exposure to millions of additional investors, who will pour funds into the coin and cause its price to rally, which will benefit investors who buy before these new exchange listings. Currently, Lord MAGA Trump can",Blockchain News|Crypto News Today,EN,0,0,TRADING|DOGE|SOL|EXCHANGE|PEPE,"{'name': 'CryptoIntelligence', 'img': 'https://resources.cryptocompare.com/news/95/default.png', 'lang': 'EN'}",cryptointelligence,2024-10-31 00:45:05
35363932,https://news.bitcoin.com/?p=681310&preview=true&preview_id=681310,1730335556,https://resources.cryptocompare.com/news/14/35363932.jpeg,China’s QE Could Ignite Bitcoin Boom Like Never Before — Analysis by Arthur Hayes,https://news.bitcoin.com/chinas-qe-could-ignite-bitcoin-boom-like-never-before-analysis-by-arthur-hayes/,"Bitmex founder Arthur Hayes predicts China’s aggressive monetary easing could spark a historic bitcoin rally, as yuan expansion indirectly fuels crypto demand. Bitcoin Boom Incoming? Arthur Hayes Weighs in on China’s QE Policies Arthur Hayes, Bitmex’s founder and former CEO, published a blog post on Monday projecting that China’s quantitative easing measures could trigger a",Markets and Prices|Arthur Hayes|Bitcoin,EN,0,0,BTC|ASIA|MARKET|TRADING,"{'name': 'Bitcoin.com', 'img': 'https://images.cryptocompare.com/news/default/bitcoincom.png', 'lang': 'EN'}",bitcoin.com,2024-10-31 00:45:56
35364104,https://thedefiant.io/news/defi/ondo-finance-partners-with-trillion-dollar-wellington-management,1730335698,https://resources.cryptocompare.com/news/101/35364104.jpeg,Ondo Finance Partners with Trillion Dollar Wellington Management,https://thedefiant.io/news/defi/ondo-finance-partners-with-trillion-dollar-wellington-management,The asset management group will be launching the Delta Wellington Ultra Short Treasury On-Chain Fund with Ondo.,,EN,0,0,FIAT|ONDO|REGULATION,"{'name': 'The Defiant', 'img': 'https://resources.cryptocompare.com/news/101/default.png', 'lang': 'EN'}",thedefiant,2024-10-31 00:48:18
