id,guid,published_on,imageurl,title,url,body,tags,lang,upvotes,downvotes,categories,source_info,source,date
35365165,https://cryptodaily.co.uk/2024/10/etherscan-launch-on-xdc-network-bitcoin-community-optimistic-about-increased-programmability-for-defi-and-payments,1730336960,https://resources.cryptocompare.com/news/75/35365165.jpeg,Etherscan Launch on XDC Network: Bitcoin Community Optimistic About Increased Programmability for DeFi and Payments,https://cryptodaily.co.uk/2024/10/etherscan-launch-on-xdc-network-bitcoin-community-optimistic-about-increased-programmability-for-defi-and-payments,"XDC Network's low-cost, fast transaction capabilities are now poised to support Bitcoin-linked payment solutions, opening doors for innovative DeFi protocols.",More News,EN,0,0,XDC|BTC,"{'name': 'Crypto Daily', 'img': 'https://resources.cryptocompare.com/news/75/default.png', 'lang': 'EN'}",cryptodaily,2024-10-31 01:09:20
35366386,https://www.cryptoglobe.com/latest/2024/10/crypto-whales-amass-over-200000-sol-as-solana-eyes-breakthrough-to-top-4-cryptos/,1730338140,https://resources.cryptocompare.com/news/2/35366386.jpeg,"Crypto Whales Amass Over 200,000 SOL as Solana Eyes Breakthrough to Top 4 Cryptos",https://www.cryptoglobe.com/latest/2024/10/crypto-whales-amass-over-200000-sol-as-solana-eyes-breakthrough-to-top-4-cryptos/,"As the price of the native token of smart contract platform Solana, SOL, keeps on rising, various cryptocurrency whales have started amassing it, with whales adding over 200,000 SOL worth around $35 million to their wallets. According to data shared by on-chain analysis service Lookonchain, three different cryptocurrency whales added over $35 million worth of",Solana|SOL|Altcoins|Solana ($SOL),EN,0,0,SOL|ALTCOIN|MARKET|TRADING,"{'name': 'CryptoGlobe', 'img': 'https://images.cryptocompare.com/news/default/cryptoglobe.png', 'lang': 'EN'}",cryptoglobe,2024-10-31 01:29:00
35366293,https://news.bitcoin.com/?p=681354&preview=true&preview_id=681354,1730338218,https://resources.cryptocompare.com/news/14/35366293.jpeg,Elon Musk Teases 69.420% on Trump’s Lead Over Harris as Biden Faces ‘Garbage’ Backlash,https://news.bitcoin.com/elon-musk-teases-69-420-on-trumps-lead-over-harris-as-biden-faces-garbage-backlash/,"Elon Musk teased “69.420% coming soon” in a post about Trump’s lead over Harris, while Biden sparked backlash for allegedly calling Trump supporters “garbage.” Elon Musk Hints at 69.420% After Trump-Harris Polls as Biden’s ‘Garbage’ Comment Sparks Uproar Tesla and Spacex CEO Elon Musk stirred attention on social media platform X on Wednesday by posting,",Economics|Donald Trump|Kamala Harris,EN,0,0,OTHER,"{'name': 'Bitcoin.com', 'img': 'https://images.cryptocompare.com/news/default/bitcoincom.png', 'lang': 'EN'}",bitcoin.com,2024-10-31 01:30:18
35366297,https://www.newsbtc.com/?p=650773,1730338258,https://resources.cryptocompare.com/news/21/35366297.jpeg,Is Bitcoin’s Bull Market Just Beginning? Leveraged Bets Suggest Big Moves Are Coming,https://www.newsbtc.com/bitcoin-news/is-bitcoin-bull-market-just-beginning-leveraged-bets-suggest-big-moves-are-coming/,"The recent surge in Bitcoin price appears to align with a shift in investor behavior, according to a CryptoQuant analyst known as ‘crypto sunmoon.’ In a post on the CryptoQuant QuickTake platform, the analyst observed that the current bull market is driven by leveraged bets, particularly in derivatives markets. This trend is noteworthy as it contrasts with past market cycles where increased deposits often accompanied BTC bull runs to spot exchanges. Related Reading: Bitcoin Volatility To Peak By November 8 As ‘Trump Trade’ Intensifies – Report Leveraged Bets’ Role in Bitcoin Price Growth Elaborating further on leverage bets involves using borrowed funds to multiply the size of an investment. For example, with 2x leverage, a trader can open a position twice as large as their capital. In Bitcoin futures trading, this approach can be profitable during upward price movements but also comes with risks. If the market shifts against their position, traders can face significant losses called liquidation. The analyst notes that the inflow of Bitcoin into derivatives exchanges signals increased confidence among investors, suggesting a belief in further price gains. This confidence can create a feedback loop, where rising prices encourage additional leveraged bets, further fueling the bull market. Bitcoin bull market begins with leveraged bets “The bull market will continue as #bitcoin continues to be deposited into futures exchanges for leveraged bets using derivatives, rather than into spot exchanges for selling.” – By @t0_god Link 👇https://t.co/1egL7L2YoO pic.twitter.com/uuQPEiSWtb — CryptoQuant.com (@cryptoquant_com) October 30, 2024 BTC Price Performance And Outlook With Bitcoin’s price showing an 8.2% increase over the past week, currently trading at $71,804, the role of leverage becomes increasingly relevant. Notably, BTC saw a slight retracement from its recent 24-hour high of $73,562 yet continues to maintain upward momentum. This steady price growth and leveraged inflows signal broader investor optimism toward Bitcoin’s future price potential. According to the analyst, as long as Bitcoin continues to flow into futures rather than spot exchanges, the bullish sentiment will likely remain strong. Notably, leveraged bets happen to be just one of the several metrics of Bitcoin, suggesting a potential continuity of the ongoing increase in price. So far, the Stablecoin Supply Ratio Oscillator (SSRO) has seen low levels not seen since 2022. The decrease of this metric into lower levels means more stablecoins are being converted to BTC, therefore suggesting increasing demand for the asset. Related Reading: Dormant Bitcoin Wallet From 2012 Awakens, Moving Millions—BTC Price To Dip? Meanwhile, the technical outlook isn’t left in one of the several metrics indicating more rally for BTC’s price. Earlier today, the renowned crypto analyst Ali highlighted that historically, BTC has increased to 1.618 and 2.272 Fibonacci retracement levels. Should the asset follow the same pattern this time, Ali predicts BTC will surge to a price between $174,000 and $462,000. In past bull cycles, #Bitcoin has peaked between the 1.618 and 2.272 Fibonacci retracement levels. Following a similar pattern, the next $BTC top could land between $174,000 and $462,000! pic.twitter.com/KUq51Tt57z — Ali (@ali_charts) October 30, 2024 Featured image created with DALL-E, Chart from TradingView",Bitcoin News|bitcoin|bitcoin analysis|bitcoin market|bitcoin price|bitcoin price prediction|btc|BTCUSDT|CyrptoQuant,EN,0,0,BTC|TRADING|MARKET|BUSINESS|SPONSORED,"{'name': 'NewsBTC', 'img': 'https://images.cryptocompare.com/news/default/newsbtc.png', 'lang': 'EN'}",newsbtc,2024-10-31 01:30:58
35367163,https://en.coinotag.com/breakingnews/record-inflow-signals-growing-investor-interest-in-cryptocurrency-potential-price-surge/,1730339326,https://resources.cryptocompare.com/news/77/35367163.jpeg,"Record Inflow Signals Growing Investor Interest in Cryptocurrency, Potential Price Surge",https://en.coinotag.com/breakingnews/record-inflow-signals-growing-investor-interest-in-cryptocurrency-potential-price-surge/,"Largest Inflow Since Launch Recorded ————— 🤖 AI Commentary: 🟢 The largest inflow could indicate increased investor interest, potentially leading to a positive price movement for the cryptocurrency. NFA.",,EN,0,0,BUSINESS|TRADING,"{'name': 'CoinOtag', 'img': 'https://resources.cryptocompare.com/news/77/default.png', 'lang': 'EN'}",coinotag,2024-10-31 01:48:46
35367189,https://en.coinotag.com/breakingnews/blackrocks-bitcoin-etf-ibit-draws-875-million-inflow-boosting-bitcoin-price-october-30-2024/,1730339363,https://resources.cryptocompare.com/news/77/35367189.jpeg,"BlackRock’s Bitcoin ETF IBIT Draws $875 Million Inflow, Boosting Bitcoin Price – October 30, 2024",https://en.coinotag.com/breakingnews/blackrocks-bitcoin-etf-ibit-draws-875-million-inflow-boosting-bitcoin-price-october-30-2024/,"BlackRock’s Bitcoin ETF IBIT Sees +$875.0 Million Net Inflow! – October 30, 2024 ————— 💰Coin: Bitcoin ( $BTC ) $72,300.65 ————— 🤖 AI Commentary: 🟢 BlackRock’s Bitcoin ETF IBIT sees",,EN,0,0,BTC|TRADING,"{'name': 'CoinOtag', 'img': 'https://resources.cryptocompare.com/news/77/default.png', 'lang': 'EN'}",coinotag,2024-10-31 01:49:23
35367360,https://en.coinotag.com/breakingnews/blockfi-transfers-26831-eth-worth-71-23-million-to-coinbase-prime-amid-bankruptcy/,1730339427,https://resources.cryptocompare.com/news/77/35367360.jpeg,"BlockFi Transfers 26,831 ETH Worth $71.23 Million to Coinbase Prime Amid Bankruptcy",https://en.coinotag.com/breakingnews/blockfi-transfers-26831-eth-worth-71-23-million-to-coinbase-prime-amid-bankruptcy/,"In a striking development within the crypto lending sector, BlockFi has made significant transactions despite its ongoing bankruptcy proceedings. According to on-chain analyst Ember, BlockFi transferred a notable 7,382 ETH,",,EN,0,0,ETH|EXCHANGE,"{'name': 'CoinOtag', 'img': 'https://resources.cryptocompare.com/news/77/default.png', 'lang': 'EN'}",coinotag,2024-10-31 01:50:27
35367660,https://cointelegraph.com/news/robinhood-crypto-volumes-double-as-hood-stock-tanks,1730339838,https://images.cryptocompare.com/news/default/cointelegraph.png,"Robinhood doubles crypto trading volume, but shares dip 12% on Q3 earnings",https://cointelegraph.com/news/robinhood-crypto-volumes-double-as-hood-stock-tanks?utm_source=rss_feed&utm_medium=rss&utm_campaign=rss_partner_inbound,"Robinhood also reported a 76% year-on-year increase in assets under custody, attributed to rising crypto valuations.",Crypto Trading Volume|Crypto Custody|HOOD|Jason Warnick|Revenue|Financial Report,EN,0,0,TRADING|BUSINESS,"{'name': 'CoinTelegraph', 'img': 'https://images.cryptocompare.com/news/default/cointelegraph.png', 'lang': 'EN'}",cointelegraph,2024-10-31 01:57:18
33767162,[object Object],1730340043,https://resources.cryptocompare.com/news/13/33767162.jpeg,Ethereum Founder Says Dogecoin Deserves To Be Number 2 Crypto After Bitcoin,https://bitcoinist.com/dogecoin-number-2-bitcoin/,"Ethereum founder Vitalik Buterin has just given up the number 2 top crypto spot to Dogecoin, the world’s first and largest meme-based cryptocurrency. Buterin has stated that Dogecoin deserves to be ranked right after Bitcoin (BTC), underscoring the meme coin’s significance in the crypto space and unique cultural impact. Buterin Ranks Dogecoin As Top 2",Altcoins|Dogecoin|bitcoin|bitcoin news|bitcoin price|btc|BTC news|btc price|btcusd|BTCUSDT|Doge|DOGE news|doge price|dogecoin|Dogecoin news|dogecoin price|dogeusd|dogeusdt|ETH|ETH news|ETH Price|Ethereum|ethereum founder|ethereum news|ethereum price|ethusd|ETHUSDT,EN,0,0,ETH|ASIA|ALTCOIN|HNT|MARKET|SHIB|BNB|EXCHANGE|BTC|REGULATION|TRADING|OTHER|DOGE|SOL|BLOCKCHAIN|XRP|TON|BUSINESS|FIAT|BONK|PYUSD|COMMODITY|ADA|ZRX|MINING|FTT|DOT|USDT|RESEARCH|FORKS|IMX|ICP|TRX|TECHNOLOGY|ARB|WLD|SPONSORED|RAY|SUI|PEPE|WALLET|UNI|XMR|LINK|NEAR|SEI|MATIC|ARKM|USDC|LTC|LUNA|AIRDROP,"{'name': 'Bitcoinist', 'img': 'https://images.cryptocompare.com/news/default/bitcoinist.png', 'lang': 'EN'}",bitcoinist,2024-10-31 02:00:43
35367791,https://ambcrypto.com/?p=438226,1730340057,https://images.cryptocompare.com/news/default/ambcrypto.png,ETH/BTC chart hints at altcoin rally: Will Solana lead the pack?,https://ambcrypto.com/eth-btc-chart-hints-at-altcoin-rally-will-solana-lead-the-pack/,Analysts are projecting a rally in the altcoin market soon.,Altcoin|News|News 1|Social|Solana|Trading View,EN,0,0,ALTCOIN|SOL|TRADING|MARKET,"{'name': 'AMB Crypto', 'img': 'https://images.cryptocompare.com/news/default/ambcrypto.png', 'lang': 'EN'}",ambcrypto,2024-10-31 02:00:57
35368035,https://en.coin-turk.com/?p=171387,1730340289,https://resources.cryptocompare.com/news/79/35368035.jpeg,First Digital Labs Expands FDUSD Stablecoin to Solana Network,https://en.coin-turk.com/first-digital-labs-expands-fdusd-stablecoin-to-solana-network/,First Digital Labs integrates FDUSD stablecoin into the Solana network. The move aims to provide faster transactions and lower fees. Continue Reading: First Digital Labs Expands FDUSD Stablecoin to Solana Network The post First Digital Labs Expands FDUSD Stablecoin to Solana Network appeared first on COINTURK NEWS .,Solana (SOL),EN,0,0,FDUSD|SOL,"{'name': 'CoinTurk News', 'img': 'https://resources.cryptocompare.com/news/79/default.png', 'lang': 'EN'}",cointurken,2024-10-31 02:04:49
35368160,https://en.coinotag.com/breakingnews/bitcoin-spot-etf-sees-historic-896-3-million-net-inflow-second-highest-on-record/,1730340389,https://resources.cryptocompare.com/news/77/35368160.jpeg,"Bitcoin Spot ETF Sees Historic $896.3 Million Net Inflow, Second Highest on Record",https://en.coinotag.com/breakingnews/bitcoin-spot-etf-sees-historic-896-3-million-net-inflow-second-highest-on-record/,According to the latest data from COINOTAG,BTC,EN,0,0,BTC,"{'name': 'CoinOtag', 'img': 'https://resources.cryptocompare.com/news/77/default.png', 'lang': 'EN'}",coinotag,2024-10-31 02:06:29
35368161,https://www.cryptointelligence.co.uk/?p=23908,1730340420,https://resources.cryptocompare.com/news/95/default.png,"Vote for Donald (VOTEDON) Memecoin Will Explode Over 14,000% Before Exchange Listings, While Shiba Inu and Dogecoin Lag",https://www.cryptointelligence.co.uk/vote-for-donald-votedon-memecoin-will-explode-over-14000-before-exchange-listings-while-shiba-inu-and-dogecoin-lag/,"Vote for Donald could turn early investors into multi-millionaires, like Shiba Inu (SHIB) and Dogecoin (DOGE) did. Vote for Donald (VOTEDON), a new Solana memecoin that was launched today, is set to explode over 14,000% in price in the coming days. This is because VOTEDON is set to soon be listed on numerous crypto exchanges, according to reports. This will give the Solana memecoin exposure to millions of additional investors, who will pour funds into the coin and drive its price up. Currently, Vote for Donald can only be purchased via Solana decentralized exchanges, like Jup.ag and Raydium.io, and early",Blockchain News|Crypto News Today,EN,0,0,SHIB|DOGE|EXCHANGE|SOL|BUSINESS,"{'name': 'CryptoIntelligence', 'img': 'https://resources.cryptocompare.com/news/95/default.png', 'lang': 'EN'}",cryptointelligence,2024-10-31 02:07:00
35368262,https://cointelegraph.com/news/crypto-app-sites-malicious-popups-after-ace-drainer-hacks-animation-library,1730340513,https://images.cryptocompare.com/news/default/cointelegraph.png,Crypto apps see malicious popups after Ace Drainer hacks animation library,https://cointelegraph.com/news/crypto-app-sites-malicious-popups-after-ace-drainer-hacks-animation-library?utm_source=rss_feed&utm_medium=rss&utm_campaign=rss_partner_inbound,"The popular Lottie Player animations library was hacked to push a crypto-draining popup on multiple websites, which has now been fixed.",lottie|hack|hackers|scam|crypto|wallet drainer|crypto drainer|ace drainer|defi scam,EN,0,0,OTHER,"{'name': 'CoinTelegraph', 'img': 'https://images.cryptocompare.com/news/default/cointelegraph.png', 'lang': 'EN'}",cointelegraph,2024-10-31 02:08:33
35368830,https://thecoinrise.com/qubetics-presale-breaks-records-near-protocol-expands-and-world-liberty-financial-reinforces-blockchain-security/,1730340904,https://resources.cryptocompare.com/news/60/35368830.jpeg,"Qubetics Presale Breaks Records, Near Protocol Expands, and World Liberty Financial Reinforces Blockchain Security",https://thecoinrise.com/qubetics-presale-breaks-records-near-protocol-expands-and-world-liberty-financial-reinforces-blockchain-security/,"This guide explores Qubetics, Near Protocol, and World Liberty Financial. Learn how Qubetics’ presale sets records, gain insights into Near Protocol’s scalability, and learn about World Liberty Financial’s asset management tools. The post Qubetics Presale Breaks Records, Near Protocol Expands, and World Liberty Financial Reinforces Blockchain Security appeared first on TheCoinrise.com .",Token Presale and ICO Insights|Qubetics,EN,0,0,NEAR|BLOCKCHAIN,"{'name': 'The Coin Rise', 'img': 'https://images.cryptocompare.com/news/default/thecoinrise.png', 'lang': 'EN'}",thecoinrise,2024-10-31 02:15:04
35368965,https://en.coinotag.com/breakingnews/whale-transfers-92751-sol-to-binance-realizing-3-3-million-profit-amid-market-surge/,1730341348,https://resources.cryptocompare.com/news/77/35368965.jpeg,"Whale Transfers 92,751 SOL to Binance, Realizing $3.3 Million Profit Amid Market Surge",https://en.coinotag.com/breakingnews/whale-transfers-92751-sol-to-binance-realizing-3-3-million-profit-amid-market-surge/,"According to recent findings from on-chain analyst Yu Jin, significant activity was recorded on October 31, when a cryptocurrency whale executed a transfer of 92,751 SOL, equivalent to US$16.34 million,",,EN,0,0,SOL|BNB|BUSINESS|EXCHANGE|MARKET,"{'name': 'CoinOtag', 'img': 'https://resources.cryptocompare.com/news/77/default.png', 'lang': 'EN'}",coinotag,2024-10-31 02:22:28
35369372,https://news.bitcoin.com/?p=681371&preview=true&preview_id=681371,1730341844,https://resources.cryptocompare.com/news/14/35369372.jpeg,Does US Dollar Need to Collapse for Bitcoin to Hit $200K? Bitwise Says No,https://news.bitcoin.com/does-us-dollar-need-to-collapse-for-bitcoin-to-hit-200k-bitwise-says-no/,"Bitwise’s chief investment officer predicts bitcoin could reach $200,000 without a U.S. dollar collapse, outlining a path for the cryptocurrency to surge toward unprecedented highs. Bitcoin’s Path to $200K: No Dollar Collapse Required The chief investment officer of asset management firm Bitwise, Matt Hougan, addressed bitcoin’s potential to reach a $200,000 valuation without a collapse",Markets and Prices|Bitcoin|US Dollar,EN,0,0,BTC|FIAT,"{'name': 'Bitcoin.com', 'img': 'https://images.cryptocompare.com/news/default/bitcoincom.png', 'lang': 'EN'}",bitcoin.com,2024-10-31 02:30:44
35369771,https://en.coinotag.com/breakingnews/celsius-network-transfers-2278-eth-worth-6-07-million-to-falconx-after-three-month-hiatus/,1730342307,https://resources.cryptocompare.com/news/77/default.png,"Celsius Network Transfers 2,278 ETH Worth $6.07 Million to FalconX After Three-Month Hiatus",https://en.coinotag.com/breakingnews/celsius-network-transfers-2278-eth-worth-6-07-million-to-falconx-after-three-month-hiatus/,"On October 31, COINOTAG reported significant activity involving the Celsius Network as a monitored address replenished 2,278 ETH to FalconX, translating to an impressive $6.07 million. This transaction, occurring after",ARKM,EN,0,0,ETH|ARKM,"{'name': 'CoinOtag', 'img': 'https://resources.cryptocompare.com/news/77/default.png', 'lang': 'EN'}",coinotag,2024-10-31 02:38:27
35369726,https://coincu.com/289811-robinhood-trading-volume-112-year-over-year,1730342349,https://resources.cryptocompare.com/news/96/35369726.jpeg,Robinhood Trading Volume Soars 112% Year-Over-Year,https://coincu.com/289811-robinhood-trading-volume-112-year-over-year,Robinhood trading volume increased 65% in equity volumes and 112% in cryptocurrencies traded in the latest quarter.,news|News|Robinhood|Robinhood app|Robinhood Crypto Trading|Robinhood Trading Volume,EN,0,0,TRADING,"{'name': 'Coincu', 'img': 'https://resources.cryptocompare.com/news/96/default.png', 'lang': 'EN'}",coincu,2024-10-31 02:39:09
35369873,https://cointelegraph.com/news/blackrock-spot-bitcoin-etf-hits-record-inflows-amid-btc-rally,1730342384,https://images.cryptocompare.com/news/default/cointelegraph.png,BlackRock's Bitcoin ETF hits record inflow amid crypto market rally,https://cointelegraph.com/news/blackrock-spot-bitcoin-etf-hits-record-inflows-amid-btc-rally?utm_source=rss_feed&utm_medium=rss&utm_campaign=rss_partner_inbound,"BlackRock's spot Bitcoin ETF recorded $875 million of inflows on Oct. 30, surpassing its previous record by around 3%.",Trading Axe|Cozy The Caller,EN,0,0,BTC|MARKET|TRADING,"{'name': 'CoinTelegraph', 'img': 'https://images.cryptocompare.com/news/default/cointelegraph.png', 'lang': 'EN'}",cointelegraph,2024-10-31 02:39:44
